symbol,publishedDate,title,image,site,text,url
AZO,2024-11-07 07:30:00,AutoZone's Valuation: A Once-in-a-Decade Opportunity?,https://images.financialmodelingprep.com/news/autozones-valuation-a-onceinadecade-opportunity-20241107.jpg,fool.com,"AutoZone's strengths, management, and financials-all in 12 minutes or less!",https://www.fool.com/investing/2024/11/07/autozones-valuation-a-once-in-a-decade-opportunity/
AZO,2024-11-05 18:51:15,AutoZone (AZO) Ascends But Remains Behind Market: Some Facts to Note,https://images.financialmodelingprep.com/news/autozone-azo-ascends-but-remains-behind-market-some-facts-20241105.jpg,zacks.com,"AutoZone (AZO) reachead $3,059.83 at the closing of the latest trading day, reflecting a +0.44% change compared to its last close.",https://www.zacks.com/stock/news/2364777/autozone-azo-ascends-but-remains-behind-market-some-facts-to-note?cid=CS-STOCKNEWSAPI-FT-tale_of_the_tape|yseop_template_6v1-2364777
AZO,2024-11-04 17:10:10,Tradepulse Power Inflow Alert: Autozone Inc. Mover Over 30 Points Higher After Signal,https://images.financialmodelingprep.com/news/tradepulse-power-inflow-alert-autozone-inc-mover-over-30-20241104.jpg,benzinga.com,STOCK CLIMBS OVER 1 % AT ITS HIGH POINT,https://www.benzinga.com/signals/24/11/41731341/tradepulse-power-inflow-alert-autozone-inc-mover-over-30-points-higher-after-signal
AZO,2024-11-04 10:00:30,"Is Trending Stock AutoZone, Inc. (AZO) a Buy Now?",https://images.financialmodelingprep.com/news/is-trending-stock-autozone-inc-azo-a-buy-now-20241104.jpg,zacks.com,"Zacks.com users have recently been watching AutoZone (AZO) quite a bit. Thus, it is worth knowing the facts that could determine the stock's prospects.",https://www.zacks.com/stock/news/2363181/is-trending-stock-autozone-inc-azo-a-buy-now?cid=CS-STOCKNEWSAPI-FT-tale_of_the_tape|most_searched_stocks_v1-2363181
AZO,2024-11-01 08:11:40,Here Are the Next 3 Stock Splits to Keep on Your Radar,https://images.financialmodelingprep.com/news/here-are-the-next-3-stock-splits-to-keep-20241101.jpg,247wallst.com,"A stock split divides existing shares into multiple new ones, increasing a given company's share count and making shares more affordable for those looking to buy in.",https://247wallst.com/investing/2024/11/01/here-are-the-next-3-stock-splits-to-keep-on-your-radar/
AZO,2024-10-29 18:56:21,AutoZone (AZO) Stock Drops Despite Market Gains: Important Facts to Note,https://images.financialmodelingprep.com/news/autozone-azo-stock-drops-despite-market-gains-important-facts-20241029.jpg,zacks.com,"In the latest trading session, AutoZone (AZO) closed at $3,060.89, marking a -1.45% move from the previous day.",https://www.zacks.com/stock/news/2360042/autozone-azo-stock-drops-despite-market-gains-important-facts-to-note?cid=CS-STOCKNEWSAPI-FT-tale_of_the_tape|yseop_template_6v1-2360042
AZO,2024-10-24 12:31:17,AutoZone (AZO) Up 2.8% Since Last Earnings Report: Can It Continue?,https://images.financialmodelingprep.com/news/autozone-azo-up-28-since-last-earnings-report-can-20241024.jpg,zacks.com,AutoZone (AZO) reported earnings 30 days ago. What's next for the stock?,https://www.zacks.com/stock/news/2357048/autozone-azo-up-2-8-since-last-earnings-report-can-it-continue?cid=CS-STOCKNEWSAPI-FT-realtime_blog-2357048
AZO,2024-10-23 18:56:31,Why the Market Dipped But AutoZone (AZO) Gained Today,https://images.financialmodelingprep.com/news/why-the-market-dipped-but-autozone-azo-gained-today-20241023.jpg,zacks.com,"AutoZone (AZO) closed the most recent trading day at $3,196.55, moving +0.77% from the previous trading session.",https://www.zacks.com/stock/news/2356299/why-the-market-dipped-but-autozone-azo-gained-today?cid=CS-STOCKNEWSAPI-FT-tale_of_the_tape|yseop_template_6v1-2356299
AZO,2024-10-22 19:06:25,Here's Why AutoZone (AZO) Fell More Than Broader Market,https://images.financialmodelingprep.com/news/heres-why-autozone-azo-fell-more-than-broader-market-20241022.jpg,zacks.com,"In the latest trading session, AutoZone (AZO) closed at $3,172.05, marking a -1.44% move from the previous day.",https://www.zacks.com/stock/news/2355375/here-s-why-autozone-azo-fell-more-than-broader-market?cid=CS-STOCKNEWSAPI-FT-tale_of_the_tape|yseop_template_6v2-2355375
AZO,2024-10-22 10:06:39,"Is Most-Watched Stock AutoZone, Inc. (AZO) Worth Betting on Now?",https://images.financialmodelingprep.com/news/is-mostwatched-stock-autozone-inc-azo-worth-betting-on-20241022.jpg,zacks.com,"AutoZone (AZO) has been one of the stocks most watched by Zacks.com users lately. So, it is worth exploring what lies ahead for the stock.",https://www.zacks.com/stock/news/2354615/is-most-watched-stock-autozone-inc-azo-worth-betting-on-now?cid=CS-STOCKNEWSAPI-FT-tale_of_the_tape|most_searched_stocks_v1-2354615
AZO,2024-10-17 09:41:20,"Genuine Parts 2.8% Yield And A Look At AutoZone, Advance Auto Parts And O'Reilly",https://images.financialmodelingprep.com/news/genuine-parts-28-yield-and-a-look-at-autozone-20241017.jpg,seekingalpha.com,"Genuine Parts Co. is a Dividend King /Champion with a 68-year history of rising dividends, offering a reliable but currently somewhat overvalued investment. AutoZone Inc. and O'Reilly Automotive Inc. are strong growth stocks but are overvalued, making them hold rather than buy candidates. Advance Auto Parts Inc. faces significant challenges with recent earnings struggles and a 2023 dividend cut, making it a speculative and unreliable investment.",https://seekingalpha.com/article/4727314-genuine-parts-2-8-percent-yield-look-at-autozone-advance-auto-parts-oreilly
AZO,2024-10-16 18:56:28,AutoZone (AZO) Outperforms Broader Market: What You Need to Know,https://images.financialmodelingprep.com/news/autozone-azo-outperforms-broader-market-what-you-need-to-20241016.jpg,zacks.com,"AutoZone (AZO) closed the most recent trading day at $3,128.64, moving +0.92% from the previous trading session.",https://www.zacks.com/stock/news/2351854/autozone-azo-outperforms-broader-market-what-you-need-to-know?cid=CS-STOCKNEWSAPI-FT-tale_of_the_tape|yseop_template_6v1-2351854
AZO,2024-10-15 19:06:30,AutoZone (AZO) Suffers a Larger Drop Than the General Market: Key Insights,https://images.financialmodelingprep.com/news/autozone-azo-suffers-a-larger-drop-than-the-general-20241015.jpg,zacks.com,"AutoZone (AZO) reachead $3,100 at the closing of the latest trading day, reflecting a -1.68% change compared to its last close.",https://www.zacks.com/stock/news/2351082/autozone-azo-suffers-a-larger-drop-than-the-general-market-key-insights?cid=CS-STOCKNEWSAPI-FT-tale_of_the_tape|yseop_template_6v2-2351082
AZO,2024-10-11 10:05:52,"AutoZone, Inc. (AZO) is Attracting Investor Attention: Here is What You Should Know",https://images.financialmodelingprep.com/news/autozone-inc-azo-is-attracting-investor-attention-here-is-20241011.jpg,zacks.com,"Recently, Zacks.com users have been paying close attention to AutoZone (AZO). This makes it worthwhile to examine what the stock has in store.",https://www.zacks.com/stock/news/2349197/autozone-inc-azo-is-attracting-investor-attention-here-is-what-you-should-know?cid=CS-STOCKNEWSAPI-FT-tale_of_the_tape|most_searched_stocks_v1-2349197
AZO,2024-10-09 19:05:36,AutoZone (AZO) Outperforms Broader Market: What You Need to Know,https://images.financialmodelingprep.com/news/autozone-azo-outperforms-broader-market-what-you-need-to-20241009.jpg,zacks.com,"AutoZone (AZO) reachead $3,146.07 at the closing of the latest trading day, reflecting a +1.42% change compared to its last close.",https://www.zacks.com/stock/news/2348607/autozone-azo-outperforms-broader-market-what-you-need-to-know?cid=CS-STOCKNEWSAPI-FT-tale_of_the_tape|yseop_template_6v2-2348607
AZO,2024-10-09 14:02:49,JPMorgan Chase & Co's Strategic Addition to Its Portfolio with AutoZone Inc Shares,https://images.financialmodelingprep.com/news/jpmorgan-chase-cos-strategic-addition-to-its-portfolio-with-20241009.jpg,gurufocus.com,"On September 30, 2024, JPMorgan Chase & Co made a significant addition to its investment portfolio by acquiring 1,333,510 shares of AutoZone Inc (AZO, Financial). This transaction, executed at a price of $3,150.04 per share, represents a notable increase in the firm's holdings in the automotive parts retailer.",https://www.gurufocus.com/news/2547178/jpmorgan-chase--cos-strategic-addition-to-its-portfolio-with-autozone-inc-shares
AZO,2024-10-05 09:00:00,Prediction: These 2 Retail Stocks Will Outperform Dollar General Stock,https://images.financialmodelingprep.com/news/prediction-these-2-retail-stocks-will-outperform-dollar-general-20241005.jpg,fool.com,"Dollar General has structural issues it must correct, while AutoZone and TJX Companies are running like clockwork.",https://www.fool.com/investing/2024/10/05/prediction-these-2-retail-stocks-will-outperform-d/
AZO,2024-10-03 09:16:20,AutoZone: Buy On Weakness Pattern (Technical Analysis),https://images.financialmodelingprep.com/news/autozone-buy-on-weakness-pattern-technical-analysis-20241003.jpg,seekingalpha.com,"AutoZone exhibits a buy-on-weakness pattern, favored by portfolio managers who buy during pullbacks and avoid chasing price spikes. The PM Buy Pattern report identifies stocks with buy-on-weakness signals, though AZO currently lacks this signal post-earnings pop. Both Wall St. and SA analysts rate AZO a Buy, supported by strong Profitability and Momentum, despite weak Valuation and Growth scores.",https://seekingalpha.com/article/4724786-autozone-buy-on-weakness-pattern-technical-analysis
AZO,2024-10-02 16:13:36,AZO Stock Declines 2.69% Amid Broader Retail Sector Weakness,https://images.financialmodelingprep.com/news/azo-stock-declines-269-amid-broader-retail-sector-weakness-20241002.jpg,gurufocus.com,"AutoZone (AZO, Financial) experienced a sharp stock decline of 2.69%, bringing the price to $3087.55 per share with a trading volume of 66,201 shares and a turnover rate of 0.39%. The stock exhibited a volatility of 3.12%.",https://www.gurufocus.com/news/2540849/azo-stock-declines-269-amid-broader-retail-sector-weakness
AZO,2024-10-01 15:43:37,Why AutoZone Stock Could Be Your Next Top Performer,https://images.financialmodelingprep.com/news/why-autozone-stock-could-be-your-next-top-performer-20241001.jpg,benzinga.com,"When companies announce their quarterly earnings results, they can often get sucked into the market's price action for that day, especially if other news or economic data come in to trump the importance of the quarterly release for that stock. That is the case today with shares of AutoZone Inc. AZO, as the company reported its latest quarterly results on a day when U.S. consumer confidence readings fell the most in three years.",https://www.benzinga.com/news/earnings/24/10/41113883/why-autozone-stock-could-be-your-next-top-performer
AZO,2024-10-01 09:37:00,History Suggests This Unstoppable Multibagger Stock in the S&P 500 Is Perfect to Buy and Hold Forever,https://images.financialmodelingprep.com/news/history-suggests-this-unstoppable-multibagger-stock-in-the-sp-20241001.jpg,fool.com,"AutoZone is up 4,000% in just the past two decades, yet its growth story could have many miles to go.",https://www.fool.com/investing/2024/10/01/history-suggests-this-unstoppable-multibagger/
AZO,2024-09-30 10:00:59,"AutoZone, Inc. (AZO) is Attracting Investor Attention: Here is What You Should Know",https://images.financialmodelingprep.com/news/autozone-inc-azo-is-attracting-investor-attention-here-is-20240930.jpg,zacks.com,"Zacks.com users have recently been watching AutoZone (AZO) quite a bit. Thus, it is worth knowing the facts that could determine the stock's prospects.",https://www.zacks.com/stock/news/2343225/autozone-inc-azo-is-attracting-investor-attention-here-is-what-you-should-know?cid=CS-STOCKNEWSAPI-FT-tale_of_the_tape|most_searched_stocks_v1-2343225
AZO,2024-09-26 07:00:10,Why AutoZone Stock Could Be Your Next Top Performer,https://images.financialmodelingprep.com/news/why-autozone-stock-could-be-your-next-top-performer-20240926.jpg,marketbeat.com,"When companies announce their quarterly earnings results, they can often get sucked into the market's price action for that day, especially if other news or economic data come in to trump the importance of the quarterly release for that stock. That is the case today with shares of AutoZone Inc. NYSE: AZO, as the company reported its latest quarterly results on a day when U.S. consumer confidence readings fell the most in three years.",https://www.marketbeat.com/stock-ideas/why-autozone-stock-could-be-your-next-top-performer/
AZO,2024-09-25 12:10:20,Tradepulse Power Inflow Alert: Autozone Inc. Climbs Over 100 Points After Signal,https://images.financialmodelingprep.com/news/tradepulse-power-inflow-alert-autozone-inc-climbs-over-100-points-20240925.jpg,benzinga.com,STOCK RISES QUICKLY AFTER THE SIGNAL AT 10:17 AM AND HITS THE HIGH OF THE DAY AT 10:55 AM EDT,https://www.benzinga.com/signals/24/09/41029338/tradepulse-power-inflow-alert-autozone-inc-climbs-over-100-points-after-signal
AZO,2024-09-25 11:05:34,"AutoZone Q4 Earnings Miss Expectations, Sales Increase Y/Y",https://images.financialmodelingprep.com/news/autozone-q4-earnings-miss-expectations-sales-increase-yy-20240925.jpg,zacks.com,AZO's fourth-quarter fiscal 2024 earnings miss the Zacks Consensus Estimate while revenues beat the same.,https://www.zacks.com/stock/news/2341393/autozone-q4-earnings-miss-expectations-sales-increase-y-y?cid=CS-STOCKNEWSAPI-FT-analyst_blog|earnings_article-2341393
AZO,2024-09-25 10:31:16,Wall Street Analysts Think AutoZone (AZO) Is a Good Investment: Is It?,https://images.financialmodelingprep.com/news/wall-street-analysts-think-autozone-azo-is-a-good-investment-20240925.jpg,zacks.com,"The recommendations of Wall Street analysts are often relied on by investors when deciding whether to buy, sell, or hold a stock. Media reports about these brokerage-firm-employed (or sell-side) analysts changing their ratings often affect a stock's price.",https://www.zacks.com/stock/news/2341182/wall-street-analysts-think-autozone-azo-is-a-good-investment-is-it?cid=CS-STOCKNEWSAPI-FT-fundamental_analysis|average_broker_rating-2341182
AZO,2024-09-25 06:30:00,AutoZone: Likely To Remain A Long-Term Winner,https://images.financialmodelingprep.com/news/autozone-likely-to-remain-a-longterm-winner-20240925.jpg,seekingalpha.com,"AutoZone has shown strong historical performance through excellent capital allocation and aggressive share buybacks, despite recent slower revenue growth rates. The company is in a transition phase, focusing on commercial expansion and international growth, particularly in Mexico and Brazil. Despite increased debt, AutoZone's negative cash conversion cycle and shareholder-friendly capital allocation remain positive indicators.",https://seekingalpha.com/article/4723144-autozone-likely-to-remain-a-long-term-winner
AZO,2024-09-24 13:34:10,"AutoZone, Inc. (AZO) Q4 2024 Earnings Call Transcript",https://images.financialmodelingprep.com/news/autozone-inc-azo-q4-2024-earnings-call-transcript-20240924.jpg,seekingalpha.com,"AutoZone, Inc. (NYSE:AZO ) Q4 2024 Earnings Conference Call September 24, 2024 10:00 AM ET Company Participants Brian Campbell - Vice President, Treasurer, Investor Relations & Tax Phil Daniele - Chief Executive Officer Jamere Jackson - Chief Financial Officer Conference Call Participants Simeon Gutman - Morgan Stanley Bret Jordan - Jefferies Chris Horvers - JPMorgan Steven Forbes - Guggenheim Securities Robbie Ohmes - Bank of America Michael Lasser - UBS Michael Baker - D.A. Davidson Zach Fadem - Wells Fargo Brian Campbell Before we begin, please note that today's call includes forward-looking statements that are subject to the safe harbor provisions of the Private Securities Litigation Reform Act of 1995.",https://seekingalpha.com/article/4723049-autozone-inc-azo-q4-2024-earnings-call-transcript
AZO,2024-09-24 13:20:10,Why Autozone Stock Slumped on Tuesday,https://images.financialmodelingprep.com/news/why-autozone-stock-slumped-on-tuesday-20240924.jpg,fool.com,Autozone missed analysts' expectations on both sales and earnings in its fiscal fourth quarter. Stock buybacks helped the company to grow its earnings per share by 11% in Q4.,https://www.fool.com/investing/2024/09/24/why-autozone-stock-slumped-on-tuesday/
AZO,2024-09-24 12:39:43,"AutoZone: Stay Long, It Continues To Be A Winner",https://images.financialmodelingprep.com/news/autozone-stay-long-it-continues-to-be-a-winner-20240924.jpg,seekingalpha.com,"AutoZone, Inc. remains a top long-term holding due to its consistent growth, international expansion, and robust buyback program that enhances shareholder value. Fiscal Q4 saw record sales of $6.2 billion, with comparable store sales up 1.3% and international comps surging 9.9%. Despite a slight EPS miss, AutoZone's aggressive share repurchase program continues to drive significant EPS growth and shareholder returns.",https://seekingalpha.com/article/4723021-autozone-stay-long-it-continues-to-be-a-winner
AZO,2024-09-24 12:14:39,AutoZone's (AZO) Engine Sputters After Off-Track Earnings Miss,https://images.financialmodelingprep.com/news/autozones-azo-engine-sputters-after-offtrack-earnings-miss-20240924.jpg,youtube.com,"Seth Basham with Wedbush Securities says AutoZone's (AZO) business model remains ""resilient"" despite its earnings miss, but notes ""there are still headwinds"" for its profitability. CFRA's Garrett Nelson calls the expectations miss ""uncharacteristic"" for the company, as he and Seth map out the road ahead for AutoZone.",https://www.youtube.com/watch?v=0g6MDDy0Io8
AZO,2024-09-24 12:00:37,AutoZone Results Impacted by Consumer Discretionary Spending Woes,https://images.financialmodelingprep.com/news/autozone-results-impacted-by-consumer-discretionary-spending-woes-20240924.jpg,investopedia.com,"Auto parts retailer AutoZone (AZO) posted worse-than-expected quarterly results Tuesday as costs rose and the company faced a decline in American customers' discretionary spending. However, it got a boost from store expansion.",https://www.investopedia.com/autozone-results-impacted-by-consumer-discretionary-spending-woes-8717436
AZO,2024-09-24 10:31:18,AutoZone (AZO) Reports Q4 Earnings: What Key Metrics Have to Say,https://images.financialmodelingprep.com/news/autozone-azo-reports-q4-earnings-what-key-metrics-have-to-20240924.jpg,zacks.com,"The headline numbers for AutoZone (AZO) give insight into how the company performed in the quarter ended August 2024, but it may be worthwhile to compare some of its key metrics to Wall Street estimates and the year-ago actuals.",https://www.zacks.com/stock/news/2340475/autozone-azo-reports-q4-earnings-what-key-metrics-have-to-say?cid=CS-STOCKNEWSAPI-FT-fundamental_analysis|nfm-2340475
AZO,2024-09-24 09:41:51,Dow Rises Over 50 Points; AutoZone Posts Downbeat Earnings,https://images.financialmodelingprep.com/news/dow-rises-over-50-points-autozone-posts-downbeat-earnings-20240924.jpg,benzinga.com,"U.S. stocks traded higher this morning, with the Dow Jones index gaining more than 50 points on Tuesday.",https://www.benzinga.com/news/earnings/24/09/41004755/dow-rises-over-50-points-autozone-posts-downbeat-earnings
AZO,2024-09-24 09:36:43,AutoZone misses quarterly profit estimates on rising costs; shares down,https://images.financialmodelingprep.com/news/autozone-misses-quarterly-profit-estimates-on-rising-costs-shares-down-20240924.jpg,reuters.com,"Auto parts retailer AutoZone reported a lower-than-expected fourth-quarter profit on Tuesday, hurt by inflationary challenges, sending its shares down almost 5% in early trade.",https://www.reuters.com/business/autos-transportation/autozone-misses-quarterly-profit-estimates-rising-costs-shares-down-2024-09-24/
AZO,2024-09-24 09:05:20,AutoZone (AZO) Misses Q4 Earnings Estimates,https://images.financialmodelingprep.com/news/autozone-azo-misses-q4-earnings-estimates-20240924.jpg,zacks.com,"AutoZone (AZO) came out with quarterly earnings of $48.11 per share, missing the Zacks Consensus Estimate of $53.31 per share. This compares to earnings of $46.46 per share a year ago.",https://www.zacks.com/stock/news/2340315/autozone-azo-misses-q4-earnings-estimates?cid=CS-STOCKNEWSAPI-FT-tale_of_the_tape|yseop_template_4-2340315
AZO,2024-09-24 07:39:00,"AutoZone's stock drops after a rare profit miss, as U.S. sales come up short",https://images.financialmodelingprep.com/news/autozones-stock-drops-after-a-rare-profit-miss-as-us-20240924.jpg,marketwatch.com,"AutoZone's stock dropped in early Tuesday trading, after the auto-parts retailer reported quarterly earnings and sales that rose, but not enough to meet expectations, as U.S. results continued to underperform.",https://www.marketwatch.com/story/autozones-stock-falls-as-profit-and-sales-rise-but-miss-expectations-3269c151
AZO,2024-09-24 06:55:00,AutoZone 4th Quarter Total Company Same Store Sales Increase 1.3%; Domestic Same Store Sales Increase 0.2%; 4th Quarter EPS Increases to $51.58; Annual Sales of $18.5 Billion,https://images.financialmodelingprep.com/news/autozone-4th-quarter-total-company-same-store-sales-increase-13-20240924.jpg,globenewswire.com,"MEMPHIS, Tenn., Sept. 24, 2024 (GLOBE NEWSWIRE) -- AutoZone, Inc. (NYSE: AZO) today reported net sales of $6.2 billion for its fourth quarter (17 weeks) ended August 31, 2024, an increase of 9.0% from the fourth quarter of fiscal 2023 (16 weeks). Excluding sales from the additional week included in this year's quarter, adjusted sales were up 2.6%. Same store sales, or sales for our domestic and international stores open at least one year, are computed on a 16-week and 52-week basis and are as follows:",https://www.globenewswire.com/news-release/2024/09/24/2951993/3935/en/AutoZone-4th-Quarter-Total-Company-Same-Store-Sales-Increase-1-3-Domestic-Same-Store-Sales-Increase-0-2-4th-Quarter-EPS-Increases-to-51-58-Annual-Sales-of-18-5-Billion.html
AZO,2024-09-20 11:10:20,AutoZone Earnings Are Imminent; These Most Accurate Analysts Revise Forecasts Ahead Of Earnings Call,https://images.financialmodelingprep.com/news/autozone-earnings-are-imminent-these-most-accurate-analysts-revise-20240920.jpg,benzinga.com,"AutoZone, Inc. AZO will release earnings results for its fourth quarter fiscal 2024, before the opening bell on Tuesday, Sept. 24.",https://www.benzinga.com/news/earnings/24/09/40960223/autozone-earnings-are-imminent-these-most-accurate-analysts-revise-forecasts-ahead-of-earnings-call
AZO,2024-09-19 22:01:00,"Stocks to watch next week: Micron, Accenture, Costco, AutoZone",https://images.financialmodelingprep.com/news/stocks-to-watch-next-week-micron-accenture-costco-autozone-20240919.jpg,invezz.com,American stocks had a strong performance this week as the Federal Reserve embarked on an interest rate cutting cycle in its bid to engineer a soft landing. The S&P 500 index jumped to a record high and analysts see it continuing its strong performance.,https://invezz.com/news/2024/09/20/stocks-to-watch-next-week-micron-accenture-costco-autozone/
AZO,2024-09-19 10:15:22,Unveiling AutoZone (AZO) Q4 Outlook: Wall Street Estimates for Key Metrics,https://images.financialmodelingprep.com/news/unveiling-autozone-azo-q4-outlook-wall-street-estimates-for-20240919.jpg,zacks.com,"Besides Wall Street's top -and-bottom-line estimates for AutoZone (AZO), review projections for some of its key metrics to gain a deeper understanding of how the company might have fared during the quarter ended August 2024.",https://www.zacks.com/stock/news/2338426/unveiling-autozone-azo-q4-outlook-wall-street-estimates-for-key-metrics?cid=CS-STOCKNEWSAPI-FT-fundamental_analysis|nfm_preview-2338426
AZO,2024-09-17 18:56:28,AutoZone (AZO) Stock Declines While Market Improves: Some Information for Investors,https://images.financialmodelingprep.com/news/autozone-azo-stock-declines-while-market-improves-some-information-20240917.jpg,zacks.com,"The latest trading day saw AutoZone (AZO) settling at $3,078.31, representing a -0.73% change from its previous close.",https://www.zacks.com/stock/news/2337483/autozone-azo-stock-declines-while-market-improves-some-information-for-investors?cid=CS-STOCKNEWSAPI-FT-tale_of_the_tape|yseop_template_6v1-2337483
AZO,2024-09-16 19:05:34,AutoZone (AZO) Stock Dips While Market Gains: Key Facts,https://images.financialmodelingprep.com/news/autozone-azo-stock-dips-while-market-gains-key-facts-20240916.jpg,zacks.com,"AutoZone (AZO) reachead $3,101.04 at the closing of the latest trading day, reflecting a -0.71% change compared to its last close.",https://www.zacks.com/stock/news/2336837/autozone-azo-stock-dips-while-market-gains-key-facts?cid=CS-STOCKNEWSAPI-FT-tale_of_the_tape|yseop_template_6v2-2336837
AZO,2024-09-16 12:34:45,Tradepulse Power Inflow Alert: Autozone Inc. Has Power Inflow Signal At 10:29 AM EDT,https://images.financialmodelingprep.com/news/tradepulse-power-inflow-alert-autozone-inc-has-power-inflow-20240916.jpg,benzinga.com,"Today, TradePulse's latest Power Inflow alert indicated institutional volume is coming into AutoZone Inc. AZO, signaling a shift from net selling to buying. This shift is a key indicator of rising investor confidence and the potential for an uptrend in AZO's stock.",https://www.benzinga.com/markets/options/24/09/40882985/tradepulse-power-inflow-alert-autozone-inc-has-power-inflow-signal-at-10-29-am-edt
AZO,2024-09-13 07:15:10,3 Stocks That Could See Rising Demand Based on Latest Jobs Data,https://images.financialmodelingprep.com/news/3-stocks-that-could-see-rising-demand-based-on-20240913.jpg,marketbeat.com,Looking into jobs data isn't just useful for understanding how strong the general economy is. It can also provide insight into what types of companies might be preparing for increases in the demand for their products and services.,https://www.marketbeat.com/originals/3-stocks-that-could-see-rising-demand-based-on-latest-jobs-data/
