symbol,publishedDate,title,image,site,text,url
AZO,2025-06-03 10:06:47,"AutoZone, Inc. (AZO) is Attracting Investor Attention: Here is What You Should Know",https://images.financialmodelingprep.com/news/autozone-inc-azo-is-attracting-investor-attention-here-is-20250603.jpg,zacks.com,"Zacks.com users have recently been watching AutoZone (AZO) quite a bit. Thus, it is worth knowing the facts that could determine the stock's prospects.",https://www.zacks.com/stock/news/2482710/autozone-inc-azo-is-attracting-investor-attention-here-is-what-you-should-know?cid=CS-STOCKNEWSAPI-FT-tale_of_the_tape|most_searched_stocks_v1-2482710
AZO,2025-05-31 07:45:00,AutoZone: Double-Digit Growth Amidst A Slowing Economy Makes It A Long-Term Buy,https://images.financialmodelingprep.com/news/autozone-doubledigit-growth-amidst-a-slowing-economy-makes-it-20250531.jpg,seekingalpha.com,"AutoZone, Inc. continues to deliver robust sales and earnings growth, driven by aggressive international expansion and commercial sales momentum despite economic headwinds. The company's fundamentals and strong free cash flow support the potential for a future dividend, making it attractive for long-term wealth compounding. Valuation remains justified by double-digit growth, with significant upside potential and a price target of $4,225 by August 2026.",https://seekingalpha.com/article/4790928-autozone-double-digit-growth-amidst-a-slowing-economy-makes-it-a-long-term-buy
AZO,2025-05-30 20:01:08,Making Sense of Q2 Earnings Expectations,https://images.financialmodelingprep.com/news/making-sense-of-q2-earnings-expectations-20250530.jpg,zacks.com,We count the Costco COST and AutoZone AZO releases for their respective fiscal quarters ending in May as part of our June-quarter tally.,https://www.zacks.com/commentary/2479927/making-sense-of-q2-earnings-expectations?cid=CS-STOCKNEWSAPI-FT-earnings_preview-2479927
AZO,2025-05-30 17:15:00,"If There's Such a Thing as a Recession-Resistant Stock, This Is It",https://images.financialmodelingprep.com/news/if-theres-such-a-thing-as-a-recessionresistant-stock-20250530.jpg,fool.com,"Since the dawn of the financial markets, investors have been on a mythical quest for a stock that can weather any storm, delivering solid returns in boom times and busts.",https://www.fool.com/investing/2025/05/30/recession-resistant-stock-this-is-it/
AZO,2025-05-29 07:42:16,AutoZone Stock to Cross $4400 This Year: This Is Why,https://images.financialmodelingprep.com/news/autozone-stock-to-cross-4400-this-year-this-is-20250529.jpg,marketbeat.com,"AutoZone NYSE: AZO shares are in a long-term, sustained uptrend and are expected to cross the $4,400 level this year. The market for AZO shares is expected to surpass the $4,400 level due to its growing blue-chip business, strong cash flow, capital return, analysts' activity, and stock price action leading up to the FQ3 earnings release.",https://www.marketbeat.com/originals/autozone-stock-to-cross-4400-this-year-this-is-why/
AZO,2025-05-28 17:00:00,AutoZone Appoints New Board Member,https://images.financialmodelingprep.com/news/autozone-appoints-new-board-member-20250528.jpg,globenewswire.com,"MEMPHIS, Tenn., May 28, 2025 (GLOBE NEWSWIRE) --  AutoZone, Inc. (NYSE: AZO) today announced the appointment of Constantino Spas Montesinos to the AutoZone Board of Directors.",https://www.globenewswire.com/news-release/2025/05/28/3089977/3935/en/AutoZone-Appoints-New-Board-Member.html
AZO,2025-05-28 10:52:17,These Analysts Revise Their Forecasts On AutoZone After Q3 Results,https://images.financialmodelingprep.com/news/these-analysts-revise-their-forecasts-on-autozone-after-q3-20250528.jpg,benzinga.com,"AutoZone, Inc. AZO reported weaker-than-expected third-quarter earnings on Tuesday.",https://www.benzinga.com/25/05/45647004/these-analysts-revise-their-forecasts-on-autozone-after-q3-results
AZO,2025-05-27 12:25:13,"AutoZone Q3 Earnings Fall Short of Expectations, Sales Beat",https://images.financialmodelingprep.com/news/autozone-q3-earnings-fall-short-of-expectations-sales-beat-20250527.jpg,zacks.com,"AZO misses Q3 earnings estimates but beats on sales. It ends the quarter with 6,537 stores in the United States, 838 in Mexico and 141 in Brazil.",https://www.zacks.com/stock/news/2477779/autozone-q3-earnings-fall-short-of-expectations-sales-beat?cid=CS-STOCKNEWSAPI-FT-analyst_blog|earnings_article-2477779
AZO,2025-05-27 11:55:43,"Top Stock Movers Now: Tesla, AutoZone, Newmont, and More",https://images.financialmodelingprep.com/news/top-stock-movers-now-tesla-autozone-newmont-and-more-20250527.jpg,investopedia.com,"U.S. equities jumped at midday after President Donald Trump said he would delay new tariffs on European Union imports for 90 days. The Nasdaq added 2%, and the Dow Jones Industrial Average and S&P 500 were up more than 1%.",https://www.investopedia.com/top-stock-movers-now-tesla-autozone-newmont-and-more-11742215
AZO,2025-05-27 11:53:56,"AutoZone, Inc. (AZO) Q3 2025 Earnings Conference Call Transcript",https://images.financialmodelingprep.com/news/autozone-inc-azo-q3-2025-earnings-conference-call-transcript-20250527.jpg,seekingalpha.com,"AutoZone, Inc. (NYSE:AZO ) Q3 2025 - Earnings Conference Call May 27, 2025 10:00 AM ET Company Participants Brian Campbell - VP, Treasurer, IR and Tax Phil Daniele - CEO Jamere Jackson - CFO Conference Call Participants Bret Jordan - Jefferies Christopher Horvers - JPMorgan Michael Lasser - UBS Brian Nagel - Oppenheimer Scot Ciccarelli - Truist Zach Fadem - Wells Fargo Steven Zaccone - Citi Seth Sigman - Barclays Greg Melich - Evercore ISI Operator Welcome to AutoZone's 2025 Q3 Earnings Release Conference Call. At this time, all participants are in a listen only mode.",https://seekingalpha.com/article/4790209-autozone-inc-azo-q3-2025-earnings-conference-call-transcript
AZO,2025-05-27 11:15:13,5 High ROE Stocks to Buy as Markets Tumble on Soaring Bond Yields,https://images.financialmodelingprep.com/news/5-high-roe-stocks-to-buy-as-markets-tumble-20250527.jpg,zacks.com,"DIS, AGNC, ANET, AZO and APP stand out with high ROE as bond yields spike and markets wobble amid U.S. deficit concerns.",https://www.zacks.com/stock/news/2477728/5-high-roe-stocks-to-buy-as-markets-tumble-on-soaring-bond-yields?cid=CS-STOCKNEWSAPI-FT-analyst_blog|rw-2477728
AZO,2025-05-27 11:08:55,AutoZone: One Of The Best Stocks We Have Ever Owned,https://images.financialmodelingprep.com/news/autozone-one-of-the-best-stocks-we-have-ever-20250527.jpg,seekingalpha.com,"AutoZone, Inc. remains a top long-term holding, compounding value through consistent growth, international expansion, and an aggressive buyback program. Recent Q3 results showed record sales and strong comparable store growth, especially internationally, despite a slight earnings miss due to higher expenses. Short-term margin pressures are operational and tied to expansion, but are fixable; buybacks continue to drive EPS growth and shareholder value.",https://seekingalpha.com/article/4790144-autozone-one-of-the-best-stocks-we-have-ever-owned
AZO,2025-05-27 10:36:03,"AutoZone's Same-Store Sales Top Estimates, But Gross Margins Fall",https://images.financialmodelingprep.com/news/autozones-samestore-sales-top-estimates-but-gross-margins-fall-20250527.jpg,investopedia.com,Shares of AutoZone (AZO) slipped Tuesday after the auto parts retailer reported gross margins declined in its fiscal third quarter.,https://www.investopedia.com/autozone-same-store-sales-easily-top-estimates-but-gross-margins-decrease-11742042
AZO,2025-05-27 10:30:25,"Compared to Estimates, AutoZone (AZO) Q3 Earnings: A Look at Key Metrics",https://images.financialmodelingprep.com/news/compared-to-estimates-autozone-azo-q3-earnings-a-look-20250527.jpg,zacks.com,"Although the revenue and EPS for AutoZone (AZO) give a sense of how its business performed in the quarter ended May 2025, it might be worth considering how some key metrics compare with Wall Street estimates and the year-ago numbers.",https://www.zacks.com/stock/news/2477653/compared-to-estimates-autozone-azo-q3-earnings-a-look-at-key-metrics?cid=CS-STOCKNEWSAPI-FT-fundamental_analysis|nfm-2477653
AZO,2025-05-27 10:30:21,Brokers Suggest Investing in AutoZone (AZO): Read This Before Placing a Bet,https://images.financialmodelingprep.com/news/brokers-suggest-investing-in-autozone-azo-read-this-before-20250527.jpg,zacks.com,"The recommendations of Wall Street analysts are often relied on by investors when deciding whether to buy, sell, or hold a stock. Media reports about these brokerage-firm-employed (or sell-side) analysts changing their ratings often affect a stock's price.",https://www.zacks.com/stock/news/2477646/brokers-suggest-investing-in-autozone-azo-read-this-before-placing-a-bet?cid=CS-STOCKNEWSAPI-FT-fundamental_analysis|average_broker_rating-2477646
AZO,2025-05-27 10:20:47,Nasdaq Jumps Over 300 Points On EU Tariff Delay; AutoZone Posts Downbeat Earnings,https://images.financialmodelingprep.com/news/nasdaq-jumps-over-300-points-on-eu-tariff-delay-autozone-20250527.jpg,benzinga.com,"U.S. stocks traded higher this morning, with the Nasdaq Composite surging more than 300 points on Tuesday. President Donald Trump announced the extension of the 50% tariffs on Sunday till July 9, which he had initially announced on Friday.",https://www.benzinga.com/25/05/45619672/nasdaq-jumps-over-300-points-on-eu-tariff-delay-autozone-posts-downbeat-earnings
AZO,2025-05-27 08:31:07,AutoZone's third quarter profit falls 6.6% on currency headwinds,https://images.financialmodelingprep.com/news/autozones-third-quarter-profit-falls-66-on-currency-headwinds-20250527.jpg,reuters.com,"AutoZone Inc on Tuesday reported a 6.6% drop in quarterly profit, as softening demand and currency fluctuations weighed on the auto parts retailer's margins.",https://www.reuters.com/business/autos-transportation/autozones-third-quarter-profit-falls-66-currency-headwinds-2025-05-27/
AZO,2025-05-27 07:58:00,AutoZone Sales Increase But Gross Margins Decline,https://images.financialmodelingprep.com/news/autozone-sales-increase-but-gross-margins-decline-20250527.jpg,wsj.com,"The aftermarket car-parts retailer's fiscal 3Q net income fell to $608.4 million, or $35.36 a share, from $651.7 million, or $36.69 a share a year ago, and missed analysts' expectations of $36.78 a share.",https://www.wsj.com/business/retail/autozone-sales-increase-but-gross-margins-decline-2aecbf19
AZO,2025-05-27 07:58:00,AutoZone Earnings Miss Expectations and Gross Margins Decline. The Stock Slips.,https://images.financialmodelingprep.com/news/autozone-earnings-miss-expectations-and-gross-margins-decline-the-20250527.jpg,barrons.com,The automotive parts retailer adds 84 new stores in the third quarter as it attempts to weather potential economic gloom.,https://www.barrons.com/articles/autozone-earnings-stock-price-88d6fa77
AZO,2025-05-27 07:34:00,Autozone stock rises on first revenue beat in five quarters,https://images.financialmodelingprep.com/news/autozone-stock-rises-on-first-revenue-beat-in-five-20250527.jpg,marketwatch.com,Shares of Autozone Inc. AZO are up 1.4% in premarket trading after the auto-parts retailer beat Wall Street's revenue estimate for the first time in five quarters in its fiscal third-quarter results.,https://www.marketwatch.com/story/autozone-stock-rises-on-first-revenue-beat-in-five-quarters-4f696358
AZO,2025-05-27 06:55:00,AutoZone 3rd Quarter Total Company Same Store Sales Increase 5.4%; Domestic Same Store Sales Increase 5.0%; EPS of $35.36,https://images.financialmodelingprep.com/news/autozone-3rd-quarter-total-company-same-store-sales-increase-54domestic-20250527.jpg,globenewswire.com,"MEMPHIS, Tenn., May 27, 2025 (GLOBE NEWSWIRE) -- AutoZone, Inc. (NYSE: AZO) today reported net sales of $4.5 billion for its third quarter (12 weeks) ended May 10, 2025, an increase of 5.4% from the third quarter of fiscal 2024 (12 weeks). Same store sales, or sales for our domestic and international stores open at least one year, are as follows:",https://www.globenewswire.com/news-release/2025/05/27/3088447/3935/en/AutoZone-3rd-Quarter-Total-Company-Same-Store-Sales-Increase-5-4-Domestic-Same-Store-Sales-Increase-5-0-EPS-of-35-36.html
AZO,2025-05-23 12:18:29,AutoZone Earnings Are Imminent; These Most Accurate Analysts Revise Forecasts Ahead Of Earnings Call,https://images.financialmodelingprep.com/news/autozone-earnings-are-imminent-these-most-accurate-analysts-revise-20250523.jpg,benzinga.com,"AutoZone, Inc. AZO will release its third-quarter earnings results before the opening bell on Tuesday, May 27.",https://www.benzinga.com/analyst-ratings/price-target/25/05/45591568/autozone-earnings-are-imminent-these-most-accurate-analysts-revise-forecasts-ahead-of-earnings-call-2
AZO,2025-05-23 08:10:21,AutoZone Gears Up to Report Q3 Earnings: Here's What to Expect,https://images.financialmodelingprep.com/news/autozone-gears-up-to-report-q3-earnings-heres-what-20250523.jpg,zacks.com,AZO is expected to have delivered third-quarter growth with strong DIY & commercial sales and store expansion efforts.,https://www.zacks.com/stock/news/2476516/autozone-gears-up-to-report-q3-earnings-here-s-what-to-expect?cid=CS-STOCKNEWSAPI-FT-analyst_blog|earnings_preview-2476516
AZO,2025-05-22 04:04:00,"Billionaire Jamie Dimon Still Believes America Is Worth Investing In, Despite Trump Tariffs and Market Fluctuations. Should You Buy These 3 U.S. Stocks in 2025?",https://images.financialmodelingprep.com/news/billionaire-jamie-dimon-still-believes-america-is-worth-investing-20250522.jpg,fool.com,"On May 19, JPMorgan Chase had an investor-day presentation and billionaire CEO Jamie Dimon had a lot to say about the economy, global trade, and investing. And much of it sounded negative.",https://www.fool.com/investing/2025/05/22/billionaire-jamie-dimon-still-believes-america-is/
AZO,2025-05-21 14:46:23,AutoZone Set To Gain As Tariffs Push Car Owners To Repair Over New Purchases: Analyst,https://images.financialmodelingprep.com/news/autozone-set-to-gain-as-tariffs-push-car-owners-20250521.jpg,benzinga.com,"BofA Securities analyst Robert F. Ohmes upgraded AutoZone, Inc. AZO from Neutral to Buy, raising the price forecast from $3900 to $4800.",https://www.benzinga.com/analyst-ratings/analyst-color/25/05/45550680/autozone-set-to-gain-as-tariffs-push-car-owners-to-repair-over-new-purchases-analyst
AZO,2025-05-20 18:51:07,AutoZone (AZO) Flat As Market Sinks: What You Should Know,https://images.financialmodelingprep.com/news/autozone-azo-flat-as-market-sinks-what-you-should-20250520.jpg,zacks.com,"In the closing of the recent trading day, AutoZone (AZO) stood at $3,880.15, denoting no change from the preceding trading day.",https://www.zacks.com/stock/news/2475008/autozone-azo-flat-as-market-sinks-what-you-should-know?cid=CS-STOCKNEWSAPI-FT-tale_of_the_tape|yseop_template_6v1-2475008
AZO,2025-05-19 12:15:38,"Top Stock Movers Now: Tesla, AutoZone, Novavax, and More",https://images.financialmodelingprep.com/news/top-stock-movers-now-tesla-autozone-novavax-and-more-20250519.jpg,investopedia.com,"U.S. equities were down at midday, while the yield on the 10-year Treasury jumped, as the market reacted to Moody's downgrading the U.S. debt rating. The Dow Jones Industrial Average, S&P 500, and Nasdaq all slid.",https://www.investopedia.com/top-stock-movers-now-tesla-autozone-novavax-and-more-11737482
AZO,2025-05-16 08:34:43,Jim Cramer Prefers AutoZone Over Rival: 'Buy The One That's Not Going To Stock Split',https://images.financialmodelingprep.com/news/jim-cramer-prefers-autozone-over-rival-buy-the-one-20250516.jpg,benzinga.com,"On CNBC's “Mad Money Lightning Round,” Jim Cramer said no to O'Reilly Automotive, Inc. ORLY.",https://www.benzinga.com/markets/25/05/45466164/jim-cramer-prefers-autozone-over-rival-buy-the-one-thats-not-going-to-stock-split
AZO,2025-05-13 07:16:53,3 Underrated Stocks Quietly Delivering Big Gains,https://images.financialmodelingprep.com/news/3-underrated-stocks-quietly-delivering-big-gains-20250513.jpg,marketbeat.com,"The stocks on this list are not high-flying tech names, shoot-for-the-moon startups, or even high-growth names, but they are quietly crushing it for investors. Kroger NYSE: KR, Casey's General Stores NASDAQ: CASY, and Autozone NYSE: AZO are all well-established businesses growing at steady and sustainable paces, driving reliable cash flow in good times and bad.",https://www.marketbeat.com/stock-ideas/3-underrated-stocks-quietly-delivering-big-gains/
AZO,2025-05-10 19:32:00,Berkshire Hathaway Is a Great Bear Market Stock. These 2 Are Even Better Buys.,https://images.financialmodelingprep.com/news/berkshire-hathaway-is-a-great-bear-market-stock-these-20250510.jpg,fool.com,"After 60 years of running Berkshire Hathaway (BRK.A 0.18%) (BRK.B 0.09%), Warren Buffett will be riding off into the sunset.",https://www.fool.com/investing/2025/05/10/berkshire-hathaway-is-a-great-bear-market-stock-th/
AZO,2025-05-09 10:00:48,"Investors Heavily Search AutoZone, Inc. (AZO): Here is What You Need to Know",https://images.financialmodelingprep.com/news/investors-heavily-search-autozone-inc-azo-here-is-what-20250509.jpg,zacks.com,"AutoZone (AZO) has been one of the stocks most watched by Zacks.com users lately. So, it is worth exploring what lies ahead for the stock.",https://www.zacks.com/stock/news/2465950/investors-heavily-search-autozone-inc-azo-here-is-what-you-need-to-know?cid=CS-STOCKNEWSAPI-FT-tale_of_the_tape|most_searched_stocks_v1-2465950
AZO,2025-05-02 13:46:19,"Calls of the Day: AutoZone, Roblox, Eli Lilly, Johnson & Johnson and Quanta Services",https://images.financialmodelingprep.com/news/calls-of-the-day-autozone-roblox-eli-lilly-johnson-20250502.jpg,youtube.com,"Oppenheimer upgrades AutoZone — NewEdge Wealth CEO Rob Sechan owns it and breaks it down, while the Investment Committee drops their latest picks.",https://www.youtube.com/watch?v=0VWoMDQK_nk
AZO,2025-05-02 10:36:13,Wall Street Bulls Look Optimistic About AutoZone (AZO): Should You Buy?,https://images.financialmodelingprep.com/news/wall-street-bulls-look-optimistic-about-autozone-azo-should-you-20250502.jpg,zacks.com,"When deciding whether to buy, sell, or hold a stock, investors often rely on analyst recommendations. Media reports about rating changes by these brokerage-firm-employed (or sell-side) analysts often influence a stock's price, but are they really important?",https://www.zacks.com/stock/news/2461131/wall-street-bulls-look-optimistic-about-autozone-azo-should-you-buy?cid=CS-STOCKNEWSAPI-FT-fundamental_analysis|average_broker_rating-2461131
AZO,2025-04-30 18:55:55,AutoZone (AZO) Laps the Stock Market: Here's Why,https://images.financialmodelingprep.com/news/autozone-azo-laps-the-stock-market-heres-why-20250430.jpg,zacks.com,"In the closing of the recent trading day, AutoZone (AZO) stood at $3,762.60, denoting a +1.56% change from the preceding trading day.",https://www.zacks.com/stock/news/2459520/autozone-azo-laps-the-stock-market-here-s-why?cid=CS-STOCKNEWSAPI-FT-tale_of_the_tape|yseop_template_6v1-2459520
AZO,2025-04-28 17:00:00,"AutoZone to Release Third Quarter Fiscal 2025 Earnings May 27, 2025",https://images.financialmodelingprep.com/news/autozone-to-release-third-quarter-fiscal-2025-earnings-may-20250428.jpg,globenewswire.com,"MEMPHIS, Tenn., April 28, 2025 (GLOBE NEWSWIRE) -- AutoZone, Inc. (NYSE: AZO), the leading retailer and distributor of automotive replacement parts and accessories in the Americas, will release results for its third quarter ended Saturday, May 10, 2025, before market open on Tuesday, May 27, 2025. Additionally, the Company will host a one-hour conference call on Tuesday, May 27, 2025, beginning at 10:00 a.m. (ET), to discuss the results of the quarter. This call is being webcast and can be accessed, along with supporting slides, at AutoZone's website at www.autozone.com and clicking on Investor Relations. Investors may also listen to the call by dialing (888) 506-0062, passcode AUTOZONE. In addition, a telephone replay will be available by dialing (877) 481-4010, replay passcode 52323 through June 10, 2025.",https://www.globenewswire.com/news-release/2025/04/28/3069708/3935/en/AutoZone-to-Release-Third-Quarter-Fiscal-2025-Earnings-May-27-2025.html
AZO,2025-04-28 11:25:43,3 Stocks to Watch From Auto Parts Retail Industry With Promising Prospects,https://images.financialmodelingprep.com/news/3-stocks-to-watch-from-auto-parts-retail-industry-20250428.jpg,zacks.com,"Auto part retailers like AZO, GPC & AAP are set to benefit from rising demand for replacement parts and expansion efforts.",https://www.zacks.com/commentary/2456861/3-stocks-to-watch-from-auto-parts-retail-industry-with-promising-prospects?cid=CS-STOCKNEWSAPI-FT-industry_outlook-2456861
AZO,2025-04-28 10:00:37,"Here is What to Know Beyond Why AutoZone, Inc. (AZO) is a Trending Stock",https://images.financialmodelingprep.com/news/here-is-what-to-know-beyond-why-autozone-inc-20250428.jpg,zacks.com,"AutoZone (AZO) has been one of the stocks most watched by Zacks.com users lately. So, it is worth exploring what lies ahead for the stock.",https://www.zacks.com/stock/news/2456624/here-is-what-to-know-beyond-why-autozone-inc-azo-is-a-trending-stock?cid=CS-STOCKNEWSAPI-FT-tale_of_the_tape|most_searched_stocks_v1-2456624
AZO,2025-04-24 18:55:58,AutoZone (AZO) Stock Slides as Market Rises: Facts to Know Before You Trade,https://images.financialmodelingprep.com/news/autozone-azo-stock-slides-as-market-rises-facts-to-20250424.jpg,zacks.com,"AutoZone (AZO) closed at $3,609.65 in the latest trading session, marking a -1.16% move from the prior day.",https://www.zacks.com/stock/news/2455408/autozone-azo-stock-slides-as-market-rises-facts-to-know-before-you-trade?cid=CS-STOCKNEWSAPI-FT-tale_of_the_tape|yseop_template_6v1-2455408
AZO,2025-04-23 17:00:00,AutoZone Appoints New Board Member,https://images.financialmodelingprep.com/news/autozone-appoints-new-board-member-20250423.jpg,globenewswire.com,"MEMPHIS, Tenn., April 23, 2025 (GLOBE NEWSWIRE) -- AutoZone, Inc. (NYSE: AZO) today announced the appointment of Claire Rauh McDonough to the AutoZone Board of Directors.",https://www.globenewswire.com/news-release/2025/04/23/3066960/3935/en/AutoZone-Appoints-New-Board-Member.html
AZO,2025-04-22 08:00:18,Retail Data Shows Urgency in Auto Parts: These 3 Stocks Could Win,https://images.financialmodelingprep.com/news/retail-data-shows-urgency-in-auto-parts-these-3-20250422.jpg,marketbeat.com,"The new economic environment has shifted to a new view lately, especially as the implications of new trade tariffs rolled out by President Trump start to take effect on both the psychology and budget of the consumer. More than that, business owners and managers are now starting to make buying decisions based on the potential impact of these tariffs as well.",https://www.marketbeat.com/stock-ideas/retail-data-shows-urgency-in-auto-parts-these-3-stocks-could-win/
AZO,2025-04-20 08:45:00,2 Recession-Resilient Stocks to Drive Your Portfolio,https://images.financialmodelingprep.com/news/2-recessionresilient-stocks-to-drive-your-portfolio-20250420.jpg,fool.com,"Depending on whom you ask or what financial institution you listen to, the current odds of a U.S. recession in the near term fall roughly between 45% to 60%. The probability has been on the rise of late thanks largely to increased trade policy uncertainty and a potential slowdown in global growth due to U.S. tariffs.",https://www.fool.com/investing/2025/04/20/2-recession-resilient-stocks-to-drive-your/
AZO,2025-04-19 14:14:00,2 Stocks Crushing It With Share Buybacks,https://images.financialmodelingprep.com/news/2-stocks-crushing-it-with-share-buybacks-20250419.jpg,fool.com,Share buybacks are an alternative to dividends for returning value to shareholders. They can be a hugely valuable tool.,https://www.fool.com/investing/2025/04/19/2-stocks-crushing-it-with-share-buybacks/
AZO,2025-04-17 03:51:00,Trump Tariff Plunge: 3 Phenomenal Stocks to Buy at Bargain Prices Right Now,https://images.financialmodelingprep.com/news/trump-tariff-plunge-3-phenomenal-stocks-to-buy-at-20250417.jpg,fool.com,"Just because Wall Street has proved to be a superior wealth creator over the long run doesn't mean stocks are impervious to bouts of volatility. Since President Donald Trump announced his ""Liberation Day"" tariffs on April 2, we've witnessed some of the wildest swings in the Dow Jones Industrial Average (^DJI -1.73%), S&P 500 (^GSPC -2.24%), and Nasdaq Composite (^IXIC -3.07%) since their respective inceptions.",https://www.fool.com/investing/2025/04/17/trump-tariff-plunge-3-stocks-buy-bargain-right-now/
AZO,2025-04-14 10:30:40,Wall Street Analysts Think AutoZone (AZO) Is a Good Investment: Is It?,https://images.financialmodelingprep.com/news/wall-street-analysts-think-autozone-azo-is-a-good-20250414.jpg,zacks.com,"Investors often turn to recommendations made by Wall Street analysts before making a Buy, Sell, or Hold decision about a stock. While media reports about rating changes by these brokerage-firm employed (or sell-side) analysts often affect a stock's price, do they really matter?",https://www.zacks.com/stock/news/2448379/wall-street-analysts-think-autozone-azo-is-a-good-investment-is-it?cid=CS-STOCKNEWSAPI-FT-fundamental_analysis|average_broker_rating-2448379
AZO,2025-04-14 10:00:45,"Is Trending Stock AutoZone, Inc. (AZO) a Buy Now?",https://images.financialmodelingprep.com/news/is-trending-stock-autozone-inc-azo-a-buy-now-20250414.jpg,zacks.com,"AutoZone (AZO) has been one of the stocks most watched by Zacks.com users lately. So, it is worth exploring what lies ahead for the stock.",https://www.zacks.com/stock/news/2448301/is-trending-stock-autozone-inc-azo-a-buy-now?cid=CS-STOCKNEWSAPI-FT-tale_of_the_tape|most_searched_stocks_v1-2448301
