symbol,publishedDate,title,image,site,text,url
AZO,2025-04-13 15:00:00,"1 ""Safe Stock"" That Will Thrive No Matter What Happens With Tariffs",https://images.financialmodelingprep.com/news/1-safe-stock-that-will-thrive-no-matter-what-20250413.jpg,fool.com,One thing is clear after a wild week of President Donald Trump's tariff roulette.,https://www.fool.com/investing/2025/04/13/1-safe-stock-that-will-thrive-no-matter-what-happe/
AZO,2025-04-09 18:50:32,AutoZone (AZO) Rises But Trails Market: What Investors Should Know,https://images.financialmodelingprep.com/news/autozone-azo-rises-but-trails-market-what-investors-should-20250409.jpg,zacks.com,"In the most recent trading session, AutoZone (AZO) closed at $3,566.72, indicating a +1.93% shift from the previous trading day.",https://www.zacks.com/stock/news/2442902/autozone-azo-rises-but-trails-market-what-investors-should-know?cid=CS-STOCKNEWSAPI-FT-tale_of_the_tape|yseop_template_6v1-2442902
AZO,2025-04-03 18:55:43,AutoZone (AZO) Rises As Market Takes a Dip: Key Facts,https://images.financialmodelingprep.com/news/autozone-azo-rises-as-market-takes-a-dip-key-20250403.jpg,zacks.com,"AutoZone (AZO) concluded the recent trading session at $3,826.15, signifying a +0.44% move from its prior day's close.",https://www.zacks.com/stock/news/2440107/autozone-azo-rises-as-market-takes-a-dip-key-facts?cid=CS-STOCKNEWSAPI-FT-tale_of_the_tape|yseop_template_6v1-2440107
AZO,2025-04-03 12:30:43,Why Is AutoZone (AZO) Up 7.1% Since Last Earnings Report?,https://images.financialmodelingprep.com/news/why-is-autozone-azo-up-71-since-last-earnings-20250403.jpg,zacks.com,AutoZone (AZO) reported earnings 30 days ago. What's next for the stock?,https://www.zacks.com/stock/news/2439908/why-is-autozone-azo-up-7-1-since-last-earnings-report?cid=CS-STOCKNEWSAPI-FT-realtime_blog-2439908
AZO,2025-04-03 10:27:00,Blackrock CEO Larry Fink Says Investors Are More Anxious About the Economy Than They've Been in Recent History. These 3 Stocks Will Help Calm Your Nerves.,https://images.financialmodelingprep.com/news/blackrock-ceo-larry-fink-says-investors-are-more-anxious-20250403.jpg,fool.com,"Larry Fink might not be as well-known as, say, Warren Buffett, but the Blackrock CEO arguably has a greater insight into the global economy.",https://www.fool.com/investing/2025/04/03/blackrock-ceo-larry-fink-says-investors-are-anxiou/
AZO,2025-04-01 19:05:53,AutoZone (AZO) Advances But Underperforms Market: Key Facts,https://images.financialmodelingprep.com/news/autozone-azo-advances-but-underperforms-market-key-facts-20250401.jpg,zacks.com,"In the latest trading session, AutoZone (AZO) closed at $3,813.27, marking a +0.01% move from the previous day.",https://www.zacks.com/stock/news/2438600/autozone-azo-advances-but-underperforms-market-key-facts?cid=CS-STOCKNEWSAPI-FT-tale_of_the_tape|yseop_template_6v2-2438600
AZO,2025-04-01 13:05:21,"Goldman Sachs Shakes Up Auto Parts Stocks: Downgrades Genuine Parts, Upgrades AutoZone Amid Economic Volatility",https://images.financialmodelingprep.com/news/goldman-sachs-shakes-up-auto-parts-stocks-downgrades-genuine-20250401.jpg,benzinga.com,"Goldman Sachs analyst Kate McShane on Tuesday highlighted concerns over market volatility, declining consumer activity, and ongoing economic uncertainty within the auto parts retail sector, which are influencing the overall outlook on a few major players in the niche industry.",https://www.benzinga.com/trading-ideas/movers/25/04/44591115/goldman-sachs-shakes-up-auto-parts-stocks-downgrades-genuine-parts-upgrades-autozone-amid-economic-woes
AZO,2025-04-01 10:00:52,"AutoZone, Inc. (AZO) is Attracting Investor Attention: Here is What You Should Know",https://images.financialmodelingprep.com/news/autozone-inc-azo-is-attracting-investor-attention-here-is-20250401.jpg,zacks.com,"Recently, Zacks.com users have been paying close attention to AutoZone (AZO). This makes it worthwhile to examine what the stock has in store.",https://www.zacks.com/stock/news/2437993/autozone-inc-azo-is-attracting-investor-attention-here-is-what-you-should-know?cid=CS-STOCKNEWSAPI-FT-tale_of_the_tape|most_searched_stocks_v1-2437993
AZO,2025-04-01 09:45:00,"This Recession-Proof Stock Soared Through the Dot-Com Bust, the Financial Crisis, and the 2022 Inflation Spike. Is It a No-Brainer Buy for the Trump Tariff Era?",https://images.financialmodelingprep.com/news/this-recessionproof-stock-soared-through-the-dotcom-bust-the-20250401.jpg,fool.com,"President Donald Trump has barely been in office for two months, but his policies and proposals have already rocked the stock market.",https://www.fool.com/investing/2025/04/01/this-bulletproof-stock-soared-through-the-dot-com/
AZO,2025-03-31 10:28:30,"Live Nasdaq Composite: ORLY, AZO Gain in Face of Unrelenting Tariffs",https://images.financialmodelingprep.com/news/live-nasdaq-composite-orly-azo-gain-in-face-of-20250331.jpg,247wallst.com,The stock market continues to suffer on tariff-related uncertainty but the major indexes are off their worst levels of the morning.,https://247wallst.com/market-news/2025/03/31/live-nasdaq-composite-orly-azo-gain-in-face-of-unrelenting-tariffs/
AZO,2025-03-28 18:14:27,"Trump's auto tariffs could lift O'Reilly and AutoZone, this analyst says",https://images.financialmodelingprep.com/news/trumps-auto-tariffs-could-lift-oreilly-and-autozone-this-20250328.jpg,youtube.com,Auto tariffs are set to take effect on April 3. Mizuho Americas director and senior analyst David Bellinger joins Asking for a Trend to discuss the impact of tariffs on auto parts and some of his auto stock picks.,https://www.youtube.com/watch?v=akjph7KQIZU
AZO,2025-03-28 10:30:44,AutoZone (AZO) Is Considered a Good Investment by Brokers: Is That True?,https://images.financialmodelingprep.com/news/autozone-azo-is-considered-a-good-investment-by-brokers-20250328.jpg,zacks.com,"Investors often turn to recommendations made by Wall Street analysts before making a Buy, Sell, or Hold decision about a stock. While media reports about rating changes by these brokerage-firm employed (or sell-side) analysts often affect a stock's price, do they really matter?",https://www.zacks.com/stock/news/2436735/autozone-azo-is-considered-a-good-investment-by-brokers-is-that-true?cid=CS-STOCKNEWSAPI-FT-fundamental_analysis|average_broker_rating-2436735
AZO,2025-03-28 05:00:26,AutoZone (AZO) Soars 4.0%: Is Further Upside Left in the Stock?,https://images.financialmodelingprep.com/news/autozone-azo-soars-40-is-further-upside-left-in-20250328.jpg,zacks.com,AutoZone (AZO) was a big mover last session on higher-than-average trading volume. The latest trend in earnings estimate revisions might not help the stock continue moving higher in the near term.,https://www.zacks.com/stock/news/2436573/autozone-azo-soars-4-0-is-further-upside-left-in-the-stock?cid=CS-STOCKNEWSAPI-FT-tale_of_the_tape|daily_price_change_3%-2436573
AZO,2025-03-27 14:57:00,Why AutoZone and Other Car- Part Stocks Are Gaining on Trump Tariffs,https://images.financialmodelingprep.com/news/why-autozone-and-other-car-part-stocks-are-gaining-20250327.jpg,marketwatch.com,Shares of auto-parts retailers are jumping even as car manufacturers tumble in response to President Donald Trump's unexpectedly severe 25% tariffs on foreign autos.,https://www.marketwatch.com/articles/autozone-car-parts-tariffs-04abde27
AZO,2025-03-24 09:40:25,"Take the Zacks Approach to Beat the Markets: CMS Energy, Chevron, AutoZone in Focus",https://images.financialmodelingprep.com/news/take-the-zacks-approach-to-beat-the-markets-cms-20250324.jpg,zacks.com,"Last week, our time-tested methodologies served investors well in navigating the market. Check out some of our achievements from the past three months.",https://www.zacks.com/stock/news/2434123/take-the-zacks-approach-to-beat-the-markets-cms-energy-chevron-autozone-in-focus?cid=CS-STOCKNEWSAPI-FT-analyst_blog|investment_ideas-2434123
AZO,2025-03-21 17:45:25,"AutoZone, Inc. (AZO) Is a Trending Stock: Facts to Know Before Betting on It",https://images.financialmodelingprep.com/news/autozone-inc-azo-is-a-trending-stock-facts-to-20250321.jpg,zacks.com,"AutoZone (AZO) has been one of the stocks most watched by Zacks.com users lately. So, it is worth exploring what lies ahead for the stock.",https://www.zacks.com/stock/news/2433662/autozone-inc-azo-is-a-trending-stock-facts-to-know-before-betting-on-it?cid=CS-STOCKNEWSAPI-FT-tale_of_the_tape|most_searched_stocks_v1-2433662
AZO,2025-03-17 04:41:00,The S&P 500 Is in Correction Territory: 4 Surefire Stocks to Buy Right Now,https://images.financialmodelingprep.com/news/the-sp-500-is-in-correction-territory-4-surefire-20250317.jpg,fool.com,"It's official! As of the closing bell on March 13, the benchmark S&P 500 (^GSPC 2.13%), which is comprised of 500 of the most-influential businesses traded on U.S. stock exchanges, had entered correction territory.",https://www.fool.com/investing/2025/03/17/sp-500-correction-4-surefire-stocks-buy-right-now/
AZO,2025-03-14 08:46:20,"Market Momentum Shifts, But These 3 Stocks Are Built to Last",https://images.financialmodelingprep.com/news/market-momentum-shifts-but-these-3-stocks-are-built-20250314.jpg,marketbeat.com,Market momentum clearly shifted in late February as the S&P 500 NYSEARCA: SPY began to sell off. The shift is caused by increased uncertainty related to Trump's tariffs and policy changes and a growing risk of a recession.,https://www.marketbeat.com/stock-ideas/market-momentum-shifts-but-these-3-stocks-are-built-to-last/
AZO,2025-03-13 13:34:11,"Josh Brown's best stocks in the Market List: Autozone, Live Nation and Starbucks",https://images.financialmodelingprep.com/news/josh-browns-best-stocks-in-the-market-list-autozone-live-20250313.jpg,youtube.com,"Josh Brown, CEO of Ritholtz Wealth Management, joins CNBC's ""Halftime Report"" to explain why Autozone, Live Nation and Starbucks are on his ""Best Stocks in the Market"" list.",https://www.youtube.com/watch?v=jOJXVaJx4BY
AZO,2025-03-09 09:57:55,2 Stocks That Are Sure to Split in 2025,https://images.financialmodelingprep.com/news/2-stocks-that-are-sure-to-split-in-2025-20250309.jpg,247wallst.com,"Many high-flying stocks have nosedived over the past week, and stock splits are no longer in the spotlight.",https://247wallst.com/investing/2025/03/09/2-stocks-that-are-sure-to-split-in-2025/
AZO,2025-03-07 07:38:14,"AutoZone: Forget the Pullback, This Stock Is Still Climbing",https://images.financialmodelingprep.com/news/autozone-forget-the-pullback-this-stock-is-still-climbing-20250307.jpg,marketbeat.com,"Investors looking to get into Autozone NYSE: AZO on a deep pullback may have a long time to wait. This must-have buy-and-hold company's FQ2 2025 earnings results underscore its quality and potential, leading analysts to raise their price targets and lead the market higher.",https://www.marketbeat.com/originals/autozone-forget-the-pullback-this-stock-is-still-climbing/
AZO,2025-03-05 13:22:07,"AutoZone's Growth Story Intact, Analysts Highlight Commercial Strength and Expansion Plans",https://images.financialmodelingprep.com/news/autozones-growth-story-intact-analysts-highlight-commercial-strength-and-20250305.jpg,benzinga.com,"Several analysts boosted the price forecast for AutoZone, Inc. AZO following second-quarter results reported on Tuesday.",https://www.benzinga.com/analyst-ratings/analyst-color/25/03/44148322/autozones-growth-story-intact-analysts-highlight-commercial-strength-and-expansion-
AZO,2025-03-04 13:15:04,"AutoZone, Inc. (AZO) Q2 2025 Earnings Conference Call Transcript",https://images.financialmodelingprep.com/news/autozone-inc-azo-q2-2025-earnings-conference-call-transcript-20250304.jpg,seekingalpha.com,"AutoZone, Inc. (NYSE:AZO ) Q2 2025 Earnings Conference Call March 4, 2025 10:00 AM ET Company Participants Brian Campbell - VP, Treasurer, IR and Tax Phil Daniele - CEO Jamere Jackson - CFO Conference Call Participants Bret Jordan - Jefferies Christian Carlino - JPMorgan Zach Fadem - Wells Fargo Seth Basham - Wedbush Securities Mark Jordan - Goldman Sachs Steve Forbes - Guggenheim David Bellinger - Mizuho Securities Josh Young - Truist Securities Brian Nagel - Oppenheimer Operator Good day, everyone, and welcome to AutoZone's 2025 Second Quarter Earnings Release Conference Call. At this time, all participants have been placed on a listen-only mode.",https://seekingalpha.com/article/4764534-autozone-inc-azo-q2-2025-earnings-conference-call-transcript
AZO,2025-03-04 11:10:32,"AutoZone Q2 Earnings Miss Expectations, Revenues Rise Y/Y",https://images.financialmodelingprep.com/news/autozone-q2-earnings-miss-expectations-revenues-rise-yy-20250304.jpg,zacks.com,"AZO's second-quarter earnings and revenues miss the Zacks Consensus Estimate. However, revenues rise year over year.",https://www.zacks.com/stock/news/2425243/autozone-q2-earnings-miss-expectations-revenues-rise-y-y?cid=CS-STOCKNEWSAPI-FT-analyst_blog|earnings_article-2425243
AZO,2025-03-04 10:46:33,AutoZone's Profit Shrinks and Misses Estimates Despite Rising Sales,https://images.financialmodelingprep.com/news/autozones-profit-shrinks-and-misses-estimates-despite-rising-sales-20250304.jpg,investopedia.com,"AutoZone's (AZO) fiscal second-quarter profit declined year-over-year and missed expectations before the bell Tuesday, even as revenue grew.",https://www.investopedia.com/autozone-profit-shrinks-and-misses-estimates-despite-rising-sales-11690230
AZO,2025-03-04 10:30:47,"Compared to Estimates, AutoZone (AZO) Q2 Earnings: A Look at Key Metrics",https://images.financialmodelingprep.com/news/compared-to-estimates-autozone-azo-q2-earnings-a-look-20250304.jpg,zacks.com,"The headline numbers for AutoZone (AZO) give insight into how the company performed in the quarter ended February 2025, but it may be worthwhile to compare some of its key metrics to Wall Street estimates and the year-ago actuals.",https://www.zacks.com/stock/news/2425129/compared-to-estimates-autozone-azo-q2-earnings-a-look-at-key-metrics?cid=CS-STOCKNEWSAPI-FT-fundamental_analysis|nfm-2425129
AZO,2025-03-04 09:05:30,AutoZone (AZO) Lags Q2 Earnings and Revenue Estimates,https://images.financialmodelingprep.com/news/autozone-azo-lags-q2-earnings-and-revenue-estimates-20250304.jpg,zacks.com,"AutoZone (AZO) came out with quarterly earnings of $28.29 per share, missing the Zacks Consensus Estimate of $29.16 per share. This compares to earnings of $28.89 per share a year ago.",https://www.zacks.com/stock/news/2425003/autozone-azo-lags-q2-earnings-and-revenue-estimates?cid=CS-STOCKNEWSAPI-FT-tale_of_the_tape|yseop_template_4-2425003
AZO,2025-03-04 08:51:00,AutoZone's stock slips on fourth straight revenue miss despite strength in the U.S.,https://images.financialmodelingprep.com/news/autozones-stock-slips-on-fourth-straight-revenue-miss-despite-20250304.jpg,marketwatch.com,"AutoZone's international business continued to deliver strong results, and “remains encouraging,” the company said.",https://www.marketwatch.com/story/autozones-stock-slips-on-fourth-straight-revenue-miss-4cac9327
AZO,2025-03-04 08:40:44,"AutoZone misses quarterly revenue estimates on inflation, currency rates",https://images.financialmodelingprep.com/news/autozone-misses-quarterly-revenue-estimates-on-inflation-currency-rates-20250304.jpg,reuters.com,"AutoZone on Tuesday missed Wall Street estimates for second-quarter revenue, as the automotive parts retailer navigated headwinds due to consumers holding back and currency rate fluctuations.",https://www.reuters.com/business/autos-transportation/autozone-misses-quarterly-revenue-estimates-inflation-currency-rates-2025-03-04/
AZO,2025-03-04 06:55:00,AutoZone 2nd Quarter Total Company Same Store Sales Increase 2.9%; Domestic Same Store Sales Increase 1.9%; EPS of $28.29,https://images.financialmodelingprep.com/news/autozone-2nd-quarter-total-company-same-store-sales-increase-29-20250304.jpg,globenewswire.com,"MEMPHIS, Tenn., March 04, 2025 (GLOBE NEWSWIRE) -- AutoZone, Inc. (NYSE: AZO) today reported net sales of $4.0 billion for its second quarter (12 weeks) ended February 15, 2025, an increase of 2.4% from the second quarter of fiscal 2024 (12 weeks).",https://www.globenewswire.com/news-release/2025/03/04/3036303/3935/en/AutoZone-2nd-Quarter-Total-Company-Same-Store-Sales-Increase-2-9-Domestic-Same-Store-Sales-Increase-1-9-EPS-of-28-29.html
AZO,2025-03-03 11:36:46,Top Wall Street Forecasters Revamp AutoZone Price Expectations Ahead Of Q2 Earnings,https://images.financialmodelingprep.com/news/top-wall-street-forecasters-revamp-autozone-price-expectations-ahead-of-20250303.jpg,benzinga.com,"AutoZone, Inc. AZO will release its second-quarter financial results, before the opening bell, on Tuesday, March 4.",https://www.benzinga.com/25/03/44083474/top-wall-street-forecasters-revamp-autozone-price-expectations-ahead-of-q2-earnings
AZO,2025-02-26 18:55:32,AutoZone (AZO) Stock Declines While Market Improves: Some Information for Investors,https://images.financialmodelingprep.com/news/autozone-azo-stock-declines-while-market-improves-some-information-20250226.jpg,zacks.com,"In the most recent trading session, AutoZone (AZO) closed at $3,392.97, indicating a -0.95% shift from the previous trading day.",https://www.zacks.com/stock/news/2422307/autozone-azo-stock-declines-while-market-improves-some-information-for-investors?cid=CS-STOCKNEWSAPI-FT-tale_of_the_tape|yseop_template_6v1-2422307
AZO,2025-02-25 10:01:38,"Here is What to Know Beyond Why AutoZone, Inc. (AZO) is a Trending Stock",https://images.financialmodelingprep.com/news/here-is-what-to-know-beyond-why-autozone-inc-20250225.jpg,zacks.com,"Recently, Zacks.com users have been paying close attention to AutoZone (AZO). This makes it worthwhile to examine what the stock has in store.",https://www.zacks.com/stock/news/2421040/here-is-what-to-know-beyond-why-autozone-inc-azo-is-a-trending-stock?cid=CS-STOCKNEWSAPI-FT-tale_of_the_tape|most_searched_stocks_v1-2421040
AZO,2025-02-22 08:15:00,AutoZone's Financial Strength: A Moneyball Analysis,https://images.financialmodelingprep.com/news/autozones-financial-strength-a-moneyball-analysis-20250222.jpg,fool.com,"AutoZone (AZO -1.11%) is a dominant force in the automotive parts retail industry, with over 7,000 stores across multiple countries. Here's how the automotive parts specialist stacks up according to The Motley Fool's Moneyball analysis system.",https://www.fool.com/investing/2025/02/22/autozones-financial-strength-a-moneyball-analysis/
AZO,2025-02-21 06:22:00,"Why Dividends Matter, Even The Little Ones",https://images.financialmodelingprep.com/news/why-dividends-matter-even-the-little-ones-20250221.jpg,seekingalpha.com,"Dividends provide a reliable income stream, especially during tough economic times, alleviating financial pressure without the need to sell shares. Persistent inflation makes dividend income increasingly valuable, as it offers stability when market returns are volatile or negative. Investing in well-established, high-yield dividend companies with strong cash flows can ensure a steady income and reduce financial stress.",https://seekingalpha.com/article/4759908-why-dividends-matter-even-the-little-ones
AZO,2025-02-20 18:55:40,AutoZone (AZO) Increases Despite Market Slip: Here's What You Need to Know,https://images.financialmodelingprep.com/news/autozone-azo-increases-despite-market-slip-heres-what-you-20250220.jpg,zacks.com,"In the closing of the recent trading day, AutoZone (AZO) stood at $3,406.66, denoting a +0.3% change from the preceding trading day.",https://www.zacks.com/stock/news/2419128/autozone-azo-increases-despite-market-slip-here-s-what-you-need-to-know?cid=CS-STOCKNEWSAPI-FT-tale_of_the_tape|yseop_template_6v1-2419128
AZO,2025-02-19 19:01:15,AutoZone (AZO) Surpasses Market Returns: Some Facts Worth Knowing,https://images.financialmodelingprep.com/news/autozone-azo-surpasses-market-returns-some-facts-worth-knowing-20250219.jpg,zacks.com,"AutoZone (AZO) concluded the recent trading session at $3,396.46, signifying a +0.36% move from its prior day's close.",https://www.zacks.com/stock/news/2418154/autozone-azo-surpasses-market-returns-some-facts-worth-knowing?cid=CS-STOCKNEWSAPI-FT-tale_of_the_tape|yseop_template_6v2-2418154
AZO,2025-02-14 10:01:35,"AutoZone, Inc. (AZO) is Attracting Investor Attention: Here is What You Should Know",https://images.financialmodelingprep.com/news/autozone-inc-azo-is-attracting-investor-attention-here-is-20250214.jpg,zacks.com,"Zacks.com users have recently been watching AutoZone (AZO) quite a bit. Thus, it is worth knowing the facts that could determine the stock's prospects.",https://www.zacks.com/stock/news/2416112/autozone-inc-azo-is-attracting-investor-attention-here-is-what-you-should-know?cid=CS-STOCKNEWSAPI-FT-tale_of_the_tape|most_searched_stocks_v1-2416112
AZO,2025-02-11 10:31:40,Is AutoZone (AZO) a Buy as Wall Street Analysts Look Optimistic?,https://images.financialmodelingprep.com/news/is-autozone-azo-a-buy-as-wall-street-analysts-20250211.jpg,zacks.com,"The recommendations of Wall Street analysts are often relied on by investors when deciding whether to buy, sell, or hold a stock. Media reports about these brokerage-firm-employed (or sell-side) analysts changing their ratings often affect a stock's price.",https://www.zacks.com/stock/news/2413574/is-autozone-azo-a-buy-as-wall-street-analysts-look-optimistic?cid=CS-STOCKNEWSAPI-FT-fundamental_analysis|average_broker_rating-2413574
AZO,2025-02-10 18:55:36,AutoZone (AZO) Rises But Trails Market: What Investors Should Know,https://images.financialmodelingprep.com/news/autozone-azo-rises-but-trails-market-what-investors-should-20250210.jpg,zacks.com,"AutoZone (AZO) closed at $3,427.55 in the latest trading session, marking a +0.22% move from the prior day.",https://www.zacks.com/stock/news/2413204/autozone-azo-rises-but-trails-market-what-investors-should-know?cid=CS-STOCKNEWSAPI-FT-tale_of_the_tape|yseop_template_6v1-2413204
AZO,2025-02-04 18:56:26,AutoZone (AZO) Exceeds Market Returns: Some Facts to Consider,https://images.financialmodelingprep.com/news/autozone-azo-exceeds-market-returns-some-facts-to-consider-20250204.jpg,zacks.com,"In the closing of the recent trading day, AutoZone (AZO) stood at $3,459, denoting a +0.78% change from the preceding trading day.",https://www.zacks.com/stock/news/2409595/autozone-azo-exceeds-market-returns-some-facts-to-consider?cid=CS-STOCKNEWSAPI-FT-tale_of_the_tape|yseop_template_6v1-2409595
AZO,2025-02-04 13:28:43,"Final Trades: Starbucks, Autozone, Sonos and Deckers",https://images.financialmodelingprep.com/news/final-trades-starbucks-autozone-sonos-and-deckers-20250204.jpg,youtube.com,The Investment Committee give you their top stocks to watch for the second half of the market day.,https://www.youtube.com/watch?v=YKlnm1JGtrU
AZO,2025-02-04 12:52:11,Trump's New Tariffs: Top U.S.-Centric Stocks Amid Escalating Trade Tensions,https://images.financialmodelingprep.com/news/trumps-new-tariffs-top-uscentric-stocks-amid-escalating-trade-20250204.jpg,seekingalpha.com,"Tariffs and currency headwinds are impacting costs and currency, making US retail and service-related stocks a nice hedge. Key stocks to consider include home improvement, grocery, automotive retail, and waste management. Hedging against tariff uncertainty should become a theme in years to come.",https://seekingalpha.com/article/4754711-trump-new-tariffs-top-us-centric-stocks-amid-escalating-trade-tensions
AZO,2025-02-03 16:30:00,"AutoZone to Release Second Quarter Fiscal 2025 Earnings March 4, 2025",https://images.financialmodelingprep.com/news/autozone-to-release-second-quarter-fiscal-2025-earnings-march-20250203.jpg,globenewswire.com,"MEMPHIS, Tenn., Feb. 03, 2025 (GLOBE NEWSWIRE) -- AutoZone, Inc. (NYSE: AZO), the leading retailer and distributor of automotive replacement parts and accessories in the Americas, will release results for its second quarter ended Saturday, February 15, 2025, before market open on Tuesday, March 4, 2025. Additionally, the Company will host a one-hour conference call on Tuesday, March 4, 2025, beginning at 10:00 a.m. (ET), to discuss the results of the quarter. This call is being webcast and can be accessed, along with supporting slides, at AutoZone's website at www.autozone.com and clicking on Investor Relations. Investors may also listen to the call by dialing (888) 506-0062, passcode AUTOZONE. In addition, a telephone replay will be available by dialing (877) 481-4010, replay passcode 51956 through March 18, 2025.",https://www.globenewswire.com/news-release/2025/02/03/3019887/3935/en/AutoZone-to-Release-Second-Quarter-Fiscal-2025-Earnings-March-4-2025.html
AZO,2025-02-03 10:01:47,"AutoZone, Inc. (AZO) Is a Trending Stock: Facts to Know Before Betting on It",https://images.financialmodelingprep.com/news/autozone-inc-azo-is-a-trending-stock-facts-to-20250203.jpg,zacks.com,"AutoZone (AZO) has received quite a bit of attention from Zacks.com users lately. Therefore, it is wise to be aware of the facts that can impact the stock's prospects.",https://www.zacks.com/stock/news/2408182/autozone-inc-azo-is-a-trending-stock-facts-to-know-before-betting-on-it?cid=CS-STOCKNEWSAPI-FT-tale_of_the_tape|most_searched_stocks_v1-2408182
AZO,2025-01-27 18:56:10,AutoZone (AZO) Increases Despite Market Slip: Here's What You Need to Know,https://images.financialmodelingprep.com/news/autozone-azo-increases-despite-market-slip-heres-what-you-need-20250127.jpg,zacks.com,"In the latest trading session, AutoZone (AZO) closed at $3,372.82, marking a +1.21% move from the previous day.",https://www.zacks.com/stock/news/2404187/autozone-azo-increases-despite-market-slip-here-s-what-you-need-to-know?cid=CS-STOCKNEWSAPI-FT-tale_of_the_tape|yseop_template_6v1-2404187
