symbol,publishedDate,title,image,site,text,url
AZO,2025-01-27 10:31:56,"Take the Zacks Approach to Beat the Markets: PSQ, AutoZone, Palantir Technologies in Focus",https://images.financialmodelingprep.com/news/take-the-zacks-approach-to-beat-the-markets-psq-20250127.jpg,zacks.com,"Last week, our time-tested methodologies served investors well in navigating the market. Check out some of our achievements from the past three months.",https://www.zacks.com/stock/news/2403777/take-the-zacks-approach-to-beat-the-markets-psq-autozone-palantir-technologies-in-focus?cid=CS-STOCKNEWSAPI-FT-analyst_blog|investment_ideas-2403777
AZO,2025-01-23 19:01:22,AutoZone (AZO) Beats Stock Market Upswing: What Investors Need to Know,https://images.financialmodelingprep.com/news/autozone-azo-beats-stock-market-upswing-what-investors-need-20250123.jpg,zacks.com,"In the latest trading session, AutoZone (AZO) closed at $3,373.57, marking a +1.43% move from the previous day.",https://www.zacks.com/stock/news/2402549/autozone-azo-beats-stock-market-upswing-what-investors-need-to-know?cid=CS-STOCKNEWSAPI-FT-tale_of_the_tape|yseop_template_6v2-2402549
AZO,2025-01-22 10:02:01,"Investors Heavily Search AutoZone, Inc. (AZO): Here is What You Need to Know",https://images.financialmodelingprep.com/news/investors-heavily-search-autozone-inc-azo-here-is-what-20250122.jpg,zacks.com,"Recently, Zacks.com users have been paying close attention to AutoZone (AZO). This makes it worthwhile to examine what the stock has in store.",https://www.zacks.com/stock/news/2401166/investors-heavily-search-autozone-inc-azo-here-is-what-you-need-to-know?cid=CS-STOCKNEWSAPI-FT-tale_of_the_tape|most_searched_stocks_v1-2401166
AZO,2025-01-17 18:55:49,AutoZone (AZO) Outperforms Broader Market: What You Need to Know,https://images.financialmodelingprep.com/news/autozone-azo-outperforms-broader-market-what-you-need-to-20250117.jpg,zacks.com,"In the most recent trading session, AutoZone (AZO) closed at $3,228.40, indicating a +1.08% shift from the previous trading day.",https://www.zacks.com/stock/news/2399347/autozone-azo-outperforms-broader-market-what-you-need-to-know?cid=CS-STOCKNEWSAPI-FT-tale_of_the_tape|yseop_template_6v1-2399347
AZO,2025-01-14 19:34:04,AutoZone: Potential Sales Re-Acceleration Bolsters Bullish Case,https://images.financialmodelingprep.com/news/autozone-potential-sales-reacceleration-bolsters-bullish-case-20250114.jpg,seekingalpha.com,"AutoZone's consistent revenue growth and aggressive share buybacks make it a long-term compounder, despite recent sales growth deceleration. AZO's sales growth is expected to re-accelerate due to expanding Mega-Hub networks, aging U.S. car fleet, and stabilizing consumer purchasing power. Wall Street projects strong double-digit EPS growth for fiscal 2026 and 2027, supported by an upcoming acceleration in sales and margin improvements.",https://seekingalpha.com/article/4749494-autozone-stock-potential-sales-re-acceleration-bolsters-bullish-case
AZO,2025-01-13 19:01:28,AutoZone (AZO) Stock Sinks As Market Gains: Here's Why,https://images.financialmodelingprep.com/news/autozone-azo-stock-sinks-as-market-gains-heres-why-20250113.jpg,zacks.com,"AutoZone (AZO) reachead $3,239.62 at the closing of the latest trading day, reflecting a -0.36% change compared to its last close.",https://www.zacks.com/stock/news/2396201/autozone-azo-stock-sinks-as-market-gains-here-s-why?cid=CS-STOCKNEWSAPI-FT-tale_of_the_tape|yseop_template_6v2-2396201
AZO,2025-01-13 11:11:09,2 Auto Parts Retailer Stocks Poised to Grow Amid Industry Challenges,https://images.financialmodelingprep.com/news/2-auto-parts-retailer-stocks-poised-to-grow-amid-20250113.jpg,zacks.com,"While the auto parts industry grapples with significant challenges in the DIY segment, ORLY and AZO are poised to capitalize on evolving market dynamics.",https://www.zacks.com/commentary/2395549/2-auto-parts-retailer-stocks-poised-to-grow-amid-industry-challenges?cid=CS-STOCKNEWSAPI-FT-industry_outlook-2395549
AZO,2025-01-10 10:01:40,"Here is What to Know Beyond Why AutoZone, Inc. (AZO) is a Trending Stock",https://images.financialmodelingprep.com/news/here-is-what-to-know-beyond-why-autozone-inc-20250110.jpg,zacks.com,"AutoZone (AZO) has received quite a bit of attention from Zacks.com users lately. Therefore, it is wise to be aware of the facts that can impact the stock's prospects.",https://www.zacks.com/stock/news/2394983/here-is-what-to-know-beyond-why-autozone-inc-azo-is-a-trending-stock?cid=CS-STOCKNEWSAPI-FT-tale_of_the_tape|most_searched_stocks_v1-2394983
AZO,2025-01-09 12:30:43,Why Is AutoZone (AZO) Down 1.2% Since Last Earnings Report?,https://images.financialmodelingprep.com/news/why-is-autozone-azo-down-12-since-last-earnings-20250109.jpg,zacks.com,AutoZone (AZO) reported earnings 30 days ago. What's next for the stock?,https://www.zacks.com/stock/news/2394576/why-is-autozone-azo-down-1-2-since-last-earnings-report?cid=CS-STOCKNEWSAPI-FT-realtime_blog-2394576
AZO,2025-01-07 12:05:41,Here's Why Investors Should Retain AutoZone Stock Right Now,https://images.financialmodelingprep.com/news/heres-why-investors-should-retain-autozone-stock-right-now-20250107.jpg,zacks.com,AZO is set to gain from continued strength across DIY and commercial businesses and expansion of mega hubs amid high capital spending.,https://www.zacks.com/stock/news/2393071/here-s-why-investors-should-retain-autozone-stock-right-now?cid=CS-STOCKNEWSAPI-FT-analyst_blog|rank_focused-2393071
AZO,2025-01-02 19:13:21,AutoZone (AZO) Increases Despite Market Slip: Here's What You Need to Know,https://images.financialmodelingprep.com/news/autozone-azo-increases-despite-market-slip-heres-what-you-20250102.jpg,zacks.com,"AutoZone (AZO) closed at $3,250 in the latest trading session, marking a +1.5% move from the prior day.",https://www.zacks.com/stock/news/2391304/autozone-azo-increases-despite-market-slip-here-s-what-you-need-to-know?cid=CS-STOCKNEWSAPI-FT-tale_of_the_tape|yseop_template_6v2-2391304
AZO,2024-12-30 10:01:33,"AutoZone, Inc. (AZO) is Attracting Investor Attention: Here is What You Should Know",https://images.financialmodelingprep.com/news/autozone-inc-azo-is-attracting-investor-attention-here-is-20241230.jpg,zacks.com,"Recently, Zacks.com users have been paying close attention to AutoZone (AZO). This makes it worthwhile to examine what the stock has in store.",https://www.zacks.com/stock/news/2389402/autozone-inc-azo-is-attracting-investor-attention-here-is-what-you-should-know?cid=CS-STOCKNEWSAPI-FT-tale_of_the_tape|most_searched_stocks_v1-2389402
AZO,2024-12-19 17:00:00,AutoZone Announces Organizational Changes,https://images.financialmodelingprep.com/news/autozone-announces-organizational-changes-20241219.jpg,globenewswire.com,"MEMPHIS, Tenn., Dec. 19, 2024 (GLOBE NEWSWIRE) -- AutoZone, Inc. (NYSE: AZO) today announces two Senior Vice President promotions. Bailey Childress, Vice President, Merchandising, has been promoted to Senior Vice President, Omnichannel and Merchandising Support, and Luke Rauch, Vice President, Merchandising, has been promoted to Senior Vice President, Merchandising and Global Sourcing.",https://www.globenewswire.com/news-release/2024/12/19/3000291/3935/en/AutoZone-Announces-Organizational-Changes.html
AZO,2024-12-17 10:00:59,"AutoZone, Inc. (AZO) Is a Trending Stock: Facts to Know Before Betting on It",https://images.financialmodelingprep.com/news/autozone-inc-azo-is-a-trending-stock-facts-to-20241217.jpg,zacks.com,"AutoZone (AZO) has received quite a bit of attention from Zacks.com users lately. Therefore, it is wise to be aware of the facts that can impact the stock's prospects.",https://www.zacks.com/stock/news/2384490/autozone-inc-azo-is-a-trending-stock-facts-to-know-before-betting-on-it?cid=CS-STOCKNEWSAPI-FT-tale_of_the_tape|most_searched_stocks_v1-2384490
AZO,2024-12-16 18:20:38,AutoZone Is A Buy Breaking Out To New Highs (Technical Analysis),https://images.financialmodelingprep.com/news/autozone-is-a-buy-breaking-out-to-new-highs-20241216.jpg,seekingalpha.com,"AZO's price action is bullish, trading above its 30-week EMA and hitting new highs, indicating strong upward momentum. Momentum indicators show both short-term and long-term bullish trends, with the PPO line well above zero and the signal line. Volume analysis reveals institutional buying, especially post-earnings, suggesting smart money confidence in AZO's future performance.",https://seekingalpha.com/article/4744672-azo-is-a-buy-breaking-out-to-new-highs-technical-analysis
AZO,2024-12-16 05:33:26,"AutoZone price target raised to $3,800 from $3,450 at TD Cowen",https://images.financialmodelingprep.com/news/autozone-price-target-raised-to-3800-from-3450-at-20241216.jpg,https://thefly.com,"TD Cowen raised the firm's price target on AutoZone to $3,800 from $3,450 and keeps a Buy rating on the shares. The firm expects the company's do-it-for-me compares to reaccelerate over the coming quarters driven by a pick-up in mega-hub openings and delivery speed initiatives. More favorable weather and AutoZone exiting five West Coast markets will be a tailwind which should help offset a softer macro environment, while the company's long-term outlook remains favorable, the analyst tells investors in a research note.",https://thefly.com/permalinks/entry.php/id4038951/AZO-AutoZone-price-target-raised-by--at-TD-Cowen-heres-why
AZO,2024-12-12 12:01:11,"AutoZone Q1 Earnings Miss Expectations, Revenues Rise Y/Y",https://images.financialmodelingprep.com/news/autozone-q1-earnings-miss-expectations-revenues-rise-yy-20241212.jpg,zacks.com,AZO's first-quarter fiscal 2025 earnings and revenues miss the Zacks Consensus Estimate.,https://www.zacks.com/stock/news/2382887/autozone-q1-earnings-miss-expectations-revenues-rise-y-y?cid=CS-STOCKNEWSAPI-FT-analyst_blog|earnings_article-2382887
AZO,2024-12-12 07:15:07,AutoZone Stock Stays in the Zone for Buy-and-Hold Investors,https://images.financialmodelingprep.com/news/autozone-stock-stays-in-the-zone-for-buyandhold-investors-20241212.jpg,marketbeat.com,"AutoZone NYSE: AZO faces headwinds in 2024, but its FQ1 2025/CQ3 2024 results prove why it is a high-caliber buy-and-hold stock. The company sustains growth in difficult times, maintains margin, provides robust cash flow, and pays its shareholders to own it.",https://www.marketbeat.com/originals/autozone-stock-stays-in-the-zone-for-buy-and-hold-investors/
AZO,2024-12-11 13:20:47,AutoZone: Strong Dollar Creates Temporary Headwind (Rating Downgrade),https://images.financialmodelingprep.com/news/autozone-strong-dollar-creates-temporary-headwind-rating-downgrade-20241211.jpg,seekingalpha.com,"AutoZone's strong share repurchase program and steady growth support its long-term investment appeal despite recent earnings misses and currency headwinds. AutoZone's balance sheet remains healthy with manageable debt levels, but rising interest expenses and operating costs are concerns. Future growth hinges on international expansion, which could be affected by a strong dollar and potential tariffs.",https://seekingalpha.com/article/4743645-autozone-strong-dollar-creates-temporary-headwind-downgrade
AZO,2024-12-10 14:11:52,"AutoZone, Inc. (AZO) Q1 2025 Earnings Call Transcript",https://images.financialmodelingprep.com/news/autozone-inc-azo-q1-2025-earnings-call-transcript-20241210.jpg,seekingalpha.com,"AutoZone, Inc. (NYSE:AZO ) Q1 2025 Earnings Conference Call December 10, 2024 10:00 AM ET Company Participants Brian Campbell - VP, Treasurer, IR and Tax Phil Daniele - CEO Jamere Jackson - CFO Conference Call Participants Bret Jordan - Jefferies Simeon Gutman - Morgan Stanley Mark Jordan - Goldman Sachs Michael Lasser - UBS Chris Horvers - JPMorgan Steven Forbes - Guggenheim Securities Steven Zaccone - Citi Scot Ciccarelli - Truist David Bellinger - Mizuho Securities Greg Melich - Evercore Scott Stember - ROTH MKM Operator Good day, everyone. Welcome to AutoZone's 2025 Q1 Earnings Release Conference Call.",https://seekingalpha.com/article/4743392-autozone-inc-azo-q1-2025-earnings-call-transcript
AZO,2024-12-10 14:00:50,S&P 500 Edges Lower; AutoZone Posts Downbeat Earnings,https://images.financialmodelingprep.com/news/sp-500-edges-lower-autozone-posts-downbeat-earnings-20241210.jpg,benzinga.com,"U.S. stocks traded mixed toward the end of trading, with the S&P 500 falling by around 0.1% on Tuesday.",https://www.benzinga.com/news/earnings/24/12/42421738/s-autozone-posts-downbeat-earnings
AZO,2024-12-10 12:11:03,AutoZone: Stick With This Winning Compounder,https://images.financialmodelingprep.com/news/autozone-stick-with-this-winning-compounder-20241210.jpg,seekingalpha.com,"AutoZone remains a favorite long-term holding due to its consistent growth, international expansion, and robust buyback program enhancing shareholder value. Despite a rare double-line earnings miss in fiscal Q1, AutoZone's comparable sales and gross margins are still growing, with international comps surging 13.7%. The company's aggressive share repurchase program has significantly boosted EPS, with $1.7 billion remaining under current authorization, ensuring continued shareholder returns.",https://seekingalpha.com/article/4743337-autozone-stick-with-this-winning-compounder
AZO,2024-12-10 10:30:31,Here's What Key Metrics Tell Us About AutoZone (AZO) Q1 Earnings,https://images.financialmodelingprep.com/news/heres-what-key-metrics-tell-us-about-autozone-azo-20241210.jpg,zacks.com,"The headline numbers for AutoZone (AZO) give insight into how the company performed in the quarter ended November 2024, but it may be worthwhile to compare some of its key metrics to Wall Street estimates and the year-ago actuals.",https://www.zacks.com/stock/news/2381483/here-s-what-key-metrics-tell-us-about-autozone-azo-q1-earnings?cid=CS-STOCKNEWSAPI-FT-fundamental_analysis|nfm-2381483
AZO,2024-12-10 10:30:30,Brokers Suggest Investing in AutoZone (AZO): Read This Before Placing a Bet,https://images.financialmodelingprep.com/news/brokers-suggest-investing-in-autozone-azo-read-this-before-20241210.jpg,zacks.com,"When deciding whether to buy, sell, or hold a stock, investors often rely on analyst recommendations. Media reports about rating changes by these brokerage-firm-employed (or sell-side) analysts often influence a stock's price, but are they really important?",https://www.zacks.com/stock/news/2381480/brokers-suggest-investing-in-autozone-azo-read-this-before-placing-a-bet?cid=CS-STOCKNEWSAPI-FT-fundamental_analysis|average_broker_rating-2381480
AZO,2024-12-10 09:05:12,AutoZone (AZO) Misses Q1 Earnings and Revenue Estimates,https://images.financialmodelingprep.com/news/autozone-azo-misses-q1-earnings-and-revenue-estimates-20241210.jpg,zacks.com,"AutoZone (AZO) came out with quarterly earnings of $32.52 per share, missing the Zacks Consensus Estimate of $33.54 per share. This compares to earnings of $32.55 per share a year ago.",https://www.zacks.com/stock/news/2381334/autozone-azo-misses-q1-earnings-and-revenue-estimates?cid=CS-STOCKNEWSAPI-FT-tale_of_the_tape|yseop_template_4-2381334
AZO,2024-12-10 08:55:40,AutoZone Q1 Results Fall Short of Estimates Despite Growing Sales,https://images.financialmodelingprep.com/news/autozone-q1-results-fall-short-of-estimates-despite-growing-20241210.jpg,investopedia.com,"AutoZone (AZO) posted first-quarter results that narrowly missed estimates Tuesday morning, but Chief Executive Officer (CEO) Phil Daniele said the auto parts retailer remains ""well positioned for growth"" heading into the rest of fiscal 2025.",https://www.investopedia.com/autozone-q1-results-fall-short-of-estimates-despite-growing-sales-8758722
AZO,2024-12-10 08:26:07,"AutoZone misses first-quarter profit, revenue estimates",https://images.financialmodelingprep.com/news/autozone-misses-firstquarter-profit-revenue-estimates-20241210.jpg,reuters.com,"Automotive parts retailer AutoZone missed estimates for first-quarter profit and revenue on Tuesday, hurt by higher raw material prices and a stronger dollar.",https://www.reuters.com/business/autos-transportation/autozone-misses-first-quarter-profit-revenue-estimates-2024-12-10/
AZO,2024-12-10 08:07:00,AutoZone Posts Earnings and Sales Miss,https://images.financialmodelingprep.com/news/autozone-posts-earnings-and-sales-miss-20241210.jpg,barrons.com,"The auto aftermarket retailer reports net income for its fiscal first quarter of $564.9 million, down from $593.5 million a year prior.",https://www.barrons.com/articles/autozone-earnings-stock-price-5927a287
AZO,2024-12-10 06:55:00,AutoZone 1st Quarter Total Company Same Store Sales Increase 1.8%; Domestic Same Store Sales Increase 0.3%; 1st Quarter EPS of $32.52,https://images.financialmodelingprep.com/news/autozone-1st-quarter-total-company-same-store-sales-increase-20241210.jpg,globenewswire.com,"MEMPHIS, Tenn., Dec. 10, 2024 (GLOBE NEWSWIRE) -- AutoZone, Inc. (NYSE: AZO) today reported net sales of $4.3 billion for its first quarter (12 weeks) ended November 23, 2024, an increase of 2.1% from the first quarter of fiscal 2024 (12 weeks). Same store sales, or sales for our domestic and international stores open at least one year, are as follows:",https://www.globenewswire.com/news-release/2024/12/10/2994347/3935/en/AutoZone-1st-Quarter-Total-Company-Same-Store-Sales-Increase-1-8-Domestic-Same-Store-Sales-Increase-0-3-1st-Quarter-EPS-of-32-52.html
AZO,2024-12-10 00:14:08,AutoZone Gears Up For Q1 Print; Here Are The Recent Forecast Changes From Wall Street's Most Accurate Analysts,https://images.financialmodelingprep.com/news/autozone-gears-up-for-q1-print-here-are-the-20241210.jpg,benzinga.com,"AutoZone, Inc. AZO will release its first quarter results before the opening bell on Tuesday, Dec. 10.",https://www.benzinga.com/24/12/42405219/autozone-gears-up-for-q1-print-here-are-the-recent-forecast-changes-from-wall-streets-most-accurate-analysts
AZO,2024-12-06 10:17:13,Insights Into AutoZone (AZO) Q1: Wall Street Projections for Key Metrics,https://images.financialmodelingprep.com/news/insights-into-autozone-azo-q1-wall-street-projections-for-key-20241206.jpg,zacks.com,"Evaluate the expected performance of AutoZone (AZO) for the quarter ended November 2024, looking beyond the conventional Wall Street top-and-bottom-line estimates and examining some of its key metrics for better insight.",https://www.zacks.com/stock/news/2380133/insights-into-autozone-azo-q1-wall-street-projections-for-key-metrics?cid=CS-STOCKNEWSAPI-FT-fundamental_analysis|nfm_preview-2380133
AZO,2024-12-03 16:30:00,"AutoZone to hold Stockholders' Meeting December 18, 2024",https://images.financialmodelingprep.com/news/autozone-to-hold-stockholders-meeting-december-18-2024-20241203.jpg,globenewswire.com,"MEMPHIS, Tenn., Dec. 03, 2024 (GLOBE NEWSWIRE) -- AutoZone, Inc. (NYSE:AZO) announced it will hold its Annual Meeting of Stockholders on Wednesday, December 18, 2024, at the J.R. Hyde III Store Support Center in Memphis, Tennessee. The meeting will begin at 9:00 a.m. (ET). Additionally, this event will be webcast and can be accessed at AutoZone's website at www.autozone.com and by clicking on Investor Relations.",https://www.globenewswire.com/news-release/2024/12/03/2991089/3935/en/AutoZone-to-hold-Stockholders-Meeting-December-18-2024.html
AZO,2024-12-02 18:51:19,AutoZone (AZO) Surpasses Market Returns: Some Facts Worth Knowing,https://images.financialmodelingprep.com/news/autozone-azo-surpasses-market-returns-some-facts-worth-knowing-20241202.jpg,zacks.com,"AutoZone (AZO) concluded the recent trading session at $3,179.52, signifying a +0.31% move from its prior day's close.",https://www.zacks.com/stock/news/2377941/autozone-azo-surpasses-market-returns-some-facts-worth-knowing?cid=CS-STOCKNEWSAPI-FT-tale_of_the_tape|yseop_template_6v1-2377941
AZO,2024-11-27 10:06:34,"Investors Heavily Search AutoZone, Inc. (AZO): Here is What You Need to Know",https://images.financialmodelingprep.com/news/investors-heavily-search-autozone-inc-azo-here-is-what-you-20241127.jpg,zacks.com,"Zacks.com users have recently been watching AutoZone (AZO) quite a bit. Thus, it is worth knowing the facts that could determine the stock's prospects.",https://www.zacks.com/stock/news/2375903/investors-heavily-search-autozone-inc-azo-here-is-what-you-need-to-know?cid=CS-STOCKNEWSAPI-FT-tale_of_the_tape|most_searched_stocks_v1-2375903
AZO,2024-11-25 18:50:20,Why AutoZone (AZO) Outpaced the Stock Market Today,https://images.financialmodelingprep.com/news/why-autozone-azo-outpaced-the-stock-market-today-20241125.jpg,zacks.com,"In the latest trading session, AutoZone (AZO) closed at $3,109.56, marking a +0.33% move from the previous day.",https://www.zacks.com/stock/news/2375003/why-autozone-azo-outpaced-the-stock-market-today?cid=CS-STOCKNEWSAPI-FT-tale_of_the_tape|yseop_template_6v1-2375003
AZO,2024-11-19 16:30:00,"AutoZone to Release First Quarter Fiscal 2025 Earnings December 10, 2024",https://images.financialmodelingprep.com/news/autozone-to-release-first-quarter-fiscal-2025-earnings-december-20241119.jpg,globenewswire.com,"MEMPHIS, Tenn., Nov. 19, 2024 (GLOBE NEWSWIRE) -- AutoZone, Inc. (NYSE: AZO), the leading retailer and distributor of automotive replacement parts and accessories in the Americas, will release results for its first quarter ended Saturday, November 23, 2024, before market open on Tuesday, December 10, 2024. Additionally, the Company will host a one-hour conference call on Tuesday, December 10, 2024, beginning at 10:00 a.m. (ET), to discuss the results of the quarter. This call is being webcast and can be accessed, along with supporting slides, at AutoZone's website at www.autozone.com and clicking on Investor Relations. Investors may also listen to the call by dialing (888) 506-0062, passcode 205511. In addition, a telephone replay will be available by dialing (877) 481-4010, replay passcode 51442 through December 24, 2024.",https://www.globenewswire.com/news-release/2024/11/19/2984053/3935/en/AutoZone-to-Release-First-Quarter-Fiscal-2025-Earnings-December-10-2024.html
AZO,2024-11-19 10:16:18,2 Auto Parts Retailers Better Equipped to Navigate Industry Woes,https://images.financialmodelingprep.com/news/2-auto-parts-retailers-better-equipped-to-navigate-industry-20241119.jpg,zacks.com,"Although the Zacks Auto Retail Parts industry is currently ranked unfavorably, stocks like ORLY and AZO are worth watching.",https://www.zacks.com/commentary/2371960/2-auto-parts-retailers-better-equipped-to-navigate-industry-woes?cid=CS-STOCKNEWSAPI-FT-industry_outlook-2371960
AZO,2024-11-18 18:50:28,AutoZone (AZO) Laps the Stock Market: Here's Why,https://images.financialmodelingprep.com/news/autozone-azo-laps-the-stock-market-heres-why-20241118.jpg,zacks.com,"The latest trading day saw AutoZone (AZO) settling at $3,166.93, representing a +1.91% change from its previous close.",https://www.zacks.com/stock/news/2371807/autozone-azo-laps-the-stock-market-here-s-why?cid=CS-STOCKNEWSAPI-FT-tale_of_the_tape|yseop_template_6v1-2371807
AZO,2024-11-15 10:30:38,Wall Street Bulls Look Optimistic About AutoZone (AZO): Should You Buy?,https://images.financialmodelingprep.com/news/wall-street-bulls-look-optimistic-about-autozone-azo-should-20241115.jpg,zacks.com,"Investors often turn to recommendations made by Wall Street analysts before making a Buy, Sell, or Hold decision about a stock. While media reports about rating changes by these brokerage-firm employed (or sell-side) analysts often affect a stock's price, do they really matter?",https://www.zacks.com/stock/news/2370988/wall-street-bulls-look-optimistic-about-autozone-azo-should-you-buy?cid=CS-STOCKNEWSAPI-FT-fundamental_analysis|average_broker_rating-2370988
AZO,2024-11-15 10:01:13,"Here is What to Know Beyond Why AutoZone, Inc. (AZO) is a Trending Stock",https://images.financialmodelingprep.com/news/here-is-what-to-know-beyond-why-autozone-inc-20241115.jpg,zacks.com,"Zacks.com users have recently been watching AutoZone (AZO) quite a bit. Thus, it is worth knowing the facts that could determine the stock's prospects.",https://www.zacks.com/stock/news/2370926/here-is-what-to-know-beyond-why-autozone-inc-azo-is-a-trending-stock?cid=CS-STOCKNEWSAPI-FT-tale_of_the_tape|most_searched_stocks_v1-2370926
AZO,2024-11-14 07:46:09,Tariff Troubles: 3 Stocks Planning Higher Prices,https://images.financialmodelingprep.com/news/tariff-troubles-3-stocks-planning-higher-prices-20241114.jpg,marketbeat.com,The current tariff discussion is amusing in the sense of how quickly everyone's become an economist. Much of that is noise.,https://www.marketbeat.com/stock-ideas/tariff-troubles-3-stocks-planning-higher-prices/
AZO,2024-11-12 18:51:09,AutoZone (AZO) Advances While Market Declines: Some Information for Investors,https://images.financialmodelingprep.com/news/autozone-azo-advances-while-market-declines-some-information-for-20241112.jpg,zacks.com,"AutoZone (AZO) closed at $3,175.72 in the latest trading session, marking a +0.07% move from the prior day.",https://www.zacks.com/stock/news/2369258/autozone-azo-advances-while-market-declines-some-information-for-investors?cid=CS-STOCKNEWSAPI-FT-tale_of_the_tape|yseop_template_6v1-2369258
AZO,2024-11-07 08:56:19,2 Big Stocks Splits We Could See in November,https://images.financialmodelingprep.com/news/2-big-stocks-splits-we-could-see-in-november-20241107.jpg,247wallst.com,"We're only a few days into November, and what a month it's been thus far. We have a new president, the market has gone berserk, and most investor attention is being placed on companies that may benefit from the new geopolitical dynamics we could have on our hands for the next four years.",https://247wallst.com/investing/2024/11/07/2-big-stocks-splits-we-could-see-in-november/
