symbol,publishedDate,title,image,site,text,url
BBY,2025-02-14 08:45:23,Watch These 3 Stocks—High Short Interest and Big Upside Potential,https://images.financialmodelingprep.com/news/watch-these-3-stockshigh-short-interest-and-big-upside-20250214.jpg,marketbeat.com,"There comes a time every once in a cycle when the market gets too invested in either a bullish or bearish view, and just like any other physical marketplace, the stock market can then trigger a major shift to the opposite end of this concentrated view. Investors can imagine the bottlenecks and mania that would be caused by this shift, which is why keeping track of sentiment gauges is so important.",https://www.marketbeat.com/stock-ideas/watch-these-3-stockshigh-short-interest-and-big-upside-potential/
BBY,2025-02-13 07:02:00,Strayer University Partners with Best Buy to Expand Education Benefits to All U.S. Employees,https://images.financialmodelingprep.com/news/strayer-university-partners-with-best-buy-to-expand-education-20250213.jpg,businesswire.com,WASHINGTON--(BUSINESS WIRE)--Best Buy announced an expansion of its education benefits relationship with Strayer University.,https://www.businesswire.com/news/home/20250213631902/en/Strayer-University-Partners-with-Best-Buy-to-Expand-Education-Benefits-to-All-U.S.-Employees/
BBY,2025-02-10 09:00:00,KIA EV9 AND TELLURIDE NAMED 2025 KELLEY BLUE BOOK BEST BUY AWARD WINNERS,https://images.financialmodelingprep.com/news/kia-ev9-and-telluride-named-2025-kelley-blue-book-20250210.jpg,prnewswire.com,"Kia EV9 named ""Best 3-Row Electric Vehicle"" for the second consecutive year Kia Telluride recognized as the ""Best Midsize SUV"" for sixth straight year – setting a KBB record for the most wins in this category by the same model IRVINE, Calif. , Feb. 10, 2025 /PRNewswire/ -- Two Kia SUVs are once again the recipients of Kelley Blue Book Best Buy Awards.",https://www.prnewswire.com/news-releases/kia-ev9-and-telluride-named-2025-kelley-blue-book-best-buy-award-winners-302371724.html
BBY,2025-02-05 18:09:56,Western Springs Scam Starts At Best Buy: Cops,https://images.financialmodelingprep.com/news/western-springs-scam-starts-at-best-buy-cops-20250205.jpg,https://www.patch.com,"WESTERN SPRINGS, IL – A Western Springs woman who lost $100,000 to $200,000 in a scam told officers it all started with a Best Buy employee, police said. Patch obtained the police report through a public records request. Two years ago, the 70-year-old victim, who lives in the 100 block of 51st Place, bought a laptop from Best Buy in Countryside, according to the report. An unidentified employee then gave the woman the name and number of a person whom the employee claimed was a cybersecurity professional who could help set up the computer, police said. Through phone calls and emails, the person convinced the woman to send multiple checks through certified mail to obtain various security services and programs, the report said. She sent the checks every other month, starting in September 2022 and ending in November 2024, police said. She mailed three checks at a time, with each check made out for between $2,000 and $4,000, police said. The checks were sent to addresses in North Hollywood and Tarzana, California. The woman and family members have made her bank, Chase Bank, aware of the scam. Police said they would send officers to patrol near her house, given that she gave her address to the scammer. The woman reported the scam to police last month.",https://www.patch.com/illinois/westernsprings/western-springs-scam-starts-best-buy-cops
BBY,2025-02-05 14:01:26,Can BBY's Strong Digital Offerings Support Its High P/E of 13.74X?,https://images.financialmodelingprep.com/news/can-bbys-strong-digital-offerings-support-its-high-pe-20250205.jpg,zacks.com,"Best Buy's digital and omnichannel strategy, along with its focus on innovative store formats and premium products, positions it well for long-term growth.",https://www.zacks.com/stock/news/2410407/can-bby-s-strong-digital-offerings-support-its-high-p-e-of-13-74x?cid=CS-STOCKNEWSAPI-FT-analyst_blog|rank_focused-2410407
BBY,2025-01-29 09:51:24,Why Investors Need to Take Advantage of These 2 Retail and Wholesale Stocks Now,https://images.financialmodelingprep.com/news/why-investors-need-to-take-advantage-of-these-2-retail-20250129.jpg,zacks.com,Why investors should use the Zacks Earnings ESP tool to help find stocks that are poised to top quarterly earnings estimates.,https://www.zacks.com/stock/news/2405348/why-investors-need-to-take-advantage-of-these-2-retail-and-wholesale-stocks-now?cid=CS-STOCKNEWSAPI-FT-tale_of_the_tape|zacks_education_earnings_esp-2405348
BBY,2025-01-22 07:00:00,Best Buy's Dividend Is a Bargain With Double-Digit Upside,https://images.financialmodelingprep.com/news/best-buys-dividend-is-a-bargain-with-doubledigit-upside-20250122.jpg,marketbeat.com,"The stock market, as legendary investors from John M. Keynes to Warren Buffett have said, is a popularity contest in the short term that then turns into an intellectual contest in the long term.",https://www.marketbeat.com/stock-ideas/best-buys-dividend-is-a-bargain-with-double-digit-upside/
BBY,2025-01-20 16:12:58,JPMorgan Analyst Focus List Includes 5 of Our Favorite High-Yield Dividend Giants,https://images.financialmodelingprep.com/news/jpmorgan-analyst-focus-list-includes-5-of-our-favorite-20250120.jpg,247wallst.com,"Investors love dividend stocks, especially the high-yield variety, because they offer a significant income stream and have massive total return potential.",https://247wallst.com/investing/2025/01/20/jpmorgan-analyst-focus-list-includes-5-of-our-favorite-high-yield-dividend-giants/
BBY,2025-01-16 21:50:20,Best Buy to Launch Third-Party Marketplace Powered by Mirakl,https://images.financialmodelingprep.com/news/best-buy-to-launch-thirdparty-marketplace-powered-by-mirakl-20250116.jpg,pymnts.com,"Best Buy is preparing to launch a digital marketplace platform that will allow third-party sellers to integrate their products into the retailer's website and app. The new Best Buy Marketplace will launch this summer, the company said in a Thursday (Jan. 16) announcement.",https://www.pymnts.com/news/ecommerce/2025/best-buy-to-launch-third-party-marketplace-powered-by-mirakl/
BBY,2025-01-11 07:25:45,3 Ideal Buys From 51 'Safer' Dividends In 100 January Barron's Sustainable Dogs,https://images.financialmodelingprep.com/news/3-ideal-buys-from-51-safer-dividends-in-100-20250111.jpg,seekingalpha.com,"Calvert Research and Management's annual review identified the top 100 sustainable companies based on over 230 ESG performance indicators, including workplace diversity and greenhouse-gas emissions. Eight dividend-paying sustainable companies offer annual dividends from a $1K investment exceeding their single share prices, signaling potential buy opportunities. Analysts forecast net gains of 27.62% to 59.85% for top ESG companies by January 2026, with Regions Financial leading at an estimated 59.84%.",https://seekingalpha.com/article/4748893-3-ideal-buys-from-51-safer-dividends-100-january-barrons-sustainable-dogs
BBY,2025-01-09 06:28:20,Buy 6 'Safer' Dividend Dogs Of 23 January Barron's Better Bets Than T-Bills,https://images.financialmodelingprep.com/news/buy-6-safer-dividend-dogs-of-23-january-barrons-20250109.jpg,seekingalpha.com,"Seven of the ten lowest-priced BBB Dogs, including Altria, Pfizer, and Verizon, are ready to buy, with dividends from $1K invested exceeding single share prices. Analysts project 16.27% to 32.98% net gains by January 2026 for the top-ten BBB Dogs, with LyondellBasell leading at 32.98%. Six of the top ten BBB Dogs are ideally priced, with dividends from $1K invested exceeding single share prices, meeting the dogcatcher ideal.",https://seekingalpha.com/article/4748465-buy-6-safer-dividend-dogs-of-23-january-barrons-better-bets-than-t-bills
BBY,2024-12-23 13:21:14,Best Buy Stock Slips 8% in a Month: Solid Bargain or Risky Bet?,https://images.financialmodelingprep.com/news/best-buy-stock-slips-8-in-a-month-solid-20241223.jpg,zacks.com,The persistent slide in comparable sales underscores BBY's difficulties in stabilizing its top line amid growing competition and cautious consumer spending.,https://www.zacks.com/stock/news/2387075/best-buy-stock-slips-8-in-a-month-solid-bargain-or-risky-bet?cid=CS-STOCKNEWSAPI-FT-analyst_blog|most_popular_stocks-2387075
BBY,2024-12-18 10:17:58,Cramer's Stop Trading: Best Buy,https://images.financialmodelingprep.com/news/cramers-stop-trading-best-buy-20241218.jpg,youtube.com,CNBC's Jim Cramer explains why he is keeping an eye on shares of Best Buy.,https://www.youtube.com/watch?v=G0E55SRk1oc
BBY,2024-12-17 09:00:00,Best Buy Ads Canada Partners with Rokt to Deliver Highly Relevant Customer Experiences for the Holidays and Beyond,https://images.financialmodelingprep.com/news/best-buy-ads-canada-partners-with-rokt-to-deliver-20241217.jpg,prnewswire.com,"Partnership Enables Best Buy Ads Canada to Drive Engagement and Loyalty NEW YORK , Dec. 17, 2024 /PRNewswire/ -- Rokt, the leading ecommerce technology company using machine learning and AI to make transactions more relevant to each shopper, today announced it has partnered with Best Buy Ads Canada ahead of the holiday season to deliver curated transaction experiences to the company's online customers. Best Buy Ads Canada will use Rokt's technology to power highly relevant messages from third-party brands, whose products and services the company does not directly sell itself, on the confirmation page of the BestBuy.ca ecommerce site.",https://www.prnewswire.com/news-releases/best-buy-ads-canada-partners-with-rokt-to-deliver-highly-relevant-customer-experiences-for-the-holidays-and-beyond-302333306.html
BBY,2024-12-17 08:30:30,3 Stocks to Gain From Stockpiling Effects of the Trump Tariffs,https://images.financialmodelingprep.com/news/3-stocks-to-gain-from-stockpiling-effects-of-the-20241217.jpg,marketbeat.com,"President Trump has stated his intention to place import tariffs on all goods made outside of the United States, supporting his America First initiative. He wants to galvanize the nation's manufacturing industry, which is a boon to factory workers.",https://www.marketbeat.com/stock-ideas/3-stocks-to-gain-from-stockpiling-effects-of-the-trump-tariffs/
BBY,2024-12-12 07:35:06,2 Ideal Buys From 50 'Safer' Dividends In 100 December Sustainables,https://images.financialmodelingprep.com/news/2-ideal-buys-from-50-safer-dividends-in-100-20241212.jpg,seekingalpha.com,"Calvert Research and Management ranked the 1,000 largest publicly traded companies by ESG performance, identifying the top 100 sustainable companies for 2024. Among 78 dividend paying sustainable companies, 8 met the Dogcatcher ideal, with annual dividends from a $1K investment exceeding their single share prices. Analysts estimate net gains of 15.68% to 48.08% for the top ten ESG companies by December 2025.",https://seekingalpha.com/article/4743832-2-ideal-buys-from-50-safer-dividends-100-december-sustainables
BBY,2024-12-11 07:31:35,Overblown Holiday Worries? 3 Stocks Set for a Surprise Comeback,https://images.financialmodelingprep.com/news/overblown-holiday-worries-3-stocks-set-for-a-surprise-20241211.jpg,marketbeat.com,"The holiday shopping season is the time of the year for retailers in the consumer discretionary sector to get in the black. While some retailers like RH NYSE: RH and Williams-Sonoma Inc. NYSE: WSM are the “haves” and are expected to have a strong holiday season, many retailers are the “have nots” and already presumed to have weak results.",https://www.marketbeat.com/stock-ideas/overblown-holiday-worries-3-stocks-set-for-a-surprise-comeback/
BBY,2024-12-11 07:00:49,Why Has Best Buy Stock Lifted 12% Amid Sluggish Sales?,https://images.financialmodelingprep.com/news/why-has-best-buy-stock-lifted-12-amid-sluggish-20241211.jpg,forbes.com,"Best Buy's stock (NYSE: BBY), an electronics specialty retailer, has increased 12% from around $78 to $87 (as of Dec 9, after close) year-to-date, underperforming the broader indices, with the S&P growing about 28% over the same period. At the same time, a tough comparison with the pandemic, stimulus-induced growth, and inflationary headwinds have hurt the consumer electronics retailing niche.",https://www.forbes.com/sites/greatspeculations/2024/12/11/why-has-best-buy-stock-lifted-12-amid-sluggish-sales/
BBY,2024-12-09 07:30:08,Here's Why Best Buy Stock Could Be a Gift for Investors in 2025,https://images.financialmodelingprep.com/news/heres-why-best-buy-stock-could-be-a-gift-20241209.jpg,marketbeat.com,"Best Buy Co. Inc. NYSE: BBY gave investors a lump of coal to kick off the holiday season. On November 26, the retailer delivered its third-quarter earnings report for its 2025 fiscal year.",https://www.marketbeat.com/stock-ideas/heres-why-best-buy-stock-could-be-a-gift-for-investors-in-2025/
BBY,2024-12-07 09:40:34,Buy 3 December Barron's Better Bet 'Safer' Dividend Dogs Of 23,https://images.financialmodelingprep.com/news/buy-3-december-barrons-better-bet-safer-dividend-dogs-20241207.jpg,seekingalpha.com,"Long-term bond yields continue to rise. But investors looking for income can still find plenty of attractive opportunities with dividend-paying stocks that have healthy yields. “23 stocks pay huge dividends. They should be a better bet than treasuries.” —Barron's Weekly. In an interview, Steven Wieting, strategist at Citi-Wealth, noted that a growing-dividend is a tangible-benefit for shareholders and a-hallmark-of companies with strong-balance-sheets. “Nobody can fake a dividend,” he said.",https://seekingalpha.com/article/4742815-buy-3-december-barrons-better-bet-safer-dividend-dogs-of-23
BBY,2024-12-06 10:39:40,"Walmart, Amazon holiday spending rise as Target, Best Buy stumble - data",https://images.financialmodelingprep.com/news/walmart-amazon-holiday-spending-rise-as-target-best-buy-20241206.jpg,reuters.com,"Walmart Inc , Amazon.com and fast-growing e-commerce sites Shein and PDD Holding's Temu saw record-breaking sales on Black Friday and Cyber Monday, according to spending data, suggesting that they may finish the holiday season on a much stronger note than Target and Best Buy , which struggled.",https://www.reuters.com/business/retail-consumer/walmart-amazon-holiday-spending-rise-target-best-buy-stumble-data-2024-12-06/
BBY,2024-12-02 14:01:10,Holiday Shopping Growth Slows: Stocks & ETFs to Gain,https://images.financialmodelingprep.com/news/holiday-shopping-growth-slows-stocks-etfs-to-gain-20241202.jpg,zacks.com,"Holiday shopping season sales this year are expected to grow at the slowest pace in six years, per NRF, as quoted on Reuters.",https://www.zacks.com/stock/news/2377701/holiday-shopping-growth-slows-stocks-etfs-to-gain?cid=CS-STOCKNEWSAPI-FT-etf_news_and_commentary-2377701
BBY,2024-12-02 12:00:10,Trump Tax Reforms: 7 Stocks That Could Benefit in 2025,https://images.financialmodelingprep.com/news/trump-tax-reforms-7-stocks-that-could-benefit-in-20241202.jpg,marketbeat.com,The returning Trump administration will seek more tax reforms pending approval from Congress. They plan on making the 2017 Trump tax cuts permanent and even lower some rates.,https://www.marketbeat.com/stock-ideas/trump-tax-reforms-7-stocks-that-could-benefit-in-2025/
BBY,2024-12-02 10:31:13,Stocks & ETFs in Focus on Cyber Monday,https://images.financialmodelingprep.com/news/stocks-etfs-in-focus-on-cyber-monday-20241202.jpg,zacks.com,"Cyber Monday online sales are expected to top Black Friday with a record-breaking $13.2 billion, up 6.1% from last year.",https://www.zacks.com/stock/news/2377575/stocks-etfs-in-focus-on-cyber-monday?cid=CS-STOCKNEWSAPI-FT-etf_news_and_commentary-2377575
BBY,2024-11-29 07:30:01,"As retailers enter the holiday shopping season, the winners are pulling away from the pack",https://images.financialmodelingprep.com/news/as-retailers-enter-the-holiday-shopping-season-the-winners-are-20241129.jpg,cnbc.com,"Retailers' earnings reports over the past two weeks have illustrated a sharp divide between brands that are winning sales and those that are missing out. Target, Kohl's and Best Buy each reported disappointing results, but Walmart, Dick's Sporting Goods and Abercrombie & Fitch posted strong sales in their most recent quarters.",https://www.cnbc.com/2024/11/29/holiday-shopping-retail-winners-losers.html
BBY,2024-11-27 12:49:41,Best Buy: Q3 Disappointment As Macro Headwinds Overcome Cost-Cutting Efforts,https://images.financialmodelingprep.com/news/best-buy-q3-disappointment-as-macro-headwinds-overcome-costcutting-20241127.jpg,seekingalpha.com,"Best Buy's Q3 results missed revenue and EPS targets, with comparable sales growth at -2.9% and disappointing Q4 guidance, leading to a 7% decline Tuesday morning. The challenging macroeconomic environment, election distractions, and uncompetitive business model against Walmart and Amazon are significant headwinds for Best Buy. I remain bearish on BBY, expecting continued sales decline, potential dividend cuts, and store closures due to weak consumer demand and macroeconomic pressures.",https://seekingalpha.com/article/4740732-best-buy-q3-disappointment-as-macro-headwinds-overcome-cost-cutting-efforts
BBY,2024-11-27 10:16:29,"Best Buy: With Weaker Spending, It's Best To Get Out Of This Stock (Rating Downgrade)",https://images.financialmodelingprep.com/news/best-buy-with-weaker-spending-its-best-to-get-out-20241127.jpg,seekingalpha.com,"Best Buy's Q3 results show a decline in sales, with a -3.2% y/y revenue drop and weaker-than-expected comparable sales, signaling near-term weakness. E-commerce pressure, declining same-store sales, and an unsustainable dividend raise concerns about Best Buy's long-term viability and profitability. Best Buy's heavy promotional spending to drive sales may cut into margins, especially with a more deal-oriented consumer base.",https://seekingalpha.com/article/4740676-best-buy-with-weaker-spending-its-best-to-get-out-of-this-stock-rating-downgrade
BBY,2024-11-27 08:00:00,Best Buy Announces Regular Quarterly Cash Dividend,https://images.financialmodelingprep.com/news/best-buy-announces-regular-quarterly-cash-dividend-20241127.jpg,businesswire.com,"MINNEAPOLIS--(BUSINESS WIRE)--The Board of Directors of Best Buy Co., Inc. (NYSE:BBY) has authorized the payment of a regular quarterly cash dividend of $0.94 per common share. The quarterly dividend is payable on January 7, 2025, to shareholders of record as of the close of business on December 17, 2024. The company had 213,764,409 shares of common stock issued and outstanding as of November 2, 2024.",https://www.businesswire.com/news/home/20241126903983/en/Best-Buy-Announces-Regular-Quarterly-Cash-Dividend/
BBY,2024-11-27 02:14:37,"Dow, S&P 500 Settle At Record Highs, Best Buy Reports Weaker Than Expected Earnings: Fear Index Remains In 'Greed' Zone",https://images.financialmodelingprep.com/news/dow-sp-500-settle-at-record-highs-best-buy-reports-20241127.jpg,benzinga.com,"The CNN Money Fear and Greed index showed a slight improvement in the overall market sentiment, while the index remained in the “Greed” zone on Tuesday.",https://www.benzinga.com/news/earnings/24/11/42207507/dow-sp-500-settle-at-record-highs-fear-greed-index-remains-in-greed-zone
BBY,2024-11-26 19:41:14,"Best Buy's Q3 Earnings Miss Estimates, Comparable Sales Dip 2.9% Y/Y",https://images.financialmodelingprep.com/news/best-buys-q3-earnings-miss-estimates-comparable-sales-dip-20241126.jpg,zacks.com,BBY reports soft third-quarter fiscal 2025 results. Enterprise comparable sales drop 2.9% year over year.,https://www.zacks.com/stock/news/2375696/best-buy-s-q3-earnings-miss-estimates-comparable-sales-dip-2-9-y-y?cid=CS-STOCKNEWSAPI-FT-analyst_blog|earnings_article-2375696
BBY,2024-11-26 17:43:00,Best Buy Revenues Dip as Consumers Await ‘Deals and Sales',https://images.financialmodelingprep.com/news/best-buy-revenues-dip-as-consumers-await-deals-and-sales-20241126.jpg,pymnts.com,"Best Buy says cautious, deal-chasing consumers and the presidential election kept quarterly sales muted. The electronics retailer released earnings Tuesday (Nov. 26) showing a 2.9% drop in comparable sales, higher than the 1% dip forecast in the company's guidance.",https://www.pymnts.com/news/retail/2024/best-buy-revenues-dip-as-consumers-await-deals-and-sales/
BBY,2024-11-26 16:01:01,Electronics Demand at Best Buy Wanes—But People Are Still Buying Laptops,https://images.financialmodelingprep.com/news/electronics-demand-at-best-buy-wanesbut-people-are-still-20241126.jpg,investopedia.com,"Laptop demand is brisk at Best Buy, but sales are slowing for home theater equipment and other discretionary electronics.",https://www.investopedia.com/electronics-demand-best-buy-wanes-people-still-buying-laptops-8752128
BBY,2024-11-26 15:25:09,"BBY No Longer the ""Best Buy"" for Consumers?",https://images.financialmodelingprep.com/news/bby-no-longer-the-best-buy-for-consumers-20241126.jpg,youtube.com,"Best Buy (BBY) became one of the worst performers on the S&P 500 following its mixed earnings report. Seth Basham calls the report ""not very surprising"" but notes potential green shoots in the company's 2025 outlook.",https://www.youtube.com/watch?v=P17y8yb5qls
BBY,2024-11-26 12:42:27,Best Buy CEO says higher costs from tariffs would mean higher prices for shoppers,https://images.financialmodelingprep.com/news/best-buy-ceo-says-higher-costs-from-tariffs-would-20241126.jpg,businessinsider.com,"Best Buy is bracing for Trump's proposed tariffs on imports from China and Mexico. ""There's very little in the consumer electronics space that is not imported,"" CEO Corie Barry said.",https://www.businessinsider.com/best-buy-ceo-trump-tariffs-higher-prices-china-mexico-imports-2024-11
BBY,2024-11-26 12:03:14,"Best Buy Co., Inc. (BBY) Q3 2025 Earnings Call Transcript",https://images.financialmodelingprep.com/news/best-buy-co-inc-bby-q3-2025-earnings-call-20241126.jpg,seekingalpha.com,"Best Buy Co., Inc. (NYSE:BBY ) Q3 2025 Earnings Conference Call November 26, 2024 8:00 AM ET Company Participants Mollie O'Brien - Head of Investor Relations Corie Barry - Chief Executive Officer Matt Bilunas - Chief Financial Officer Jason Bonfig - Senior Executive Vice President, Customer Offerings and Fulfillment Conference Call Participants Peter Keith - Piper Sandler Scot Ciccarelli - Truist Securities Anthony Chukumba - Loop Capital Markets Steven Forbes - Guggenheim Securities Joseph Feldman - Telsey Advisory Group Karen Short - Melius Research Seth Basham - Wedbush Securities Seth Sigman - Barclays Operator Ladies and gentlemen, thank you for standing by. Welcome to Best Buy's Third Quarter Fiscal 2025 Earnings Conference Call.",https://seekingalpha.com/article/4740429-best-buy-co-inc-bby-q3-2025-earnings-call-transcript
BBY,2024-11-26 11:35:22,"Flurry of Q3 Earnings: ANF, DKS, BBY and More",https://images.financialmodelingprep.com/news/flurry-of-q3-earnings-anf-dks-bby-and-more-20241126.jpg,zacks.com,"Pre-market futures are mixed, with the Dow and the small-cap Russell 2000 -- both coming off record closing highs yesterday -- trading lower.",https://www.zacks.com/stock/news/2375453/flurry-of-q3-earnings-anf-dks-bby-and-more?cid=CS-STOCKNEWSAPI-FT-ahead_of_wall_street-2375453
BBY,2024-11-26 11:25:50,Hesitant Consumers Hurt Best Buy Results,https://images.financialmodelingprep.com/news/hesitant-consumers-hurt-best-buy-results-20241126.jpg,investopedia.com,Best Buy (BBY) shares slumped 8% Tuesday morning after the electronics retailer missed profit and sales estimates and slashed its guidance as consumers pulled back on spending ahead of the key holiday shopping season.,https://www.investopedia.com/hesitant-consumers-hurt-best-buy-results-8751976
BBY,2024-11-26 10:55:18,Best Buy Stock Is Sinking After Earnings. Here's Why,https://images.financialmodelingprep.com/news/best-buy-stock-is-sinking-after-earnings-heres-why-20241126.jpg,kiplinger.com,Best Buy is one of the worst S&P 500 stocks Tuesday after the retailer missed quarterly earnings expectations and slashed its full-year forecast.,https://www.kiplinger.com/investing/stocks/best-buy-bby-stock-is-sinking-after-earnings-heres-why
BBY,2024-11-26 10:31:27,"Compared to Estimates, Best Buy (BBY) Q3 Earnings: A Look at Key Metrics",https://images.financialmodelingprep.com/news/compared-to-estimates-best-buy-bby-q3-earnings-a-look-20241126.jpg,zacks.com,"The headline numbers for Best Buy (BBY) give insight into how the company performed in the quarter ended October 2024, but it may be worthwhile to compare some of its key metrics to Wall Street estimates and the year-ago actuals.",https://www.zacks.com/stock/news/2375313/compared-to-estimates-best-buy-bby-q3-earnings-a-look-at-key-metrics?cid=CS-STOCKNEWSAPI-FT-fundamental_analysis|nfm-2375313
BBY,2024-11-26 10:16:29,2 Retail Stocks Reacting to Quarterly Reports,https://images.financialmodelingprep.com/news/2-retail-stocks-reacting-to-quarterly-reports-20241126.jpg,schaeffersresearch.com,"Shares of Dick's Sporting Goods Inc (NYSE:DKS) and Best Buy Inc (NYSE:BBY) are in focus today, after both retail giants reported third quarter results.",https://www.schaeffersresearch.com/content/news/2024/11/26/2-retail-stocks-reacting-to-quarterly-reports
BBY,2024-11-26 09:48:18,US Stocks Mixed; Best Buy Posts Downbeat Earnings,https://images.financialmodelingprep.com/news/us-stocks-mixed-best-buy-posts-downbeat-earnings-20241126.jpg,benzinga.com,"U.S. stocks traded mixed this morning, with the Dow Jones index falling around 200 points on Tuesday.",https://www.benzinga.com/24/11/42191274/us-stocks-mixed-best-buy-posts-downbeat-earnings
