symbol,publishedDate,title,image,site,text,url
BBY,2025-03-11 11:37:09,"US tariffs fuel inflation, putting pressure on low-income households",https://images.financialmodelingprep.com/news/us-tariffs-fuel-inflation-putting-pressure-on-lowincome-households-20250311.jpg,https://invezz.com,"With inflation already weighing heavily on American families, new tariffs on imported goods are set to intensify financial strain, particularly for low-income households. The impact of these levies—targeting everyday items like clothing, electronics, and groceries—will ripple through consumer spending habits and drive up costs in sectors where affordability is already a concern.Economists from Bank of America and BNP Paribas expect the February Consumer Price Index (CPI) report to provide the first clear indications of these tariffs&#8217; effect, with further increases anticipated in the coming months. As US retailers, including Target and Best Buy, brace for higher costs, long-term inflation expectations have climbed to near 30-year highs. The burden will fall hardest on those already struggling with rising living expenses, as businesses pass higher import costs onto consumers.Low-income consumers hit hardest by rising costsFamilies with tighter budgets, who typically allocate a larger share of their income to necessities, are particularly vulnerable to these price hikes. Goods sourced from China, Mexico, and Canada—such as furniture, fresh produce, and energy supplies—are becoming more expensive, compounding financial pressures on low-income consumers who have been dealing with high inflation and borrowing costs.Retail giants have already signaled that price increases are inevitable. Target CEO Brian Cornell has warned that tariffs on key imports, such as Mexican fruits and vegetables, will make it challenging to maintain stable pricing.Walmart, the nation’s largest retailer, has also noted growing &#8220;stress behaviors&#8221; among budget-conscious shoppers, with some switching to smaller pack sizes or opting for less expensive alternatives. According to a recent report by Bloomberg, Walmart has begun negotiating with Chinese suppliers, requesting price cuts of up to 10% to mitigate the effects of tariffs. However, such efforts may not be enough to shield customers from rising costs.Inflation concerns escalate as consumer spending slowsHigher import duties are expected to act as a hidden tax on consumers, further slowing already tepid spending growth. The Federal Reserve’s latest Beige Book report has highlighted increased price sensitivity among shoppers, particularly for non-essential items.This shift in consumer behavior suggests that inflationary pressures are reshaping purchasing decisions, leading to a decline in demand for discretionary goods.David French, executive vice president of government relations at the National Retail Federation, has pointed out that these tariffs function as a &#8220;consumption tax,&#8221; disproportionately affecting lower-income families. Unlike traditional tax policies, these trade levies increase the cost of essential goods, making it harder for vulnerable households to maintain their standard of living.The economic consequences of these tariffs are particularly stark for households at the lower end of the income spectrum. Between February 2020 and June 2024, the poorest 20% of US households experienced an 8.3% faster rise in consumer prices compared to the wealthiest segment, according to the Federal Reserve Bank of Minneapolis.This divergence in inflation rates has contributed to broader economic discontent, influencing voter sentiment in the 2024 election cycle.Trump’s tariff strategyDonald Trump’s current trade policies mark a significant shift from his first-term tariff approach, which initially focused on industrial materials like steel and aluminum. This time, the measures are far more aggressive, pushing average US tariff rates to their highest levels since World War II.The latest round of levies includes a broad array of consumer goods, raising concerns about prolonged inflationary effects.Despite the financial strain on households, the White House has defended the policy, arguing that tariffs will ultimately benefit American workers and businesses. A White House spokesperson stated that the administration’s strategy aims to &#8220;raise wages, create jobs, and expand investment,&#8221; dismissing concerns about short-term price increases as a &#8220;little disturbance&#8221; that the economy can absorb.However, for many American families already facing financial hardship, the reality is far more immediate. The combination of tariffs, stagnant wages, and existing economic pressures is making it increasingly difficult for some households to afford basic necessities.As the effects of these tariffs take hold, the question remains: how will struggling consumers navigate an economy where the cost of living continues to climb?The post US tariffs fuel inflation, putting pressure on low-income households appeared first on Invezz",https://invezz.com/news/2025/03/11/us-tariffs-fuel-inflation-putting-pressure-on-low-income-households/
BBY,2025-03-10 08:00:00,Best Buy Canada Selects PingPong As Their First Cross-Border Partner To Drive International Growth on its Marketplace,https://images.financialmodelingprep.com/news/best-buy-canada-selects-pingpong-as-their-first-crossborder-20250310.jpg,prnewswire.com,"NEW YORK and VANCOUVER, BC , March 10, 2025 /PRNewswire/ -- Best Buy Canada has selected  PingPong , a world-leading provider of cross-border embedded payment solutions, to become its first cross-border payment service provider of record on its Marketplace. Leveraging PingPong's easy-to-integrate API, Best Buy Canada will begin expanding internationally and facilitate payouts to international sellers.",https://www.prnewswire.com/news-releases/best-buy-canada-selects-pingpong-as-their-first-cross-border-partner-to-drive-international-growth-on-its-marketplace-302396408.html
BBY,2025-03-05 19:30:30,Analyzing Retail Earnings in a High-Tariff Economy,https://images.financialmodelingprep.com/news/analyzing-retail-earnings-in-a-hightariff-economy-20250305.jpg,zacks.com,"Note: The following is an excerpt from this week's Earnings Trends report. You can access the full report that contains detailed historical actual and estimates for the current and following periods, please click here>>>",https://www.zacks.com/commentary/2426318/analyzing-retail-earnings-in-a-high-tariff-economy?cid=CS-STOCKNEWSAPI-FT-earnings_outlook-2426318
BBY,2025-03-05 19:30:29,Analyzing Retail Earnings in a High-Tariff Economy,https://images.financialmodelingprep.com/news/analyzing-retail-earnings-in-a-hightariff-economy-20250305.jpg,zacks.com,"Note: The following is an excerpt from this week's Earnings Trends report. You can access the full report that contains detailed historical actual and estimates for the current and following periods, please click here>>>",https://www.zacks.com/commentary/2426283/analyzing-retail-earnings-in-a-high-tariff-economy?cid=CS-STOCKNEWSAPI-FT-earnings_trends-2426283
BBY,2025-03-05 09:21:23,Target and Best Buy said they'll raise prices due to Trump tariffs. These other companies could be next,https://images.financialmodelingprep.com/news/target-and-best-buy-said-theyll-raise-prices-due-20250305.jpg,fastcompany.com,"Target and Best Buy, two of the country's largest retail chains, warned their prices will increase after President Donald Trump's 25% tariffs on goods from Mexico and Canada went into effect on Tuesday, sending the stock market plunging more than 650 points and shooting shock waves through the financial system. Adding fuel to the fire, Trump also said he would double tariffs on all Chinese imports from 10% to 20%.",https://www.fastcompany.com/91290332/target-best-buy-raise-prices-trump-tariffs-companies-join-list-inflation-chipotle-autozone
BBY,2025-03-05 09:00:30,"Tariffs Cast A Shadow Over Best Buy, Target: Could This Be A Buying Opportunity?",https://images.financialmodelingprep.com/news/tariffs-cast-a-shadow-over-best-buy-target-could-this-20250305.jpg,benzinga.com,"Just as Best Buy Co Inc BBY and Target Corp TGT gear up for a turnaround, tariffs are threatening to spoil the party.",https://www.benzinga.com/25/03/44140954/tariffs-cast-a-shadow-over-best-buy-target-but-is-it-a-buying-opportunity
BBY,2025-03-05 03:58:12,iShares U.S. Infrastructure ETF Is The Best Buy Into A Hot Market,https://images.financialmodelingprep.com/news/ishares-us-infrastructure-etf-is-the-best-buy-into-20250305.jpg,seekingalpha.com,"In uncertain times, iShares U.S. Infrastructure ETF offers retail value investors a safe buy opportunity with historically good returns and low management fees. Despite recent momentum dips, IFRA's diversified holdings in infrastructure sectors and buy Quant Rating make it a compelling opportunity. Federal infrastructure spending freezes and macroeconomic risks create short-term uncertainty, but long-term investment in U.S. infrastructure remains essential.",https://seekingalpha.com/article/4764749-ishares-us-infrastructure-etf-is-the-best-buy-into-a-hot-market
BBY,2025-03-04 17:51:44,"Stock Market Extends Losses; Amid Stock Carnage, Be Patient And Wait For New Buys",https://images.financialmodelingprep.com/news/stock-market-extends-losses-amid-stock-carnage-be-patient-20250304.jpg,investors.com,"It was another volatile session for the stock market Tuesday as tariffs on China, Mexico and Canada fueled fears of stagflation. The post Stock Market Extends Losses; Amid Stock Carnage, Be Patient And Wait For New Buys appeared first on Investor's Business Daily.",https://www.investors.com/market-trend/the-big-picture/stock-market-sp500-nasdaq-dow-jones-russell-2000-tariffs/
BBY,2025-03-04 17:36:00,S&P 500 Gains and Losses Today: Best Buy Stock Falls as it Predicts Price Pressure,https://images.financialmodelingprep.com/news/sp-500-gains-and-losses-today-best-buy-stock-falls-20250304.jpg,investopedia.com,"Major U.S. equities indexes moved lower as tariffs went into effect on imports from major trading partners Mexico and Canada, in addition to an increase in the existing levy on goods from China.",https://www.investopedia.com/s-and-p-500-gains-and-losses-today-best-buy-stock-falls-as-retailer-predicts-price-pressure-11690528
BBY,2025-03-04 14:57:34,"Best Buy beats earnings, but tariffs loom: can tech retailer sustain momentum?",https://images.financialmodelingprep.com/news/best-buy-beats-earnings-but-tariffs-loom-can-tech-20250304.jpg,invezz.com,"Best Buy (BBY) is signaling a potential turnaround after years of struggling sales figures. The electronics retailer reported surprisingly strong fourth-quarter results on Tuesday, exceeding Wall Street's expectations and putting an end to a three-year slide in sales growth.",https://invezz.com/news/2025/03/04/best-buy-beats-earnings-but-tariffs-loom-can-tech-retailer-sustain-momentum/
BBY,2025-03-04 13:58:33,"Best Buy Q4 earnings, CoreWeave files for IPO: Catalysts",https://images.financialmodelingprep.com/news/best-buy-q4-earnings-coreweave-files-for-ipo-catalysts-20250304.jpg,youtube.com,"Catalysts anchors Seana Smith and Madison Mills cover the morning's top market stories as equities continue to react to the Trump administration's latest tariffs against Canada, Mexico, and China. Best Buy (BBY) shares take a hit Tuesday morning as the electronics retailer's outlook on tariffs overshadows its latest earnings beat.",https://www.youtube.com/watch?v=2C9abXDAmOs
BBY,2025-03-04 13:46:16,Why Best Buy Stock Unplugged Today,https://images.financialmodelingprep.com/news/why-best-buy-stock-unplugged-today-20250304.jpg,fool.com,"Shares of Best Buy (BBY -12.75%) plunged on Tuesday, following a robust earnings report with a side of worrisome management comments. The stock price dropped by as much as 15.9% in the morning session, recovering to a 13.2% loss by 1 p.m.",https://www.fool.com/investing/2025/03/04/why-best-buy-stock-unplugged-today/
BBY,2025-03-04 13:46:12,"Best Buy Q4 Earnings Beat Estimates, Comparable Sales Rise 0.5% Y/Y",https://images.financialmodelingprep.com/news/best-buy-q4-earnings-beat-estimates-comparable-sales-rise-20250304.jpg,zacks.com,BBY's fiscal fourth-quarter results reflect lower y/y revenues. The gross margin expands 40 bps to 20.9% in the quarter.,https://www.zacks.com/stock/news/2425450/best-buy-q4-earnings-beat-estimates-comparable-sales-rise-0-5-y-y?cid=CS-STOCKNEWSAPI-FT-analyst_blog|earnings_article-2425450
BBY,2025-03-04 12:25:55,Best Buy: Tariffs Could Cut Comparable Sales by 1 Point,https://images.financialmodelingprep.com/news/best-buy-tariffs-could-cut-comparable-sales-by-1-20250304.jpg,pymnts.com,Best Buy said Tuesday (March 4) that the U.S. tariffs on China that went into effect Feb. 4 could have a negative impact of about one point of comparable sales if they remain in place for a full year.,https://www.pymnts.com/earnings/2025/best-buy-tariffs-could-cut-comparable-sales-1-point/
BBY,2025-03-04 11:31:23,"Target, Best Buy CEOs warn of price increases as tariffs take effect",https://images.financialmodelingprep.com/news/target-best-buy-ceos-warn-of-price-increases-as-20250304.jpg,foxbusiness.com,"The heads of major retail companies are warning that their profits could be impacted by tariffs and that prices could rise, some as soon as this week.",https://www.foxbusiness.com/retail/target-best-buy-ceos-warn-price-increases-tariffs-take-effect
BBY,2025-03-04 11:21:26,Best Buy Stock Sinks as Retailer Warns About Tariffs and Inflation,https://images.financialmodelingprep.com/news/best-buy-stock-sinks-as-retailer-warns-about-tariffs-20250304.jpg,investopedia.com,Best Buy (BBY) shares plunged nearly 15% to lead S&P 500 decliners Tuesday when the electronics retailer warned that new tariffs and inflation will negatively impact sales.,https://www.investopedia.com/best-buy-stock-sinks-as-retailer-warns-about-tariffs-and-inflation-11690283
BBY,2025-03-04 10:39:16,Best Buy down 13% after a guarded assessment of prospects,https://images.financialmodelingprep.com/news/best-buy-down-13-after-a-guarded-assessment-of-prospects-20250304.jpg,proactiveinvestors.com,"Best Buy Co Inc (NYSE:BBY) shares tumbled 14% on Tuesday after the retailer issued a cautious annual outlook, warning of sluggish demand for high-ticket electronics amid tariff concerns and shifting consumer priorities. The company forecasted annual comparable sales and earnings below market expectations, citing inflationary pressures that are keeping shoppers wary of big purchases like appliances and gaming consoles.",https://www.proactiveinvestors.com/companies/news/1067333
BBY,2025-03-04 10:30:57,"Best Buy Co., Inc. (BBY) Q4 2025 Earnings Call Transcript",https://images.financialmodelingprep.com/news/best-buy-co-inc-bby-q4-2025-earnings-call-20250304.jpg,seekingalpha.com,"Best Buy Co., Inc. (NYSE:BBY ) Q5 2024 Earnings Conference Call March 4, 2025 8:00 AM ET Company Participants Mollie O'Brien - Head of Investor Relations Corie Barry - Chief Executive Officer Matt Bilunas - Chief Financial Officer Jason Bonfig - Senior Executive Vice President, Customer Offerings and Fulfillment Conference Call Participants Christopher Horvers - JPMorgan Brian Nagel - Oppenheimer Jonathan Matuszewski - Jefferies Michael Lasser - UBS Investment Bank Anthony Chukumba - Loop Capital Markets Oliver Hu - Barclays Steven Forbes - Guggenheim Securities Operator Ladies and gentlemen, thank you for standing by. Welcome to Best Buy's Fourth Quarter of Fiscal 2025 Earnings Conference Call.",https://seekingalpha.com/article/4764461-best-buy-co-inc-bby-q4-2025-earnings-call-transcript
BBY,2025-03-04 10:30:45,Best Buy (BBY) Q4 Earnings: How Key Metrics Compare to Wall Street Estimates,https://images.financialmodelingprep.com/news/best-buy-bby-q4-earnings-how-key-metrics-compare-20250304.jpg,zacks.com,"The headline numbers for Best Buy (BBY) give insight into how the company performed in the quarter ended January 2025, but it may be worthwhile to compare some of its key metrics to Wall Street estimates and the year-ago actuals.",https://www.zacks.com/stock/news/2425131/best-buy-bby-q4-earnings-how-key-metrics-compare-to-wall-street-estimates?cid=CS-STOCKNEWSAPI-FT-fundamental_analysis|nfm-2425131
BBY,2025-03-04 10:26:09,Cramer's Mad Dash: Best Buy,https://images.financialmodelingprep.com/news/cramers-mad-dash-best-buy-20250304.jpg,youtube.com,CNBC's Jim Cramer breaks down why he's keeping an eye on shares of Best Buy.,https://www.youtube.com/watch?v=6hEMX57K5QI
BBY,2025-03-04 09:10:38,Best Buy (BBY) Q4 Earnings and Revenues Beat Estimates,https://images.financialmodelingprep.com/news/best-buy-bby-q4-earnings-and-revenues-beat-estimates-20250304.jpg,zacks.com,"Best Buy (BBY) came out with quarterly earnings of $2.58 per share, beating the Zacks Consensus Estimate of $2.40 per share. This compares to earnings of $2.72 per share a year ago.",https://www.zacks.com/stock/news/2425009/best-buy-bby-q4-earnings-and-revenues-beat-estimates?cid=CS-STOCKNEWSAPI-FT-tale_of_the_tape|yseop_template_4-2425009
BBY,2025-03-04 08:55:00,NYSE CONTENT ADVISORY: PRE-MARKET UPDATE + TARGET & BEST BUY HIGHLIGHT RETAIL EARNINGS,https://images.financialmodelingprep.com/news/nyse-content-advisory-premarket-update-target-best-buy-highlight-retail-20250304.jpg,prnewswire.com,"NEW YORK , March 4, 2025 /PRNewswire/ -- The New York Stock Exchange (NYSE) is proud to offer a daily pre-market update directly from the NYSE Trading Floor. Access today's NYSE Pre-market update for market insights before trading begins.",https://www.prnewswire.com/news-releases/nyse-content-advisory-pre-market-update--target--best-buy-highlight-retail-earnings-302391608.html
BBY,2025-03-04 08:36:23,"Best Buy Revenue Upbeat, Health Drags",https://images.financialmodelingprep.com/news/best-buy-revenue-upbeat-health-drags-20250304.jpg,fool.com,"Best Buy (BBY -3.53%), a leading consumer electronics retailer, reported its fourth-quarter results on March 4, 2025.",https://www.fool.com/data-news/2025/03/04/best-buy-revenue-upbeat-health-drags/
BBY,2025-03-04 08:10:05,"Best Buy beats on earnings and revenue, as computing and phone sales grow",https://images.financialmodelingprep.com/news/best-buy-beats-on-earnings-and-revenue-as-computing-20250304.jpg,cnbc.com,Best Buy beat Wall Street's earnings and revenue expectations for its fiscal 2025 fourth quarter. The company saw comparable sales rise slightly year over year.,https://www.cnbc.com/2025/03/04/best-buy-bby-q4-2025-earnings.html
BBY,2025-03-04 07:48:00,Best Buy's stock surrenders gains. Here's the quibble with guidance.,https://images.financialmodelingprep.com/news/best-buys-stock-surrenders-gains-heres-the-quibble-with-20250304.jpg,marketwatch.com,An earnings beat and dividend hike aren't enough to hold the stock's early gains.,https://www.marketwatch.com/story/best-buys-stock-pops-as-earnings-crush-estimates-and-it-raises-dividend-e47318b4
BBY,2025-03-04 07:24:00,Best Buy Reports Better-Than-Expected Earnings. The Stock Falls Anyway.,https://images.financialmodelingprep.com/news/best-buy-reports-betterthanexpected-earnings-the-stock-falls-anyway-20250304.jpg,barrons.com,Best Buy's earnings and revenue top analysts' expectations but fall from the prior year.,https://www.barrons.com/articles/best-buy-earnings-stock-price-1929edb9
BBY,2025-03-03 16:25:46,"Target and Best Buy Q4 earnings preview, tax changes: Wealth",https://images.financialmodelingprep.com/news/target-and-best-buy-q4-earnings-preview-tax-changes-wealth-20250303.jpg,youtube.com,"Brad Smith covers the latest market moves and more in this episode of Yahoo Finance's Wealth. Wells Fargo Investment Institute global investment strategist Veronica Willis joins the program to talk about why the current market pullback (^DJI, ^IXIC, ^GSPC) may be an opportunity for investors to adjust their investment portfolios.",https://www.youtube.com/watch?v=HRJzj3FVjDs
BBY,2025-03-03 08:45:11,How To Earn $500 A Month From Best Buy Stock Ahead Of Q4 Earnings,https://images.financialmodelingprep.com/news/how-to-earn-500-a-month-from-best-buy-20250303.jpg,benzinga.com,"Best Buy Co., Inc. BBY will release its fourth-quarter financial results, before the opening bell, on Tuesday, March 4.",https://www.benzinga.com/news/earnings/25/03/44076199/how-to-earn-500-a-month-from-best-buy-stock-ahead-of-q4-earnings
BBY,2025-02-28 20:25:19,Q4 Earnings Cycle Continues: Retail Results in Focus,https://images.financialmodelingprep.com/news/q4-earnings-cycle-continues-retail-results-in-focus-20250228.jpg,zacks.com,"The retail earnings releases thus far provide a reassuring view of consumer spending, with broad spending trends largely stable and in-line with what we have seen in recent quarters.",https://www.zacks.com/commentary/2423977/q4-earnings-cycle-continues-retail-results-in-focus?cid=CS-STOCKNEWSAPI-FT-earnings_preview-2423977
BBY,2025-02-28 10:34:16,"Best Buy: Juggling Tariff Risk, Consumer Weakness, Ecommerce Pressure (Downgrade)",https://images.financialmodelingprep.com/news/best-buy-juggling-tariff-risk-consumer-weakness-ecommerce-pressure-20250228.jpg,seekingalpha.com,"Best Buy's Q4 results may see a boost from strong countrywide holiday season electronics sales. A weak outlook may weigh more. Best Buy has continued to lose market share to ecommerce competition, combining with consumer weakness and major tariff uncertainty. The risks aren't completely reflected in BBY stock's valuation. I estimate -26% downside to a fair value of $65.9.",https://seekingalpha.com/article/4763421-best-buy-juggling-tariff-risk-consumer-weakness-ecommerce-pressure-downgrade
BBY,2025-02-28 07:10:53,Best Buy Gears Up For Q4 Print; Here Are The Recent Forecast Changes From Wall Street's Most Accurate Analysts,https://images.financialmodelingprep.com/news/best-buy-gears-up-for-q4-print-here-are-20250228.jpg,benzinga.com,"Best Buy Co., Inc. BBY will release its financial results for the fourth quarter, before the opening bell, on Tuesday, March 4, 2025.",https://www.benzinga.com/analyst-ratings/price-target/25/02/44038852/best-buy-gears-up-for-q4-print-here-are-the-recent-forecast-changes-from-wall-street
BBY,2025-02-27 10:20:41,Stay Ahead of the Game With Best Buy (BBY) Q4 Earnings: Wall Street's Insights on Key Metrics,https://images.financialmodelingprep.com/news/stay-ahead-of-the-game-with-best-buy-bby-20250227.jpg,zacks.com,"Beyond analysts' top -and-bottom-line estimates for Best Buy (BBY), evaluate projections for some of its key metrics to gain a better insight into how the business might have performed for the quarter ended January 2025.",https://www.zacks.com/stock/news/2422730/stay-ahead-of-the-game-with-best-buy-bby-q4-earnings-wall-street-s-insights-on-key-metrics?cid=CS-STOCKNEWSAPI-FT-fundamental_analysis|nfm_preview-2422730
BBY,2025-02-26 04:57:18,3 Ideal Buys From 50 'Safer' Dividends In 100 February Barron's Sustainable Dogs,https://images.financialmodelingprep.com/news/3-ideal-buys-from-50-safer-dividends-in-100-february-20250226.jpg,seekingalpha.com,"Calvert Research and Management's annual review identified the top 100 sustainable companies based on 230 ESG performance indicators, focusing on planet, workplace, customer, community, and shareholder categories. Four dividend-paying companies—Interpublic Group, Regions Financial, Hormel Foods, and HP Inc.—meet the Dogcatcher ideal, with annual dividends from a $1K investment exceeding their share prices. Analysts estimate net gains of 18.08% to 50.6% for the top ten ESG companies by February 2026, with the average net gain projected at 26.12%.",https://seekingalpha.com/article/4762056-3-ideal-buys-safer-dividends-sustainable-dogs
BBY,2025-02-25 11:00:28,Best Buy (BBY) Expected to Beat Earnings Estimates: What to Know Ahead of Q4 Release,https://images.financialmodelingprep.com/news/best-buy-bby-expected-to-beat-earnings-estimates-what-20250225.jpg,zacks.com,Best Buy (BBY) possesses the right combination of the two key ingredients for a likely earnings beat in its upcoming report. Get prepared with the key expectations.,https://www.zacks.com/stock/news/2421264/best-buy-bby-expected-to-beat-earnings-estimates-what-to-know-ahead-of-q4-release?cid=CS-STOCKNEWSAPI-FT-tale_of_the_tape|yseop_template_9-2421264
BBY,2025-02-17 09:51:31,These 2 Retail and Wholesale Stocks Could Beat Earnings: Why They Should Be on Your Radar,https://images.financialmodelingprep.com/news/these-2-retail-and-wholesale-stocks-could-beat-earnings-20250217.jpg,zacks.com,Investors looking for ways to find stocks that are set to beat quarterly earnings estimates should check out the Zacks Earnings ESP.,https://www.zacks.com/stock/news/2416693/these-2-retail-and-wholesale-stocks-could-beat-earnings-why-they-should-be-on-your-radar?cid=CS-STOCKNEWSAPI-FT-tale_of_the_tape|zacks_education_earnings_esp-2416693
BBY,2025-02-16 07:53:39,Buy 5 'Safer' Dividend Dogs Of 23 February Barron's Better Bets Than T-Bills,https://images.financialmodelingprep.com/news/buy-5-safer-dividend-dogs-of-23-february-barrons-20250216.jpg,seekingalpha.com,"Long-term bond yields continue to rise. But investors looking for income can still find plenty of attractive opportunities with dividend-paying stocks that have healthy yields. “23 stocks pay huge dividends. They should be a better bet than treasuries.” - Barron's Weekly. In a Barron's interview, Steven Wieting, strategist at Citi Wealth, noted that a growing dividend is a tangible benefit for shareholders and a hallmark of companies with strong balance sheets. ""Nobody can fake a dividend,"" he said.",https://seekingalpha.com/article/4758840-buy-5-safer-dividend-dogs-23-february-barrons-better-bets-than-t-bills
