symbol,publishedDate,title,image,site,text,url
BBY,2025-06-04 16:10:02,These Are America’s 10 Favorite Retail Stores,https://images.financialmodelingprep.com/news/these-are-americas-10-favorite-retail-stores-20250604.jpg,https://247wallst.com,"Over the last decade, shopping has changed. This change has occurred worldwide, most notably in technologically advanced countries like America. We once ventured out to &#8220;run errands&#8221;, a frequent activity that often included a stop at the mall or a trip to the local boutique. But with Amazon reigning supreme and tons of huge brands like Walmart and Target focusing on online sales, the nature of shopping in America has been drastically altered. With online retail comes the opportunity to reach any segment of the population from anywhere in the world. As competition skyrockets, brand recognition, marketing, and advertising become crucial to a company&#8217;s success. To find the 10 retail stores Americans love most, 24/7 Wall St. reviewed data from the recent 2025 Axios Harris Poll 100 Reputation Rankings. This consumer survey ranked 100 brands, giving each a score. These were accessed across several categories, such as Character, Trust, Growth, Vision, and Ethics. Depending on the exact score, these brands fell into 6 separate rankings: Excellent, Very Good, Good, Fair, Poor, Very Poor. In the retail store category, 15 brands made Axios&#8217; list; however, only 10 of these fell into the top 3 rankings. Here, we list the retail stores Americans think fall under Excellent, Good, and Very Good. 10. Target Score: 71 (Good) Change from last year: down 9 points Top-scoring categories: Products and Services (73.2), Vision (72.7) 9. Macy&#8217;s Score: 71.8 (Good) Change from last year: down 9 points Top-scoring categories: Products and Services (75.6), Trust (75.5) 8. Hobby Lobby Score: 73.9 (Good) Change from last year: down 9 points Top-scoring categories: Trust (76.2), Vision (75.5) 7. Kroger Score: 76.7 (Very Good) Change from last year: down 6 points Top-scoring categories: Trust (79.4), Growth (79.2) 6. Best Buy Score: 76.8 (Very Good) Change from last year: up 13 points Top-scoring categories: Products and Services (80.5), Growth (77.9) 5. Aldi Score: 77 (Very Good) Change from last year: down 18 points Top-scoring categories: Growth (80.4), Vision (71.0) 4. Lowe&#8217;s Score: 78.1 (Very Good) Change from last year: up 18 points Top-scoring categories: Products and Services (80.4), Trust (79.9) 3. Home Depot Score: 78.6 (Very Good) Change from last year: up 24 points Top-scoring categories: Trust (81.4), Vision (81.6) 2. Costco Score: 80.6 (Excellent) Change from last year: up 6 points Top-scoring categories: Culture (83.5), Products and Services (82.6) 1. Trader Joe&#8217;s Score: 82.1 (Excellent) Change from last year: up 12 points Top-scoring categories: Products and Services (83.8), Trajectory (83.2) The post These Are America&#8217;s 10 Favorite Retail Stores appeared first on 24/7 Wall St..",https://247wallst.com/retail/2025/06/03/these-are-americas-10-favorite-retail-stores/
BBY,2025-06-02 12:35:46,"Investing in These Retailers' Stock is 'Worth the Risk,' JPMorgan Says",https://images.financialmodelingprep.com/news/investing-in-these-retailers-stock-is-worth-the-risk-20250602.jpg,investopedia.com,"Best Buy and Wayfair stock offer a healthy balance of risk and reward, JPMorgan said.",https://www.investopedia.com/these-retailers-stock-are-worth-the-risk-jpmorgan-says-11746307
BBY,2025-06-02 05:40:04,Is A 50% Plunge On The Horizon For Best Buy Stock?,https://images.financialmodelingprep.com/news/is-a-50-plunge-on-the-horizon-for-best-20250602.jpg,forbes.com,"Note: Best Buy's FY'25 ended on February 1, 2025",https://www.forbes.com/sites/greatspeculations/2025/06/02/is-a-50-plunge-on-the-horizon-for-best-buy-stock/
BBY,2025-06-01 07:30:00,2 Popular Dividend Stocks I Wouldn't Touch With A 10-Foot Pole,https://images.financialmodelingprep.com/news/2-popular-dividend-stocks-i-wouldnt-touch-with-a-20250601.jpg,seekingalpha.com,"I'm a picky investor for a reason, as only a small fraction of stocks creates long-term wealth. That's why I focus on quality and avoid the most popular names. In this piece, I break from tradition and spotlight two well-known dividend stocks I won't buy, even if they look tempting to others right now. While both companies have strong brands and loyal customers, I believe their long-term risks far outweigh the rewards, especially versus solid benchmarks.",https://seekingalpha.com/article/4791472-2-popular-dividend-stocks-wouldnt-touch-with-10-foot-pole
BBY,2025-05-30 14:45:00,Retailers Flex Their Vocabulary to Warn of Potential Tariff-Driven Price Hikes,https://images.financialmodelingprep.com/news/retailers-flex-their-vocabulary-to-warn-of-potential-tariffdriven-20250530.jpg,wsj.com,Retailers are walking a tightrope to convey they're looking to raise prices without actually saying they're raising prices.,https://www.wsj.com/business/retail/retailers-flex-their-vocabulary-to-warn-of-potential-tariff-driven-price-hikes-a5d9748c
BBY,2025-05-30 12:49:06,These Analysts Revise Their Forecasts On Best Buy After Q1 Results,https://images.financialmodelingprep.com/news/these-analysts-revise-their-forecasts-on-best-buy-after-20250530.jpg,benzinga.com,Best Buy Co Inc BBY posted downbeat results for the first quarter.,https://www.benzinga.com/cannabis/25/05/45700069/these-analysts-revise-their-forecasts-on-best-buy-after-q1-results
BBY,2025-05-30 08:00:00,Best Buy Announces Regular Quarterly Cash Dividend,https://images.financialmodelingprep.com/news/best-buy-announces-regular-quarterly-cash-dividend-20250530.jpg,businesswire.com,"MINNEAPOLIS--(BUSINESS WIRE)--The Board of Directors of Best Buy Co., Inc. (NYSE:BBY) has authorized the payment of a regular quarterly cash dividend of $0.95 per common share. The quarterly dividend is payable on July 10, 2025, to shareholders of record as of the close of business on June 19, 2025. The company had 211,299,033 shares of common stock issued and outstanding as of May 3, 2025.",https://www.businesswire.com/news/home/20250529209981/en/Best-Buy-Announces-Regular-Quarterly-Cash-Dividend/
BBY,2025-05-29 17:15:37,"S&P 500 Gains and Losses Today: HP, Best Buy Stocks Drop as Tariffs Weigh On Outlook",https://images.financialmodelingprep.com/news/sp-500-gains-and-losses-today-hp-best-buy-stocks-20250529.jpg,investopedia.com,"Major U.S. equities indexes ticked higher after a federal court blocked the ""reciprocal"" tariffs imposed by President Donald Trump—though that hold was ultimately itself put on ice.",https://www.investopedia.com/s-and-p-500-gains-and-losses-today-11744604
BBY,2025-05-29 16:26:54,Best Buy Predicts Dip in Sales Amid ‘Incredibly Fluid' Tariff Outlook,https://images.financialmodelingprep.com/news/best-buy-predicts-dip-in-sales-amid-incredibly-fluid-20250529.jpg,pymnts.com,"Despite its customers' resilience, Best Buy expects sales to dip this year because of tariffs. The electronics retailer released quarterly earnings Thursday (May 29), projecting yearly revenue of $41.1 billion to $41.9 billion, below past guidance of $41.4 billion to $42.2 billion.",https://www.pymnts.com/earnings/2025/best-buy-predicts-dip-in-sales-amid-incredibly-fluid-tariff-outlook/
BBY,2025-05-29 14:25:42,Best Buy Stock Tumbles as Retailer Lowers Outlook on Tariffs Hit,https://images.financialmodelingprep.com/news/best-buy-stock-tumbles-as-retailer-lowers-outlook-on-20250529.jpg,investopedia.com,Best Buy (BBY) shares tumbled more than 8% to lead S&P 500 decliners Thursday after the electronics retailer lowered its full-year outlook because of tariffs.,https://www.investopedia.com/best-buy-stock-tumbles-as-retailer-lowers-outlook-on-tariffs-hit-11744200
BBY,2025-05-29 13:46:09,"Best Buy Beats Q1 Earnings Estimates, Cuts FY26 Guidance on Tariffs",https://images.financialmodelingprep.com/news/best-buy-beats-q1-earnings-estimates-cuts-fy26-guidance-20250529.jpg,zacks.com,"BBY tops Q1 earnings estimates but trims FY26 outlook on tariffs. Focus shifts to Marketplace, Ads & boosting operational efficiency.",https://www.zacks.com/stock/news/2479178/best-buy-beats-q1-earnings-estimates-cuts-fy26-guidance-on-tariffs?cid=CS-STOCKNEWSAPI-FT-analyst_blog|earnings_article-2479178
BBY,2025-05-29 13:38:52,7 Quality Dividend Stocks on Sale Today,https://images.financialmodelingprep.com/news/7-quality-dividend-stocks-on-sale-today-20250529.jpg,247wallst.com,"Dividend stocks are outperforming the S&P 500 in 2025. hese dividend payers are trading lower today, giving investors an opportunity to add these names at a potential discount.",https://247wallst.com/investing/2025/05/29/7-quality-dividend-stocks-on-sale-today/
BBY,2025-05-29 13:15:07,Tariffs Hit Best Buy Revenues As Retailer Reduces Chinese Imports,https://images.financialmodelingprep.com/news/tariffs-hit-best-buy-revenues-as-retailer-reduces-chinese-20250529.jpg,forbes.com,U.S. consumer electricals giant Best Buy missed quarterly revenue expectations and cut its full-year sales and profit guidance amid the impact of higher tariffs.,https://www.forbes.com/sites/markfaithfull/2025/05/29/tariffs-hit-best-buy-revenues-as-retailer-reduces-chinese-imports/
BBY,2025-05-29 13:13:45,"JPMorgan cut Best Buy target, sees attractive entry point",https://images.financialmodelingprep.com/news/jpmorgan-cut-best-buy-target-sees-attractive-entry-point-20250529.jpg,https://thefly.com,29 May 13 Jun,https://thefly.com/permalinks/entry.php/id4138107/BBY-JPMorgan-cut-Best-Buy-target-sees-attractive-entry-point
BBY,2025-05-29 13:13:42,Crude Oil Falls Over 1%; Best Buy Reports Downbeat Results,https://images.financialmodelingprep.com/news/crude-oil-falls-over-1-best-buy-reports-downbeat-20250529.jpg,benzinga.com,"U.S. stocks traded mostly higher midway through trading, with the S&P 500 gaining around 0.4% on Thursday.",https://www.benzinga.com/news/earnings/25/05/45677149/crude-oil-falls-over-1-best-buy-reports-downbeat-results
BBY,2025-05-29 12:10:55,"Top Stock Movers Now: Nvidia, HP, Best Buy, and More",https://images.financialmodelingprep.com/news/top-stock-movers-now-nvidia-hp-best-buy-and-20250529.jpg,investopedia.com,"U.S. equities were mixed at midday, dropping from their morning highs after a federal trade court blocked some of President Donald Trump's tariffs. The S&P 500 and Nasdaq were up, the Dow Jones Industrial Average fell.",https://www.investopedia.com/top-stock-movers-now-nvidia-hp-best-buy-and-more-11744420
BBY,2025-05-29 12:01:05,Jobless Claims Come in Higher,https://images.financialmodelingprep.com/news/jobless-claims-come-in-higher-20250529.jpg,zacks.com,Jobless Claims Come in Higher.,https://www.zacks.com/stock/news/2479008/jobless-claims-come-in-higher?cid=CS-STOCKNEWSAPI-FT-economic_highlights-2479008
BBY,2025-05-29 11:00:25,"Best Buy Co., Inc. (BBY) Q1 2026 Earnings Call Transcript",https://images.financialmodelingprep.com/news/best-buy-co-inc-bby-q1-2026-earnings-call-20250529.jpg,seekingalpha.com,"Best Buy Co., Inc. (NYSE:BBY ) Q1 2026 Earnings Conference Call May 29, 2025 8:00 AM ET Company Participants Mollie O'Brien - Head of Investor Relations Corie Barry - Chief Executive Officer Matt Bilunas - Chief Financial Officer Jason Bonfig - Senior Executive Vice President, Customer Offerings and Fulfillment Conference Call Participants Scot Ciccarelli - Truist Securities Michael Baker - DA Davidson Greg Melich - Evercore ISI Loren Eng - Morgan Stanley Peter Keith - Piper Sandler Steven Zaccone - Citi Brian Nagel - Oppenheimer Jonathan Matuszewski - Jefferies Operator Ladies and gentlemen, thank you for standing by. Welcome to Best Buy's First Quarter Fiscal 2026 Earnings Conference Call.",https://seekingalpha.com/article/4790899-best-buy-co-inc-bby-q1-2026-earnings-call-transcript
BBY,2025-05-29 10:51:31,Best Buy trims full-year guidance as tariffs weigh on sales,https://images.financialmodelingprep.com/news/best-buy-trims-fullyear-guidance-as-tariffs-weigh-on-20250529.jpg,proactiveinvestors.com,"Best Buy Co Inc (NYSE:BBY) posted mixed earnings for the first quarter and cut its full-year sales and profit outlook as tariffs have increased the cost of electronics, sending its shares almost 10% lower. For fiscal 2026, the retailer now expects revenue in the range of $41.1 billion to $41.9 billion, down from its earlier guidance of $41.4 billion to $42.2 billion Comparable sales are expected to be -1% to 1%, compared to earlier guidance of flat to 2%.",https://www.proactiveinvestors.com/companies/news/1072087
BBY,2025-05-29 10:48:34,Best Buy Stock Slips on Slashed Sales Outlook,https://images.financialmodelingprep.com/news/best-buy-stock-slips-on-slashed-sales-outlook-20250529.jpg,schaeffersresearch.com,"Best Buy Co Inc  (NYSE:BBY) reported a revenue miss for the first quarter, but the bigger news is a slashed full-year sales outlook, as the cost of electronics jumps due to President Donald Trump's tariffs.",https://www.schaeffersresearch.com/content/news/2025/05/29/best-buy-stock-slips-on-slashed-sales-outlook
BBY,2025-05-29 10:36:29,"Compared to Estimates, Best Buy (BBY) Q1 Earnings: A Look at Key Metrics",https://images.financialmodelingprep.com/news/compared-to-estimates-best-buy-bby-q1-earnings-a-look-20250529.jpg,zacks.com,"The headline numbers for Best Buy (BBY) give insight into how the company performed in the quarter ended April 2025, but it may be worthwhile to compare some of its key metrics to Wall Street estimates and the year-ago actuals.",https://www.zacks.com/stock/news/2478818/compared-to-estimates-best-buy-bby-q1-earnings-a-look-at-key-metrics?cid=CS-STOCKNEWSAPI-FT-fundamental_analysis|nfm-2478818
BBY,2025-05-29 09:31:16,"Best Buy Falls Short: Sales, Earnings Miss As Tariff Pressures Mount",https://images.financialmodelingprep.com/news/best-buy-falls-short-sales-earnings-miss-as-tariff-20250529.jpg,benzinga.com,Best Buy Co Inc BBY is trading lower Thursday after the retailer's first-quarter 2026 earnings fell short of expectations.,https://www.benzinga.com/news/earnings/25/05/45669267/best-buy-whiffs-on-sales-earnings-tariff-pressures-mount
BBY,2025-05-29 09:18:40,Best Buy Says Tariffs May Lower Profits And Sales—Joining These Companies Warning Of Tariff Impacts,https://images.financialmodelingprep.com/news/best-buy-says-tariffs-may-lower-profits-and-salesjoining-20250529.jpg,forbes.com,"Home Depot, whose first-quarter earnings fell just below analyst expectations despite beating revenue projections, according to FactSet, reported the company will hold onto its forecast for full-year sales. Chief Financial Officer Richard McPhail told CNBC that, “because of our scale” and Home Depot's “great partnerships” with suppliers, the company plans to “generally maintain our current pricing levels across our portfolio.",https://www.forbes.com/sites/tylerroush/2025/05/29/best-buy-says-tariffs-may-lower-profits-and-sales-joining-these-companies-warning-of-tariff-impacts/
BBY,2025-05-29 09:10:15,Best Buy (BBY) Q1 Earnings and Revenues Surpass Estimates,https://images.financialmodelingprep.com/news/best-buy-bby-q1-earnings-and-revenues-surpass-estimates-20250529.jpg,zacks.com,"Best Buy (BBY) came out with quarterly earnings of $1.15 per share, beating the Zacks Consensus Estimate of $1.09 per share. This compares to earnings of $1.20 per share a year ago.",https://www.zacks.com/stock/news/2478691/best-buy-bby-q1-earnings-and-revenues-surpass-estimates?cid=CS-STOCKNEWSAPI-FT-tale_of_the_tape|yseop_template_4-2478691
BBY,2025-05-29 08:40:36,Best Buy First-Quarter 2026 Financial Results: Just the Numbers,https://images.financialmodelingprep.com/news/best-buy-firstquarter-2026-financial-results-just-the-numbers-20250529.jpg,investopedia.com,Best Buy (BBY) reported fiscal 2026 first-quarter results before the bell Thursday. A summary of its key numbers is below.,https://www.investopedia.com/best-buy-first-quarter-2026-financial-results-just-the-numbers-11743141
BBY,2025-05-29 07:49:00,Best Buy Cuts Guidance as Tariffs Loom,https://images.financialmodelingprep.com/news/best-buy-cuts-guidance-as-tariffs-loom-20250529.jpg,wsj.com,Best Buy cut its sales and profit forecast for the year to account for the global trade war.,https://www.wsj.com/business/retail/best-buy-cuts-guidance-as-tariffs-loom-ac5841d3
BBY,2025-05-29 07:23:17,Best Buy cuts full-year sales and profit guidance as tariffs raise cost of electronics,https://images.financialmodelingprep.com/news/best-buy-cuts-fullyear-sales-and-profit-guidance-as-20250529.jpg,cnbc.com,Best Buy cuts full-year sales and profit guidance as tariffs raise cost of electronics,https://www.cnbc.com/2025/05/29/best-buy-bby-q1-2026-earnings-.html
BBY,2025-05-29 07:20:00,Best Buy Stock Falls After Earnings. Fiscal-Year Guidance Cut to Account for Tariffs.,https://images.financialmodelingprep.com/news/best-buy-stock-falls-after-earnings-fiscalyear-guidance-cut-20250529.jpg,barrons.com,The retailer says both domestic and international comparable sales slip from the prior year.,https://www.barrons.com/articles/best-buy-earnings-stock-price-8455a59a
BBY,2025-05-29 07:13:48,Electronics retailer Best Buy cuts annual sales forecast on tariff pain,https://images.financialmodelingprep.com/news/electronics-retailer-best-buy-cuts-annual-sales-forecast-on-20250529.jpg,reuters.com,"Best Buy slashed its annual comparable sales forecast on Thursday, on signs that consumer demand for big-ticket items such as appliances, home theater and gaming consoles will be pressured by U.S. tariffs.",https://www.reuters.com/business/electronics-retailer-best-buy-cuts-annual-sales-forecast-tariff-pain-2025-05-29/
BBY,2025-05-29 07:10:00,Best Buy's stock drops after it cuts profit outlook on tariff impact,https://images.financialmodelingprep.com/news/best-buys-stock-drops-after-it-cuts-profit-outlook-20250529.jpg,marketwatch.com,Best Buy's stock BBY fell 2.3% in premarket trading on Thursday after the electronics retailer cut its full-year profit guidance due to the impact of tariffs.,https://www.marketwatch.com/story/best-buys-stock-drops-after-it-cuts-profit-outlook-on-tariff-impact-ce97a764
BBY,2025-05-29 07:00:00,Best Buy Reports First Quarter Results,https://images.financialmodelingprep.com/news/best-buy-reports-first-quarter-results-20250529.jpg,businesswire.com,"MINNEAPOLIS--(BUSINESS WIRE)--Best Buy Co., Inc. (NYSE: BBY) today announced results for the 13-week first quarter ended May 3, 2025 (“Q1 FY26”), as compared to the 13-week first quarter ended May 4, 2024 (“Q1 FY25”).             Q1 FY26 Q1 FY25 Revenue ($ in millions)         Enterprise $ 8,767   $ 8,847   Domestic segment $ 8,127   $ 8,203   International segment $ 640   $ 644   Enterprise comparable sales % change1   (0.7 )%   (6.1 )% Domestic comparable sales % change1   (0.7 )%   (6.3 )% D.",https://www.businesswire.com/news/home/20250528973660/en/Best-Buy-Reports-First-Quarter-Results/
BBY,2025-05-28 07:35:04,Will Earnings Results Move The Needle For Best Buy?,https://images.financialmodelingprep.com/news/will-earnings-results-move-the-needle-for-best-buy-20250528.jpg,forbes.com,"Best Buy's stock (NYSE: BBY) is set to announce its fiscal first-quarter earnings on Thursday, May 29, 2025, with analysts expecting earnings of $1.09 per share from $8.82 billion in revenue. This would indicate a 4% year-over-year decrease in earnings and a flat sales growth compared to the prior year's numbers of $1.13 per share and $8.85 billion in revenue.",https://www.forbes.com/sites/greatspeculations/2025/05/28/will-earnings-results-move-the-needle-for-best-buy/
BBY,2025-05-25 10:23:51,"100 Sustainable Dividend Dogs: 18 ""Safer"", 4 Ideal May Buys",https://images.financialmodelingprep.com/news/100-sustainable-dividend-dogs-18-safer-4-ideal-may-20250525.jpg,seekingalpha.com,"I analyze Barron's top 100 sustainable companies, focusing on dividend-paying stocks using the yield-based 'dogcatcher' strategy for value and income. Six of 83 dividend-paying ESG stocks meet the ideal of annual dividends from $1,000 invested exceeding their share price, signaling potential value opportunities. Analyst targets suggest 20-45% net gains for the top ten ESG 'dogs' by May 2026, with risk and volatility varying by stock and sector.",https://seekingalpha.com/article/4789716-100-sustainable-dividend-dogs-18-safer-4-ideal-may-buys
BBY,2025-05-23 10:21:18,Stay Ahead of the Game With Best Buy (BBY) Q1 Earnings: Wall Street's Insights on Key Metrics,https://images.financialmodelingprep.com/news/stay-ahead-of-the-game-with-best-buy-bby-20250523.jpg,zacks.com,Get a deeper insight into the potential performance of Best Buy (BBY) for the quarter ended April 2025 by going beyond Wall Street's top -and-bottom-line estimates and examining the estimates for some of its key metrics.,https://www.zacks.com/stock/news/2476567/stay-ahead-of-the-game-with-best-buy-bby-q1-earnings-wall-street-s-insights-on-key-metrics?cid=CS-STOCKNEWSAPI-FT-fundamental_analysis|nfm_preview-2476567
BBY,2025-05-23 08:00:00,Best Buy: Tariff Environment Still Weighs On Outlook,https://images.financialmodelingprep.com/news/best-buy-tariff-environment-still-weighs-on-outlook-20250523.jpg,seekingalpha.com,"Best Buy is likely to report weak fiscal Q1 results. The company anticipates negative comparable sales growth, and declining consumer confidence weighs on especially in April. Weaker consumer confidence and tariffs weigh on the FY2026 outlook. With tariffs excluded from Best Buy's current guidance, I expect that the 30% tariff on China will pressure the guidance. I estimate BBY stock to have 11% downside to $63.3.",https://seekingalpha.com/article/4789389-best-buy-tariff-environment-still-weighs-on-outlook
BBY,2025-05-22 11:06:24,Analysts Estimate Best Buy (BBY) to Report a Decline in Earnings: What to Look Out for,https://images.financialmodelingprep.com/news/analysts-estimate-best-buy-bby-to-report-a-decline-20250522.jpg,zacks.com,Best Buy (BBY) doesn't possess the right combination of the two key ingredients for a likely earnings beat in its upcoming report. Get prepared with the key expectations.,https://www.zacks.com/stock/news/2476062/analysts-estimate-best-buy-bby-to-report-a-decline-in-earnings-what-to-look-out-for?cid=CS-STOCKNEWSAPI-FT-tale_of_the_tape|yseop_template_9-2476062
BBY,2025-05-21 16:20:04,Buy 9 Barron's Better Bets (Than T-Bills) From 16 'Safer' May Dividend Dogs,https://images.financialmodelingprep.com/news/buy-9-barrons-better-bets-than-tbills-from-16-20250521.jpg,seekingalpha.com,"Long-term bond yields continue to rise. But investors looking for income can still find plenty of attractive opportunities with dividend-paying stocks that have healthy yields. “23 stocks pay huge dividends. They should be a better bet than treasuries.” —Barron's Weekly. Interviewed by Barron's, Steven Wieting, strategist at Citi-Wealth, noted that growing dividends are tangible benefits for shareholders and hallmarks of companies with strong balance sheets. “Nobody can fake a dividend,” he said.",https://seekingalpha.com/article/4788967-buy-9-barrons-better-bets-than-t-bills-from-16-safer-may-dividend-dogs
BBY,2025-05-12 12:41:42,"REITs, MLPs, And BDCs: Which Is The Best Buy Today?",https://images.financialmodelingprep.com/news/reits-mlps-and-bdcs-which-is-the-best-buy-20250512.jpg,seekingalpha.com,"REITs, MLPs, and BDCs are some of the very best places to look for big and predictable dividends. I compare them side by side and share which I think is the best buy of the three today. I also share some of my top picks of the moment.",https://seekingalpha.com/article/4785624-reits-mlps-and-bdcs-which-is-the-best-buy-today
BBY,2025-05-12 11:02:20,Best Buy Stock Soars as Tariff Rollback Sparks Rally,https://images.financialmodelingprep.com/news/best-buy-stock-soars-as-tariff-rollback-sparks-rally-20250512.jpg,schaeffersresearch.com,"While most of Wall Street is cheering today's tariff rollback, one stock is rallying especially hard: Best Buy Co Inc (NYSE:BBY).",https://www.schaeffersresearch.com/content/news/2025/05/12/best-buy-stock-soars-as-tariff-rollback-sparks-rally
BBY,2025-05-07 07:14:03,Best Buy: Short-Term Struggles Don't Define Long-Term Potential,https://images.financialmodelingprep.com/news/best-buy-shortterm-struggles-dont-define-longterm-potential-20250507.jpg,seekingalpha.com,"Despite short-term headwinds, I rate Best Buy as a buy due to its stable brand, healthy balance sheet, and high sustainable dividend yield of 5.58%. The company is undervalued, with an intrinsic value of $85.71, significantly higher than the current trading price of $68.07, indicating potential for long-term growth. Best Buy's low debt and strong dividend growth, coupled with substantial share buybacks, showcase its resilience and ability to return value to shareholders.",https://seekingalpha.com/article/4782815-best-buy-short-term-struggles-dont-define-long-term-potential
BBY,2025-04-20 09:15:00,"Selling America, Buying Europe - My Picks",https://images.financialmodelingprep.com/news/selling-america-buying-europe-my-picks-20250420.jpg,seekingalpha.com,"After years of strong returns, amidst the tariff-induced uncertainty, I am rotating towards European-based equities. US economy is facing mounting pressures, via weakening consumer demand, reduced CAPEX spending, inflation, and rising recession odds. European equities are relatively cheap, and despite structural issues, pockets of opportunities exist in high-growth areas and via re-arming Europe initiative.",https://seekingalpha.com/article/4776258-selling-america-buying-europe-my-picks
