symbol,publishedDate,title,image,site,text,url
BBY,2024-11-26 09:15:08,Best Buy cuts guidance after softer pre-festive sales,https://images.financialmodelingprep.com/news/best-buy-cuts-guidance-after-softer-prefestive-sales-20241126.jpg,proactiveinvestors.com,"Best Buy Co Inc (NYSE:BBY) shares dropped 2% pre-market after the electronics retailer cut guidance because of softer sales in the third quarter. Full-year comparable sales are now guided to decline 2.5% to 3.5%, compared to its previous forecast of a 1.5% to 3.0% drop.",https://www.proactiveinvestors.com/companies/news/1061510
BBY,2024-11-26 09:10:26,Best Buy (BBY) Q3 Earnings and Revenues Lag Estimates,https://images.financialmodelingprep.com/news/best-buy-bby-q3-earnings-and-revenues-lag-estimates-20241126.jpg,zacks.com,"Best Buy (BBY) came out with quarterly earnings of $1.26 per share, missing the Zacks Consensus Estimate of $1.30 per share. This compares to earnings of $1.29 per share a year ago.",https://www.zacks.com/stock/news/2375154/best-buy-bby-q3-earnings-and-revenues-lag-estimates?cid=CS-STOCKNEWSAPI-FT-tale_of_the_tape|yseop_template_4-2375154
BBY,2024-11-26 08:33:44,"Dow Jones and S&P500: Best Buy Drops 7%, Dick's Rises 5%, Banks Face Downgrades",https://images.financialmodelingprep.com/news/dow-jones-and-sp500-best-buy-drops-7-dicks-rises-20241126.jpg,fxempire.com,"Goldman Sachs and Morgan Stanley face downgrades, Best Buy slides on weak earnings, but Dick's shines. What this means for the S&P500 outlook.",https://www.fxempire.com/forecasts/article/dow-jones-and-sp500-best-buy-drops-7-dicks-rises-5-banks-face-downgrades-1478935
BBY,2024-11-26 08:10:11,"Best Buy Says Q3 Sales 'Little Softer Than Expected' On Lower Demand For Appliances And Gaming, Trims Annual Forecast",https://images.financialmodelingprep.com/news/best-buy-says-q3-sales-little-softer-than-expected-20241126.jpg,benzinga.com,"On Tuesday, Best Buy Co., Inc  BBY reported fiscal 2025 third-quarter adjusted EPS of $1.26, missing the consensus of $1.29.",https://www.benzinga.com/news/earnings/24/11/42188320/best-buy-says-q3-sales-little-softer-than-expected-on-lower-demand-for-appliances-and-gaming-trims-
BBY,2024-11-26 08:06:00,"Best Buy's stock slides as ‘softer-than-expected' demand leads to sales, earnings miss",https://images.financialmodelingprep.com/news/best-buys-stock-slides-as-softerthanexpected-demand-leads-to-sales-20241126.jpg,marketwatch.com,"Macro uncertainty, customers waiting for deals and sales events, and distraction during the run-up to the election led to softer-than-expected demand, according to Best Buy CEO Corie Barry.",https://www.marketwatch.com/story/best-buy-stock-slides-on-q3-top-and-bottom-line-miss-915118a0
BBY,2024-11-26 07:31:00,Best Buy Earnings Miss on All Fronts. The Stock Tumbles.,https://images.financialmodelingprep.com/news/best-buy-earnings-miss-on-all-fronts-the-stock-tumbles-20241126.jpg,barrons.com,The retailer's earnings and sales fell short of consensus estimates.,https://www.barrons.com/articles/best-buy-earnings-stock-price-1627178a
BBY,2024-11-26 07:19:39,Best Buy cuts full-year sales forecast due to softer demand for consumer electronics,https://images.financialmodelingprep.com/news/best-buy-cuts-fullyear-sales-forecast-due-to-softer-demand-20241126.jpg,cnbc.com,Best Buy on Tuesday cut its full-year sales forecast. The retailer missed Wall Street's quarterly revenue expectations.,https://www.cnbc.com/2024/11/26/best-buy-bby-earnings-q3-2025.html
BBY,2024-11-26 07:06:41,"Best Buy cuts annual profit, sales forecasts on tepid holiday demand",https://images.financialmodelingprep.com/news/best-buy-cuts-annual-profit-sales-forecasts-on-tepid-holiday-20241126.jpg,reuters.com,"Best Buy cut its annual profit and sales forecasts on Tuesday, in a sign that the holiday shopping season would be marked by aggressive discounts and tepid demand for pricey electronics such as televisions and home theater systems.",https://www.reuters.com/business/retail-consumer/best-buy-cuts-annual-profit-sales-forecasts-tepid-holiday-demand-2024-11-26/
BBY,2024-11-25 18:55:32,Dow and Small-Caps Close at New All-Time Highs,https://images.financialmodelingprep.com/news/dow-and-smallcaps-close-at-new-alltime-highs-20241125.jpg,zacks.com,"The Dow closed at a fresh new high at 44,736, +440 points on the day, and the Russell 2000 notched its first all-time closing high since 2021.",https://www.zacks.com/stock/news/2375000/dow-and-small-caps-close-at-new-all-time-highs?cid=CS-STOCKNEWSAPI-FT-ahead_of_wall_street-2375000
BBY,2024-11-25 08:35:42,How To Earn $500 A Month From Best Buy Stock Ahead Of Q3 Earnings,https://images.financialmodelingprep.com/news/how-to-earn-500-a-month-from-best-buy-20241125.jpg,benzinga.com,"Best Buy Co., Inc. BBY will release earnings results for its third quarter, before the opening bell on Tuesday, Nov. 26.",https://www.benzinga.com/24/11/42162898/how-to-earn-500-a-month-from-best-buy-stock-ahead-of-q3-earnings
BBY,2024-11-24 14:00:00,"Best Buy, Zoom, CrowdStrike, Macy's, and More Stocks to Watch",https://images.financialmodelingprep.com/news/best-buy-zoom-crowdstrike-macys-and-more-stocks-to-20241124.jpg,barrons.com,Markets will be closed on Thursday for Thanksgiving. Earnings from retailers and October inflation data will be the week's highlights.,https://www.barrons.com/articles/best-buy-zoom-crowdstrike-macys-stocks-to-watch-0617eecd
BBY,2024-11-22 12:34:42,Best Buy's Growth Hinges On Computing And Services As Q3 Approaches: Analyst,https://images.financialmodelingprep.com/news/best-buys-growth-hinges-on-computing-and-services-as-20241122.jpg,benzinga.com,"BofA Securities analyst Robert F. Ohmes maintained an Underperform rating on Best Buy Co, Inc BBY with a price target of $80.",https://www.benzinga.com/24/11/42143717/best-buys-growth-hinges-on-computing-and-services-as-q3-approaches-analyst
BBY,2024-11-21 10:20:23,Ahead of Best Buy (BBY) Q3 Earnings: Get Ready With Wall Street Estimates for Key Metrics,https://images.financialmodelingprep.com/news/ahead-of-best-buy-bby-q3-earnings-get-ready-20241121.jpg,zacks.com,"Beyond analysts' top -and-bottom-line estimates for Best Buy (BBY), evaluate projections for some of its key metrics to gain a better insight into how the business might have performed for the quarter ended October 2024.",https://www.zacks.com/stock/news/2373274/ahead-of-best-buy-bby-q3-earnings-get-ready-with-wall-street-estimates-for-key-metrics?cid=CS-STOCKNEWSAPI-FT-fundamental_analysis|nfm_preview-2373274
BBY,2024-11-15 16:30:00,Generation Income Properties Announces Third Quarter 2024 Financial and Operating Results,https://images.financialmodelingprep.com/news/generation-income-properties-announces-third-quarter-2024-financial-and-20241115.jpg,accesswire.com,"TAMPA, FL / ACCESSWIRE / November 15, 2024 / Generation Income Properties, Inc. (NASDAQ:GIPR) (""GIPR"" or the ""Company"") today announced its three and nine month financial and operating results for the period ended September 30, 2024. Quarterly Highlights (For the 3 months ended September 30, 2024) Generated net loss attributable to GIP common shareholders of $2.1 million, or ($0.55) per basic and diluted share.",https://www.accesswire.com/942275/generation-income-properties-announces-third-quarter-2024-financial-and-operating-results
BBY,2024-11-14 18:54:21,100 November Sustainable Dividend Dogs: 50 'Safer' And 2 Ideal Buys,https://images.financialmodelingprep.com/news/100-november-sustainable-dividend-dogs-50-safer-and-2-20241114.jpg,seekingalpha.com,"Calvert Research and Management ranked the 100 most sustainable companies based on over 230 ESG indicators, including workplace diversity and greenhouse-gas emissions. Eight of 78 dividend-paying sustainable companies offer dividends exceeding their share prices, signalling potential buy opportunities for investors. Analysts estimate net gains of 17.47% to 69.69% for the top ten sustainable companies by November 2025, based on target prices and dividends.",https://seekingalpha.com/article/4737572-100-november-sustainable-divi-dogs-50-safer-and-2-ideal-buys
BBY,2024-11-14 09:46:46,Best Buy: Q3 Outlook Remains Weak,https://images.financialmodelingprep.com/news/best-buy-q3-outlook-remains-weak-20241114.jpg,seekingalpha.com,"Best Buy Co., Inc. is soon reporting the company's Q3 results, likely having relatively weak earnings due to persisting consumer weakness. Over the long term, Best Buy's operating model is challenged by ecommerce competition, making for a weak growth outlook despite the company's good ability to maintain earnings power. BBY stock is valued for slightly more growth than I anticipate, marking an estimated -14% downside.",https://seekingalpha.com/article/4737321-best-buy-q3-outlook-remains-weak
BBY,2024-11-14 09:30:00,Whisker Announces Nationwide Retail Expansion at Best Buy,https://images.financialmodelingprep.com/news/whisker-announces-nationwide-retail-expansion-at-best-buy-20241114.jpg,businesswire.com,"AUBURN HILLS, Mich.--(BUSINESS WIRE)--Whisker, the global leader in connected pet care and maker of Litter-Robot®, announces its in-store expansion to Best Buy nationwide. Whisker's hero product Litter-Robot 4 (available in Black and White) will be the first self-cleaning litter box available for Best Buy customers in over 200 stores nationwide and online at BestBuy.com. ""We're thrilled to announce our in-store expansion with Best Buy, a partnership that aligns with our mission to bring innovat.",https://www.businesswire.com/news/home/20241114833091/en/Whisker-Announces-Nationwide-Retail-Expansion-at-Best-Buy/
BBY,2024-11-08 04:30:00,Confluence's Revolution solution recognized as Best Buy-side Risk Management Initiative by Waters Technology,https://images.financialmodelingprep.com/news/confluences-revolution-solution-recognized-as-best-buyside-risk-management-20241108.jpg,businesswire.com,"PITTSBURGH--(BUSINESS WIRE)--Confluence Technologies, Inc. (“Confluence”), a global technology solutions provider for regulatory, analytics, and investor communications solutions for the investment management industry, proudly announced that its Revolution solution for multi-asset performance, attribution and risk analytics, has been named Best Buy-side Risk Management Initiative in the Last 12 Months by Waters Technology's Buy-side Technology Awards, marking the fourth time Confluence has won.",https://www.businesswire.com/news/home/20241107100618/en/Confluence%E2%80%99s-Revolution-solution-recognized-as-Best-Buy-side-Risk-Management-Initiative-by-Waters-Technology/
BBY,2024-11-07 17:48:53,Buy 7 November Barron's Better Bet DiviDogs Of 23 & Watch 3 More To Be 'Safer',https://images.financialmodelingprep.com/news/buy-7-november-barrons-better-bet-dividogs-of-23-20241107.jpg,seekingalpha.com,"Long-term bond yields continue to rise. But investors looking for income can still find plenty of attractive opportunities with dividend-paying stocks that have healthy yields. “23 stocks pay huge dividends. They should be a better bet than treasuries.” —Barron's Weekly. In an interview with Barron's, Steven Wieting, strategist at Citi Wealth, stated a growing dividend is a shareholder benefit and a hallmark of strong balance-sheets. “Nobody can fake a dividend,” he-said.",https://seekingalpha.com/article/4734566-buy-7-november-barrons-better-bet-dividogs-of-23-and-watch-3-more-be-safer
BBY,2024-11-07 10:35:28,"Best Buy (BBY) Loses -9.37% in 4 Weeks, Here's Why a Trend Reversal May be Around the Corner",https://images.financialmodelingprep.com/news/best-buy-bby-loses-937-in-4-weeks-heres-20241107.jpg,zacks.com,"The heavy selling pressure might have exhausted for Best Buy (BBY) as it is technically in oversold territory now. In addition to this technical measure, strong agreement among Wall Street analysts in revising earnings estimates higher indicates that the stock is ripe for a trend reversal.",https://www.zacks.com/stock/news/2366298/best-buy-bby-loses-9-37-in-4-weeks-here-s-why-a-trend-reversal-may-be-around-the-corner?cid=CS-STOCKNEWSAPI-FT-tale_of_the_tape|rsi-2366298
BBY,2024-11-04 10:22:00,"Artificial Intelligence Risk Inc. Named as Waters Technology's ""Best buy-side AI platform or tool (compliance)"" for the AIR- GPT Gen AI Platform",https://images.financialmodelingprep.com/news/artificial-intelligence-risk-inc-named-as-waters-technologys-best-20241104.jpg,newsfilecorp.com,"Waters Technology Recognizes Generative-AI Platform Focused on Compliance and Cybersecurity Greenwich, Connecticut--(Newsfile Corp. - November 4, 2024) - Artificial Intelligence Risk, Inc. (AI Risk, Inc.), the leader in Gen AI compliance and cybersecurity software, today announced its recognition as the best buy-side AI platform or tool (compliance) by WaterTechnology's 2024 Buy-Side Technology Awards. This acknowledgement, awarded as AI Risk, Inc. is growing rapidly in terms of both clients and staff, underscores the company's rapid and exceptional impact on the financial industry.",https://www.newsfilecorp.com/release/228682/Artificial-Intelligence-Risk-Inc.-Named-as-Waters-Technologys-Best-buyside-AI-platform-or-tool-compliance-for-the-AIR-GPT-Gen-AI-Platform
BBY,2024-11-01 13:11:10,Will Best Buy (BBY) Beat Estimates Again in Its Next Earnings Report?,https://images.financialmodelingprep.com/news/will-best-buy-bby-beat-estimates-again-in-its-20241101.jpg,zacks.com,Best Buy (BBY) has an impressive earnings surprise history and currently possesses the right combination of the two key ingredients for a likely beat in its next quarterly report.,https://www.zacks.com/stock/news/2362825/will-best-buy-bby-beat-estimates-again-in-its-next-earnings-report?cid=CS-STOCKNEWSAPI-FT-tale_of_the_tape|yseop_template_7-2362825
BBY,2024-11-01 09:50:25,Why Investors Need to Take Advantage of These 2 Retail and Wholesale Stocks Now,https://images.financialmodelingprep.com/news/why-investors-need-to-take-advantage-of-these-2-20241101.jpg,zacks.com,The Zacks Earnings ESP is a great way to find potential earnings surprises. Why investors should take advantage now.,https://www.zacks.com/stock/news/2362415/why-investors-need-to-take-advantage-of-these-2-retail-and-wholesale-stocks-now?cid=CS-STOCKNEWSAPI-FT-tale_of_the_tape|zacks_education_earnings_esp-2362415
BBY,2024-10-30 07:52:48,Google Gets No Respect From Wall Street: Still The Best Buy In Tech,https://images.financialmodelingprep.com/news/google-gets-no-respect-from-wall-street-still-the-20241030.jpg,seekingalpha.com,"After a blowout Q3, Wall Street's current earnings estimates for Google are likely too low and will be revised higher, driven by the company's success in cloud computing. Google's earnings quality and growth are superior to peers, making its lower valuation compared to Apple and other tech giants increasingly unjustified. This presents a buying opportunity. GOOGL deserves to be a more popular stock than it is.",https://seekingalpha.com/article/4730796-google-stock-blowout-q3-earnings-best-buy-in-tech
BBY,2024-10-27 09:05:23,Dividend Aristocrats Of The Future - Part 2,https://images.financialmodelingprep.com/news/dividend-aristocrats-of-the-future-part-2-20241027.jpg,seekingalpha.com,This is the second group of 10 companies who are aiming to reach dividend aristocrat status in the near future. The majority of these companies are from the utilities sector with two defense contractors also included. A few of the companies have 10-year dividend growth rates above 10%.,https://seekingalpha.com/article/4729960-dividend-aristocrats-of-the-future-part-2
BBY,2024-10-26 09:00:00,"Roborock Expands to More Than 850 Best Buy Stores, Offers Exclusive Promotion on the Powerful S8 MaxV Ultra",https://images.financialmodelingprep.com/news/roborock-expands-to-more-than-850-best-buy-stores-20241026.jpg,prnewswire.com,"Roborock Celebrates the Availability of Innovative Robot Vacuum with Limited-Time Offer HONG KONG , Oct. 26, 2024 /PRNewswire/ -- Roborock, a global leader in ultra-intelligent home robotics engineered to simplify daily life, is expanding its presence into over 850 Best Buy stores across the United States. In honor of the news, Roborock is running an exclusive discount on the sleek, high-tech Roborock S8 MaxV Ultra, available in Best Buy stores, on BestBuy.com and through the Best Buy App.",https://www.prnewswire.com/news-releases/roborock-expands-to-more-than-850-best-buy-stores-offers-exclusive-promotion-on-the-powerful-s8-maxv-ultra-302287387.html
BBY,2024-10-22 09:45:19,Best Buy's Game Plan to Engage Shoppers This Holiday Season,https://images.financialmodelingprep.com/news/best-buys-game-plan-to-engage-shoppers-this-holiday-20241022.jpg,zacks.com,"BBY is set to start its holiday shopping season early with Black Friday deals, offering weekly doorbusters and return policies to enhance the shopping experience.",https://www.zacks.com/stock/news/2354877/best-buy-s-game-plan-to-engage-shoppers-this-holiday-season?cid=CS-STOCKNEWSAPI-FT-analyst_blog|company_news_corporate_actions-2354877
BBY,2024-10-15 15:08:26,"Technical Tuesday: SPX, BBY, DHI",https://images.financialmodelingprep.com/news/technical-tuesday-spx-bby-dhi-20241015.jpg,youtube.com,"Kevin Horner returns with this week's Technical Tuesday, where he breaks down technical trends in charts of interest. For the S&P 500 (SPX), he's interested in how the index has consolidated since the Fed's rate cut, and whether levels can continue pushing to the upside.",https://www.youtube.com/watch?v=oRylm_TFrOk
BBY,2024-10-15 10:56:14,"Bears are Losing Control Over Best Buy (BBY), Here's Why It's a 'Buy' Now",https://images.financialmodelingprep.com/news/bears-are-losing-control-over-best-buy-bby-heres-why-20241015.jpg,zacks.com,"Best Buy (BBY) appears to have found support after losing some value lately, as indicated by the formation of a hammer chart. In addition to this technical chart pattern, strong agreement among Wall Street analysts in revising earnings estimates higher enhances the stock's potential for a turnaround in the near term.",https://www.zacks.com/stock/news/2350698/bears-are-losing-control-over-best-buy-bby-here-s-why-it-s-a-buy-now?cid=CS-STOCKNEWSAPI-FT-tale_of_the_tape|hammer_chart_pattern_(ta)-2350698
BBY,2024-10-15 10:46:02,Is Best Buy (BBY) Outperforming Other Retail-Wholesale Stocks This Year?,https://images.financialmodelingprep.com/news/is-best-buy-bby-outperforming-other-retailwholesale-stocks-this-20241015.jpg,zacks.com,Here is how Best Buy (BBY) and Nordstrom (JWN) have performed compared to their sector so far this year.,https://www.zacks.com/stock/news/2350622/is-best-buy-bby-outperforming-other-retail-wholesale-stocks-this-year?cid=CS-STOCKNEWSAPI-FT-tale_of_the_tape|yseop_template_1-2350622
BBY,2024-10-15 07:45:00,Best Buy: Impressive Bull Run But Dividend Safety Remains A Concern,https://images.financialmodelingprep.com/news/best-buy-impressive-bull-run-but-dividend-safety-remains-20241015.jpg,seekingalpha.com,"Best Buy has experienced a strong price appreciation despite headwinds, with the stock up nearly 40% over the past year. The company's dividend safety is a concern, with a payout ratio over 100% due to declining cash flows. Best Buy's FY24 outlook is positive, with raised revenue and EPS guidance, but cash flow and comparable sales declines remain concerns.",https://seekingalpha.com/article/4726192-best-buy-impressive-bull-run-but-dividend-safety-remains-a-concern
BBY,2024-10-11 14:31:53,"Three Buys and a Bail: Goldman Sachs, Caterpillar, D.R. Horton, and Best Buy",https://images.financialmodelingprep.com/news/three-buys-and-a-bail-goldman-sachs-caterpillar-dr-20241011.jpg,youtube.com,"Gina Sanchez, Lido Advisors chief market strategist, joins CNBC's 'The Exchange' to discuss these stocks: Goldman Sachs, Caterpillar, D.R. Horton, Best Buy.",https://www.youtube.com/watch?v=twZzmCbOMRM
BBY,2024-10-08 07:45:27,Best Buy: AI Demand Is Recharging the Electronics Upgrade Cycle,https://images.financialmodelingprep.com/news/best-buy-ai-demand-is-recharging-the-electronics-upgrade-20241008.jpg,marketbeat.com,"Buy Best Co. Inc. NYSE: BBY is a leading big-box retailer of consumer electronics products and services. The company's physical stores average 36,800 square feet, which has actually been shrinking.",https://www.marketbeat.com/originals/best-buy-ai-demand-is-recharging-the-electronics-upgrade-cycle/
BBY,2024-10-08 07:00:23,Top 3 Growth Stocks Poised for a Strong Q4 2024 Rally,https://images.financialmodelingprep.com/news/top-3-growth-stocks-poised-for-a-strong-q4-20241008.jpg,marketbeat.com,"As 2024 comes to a close, seasonality is a theme that occurs every year entering the holiday season. A look back at some of the familiar headline trends for 2024 includes the AI data center boom, shortage of GLP-1 drugs, fresh demand for nuclear power, restarting the interest rate cut cycle, off-price shopping frenzy, retailer inventory normalization, and the ad market, and cloud computing recovery.",https://www.marketbeat.com/stock-ideas/top-3-growth-stocks-poised-for-a-strong-q4-2024-rally/
BBY,2024-10-02 16:10:41,Best Buy (BBY) Stock Declines Amid Broader Retail Sector Weakness,https://images.financialmodelingprep.com/news/best-buy-bby-stock-declines-amid-broader-retail-sector-20241002.jpg,gurufocus.com,"Best Buy (BBY, Financial) experienced a 1.36% drop in its stock price, reaching $99.97 per share with a trading volume of 795,462 shares and a turnover rate of 0.37%. The stock's volatility was recorded at 1.38%.",https://www.gurufocus.com/news/2540832/best-buy-bby-stock-declines-amid-broader-retail-sector-weakness
BBY,2024-09-25 08:29:47,Top 10 Stock Picks For The Holiday Boom: Adobe Forecasts Unprecedented E-Commerce Sales This Season,https://images.financialmodelingprep.com/news/top-10-stock-picks-for-the-holiday-boom-adobe-forecasts-unprecedented-20240925.jpg,benzinga.com,"Consumers remained a pillar of support for the economy despite the high interest-rate environment that has prevailed since early 2022. With the Federal Reserve implementing a substantial 50 basis-point rate cut, the benefits of which are expected to trickle down to them, consumers are forecasted to splurge on purchases this holiday season, according to early forecasts provided by Adobe on Wednesday.",https://www.benzinga.com/news/24/09/41023224/top-10-stock-picks-for-the-holiday-boom-adobe-forecasts-unprecedented-e-commerce-sales-this-season
BBY,2024-09-20 09:31:11,5 Broker-Loved Stocks to Keep an Eye on Post Fed's Huge Rate Cut,https://images.financialmodelingprep.com/news/5-brokerloved-stocks-to-keep-an-eye-on-post-20240920.jpg,zacks.com,"Investors should monitor stocks like American Airlines (AAL), Alaska Air (ALK), Warner Bros. Discovery (WBD), Dana (DAN) and Best Buy (BBY) for high returns.",https://www.zacks.com/stock/news/2339066/5-broker-loved-stocks-to-keep-an-eye-on-post-fed-s-huge-rate-cut?cid=CS-STOCKNEWSAPI-FT-analyst_blog|rw-2339066
BBY,2024-09-19 00:20:00,"Best Buy: Encouraging Trends, But Risks Remain (Rating Upgrade)",https://images.financialmodelingprep.com/news/best-buy-encouraging-trends-but-risks-remain-rating-upgrade-20240919.jpg,seekingalpha.com,"Best Buy's Q2 earnings exceeded expectations, boosting shares by nearly 30% YTD, but the sustainability of this rally is uncertain. Upgrading Best Buy to neutral, but still recommending that investors remain on the sidelines. Risks include declining same-store sales in other electronics, potentially unsustainable dividends, and margin pressures from deal-oriented consumers.",https://seekingalpha.com/article/4721983-best-buy-encouraging-trends-but-risks-remain-bby-stock
BBY,2024-09-04 16:30:00,Sealed Air Provides Packaging Solutions for Best Buy,https://images.financialmodelingprep.com/news/sealed-air-provides-packaging-solutions-for-best-buy-20240904.jpg,prnewswire.com,"Converting to Sealed Air helps company use more recycled content in packaging materials CHARLOTTE, N.C. , Sept. 4, 2024 /PRNewswire/ -- Sealed Air (NYSE: SEE) is helping Best Buy (NYSE: BBY) through the introduction of packaging solutions that allow the company to use more recycled packaging content for shipping Best Buy products to consumers across North America.",https://www.prnewswire.com/news-releases/sealed-air-provides-packaging-solutions-for-best-buy-302238197.html
BBY,2024-09-03 08:17:36,Top 5 Consumer Stocks That Could Sink Your Portfolio In Q3,https://images.financialmodelingprep.com/news/top-5-consumer-stocks-that-could-sink-your-portfolio-20240903.jpg,benzinga.com,"As of Sept. 3, 2024, five stocks in the consumer discretionary sector could be flashing a real warning to investors who value momentum as a key criteria in their trading decisions.",https://www.benzinga.com/news/24/09/40685430/top-5-consumer-stocks-that-could-sink-your-portfolio-in-q3
BBY,2024-09-02 09:31:33,"Affirm, Mongodb And Best Buy Are Among Top 10 Large Cap Gainers Last Week (Aug 25-Aug 31): Are The Others In Your Portfolio?",https://images.financialmodelingprep.com/news/affirm-mongodb-and-best-buy-are-among-top-10-20240902.jpg,benzinga.com,These ten large-cap stocks were the best performers in the last week. Are they in your portfolio?,https://www.benzinga.com/news/large-cap/24/09/40674984/affirm-mongodb-and-best-buy-are-among-top-10-large-cap-gainers-last-week-aug-25-aug-31-are-the-oth
BBY,2024-08-30 13:46:47,Best Buy's Growth Will Be Driven By AI And Margin Expansion Despite Mixed Sector Challenges: Analysts,https://images.financialmodelingprep.com/news/best-buys-growth-will-be-driven-by-ai-and-margin-20240830.jpg,benzinga.com,"Several analysts raised the price target on Best Buy Co., Inc. BBY following better-than-expected second-quarter financial results reported Thursday.",https://www.benzinga.com/analyst-ratings/analyst-color/24/08/40658989/best-buys-growth-will-be-driven-by-ai-and-margin-expansion-despite-mixed-sector-cha
