symbol,publishedDate,title,image,site,text,url
INTC,2025-04-10 12:00:43,Intel (INTC) Moves 18.8% Higher: Will This Strength Last?,https://images.financialmodelingprep.com/news/intel-intc-moves-188-higher-will-this-strength-last-20250410.jpg,zacks.com,Intel (INTC) saw its shares surge in the last session with trading volume being higher than average. The latest trend in earnings estimate revisions may not translate into further price increase in the near term.,https://www.zacks.com/stock/news/2443709/intel-intc-moves-18-8-higher-will-this-strength-last?cid=CS-STOCKNEWSAPI-FT-tale_of_the_tape|daily_price_change_5%-2443709
INTC,2025-04-10 09:30:00,Intel: Generational Buying Opportunity Approaches,https://images.financialmodelingprep.com/news/intel-generational-buying-opportunity-approaches-20250410.jpg,seekingalpha.com,"Intel's stock remains a ""strong buy"" due to historically low price-book ratios and limited downside potential, despite recent declines in share prices. Intel's Q4 2024 earnings surpassed estimates, but revenue and net income showed declines, creating a challenging starting point for the new CEO. Comparatively, Intel's price-book ratio is significantly lower than key competitors like AMD, Qualcomm, and Nvidia, highlighting its undervaluation.",https://seekingalpha.com/article/4774221-intel-generational-buying-opportunity-approaches
INTC,2025-04-10 06:08:07,Intel CEO Lip-Bu Tan's wide-ranging investments in China,https://images.financialmodelingprep.com/news/intel-ceo-lipbu-tans-wideranging-investments-in-china-20250410.jpg,reuters.com,"Intel CEO Lip-Bu Tan has made hundreds of investments in Chinese companies over decades through Walden International, the San Francisco venture capital firm he founded in 1987, and two Hong Kong-based holding companies, Sakarya Limited and Seine Limited. The following are some key investments uncovered by Reuters and their connections to Chinese state entities:",https://www.reuters.com/technology/intel-ceo-lip-bu-tans-wide-ranging-investments-china-2025-04-10/
INTC,2025-04-10 06:03:00,"Insight: Intel CEO invested in hundreds of Chinese companies, some with military ties",https://images.financialmodelingprep.com/news/insight-intel-ceo-invested-in-hundreds-of-chinese-companies-20250410.jpg,reuters.com,"Lip-Bu Tan, the man chosen to lead Intel, the U.S.'s largest chip maker, has invested in hundreds of Chinese tech firms, including at least eight with links to the People's Liberation Army, according to a Reuters review of Chinese and U.S. corporate filings.",https://www.reuters.com/technology/intel-ceo-invested-hundreds-chinese-companies-some-with-military-ties-2025-04-10/
INTC,2025-04-09 14:30:08,"Market's Explosive Reaction to Tariff Pause, INTC in ""the Crosshairs""",https://images.financialmodelingprep.com/news/markets-explosive-reaction-to-tariff-pause-intc-in-the-20250409.jpg,youtube.com,"George Tsilis reacts to President Trump's tariff pause announcement, pointing to the $5,400 level on the SPX as a potential rallying point. He warns against fear, saying that people tend to panic at the bottom.",https://www.youtube.com/watch?v=6yJDklwyeHk
INTC,2025-04-09 08:48:34,"NVDA, INTC and AMD Forecast – Chips Continues to See Tariff Pressures",https://images.financialmodelingprep.com/news/nvda-intc-and-amd-forecast-chips-continues-to-see-20250409.jpg,fxempire.com,"The major microchip manufacturers continue to see a lot of noise form the tariff situation between the United States and China, as well as fears of a lack of spending via cap ex.",https://www.fxempire.com/forecasts/article/nvda-intc-and-amd-forecast-chips-continues-to-see-tariff-pressures-1510496
INTC,2025-04-09 08:03:00,Intel 471's Chief Intelligence Officer Michael DeBolt Honored as a Finalist of the 2025 SC Awards,https://images.financialmodelingprep.com/news/intel-471s-chief-intelligence-officer-michael-debolt-honored-as-20250409.jpg,businesswire.com,"WILMINGTON, Del.--(BUSINESS WIRE)--Michael DeBolt is honored as a Finalist of the 2025 SC Awards among the Most Innovative Executives and Practitioners of the Year.",https://www.businesswire.com/news/home/20250409110771/en/Intel-471%E2%80%99s-Chief-Intelligence-Officer-Michael-DeBolt-Honored-as-a-Finalist-of-the-2025-SC-Awards/
INTC,2025-04-09 06:20:00,Will Intel Stock Be a Trade War Winner?,https://images.financialmodelingprep.com/news/will-intel-stock-be-a-trade-war-winner-20250409.jpg,fool.com,"Semiconductor giant Intel (INTC -7.28%) has a new CEO ready to shake up the company after years of disappointing results. Intel has been losing market share to AMD in its core CPU businesses, struggling to gain a foothold in the AI accelerator market, and pouring billions into new factories and manufacturing technology.",https://www.fool.com/investing/2025/04/09/will-intel-stock-be-a-trade-war-winner/
INTC,2025-04-08 21:22:03,Why Intel Stock Was Up 13.3% in Q1 as the S&P 500 Had Its Worst Quarter Since 2022,https://images.financialmodelingprep.com/news/why-intel-stock-was-up-133-in-q1-as-20250408.jpg,fool.com,The first three months of 2025 were a tough run for the market. The S&P 500 lost 4.6% and the Nasdaq Composite lost 10.4%.,https://www.fool.com/investing/2025/04/08/why-intel-stock-was-up-133-in-q1-as-the-sp-500-had/
INTC,2025-04-08 11:30:00,Ultra Clean Earns Intel's 2025 EPIC Supplier Award,https://images.financialmodelingprep.com/news/ultra-clean-earns-intels-2025-epic-supplier-award-20250408.jpg,prnewswire.com,"HAYWARD, Calif. , April 8, 2025 /PRNewswire/ -- Ultra Clean Holdings, Inc. (Nasdaq, UCTT) is proud to announce that it has earned the exclusive Intel EPIC Supplier Award for 2025.",https://www.prnewswire.com/news-releases/ultra-clean-earns-intels-2025-epic-supplier-award-302422538.html
INTC,2025-04-08 10:30:08,"NVDA & INTC Behind AMD Downgrade, WFC & LLY Upgrades",https://images.financialmodelingprep.com/news/nvda-intc-behind-amd-downgrade-wfc-lly-upgrades-20250408.jpg,youtube.com,"Keybanc downgraded AMD Inc. (AMD) to Sector Weight from Overweight, but it didn't shake the stock's rally alongside the market. Diane King Hall talks about why Nvidia (NVDA) and Intel (INTC) are behind the firm's bearish sentiment.",https://www.youtube.com/watch?v=DQf6rMteKLQ
INTC,2025-04-08 08:31:53,Intel-Taiwan Semiconductor Alliance Fuels Turnaround Hopes,https://images.financialmodelingprep.com/news/inteltaiwan-semiconductor-alliance-fuels-turnaround-hopes-20250408.jpg,marketbeat.com,"Intel Corporation NASDAQ: INTC is the subject of intense market speculation following rumors of a potential landmark partnership with Taiwan Semiconductor Manufacturing Company NYSE: TSM, the world's leading contract chip manufacturer.",https://www.marketbeat.com/originals/intel-taiwan-semiconductor-alliance-fuels-turnaround-hopes/
INTC,2025-04-08 08:00:03,Analysts Name 9 Stocks Where Profit Is About To Fall Apart,https://images.financialmodelingprep.com/news/analysts-name-9-stocks-where-profit-is-about-to-20250408.jpg,investors.com,"In an age of rising tariffs, earnings growth is one thing S&P 500 investors can lean on. But for some companies, you don't even have that to count on.",https://www.investors.com/etfs-and-funds/sectors/sp500-analysts-name-stocks-where-profit-is-about-to-fall-apart/
INTC,2025-04-08 07:58:00,Advanced Micro Devices Stock Gets a Downgrade. Nvidia and Intel Are Part of the Problem.,https://images.financialmodelingprep.com/news/advanced-micro-devices-stock-gets-a-downgrade-nvidia-and-20250408.jpg,barrons.com,"Advanced Micro Devices risks falling behind as competition in the server and PC markets ramps up, say analysts at KeyBanc.",https://www.barrons.com/articles/advanced-micro-devices-stock-downgrade-nvidia-intel-ai-262a4f63
INTC,2025-04-08 02:28:42,Wall Street Gave Up On Intel - Should You Bet Against The Crowd,https://images.financialmodelingprep.com/news/wall-street-gave-up-on-intel-should-you-bet-20250408.jpg,seekingalpha.com,"Intel is undergoing a strategic overhaul to regain competitiveness, including splitting its foundry operations and revamping its chip design roadmap. The stock trades at a deep discount, reflecting skepticism that may overlook improving execution and long-term potential. Management is candid about past failures and is now aggressively investing in technology, manufacturing, and structural change.",https://seekingalpha.com/article/4773611-wall-street-gave-up-on-intel-should-you-bet-against-the-crowd
INTC,2025-04-07 16:00:33,Can Intel Be the Turnaround Stock of 2025? Is the Time to Buy Now?,https://images.financialmodelingprep.com/news/can-intel-be-the-turnaround-stock-of-2025-is-20250407.jpg,zacks.com,"With Lip-Bu Tan as the new CEO, Intel stock might become a top buy this year with a potential turnaround.",https://www.zacks.com/stock/news/2441461/can-intel-be-the-turnaround-stock-of-2025-is-the-time-to-buy-now?cid=CS-STOCKNEWSAPI-FT-analyst_blog|investment_ideas-2441461
INTC,2025-04-07 14:04:55,Intel: A Surprising Tariff Winner,https://images.financialmodelingprep.com/news/intel-a-surprising-tariff-winner-20250407.jpg,seekingalpha.com,"Intel targets over 100 million AI PC shipments by end-CY25, leveraging Core Ultra chips and 400+ AI-optimized features from 200+ ISVs. Panther Lake, launching H2 CY25 on Intel 18A, is set to be the first high-volume AI CPU on Intel's next-gen node, anchoring future growth. Intel Foundry posted a $13B loss in CY24 despite $18B revenue; EUV wafer mix remains low at ~5%, breakeven expected by CY27.",https://seekingalpha.com/article/4773512-intel-a-surprising-tariff-winner
INTC,2025-04-07 10:47:19,Investors Heavily Search Intel Corporation (INTC): Here is What You Need to Know,https://images.financialmodelingprep.com/news/investors-heavily-search-intel-corporation-intc-here-is-what-20250407.jpg,zacks.com,"Zacks.com users have recently been watching Intel (INTC) quite a bit. Thus, it is worth knowing the facts that could determine the stock's prospects.",https://www.zacks.com/stock/news/2441051/investors-heavily-search-intel-corporation-intc-here-is-what-you-need-to-know?cid=CS-STOCKNEWSAPI-FT-tale_of_the_tape|most_searched_stocks-2441051
INTC,2025-04-06 07:15:00,Is Intel Stock a Buy?,https://images.financialmodelingprep.com/news/is-intel-stock-a-buy-20250406.jpg,fool.com,Investors are taking a new look at Intel's (INTC -11.21%) stock after the appointment of Lip-Bu Tan as its new CEO. He takes over as Intel struggles to catch up to competitors and develop a foundry business that can compete with Taiwan Semiconductor Manufacturing and Samsung.,https://www.fool.com/investing/2025/04/06/is-intel-stock-a-buy/
INTC,2025-04-05 08:53:00,Billionaire Paul Tudor Jones Trimmed His Position in Nvidia and Is Piling Into 2 Turnaround Tech Stocks,https://images.financialmodelingprep.com/news/billionaire-paul-tudor-jones-trimmed-his-position-in-nvidia-20250405.jpg,fool.com,"The U.S. equity market has been volatile over the past few weeks, with major indexes reflecting bearish market sentiment. Investors are concerned about the rising risk of stagflation (a combination of slower growth and higher prices), fueled mainly by increasing tariffs, rising costs, and policy uncertainties.",https://www.fool.com/investing/2025/04/05/billionaire-paul-tudor-jones-trimmed-position-in/
INTC,2025-04-05 06:29:00,"President Donald Trump Introduces Worldwide Tariffs, Causing Intel Stock to Dip. Is It Time to Buy?",https://images.financialmodelingprep.com/news/president-donald-trump-introduces-worldwide-tariffs-causing-intel-stock-20250405.jpg,fool.com,Intel (INTC -11.21%) stock investors have much to digest this week as tariffs increase economic uncertainty.,https://www.fool.com/investing/2025/04/05/president-donald-trump-introduces-worldwide-tariff/
INTC,2025-04-04 18:30:29,"Final Trade: TEF, VST, INTC",https://images.financialmodelingprep.com/news/final-trade-tef-vst-intc-20250404.jpg,youtube.com,The final trades of the day with CNBC's Melissa Lee and the Fast Money traders.,https://www.youtube.com/watch?v=xPKtF_MkGbo
INTC,2025-04-04 14:32:49,Why Intel Stock Is Crashing Today,https://images.financialmodelingprep.com/news/why-intel-stock-is-crashing-today-20250404.jpg,fool.com,Shares of Intel (INTC -11.68%) are tumbling on Thursday. The chipmaker's stock lost 10.8% as of 1:40 p.m.,https://www.fool.com/investing/2025/04/04/why-intel-stock-is-plummeting-today/
INTC,2025-04-04 13:31:57,Intel-TSMC joint venture marks strategic shift for US foundry ambitions,https://images.financialmodelingprep.com/news/inteltsmc-joint-venture-marks-strategic-shift-for-us-foundry-20250404.jpg,proactiveinvestors.com,"Intel Corp (NASDAQ:INTC, ETR:INL) and Taiwan Semiconductor Manufacturing Co (ADR) (NYSE:TSM) (TSMC) have reportedly reached a preliminary agreement to form a joint venture (JV) that may mark a turning point in Intel's ambitious foundry strategy, analysts at UBS believe. Per media reports, TSMC would acquire its 20% stake through the contribution of technology and personnel, versus capital investment.",https://www.proactiveinvestors.com/companies/news/1069170
INTC,2025-04-04 09:45:08,Tariffs Threaten INTC & TSM Tentative Chipmaking Venture,https://images.financialmodelingprep.com/news/tariffs-threaten-intc-tsm-tentative-chipmaking-venture-20250404.jpg,youtube.com,Intel (INTC) initially soared after The Information reported it and TSMC (TSM) joined a tentative agreement to build their own chipmaking venture. Jenny Horne points to one overhang: Trump's tariffs.,https://www.youtube.com/watch?v=kVYhKEghE3o
INTC,2025-04-04 08:59:20,INTC/TSMC Tie-Up: Chipmakers' New Venture,https://images.financialmodelingprep.com/news/intctsmc-tieup-chipmakers-new-venture-20250404.jpg,youtube.com,Jenny Horne details the reported agreement between Intel (INTC) and TSMC (TSM) to start a new joint venture to take over control of INTC manufacturing facilities. The report originated from The Information and says TSMC will take a 20% stake in the JV.,https://www.youtube.com/watch?v=Iyy0Ee_Bk-8
INTC,2025-04-04 08:42:55,"INTC, AMD and AVGO Forecast – Chip Stocks Falling with Everything Else",https://images.financialmodelingprep.com/news/intc-amd-and-avgo-forecast-chip-stocks-falling-with-20250404.jpg,fxempire.com,"The three chip manufacturers in this analysis are all falling right along with everything else on Wall Street, despite the news that Intel and Taiwan Semiconductor are reaching a preliminary agreement on production in the US.",https://www.fxempire.com/forecasts/article/intc-amd-and-avgo-forecast-chip-stocks-falling-with-everything-else-1509456
INTC,2025-04-04 08:06:49,Intel's Big Bet on 18A: Will Lip-Bu Tan's Vision Pay Off?,https://images.financialmodelingprep.com/news/intels-big-bet-on-18a-will-lipbu-tans-vision-20250404.jpg,marketbeat.com,"Intel Corporation NASDAQ: INTC is at a critical juncture in its multi-year turnaround strategy. The appointment of CEO Lip-Bu Tan led to an initial stock surge, which has since subsided, with shares trading near $21.35 in early April.",https://www.marketbeat.com/originals/intels-big-bet-on-18a-will-lip-bu-tans-vision-pay-off/
INTC,2025-04-04 07:57:49,China retaliatory tariffs add to Intel woes; QCOM to also take a hit,https://images.financialmodelingprep.com/news/china-retaliatory-tariffs-add-to-intel-woes-qcom-to-also-20250404.jpg,invezz.com,"Intel Corp (NASDAQ: INTC) is inching down further on Friday after China delivered on its promise of slapping retaliatory tariffs on American goods. From April 10, all US products will now face a 34% tariff in Beijing.",https://invezz.com/news/2025/04/04/china-retaliatory-tariffs-add-to-intel-woes-qcom-to-also-take-a-hit/
INTC,2025-04-04 05:15:00,Huge News for Intel Stock Investors,https://images.financialmodelingprep.com/news/huge-news-for-intel-stock-investors-20250404.jpg,fool.com,"In this video, I will talk about recent updates regarding Intel (INTC 2.30%). Watch the short video to learn more, consider subscribing, and click the special offer link below.",https://www.fool.com/investing/2025/04/04/huge-news-for-intel-stock-investors/
INTC,2025-04-04 04:19:47,Why An Intel-TSMC Marriage Makes Sense,https://images.financialmodelingprep.com/news/why-an-inteltsmc-marriage-makes-sense-20250404.jpg,seekingalpha.com,"Intel and Taiwan Semiconductor have preliminarily agreed on a joint venture to operate some of Intel's foundries. Intel would maintain a significant stake, while TSMC would get a 20% stake in exchange for training and sharing expertise. While many details remain uncertain, this arrangement has potential benefits for both companies.",https://seekingalpha.com/article/4772943-why-an-intel-tsmc-marriage-makes-sense
INTC,2025-04-03 17:19:30,Why Intel Stock Jumped in a Brutal Day for the Market,https://images.financialmodelingprep.com/news/why-intel-stock-jumped-in-a-brutal-day-for-20250403.jpg,fool.com,Intel (INTC 2.30%) stock posted gains despite big sell-offs for the broader market Thursday. The semiconductor company's share price closed out the day up 2.1% and had been up as much as 8.7% earlier in trading.,https://www.fool.com/investing/2025/04/03/why-intel-stock-jumped-in-a-brutal-day-for-the-mar/
INTC,2025-04-03 16:40:17,Intel and TSMC tentatively agree to form chipmaking joint venture: Here's what you need to know,https://images.financialmodelingprep.com/news/intel-and-tsmc-tentatively-agree-to-form-chipmaking-joint-20250403.jpg,youtube.com,CNBC's Kristina Partsinevelos joins ‘Closing Bell' to report on big news from Intel and TSMC.,https://www.youtube.com/watch?v=Zv3hurofJZA
INTC,2025-04-03 16:25:46,Intel and TSMC are reportedly launching a joint chipmaking venture,https://images.financialmodelingprep.com/news/intel-and-tsmc-are-reportedly-launching-a-joint-chipmaking-20250403.jpg,techcrunch.com,Semiconductor giants Intel and TSMC are reportedly teaming up.,https://techcrunch.com/2025/04/03/intel-and-tsmc-are-reportedly-launching-a-joint-chipmaking-venture/
INTC,2025-04-03 15:00:00,"Intel, TSMC tentatively agree to form chipmaking joint venture, Information reports",https://images.financialmodelingprep.com/news/intel-tsmc-tentatively-agree-to-form-chipmaking-joint-venture-20250403.jpg,reuters.com,"Intel and Taiwan Semiconductor Manufacturing Co recently reached a preliminary agreement to form a joint venture to operate the U.S. firm's chipmaking facilities, the Information reported on Thursday, citing two people involved in the discussions.",https://www.reuters.com/technology/intel-tsmc-tentatively-agree-form-chipmaking-joint-venture-information-reports-2025-04-03/
INTC,2025-04-03 08:45:31,Should You Stay Invested in INTC Stock on Positive Growth Trends?,https://images.financialmodelingprep.com/news/should-you-stay-invested-in-intc-stock-on-positive-20250403.jpg,zacks.com,INTC appears to be treading in the middle of the road and investors could be better off if they exercise caution and stay invested for long-term gains.,https://www.zacks.com/stock/news/2439554/should-you-stay-invested-in-intc-stock-on-positive-growth-trends?cid=CS-STOCKNEWSAPI-FT-analyst_blog|most_popular_stocks-2439554
INTC,2025-04-02 20:45:49,Intel's New CEO Vows to Reform Outdated Development Model,https://images.financialmodelingprep.com/news/intels-new-ceo-vows-to-reform-outdated-development-model-20250402.jpg,pymnts.com,"Intel's new CEO, Lip-Bu Tan, is clear-eyed about the chipmaker's many problems and the tough road ahead as he engineers a turnaround to revive this legendary Silicon Valley company.",https://www.pymnts.com/technology/2025/intels-new-ceo-vows-to-reform-outdated-development-model/
INTC,2025-04-02 16:30:00,Intel to Report First-Quarter 2025 Financial Results,https://images.financialmodelingprep.com/news/intel-to-report-firstquarter-2025-financial-results-20250402.jpg,businesswire.com,"SANTA CLARA, Calif.--(BUSINESS WIRE)--Intel Corporation announced that it will report first-quarter financial results on Thursday, April 24, 2025.",https://www.businesswire.com/news/home/20250402628935/en/Intel-to-Report-First-Quarter-2025-Financial-Results/
INTC,2025-04-02 10:20:00,ASML Stock Gets a Downgrade. Why Intel and Samsung Are a Problem.,https://images.financialmodelingprep.com/news/asml-stock-gets-a-downgrade-why-intel-and-samsung-20250402.jpg,barrons.com,"The company has been a popular play on the AI chip boom but a lack of investment from Samsung and Intel could drag on its results, according to Mizuho.",https://www.barrons.com/articles/asml-stock-price-intel-samsung-tsmc-bffa7885
INTC,2025-04-02 08:38:50,Intel Investors Just Got Amazing News,https://images.financialmodelingprep.com/news/intel-investors-just-got-amazing-news-20250402.jpg,fool.com,"In today's video, I discuss Intel (INTC -2.91%) and recent updates investors should know. To learn more, check out the short video, consider subscribing, and click the special offer link below.",https://www.fool.com/investing/2025/04/02/intel-investors-just-got-amazing-news/
INTC,2025-04-02 08:20:00,Intel Stock Has Broken Its Winning Streak. This Could Help It Rally Again.,https://images.financialmodelingprep.com/news/intel-stock-has-broken-its-winning-streak-this-could-20250402.jpg,barrons.com,The chip maker has begun “risk production” on its new 18A chip-manufacturing process. It could be key for the stock.,https://www.barrons.com/articles/intel-stock-price-chips-563c390b
INTC,2025-04-01 18:20:30,Why Intel Stock Sank Today,https://images.financialmodelingprep.com/news/why-intel-stock-sank-today-20250401.jpg,fool.com,Intel (INTC -2.91%) stock moved lower on Tuesday. The company's share price closed out the session down 2.9% and had been off as much as 4.9% earlier in trading.,https://www.fool.com/investing/2025/04/01/why-intel-stock-sank-today/
INTC,2025-04-01 18:02:52,New Intel CEO lays out his vision for the company,https://images.financialmodelingprep.com/news/new-intel-ceo-lays-out-his-vision-for-the-20250401.jpg,youtube.com,"Commerce Secretary Howard Lutnick is signaling that he could withhold promised Chips Act grants unless companies expand their US projects. Moor Insights & Strategy founder, CEO, and chief analyst Patrick Moorhead joins Market Domination host Josh Lipton to discuss the implications of this move.",https://www.youtube.com/watch?v=Z_NMw_T71PQ
INTC,2025-04-01 12:33:00,Intel's new CEO is known to ‘underpromise and overdeliver.' Can he do it again?,https://images.financialmodelingprep.com/news/intels-new-ceo-is-known-to-underpromise-and-overdeliver-20250401.jpg,marketwatch.com,"Intel Corp. Chief Executive Lip-Bu Tan just had his first big chance to wow the investment community, but his speech at Intel's partner conference seemed to emphasize that there are no quick fixes for the company's challenges.",https://www.marketwatch.com/story/intels-new-ceo-is-known-to-underpromise-and-overdeliver-can-he-do-it-again-f54b3068
INTC,2025-04-01 11:30:12,"INTC Turnaround ""Won't Be Easy,"" CHIPS Act in Balance",https://images.financialmodelingprep.com/news/intc-turnaround-wont-be-easy-chips-act-in-balance-20250401.jpg,youtube.com,New Intel (INTC) CEO Lip-Bu Tan shared cautious optimism for the company's outlook.,https://www.youtube.com/watch?v=ZaEIkSeHC70
INTC,2025-04-01 11:24:26,Intel Faces Make-Or-Break Moment: Can New CEO Lip-Bu Tan Turn It Around?,https://images.financialmodelingprep.com/news/intel-faces-makeorbreak-moment-can-new-ceo-lipbu-tan-20250401.jpg,benzinga.com,"Intel Corp INTC just got a new captain, but it's going to take more than a fresh face to turn this ship around. CEO Lip-Bu Tan has stepped in with bold plans to spin off non-core units, add more engineers, and – perhaps most notably – ask customers for unfiltered feedback.",https://www.benzinga.com/trading-ideas/technicals/25/04/44588724/intel-make-or-break-moment-can-new-ceo-lip-bu-tan-turn-it-around
INTC,2025-04-01 05:45:00,"Have $1,000? These 2 Stocks Could Be Bargain Buys for 2025 and Beyond",https://images.financialmodelingprep.com/news/have-1000-these-2-stocks-could-be-bargain-buys-20250401.jpg,fool.com,"The stock market is looking scary right now as investors worry about the impact of tariffs and the ongoing effort to slash government spending. It can be tempting to stay on the sidelines, but it's important to remember that investing is a long-term game.",https://www.fool.com/investing/2025/04/01/have-1000-these-2-stocks-could-be-bargain-buys-for/
INTC,2025-04-01 05:30:00,The Clock Is Ticking Loudly for Intel's New Boss,https://images.financialmodelingprep.com/news/the-clock-is-ticking-loudly-for-intels-new-boss-20250401.jpg,wsj.com,"Lip-Bu Tan isn't yet signaling a major departure from Intel's past strategy, but expectations for change are high.",https://www.wsj.com/tech/intel-new-ceo-lip-bu-tan-2de6876f
INTC,2025-04-01 01:19:15,Intel's new CEO acknowledges the company fell behind and he wants customers to be 'brutally honest',https://images.financialmodelingprep.com/news/intels-new-ceo-acknowledges-the-company-fell-behind-and-20250401.jpg,businessinsider.com,"Intel's new CEO, Lip-Bu Tan, said he wants brutal customer feedback to address recent shortcomings. Tan's appointment follows Pat Gelsinger's departure in December.",https://www.businessinsider.com/intel-new-ceo-wants-customer-feedback-turnaround-lip-bu-tan-2025-4
INTC,2025-03-31 21:53:00,Intel's New CEO Says Company Turnaround ‘Won't Be Easy',https://images.financialmodelingprep.com/news/intels-new-ceo-says-company-turnaround-wont-be-easy-20250331.jpg,wsj.com,Intel's new chief executive Lip-Bu Tan told investors during the company's “Intel Vision” conference that the chip giant has been “too slow to adapt.” Photo: Intel Corporation; David Paul Morris/Bloomberg News,https://www.wsj.com/video/intels-new-ceo-says-company-turnaround-wont-be-easy/89410434-F36A-4AC8-A1DA-AFA3D6F6103D.html
