symbol,publishedDate,title,image,site,text,url
INTC,2025-02-13 08:48:51,Intel Stock Rides AI Momentum After VP Vance Urges Deregulation In Paris Speech,https://images.financialmodelingprep.com/news/intel-stock-rides-ai-momentum-after-vp-vance-urges-20250213.jpg,benzinga.com,Intel Corp INTC stock is up over 15% over the past five days on the heels of Vice President JD Vance‘s artificial intelligence deregulation speech at the AI Action Summit in Paris.,https://www.benzinga.com/trading-ideas/long-ideas/25/02/43692955/intel-stock-rides-ai-momentum-after-vp-vance-urges-deregulation-in-paris-speech
INTC,2025-02-13 08:18:44,"TTD, PLTR and INTC Forecast – Stocks Mixed Premarket",https://images.financialmodelingprep.com/news/ttd-pltr-and-intc-forecast-stocks-mixed-premarket-20250213.jpg,fxempire.com,"The stock market continues to go through the earnings call season, and this morning it looks like at least one is going to pay the price.",https://www.fxempire.com/forecasts/article/ttd-pltr-and-intc-forecast-stocks-mixed-premarket-1497578
INTC,2025-02-13 06:00:00,What Caused Intel Stock's 12% Rally?,https://images.financialmodelingprep.com/news/what-caused-intel-stocks-12-rally-20250213.jpg,forbes.com,"Intel stock performed well over the last two days, climbing approximately 12% across Monday and Tuesday. Several factors have contributed to Intel's recent surge.",https://www.forbes.com/sites/greatspeculations/2025/02/13/what-caused-intel-stocks-12-rally/
INTC,2025-02-12 15:44:56,"Future of A.I. Chips on Employment, QCOM Undervalued, ""Don't Bet Against"" INTC",https://images.financialmodelingprep.com/news/future-of-ai-chips-on-employment-qcom-undervalued-dont-20250212.jpg,youtube.com,Olivier Blanchard notes rockiness in the chip trade but expects it to smooth out with the world's growing reliance on A.I. He anticipates companies to use the technology in ways that improve employee efficiency.,https://www.youtube.com/watch?v=g8jjuK8eqDk
INTC,2025-02-12 15:08:00,Intel's stock is on a run not seen in more than two decades,https://images.financialmodelingprep.com/news/intels-stock-is-on-a-run-not-seen-in-20250212.jpg,marketwatch.com,"Intel is enjoying a strong three-day rally, fueled by a hospitable political climate and analyst commentary about its CPU business.",https://www.marketwatch.com/story/intels-stock-is-on-a-run-not-seen-in-more-than-two-decades-46eeb064
INTC,2025-02-12 11:47:18,Intel: Poised To Rise From The Ashes,https://images.financialmodelingprep.com/news/intel-poised-to-rise-from-the-ashes-20250212.jpg,seekingalpha.com,"Intel's 4Q24 earnings showed a 7% YoY sales drop, but Network and Edge grew 10% YoY, indicating potential for future growth. Despite a small profit beat, Intel faces challenges in 2025 unless it makes strategic business decisions, possibly divesting parts of its portfolio. New high-performance CPUs and AI microchips could drive Intel's growth in 2025, with Panther Lake launches potentially boosting sales.",https://seekingalpha.com/article/4757429-intel-poised-to-rise-from-the-ashes
INTC,2025-02-12 11:28:59,Why Intel Stock Popped on Wednesday,https://images.financialmodelingprep.com/news/why-intel-stock-popped-on-wednesday-20250212.jpg,fool.com,Intel (INTC 3.00%) stock is getting a lift Wednesday from some interesting commentary out of investment banker R.W. Baird.,https://www.fool.com/investing/2025/02/12/why-intel-stock-popped-on-wednesday/
INTC,2025-02-12 08:40:55,INTC stock price: Intel shares jump 8% after JD Vance vows to safeguard American chips from ‘theft and misuse' at Paris AI summit,https://images.financialmodelingprep.com/news/intc-stock-price-intel-shares-jump-8-after-jd-20250212.jpg,fastcompany.com,"Shares of Intel Corporation (NASDAQ: INTC) rose 8% on Tuesday after Vice President JD Vance said that the U.S. will safeguard American artificial intelligence and chip technologies from “theft and misuse” by its “adversaries,” making a veiled reference to China. (The stock closed up by just over 6%.",https://www.fastcompany.com/91276896/intc-stock-price-intel-shares-jump-8-on-jd-vance-american-ai-chips-summit-nvidia-broadcom
INTC,2025-02-12 06:20:00,Intel Just Pulled Ahead in This Key Market,https://images.financialmodelingprep.com/news/intel-just-pulled-ahead-in-this-key-market-20250212.jpg,fool.com,"Chip giant Intel (INTC) has faced multiple challenges in its PC CPU business over the past year. For starters, the rebound in PC demand following the post-pandemic crash has been a disappointment.",https://www.fool.com/investing/2025/02/12/intel-just-pulled-ahead-in-this-key-market/
INTC,2025-02-11 15:52:00,Why Intel Stock Is Soaring Today,https://images.financialmodelingprep.com/news/why-intel-stock-is-soaring-today-20250211.jpg,fool.com,Shares of Intel (INTC 6.30%) are flying higher on Tuesday. The company's stock gained 6.6% as of 3 p.m.,https://www.fool.com/investing/2025/02/11/why-intel-stock-is-soaring-today/
INTC,2025-02-11 14:35:44,"Intel stock surges as Vance pledges to protect US AI technology, boost domestic production",https://images.financialmodelingprep.com/news/intel-stock-surges-as-vance-pledges-to-protect-us-20250211.jpg,invezz.com,"Shares of Intel (NASDAQ: INTC) rose 8% on Tuesday after Vice President JD Vance emphasized the Trump administration's commitment to protecting American artificial intelligence technology from foreign threats. Speaking at the AI Action Summit in Paris, Vance warned that some authoritarian regimes have misused AI for military and surveillance purposes.",https://invezz.com/news/2025/02/11/intel-stock-surges-as-vance-pledges-to-protect-us-ai-technology-boost-domestic-production/
INTC,2025-02-11 13:14:03,Intel shares rise after VP Vance promises to safeguard American AI and chips,https://images.financialmodelingprep.com/news/intel-shares-rise-after-vp-vance-promises-to-safeguard-american-20250211.jpg,cnbc.com,"Shares of Intel rose 8% after Vice President JD Vance said that the U.S. will safeguard American artificial intelligence technologies from ""theft and misuse"" by adversaries. In a keynote address at the Paris AI summit, Vance said the U.S. will ""block efforts, full stop"" of authoritarian regimes stealing AI to ""strengthen their military intelligence.",https://www.cnbc.com/2025/02/11/intel-rises-after-vp-vance-promises-to-safeguard-american-ai-and-chips.html
INTC,2025-02-11 12:45:00,Is Intel now a Trump stock? Its shares are surging after upbeat comments by J.D.,https://images.financialmodelingprep.com/news/is-intel-now-a-trump-stock-its-shares-are-20250211.jpg,marketwatch.com,Shares of Intel Corp. were surging on Tuesday after Vice President J.D. Vance made bullish comments about semiconductor manufacturing in the U.S. at an artificial-intelligence summit in Paris.,https://www.marketwatch.com/story/is-intel-now-a-trump-stock-its-stock-is-surging-after-upbeat-comments-by-j-d-vance-5b6a1a82
INTC,2025-02-11 11:13:08,3 Chip Stocks Still Trading 50% Below Their 52-Week Highs,https://images.financialmodelingprep.com/news/3-chip-stocks-still-trading-50-below-their-52week-20250211.jpg,marketbeat.com,"The semiconductor industry has become an intense area of focus in the stock market over the past few years. It's always been important, but the advent of artificial intelligence is driving unprecedented interest.",https://www.marketbeat.com/stock-ideas/3-chip-stocks-still-trading-50-below-their-52-week-highs/
INTC,2025-02-11 11:08:28,"With $20K to invest, debating between Super Micro Computer and Intel—what's the smarter move?",https://images.financialmodelingprep.com/news/with-20k-to-invest-debating-between-super-micro-computer-20250211.jpg,247wallst.com,“The Next NVIDIA” Could Change Your Life NVIDIA has returned 250-fold in the past 10 years as artificial intelligence took off.,https://247wallst.com/investing/2025/02/11/with-20k-to-invest-debating-between-super-micro-computer-and-intel-whats-the-smarter-move/
INTC,2025-02-11 07:45:10,3 Undervalued Stocks You Don't Want to Overlook,https://images.financialmodelingprep.com/news/3-undervalued-stocks-you-dont-want-to-overlook-20250211.jpg,marketbeat.com,"Every once in a while, the stock market's attention will float away from stocks that deserve it and into areas in the rest of the market that might have been great investments at first but ultimately become too bloated to keep holding. Today's market fits that description in that most of the activity has been centered in the technology sector.",https://www.marketbeat.com/stock-ideas/3-undervalued-stocks-you-dont-want-to-overlook/
INTC,2025-02-11 03:45:00,"Parfin hires Dr. Jacob Mendel, former JP Morgan and Intel, as new co-CTO Rayls",https://images.financialmodelingprep.com/news/parfin-hires-dr-jacob-mendel-former-jp-morgan-and-20250211.jpg,globenewswire.com,Professional with 23 approved cybersecurity patents brings extensive blockchain expertise to strengthen and enhance Rayls Professional with 23 approved cybersecurity patents brings extensive blockchain expertise to strengthen and enhance Rayls,https://www.globenewswire.com/news-release/2025/02/11/3023926/0/en/Parfin-hires-Dr-Jacob-Mendel-former-JP-Morgan-and-Intel-as-new-co-CTO-Rayls.html
INTC,2025-02-10 14:36:36,"Options Corner: NVDA, INTC, X",https://images.financialmodelingprep.com/news/options-corner-nvda-intc-x-20250210.jpg,youtube.com,"Tariffs from the Trump administration on aluminum and steel created unusual options activity around U.S. Steel (X). However, the A.I.",https://www.youtube.com/watch?v=-1DqCFxfvH0
INTC,2025-02-10 14:30:19,Why Intel Stock Is Jumping Today,https://images.financialmodelingprep.com/news/why-intel-stock-is-jumping-today-20250210.jpg,fool.com,Intel (INTC 3.72%) stock is gaining ground in Monday's trading. The semiconductor company's share price was up 4% as of 2 p.m.,https://www.fool.com/investing/2025/02/10/why-intel-stock-is-jumping-today/
INTC,2025-02-10 09:45:04,Intel: It's Time To Let Go,https://images.financialmodelingprep.com/news/intel-its-time-to-let-go-20250210.jpg,seekingalpha.com,"Intel has lost 65% in value since 2021 and has suspended its dividend. Intel's core x86 CPU business is losing market share to AMD, while Intel's gross margin is also far behind its peers. Intel's new leadership faces urgent decisions to avoid falling further behind competitors like AMD, NVIDIA, and TSMC in key growth markets.",https://seekingalpha.com/article/4756619-intel-its-time-to-let-go
INTC,2025-02-10 04:18:39,Nokia CEO Lundmark to be replaced by Intel AI chief Hotard,https://images.financialmodelingprep.com/news/nokia-ceo-lundmark-to-be-replaced-by-intel-ai-chief-20250210.jpg,techxplore.com,"Finnish telecommunications equipment giant Nokia announced on Monday that chief executive Pekka Lundmark would step down and be replaced by Justin Hotard, the head of AI and data centers at US chip-maker Intel.",https://techxplore.com/news/2025-02-nokia-ceo-lundmark-intel-ai.html
INTC,2025-02-09 12:09:00,Intel Continues to See Revenue Declines. Can the Stock Rebound?,https://images.financialmodelingprep.com/news/intel-continues-to-see-revenue-declines-can-the-stock-20250209.jpg,fool.com,Intel Continues to See Revenue Declines. Can the Stock Rebound?,https://www.fool.com/investing/2025/02/09/intel-continues-to-see-revenue-declines-can-the-st/
INTC,2025-02-08 10:00:00,"Intel Loses Numerous Battles Across PC, AI, And Foundry - Recovery Uncertain",https://images.financialmodelingprep.com/news/intel-loses-numerous-battles-across-pc-ai-and-foundry-20250208.jpg,seekingalpha.com,"Recent market trends continue to highlight growing AI related spend, one that may bypass INTC, as similarly observed in the management's underwhelming FQ1'25 guidance. With INTC already cutting its Gaudi3 shipment targets as AMD and NVDA ramp up their production, it goes without saying that the former's AI monetization opportunity appears uncertain. This is on top of AMD consistently eroding INTC's x86 market share as ARM's offerings also grow in adoption.",https://seekingalpha.com/article/4755443-intel-loses-numerous-battles-across-pc-ai-and-foundry-recovery-uncertain
INTC,2025-02-08 07:03:00,Why Is Everyone Talking About Intel Stock?,https://images.financialmodelingprep.com/news/why-is-everyone-talking-about-intel-stock-20250208.jpg,fool.com,Intel (INTC -1.45%) is one of the worst-performing semiconductor stocks of the last two years.,https://www.fool.com/investing/2025/02/08/why-is-everyone-talking-about-intel-stock/
INTC,2025-02-07 10:26:00,Should INTC Be in Your Portfolio Post Healthy Q4 Earnings?,https://images.financialmodelingprep.com/news/should-intc-be-in-your-portfolio-post-healthy-q4-20250207.jpg,zacks.com,INTC appears to be treading in the middle of the road and investors could be better off if they trade with caution.,https://www.zacks.com/stock/news/2411944/should-intc-be-in-your-portfolio-post-healthy-q4-earnings?cid=CS-STOCKNEWSAPI-FT-analyst_blog|most_popular_stocks-2411944
INTC,2025-02-07 05:30:00,Huge News for Intel Stock Investors,https://images.financialmodelingprep.com/news/huge-news-for-intel-stock-investors-20250207.jpg,fool.com,Intel's (INTC -1.37%) management team elaborated on the company's key product releases and the industry's response.,https://www.fool.com/investing/2025/02/07/huge-news-for-intel-stock-investors/
INTC,2025-02-07 04:05:00,What's Going on With Intel Stock?,https://images.financialmodelingprep.com/news/whats-going-on-with-intel-stock-20250207.jpg,fool.com,Intel (INTC -1.37%) continues to disappoint stock market investors as new products fail to hit the mark.,https://www.fool.com/investing/2025/02/07/whats-going-on-with-intel-stock/
INTC,2025-02-06 11:39:21,Intel Q4: 18A Products Can Mark Its Turning Point,https://images.financialmodelingprep.com/news/intel-q4-18a-products-can-mark-its-turning-point-20250206.jpg,seekingalpha.com,"A few new catalysts have fundamentally shifted INTC stock's return/risk curve since my last writing. First, its Q4 earnings are far better than I expected/feared, dramatically reducing my concerns over its financial resources. Second, the progress with its 18A products could be a pivotal moment for Intel's multi-year turnaround plan.",https://seekingalpha.com/article/4755563-intel-q4-18a-products-can-mark-turning-point
INTC,2025-02-06 08:34:45,Intel Q4: Too Early To Bet On A 2026 Turnaround,https://images.financialmodelingprep.com/news/intel-q4-too-early-to-bet-on-a-2026-20250206.jpg,seekingalpha.com,"Despite beating 4Q FY2024 revenue and non-GAAP EPS estimates, Intel's muted price action reflects a gloomy 1Q FY2025 outlook, with a fourth consecutive YoY revenue decline. Some PC demand was pulled forward in 4Q due to potential Trump-era tariffs, which could pressure 1Q revenue while operating cost reductions will not contribute until later. Optimism remains for Intel's FY2026 roadmap, with higher gross margin 18A chips and reduced operating expenses expected, which can re-accelerate growth and profitability.",https://seekingalpha.com/article/4755486-intel-q4-too-early-to-bet-on-a-2026-turnaround
INTC,2025-02-06 05:59:51,Intel's Stock Faces A Make-Or-Break Moment,https://images.financialmodelingprep.com/news/intels-stock-faces-a-makeorbreak-moment-20250206.jpg,seekingalpha.com,"Intel reported $14.3B in revenue, a 7% sequential increase driven by Client Computing and Edge gains. Intel projects an 11-18% revenue decline, forecasting $11.7B to $12.7B due to seasonal weakness and competition. Intel Foundry posted a $2.3B operating loss in Q4, with breakeven targeted by the end of CY27.",https://seekingalpha.com/article/4755442-intel-stock-faces-a-make-or-break-moment
INTC,2025-02-05 08:54:26,"JPMorgan Picks Winners, Losers After DeepSeek Debut: How Alphabet, Amazon, Intel And Oracle Rank",https://images.financialmodelingprep.com/news/jpmorgan-picks-winners-losers-after-deepseek-debut-how-alphabet-20250205.jpg,benzinga.com,"JPMorgan analysts Claudia Hueston and Pedro Martins just dropped a major AI ripple effect report, and the verdict is clear: DeepSeek's latest LLM is shaking up the tech hierarchy.",https://www.benzinga.com/analyst-ratings/analyst-color/25/02/43494592/jpmorgan-picks-winners-losers-after-deepseek-debut-how-alphabet-amazon-intel-and-or
INTC,2025-02-05 04:30:00,Why Intel's Q4 Earnings Report Was Much Better Than It Looked. Is The Turnaround Story Intact?,https://images.financialmodelingprep.com/news/why-intels-q4-earnings-report-was-much-better-than-20250205.jpg,fool.com,"There aren't many deep value turnaround opportunities in the technology world these days. However, Intel (INTC -0.46%) is an interesting case.",https://www.fool.com/investing/2025/02/05/intels-earnings-report-was-better-than-it-looked/
INTC,2025-02-05 02:07:29,Intel Stays On Track For 2025,https://images.financialmodelingprep.com/news/intel-stays-on-track-for-2025-20250205.jpg,seekingalpha.com,"Intel's Panther Lake node, launching in 2H 2025, aims to surpass Taiwan Semiconductor's 2nm, potentially boosting Intel's competitive edge and shareholder returns. Despite a 7% YoY revenue drop, Intel's $14 billion revenue exceeded expectations, showing resilience amid its transition phase. Intel's foundry business, though currently loss-making, is crucial for future growth, with breakeven expected by 2027.",https://seekingalpha.com/article/4754937-intel-stays-on-track-for-2025
INTC,2025-02-05 01:26:33,Intel: Future Is Still Bright But It Will Be A Long Ride,https://images.financialmodelingprep.com/news/intel-future-is-still-bright-but-it-will-be-20250205.jpg,seekingalpha.com,"Overall, it was a good yearly result for Intel, considering the continued glut of traditional semiconductor segments with limited exposure to AI. Intel Products' CCG surprisingly delivered a revenue decline YoY due to competition. This is disturbing as this segment will face more competition this year from new entrants. While Intel Foundry is the future growth driver, it will take time because of the long product cycle and experience curve associated with 18A.",https://seekingalpha.com/article/4754933-intel-future-is-still-bright-but-it-will-be-a-long-ride
INTC,2025-02-04 14:26:23,"China puts Google, Nvidia, Intel in regulatory crosshairs as Trump trade dispute escalates",https://images.financialmodelingprep.com/news/china-puts-google-nvidia-intel-in-regulatory-crosshairs-as-20250204.jpg,nypost.com,China opened an antitrust probe against Google as part of a sweeping set of retaliatory measures targeting the US economy after President Trump imposed a new 10% tariff on Chinese imports.,https://nypost.com/2025/02/04/business/china-puts-google-nvidia-intel-in-crosshairs-as-trump-trade-dispute-escalates/
INTC,2025-02-04 10:24:20,Intel: Almost Time To Buy,https://images.financialmodelingprep.com/news/intel-almost-time-to-buy-20250204.jpg,seekingalpha.com,"Intel shares have been hit over the past year due to shrinking revenues, large losses, and cash burn, despite beating estimates recently. The company's balance sheet remains under pressure, and its stock has fallen nearly 14% in three months, underperforming the S&P 500. While Intel's current quarter guidance may seem disappointing, the situation isn't as dire as it appears, but I'm not ready to fully buy in.",https://seekingalpha.com/article/4754630-intel-almost-time-to-buy
INTC,2025-02-04 10:06:48,Intel Corporation (INTC) Is a Trending Stock: Facts to Know Before Betting on It,https://images.financialmodelingprep.com/news/intel-corporation-intc-is-a-trending-stock-facts-to-20250204.jpg,zacks.com,"Recently, Zacks.com users have been paying close attention to Intel (INTC). This makes it worthwhile to examine what the stock has in store.",https://www.zacks.com/stock/news/2409027/intel-corporation-intc-is-a-trending-stock-facts-to-know-before-betting-on-it?cid=CS-STOCKNEWSAPI-FT-tale_of_the_tape|most_searched_stocks-2409027
INTC,2025-02-04 04:35:00,Is Intel Stock a Buy Now?,https://images.financialmodelingprep.com/news/is-intel-stock-a-buy-now-20250204.jpg,fool.com,"The past year has been a terrible one for Intel (INTC -0.26%) investors as share prices of the once-mighty semiconductor giant have fallen 55%, driven by the company's inability to capitalize on hot technology trends such as artificial intelligence (AI) and market share losses to rivals.",https://www.fool.com/investing/2025/02/04/is-intel-stock-a-buy-now/
INTC,2025-02-04 02:31:39,Intel: AI Dominance Is A Post-2027 Aspiration,https://images.financialmodelingprep.com/news/intel-ai-dominance-is-a-post2027-aspiration-20250204.jpg,seekingalpha.com,"Intel's Q4 results were better than expected, but still showed declines in revenue and margins, highlighting competitive pressures and market challenges. The company's 2025 outlook is focused on damage control, with significant improvements not expected until 2026-2027, particularly in the foundry business. Intel's product timeline is being rationalized to align with production capabilities, but delays and high execution risks persist, especially in AI and consumer chips.",https://seekingalpha.com/article/4754503-intel-ai-dominance-is-a-post-2027-aspiration
INTC,2025-02-03 01:19:19,Intel: Excessive Safety Margin,https://images.financialmodelingprep.com/news/intel-excessive-safety-margin-20250203.jpg,seekingalpha.com,"Intel reported better-than-expected Q4 earnings, with shares surging 3.7% in after-hours trading. I am optimistic about Intel's growth prospects in FY 2025, driven by AI product demand. Positive momentum in AI PCs and Gaudi 3 AI accelerator shipments could drive growth. Intel's Q1'25 revenue outlook missed expectations, but only slightly. The guidance implies that top line pressure may ease going forward.",https://seekingalpha.com/article/4754248-intel-excessive-safety-margin
INTC,2025-02-02 08:30:00,Intel Just Gutted Its AI Chip Ambitions,https://images.financialmodelingprep.com/news/intel-just-gutted-its-ai-chip-ambitions-20250202.jpg,fool.com,"Intel (INTC -2.90%) has largely failed to tap into soaring demand for artificial intelligence (AI) accelerators. The company's acquisition of AI chip start-up Habana Labs back in 2019, three years before the AI boom kicked off in earnest, certainly seemed like a prescient move.",https://www.fool.com/investing/2025/02/02/intel-just-gutted-its-ai-chip-ambitions/
INTC,2025-02-01 10:45:00,Should Investors Buy Intel Stock?,https://images.financialmodelingprep.com/news/should-investors-buy-intel-stock-20250201.jpg,fool.com,Intel (INTC -2.90%) reported another quarter of underwhelming performance.,https://www.fool.com/investing/2025/02/01/should-investors-buy-intel-stock/
INTC,2025-02-01 08:15:00,Is Now the Perfect Time to Buy Intel Stock?,https://images.financialmodelingprep.com/news/is-now-the-perfect-time-to-buy-intel-stock-20250201.jpg,fool.com,"In this video, I will cover Intel's (INTC -2.90%) recent earnings and management comments about the company's future. Watch the short video to learn more, consider subscribing, and click the special offer link below.",https://www.fool.com/investing/2025/02/01/is-now-the-perfect-time-to-buy-intel-stock/
INTC,2025-02-01 05:55:00,Intel Delays Its Monster Server CPU,https://images.financialmodelingprep.com/news/intel-delays-its-monster-server-cpu-20250201.jpg,fool.com,"Intel (INTC -2.90%) made significant progress last year in its server central processing unit (CPU) business. The company has been losing market share to AMD for years, partly because it was stuck on its aging Intel 7 manufacturing process.",https://www.fool.com/investing/2025/02/01/intel-delays-its-monster-server-cpu/
INTC,2025-01-31 16:09:15,Stock Market Today: Trump Tariff Worries Pressure Stocks,https://images.financialmodelingprep.com/news/stock-market-today-trump-tariff-worries-pressure-stocks-20250131.jpg,kiplinger.com,"Stocks swung lower Friday after the White House confirmed it will impose tariffs on Mexico, Canada and China beginning tomorrow.",https://www.kiplinger.com/investing/stocks/stock-market-today-trump-tariff-worries-pressure-stocks
INTC,2025-01-31 15:51:25,Intel's 'Realistic' Earnings,https://images.financialmodelingprep.com/news/intels-realistic-earnings-20250131.jpg,youtube.com,"Matt Bryson, Wedbush Equity Research analyst, says the big question is, ""What does Intel do from here""? The chipmaker posted earnings that were better-than-expected but warns of a tougher first quarter to come.",https://www.youtube.com/watch?v=a8flrINre78
INTC,2025-01-31 12:55:21,ETFs in Focus Post Intel's Q4 Earnings Beat,https://images.financialmodelingprep.com/news/etfs-in-focus-post-intels-q4-earnings-beat-20250131.jpg,zacks.com,Intel beats fourth-quarter earnings and revenue estimates but offers a downbeat outlook for the ongoing quarter.,https://www.zacks.com/stock/news/2407747/etfs-in-focus-post-intel-s-q4-earnings-beat?cid=CS-STOCKNEWSAPI-FT-etf_news_and_commentary-2407747
INTC,2025-01-31 12:23:49,"Intel beats Q4 estimates, faces tough Q1 ahead",https://images.financialmodelingprep.com/news/intel-beats-q4-estimates-faces-tough-q1-ahead-20250131.jpg,youtube.com,"Computer processor maker Intel (INTC) exceeded fourth quarter expectations despite a third straight quarter of declining revenue. Intel also fell short on weak guidance for the first quarter due to seasonal weakness, macro uncertainty, and rising competition.",https://www.youtube.com/watch?v=BYjVOFuRfXI
