symbol,publishedDate,title,image,site,text,url
INTC,2025-06-10 19:34:35,"This is just the beginning of the comeback in semis, says Patrick Moorhead",https://images.financialmodelingprep.com/news/this-is-just-the-beginning-of-the-comeback-in-20250610.jpg,youtube.com,"Patrick Moorhead, Moorhead Insights and Strategy CEO and chief analyst, joins 'Closing Bell Overtime' to talk chip stocks and if the sector can keep running.",https://www.youtube.com/watch?v=W2q_M4_Zf18
INTC,2025-06-10 19:06:04,"Markets Keep Nudging Higher Ahead of Trade Deals, CPI",https://images.financialmodelingprep.com/news/markets-keep-nudging-higher-ahead-of-trade-deals-cpi-20250610.jpg,zacks.com,The S&P 500 is now at its highest level since February 20th.,https://www.zacks.com/stock/news/2493348/markets-keep-nudging-higher-ahead-of-trade-deals-cpi?cid=CS-STOCKNEWSAPI-FT-ahead_of_wall_street-2493348
INTC,2025-06-09 14:03:19,"As China’s Dominance Dims, India Begins to Shine – The Time to Consider Investment Opportunities is Now",https://images.financialmodelingprep.com/news/as-chinas-dominance-dims-india-begins-to-shine-the-20250609.jpg,https://247wallst.com,"Key Points As US tariffs hit, China&#8217;s manufacturing sector feels the bite Geopolitics began the slide, many multinationals have been looking for a new low cost country/region Risks are still present, but India&#8217;s advancements over the past 30 years have them well positioned Are you ahead, or behind on retirement? SmartAsset&#8217;s free tool can match you with a financial advisor in minutes to help you answer that today. Each advisor has been carefully vetted, and must act in your best interests. Don&#8217;t waste another minute; get started by clicking here.(Sponsor) A seismic shift has transformed global manufacturing in recent years, with US and EU companies increasingly moving production from China to India. Accelerated by President Trump’s use of tariffs as trade weapons, this movement began a few years ago as geopolitical tensions and economic pressures began to raise concerns about supply chain resilience. India’s proactive policies have served to drive this trend toward supply chain diversification. While India has made remarkable progress over the past three decades, and holds vast potential as a manufacturing hub, infrastructure gaps and regulatory complexities present challenges. The primary driver is escalating friction with China. U.S.-China trade wars have imposed steep tariffs on Chinese goods, pushing companies to seek alternatives. From 2018 to 2022, U.S. goods imports from China dropped 10% (inflation-adjusted), while imports from India soared 44%, per trade data. Concerns over intellectual property theft and supply chain risks exposed during COVID-19 further fueled this shift. China’s rising labor and production costs have also eroded its edge in labor-intensive sectors like textiles and electronics, prompting companies to explore cost-competitive alternatives. India has emerged as a prime destination, propelled by initiatives like “Make in India” and Production Linked Incentive (PLI) schemes. These offer tax breaks (e.g., a 17% corporate tax rate for new manufacturing firms), subsidies to attract foreign direct investment (FDI), and a stable legal system rooted in British common law, safeguarding intellectual property. India’s youthful workforce (median age 28) and 1.4 billion-strong consumer market enhance its appeal. Apple, for example, has ramped up iPhone production in India, with Foxconn investing $1.5 billion in Tamil Nadu to supply the U.S. market. India’s share of Apple’s iPhone output grew from 2% to 5% between 2021 and 2022, with goals to hit 25%. Other giants like Dell, Nike, Intel, and Nippon Steel are also shifting production, with over 90% of North American manufacturers surveyed by BCG reporting some relocation from China in the past five years. Yet despite India’s appeal, challenges do remain. India’s infrastructure lags, with only 5% of roads classified as highways, causing logistical bottlenecks. Regulatory red tape hinders operations, with just 55% of companies reporting seamless production shifts. Manufacturing costs in India can also run 5–10% higher than in China due to import duties on components. India faces competition from Vietnam, a leader in electronics, and Mexico, advantaged by its proximity to the U.S. Companies and investors must navigate these hurdles to ensure profitability. This shift opens doors for entrepreneurs and businesses. Investors can target Indian firms or ETFs in booming sectors like electronics and semiconductors, which attracted $16 billion in manufacturing FDI from 2020 to 2023. Content creators can monetize blogs or videos on India’s manufacturing surge through ads or sponsorships. Consulting services offer another path, providing market research or regulatory guidance for firms entering India. Businesses can also develop logistics or compliance solutions to address operational challenges. The pivot from China to India reflects geopolitical, economic, and logistical realities. India’s policies and demographic strengths position it as a rising manufacturing powerhouse, but infrastructure and regulatory hurdles require careful strategy. Opportunities in investment, content creation, and consulting abound for those who can navigate India’s complexities with precision. Investors can explore top Indian companies listed on U.S. exchanges, such as HDFC Bank (NYSE: HDB), Infosys (NYSE: INFY), or MakeMyTrip (NASDAQ: MMYT). For broader exposure, the iShares MSCI India ETF (NASDAQ: INDA) tracks the MSCI India Index, covering roughly 85% of India’s large and mid-cap equity market. The post As China’s Dominance Dims, India Begins to Shine – The Time to Consider Investment Opportunities is Now appeared first on 24/7 Wall St..",https://247wallst.com/investing/2025/06/08/as-chinas-dominance-dims-india-begins-to-shine-the-time-to-consider-investment-opportunities-is-now/
INTC,2025-06-09 11:31:08,INTC Plunges 35% in the Past Year: Should You Dump the Stock?,https://images.financialmodelingprep.com/news/intc-plunges-35-in-the-past-year-should-you-20250609.jpg,zacks.com,"INTC stock plunges 35% in a year as margin pressures, China risks and AI missteps cloud its turnaround efforts.",https://www.zacks.com/stock/news/2490865/intc-plunges-35-in-the-past-year-should-you-dump-the-stock?cid=CS-STOCKNEWSAPI-FT-analyst_blog|most_popular_stocks-2490865
INTC,2025-06-08 08:40:09,"Intel's Dual Gamble: AI Innovation Now, Foundry Fortunes Later?",https://images.financialmodelingprep.com/news/intels-dual-gamble-ai-innovation-now-foundry-fortunes-later-20250608.jpg,marketbeat.com,"Intel Corporation NASDAQ: INTC continues pursuing a demanding dual strategy to revitalize its market standing and financial health. The company's stock price is hovering near $20.25 in early June 2025, reflecting a significant investor evaluation of its turnaround prospects.",https://www.marketbeat.com/originals/intels-dual-gamble-ai-innovation-now-foundry-fortunes-later/
INTC,2025-06-07 10:13:56,Intel: Wall Street Is Asleep At The Wheel,https://images.financialmodelingprep.com/news/intel-wall-street-is-asleep-at-the-wheel-20250607.jpg,seekingalpha.com,"I am reiterating my ""Buy"" rating on Intel, believing the market is overly pessimistic. New CEO Lip-Bu Tan is the right leader to execute a successful, sustainable turnaround. Tan's strategy focuses on cutting bureaucracy, selling non-core assets to reduce debt, and fostering an engineer-driven culture that prioritizes R&D to restore Intel's innovation engine. Intel's strategic moves in AI, including the Saimemory partnership and product roadmap, position it well to regain share in key markets.",https://seekingalpha.com/article/4793190-intel-wall-street-is-asleep-at-the-wheel
INTC,2025-06-07 07:30:00,The Nasdaq Bounces Back: 2 Artificial Intelligence (AI) Stocks Worth Buying Right Now,https://images.financialmodelingprep.com/news/the-nasdaq-bounces-back-2-artificial-intelligence-ai-stocks-20250607.jpg,fool.com,"Technology stocks are surging once again, especially artificial intelligence stocks. But don't think it's too late to buy in.",https://www.fool.com/investing/2025/06/07/nasdaq-bounces-back-artificial-intelligence-stocks/
INTC,2025-06-06 07:47:00,Should Investors Bet on Intel's Turnaround In 2025?,https://images.financialmodelingprep.com/news/should-investors-bet-on-intels-turnaround-in-2025-20250606.jpg,fool.com,"Intel (INTC -1.46%) used to be the 800-pound gorilla of the semiconductor industry. These days, the company formerly known as Chipzilla has lost market share in its most important divisions and missed the bus to the artificial intelligence (AI) boom.",https://www.fool.com/investing/2025/06/06/should-investors-bet-on-intels-turnaround-in-2025/
INTC,2025-06-06 07:00:00,2 Artificial Intelligence (AI) Stocks That Look Like Buffett-Style Long-Term Bets,https://images.financialmodelingprep.com/news/2-artificial-intelligence-ai-stocks-that-look-like-buffettstyle-20250606.jpg,fool.com,"Warren Buffett, the longtime CEO of Berkshire Hathaway, is famous for his long-term bets. Many of his biggest investments have been in his portfolio for decades.",https://www.fool.com/investing/2025/06/06/2-artificial-intelligence-ai-stocks-that-look-like/
INTC,2025-06-05 08:30:00,Veolia Earns Intel's 2025 EPIC Supplier Award,https://images.financialmodelingprep.com/news/veolia-earns-intels-2025-epic-supplier-award-20250605.jpg,businesswire.com,"BOSTON--(BUSINESS WIRE)--Veolia is proud to announce that it has earned the exclusive Intel EPIC Supplier Award for 2025. This award recognizes the top performers in the Intel supply chain for their world-class commitment to continuous improvement and performance excellence over the past year. “Congratulations to Veolia on receiving the Intel EPIC Supplier Award, Intel's highest supplier recognition,” said Frank Sanders, corporate vice president and general manager of Global Supply Chain Operat.",https://www.businesswire.com/news/home/20250605222960/en/Veolia-Earns-Intel%E2%80%99s-2025-EPIC-Supplier-Award/
INTC,2025-06-05 03:06:00,Here Are All 6 Stocks I've Bought Through 5 Months of 2025,https://images.financialmodelingprep.com/news/here-are-all-6-stocks-ive-bought-through-5-20250605.jpg,fool.com,"It's been a wild ride for the stock market through the first five months of 2025. As of mid-February, Wall Street's major stock indexes could do no wrong, with the benchmark S&P 500 vaulting to an all-time record-closing high.",https://www.fool.com/investing/2025/06/05/all-6-stocks-ive-bought-through-5-months-of-2025/
INTC,2025-06-04 16:43:51,Intel: A Potential Generational Buying Opportunity Under Lip-Bu Tan,https://images.financialmodelingprep.com/news/intel-a-potential-generational-buying-opportunity-under-lipbu-tan-20250604.jpg,seekingalpha.com,"I remain bullish on Intel Corporation, viewing the new CEO Lip-Bu Tan as a catalyst for a generational turnaround and long-term growth. Tan's proven track record and early strategic moves—cost cuts, renewed focus, and AI initiatives—position Intel for success in emerging tech sectors. Intel is poised to benefit from onshoring, AI, quantum computing, and humanoid robotics, with the market underestimating these future opportunities.",https://seekingalpha.com/article/4792463-intel-a-potential-generational-buying-opportunity-under-lip-bu-tan
INTC,2025-06-03 20:27:06,Intel Corporation (INTC) BofA Securities 2025 Global Technology Conference (Transcript),https://images.financialmodelingprep.com/news/intel-corporation-intc-bofa-securities-2025-global-technology-conference-20250603.jpg,seekingalpha.com,"Intel Corporation (NASDAQ:INTC ) BofA Securities 2025 Global Technology Conference June 3, 2025 5:40 PM ET Company Participants Michelle Johnston Holthaus - CEO Conference Call Participants Vivek Arya - Bank of America Vivek Arya Vivek Arya, from BofA's semiconductor semicap equipment research team, and I'm really delighted to have the team from Intel join us today, Michelle Johnston Holthaus or MJ, as most people refer to her as -- really happy that you could join us. Michelle Johnston Holthaus Thanks for having me.",https://seekingalpha.com/article/4792163-intel-corporation-intc-bofa-securities-2025-global-technology-conference-transcript
INTC,2025-06-03 10:06:18,Intel Corporation (INTC) Is a Trending Stock: Facts to Know Before Betting on It,https://images.financialmodelingprep.com/news/intel-corporation-intc-is-a-trending-stock-facts-to-20250603.jpg,zacks.com,"Intel (INTC) has been one of the stocks most watched by Zacks.com users lately. So, it is worth exploring what lies ahead for the stock.",https://www.zacks.com/stock/news/2482693/intel-corporation-intc-is-a-trending-stock-facts-to-know-before-betting-on-it?cid=CS-STOCKNEWSAPI-FT-tale_of_the_tape|most_searched_stocks-2482693
INTC,2025-05-30 15:20:30,"Intel stock dubbed ‘dead money', analyst reveals a ‘viable path forward for INTC",https://images.financialmodelingprep.com/news/intel-stock-dubbed-dead-money-analyst-reveals-a-viable-path-20250530.jpg,invezz.com,"Intel has announced plans to lower its global headcount by more than 20% under the leadership of Lip-Bu Tan, who has been at the helm for a couple of months only. In its latest reported quarter, the semiconductor giant came in ahead of Street estimates on both the top and bottom line as well.",https://invezz.com/news/2025/05/30/intel-stock-dubbed-dead-money-analyst-reveals-a-viable-path-forward-for-intc/
INTC,2025-05-30 12:27:14,Intel's Turnaround May Be the Best Bet No One's Watching,https://images.financialmodelingprep.com/news/intels-turnaround-may-be-the-best-bet-no-ones-20250530.jpg,marketbeat.com,"Recent semiconductor sector news from late May indicates that Intel Corporation NASDAQ: INTC has discovered an alleged embezzlement, which media outlets have dubbed the ""chip bandit."" Over $840,000 was reportedly involved in the embezzlement at its Israeli operations.",https://www.marketbeat.com/originals/intels-turnaround-may-be-the-best-bet-no-ones-watching/
INTC,2025-05-30 09:25:56,"NVDA, INTC and AMD Forecast – US Chip Stocks Sluggish in Early Hours",https://images.financialmodelingprep.com/news/nvda-intc-and-amd-forecast-us-chip-stocks-sluggish-20250530.jpg,fxempire.com,"The three microchip stocks in this analysis are all a bit sluggish at the moment, as I look at the premarket charts. At this point, it looks as if the market is in the middle of churning to work off frothy moves.",https://www.fxempire.com/forecasts/article/nvda-intc-and-amd-forecast-us-chip-stocks-sluggish-in-early-hours-1522854
INTC,2025-05-30 03:51:00,Billionaire David Tepper of Appaloosa Just Sold 5 Prominent Artificial Intelligence (AI) Stocks,https://images.financialmodelingprep.com/news/billionaire-david-tepper-of-appaloosa-just-sold-5-prominent-20250530.jpg,fool.com,"Wall Street runs on information, and investors rarely have to look too far for market-moving data. Everything from President Donald Trump's ever-changing tariff and trade policy to earnings season provides clues to investors about the current and future health of corporate America and the U.S. economy.",https://www.fool.com/investing/2025/05/30/billionaire-david-tepper-appaloosa-sold-5-ai-stock/
INTC,2025-05-29 08:00:01,Intel CEO Lip-Bu Tan has a long track record in the chip industry. Now he needs a big customer,https://images.financialmodelingprep.com/news/intel-ceo-lipbu-tan-has-a-long-track-record-20250529.jpg,cnbc.com,"Lip-Bu Tan is a little over two months into his gig running Intel, and he's making his intentions to grow the foundry business clear. But persuading Wall Street that Intel can be a real player in the chip manufacturing business requires that Tan find a big customer willing to move some production.",https://www.cnbc.com/2025/05/29/intel-ceo-lip-bu-tan-long-track-record-in-chips-needs-big-customer.html
INTC,2025-05-29 07:30:00,"Bionoid Pharma, Inc. Confirms Name Change to AI Maverick Intel, Inc. Following Delaware Approval",https://images.financialmodelingprep.com/news/bionoid-pharma-inc-confirms-name-change-to-ai-maverick-20250529.jpg,accessnewswire.com,"Company Has Initiated FINRA Process to Complete Rebranding and Ticker Update NEW YORK CITY, NY / ACCESS Newswire / May 29, 2025 / Bionoid Pharma, Inc. (OTC PINK:BINP) (""Bionoid"" or the ""Company"") is pleased to confirm that, following the previously announced rebranding initiative, the State of Delaware has approved the Company's formal name change to AI Maverick Intel, Inc., effective April 30, 2025. The Company has submitted the necessary filings with FINRA to update its name and trading symbol on the OTC Markets.",https://www.accessnewswire.com/newsroom/en/biotechnology/bionoid-pharma-inc.-confirms-name-change-to-ai-maverick-intel-inc.-following-delaware-1033133
INTC,2025-05-29 06:00:00,2 Brilliant Stocks to Buy With $100 and Hold for 5 Years,https://images.financialmodelingprep.com/news/2-brilliant-stocks-to-buy-with-100-and-hold-20250529.jpg,fool.com,"The U.S. equity markets have been quite turbulent in 2025, affected by escalating geopolitical pressures, protectionist tariffs, and high interest rates. Not surprisingly, investors are shying away from high-growth, high-risk stocks and moving toward defensive plays.",https://www.fool.com/investing/2025/05/29/2-brilliant-stocks-to-buy-with-100-and-hold-for-5/
INTC,2025-05-28 16:30:00,Intel Corporation to Participate in Upcoming Investor Conference,https://images.financialmodelingprep.com/news/intel-corporation-to-participate-in-upcoming-investor-conference-20250528.jpg,businesswire.com,"SANTA CLARA, Calif.--(BUSINESS WIRE)--Intel announces that Michelle Johnston Holthaus, CEO of Intel Products, will participate in the BofA Global Technology Conference on June 3.",https://www.businesswire.com/news/home/20250528741379/en/Intel-Corporation-to-Participate-in-Upcoming-Investor-Conference/
INTC,2025-05-28 14:00:34,"NVDA Holds Over Half of ""A.I. Pie,"" AMD & INTC Seek Bigger Slices",https://images.financialmodelingprep.com/news/nvda-holds-over-half-of-ai-pie-amd-intc-20250528.jpg,youtube.com,"Landon Swan of @LikeFolio says sky-high expectations for Nvidia (NVDA) will be the biggest risk in earnings. That said, he points to overwhelming A.I.",https://www.youtube.com/watch?v=So-nvhnPudY
INTC,2025-05-28 11:06:04,Intel vs. Advanced Micro: Which Chipmaker is the Better Buy Now?,https://images.financialmodelingprep.com/news/intel-vs-advanced-micro-which-chipmaker-is-the-better-20250528.jpg,zacks.com,AMD's expanding AI portfolio and strong 2025 growth outlook make it a stronger pick over INTC despite its higher valuation.,https://www.zacks.com/stock/news/2478305/intel-vs-advanced-micro-which-chipmaker-is-the-better-buy-now?cid=CS-STOCKNEWSAPI-FT-analyst_blog|most_popular_stocks-2478305
INTC,2025-05-27 11:12:42,TSMC still evaluating ASML's 'High-NA' as Intel eyes future use,https://images.financialmodelingprep.com/news/tsmc-still-evaluating-asmls-highna-as-intel-eyes-future-20250527.jpg,reuters.com,"Taiwan Semiconductor Manufacturing Co (2330.TW), the world's largest contract chipmaker, is still assessing when it will use ASML's cutting-edge high numerical aperture (NA) machines for its future process nodes, an executive said on Tuesday.",https://www.reuters.com/world/asia-pacific/tsmc-still-evaluating-asmls-high-na-intel-eyes-future-use-2025-05-27/
INTC,2025-05-27 08:30:43,"NVDA, INTC and AMD Price Analysis – Microchip Stocks Look Ready to Go Higher",https://images.financialmodelingprep.com/news/nvda-intc-and-amd-price-analysis-microchip-stocks-look-20250527.jpg,fxempire.com,"The three stocks in this analysis, Nvidia, Intel, and AMD, all look like they are ready to go higher based on the premarket action, as all three are gapping higher. Ultimately, some of these are better than others, but they all look positive.",https://www.fxempire.com/forecasts/article/nvda-intc-and-amd-price-analysis-microchip-stocks-look-ready-to-go-higher-1521993
INTC,2025-05-26 16:30:00,Here's How Intel Could Be Affected by the United States' Rare Earths Trade With China,https://images.financialmodelingprep.com/news/heres-how-intel-could-be-affected-by-the-united-20250526.jpg,fool.com,Rare earths were just one of many issues that arose during the salvos of the recent trade war between the United States and China. The tensions between the two nations seem to have eased -- a little at least -- with the nations' recent announcement of a 90-day pause regarding the recently heightened tariffs.,https://www.fool.com/investing/2025/05/26/heres-how-intel-could-be-affected-by-the-united-st/
INTC,2025-05-24 07:00:00,Is Intel Corp Stock a Buy?,https://images.financialmodelingprep.com/news/is-intel-corp-stock-a-buy-20250524.jpg,fool.com,The past few years have been difficult -- to say the least -- for Intel (INTC -2.34%). Competitors like Nvidia have seen their share prices balloon thanks to the rapid rise of AI technologies.,https://www.fool.com/investing/2025/05/24/intel-corp-stock-buy-intc/
INTC,2025-05-22 18:48:19,Intel Doesn't Need To Beat TSMC To Win - Nearing $20 Buy Signal,https://images.financialmodelingprep.com/news/intel-doesnt-need-to-beat-tsmc-to-win-nearing-20250522.jpg,seekingalpha.com,"Intel Corporation is our swing trade safe haven: buy under $20, sell above $23, and hold for the 18A node catalyst into 2026. 18A node is a game-changer with GAA and backside power; it'll enable share gain on PC Client from AMD and put IFS on the map against TSMC. Valuation is attractive, with INTC stock trading at a significant discount to peers, and expectations are getting revised down making for an easier beat.",https://seekingalpha.com/article/4789306-intel-doesnt-need-to-beat-tsmc-to-win-nearing-20-buy-signal
INTC,2025-05-22 07:30:00,Intel Could Sell Another Major Business in Turnaround Bid,https://images.financialmodelingprep.com/news/intel-could-sell-another-major-business-in-turnaround-bid-20250522.jpg,fool.com,"For years, semiconductor giant Intel (INTC -2.49%) has been exiting lines of business that don't fit with its overall strategy. Under former CEO Pat Gelsinger, Intel sold off its NAND and SSD operations, wound down its Optane memory unit, spun off Mobileye via an initial public offering (IPO), exited the prebuilt server business, gave up on Bitcoin mining chips, and sold a minority stake in its IMS Nanofabrication business.",https://www.fool.com/investing/2025/05/22/intel-could-sell-another-major-business-in-turnaro/
INTC,2025-05-22 03:35:00,2 Artificial Intelligence (AI) Stocks That May Have a Hard Time Bouncing Back From President Trump's Trade War,https://images.financialmodelingprep.com/news/2-artificial-intelligence-ai-stocks-that-may-have-a-20250522.jpg,fool.com,No one knows where President Trump's trade war will go next.,https://www.fool.com/investing/2025/05/22/artificial-intelligence-ai-stock-trump-trade-war/
INTC,2025-05-21 15:21:40,Intel Refocuses: NEX Sale and Foundry Pivot Signal New Era,https://images.financialmodelingprep.com/news/intel-refocuses-nex-sale-and-foundry-pivot-signal-new-20250521.jpg,marketbeat.com,"Recent developments at Intel Corporation NASDAQ: INTC suggest a quickening pace in its strategic overhaul under new CEO Lip-Bu Tan. Reports emerging around May 20, 2025, indicate the semiconductor sector giant may be actively exploring a sale of its Networking and Edge (NEX) business unit.",https://www.marketbeat.com/originals/intel-refocuses-nex-sale-and-foundry-pivot-signal-new-era/
INTC,2025-05-21 15:09:57,"Intel faces long road to recovery, Deutsche Bank says",https://images.financialmodelingprep.com/news/intel-faces-long-road-to-recovery-deutsche-bank-says-20250521.jpg,proactiveinvestors.com,"Deutsche Bank has resumed coverage of Intel Corp (NASDAQ:INTC, ETR:INL) with a ""Hold"" rating and a $23 price target on Tuesday, citing confidence in new CEO Lip-Bu Tan's leadership but warning that the company faces a prolonged and difficult turnaround. Analysts said the chipmaker's path to re-accelerated growth under Tan will require “patience,” as execution challenges and ongoing macroeconomic and company-specific headwinds continue to weigh on performance.",https://www.proactiveinvestors.com/companies/news/1071656
INTC,2025-05-21 01:00:00,Elliptic Labs and Intel Announcing Long-Term Partnership to Power the Future of AI PCs,https://images.financialmodelingprep.com/news/elliptic-labs-and-intel-announcing-longterm-partnership-to-power-20250521.jpg,businesswire.com,"OSLO, Norway--(BUSINESS WIRE)-- #AIPC--Elliptic Labs and Intel have a long-term partnership to bring smarter, more intuitive AI features to Intel's next-gen laptops.",https://www.businesswire.com/news/home/20250520154939/en/Elliptic-Labs-and-Intel-Announcing-Long-Term-Partnership-to-Power-the-Future-of-AI-PCs/
INTC,2025-05-20 14:55:40,Intel Is Having An Existential Crisis And Risks Losing More Market Share,https://images.financialmodelingprep.com/news/intel-is-having-an-existential-crisis-and-risks-losing-more-20250520.jpg,seekingalpha.com,"Intel faces ongoing growth headwinds in client and AI data center markets, losing share to AMD and Nvidia despite new design efforts. Intel's data center market share by revenue has declined from 61% in 2021 to 11% in 2024. Recapture share may not be feasible. New CEO Lip-Bu Tan is streamlining operations, cutting costs, and refocusing on core businesses like client and data center chip design.",https://seekingalpha.com/article/4788583-intel-is-having-an-existential-crisis-and-risks-losing-more-market-share
