symbol,publishedDate,title,image,site,text,url
INTC,2024-12-10 13:55:21,Why Intel Stock Is Falling Today,https://images.financialmodelingprep.com/news/why-intel-stock-is-falling-today-20241210.jpg,fool.com,Intel (INTC -2.79%) stock is losing ground in Tuesday's trading. The semiconductor company's share price was down 2.6% as of 1:45 p.m.,https://www.fool.com/investing/2024/12/10/why-intel-stock-is-falling-today/
INTC,2024-12-10 13:54:12,3 Semiconductor Stocks Facing Sector Pressure,https://images.financialmodelingprep.com/news/3-semiconductor-stocks-facing-sector-pressure-20241210.jpg,schaeffersresearch.com,"Shares of semiconductor firms Micron Technology Inc (NASDAQ:MU) , Intel Corp (NASDAQ:INTC), and Advanced Micro Devices, Inc. (NASDAQ) are all moving lower today.",https://www.schaeffersresearch.com/content/news/2024/12/10/3-semiconductor-stocks-facing-sector-pressure
INTC,2024-12-10 10:05:26,Intel Corporation (INTC) is Attracting Investor Attention: Here is What You Should Know,https://images.financialmodelingprep.com/news/intel-corporation-intc-is-attracting-investor-attention-here-is-20241210.jpg,zacks.com,"Intel (INTC) has received quite a bit of attention from Zacks.com users lately. Therefore, it is wise to be aware of the facts that can impact the stock's prospects.",https://www.zacks.com/stock/news/2381401/intel-corporation-intc-is-attracting-investor-attention-here-is-what-you-should-know?cid=CS-STOCKNEWSAPI-FT-tale_of_the_tape|most_searched_stocks-2381401
INTC,2024-12-10 01:01:00,Intel stock price forecast: is INTC a bargain or a value trap?,https://images.financialmodelingprep.com/news/intel-stock-price-forecast-is-intc-a-bargain-or-20241210.jpg,invezz.com,"The Intel stock price has imploded as concerns about the fallen angel continue. INTC shares have dropped to $20.8, its lowest level since September, and 60% below the highest point this month.",https://invezz.com/news/2024/12/10/intel-stock-price-forecast-is-intc-a-bargain-or-a-value-trap/
INTC,2024-12-09 15:31:58,Intel: Can One Person Make A Difference?,https://images.financialmodelingprep.com/news/intel-can-one-person-make-a-difference-20241209.jpg,seekingalpha.com,"Intel's stock is down nearly 50% in the last year, and a new CEO is essential to restore investor confidence and drive a turnaround. Historical examples like Starbucks and GM show that new leadership can successfully revive struggling companies by shedding underperforming assets and focusing on core strengths. Intel should trim its bloated workforce, focus on its star products, and invest in new technologies and start-ups to drive future growth.",https://seekingalpha.com/article/4743105-intel-can-one-person-make-a-difference
INTC,2024-12-09 10:44:02,Pray And Fast For Intel,https://images.financialmodelingprep.com/news/pray-and-fast-for-intel-20241209.jpg,seekingalpha.com,"Intel Corporation's future hinges on the success of its 18A node and GPU competitiveness, supported by significant U.S. government funding and strategic partnerships. Despite recent setbacks, including the CEO's departure and financial struggles, Intel's long-term potential remains strong with strategic investments and cost reduction plans. Intel's shift to TSMC's 3nm process for GPUs and the development of Falcon Shores are crucial for regaining market competitiveness by 2025-2026.",https://seekingalpha.com/article/4743045-pray-and-fast-for-intel
INTC,2024-12-09 09:54:08,Three CEOs That Ought to Follow Intel's Pat Gelsinger Out the Door,https://images.financialmodelingprep.com/news/three-ceos-that-ought-to-follow-intels-pat-gelsinger-20241209.jpg,247wallst.com,Intel (NASDAQ:INTC) CEO Pat Gelsinger stepped down on Dec.,https://247wallst.com/investing/2024/12/09/three-ceos-that-ought-to-follow-intels-pat-gelsinger-out-the-door/
INTC,2024-12-09 06:46:41,Intel (INTC) Exceeds Market Returns: Some Facts to Consider,https://images.financialmodelingprep.com/news/intel-intc-exceeds-market-returns-some-facts-to-consider-20241209.jpg,zacks.com,"In the closing of the recent trading day, Intel (INTC) stood at $20.92, denoting a +0.58% change from the preceding trading day.",https://www.zacks.com/stock/news/2380585/intel-intc-exceeds-market-returns-some-facts-to-consider?cid=CS-STOCKNEWSAPI-FT-tale_of_the_tape|yseop_template_6-2380585
INTC,2024-12-09 06:35:22,"North American Morning Briefing : Global Ad Shares Gain as Omnicom, Interpublic Near Merger Deal",https://images.financialmodelingprep.com/news/north-american-morning-briefing-global-ad-shares-gain-as-20241209.png,https://www.marketscreener.com,"OPENING CALL Stock futures dipped on Monday as investors awaited inflation data later this week. aAdsList.push('Article'); aAdsListSize.push([300, 250]); aAdsListCA.push(null); Wednesday's inflation reading will be the last major economic data point of the year, and it could be crucial ahead of the Federal Reserve's meeting next week. Meanwhile, global advertising stocks rallied as Omnicom and Interpublic neared a long-awaited union that would reshape the industry . Interpublic surged premarket, and shares in European rivals Publicis and WPP rose. South Korean markets came under renewed pressure after the leader of the country's ruling party said embattled president Yoon Suk Yeol would no longer be involved in running the country , in a move aimed at stabilizing state affairs. Investors were also assessing developments in the Middle East, where the Assad family dictatorship collapsed over the weekend. Rebel forces claimed control of Damascus and President Bashar al-Assad fled to Russia. Also this week, central banks in Europe and Canada will meet to decide on interest rates. Premarket Movers Apollo Global Management and Workday, will be added to the S&P 500 in the index's quarterly rebalancing, replacing Qorvo and Amentum Holdings, both of which will move to the S&P Small Cap 600 index. Apollo Global was up 6.1% and Workday rose 10%. Qorvo and Amentum fell. AppLovin fell 5.4% after it wasn't added to the S&P 500. Barron's had reported Friday that AppLovin, Apollo, and Coinbase Global were leading candidates that might be added to the index because they have three of the largest market values of any companies not in the S&P 500. Coinbase declined 1.8%. Super Micro Computer said it has been granted an extension from Nasdaq that gives the server marker until Feb. 25, 2025, to file its latest annual report and that it expects to file by the deadline. Shares rose 9.2% Tesla was up 2.1%. Watch For: Oracle 2Q earnings Today's Headlines/Must Reads: - Tapped-Out Private-Equity Investors Decline New Commitments - New York City's Biggest Office Landlord Offers a Glimpse of the Market's Comeback - Why Tariffs Could Really Pinch Retailers This Time MARKET WRAPS Forex: The dollar edged lower as investors bet on the Fed cutting interest rates further this month, Swissquote Bank said. Friday's nonfarm payrolls data boosted market expectations for the Fed to cut rates by 25 basis points at the December 18 meeting, supporting the case for a softer dollar even as investors seek safe haven assets amid global political turmoil. The euro could fall to $1.0500 in the short-term or even lower after the U.S. inflation data and the ECB policy decision later this week, according to ING. Core inflation might have accelerated in November, bringing into question if the Fed would be right to be cutting interest rates and the ECB is likely to cut rates by 25 basis points on Thursday which might open the door to taking rates below the so-called neutral rate that neither spurs nor slows growth, ING said. Sterling rose after China's pledge for more proactive fiscal stimulus Monex Europe said. The announcement was supporting risk appetite and offering tailwinds to sterling, it said. Energy: Oil rose on greater uncertainty in the Middle East after Syrian President Bashar al-Assad's regime fell. ""The geopolitical situation in the Middle East is likely to remain tense in the coming days following the collapse of Syria's government,"" ANZ Research said. Still, gains are capped by persistent concerns over global demand and an impending glut despite OPEC+'s decision to extend a series of production cuts. The weak demand outlook was also underscored by Saudi Arabia's decision to lower its January prices for crude grades it sells to Asia, its main market. Focus this week will be on China's Central Economic Work Conference, as well as monthly reports from OPEC, the IEA and the EIA. DNB Markets said Saudi Arabia's decision to cut official oil selling prices for Asia underscores weaker demand in the continent. Aramco will sell January loadings of its flagship Arab Light grade to Asian buyers at a premium of $0.90 a barrel to the regional Dubai/Oman benchmark, compared with $1.70 in December. ""This is the lowest premium to Dubai since the start of 2021, and at the same time as OPEC has extended its production cuts."" Metals: Gold futures rose on geopolitical risk and central bank purchases. The precious metal has gained on safe-haven demand after the Syrian rebels seized Damascus. Israel seized the demilitarized buffer zone between Israel and Syria over the weekend. A softer dollar has further enhanced gold's appeal as a safe-haven. China's central bank also resumed purchases of bullions in November after a six-month pause, which should shore up Chinese investor demand. Gold Chart Comex gold futures' bullish setup is still valid, based on the daily chart, RHB Retail Research said. Friday's price movements have reaffirmed that bears are respecting the immediate support pegged at $2,640. TODAY'S TOP HEADLINES Meet the Small AI Chip Maker Now More Valuable Than Intel Matt Murphy has no interest in running a chip company 10 times the size of his current one. It is the smarter move, and actually the more ambitious one. Murphy, who has served as chief executive officer of Marvell Technology since 2016, has been among the few names floated as potential replacements for the recently ousted Pat Gelsinger at Intel's corner office. That led to the rare sight of a CEO using his own earnings call to deny that he is on the market. Apple Tops the List of Best-Managed Companies of 2024 Technology companies continue to hold most of the top spots in the annual Management Top 250 ranking of America's best-run companies, with Apple unseating Microsoft at No. 1. Rounding out the top four are Nvidia, Microsoft-which came in at No. 1 the previous four years-and Intel. BP, Japan's JERA to Invest Up to $5.8 Billion to Create Offshore Wind JV British energy giant BP and Japanese power-generation company JERA will invest $5.8 billion to create a global offshore wind-energy joint venture. The companies said Monday that the standalone company will have 13 gigawatt of potential net generating capacity. China Adopts Crisis-Era Language as Leaders Signal More Forceful Stimulus BEIJING-China's leaders signaled a more forceful policy approach to shoring up the economy as Beijing braces for trade tensions under the incoming Trump administration, employing language they haven't used since the depths of the global financial crisis. The 24-man Politburo, China's top decision-making body, pledged Monday to implement more proactive fiscal policy and to adopt a ""moderately loose"" monetary policy next year-the first introduction of such language since 2008. Why Tariffs Could Really Pinch Retailers This Time Many retailers came through relatively unscathed by Donald Trump's tariffs imposed starting in 2018. This time around, though, tariffs have the potential to bite more. Trump has proposed a universal tariff of 10% to 20% on all imports to the U.S. and a 60% or more tariff on goods from China. Somewhat confusingly, Trump has also separately threatened 25% tariffs on goods from Canada and Mexico and an additional 10% tariff on China over immigration and drug issues. Trump Says He Has No Plan to Remove Powell at Fed President-elect Donald Trump said he had no plans to remove Federal Reserve Chair Jerome Powell, whose term ends in May 2026. During an interview on NBC's Meet the Press, Trump fielded a question about whether he planned to replace Powell, who has said he would not leave the job even if asked to do so. ""No, I don't think so. I don't see it,"" Trump answered. U.S. Scrambles to Shape Post-Assad Syria but Has to Overcome Years of Disengagement WASHINGTON-The unexpectedly rapid downfall of President Bashar al-Assad in Syria has turned the country's future from a back-burner issue to a suddenly high-stakes concern for the departing Biden administration-and almost certainly for Donald Trump. U.S. officials are scrambling to assess the intentions of the rebel groups that drove Assad into exile, especially Hayat Tahrir al-Sham, which is expected to play a pivotal role in whatever government emerges in Damascus but which is on the U.S. list of foreign terrorist organizations. Israeli Airstrikes Target Syrian Chemical-Weapons Systems TEL AVIV-Israel said it had struck chemical-weapons caches and other missile and air-defense systems in Syria on Monday, taking advantage of the chaos there to destroy what it sees as dangerous assets that could fall into rebel hands. Since the stunning assault by Syrian rebels that brought down the regime of President Bashar al-Assad over the weekend, Israel said it has taken immediate steps to ensure the protection of its border amid the uncertainty engulfing the country. This includes striking targets across Syria and swiftly seizing a demilitarized buffer zone with Syria as well as adjacent points. Inside Ukraine's Battle for the Skies as Russian Bombardments Hit Records POLTAVA, Ukraine-A team of soldiers sat inside a nondescript red bus with their eyes glued to a bank of screens blinking with yellow dots. The shapes represented Russian drones, missiles and planes cutting into Ukrainian skies. Soldiers from Ukraine's 164th Radiotechnical Brigade were trying to quickly identify targets and intercept them before they could sow destruction in towns and cities. Write to clare.kinloch@wsj.com TODAY IN CANADA Earnings: VersaBank 4Q Economic Calendar (ET): Nothing major scheduled Stocks to Watch: (MORE TO FOLLOW) Dow Jones Newswires 12-09-24 0634ET",https://www.marketscreener.com/quote/stock/OMNICOM-GROUP-INC-13904/news/North-American-Morning-Briefing-Global-Ad-Shares-Gain-as-Omnicom-Interpublic-Near-Merger-Deal-48550188/
INTC,2024-12-09 06:11:00,"Intel should have focused on AI rather than chipmaking, TSMC founder says",https://images.financialmodelingprep.com/news/intel-should-have-focused-on-ai-rather-than-chipmaking-20241209.jpg,reuters.com,"Intel should have focused on artificial intelligence rather than trying to become a contract chipmaker, the founder of Taiwan Semiconductor Manufacturing Co said on Monday, in relation to the recent departure of Intel's CEO.",https://www.reuters.com/technology/intel-should-have-focused-ai-rather-than-chipmaking-tsmc-founder-says-2024-12-09/
INTC,2024-12-08 18:18:00,2 Stocks Down 63% and 72% to Buy Right Now,https://images.financialmodelingprep.com/news/2-stocks-down-63-and-72-to-buy-right-20241208.jpg,fool.com,"With less than a month remaining in this year, it's fair to say that 2024 has been great for the stock market. The S&P 500 index, which is often treated as the benchmark for broader market performance, has risen roughly 28% year to date.",https://www.fool.com/investing/2024/12/08/2-stocks-down-63-and-72-to-buy-right-now/
INTC,2024-12-08 09:30:00,Meet the Small AI Chip Maker Now More Valuable Than Intel,https://images.financialmodelingprep.com/news/meet-the-small-ai-chip-maker-now-more-valuable-20241208.jpg,wsj.com,Marvell's role in helping tech titans create their own data center chips has boosted its revenue—and valuation.,https://www.wsj.com/articles/marvell-ai-chip-manufacturing-faa89cb6
INTC,2024-12-06 17:03:00,"The Score: Intel, Salesforce, American Airlines and More Stocks That Defined the Week",https://images.financialmodelingprep.com/news/the-score-intel-salesforce-american-airlines-and-more-stocks-20241206.jpg,wsj.com,Here are some of the major companies whose stocks moved on the week's news.,https://www.wsj.com/articles/the-score-intel-salesforce-american-airlines-and-more-stocks-that-defined-the-week-fb9d2411
INTC,2024-12-06 11:19:29,2 growth stocks to buy at end of 2024,https://images.financialmodelingprep.com/news/2-growth-stocks-to-buy-at-end-of-2024-20241206.jpg,finbold.com,"As 2024 draws to a close, the stock market presents various investment opportunities, with equities likely to gain momentum into the new year.",https://finbold.com/2-growth-stocks-to-buy-at-end-of-2024/
INTC,2024-12-06 07:30:00,"Is It ""Game Over"" for Intel Stock Investors? Or Is There Still a Glimmer of Hope?",https://images.financialmodelingprep.com/news/is-it-game-over-for-intel-stock-investors-or-is-20241206.jpg,fool.com,"In today's video, I discuss Intel (INTC -5.28%), its business strategy, growth opportunities, potential risks, and why artificial intelligence stock investors should not ignore this semiconductor stock.",https://www.fool.com/investing/2024/12/06/is-it-game-over-for-intel-stock-investors-or-is-th/
INTC,2024-12-06 07:00:08,Is Intel Cooked? + What's Your P(Dyson Sphere)?,https://images.financialmodelingprep.com/news/is-intel-cooked-whats-your-pdyson-sphere-20241206.jpg,nytimes.com,The sudden departure of Intel's C.E.O. reignites concerns about U.S. dependence on foreign manufacturing.,https://www.nytimes.com/2024/12/06/podcasts/is-intel-cooked-whats-your-p-dyson-sphere-hard-fork-gift-guide.html
INTC,2024-12-06 06:05:02,Why Intel stock price is crashing,https://images.financialmodelingprep.com/news/why-intel-stock-price-is-crashing-20241206.jpg,finbold.com,"In the last two years, semiconductor companies and chipmakers were largely the biggest winners in the financial markets. The ongoing advancement and rapid expansion of artificial intelligence helped stocks like Nvidia (NASDAQ: NVDA) rapidly expand their market capitalizations — sometimes by a factor of 3 or 4.",https://finbold.com/why-intel-stock-price-is-crashing/
INTC,2024-12-06 05:10:00,These 2 Chip Stocks Are Set to Capitalize on Intel's CEO Crisis,https://images.financialmodelingprep.com/news/these-2-chip-stocks-are-set-to-capitalize-on-intels-20241206.jpg,fool.com,Investors don't seem to know what to do with Intel's (INTC -5.28%) recent CEO announcement.,https://www.fool.com/investing/2024/12/06/chip-stocks-set-capitalize-intel-ceo-crisis/
INTC,2024-12-06 05:00:00,"Sell Nvidia, Buy Intel Stock?",https://images.financialmodelingprep.com/news/sell-nvidia-buy-intel-stock-20241206.jpg,forbes.com,"Nvidia has been the poster child of the AI boom, with its stock surging by over 180% this year, pushing its valuation to close to $3.4 trillion. Nvidia's revenues are on track to more than double this fiscal year led by surging demand for its GPUs which have become the de facto chips for AI applications.",https://www.forbes.com/sites/greatspeculations/2024/12/06/sell-nvidia-buy-intel-stock/
INTC,2024-12-05 20:34:00,"Intel adds some much-needed help to its board, with stock on track for its worst year ever",https://images.financialmodelingprep.com/news/intel-adds-some-muchneeded-help-to-its-board-with-20241205.jpg,marketwatch.com,"Intel Corp.'s much-needed addition of two executives with semiconductor expertise to its board comes as the chip maker's stock is on track for its worst year ever, after the ouster earlier this week of Chief Executive Pat Gelsinger.",https://www.marketwatch.com/story/intel-adds-some-much-needed-help-to-its-board-with-stock-on-track-for-its-worst-year-ever-bc4161fd
INTC,2024-12-05 18:00:00,"Intel: The Board Shoots Itself In The Foot, Here's What Comes Next",https://images.financialmodelingprep.com/news/intel-the-board-shoots-itself-in-the-foot-heres-20241205.jpg,seekingalpha.com,"Intel CEO Pat Gelsinger has resigned. With the board likely forcing his hand, questions remain on next steps. I think Intel should maintain course on its foundry turnaround with its new 18A node.",https://seekingalpha.com/article/4742238-intel-the-board-shoots-itself-in-the-foot-heres-what-comes-next
INTC,2024-12-05 16:00:31,Can Restructure of Top Management Revive Intel Stock's Mojo?,https://images.financialmodelingprep.com/news/can-restructure-of-top-management-revive-intel-stocks-mojo-20241205.jpg,zacks.com,Intel appears to be treading in the middle of the road on a thin wafer line and investors could be better off if they trade with caution.,https://www.zacks.com/stock/news/2379827/can-restructure-of-top-management-revive-intel-stock-s-mojo?cid=CS-STOCKNEWSAPI-FT-analyst_blog|most_popular_stocks-2379827
INTC,2024-12-05 15:49:07,Intel announces two new board members to strengthen semiconductor experience,https://images.financialmodelingprep.com/news/intel-announces-two-new-board-members-to-strengthen-semiconductor-20241205.jpg,youtube.com,CNBC's Seema Mody reports on news regarding Intel.,https://www.youtube.com/watch?v=7frYd570q7I
INTC,2024-12-05 14:56:00,The Shake-Up at Intel,https://images.financialmodelingprep.com/news/the-shakeup-at-intel-20241205.jpg,fool.com,"In this podcast, Motley Fool analyst Tim Beyers and host Dylan Lewis discuss:",https://www.fool.com/investing/2024/12/05/the-shake-up-at-intel/
INTC,2024-12-05 12:42:15,Why Intel Stock Was Sliding Again Today,https://images.financialmodelingprep.com/news/why-intel-stock-was-sliding-again-today-20241205.jpg,fool.com,"Shares of Intel (INTC -4.64%) continued to retreat today after an initial pop following the exit of CEO Pat Gelsinger. Intel added new members to its board this morning, but a picture of a chaotic search for a new CEO is emerging as well.",https://www.fool.com/investing/2024/12/05/why-intel-stock-was-sliding-again-today/
INTC,2024-12-05 12:20:23,Intel hires two tech heavyweights to help steer struggling chipmaker in new direction,https://images.financialmodelingprep.com/news/intel-hires-two-tech-heavyweights-to-help-steer-struggling-20241205.jpg,proactiveinvestors.com,"Intel Corp (NASDAQ:INTC, ETR:INL) has added two technology heavyweights to its board of directors to firm up the senior leadership at the struggling chipmaker. The new board additions are Eric Meurice, former chief executive of Dutch semiconductor machinery titan ASML Holding NV (NASDAQ:ASML), and Steve Sanghi, the currency chairman and interim chief executive officer of Microchip Technology Inc (NASDAQ:MCHP).",https://www.proactiveinvestors.com/companies/news/1062237
INTC,2024-12-05 11:22:17,Intel names two chip industry veterans to its board amid CEO search,https://images.financialmodelingprep.com/news/intel-names-two-chip-industry-veterans-to-its-board-20241205.jpg,reuters.com,"Intel on Thursday named two chip industry veterans to its board, as the struggling semiconductor firm looks for a new top boss following the recent ouster of Pat Gelsinger and tries to reclaim its lost glory.",https://www.reuters.com/technology/intel-names-two-chip-industry-veterans-its-board-amid-ceo-search-2024-12-05/
INTC,2024-12-05 09:45:00,Intel's Stock Just Did Something It Hasn't Done Since 2022,https://images.financialmodelingprep.com/news/intels-stock-just-did-something-it-hasnt-done-since-20241205.jpg,fool.com,"The last couple of years have been terrific for semiconductor stocks. Well, most semiconductor stocks, that is.",https://www.fool.com/investing/2024/12/05/intel-stock-just-did-something-it-hasnt-done-since/
INTC,2024-12-05 09:06:16,Intel adds two new directors with CEO search underway,https://images.financialmodelingprep.com/news/intel-adds-two-new-directors-with-ceo-search-underway-20241205.jpg,cnbc.com,"Intel on Thursday announced the appointment of two new directors with significant semiconductor manufacturing experience as the company ramps up the search process for ousted CEO Pat Gelsinger's replacement. Former ASML CEO Eric Meurice and Microchip interim CEO Steve Sanghi will join Intel's board effective immediately, the company said.",https://www.cnbc.com/2024/12/05/intel-adds-two-new-directors-with-ceo-search-underway.html
INTC,2024-12-05 09:00:00,MediaRadar Transforms Actionable Ad Intel with AI-Powered Sales Prospecting Solution for Publishers and Platforms,https://images.financialmodelingprep.com/news/mediaradar-transforms-actionable-ad-intel-with-aipoweredsales-prospecting-solution-20241205.jpg,globenewswire.com,The solution uses AI to scale personalized email and LinkedIn sequences auto-populated with advertising recommendations from the industry's leading advertising intelligence platform The solution uses AI to scale personalized email and LinkedIn sequences auto-populated with advertising recommendations from the industry's leading advertising intelligence platform,https://www.globenewswire.com/news-release/2024/12/05/2992382/0/en/MediaRadar-Transforms-Actionable-Ad-Intel-with-AI-Powered-Sales-Prospecting-Solution-for-Publishers-and-Platforms.html
INTC,2024-12-05 08:30:00,Intel Appoints Semiconductor Leaders Eric Meurice and Steve Sanghi to Board of Directors,https://images.financialmodelingprep.com/news/intel-appoints-semiconductor-leaders-eric-meurice-and-steve-sanghi-20241205.jpg,businesswire.com,"SANTA CLARA, Calif.--(BUSINESS WIRE)--Intel Corp. announces that Eric Meurice and Steve Sanghi have been appointed to Intel's board of directors. Both will serve as independent directors.",https://www.businesswire.com/news/home/20241205898439/en/Intel-Appoints-Semiconductor-Leaders-Eric-Meurice-and-Steve-Sanghi-to-Board-of-Directors/
