symbol,publishedDate,title,image,site,text,url
INTU,2025-04-09 08:14:00,Intuit Further Simplifies Tax Prep for Millions of TurboTax Customers this Tax Season with Google Cloud AI,https://images.financialmodelingprep.com/news/intuit-further-simplifies-tax-prep-for-millions-of-turbotax-20250409.jpg,prnewswire.com,"With Google Cloud's Doc AI and Gemini models, TurboTax expands done-for-you tax return autofill for ten common tax forms to save time and boost accuracy LAS VEGAS , April 9, 2025 /PRNewswire/ -- Cloud Next '25, LAS VEGAS -- Intuit Inc. (Nasdaq: INTU), the global financial technology platform that makes Intuit TurboTax, Credit Karma, QuickBooks, and Mailchimp, today announced a new collaboration with Google Cloud that further simplifies tax preparation for millions of TurboTax customers this tax season. With Google Cloud's generative AI capabilities, Intuit is expanding done-for-you autofill of tax returns for the ten most common U.S. tax forms (1099, 1040) – which can vary significantly in complexity – saving time and boosting accuracy.",https://www.prnewswire.com/news-releases/intuit-further-simplifies-tax-prep-for-millions-of-turbotax-customers-this-tax-season-with-google-cloud-ai-302423849.html
INTU,2025-04-07 18:55:36,Intuit (INTU) Falls More Steeply Than Broader Market: What Investors Need to Know,https://images.financialmodelingprep.com/news/intuit-intu-falls-more-steeply-than-broader-market-what-20250407.jpg,zacks.com,"In the closing of the recent trading day, Intuit (INTU) stood at $556.24, denoting a -0.94% change from the preceding trading day.",https://www.zacks.com/stock/news/2441506/intuit-intu-falls-more-steeply-than-broader-market-what-investors-need-to-know?cid=CS-STOCKNEWSAPI-FT-tale_of_the_tape|yseop_template_6v1-2441506
INTU,2025-04-03 10:06:04,Intuit Inc. (INTU) is Attracting Investor Attention: Here is What You Should Know,https://images.financialmodelingprep.com/news/intuit-inc-intu-is-attracting-investor-attention-here-is-20250403.jpg,zacks.com,"Zacks.com users have recently been watching Intuit (INTU) quite a bit. Thus, it is worth knowing the facts that could determine the stock's prospects.",https://www.zacks.com/stock/news/2439629/intuit-inc-intu-is-attracting-investor-attention-here-is-what-you-should-know?cid=CS-STOCKNEWSAPI-FT-tale_of_the_tape|most_searched_stocks-2439629
INTU,2025-04-02 16:58:14,"Intuit: Steady Performance, But This Tax Leader Already Commands A High Price (Upgrade)",https://images.financialmodelingprep.com/news/intuit-steady-performance-but-this-tax-leader-already-commands-20250402.jpg,seekingalpha.com,"Intuit's diversified revenue streams, including QuickBooks and Credit Karma, have reduced dependency on the volatile tax season, contributing to stable performance amid market volatility. Despite strong fiscal Q2 results and accelerating revenue, Intuit's high valuation and market saturation limit its growth potential and justify a neutral rating. Intuit faces heavy competition in non-tax business software, with rivals like Workday, Oracle NetSuite, and SAP posing significant challenges.",https://seekingalpha.com/article/4772605-intuit-steady-performance-but-this-tax-leader-already-commands-high-price-upgrade
INTU,2025-04-02 14:59:00,Hidden Ways to Maximize Your Tax Refund and Find Lesser-Known Deductions and Credits,https://images.financialmodelingprep.com/news/hidden-ways-to-maximize-your-tax-refund-and-find-20250402.jpg,globenewswire.com,"With the IRS tax filing deadline approaching on April 15, experts say you should file now. You can boost your refund with many deductions and credits.",https://www.globenewswire.com/news-release/2025/04/02/3054649/0/en/Hidden-Ways-to-Maximize-Your-Tax-Refund-and-Find-Lesser-Known-Deductions-and-Credits.html
INTU,2025-04-02 04:00:00,New Intuit Small Business Growth Council Launched to Champion AI and Digital Transformation for Small Businesses in the UK,https://images.financialmodelingprep.com/news/new-intuit-small-business-growth-council-launched-to-champion-20250402.jpg,businesswire.com,"LONDON--(BUSINESS WIRE)--Intuit Inc. (Nasdaq: INTU), the global financial technology platform that makes TurboTax, Credit Karma, QuickBooks, and Mailchimp, today announced the launch of the Intuit Small Business Growth Council (Council), a new initiative dedicated to empowering small businesses in the UK through AI and digital adoption. The Council, which consists of 18 digitally-connected businesses, will amplify the voices of small businesses in shaping policies that drive innovation and econ.",https://www.businesswire.com/news/home/20250402452695/en/New-Intuit-Small-Business-Growth-Council-Launched-to-Champion-AI-and-Digital-Transformation-for-Small-Businesses-in-the-UK/
INTU,2025-04-02 02:12:33,My Top 15 High-Growth Dividend Stocks For April 2025,https://images.financialmodelingprep.com/news/my-top-15-highgrowth-dividend-stocks-for-april-2025-20250402.jpg,seekingalpha.com,"My Top 15 High-Growth Dividend stocks outperformed SPY and VIG in March, posting a loss of 3.26% compared to SPY's 5.86% and VIG's 4.50%. The April 2025 list offers an average dividend yield of 1.25% and is potentially 31% undervalued, poised for strong long-term returns. Dollar cost averaging into the top 15 stocks each month shows a 68.54% success rate, with 61 out of 89 stocks leading to positive gains.",https://seekingalpha.com/article/4772405-my-top-15-high-growth-dividend-stocks-for-april-2025
INTU,2025-04-01 18:55:46,Intuit (INTU) Stock Falls Amid Market Uptick: What Investors Need to Know,https://images.financialmodelingprep.com/news/intuit-intu-stock-falls-amid-market-uptick-what-investors-20250401.jpg,zacks.com,"Intuit (INTU) closed the most recent trading day at $613.78, moving -0.03% from the previous trading session.",https://www.zacks.com/stock/news/2438571/intuit-intu-stock-falls-amid-market-uptick-what-investors-need-to-know?cid=CS-STOCKNEWSAPI-FT-tale_of_the_tape|yseop_template_6v1-2438571
INTU,2025-04-01 10:35:00,Intuit Launches Financial Literacy Month Challenge to Empower Nation's Students,https://images.financialmodelingprep.com/news/intuit-launches-financial-literacy-month-challenge-to-empower-nations-students-20250401.jpg,businesswire.com,"MOUNTAIN VIEW, Calif.--(BUSINESS WIRE)--Intuit Launches Financial Literacy Month Challenge to Empower Nation's Students.",https://www.businesswire.com/news/home/20250401996313/en/Intuit-Launches-Financial-Literacy-Month-Challenge-to-Empower-Nations-Students/
INTU,2025-03-20 10:05:26,Intuit Inc. (INTU) Is a Trending Stock: Facts to Know Before Betting on It,https://images.financialmodelingprep.com/news/intuit-inc-intu-is-a-trending-stock-facts-to-20250320.jpg,zacks.com,"Intuit (INTU) has received quite a bit of attention from Zacks.com users lately. Therefore, it is wise to be aware of the facts that can impact the stock's prospects.",https://www.zacks.com/stock/news/2432624/intuit-inc-intu-is-a-trending-stock-facts-to-know-before-betting-on-it?cid=CS-STOCKNEWSAPI-FT-tale_of_the_tape|most_searched_stocks-2432624
INTU,2025-03-19 10:30:48,Brokers Suggest Investing in Intuit (INTU): Read This Before Placing a Bet,https://images.financialmodelingprep.com/news/brokers-suggest-investing-in-intuit-intu-read-this-before-20250319.jpg,zacks.com,"When deciding whether to buy, sell, or hold a stock, investors often rely on analyst recommendations. Media reports about rating changes by these brokerage-firm-employed (or sell-side) analysts often influence a stock's price, but are they really important?",https://www.zacks.com/stock/news/2432032/brokers-suggest-investing-in-intuit-intu-read-this-before-placing-a-bet?cid=CS-STOCKNEWSAPI-FT-fundamental_analysis|average_broker_rating-2432032
INTU,2025-03-18 09:00:27,Buy 3 Wide Moat Stocks to Tap Near-Term Upside and Long-Term Potential,https://images.financialmodelingprep.com/news/buy-3-wide-moat-stocks-to-tap-nearterm-upside-20250318.jpg,zacks.com,"Three Wide Moat stocks have strong short-term and long-term growth potential. These are: NVDA, V, INTU.",https://www.zacks.com/stock/news/2431289/buy-3-wide-moat-stocks-to-tap-near-term-upside-and-long-term-potential?cid=CS-STOCKNEWSAPI-FT-analyst_blog|investment_ideas-2431289
INTU,2025-03-12 09:35:24,Top Wide-Moat Stocks Worth Investing in for Sustainable Growth in 2025,https://images.financialmodelingprep.com/news/top-widemoat-stocks-worth-investing-in-for-sustainable-growth-20250312.jpg,zacks.com,"Investing in wide-moat stocks like TSM, NVDA, INTU and SPGI can be a strategy for long-term wealth creation due to their ability to deliver consistent returns.",https://www.zacks.com/stock/news/2428928/top-wide-moat-stocks-worth-investing-in-for-sustainable-growth-in-2025?cid=CS-STOCKNEWSAPI-FT-analyst_blog|investment_ideas-2428928
INTU,2025-03-11 12:15:28,Intuit Falls 13% in a Year: Is it the Right Time to Buy the Stock?,https://images.financialmodelingprep.com/news/intuit-falls-13-in-a-year-is-it-the-20250311.jpg,zacks.com,"INTU forms key partnerships and integrates AI into its services, which investors should see as a compelling entry point.",https://www.zacks.com/stock/news/2428498/intuit-falls-13-in-a-year-is-it-the-right-time-to-buy-the-stock?cid=CS-STOCKNEWSAPI-FT-analyst_blog|rank_focused-2428498
INTU,2025-03-06 15:21:26,"Salesforce, Microsoft, and 3 other software stocks Evercore ISI wants you to buy amid market pullback",https://images.financialmodelingprep.com/news/salesforce-microsoft-and-3-other-software-stocks-evercore-isi-20250306.jpg,invezz.com,"Investors have been cautious about high-growth technology stocks in 2024, with broader market uncertainty and concerns over President Donald Trump's tariff policies putting pressure on valuations. The Nasdaq Composite has declined 6% so far this year as investors rotate out of last year's best-performing stocks and software companies have not been immune to this downturn.",https://invezz.com/news/2025/03/06/salesforce-microsoft-and-3-other-software-stocks-evercore-isi-wants-you-to-buy-amid-market-pullback/
INTU,2025-03-06 08:50:32,Bet on These 5 Stocks With Robust Sales Growth for Exceptional Returns,https://images.financialmodelingprep.com/news/bet-on-these-5-stocks-with-robust-sales-growth-20250306.jpg,zacks.com,"Against heightened market volatility, the traditional stock picking method - sales growth - is apt. Stocks like DRI, MIDD, INTU, CFR & AEP are worth buying.",https://www.zacks.com/stock/news/2426455/bet-on-these-5-stocks-with-robust-sales-growth-for-exceptional-returns?cid=CS-STOCKNEWSAPI-FT-analyst_blog|rw-2426455
INTU,2025-03-05 13:18:25,"Intuit Under-performance Has Stemmed From Valuation Reset, Analyst Upgrades Stock",https://images.financialmodelingprep.com/news/intuit-underperformance-has-stemmed-from-valuation-reset-analyst-upgrades-20250305.jpg,benzinga.com,JP Morgan analyst Mark Murphy upgraded Intuit Inc INTU from Neutral to Overweight and raised the price target from $640 to $660.,https://www.benzinga.com/25/03/44148252/intuit-gains-analyst-confidence-with-strong-business-trends-higher-pricing-power-and-market-stickiness
INTU,2025-03-05 10:05:58,Investors Heavily Search Intuit Inc. (INTU): Here is What You Need to Know,https://images.financialmodelingprep.com/news/investors-heavily-search-intuit-inc-intu-here-is-what-20250305.jpg,zacks.com,"Recently, Zacks.com users have been paying close attention to Intuit (INTU). This makes it worthwhile to examine what the stock has in store.",https://www.zacks.com/stock/news/2425819/investors-heavily-search-intuit-inc-intu-here-is-what-you-need-to-know?cid=CS-STOCKNEWSAPI-FT-tale_of_the_tape|most_searched_stocks-2425819
INTU,2025-03-04 20:40:03,"Intuit Inc. (INTU) Presents at the Morgan Stanley Technology, Media & Telecom Conference (Transcript)",https://images.financialmodelingprep.com/news/intuit-inc-intu-presents-at-the-morgan-stanley-technology-20250304.jpg,seekingalpha.com,"Intuit Inc. (NASDAQ:INTU ) Morgan Stanley Technology, Media & Telecom Conference Call March 4, 2025 4:05 PM ET Company Participants Sandeep Ahuja - Executive Vice President, Chief Financial Officer Conference Call Participants Keith Weiss - Morgan Stanley Keith Weiss Excellent. Thank you, everyone, for joining us.",https://seekingalpha.com/article/4764681-intuit-inc-intu-presents-at-the-morgan-stanley-technology-media-and-telecom-conference
INTU,2025-03-04 09:05:00,Intuit Expands Free Financial Education Program to Colleges and Universities to Champion Student Success,https://images.financialmodelingprep.com/news/intuit-expands-free-financial-education-program-to-colleges-and-20250304.jpg,businesswire.com,"MOUNTAIN VIEW, Calif.--(BUSINESS WIRE)--Intuit is investing in the future of college students nationwide through a suite of free financial education programs.",https://www.businesswire.com/news/home/20250304653945/en/Intuit-Expands-Free-Financial-Education-Program-to-Colleges-and-Universities-to-Champion-Student-Success/
INTU,2025-03-03 16:34:39,My Top 15 High-Growth Dividend Stocks For March 2025,https://images.financialmodelingprep.com/news/my-top-15-highgrowth-dividend-stocks-for-march-2025-20250303.jpg,seekingalpha.com,"The SPDR S&P 500 ETF Trust stumbled in February but managed to maintain a positive return in 2025. The Top 15 dividend growth stocks for March 2025 offer an average dividend yield of 1.13% and appear to be about 25% undervalued based on dividend yield theory. Since its inception in September 2020, the watch list has achieved a 10.63% compound annual growth rate.",https://seekingalpha.com/article/4764169-my-top-15-high-growth-dividend-stocks-for-march-205
INTU,2025-03-03 13:00:34,All You Need to Know About Intuit (INTU) Rating Upgrade to Buy,https://images.financialmodelingprep.com/news/all-you-need-to-know-about-intuit-intu-rating-20250303.jpg,zacks.com,"Intuit (INTU) might move higher on growing optimism about its earnings prospects, which is reflected by its upgrade to a Zacks Rank #2 (Buy).",https://www.zacks.com/stock/news/2424682/all-you-need-to-know-about-intuit-intu-rating-upgrade-to-buy?cid=CS-STOCKNEWSAPI-FT-tale_of_the_tape|yseop_template_12_zacks_rank_upgrade-2424682
INTU,2025-03-03 10:30:34,Wall Street Bulls Look Optimistic About Intuit (INTU): Should You Buy?,https://images.financialmodelingprep.com/news/wall-street-bulls-look-optimistic-about-intuit-intu-should-20250303.jpg,zacks.com,"The recommendations of Wall Street analysts are often relied on by investors when deciding whether to buy, sell, or hold a stock. Media reports about these brokerage-firm-employed (or sell-side) analysts changing their ratings often affect a stock's price.",https://www.zacks.com/stock/news/2424323/wall-street-bulls-look-optimistic-about-intuit-intu-should-you-buy?cid=CS-STOCKNEWSAPI-FT-fundamental_analysis|average_broker_rating-2424323
INTU,2025-02-27 05:24:33,Intuit's Q2 Earnings Reinforce Its Status As A Strong Compounder,https://images.financialmodelingprep.com/news/intuits-q2-earnings-reinforce-its-status-as-a-strong-20250227.jpg,seekingalpha.com,"Intuit's Q2 earnings demonstrate strong fundamentals, driven by AI-driven automation, resulting in 17% revenue growth and 26% GAAP operating income growth YoY. The company's long-term growth prospects are bolstered by its comprehensive ecosystem, high switching costs, and significant TAM, particularly in small business growth and international expansion. Despite potential risks from evolving technologies and competition, Intuit's robust track record and strategic initiatives support a projected 10%-20% annual revenue growth.",https://seekingalpha.com/article/4762645-intuits-q2-earnings-reinforce-its-status-as-a-strong-compounder
INTU,2025-02-26 17:49:42,"Value investing, AI data centers, Intuit CFO: Catalysts",https://images.financialmodelingprep.com/news/value-investing-ai-data-centers-intuit-cfo-catalysts-20250226.jpg,youtube.com,Join Seana Smith and Madison Mills as they cover the biggest market stories in Wednesday's first full trading hour. All that and more on today's episode of Catalysts.,https://www.youtube.com/watch?v=xDzPOcelFAc
INTU,2025-02-26 16:05:24,Watch These 3 Stocks for Solid Earnings Acceleration,https://images.financialmodelingprep.com/news/watch-these-3-stocks-for-solid-earnings-acceleration-20250226.jpg,zacks.com,"Prairie Operating, Intuit and Cardinal Health are exhibiting strong earnings acceleration.",https://www.zacks.com/stock/news/2422233/watch-these-3-stocks-for-solid-earnings-acceleration?cid=CS-STOCKNEWSAPI-FT-analyst_blog|rw-2422233
INTU,2025-02-26 11:53:50,"Intuit Sees AI-Driven Growth With TurboTax, Credit Karma: Analyst Raises Price Forecast",https://images.financialmodelingprep.com/news/intuit-sees-aidriven-growth-with-turbotax-credit-karma-analyst-20250226.jpg,benzinga.com,Piper Sandler analyst Arvind Ramnani reiterated Intuit Inc INTU with an Overweight and raised the price target from $765 to $785.,https://www.benzinga.com/analyst-ratings/price-target/25/02/43980437/intuit-sees-ai-driven-growth-with-turbotax-credit-karma-analyst-raises-price-forecas
INTU,2025-02-26 11:40:31,"Intuit Q2 Earnings Surpass Estimates, Revenues Increase Y/Y",https://images.financialmodelingprep.com/news/intuit-q2-earnings-surpass-estimates-revenues-increase-yy-20250226.jpg,zacks.com,"INTU's fiscal second-quarter results surpass expectations, reflecting strength in the Global Business Solutions segment.",https://www.zacks.com/stock/news/2422077/intuit-q2-earnings-surpass-estimates-revenues-increase-y-y?cid=CS-STOCKNEWSAPI-FT-analyst_blog|earnings_article-2422077
INTU,2025-02-26 10:52:00,"Intuit's Q2 Blowout: Premium Valuation, But Premium Growth As Well",https://images.financialmodelingprep.com/news/intuits-q2-blowout-premium-valuation-but-premium-growth-as-well-20250226.jpg,seekingalpha.com,"Intuit's strong Q2 earnings, driven by AI automation and mid-market expansion, surpassed expectations with a 17.04% revenue increase and 26% non-GAAP EPS growth. AI-driven innovations like QuickBooks Live and TurboTax integration with Credit Karma are enhancing efficiency, customer retention, and revenue, justifying Intuit's premium valuation. Despite regulatory scrutiny and slowing growth in Consumer Tax and Mailchimp, Intuit's consistent double-digit revenue and EPS growth make it a compelling long-term investment.",https://seekingalpha.com/article/4762165-intuits-q2-blowout-premium-valuation-but-premium-growth-as-well
INTU,2025-02-26 10:38:14,2 Software Stocks Surging After Earnings,https://images.financialmodelingprep.com/news/2-software-stocks-surging-after-earnings-20250226.jpg,schaeffersresearch.com,"Workday Inc (NASDAQ:WDAY) stock is up 7.8% at $275.15, after the software name posted fourth-quarter earnings of $1.92 per share on revenue of $2.21 billion, beating estimates of $1.78 on $2.18 billion.",https://www.schaeffersresearch.com/content/news/2025/02/26/2-software-stocks-surging-after-earnings
INTU,2025-02-26 10:17:45,Cramer's Stop Trading: Intuit,https://images.financialmodelingprep.com/news/cramers-stop-trading-intuit-20250226.jpg,youtube.com,Jim Cramer breaks down why he's keeping an eye on shares of Intuit.,https://www.youtube.com/watch?v=Fza8m8BW1xs
INTU,2025-02-26 09:00:00,"Intuit Mailchimp Announces New Product Enhancements and Refreshed Popup Forms, A Smarter Solution for Lead Generation and Business Growth",https://images.financialmodelingprep.com/news/intuit-mailchimp-announces-new-product-enhancements-and-refreshed-popup-forms-20250226.jpg,businesswire.com,"MOUNTAIN VIEW, Calif.--(BUSINESS WIRE)--Intuit Inc. (Nasdaq: INTU), the global financial technology platform that makes Intuit TurboTax, Credit Karma, QuickBooks, and Mailchimp, today announced a host of product enhancements and a completely revamped popup forms experience in beta to help marketers target and engage site visitors with branded, interactive popup forms to grow their audience. With popup forms, marketers can grow their customers using customizable, mobile-first designs for deeper.",https://www.businesswire.com/news/home/20250226883406/en/Intuit-Mailchimp-Announces-New-Product-Enhancements-and-Refreshed-Popup-Forms-A-Smarter-Solution-for-Lead-Generation-and-Business-Growth/
INTU,2025-02-25 20:04:02,Intuit Inc. (INTU) Q2 2025 Earnings Call Transcript,https://images.financialmodelingprep.com/news/intuit-inc-intu-q2-2025-earnings-call-transcript-20250225.jpg,seekingalpha.com,"Intuit Inc. (NASDAQ:INTU ) Q2 2025 Earnings Conference Call February 25, 2025 4:30 PM ET Company Participants Kim Watkins - Vice President, Investor Relations Sasan Goodarzi - Chief Executive Officer Sandeep Aujla - Chief Financial Officer Conference Call Participants Siti Panigrahi - Mizuho Kirk Materne - Evercore ISI Keith Weiss - Morgan Stanley Brent Thill - Jefferies Steve Enders - Citi Kash Rangan - Goldman Sachs Brad Sills - Bank of America Alex Markgraff - KeyBanc Capital Markets Taylor McGinnis - UBS Rishi Jaluria - RBC Capital Markets Scott Schneeberger - Oppenheimer Operator Good afternoon. My name is Angela, and I will be your conference operator.",https://seekingalpha.com/article/4761938-intuit-inc-intu-q2-2025-earnings-call-transcript
INTU,2025-02-25 18:42:07,"Intuit Beats EPS, Revenue Expectations",https://images.financialmodelingprep.com/news/intuit-beats-eps-revenue-expectations-20250225.jpg,fool.com,"Intuit reported stronger-than-expected fiscal 2025 second-quarter results, fueled by robust segment growth and an AI-focused strategy.",https://www.fool.com/data-news/2025/02/25/intuit-beats-eps-revenue-expectations/
INTU,2025-02-25 18:15:20,Intuit (INTU) Q2 Earnings and Revenues Beat Estimates,https://images.financialmodelingprep.com/news/intuit-intu-q2-earnings-and-revenues-beat-estimates-20250225.jpg,zacks.com,"Intuit (INTU) came out with quarterly earnings of $3.32 per share, beating the Zacks Consensus Estimate of $2.58 per share. This compares to earnings of $2.63 per share a year ago.",https://www.zacks.com/stock/news/2421485/intuit-intu-q2-earnings-and-revenues-beat-estimates?cid=CS-STOCKNEWSAPI-FT-tale_of_the_tape|yseop_template_4-2421485
INTU,2025-02-25 17:30:00,Intuit shares jump after results top estimates amid key tax season,https://images.financialmodelingprep.com/news/intuit-shares-jump-after-results-top-estimates-amid-key-20250225.jpg,marketwatch.com,"Tax-preparation software provider Intuit on Tuesday reported quarterly results that topped Wall Street's estimates, while forecasting third-quarter sales that were also above expectations.",https://www.marketwatch.com/story/intuit-shares-jump-after-results-top-estimates-amid-key-tax-season-f2f4c2bc
INTU,2025-02-25 16:04:10,Intuit's AI-driven financial tools boost third-quarter revenue forecast,https://images.financialmodelingprep.com/news/intuits-aidriven-financial-tools-boost-thirdquarter-revenue-forecast-20250225.jpg,reuters.com,"TurboTax maker Intuit forecast third-quarter revenue above Wall Street estimates on Tuesday, betting on growing demand for its AI-driven financial services software.",https://www.reuters.com/technology/artificial-intelligence/intuits-ai-driven-financial-tools-boost-third-quarter-revenue-forecast-2025-02-25/
INTU,2025-02-25 16:00:00,Intuit Reports Strong Second Quarter Results and Reiterates Full Year Guidance,https://images.financialmodelingprep.com/news/intuit-reports-strong-second-quarter-results-and-reiterates-full-20250225.jpg,https://www.businesswire.com,"MOUNTAIN VIEW, Calif.--(BUSINESS WIRE)--Intuit Inc. (Nasdaq: INTU), the global financial technology platform that makes Intuit TurboTax, Credit Karma, QuickBooks, and Mailchimp, announced financial results for the second quarter of fiscal 2025, which ended January 31.",https://www.businesswire.com/news/home/20250225842551/en/Intuit-Reports-Strong-Second-Quarter-Results-and-Reiterates-Full-Year-Guidance
INTU,2025-02-25 12:21:18,Intuit Earnings Are Imminent; These Most Accurate Analysts Revise Forecasts Ahead Of Earnings Call,https://images.financialmodelingprep.com/news/intuit-earnings-are-imminent-these-most-accurate-analysts-revise-20250225.jpg,benzinga.com,"Intuit Inc. INTU will release its second-quarter financial results after the closing bell on Tuesday, Feb. 25.",https://www.benzinga.com/analyst-ratings/price-target/25/02/43948819/intuit-earnings-are-imminent-these-most-accurate-analysts-revise-forecasts-ahead-of-
INTU,2025-02-24 13:18:33,What To Expect From Intuit Q2 Earnings?,https://images.financialmodelingprep.com/news/what-to-expect-from-intuit-q2-earnings-20250224.jpg,benzinga.com,Wall Street analysts rerated Intuit Inc INTU ahead of its quarterly earnings report amid an exciting earnings season. JP Morgan analyst Mark R Murphy remained Neutral rated on Intuit.,https://www.benzinga.com/25/02/43921057/intuit-gains-analyst-attention-with-strong-quickbooks-turbotax-trends-despite-credit-karma-challenges
INTU,2025-02-23 22:21:37,"Defensive, Sector-Based Dividend Growth: 6 Opportunities And One Special Highlight (Part 1)",https://images.financialmodelingprep.com/news/defensive-sectorbased-dividend-growth-6-opportunities-and-one-special-20250223.jpg,seekingalpha.com,"Dividend growth investing can offer high-quality stocks, with small dividends growing in the 10-15% range, providing impressive investment opportunities. Diversified, large-cap companies with strong revenue, earnings, and dividend growth, are reliable characteristics of such dividend growth companies investors can count on. The companies I'll highlight have strong insider holdings, reliable growing dividends, and current or potential for share buybacks, offering stability and potentially strong capital gains.",https://seekingalpha.com/article/4761143-defensive-sector-based-dividend-growth-6-opportunities-and-one-special-highlight-part-1
