symbol,publishedDate,title,image,site,text,url
INTU,2024-12-02 06:00:00,My Top 15 High-Growth Dividend Stocks For December 2024,https://images.financialmodelingprep.com/news/my-top-15-highgrowth-dividend-stocks-for-december-2024-20241202.jpg,seekingalpha.com,"The SPDR S&P 500 ETF Trust posted a strong gain of 5.96% in November, resuming its strong run in 2024. The Top 15 dividend growth stocks for December 2024 offer an average dividend yield of 1.2% and appear to be about 22% undervalued based on dividend yield theory. Since its inception in September 2020, the watch list has achieved a 12.41% compound annual growth rate.",https://seekingalpha.com/article/4741426-my-top-15-high-growth-dividend-stocks-for-december-2024
INTU,2024-11-28 10:05:30,Intuit Inc. (INTU) is Attracting Investor Attention: Here is What You Should Know,https://images.financialmodelingprep.com/news/intuit-inc-intu-is-attracting-investor-attention-here-is-20241128.jpg,zacks.com,"Recently, Zacks.com users have been paying close attention to Intuit (INTU). This makes it worthwhile to examine what the stock has in store.",https://www.zacks.com/stock/news/2376465/intuit-inc-intu-is-attracting-investor-attention-here-is-what-you-should-know?cid=CS-STOCKNEWSAPI-FT-tale_of_the_tape|most_searched_stocks-2376465
INTU,2024-11-27 10:15:00,3 Tech Stocks You Can Buy and Hold for the Next Decade,https://images.financialmodelingprep.com/news/3-tech-stocks-you-can-buy-and-hold-for-the-20241127.jpg,fool.com,"Technology companies are the growth stock darlings of the stock market, and for good reason. The ""Magnificent Seven's"" dominance has propelled the Nasdaq Composite to new heights this year, with the technology-heavy index up more than 28% year to date to surpass the 19,000 level.",https://www.fool.com/investing/2024/11/27/3-tech-stocks-you-can-hold-for-the-next-decade/
INTU,2024-11-26 16:01:00,Intuit Executive Mark Notarainni to Present at the Wells Fargo 8th Annual TMT Summit,https://images.financialmodelingprep.com/news/intuit-executive-mark-notarainni-to-present-at-the-wells-20241126.jpg,businesswire.com,"MOUNTAIN VIEW, Calif.--(BUSINESS WIRE)--Intuit Inc. (Nasdaq: INTU), the global financial technology platform that makes Intuit TurboTax, Credit Karma, QuickBooks, and Mailchimp, announced today that Mark Notarainni, executive vice president and general manager of Intuit's Consumer Group, will present at the Wells Fargo 8th Annual TMT Summit on December 4, 2024. The fireside chat will begin at 3:00 p.m. Pacific Time (6:00 p.m. Eastern Time) and will be available live via audio webcast on Intuit'.",https://www.businesswire.com/news/home/20241126946760/en/Intuit-Executive-Mark-Notarainni-to-Present-at-the-Wells-Fargo-8th-Annual-TMT-Summit/
INTU,2024-11-25 16:00:00,"Intuit to Host Investor Day on September 18, 2025",https://images.financialmodelingprep.com/news/intuit-to-host-investor-day-on-september-18-2025-20241125.jpg,businesswire.com,"MOUNTAIN VIEW, Calif.--(BUSINESS WIRE)--Intuit (Nasdaq: INTU), the global financial technology platform that makes Intuit TurboTax, Credit Karma, QuickBooks, and Mailchimp, will hold its annual Investor Day on September 18, 2025 at its headquarters in Mountain View, CA. The half-day event will include presentations from senior company leaders and can be viewed live at https://investors.intuit.com/news-events/ir-calendar. About Intuit Intuit is the global financial technology platform that power.",https://www.businesswire.com/news/home/20241125561483/en/Intuit-to-Host-Investor-Day-on-September-18-2025/
INTU,2024-11-25 11:20:25,"Intuit Q1 Earnings Beat on Online Growth, Revenues Rise 10% Y/Y",https://images.financialmodelingprep.com/news/intuit-q1-earnings-beat-on-online-growth-revenues-rise-20241125.jpg,zacks.com,"INTU's Q1 results showcase digital strength with 20% online growth, while desktop revenues decline 17% amid the transition.",https://www.zacks.com/stock/news/2374796/intuit-q1-earnings-beat-on-online-growth-revenues-rise-10-y-y?cid=CS-STOCKNEWSAPI-FT-analyst_blog|earnings_article-2374796
INTU,2024-11-24 01:18:32,Intuit: Compelling Opportunity With Material Tailwinds And Long Runway,https://images.financialmodelingprep.com/news/intuit-compelling-opportunity-with-material-tailwinds-and-long-runway-20241124.jpg,seekingalpha.com,"Intuit has a robust financial technology platform, including TurboTax, Credit Karma, QuickBooks, and Mailchimp, serving over 100 million customers. The company's big bets are driving them towards continued growth on leveraging AI and expanding their offerings. Financials are strong with 12% revenue growth, 79% gross margin, and 31% EBITDA margin, supported by a solid balance sheet and efficient return on capital.",https://seekingalpha.com/article/4739861-intuit-compelling-opportunity-with-material-tailwinds-and-long-runway
INTU,2024-11-22 14:18:42,S&P 500 Moves Higher; Intuit Shares Fall Following Q1 Results,https://images.financialmodelingprep.com/news/sp-500-moves-higher-intuit-shares-fall-following-q1-results-20241122.jpg,benzinga.com,"U.S. stocks traded higher toward the end of trading, with the Dow Jones index gaining by more than 350 points on Friday.",https://www.benzinga.com/24/11/42145950/s-intuit-shares-fall-following-q1-results
INTU,2024-11-22 13:20:42,Why Analysts Are Bullish on Intuit Despite a Forecast That Missed Estimates,https://images.financialmodelingprep.com/news/why-analysts-are-bullish-on-intuit-despite-a-forecast-20241122.jpg,investopedia.com,"Intuit (INTU) shares tumbled Friday after the company issued a current-quarter forecast that missed estimates, but analysts were bullish on the stock, suggesting the company's early spending on marketing could drive later growth.",https://www.investopedia.com/why-analysts-are-bullish-on-intuit-despite-a-forecast-that-missed-estimates-8750086
INTU,2024-11-22 11:49:05,"Intuit Posts Q1 Beat, Shares Tank On Disappointing Outlook: Analyst Says: 'Trends Beneath The Surface Were Mixed'",https://images.financialmodelingprep.com/news/intuit-posts-q1-beat-shares-tank-on-disappointing-outlook-20241122.jpg,benzinga.com,"Intuit Inc INTU shares tanked in early trading on Friday, even after the company reported upbeat fiscal first-quarter results.",https://www.benzinga.com/news/earnings/earnings-beats/24/11/42142713/intuit-posts-q1-beat-shares-tank-on-disappointing-outlook-analyst-says-trends-beneat
INTU,2024-11-22 10:52:36,2 Fintech Stocks Gapping Lower After Earnings,https://images.financialmodelingprep.com/news/2-fintech-stocks-gapping-lower-after-earnings-20241122.jpg,schaeffersresearch.com,Fintech names NetApp Inc (NASDAQ:NTAP) and Intuit Inc (NASDAQ:INTU) are gapping lower after their respective quarterly earnings reports.,https://www.schaeffersresearch.com/content/news/2024/11/22/2-fintech-stocks-gapping-lower-after-earnings
INTU,2024-11-22 10:15:16,"INTU Weak Guidance, NTAP ""Outgrowing"" Market, Tencent Sheds RDDT Stake",https://images.financialmodelingprep.com/news/intu-weak-guidance-ntap-outgrowing-market-tencent-sheds-rddt-20241122.jpg,youtube.com,Intuit (INTU) slid to the downside after posting weak guidance. The company's CEO shrugged off the idea that the Trump administration could create a free tax-filing app.,https://www.youtube.com/watch?v=XuwlGKzJ_3s
INTU,2024-11-22 10:14:08,Intuit: Mix Of Headwinds Collides With Unsustainable Valuation,https://images.financialmodelingprep.com/news/intuit-mix-of-headwinds-collides-with-unsustainable-valuation-20241122.jpg,seekingalpha.com,"Intuit's Q1 '25 results were weak, with lackluster growth, declining margins, and guidance that missed consensus. Increased marketing spending could be a sign Intuit is worried about the government tax-filing program, and there's a headline risk coming from the Elon Musk-led DOGE. Intuit's valuation is misleading; it's trading at 54x fwd earnings, not 35x as commonly reported, making it overvalued.",https://seekingalpha.com/article/4739628-intuit-mix-of-headwinds-collides-with-unsustainable-valuation
INTU,2024-11-22 10:11:11,"Intuit's Q1 Earnings Surpass Estimates, Revenues Rise Y/Y",https://images.financialmodelingprep.com/news/intuits-q1-earnings-surpass-estimates-revenues-rise-yy-20241122.jpg,zacks.com,INTU's fiscal first-quarter results reflect strength in the Online Ecosystem and Credit Karma business segments.,https://www.zacks.com/stock/news/2373902/intuit-s-q1-earnings-surpass-estimates-revenues-rise-y-y?cid=CS-STOCKNEWSAPI-FT-analyst_blog|earnings_article-2373902
INTU,2024-11-22 08:30:20,"Intuit Issues Weak Forecast, Joins Reddit And Other Big Stocks Moving Lower In Friday's Pre-Market Session",https://images.financialmodelingprep.com/news/intuit-issues-weak-forecast-joins-reddit-and-other-big-20241122.jpg,benzinga.com,"U.S. stock futures were lower this morning, with the Dow futures falling more than 100 points on Friday's.",https://www.benzinga.com/trading-ideas/movers/24/11/42137017/intuit-issues-weak-forecast-joins-reddit-and-other-big-stocks-moving-lower-in-fridays-pre-ma
INTU,2024-11-21 20:13:20,Intuit Inc. (INTU) Q1 2025 Earnings Call Transcript,https://images.financialmodelingprep.com/news/intuit-inc-intu-q1-2025-earnings-call-transcript-20241121.jpg,seekingalpha.com,Intuit Inc. (INTU) Q1 2025 Earnings Call Transcript,https://seekingalpha.com/article/4739469-intuit-inc-intu-q1-2025-earnings-call-transcript
INTU,2024-11-21 19:01:41,Intuit Sees AI Driving Big Changes for Small Businesses,https://images.financialmodelingprep.com/news/intuit-sees-ai-driving-big-changes-for-small-businesses-20241121.jpg,pymnts.com,"All artificial intelligence (AI) systems are software, but not all software is AI. At least, not yet.",https://www.pymnts.com/earnings/2024/intuit-sees-ai-driving-big-changes-for-small-businesses/
INTU,2024-11-21 19:01:16,Intuit (INTU) Reports Q1 Earnings: What Key Metrics Have to Say,https://images.financialmodelingprep.com/news/intuit-intu-reports-q1-earnings-what-key-metrics-have-20241121.jpg,zacks.com,"The headline numbers for Intuit (INTU) give insight into how the company performed in the quarter ended October 2024, but it may be worthwhile to compare some of its key metrics to Wall Street estimates and the year-ago actuals.",https://www.zacks.com/stock/news/2373653/intuit-intu-reports-q1-earnings-what-key-metrics-have-to-say?cid=CS-STOCKNEWSAPI-FT-fundamental_analysis|nfm-2373653
INTU,2024-11-21 18:11:13,Intuit (INTU) Beats Q1 Earnings and Revenue Estimates,https://images.financialmodelingprep.com/news/intuit-intu-beats-q1-earnings-and-revenue-estimates-20241121.jpg,zacks.com,"Intuit (INTU) came out with quarterly earnings of $2.50 per share, beating the Zacks Consensus Estimate of $2.36 per share. This compares to earnings of $2.47 per share a year ago.",https://www.zacks.com/stock/news/2373640/intuit-intu-beats-q1-earnings-and-revenue-estimates?cid=CS-STOCKNEWSAPI-FT-tale_of_the_tape|yseop_template_4-2373640
INTU,2024-11-21 17:20:47,Intuit's Stock Drops as Its Outlook Disappoints,https://images.financialmodelingprep.com/news/intuits-stock-drops-as-its-outlook-disappoints-20241121.jpg,investopedia.com,"Intuit (INTU) reported fiscal first-quarter results that beat analysts expectations, but shares tumbled in extended trading as the company's current-quarter forecast disappointed.",https://www.investopedia.com/intuit-q1-fy25-earnings-8749354
INTU,2024-11-21 17:11:31,"Intuit Beats Fiscal Q1 Targets Buts Guides Low For Current Quarter, Full Year",https://images.financialmodelingprep.com/news/intuit-beats-fiscal-q1-targets-buts-guides-low-for-20241121.jpg,investors.com,"Intuit beat estimates for its fiscal first quarter but gave an outlook that was below views for the current quarter and full year ahead. The post Intuit Beats Fiscal Q1 Targets Buts Guides Low For Current Quarter, Full Year appeared first on Investor's Business Daily.",https://www.investors.com/news/technology/intuit-stock-intu-fiscal-q1-2025-earnings-report/
INTU,2024-11-21 16:54:46,"EARNINGS ALERT: INTU, NTAP, ROST",https://images.financialmodelingprep.com/news/earnings-alert-intu-ntap-rost-20241121.jpg,youtube.com,"Another round of earnings highlight the technology, finance, and retail sectors. Oliver Renick, Kevin Green and Diane King Hall break down the reports minutes after they drop.",https://www.youtube.com/watch?v=-Bg4OBmqQC4
INTU,2024-11-21 16:44:00,Intuit Maintains Full Year Guidance; CEO Says Trump Administration Won't Build Tax-Filing App,https://images.financialmodelingprep.com/news/intuit-maintains-full-year-guidance-ceo-says-trump-administration-20241121.jpg,wsj.com,President-elect Donald Trump's incoming administration doesn't “want to add to the bureaucracy and they don't want to add investments to create something,https://www.wsj.com/articles/intuit-maintains-fiscal-year-guidance-ceo-says-trump-administration-wont-build-tax-filing-app-902941d7
INTU,2024-11-21 16:33:55,Intuit shares fall on soft second quarter guidance,https://images.financialmodelingprep.com/news/intuit-shares-fall-on-soft-second-quarter-guidance-20241121.jpg,proactiveinvestors.com,"Intuit Inc (NASDAQ:INTU, ETR:ITU) projected fiscal second quarter revenue and profit below Wall Street estimates, sending its shares more than 5% lower after Thursday's closing bell. For the quarter ending in January, the financial technology firm projected revenue in the range of $3.81 billion to $3.85 billion, short of the $3.87 billion expected.",https://www.proactiveinvestors.com/companies/news/1061246
INTU,2024-11-21 16:17:32,Intuit drops as quarterly forecast misses estimates due to revenue getting delayed,https://images.financialmodelingprep.com/news/intuit-drops-as-quarterly-forecast-misses-estimates-due-to-20241121.jpg,cnbc.com,Intuit's fiscal first-quarter results exceeded expectations. The finance software company reaffirmed its full-year view but said promotional changes in the current quarter will affect revenue timing.,https://www.cnbc.com/2024/11/21/intuit-intu-q1-earnings-report-2025.html
INTU,2024-11-21 16:04:02,"Intuit forecasts quarterly results below estimates on weak demand, promotions delay",https://images.financialmodelingprep.com/news/intuit-forecasts-quarterly-results-below-estimates-on-weak-demand-20241121.jpg,reuters.com,"Intuit projected second-quarter revenue and profit below market estimates on Thursday, hampered by sluggish demand for its financial management services and a planned change in the timing of its promotions.",https://www.reuters.com/technology/intuit-forecasts-quarterly-results-below-estimates-weak-demand-promotions-delay-2024-11-21/
INTU,2024-11-21 16:00:00,Intuit Reports Strong First Quarter Results and Reiterates Full Year Guidance,https://images.financialmodelingprep.com/news/intuit-reports-strong-first-quarter-results-and-reiterates-full-20241121.jpg,businesswire.com,"MOUNTAIN VIEW, Calif.--(BUSINESS WIRE)--Intuit Inc. (Nasdaq: INTU), the global financial technology platform that makes Intuit TurboTax, Credit Karma, QuickBooks, and Mailchimp, announced financial results for the first quarter of fiscal 2025, which ended October 31. ""We've had a strong start to the year as we demonstrate the power of Intuit's AI-driven expert platform strategy. By delivering 'done-for-you' experiences, enabled by AI with access to AI-powered human experts, we continue to fuel.",https://www.businesswire.com/news/home/20241121099002/en/Intuit-Reports-Strong-First-Quarter-Results-and-Reiterates-Full-Year-Guidance/
INTU,2024-11-21 15:17:17,Intuit Adds Generative AI-Powered Financial Assistant to QuickBooks,https://images.financialmodelingprep.com/news/intuit-adds-generative-aipowered-financial-assistant-to-quickbooks-20241121.jpg,pymnts.com,"Intuit has added a generative artificial intelligence (AI)-powered financial assistant to QuickBooks. The new Intuit Assist for QuickBooks is designed to help small and medium-sized businesses (SMBs) by generating estimates, invoices, bills and payment reminders and delivering personalized recommendations, the company said in a Wednesday (Nov. 20) press release.",https://www.pymnts.com/artificial-intelligence-2/2024/intuit-adds-generative-ai-powered-financial-assistant-to-quickbooks/
INTU,2024-11-21 08:27:50,How To Earn $500 A Month From Intuit Stock Ahead Of Q1 Earnings,https://images.financialmodelingprep.com/news/how-to-earn-500-a-month-from-intuit-stock-ahead-20241121.jpg,benzinga.com,"Intuit Inc. INTU will release earnings results for the first quarter, after the closing bell, on Thursday, Nov. 21.",https://www.benzinga.com/news/earnings/24/11/42110873/how-to-earn-500-month-from-intuit-stock-ahead-q1-earnings
INTU,2024-11-20 08:30:00,"Intuit Launches AI-Powered Intuit Assist for QuickBooks, Giving Millions of Businesses a Competitive Edge",https://images.financialmodelingprep.com/news/intuit-launches-aipowered-intuit-assist-for-quickbooks-giving-millions-20241120.jpg,businesswire.com,"MOUNTAIN VIEW, Calif.--(BUSINESS WIRE)--Intuit Inc. (Nasdaq: INTU), the global financial technology platform that makes Intuit TurboTax, Credit Karma, QuickBooks, and Mailchimp, today announced the launch of Intuit Assist for QuickBooks, a generative AI (GenAI)-powered financial assistant that transforms how businesses run and grow their business. Available to QuickBooks Online customers in the U.S.*, Intuit Assist is delivering seamless, connected 'done-for-you' experiences, enabled by AI with.",https://www.businesswire.com/news/home/20241120869309/en/Intuit-Launches-AI-Powered-Intuit-Assist-for-QuickBooks-Giving-Millions-of-Businesses-a-Competitive-Edge/
INTU,2024-11-19 17:29:05,"3-Stock Lunch: Microsoft, Walmart & Intuit",https://images.financialmodelingprep.com/news/3stock-lunch-microsoft-walmart-intuit-20241119.jpg,youtube.com,"Chad Morganlander, Washington Crossing Advisor, senior portfolio manager, joins 'Power Lunch' to discuss stock plays for three stocks.",https://www.youtube.com/watch?v=j_Uyne4IAqE
INTU,2024-11-19 13:58:53,"H&R Block, Intuit stocks fall on news of a potential free tax-filing app by Trump transition team",https://images.financialmodelingprep.com/news/hr-block-intuit-stocks-fall-on-news-of-a-potential-20241119.jpg,cnbc.com,"The stock prices for H&R Block and Intuit fell after a Tuesday report saying the Trump transition team is considering creating a free tax-filing app. Intuit, which makes the TurboTax tax-filing software, was down 5%, putting it on pace for its worst day since Aug. 23 while H&R Block was down 8% and on pace for its worst day since 2020.",https://www.cnbc.com/2024/11/19/hr-block-intuit-stocks-fall-following-trump-tax-filing-app-report.html
INTU,2024-11-18 13:10:51,Intuit: Maintaining Course As Earnings Approach,https://images.financialmodelingprep.com/news/intuit-maintaining-course-as-earnings-approach-20241118.jpg,seekingalpha.com,"Intuit has shown impressive growth with strong revenue and net income increases, driven mainly by its Small Business & Self-Employed and Consumer segments. Despite its quality and growth potential, Intuit's stock remains expensive, justifying a 'hold' rating as it is likely to perform in line with the broader market. Management's guidance for fiscal 2025 indicates continued growth, but analysts expect a decline in profits, making an upgrade unlikely unless results significantly exceed expectations.",https://seekingalpha.com/article/4738439-intuit-maintaining-course-as-earnings-approach
INTU,2024-11-18 10:15:41,Insights Into Intuit (INTU) Q1: Wall Street Projections for Key Metrics,https://images.financialmodelingprep.com/news/insights-into-intuit-intu-q1-wall-street-projections-for-20241118.jpg,zacks.com,"Besides Wall Street's top -and-bottom-line estimates for Intuit (INTU), review projections for some of its key metrics to gain a deeper understanding of how the company might have fared during the quarter ended October 2024.",https://www.zacks.com/stock/news/2371462/insights-into-intuit-intu-q1-wall-street-projections-for-key-metrics?cid=CS-STOCKNEWSAPI-FT-fundamental_analysis|nfm_preview-2371462
INTU,2024-11-14 10:01:31,Intuit Inc. (INTU) Is a Trending Stock: Facts to Know Before Betting on It,https://images.financialmodelingprep.com/news/intuit-inc-intu-is-a-trending-stock-facts-to-20241114.jpg,zacks.com,"Intuit (INTU) has received quite a bit of attention from Zacks.com users lately. Therefore, it is wise to be aware of the facts that can impact the stock's prospects.",https://www.zacks.com/stock/news/2370280/intuit-inc-intu-is-a-trending-stock-facts-to-know-before-betting-on-it?cid=CS-STOCKNEWSAPI-FT-tale_of_the_tape|most_searched_stocks-2370280
INTU,2024-11-13 06:36:06,What To Expect Before Intuit's Earnings,https://images.financialmodelingprep.com/news/what-to-expect-before-intuits-earnings-20241113.jpg,seekingalpha.com,"Intuit's strong financials, including 80% gross margins and 18% net profit margins, position it well for growth, especially with embedded fintech and A.I. integration. TurboTax, QuickBooks, Mailchimp, and Credit Karma are key products driving Intuit's consumer and small business market expansion. Cybersecurity risks are significant for Intuit due to its handling of sensitive financial data, making it a prime target for cyberattacks.",https://seekingalpha.com/article/4736808-what-to-expect-before-intuits-earnings
INTU,2024-11-12 12:24:16,Software stocks see potential turning point as AI shows signs of deceleration,https://images.financialmodelingprep.com/news/software-stocks-see-potential-turning-point-as-ai-shows-20241112.jpg,youtube.com,CNBC's Deirdre Bosa reports on the software sector's recent performance.,https://www.youtube.com/watch?v=hhISGAa9fgg
INTU,2024-11-11 18:50:21,Intuit (INTU) Surpasses Market Returns: Some Facts Worth Knowing,https://images.financialmodelingprep.com/news/intuit-intu-surpasses-market-returns-some-facts-worth-knowing-20241111.jpg,zacks.com,"Intuit (INTU) closed at $697.35 in the latest trading session, marking a +1.92% move from the prior day.",https://www.zacks.com/stock/news/2368462/intuit-intu-surpasses-market-returns-some-facts-worth-knowing?cid=CS-STOCKNEWSAPI-FT-tale_of_the_tape|yseop_template_6-2368462
INTU,2024-11-07 05:00:00,Intuit Launches QuickBooks Sole Trader: Simplified Financial Management for the UK's 3.1 million One-Person Businesses,https://images.financialmodelingprep.com/news/intuit-launches-quickbooks-sole-trader-simplified-financial-management-for-20241107.jpg,businesswire.com,"LONDON--(BUSINESS WIRE)--AI-powered business solution manages transactions, enables accounting on-the-go, automates tax preparation, and facilitates accountant collaboration.",https://www.businesswire.com/news/home/20241107540413/en/Intuit-Launches-QuickBooks-Sole-Trader-Simplified-Financial-Management-for-the-UK%E2%80%99s-3.1-million-One-Person-Businesses/
INTU,2024-11-05 18:51:22,Intuit (INTU) Stock Dips While Market Gains: Key Facts,https://images.financialmodelingprep.com/news/intuit-intu-stock-dips-while-market-gains-key-facts-20241105.jpg,zacks.com,"In the most recent trading session, Intuit (INTU) closed at $618.83, indicating a -0.03% shift from the previous trading day.",https://www.zacks.com/stock/news/2364754/intuit-intu-stock-dips-while-market-gains-key-facts?cid=CS-STOCKNEWSAPI-FT-tale_of_the_tape|yseop_template_6-2364754
INTU,2024-11-04 18:55:55,Intuit (INTU) Declines More Than Market: Some Information for Investors,https://images.financialmodelingprep.com/news/intuit-intu-declines-more-than-market-some-information-for-20241104.jpg,zacks.com,"The latest trading day saw Intuit (INTU) settling at $619.01, representing a -0.44% change from its previous close.",https://www.zacks.com/stock/news/2363849/intuit-intu-declines-more-than-market-some-information-for-investors?cid=CS-STOCKNEWSAPI-FT-tale_of_the_tape|yseop_template_6v1-2363849
INTU,2024-11-03 14:44:04,My Top 15 High-Growth Dividend Stocks For November 2024,https://images.financialmodelingprep.com/news/my-top-15-highgrowth-dividend-stocks-for-november-2024-20241103.jpg,seekingalpha.com,"The SPDR S&P 500 ETF Trust posted a loss of 0.89% in October, putting a pause on its strong run in 2024. The Top 15 dividend growth stocks for November 2024 offer an average dividend yield of 1.24% and appear to be about 23% undervalued based on dividend yield theory. Since its inception in September 2020, the watch list has achieved an 11.33% compound annual growth rate.",https://seekingalpha.com/article/4732601-my-top-15-high-growth-dividend-stocks-for-november-2024
INTU,2024-10-31 10:05:52,Intuit Inc. (INTU) is Attracting Investor Attention: Here is What You Should Know,https://images.financialmodelingprep.com/news/intuit-inc-intu-is-attracting-investor-attention-here-is-20241031.jpg,zacks.com,"Recently, Zacks.com users have been paying close attention to Intuit (INTU). This makes it worthwhile to examine what the stock has in store.",https://www.zacks.com/stock/news/2361551/intuit-inc-intu-is-attracting-investor-attention-here-is-what-you-should-know?cid=CS-STOCKNEWSAPI-FT-tale_of_the_tape|most_searched_stocks-2361551
INTU,2024-10-29 18:50:31,Intuit (INTU) Beats Stock Market Upswing: What Investors Need to Know,https://images.financialmodelingprep.com/news/intuit-intu-beats-stock-market-upswing-what-investors-need-20241029.jpg,zacks.com,"In the most recent trading session, Intuit (INTU) closed at $623.70, indicating a +1.9% shift from the previous trading day.",https://www.zacks.com/stock/news/2359997/intuit-intu-beats-stock-market-upswing-what-investors-need-to-know?cid=CS-STOCKNEWSAPI-FT-tale_of_the_tape|yseop_template_6-2359997
