symbol,publishedDate,title,image,site,text,url
INTU,2025-06-10 21:29:52,Intuit Inc. (INTU) Presents at Nasdaq Summer Conference Transcript,https://images.financialmodelingprep.com/news/intuit-inc-intu-presents-at-nasdaq-summer-conference-transcript-20250610.jpg,seekingalpha.com,"Intuit Inc. (NASDAQ:INTU ) Nasdaq Summer Conference June 10, 2025 8:00 AM ET Company Participants Sasan K. Goodarzi - CEO, President & Director Conference Call Participants Sang-Jin Byun - Jefferies LLC, Research Division Sang-Jin Byun My name is John Byun.",https://seekingalpha.com/article/4793891-intuit-inc-intu-presents-at-nasdaq-summer-conference-transcript
INTU,2025-06-10 18:12:48,Intuit Inc. (INTU) Presents at Mizuho Technology Conference Transcript,https://images.financialmodelingprep.com/news/intuit-inc-intu-presents-at-mizuho-technology-conference-transcript-20250610.jpg,seekingalpha.com,"Intuit Inc. (NASDAQ:INTU ) Mizuho Technology Conference Call June 10, 2025 2:50 PM ET Company Participants Marianna Tessel - Executive VP & GM of Small Business Group Conference Call Participants Sitikantha Panigrahi - Mizuho Securities USA LLC, Research Division Sitikantha Panigrahi Hello, everyone. I'm Siti Panigrahi, software analyst here at Mizuho.",https://seekingalpha.com/article/4793872-intuit-inc-intu-presents-at-mizuho-technology-conference-transcript
INTU,2025-06-10 09:22:58,Intuit: Solid Earnings Growth Outlook For The Coming Years,https://images.financialmodelingprep.com/news/intuit-solid-earnings-growth-outlook-for-the-coming-years-20250610.jpg,seekingalpha.com,"I rate Intuit a buy, driven by strong TurboTax Live adoption and successful upmarket expansion with QuickBooks Online Advanced and IES. TurboTax Live is a game changer, disrupting the assisted tax industry and driving explosive revenue growth and higher profitability. Intuit's upmarket push with QBOA and IES is unlocking new growth, validated by strong customer wins and rapid segment expansion.",https://seekingalpha.com/article/4793694-intuit-solid-earnings-growth-outlook-for-the-coming-years
INTU,2025-06-10 09:00:00,The Highest-Quality Dividend Contenders By Quality Scores,https://images.financialmodelingprep.com/news/the-highestquality-dividend-contenders-by-quality-scores-20250610.jpg,seekingalpha.com,"The article presents the highest-quality Dividend Contenders, companies listed on U.S. exchanges with higher annual dividend payouts for 10-24 consecutive years. I use a quality scoring system with six quality indicators, each worth five points, for a maximum score of 30. The highest-quality Dividend Contenders score four or five points for each quality indicator.",https://seekingalpha.com/article/4793560-the-highest-quality-dividend-contenders-by-quality-scores
INTU,2025-06-09 13:01:09,Here's Why Intuit (INTU) is a Great Momentum Stock to Buy,https://images.financialmodelingprep.com/news/heres-why-intuit-intu-is-a-great-momentum-stock-20250609.jpg,zacks.com,Does Intuit (INTU) have what it takes to be a top stock pick for momentum investors? Let's find out.,https://www.zacks.com/stock/news/2491084/here-s-why-intuit-intu-is-a-great-momentum-stock-to-buy?cid=CS-STOCKNEWSAPI-FT-tale_of_the_tape|yseop_template_10-2491084
INTU,2025-06-05 14:00:16,Intuit Gains 22% in a Month: Here's Why the Stock Is Still a Must Buy,https://images.financialmodelingprep.com/news/intuit-gains-22-in-a-month-heres-why-the-20250605.jpg,zacks.com,"Investors should buy INTU on strong stock price movement, AI-driven gains and a bullish fiscal 2025 outlook.",https://www.zacks.com/stock/news/2486169/intuit-gains-22-in-a-month-here-s-why-the-stock-is-still-a-must-buy?cid=CS-STOCKNEWSAPI-FT-analyst_blog|rank_focused-2486169
INTU,2025-06-04 17:41:34,"Intuit's AI Boom: Stock Soaring, But Should Investors Hit Pause?",https://images.financialmodelingprep.com/news/intuits-ai-boom-stock-soaring-but-should-investors-hit-20250604.jpg,marketbeat.com,Shares of financial technology (fintech) firm Intuit NASDAQ: INTU have captured the market's eye with an impressive climb of over 25% in the past three months.,https://www.marketbeat.com/originals/intuits-ai-boom-stock-soaring-but-should-investors-hit-pause/
INTU,2025-06-03 16:01:00,Intuit Executive Marianna Tessel to Present at the Mizuho Technology Conference,https://images.financialmodelingprep.com/news/intuit-executive-marianna-tessel-to-present-at-the-mizuho-20250603.jpg,businesswire.com,"MOUNTAIN VIEW, Calif.--(BUSINESS WIRE)--Intuit Inc. (Nasdaq: INTU), the global financial technology platform that makes Intuit TurboTax, Credit Karma, QuickBooks, and Mailchimp, announced today that Marianna Tessel, executive vice president and general manager of Intuit's Small Business Group, will present at the Mizuho Technology Conference on Tuesday, June 10 in New York, NY. The fireside chat will begin at 11:50 a.m. Pacific Time (2:50 p.m. Eastern Time) and will be available live via audio.",https://www.businesswire.com/news/home/20250603292757/en/Intuit-Executive-Marianna-Tessel-to-Present-at-the-Mizuho-Technology-Conference/
INTU,2025-06-03 16:00:00,Intuit CEO Sasan Goodarzi to Present at the Nasdaq Investor Conference in Partnership with Jefferies,https://images.financialmodelingprep.com/news/intuit-ceo-sasan-goodarzi-to-present-at-the-nasdaq-20250603.jpg,businesswire.com,"MOUNTAIN VIEW, Calif.--(BUSINESS WIRE)--Intuit Inc. (Nasdaq: INTU), the global financial technology platform that makes Intuit TurboTax, Credit Karma, QuickBooks, and Mailchimp, announced today that Sasan Goodarzi, chief executive officer, will present at the Nasdaq Investor Conference in Partnership with Jefferies on Tuesday, June 10, 2025 in London. The fireside chat will begin at 5:00 a.m. Pacific Time (1:00 p.m. Greenwich Time) and will be available live via audio webcast on Intuit's invest.",https://www.businesswire.com/news/home/20250603633379/en/Intuit-CEO-Sasan-Goodarzi-to-Present-at-the-Nasdaq-Investor-Conference-in-Partnership-with-Jefferies/
INTU,2025-06-03 08:41:04,Buy 5 High-Flying Growth Stocks to Maximize Your Returns in June,https://images.financialmodelingprep.com/news/buy-5-highflying-growth-stocks-to-maximize-your-returns-20250603.jpg,zacks.com,"APP, APH, INTU, CVNA, and STN posted double-digit gains and rising earnings estimates ahead of June.",https://www.zacks.com/stock/news/2482500/buy-5-high-flying-growth-stocks-to-maximize-your-returns-in-june?cid=CS-STOCKNEWSAPI-FT-analyst_blog|investment_ideas-2482500
INTU,2025-06-02 13:46:17,Intuit (INTU) is an Incredible Growth Stock: 3 Reasons Why,https://images.financialmodelingprep.com/news/intuit-intu-is-an-incredible-growth-stock-3-reasons-20250602.jpg,zacks.com,"Intuit (INTU) possesses solid growth attributes, which could help it handily outperform the market.",https://www.zacks.com/stock/news/2480569/intuit-intu-is-an-incredible-growth-stock-3-reasons-why?cid=CS-STOCKNEWSAPI-FT-tale_of_the_tape|yseop_template_11_growth-2480569
INTU,2025-06-02 11:05:24,"Take the Zacks Approach to Beat the Markets: StoneCo, Axon, Intuit in Focus",https://images.financialmodelingprep.com/news/take-the-zacks-approach-to-beat-the-markets-stoneco-20250602.jpg,zacks.com,"StoneCo, Axon and Intuit stand out as Zacks-backed winners amid market weakness and rising global trade tensions.",https://www.zacks.com/stock/news/2480391/take-the-zacks-approach-to-beat-the-markets-stoneco-axon-intuit-in-focus?cid=CS-STOCKNEWSAPI-FT-analyst_blog|investment_ideas-2480391
INTU,2025-06-02 10:31:09,Is It Worth Investing in Intuit (INTU) Based on Wall Street's Bullish Views?,https://images.financialmodelingprep.com/news/is-it-worth-investing-in-intuit-intu-based-on-20250602.jpg,zacks.com,"Investors often turn to recommendations made by Wall Street analysts before making a Buy, Sell, or Hold decision about a stock. While media reports about rating changes by these brokerage-firm employed (or sell-side) analysts often affect a stock's price, do they really matter?",https://www.zacks.com/stock/news/2480184/is-it-worth-investing-in-intuit-intu-based-on-wall-street-s-bullish-views?cid=CS-STOCKNEWSAPI-FT-fundamental_analysis|average_broker_rating-2480184
INTU,2025-06-02 10:00:00,Top 15 High-Growth Dividend Stocks For June 2025,https://images.financialmodelingprep.com/news/top-15-highgrowth-dividend-stocks-for-june-2025-20250602.jpg,seekingalpha.com,"My Top 15 High-Growth Dividend Stocks outperformed SPY and VIG in May, gaining 6.45% versus SPY's 6.28% and VIG's 3.61%. The list's year-to-date return is 6.07%, beating SPY every month in 2025, though still short of my 12% annualized target. The June 2025 Top 15 stocks offer a 1.34% average dividend yield with a 22.82% 5-year dividend growth rate and are 25% undervalued.",https://seekingalpha.com/article/4791689-top-15-high-growth-dividend-stocks-for-june-2025
INTU,2025-06-02 08:26:03,"Tech Shines as Markets Defy ""Sell in May and Go Away"" Adage: 5 Picks",https://images.financialmodelingprep.com/news/tech-shines-as-markets-defy-sell-in-may-and-20250602.jpg,zacks.com,"Tech giants like INTU, APH, AVGO, TWLO and UI surged over 11% in May, powering markets past the ""Sell in May"" adage with standout gains.",https://www.zacks.com/stock/news/2480038/tech-shines-as-markets-defy-sell-in-may-and-go-away-adage-5-picks?cid=CS-STOCKNEWSAPI-FT-analyst_blog|investment_ideas-2480038
INTU,2025-05-30 10:46:23,Is Intuit (INTU) Stock Outpacing Its Computer and Technology Peers This Year?,https://images.financialmodelingprep.com/news/is-intuit-intu-stock-outpacing-its-computer-and-technology-20250530.jpg,zacks.com,Here is how Intuit (INTU) and Adyen N.V. Unsponsored ADR (ADYEY) have performed compared to their sector so far this year.,https://www.zacks.com/stock/news/2479477/is-intuit-intu-stock-outpacing-its-computer-and-technology-peers-this-year?cid=CS-STOCKNEWSAPI-FT-tale_of_the_tape|yseop_template_1-2479477
INTU,2025-05-29 10:06:36,Intuit Inc. (INTU) is Attracting Investor Attention: Here is What You Should Know,https://images.financialmodelingprep.com/news/intuit-inc-intu-is-attracting-investor-attention-here-is-20250529.jpg,zacks.com,"Intuit (INTU) has been one of the stocks most watched by Zacks.com users lately. So, it is worth exploring what lies ahead for the stock.",https://www.zacks.com/stock/news/2478750/intuit-inc-intu-is-attracting-investor-attention-here-is-what-you-should-know?cid=CS-STOCKNEWSAPI-FT-tale_of_the_tape|most_searched_stocks-2478750
INTU,2025-05-29 06:05:00,Intuit Announces National Winners of 2025 Intuit Hour of Finance Challenge,https://images.financialmodelingprep.com/news/intuit-announces-national-winners-of-2025-intuit-hour-of-20250529.jpg,businesswire.com,"MOUNTAIN VIEW, Calif.--(BUSINESS WIRE)--Intuit announces the winners of the 2025 Hour of Finance Challenge, recognizing 6 schools for their exceptional leadership in financial education.",https://www.businesswire.com/news/home/20250529658574/en/Intuit-Announces-National-Winners-of-2025-Intuit-Hour-of-Finance-Challenge/
INTU,2025-05-28 15:00:25,Intuit Inc. (INTU) Jefferies Public Technology Conference (Transcript),https://images.financialmodelingprep.com/news/intuit-inc-intu-jefferies-public-technology-conference-transcript-20250528.jpg,seekingalpha.com,"Intuit Inc. (NASDAQ:INTU ) Jefferies Public Technology Conference May 28, 2025 11:30 AM ET Company Participants Sandeep Aujla - CFO Conference Call Participants Brent Thill - Jefferies Brent Thill Good morning, everyone. It's Brent Thill with Jefferies.",https://seekingalpha.com/article/4790606-intuit-inc-intu-jefferies-public-technology-conference-transcript
INTU,2025-05-28 14:11:51,"Final Trades: Intuit, Vertiv, Axon and the CIBR",https://images.financialmodelingprep.com/news/final-trades-intuit-vertiv-axon-and-the-cibr-20250528.jpg,youtube.com,The Investment Committee give you their top stocks to watch for the second half.,https://www.youtube.com/watch?v=yf8twBBS-Ps
INTU,2025-05-27 17:05:00,Why Intuit Stock Topped the Market on Tuesday,https://images.financialmodelingprep.com/news/why-intuit-stock-topped-the-market-on-tuesday-20250527.jpg,fool.com,"Intuit (INTU 4.36%) stock was off to a fine start as the Memorial Day-shortened trading week began. The tax and finance software specialist was the subject of a new, bullish analyst note, and investors reacted to this by pushing the stock's price up about 4.4% on the day.",https://www.fool.com/investing/2025/05/27/why-intuit-stock-topped-the-market-on-tuesday/
INTU,2025-05-27 12:51:02,"TurboTax Maker Soars Past Buy Point On Google AI Partnership, Strong Growth Outlook",https://images.financialmodelingprep.com/news/turbotax-maker-soars-past-buy-point-on-google-ai-20250527.jpg,investors.com,Intuit stock is at an all-time high and in a buy zone. The TurboTax software provider gapped up on earnings Friday.,https://www.investors.com/research/turbotax-intuit-stock-intu-ibd-50/
INTU,2025-05-25 12:00:00,3 Stocks to Buy for “Liberation Day 2.0”,https://images.financialmodelingprep.com/news/3-stocks-to-buy-for-liberation-day-20-20250525.jpg,investorplace.com,"For better or worse, April's “Liberation Day” was a chance to make a lot of money.  On the positive side, the volatility surge created some incredible deals.",https://investorplace.com/2025/05/3-stocks-to-buy-for-liberation-day-2-0/
INTU,2025-05-25 06:02:08,S&P 500 INDEX (SPX) Live: Markets Retreat After Tariff Tricks Resurface,https://images.financialmodelingprep.com/news/sp-500-index-spx-live-markets-retreat-after-tariff-20250525.jpg,https://247wallst.com,"Live Updates Live Coverage Has Ended Markets Hope Nvidia Will Lift Sentiment 1:51 pm by Gerelyn Terzo The markets are hoping Nvidia (Nasdaq: NVDA) will revive sentiment next week, as the company prepares to release its highly anticipated Q1 results on Wednesday, May 28. Despite a 1% dip year-to-date in the share price, Nvidia&#8217;s underlying fundamentals remain robust based on its most recent performance. The company has the potential to shift the focus from tariffs back to earnings, which have largely beaten expectations so far. Most Wall Street analysts maintain a buy rating on NVDA stock, projecting an average 12-month price target of $164, a considerable upside from current levels of $132. Nvidia&#8217;s upcoming Q1 report is expected to shed light on the impact of tariffs implemented in early 2025. This follows strong Q4 results where the company surpassed Wall Street estimates on both revenue and earnings. At the time, Nvidia CEO Jensen Huang stated, “AI is advancing at light speed as agentic AI and physical AI set the stage for the next wave of AI to revolutionize the largest industries.” NVDA stock is currently off fractionally while the SPX ETF is off by 0.37%. Tariff Tall Tale 12:24 pm by Gerelyn Terzo Wedbush analyst Dan Ives pushed back against President Donald Trump&#8217;s new tariff targeting Apple (Nasdaq: AAPL) iPhones, basically calling domestic production a tall tale. &#8220;We believe the concept of Apple producing iPhones in the [U.S.] is a fairy tale that is not feasible,&#8221; Ives stated in a report. Trump threatened that Apple could face tariffs of 25% or more on iPhones made outside the USA. Apple recently revealed its intentions to redirect production of its iPhones from China to India. Apple stock is down 2.5% today, and the SPX ETF is lower by 0.84%. Fed Uncertainty 10:45 am by Gerelyn Terzo Chicago Fed President Austan Goolsbee cautioned Friday that President Donald Trump’s latest tariff moves have complicated monetary policy decisions and likely pushed back any interest rate changes. The Fed previously revealed its intentions to lower interest rates twice in 2025. Goolsbee told CNBC, &#8220;Everything’s always on the table. But I feel like the bar for me is a little higher for action in any direction while we’re waiting to get some clarity.&#8221; This article will be updated throughout the day, so check back often for more daily updates. A sharp sell-off gripped the markets this Friday morning, with all three major stock market averages surrendering ground. The week is set to conclude on a sour note, following President Trump’s recent threat to levy a steep 50% tariff on the EU, a measure that could be implemented in the coming days. In a potentially encouraging sign, the Dow Jones Industrial Average has trimmed its losses almost in half, while both the Nasdaq Composite and S&amp;P 500 have similarly come off their worst levels. The majority of economic sectors are trading lower, with consumer discretionary and technology stocks taking the hardest hits. The SPX ETF is lower by 0.84%, while the S&amp;P 500 is on pace for a 2.7% weekly decline. Bond yields are declining as the trade war escalates, bringing a volatile week for the bond market to a close. Stock market volatility has also reemerged, highlighted by a 25% increase in the CBOE Volatility Index (VIX). Apple (Nasdaq: AAPL) is facing renewed pressure, with President Trump warning that iPhones produced outside the U.S. could be subject to substantial tariffs, causing Apple stock to drop 2% today. Yet, in a bright spot among the Magnificent Seven, prominent Wedbush analyst Dan Ives is optimistic about Tesla (Nasdaq: TSLA), boosting his price target on the electric vehicle manufacturer to $500, suggesting a 49% upside potential, alongside an &#8220;outperform&#8221; rating. Here’s a look at the performance as of morning trading: Dow Jones Industrial Average: Down 253.11 (-0.60%) Nasdaq Composite: Down 182.34 (-0.94%) S&amp;P 500: Down 44.23 (-0.77%) Market Movers Nuclear stocks are defying the downward trend today, gaining ground as the Trump administration signals favorable conditions for the industry. Companies including Oklo (NYSE: OKLO), NuScale (NYSE: SMR), and Constellation Energy (Nasdaq: CEG) are all advancing, led by a double-digit percentage gain for OKLO. Quantum computing stock IonQ (NYSE: IONQ), however, is down as much as 4.7% today, following yesterday&#8217;s rally that saw its share price close above $45. In earnings developments, Intuit (NYSE: INTU) is gaining 8.6% today while Deckers (NYSE: DECK) is sinking 21.7% on a Wall Street downgrade following disappointing results on tariff impacts. The post S&#038;P 500 INDEX (SPX) Live: Markets Retreat After Tariff Tricks Resurface appeared first on 24/7 Wall St..",https://247wallst.com/investing/2025/05/23/sp-500-index-spx-live-markets-retreat-after-tariff-tricks-resurface/
INTU,2025-05-23 21:06:03,Buy the Spike in Intuit (INTU) Stock After Earnings?,https://images.financialmodelingprep.com/news/buy-the-spike-in-intuit-intu-stock-after-earnings-20250523.jpg,zacks.com,"Attributed to its AI-driven solutions, Intuit exceeded expectations for its fiscal third quarter and raised its full-year revenue guidance.",https://www.zacks.com/stock/news/2476932/buy-the-spike-in-intuit-intu-stock-after-earnings?cid=CS-STOCKNEWSAPI-FT-stocks_in_the_news-2476932
INTU,2025-05-23 17:25:35,"S&P 500 Gains and Losses Today: Deckers Outdoor, Ross Stores Stocks Fall as Firms Withhold Outlooks",https://images.financialmodelingprep.com/news/sp-500-gains-and-losses-today-deckers-outdoor-ross-20250523.jpg,investopedia.com,"Major U.S. equities indexes lost ground on the final day of the trading week as President Donald Trump reverted to a tougher tone on trade policy, taking aim at Apple (AAPL) and the European Union in a pair of early morning social media posts.",https://www.investopedia.com/s-and-p-500-gains-and-losses-today-deckers-outdoor-ross-stores-stocks-fall-as-firms-withhold-guidance-11741141
INTU,2025-05-23 16:05:19,"Intuit's AI Strategy, Upmarket Gains Fuel Analyst Optimism Following Strong Earnings",https://images.financialmodelingprep.com/news/intuits-ai-strategy-upmarket-gains-fuel-analyst-optimism-following-20250523.jpg,benzinga.com,Wall Street analysts rerated Intuit Inc INTU after the company reported its third-quarter results on Thursday.,https://www.benzinga.com/analyst-ratings/price-target/25/05/45595446/intuits-ai-strategy-upmarket-gains-fuel-analyst-optimism-following-strong-earnings
INTU,2025-05-23 16:00:00,Intuit CFO Sandeep Aujla to Present at the Jefferies Public Technology Conference,https://images.financialmodelingprep.com/news/intuit-cfo-sandeep-aujla-to-present-at-the-jefferies-20250523.jpg,businesswire.com,"MOUNTAIN VIEW, Calif.--(BUSINESS WIRE)--Intuit Inc. (Nasdaq: INTU), the global financial technology platform that makes Intuit TurboTax, Credit Karma, QuickBooks, and Mailchimp, announced today that Sandeep Aujla, chief financial officer, will present at the Jefferies Public Technology Conference on May 28, 2025. The fireside chat will begin at 8:30 a.m. Pacific Time (11:30 a.m. Eastern Time) and will be available live via audio webcast on Intuit's investor relations website at https://investor.",https://www.businesswire.com/news/home/20250523929375/en/Intuit-CFO-Sandeep-Aujla-to-Present-at-the-Jefferies-Public-Technology-Conference/
INTU,2025-05-23 13:32:17,A Nuclear Power Play And TurboTax Stock Reach New Highs,https://images.financialmodelingprep.com/news/a-nuclear-power-play-and-turbotax-stock-reach-new-20250523.jpg,investors.com,GE Vernova stock is in a buy zone and reached a record high.,https://www.investors.com/stock-lists/new-highs/nuclear-ge-vernova-stock-gev-intuit-intu-turbotax/
INTU,2025-05-23 12:41:15,"Intuit Q3 Earnings Surpass Estimates, Revenues Increase Y/Y",https://images.financialmodelingprep.com/news/intuit-q3-earnings-surpass-estimates-revenues-increase-yy-20250523.jpg,zacks.com,"INTU's fiscal third-quarter results surpass expectations, reflecting strength in the Consumer Group segment.",https://www.zacks.com/stock/news/2476887/intuit-q3-earnings-surpass-estimates-revenues-increase-y-y?cid=CS-STOCKNEWSAPI-FT-analyst_blog|earnings_article-2476887
INTU,2025-05-23 12:39:04,"Intuit CFO talks earnings beat, strong outlook, and company's future",https://images.financialmodelingprep.com/news/intuit-cfo-talks-earnings-beat-strong-outlook-and-companys-20250523.jpg,youtube.com,"Intuit shares get a boost Friday morning after reporting earnings growth and raising its full-year guidance. Intuit CFO Sandeep Aujla joins the Catalysts team for a conversation on the company's quarterly performance, while he also provides comments on the impacts of President Trump's ""big, beautiful"" tax bill working its way through Congress and his views on the health of small businesses.",https://www.youtube.com/watch?v=70k1neyu7ok
INTU,2025-05-23 12:20:38,"Top Stock Movers Now: Apple, Deckers Outdoor, Intuit, and More",https://images.financialmodelingprep.com/news/top-stock-movers-now-apple-deckers-outdoor-intuit-and-20250523.jpg,investopedia.com,"U.S. equities slumped at midday after President Donald Trump threatened tariffs on Apple (AAPL) iPhones and European Union (EU) products. The Nasdaq slipped 1%, and the Dow Jones Industrial Average and S&P 500 were down as well.",https://www.investopedia.com/top-stock-movers-now-apple-deckers-outdoor-intuit-and-more-11740912
INTU,2025-05-23 12:17:00,Why Intuit Stock Was Moving Higher Today,https://images.financialmodelingprep.com/news/why-intuit-stock-was-moving-higher-today-20250523.jpg,fool.com,"Shares of Intuit (INTU 7.58%), the parent of TurboTax, QuickBooks, Credit Karma, and Mailchimp, were moving higher today after the financial technology company reported better-than-expected results in its fiscal third-quarter earnings report.",https://www.fool.com/investing/2025/05/23/why-intuit-stock-was-moving-higher-today/
INTU,2025-05-23 11:51:24,These Analysts Boost Their Forecasts On Intuit Following Better-Than-Expected Results,https://images.financialmodelingprep.com/news/these-analysts-boost-their-forecasts-on-intuit-following-betterthanexpected-20250523.jpg,benzinga.com,Intuit Inc. INTU reported stronger-than-expected third-quarter financial results and raised its full-year guidance on Thursday.,https://www.benzinga.com/25/05/45591006/these-analysts-boost-their-forecasts-on-intuit-following-better-than-expected-results
INTU,2025-05-23 11:17:17,"Dow Jones and S&P500: Apple, Ross, Intuit Shake US Indices on Tariff Talk",https://images.financialmodelingprep.com/news/dow-jones-and-sp500-apple-ross-intuit-shake-us-20250523.jpg,fxempire.com,"Dow drops 343 pts as Trump targets Apple and EU with tariff threats. Tech, retail stocks sink, fueling investor concern over trade and US stock forecasts.",https://www.fxempire.com/forecasts/article/dow-jones-and-sp500-apple-ross-intuit-shake-us-indices-on-tariff-talk-1521359
INTU,2025-05-23 10:43:38,"Intuit shares pop 9% on earnings beat, rosy guidance",https://images.financialmodelingprep.com/news/intuit-shares-pop-9-on-earnings-beat-rosy-guidance-20250523.jpg,cnbc.com,"Intuit shares popped on Friday, a day after the company reported strong quarterly results. The company said revenue in the fiscal third quarter increased 15% to $7.8 billion.",https://www.cnbc.com/2025/05/23/intuit-shares-pop-9percent-on-earnings-beat-rosy-guidance.html
INTU,2025-05-23 10:14:40,Cramer's Mad Dash: Intuit,https://images.financialmodelingprep.com/news/cramers-mad-dash-intuit-20250523.jpg,youtube.com,Jim Cramer breaks down why he's keeping an eye on shares of Intuit.,https://www.youtube.com/watch?v=0xZ0ph8m1As
INTU,2025-05-23 09:37:59,"Intuit shares jump after earnings, outlook top Wall Street views",https://images.financialmodelingprep.com/news/intuit-shares-jump-after-earnings-outlook-top-wall-street-20250523.jpg,proactiveinvestors.com,"Shares of Intuit Inc (NASDAQ:INTU, ETR:ITU) climbed over 9% on Friday morning after the financial software maker reported stronger-than-expected quarterly earnings and lifted its full-year guidance, fueled by robust gains in its tax and credit segments. The maker of TurboTax and QuickBooks posted fiscal third-quarter revenue of $7.88 billion, beating analysts' average estimate of $7.56 billion, according to LSEG data.",https://www.proactiveinvestors.com/companies/news/1071793
