symbol,publishedDate,title,image,site,text,url
INTU,2024-10-29 12:40:31,Can Intuit's Venture Investment in Wildfire Push the Stock Up?,https://images.financialmodelingprep.com/news/can-intuits-venture-investment-in-wildfire-push-the-stock-20241029.jpg,zacks.com,"INTU's investment in Wildfire to enhance customer loyalty and experience bodes well for investors. However, stretched valuation is a concern.",https://www.zacks.com/stock/news/2359800/can-intuit-s-venture-investment-in-wildfire-push-the-stock-up?cid=CS-STOCKNEWSAPI-FT-analyst_blog|company_news_tech_sector-2359800
INTU,2024-10-23 18:56:21,Intuit (INTU) Sees a More Significant Dip Than Broader Market: Some Facts to Know,https://images.financialmodelingprep.com/news/intuit-intu-sees-a-more-significant-dip-than-broader-20241023.jpg,zacks.com,"Intuit (INTU) closed the most recent trading day at $602.01, moving -1.24% from the previous trading session.",https://www.zacks.com/stock/news/2356290/intuit-intu-sees-a-more-significant-dip-than-broader-market-some-facts-to-know?cid=CS-STOCKNEWSAPI-FT-tale_of_the_tape|yseop_template_6v1-2356290
INTU,2024-10-23 10:30:13,Intuit (INTU) Is Considered a Good Investment by Brokers: Is That True?,https://images.financialmodelingprep.com/news/intuit-intu-is-considered-a-good-investment-by-brokers-20241023.jpg,zacks.com,"The recommendations of Wall Street analysts are often relied on by investors when deciding whether to buy, sell, or hold a stock. Media reports about these brokerage-firm-employed (or sell-side) analysts changing their ratings often affect a stock's price.",https://www.zacks.com/stock/news/2355723/intuit-intu-is-considered-a-good-investment-by-brokers-is-that-true?cid=CS-STOCKNEWSAPI-FT-fundamental_analysis|average_broker_rating-2355723
INTU,2024-10-23 10:04:14,Intuit: The Leader In Automated Accounting Is Worth Investing In,https://images.financialmodelingprep.com/news/intuit-the-leader-in-automated-accounting-is-worth-investing-20241023.jpg,seekingalpha.com,"Intuit is a leader in automated accounting, well-positioned to capitalize on digital transformation trends, with a projected 16% stock price gain in a year. The company's investment in AI and a subscription-based model ensures stable revenue and increased customer retention, particularly among SMBs. Intuit's profitability is strong, with a net income margin of 18.2% and a gross profit margin of 79.6%, far exceeding sector medians.",https://seekingalpha.com/article/4728601-intuit-the-leader-in-automated-accounting-is-worth-investing-in
INTU,2024-10-17 10:05:42,Intuit Inc. (INTU) Is a Trending Stock: Facts to Know Before Betting on It,https://images.financialmodelingprep.com/news/intuit-inc-intu-is-a-trending-stock-facts-to-20241017.jpg,zacks.com,"Intuit (INTU) has received quite a bit of attention from Zacks.com users lately. Therefore, it is wise to be aware of the facts that can impact the stock's prospects.",https://www.zacks.com/stock/news/2352078/intuit-inc-intu-is-a-trending-stock-facts-to-know-before-betting-on-it?cid=CS-STOCKNEWSAPI-FT-tale_of_the_tape|most_searched_stocks-2352078
INTU,2024-10-15 08:30:00,Intuit QuickBooks Report Reveals Small Businesses Project a Third of Yearly Revenue from Holiday Sales as Consumer Spending Expected to Decrease by 34%,https://images.financialmodelingprep.com/news/intuit-quickbooks-report-reveals-small-businesses-project-a-third-20241015.jpg,businesswire.com,"MOUNTAIN VIEW, Calif.--(BUSINESS WIRE)--A new Intuit QuickBooks data report revealed that rising costs and continued inflationary pressures are causing a pull back on spending, as consumers are expected to spend $85 billion less this holiday season, a 34% year-over-year downturn. These findings and more are highlighted in the annual QuickBooks Holiday Shopping Report, based on a recent survey of U.S. consumers and small businesses commissioned by Intuit Inc. (Nasdaq: INTU), the global financial.",https://www.businesswire.com/news/home/20241015284500/en/Intuit-QuickBooks-Report-Reveals-Small-Businesses-Project-a-Third-of-Yearly-Revenue-from-Holiday-Sales-as-Consumer-Spending-Expected-to-Decrease-by-34/
INTU,2024-10-14 13:01:37,Intuit (INTU) Upgraded to Buy: What Does It Mean for the Stock?,https://images.financialmodelingprep.com/news/intuit-intu-upgraded-to-buy-what-does-it-mean-20241014.jpg,zacks.com,"Intuit (INTU) has been upgraded to a Zacks Rank #2 (Buy), reflecting growing optimism about the company's earnings prospects. This might drive the stock higher in the near term.",https://www.zacks.com/stock/news/2350167/intuit-intu-upgraded-to-buy-what-does-it-mean-for-the-stock?cid=CS-STOCKNEWSAPI-FT-tale_of_the_tape|yseop_template_12_zacks_rank_upgrade-2350167
INTU,2024-10-08 07:00:42,Invest with Confidence: Intrinsic Value Unveiled of Intuit Inc,https://images.financialmodelingprep.com/news/invest-with-confidence-intrinsic-value-unveiled-of-intuit-inc-20241008.jpg,gurufocus.com,"In this article, we will take a look into Intuit Inc's (INTU, Financial) DCF analysis, a reliable and data-driven approach to estimating its intrinsic value. Instead of using future free cash flow as in the traditional DCF model, the GuruFocus DCF calculator uses EPS without NRI as the default for the DCF model based on research that shows that historically stock prices have been more correlated with earnings than free cash flow.",https://www.gurufocus.com/news/2544460/invest-with-confidence-intrinsic-value-unveiled-of-intuit-inc
INTU,2024-10-04 10:05:39,Investors Heavily Search Intuit Inc. (INTU): Here is What You Need to Know,https://images.financialmodelingprep.com/news/investors-heavily-search-intuit-inc-intu-here-is-what-20241004.jpg,zacks.com,"Intuit (INTU) has received quite a bit of attention from Zacks.com users lately. Therefore, it is wise to be aware of the facts that can impact the stock's prospects.",https://www.zacks.com/stock/news/2345896/investors-heavily-search-intuit-inc-intu-here-is-what-you-need-to-know?cid=CS-STOCKNEWSAPI-FT-tale_of_the_tape|most_searched_stocks-2345896
INTU,2024-10-03 23:15:10,3 Upcoming Dividend Increases,https://images.financialmodelingprep.com/news/3-upcoming-dividend-increases-20241003.jpg,seekingalpha.com,"My strategy focuses on buying, holding, and adding companies that consistently increase dividends and outperform benchmarks, ensuring long-term portfolio success. This week's dividend increases an average 10.7%, with a median of 14.7%, featuring Verizon, Accenture, and Intuit. I use data from the ""U.S. Dividend Champions"" spreadsheet and NASDAQ to identify companies with at least five years of consistent dividend growth.",https://seekingalpha.com/article/4724925-3-upcoming-dividend-increases
INTU,2024-10-03 15:55:49,Intuit (INTU) Stock Dips Amid Sector Decline,https://images.financialmodelingprep.com/news/intuit-intu-stock-dips-amid-sector-decline-20241003.jpg,gurufocus.com,"Intuit (INTU, Financial) experienced a sudden stock price drop of 1.20%, with shares priced at $599.98. The trading volume reached 728,403 shares, reflecting a turnover rate of 0.26% and a price fluctuation of 1.09%.",https://www.gurufocus.com/news/2541871/intuit-intu-stock-dips-amid-sector-decline
INTU,2024-10-03 12:04:22,My Top 15 High Growth Dividend Stocks For October 2024,https://images.financialmodelingprep.com/news/my-top-15-high-growth-dividend-stocks-for-october-20241003.jpg,seekingalpha.com,The SPDR S&P 500 ETF Trust posted a gain of 2.10% in September as it continues marching on in 2024. The Top 15 dividend growth stocks for October 2024 offer an average dividend yield of 1.05% and appear to be about 20% undervalued based on dividend yield theory.,https://seekingalpha.com/article/4724837-my-top-15-high-growth-dividend-stocks-for-october-2024
INTU,2024-10-02 18:56:07,Intuit (INTU) Outperforms Broader Market: What You Need to Know,https://images.financialmodelingprep.com/news/intuit-intu-outperforms-broader-market-what-you-need-to-20241002.jpg,zacks.com,"In the latest trading session, Intuit (INTU) closed at $607.28, marking a +0.16% move from the previous day.",https://www.zacks.com/stock/news/2345022/intuit-intu-outperforms-broader-market-what-you-need-to-know?cid=CS-STOCKNEWSAPI-FT-tale_of_the_tape|yseop_template_6v1-2345022
INTU,2024-10-01 12:06:15,Can Intuit's Expanding AI-Focused Portfolio Push the Stock Higher?,https://images.financialmodelingprep.com/news/can-intuits-expanding-aifocused-portfolio-push-the-stock-higher-20241001.jpg,zacks.com,"INTU's new agentic AI and GenOS integrated product offering bodes well for investors. However, stretched valuation might keep investors on the sidelines.",https://www.zacks.com/stock/news/2344148/can-intuit-s-expanding-ai-focused-portfolio-push-the-stock-higher?cid=CS-STOCKNEWSAPI-FT-analyst_blog|company_news_tech_sector-2344148
INTU,2024-10-01 08:45:20,Dividend Increases You Can't Miss: 10 Big-Name Stocks,https://images.financialmodelingprep.com/news/dividend-increases-you-cant-miss-10-bigname-stocks-20241001.jpg,marketbeat.com,"Income is an aspect of stock market investing that is often at the top of one's mind, as it can provide a more consistent source of return than betting that the price of a stock will go up. Below are 10 big-name U.S. companies that recently raised the dividends they provide to shareholders.",https://www.marketbeat.com/stock-ideas/10-dividend-increases-you-might-have-missed/
INTU,2024-09-26 16:39:18,Intuit Integrates Credit Karma and TurboTax Amid AI Rollout,https://images.financialmodelingprep.com/news/intuit-integrates-credit-karma-and-turbotax-amid-ai-rollout-20240926.jpg,pymnts.com,"Financial software firm Intuit is integrating two of its most popular consumer finance offerings. “Upcoming innovations across TurboTax and Credit Karma will deliver a single, connected consumer financial platform that delivers insights and recommendations year-round and done-for-you experiences at tax time,” the company said Thursday (Sept.",https://www.pymnts.com/financial-apps/2024/intuit-integrates-credit-karma-and-turbotax-amid-ai-rollout/
INTU,2024-09-26 09:05:00,Intuit Unveils New AI-driven Expert Platform Experiences at Investor Day 2024,https://images.financialmodelingprep.com/news/intuit-unveils-new-aidriven-expert-platform-experiences-at-investor-20240926.jpg,businesswire.com,"MOUNTAIN VIEW, Calif.--(BUSINESS WIRE)--Intuit Inc. (Nasdaq: INTU), the global financial technology platform that makes Intuit TurboTax, Credit Karma, QuickBooks, and Mailchimp, today shared the company's strategy at Investor Day and unveiled new AI-powered innovations that help consumers make smart money decisions year-round and fuel business growth on Intuit's platform, supercharged with an AI-powered financial assistant in customers' pockets. “Intuit's AI-driven expert platform delivers seam.",https://www.businesswire.com/news/home/20240926448254/en/Intuit-Unveils-New-AI-driven-Expert-Platform-Experiences-at-Investor-Day-2024/
INTU,2024-09-25 14:20:29,Intuit to Add Agentic AI Capabilities Across Platforms and Products,https://images.financialmodelingprep.com/news/intuit-to-add-agentic-ai-capabilities-across-platforms-and-20240925.jpg,pymnts.com,"Intuit will introduce agentic artificial intelligence (AI) capabilities in December and continue rolling them out throughout 2025. The company will add these capabilities across its platforms and products, including Intuit TurboTax, Credit Karma, QuickBooks and Mailchimp, Intuit said in a Wednesday (Sept.",https://www.pymnts.com/artificial-intelligence-2/2024/intuit-to-add-agentic-ai-capabilities-across-platforms-and-products/
INTU,2024-09-24 10:31:15,Wall Street Analysts See Intuit (INTU) as a Buy: Should You Invest?,https://images.financialmodelingprep.com/news/wall-street-analysts-see-intuit-intu-as-a-buy-should-20240924.jpg,zacks.com,"The recommendations of Wall Street analysts are often relied on by investors when deciding whether to buy, sell, or hold a stock. Media reports about these brokerage-firm-employed (or sell-side) analysts changing their ratings often affect a stock's price.",https://www.zacks.com/stock/news/2340471/wall-street-analysts-see-intuit-intu-as-a-buy-should-you-invest?cid=CS-STOCKNEWSAPI-FT-fundamental_analysis|average_broker_rating-2340471
INTU,2024-09-23 03:57:33,Intuit: AI Will Reduce Its Burdens,https://images.financialmodelingprep.com/news/intuit-ai-will-reduce-its-burdens-20240923.jpg,seekingalpha.com,"Intuit's transformation into an AI-driven business is expected to drive future growth and boost margins through improved operational efficiency and personalized services. Despite modest 2024 growth compared to the S&P 500, INTU's strategic focus on AI could help maintain market leadership. The target price of $953.70 per share, a 48% premium, is based on a forecasted 15% revenue growth rate over the next decade.",https://seekingalpha.com/article/4722643-intuit-ai-will-reduce-its-burdens
INTU,2024-09-20 12:32:00,Spruce Point shorts Intuit,https://images.financialmodelingprep.com/news/spruce-point-shorts-intuit-20240920.jpg,youtube.com,"Ben Axler, Spruce Point Capital founder and CIO, joins ‘Money Movers' to discuss why his firm is shorting Intuit, what has led the company to underperform this year, and more.",https://www.youtube.com/watch?v=MbFMmzs7c_k
INTU,2024-09-19 12:31:30,Intuit Gains 20% in a Year on Market Strength: Buy or Hold the Stock?,https://images.financialmodelingprep.com/news/intuit-gains-20-in-a-year-on-market-strength-20240919.jpg,zacks.com,INTU's strong product offerings and resilient business model make the stock worth a watch amid elevated valuation and growing competition.,https://www.zacks.com/stock/news/2338710/intuit-gains-20-in-a-year-on-market-strength-buy-or-hold-the-stock?cid=CS-STOCKNEWSAPI-FT-analyst_blog|rank_focused-2338710
INTU,2024-09-19 09:44:38,3 Dividend Stocks That Just Hiked Their Payouts 14%,https://images.financialmodelingprep.com/news/3-dividend-stocks-that-just-hiked-their-payouts-14-20240919.jpg,247wallst.com,"Although dividend stock investing is one of the surest ways for investors to dramatically increase their returns over time, dividend growth stocks are even better.",https://247wallst.com/investing/2024/09/19/3-dividend-stocks-that-just-hiked-their-payouts-14/
INTU,2024-09-18 10:05:35,Here is What to Know Beyond Why Intuit Inc. (INTU) is a Trending Stock,https://images.financialmodelingprep.com/news/here-is-what-to-know-beyond-why-intuit-inc-20240918.jpg,zacks.com,"Recently, Zacks.com users have been paying close attention to Intuit (INTU). This makes it worthwhile to examine what the stock has in store.",https://www.zacks.com/stock/news/2337723/here-is-what-to-know-beyond-why-intuit-inc-intu-is-a-trending-stock?cid=CS-STOCKNEWSAPI-FT-tale_of_the_tape|most_searched_stocks-2337723
INTU,2024-09-17 14:22:17,Intuit Rolls Out Product Suite for Mid-Market Businesses,https://images.financialmodelingprep.com/news/intuit-rolls-out-product-suite-for-midmarket-businesses-20240917.jpg,pymnts.com,"TurboTax maker Intuit debuted a new product suite for mid-market businesses. Intuit Enterprise Suite is designed to serve an $89 billion total addressable market of larger, mid-market businesses whose needs become more complex as they scale, according to a Tuesday (Sept.",https://www.pymnts.com/news/b2b-payments/2024/intuit-rolls-out-product-suite-mid-market-businesses/
INTU,2024-09-17 08:34:15,Intuit releases enterprise suite of financial products to tap new customers,https://images.financialmodelingprep.com/news/intuit-releases-enterprise-suite-of-financial-products-to-tap-20240917.jpg,reuters.com,TurboTax maker Intuit said on Tuesday it has released a new customizable enterprise suite of its financial products in the United States to capture new customers looking for an all-in-one solution for managing their financial needs.,https://www.reuters.com/technology/intuit-releases-enterprise-suite-financial-products-tap-new-customers-2024-09-17/
INTU,2024-09-12 07:44:40,"Upstart, Insulet And 2 Other Stocks Executives Are Selling",https://images.financialmodelingprep.com/news/upstart-insulet-and-2-other-stocks-executives-are-selling-20240912.jpg,benzinga.com,"The Nasdaq 100 closed higher by over 400 points during Wednesday's session. Investors, meanwhile, focused on some notable insider trades.",https://www.benzinga.com/news/24/09/40829998/upstart-insulet-and-2-other-stocks-executives-are-selling
INTU,2024-09-11 19:45:26,Intuit Inc. (INTU) Goldman Sachs Communacopia + Technology Conference (Transcript),https://images.financialmodelingprep.com/news/intuit-inc-intu-goldman-sachs-communacopia-technology-conference-transcript-20240911.jpg,seekingalpha.com,"Intuit Inc. (NASDAQ:INTU ) Goldman Sachs Communacopia + Technology Conference September 11, 2024 4:45 PM ET Company Participants Sasan Goodarzi - Chief Executive Officer Conference Call Participants Unidentified Analyst Are we ready to have this Gen AI thing move to the application layer already, enough about this infrastructure thing. Let's get this to work and create value for customers at the application there.",https://seekingalpha.com/article/4720566-intuit-inc-intu-goldman-sachs-communacopia-technology-conference-transcript
INTU,2024-09-06 15:04:02,Intuit Inc. (INTU) Citi 2024 Global TMT Conference (Transcript),https://images.financialmodelingprep.com/news/intuit-inc-intu-citi-2024-global-tmt-conference-transcript-20240906.jpg,seekingalpha.com,"Intuit Inc. (NASDAQ:INTU ) Citi 2024 Global TMT Conference September 4, 2024 3:00 PM ET Company Participants Marianna Tessel - EVP & GM of Global Business Solutions Group Conference Call Participants Steven Enders - Citigroup Operator Steven Enders Thank you for being here for the afternoon session of the Citi Technology Conference. I'm Steve Enders, part of the Software Research team here, and with us for this session, we have Marianna Tessel from Intuit.",https://seekingalpha.com/article/4719621-intuit-inc-intu-citi-2024-global-tmt-conference-transcript
INTU,2024-09-06 12:01:09,Here's What Key Metrics Tell Us About Intuit (INTU) Q4 Earnings,https://images.financialmodelingprep.com/news/heres-what-key-metrics-tell-us-about-intuit-intu-20240906.jpg,zacks.com,"Although the revenue and EPS for Intuit (INTU) give a sense of how its business performed in the quarter ended July 2024, it might be worth considering how some key metrics compare with Wall Street estimates and the year-ago numbers.",https://www.zacks.com/stock/news/2332870/here-s-what-key-metrics-tell-us-about-intuit-intu-q4-earnings?cid=CS-STOCKNEWSAPI-FT-fundamental_analysis|nfm-2332870
INTU,2024-09-05 10:06:25,Is Trending Stock Intuit Inc. (INTU) a Buy Now?,https://images.financialmodelingprep.com/news/is-trending-stock-intuit-inc-intu-a-buy-now-20240905.jpg,zacks.com,"Recently, Zacks.com users have been paying close attention to Intuit (INTU). This makes it worthwhile to examine what the stock has in store.",https://www.zacks.com/stock/news/2331956/is-trending-stock-intuit-inc-intu-a-buy-now?cid=CS-STOCKNEWSAPI-FT-tale_of_the_tape|most_searched_stocks-2331956
INTU,2024-09-05 08:00:31,Buy this Big Tech Stock Now at a Discount and Hold Forever?,https://images.financialmodelingprep.com/news/buy-this-big-tech-stock-now-at-a-discount-and-20240905.jpg,zacks.com,Intuit has more than doubled Tech over the past decade and it's projected to post double-digit sales and earnings growth going forward. Intuit stock could be ready to break out to all-time highs after getting rejected at its 2021 peaks multiple times this year.,https://www.zacks.com/stock/news/2331843/buy-this-big-tech-stock-now-at-a-discount-and-hold-forever?cid=CS-STOCKNEWSAPI-FT-stocks_in_the_news|investment_ideas-2331843
INTU,2024-09-03 10:46:03,My Top 15 High Growth Dividend Stocks For September 2024,https://images.financialmodelingprep.com/news/my-top-15-high-growth-dividend-stocks-for-september-20240903.jpg,seekingalpha.com,"The SPDR S&P 500 ETF Trust posted a 2.34% gain in August, underperforming Vanguard's Dividend Appreciation Index Fund ETF Shares by +3.32%. The top 15 dividend growth stocks for September 2024 offer an average dividend yield of 1.23% and appear to be about 26% undervalued based on dividend yield theory. Since its inception in September 2020, the watchlist has achieved a 12.93% annualized return.",https://seekingalpha.com/article/4718685-my-top-15-high-growth-dividend-stocks-for-september-2024
INTU,2024-08-29 11:07:17,Intuit: A Mini-Microsoft In The Making?,https://images.financialmodelingprep.com/news/intuit-a-minimicrosoft-in-the-making-20240829.jpg,seekingalpha.com,"Intuit (INTU) aims to become a leading financial software company, leveraging its well-known platforms like QuickBooks and TurboTax to become the operating system for small businesses. The company's strong moat is supported by brand trust, network effects, and switching costs, though competition from larger software players like Salesforce potentially remains a risk. Overall I like the company a lot, however, rate it a hold on valuation and concerns about possible downside scenarios.",https://seekingalpha.com/article/4717902-intuit-mini-microsoft-in-the-making
INTU,2024-08-28 15:45:49,Looking for Yield? 4 Stocks Announce Dividend Hikes,https://images.financialmodelingprep.com/news/looking-for-yield-4-stocks-announce-dividend-hikes-20240828.jpg,zacks.com,"Stocks like Napco Security Technologies (NSSC), Northrim BanCorp (NRIM), Intuit (INTU) and SS&C Technologies (SSNC) recently announced dividend hikes.",https://www.zacks.com/stock/news/2328518/looking-for-yield-4-stocks-announce-dividend-hikes?cid=CS-STOCKNEWSAPI-FT-analyst_blog|investment_ideas-2328518
INTU,2024-08-28 00:01:00,Education at Work Partners with Intuit to Create New Pathways for College Students to Start Careers in Tax and Accounting,https://images.financialmodelingprep.com/news/education-at-work-partners-with-intuit-to-create-new-20240828.jpg,prnewswire.com,"In collaboration with national nonprofit Education at Work, Intuit connects college students with work opportunities in Tax and Accounting to gain experience and help pay for college   TEMPE, Ariz. , Aug. 28, 2024 /PRNewswire/ -- Education at Work, a national work-based learning non-profit, in collaboration with Intuit Inc. (Nasdaq: INTU), the global financial technology platform that makes Intuit TurboTax, Credit Karma, QuickBooks, and Mailchimp, announce a new pilot program to help college students gain valuable industry experience in tax, accounting, and financial services while earning money to offset college expenses.",https://www.prnewswire.com/news-releases/education-at-work-partners-with-intuit-to-create-new-pathways-for-college-students-to-start-careers-in-tax-and-accounting-302232305.html
INTU,2024-08-27 11:58:40,Best AI Stocks to Buy: Intuit vs UiPath,https://images.financialmodelingprep.com/news/best-ai-stocks-to-buy-intuit-vs-uipath-20240827.jpg,247wallst.com,Tech investors have continued to focus on the growth potential artificial intelligence provides.,https://247wallst.com/investing/2024/08/27/best-ai-stocks-to-buy-intuit-vs-uipath/
INTU,2024-08-26 10:31:14,Should You Invest in Intuit (INTU) Based on Bullish Wall Street Views?,https://images.financialmodelingprep.com/news/should-you-invest-in-intuit-intu-based-on-bullish-20240826.jpg,zacks.com,"Investors often turn to recommendations made by Wall Street analysts before making a Buy, Sell, or Hold decision about a stock. While media reports about rating changes by these brokerage-firm employed (or sell-side) analysts often affect a stock's price, do they really matter?",https://www.zacks.com/stock/news/2326945/should-you-invest-in-intuit-intu-based-on-bullish-wall-street-views?cid=CS-STOCKNEWSAPI-FT-fundamental_analysis|average_broker_rating-2326945
INTU,2024-08-26 09:06:26,Intuit Stock Drops Sharply on Profit Concerns: Is It a Buy?,https://images.financialmodelingprep.com/news/intuit-stock-drops-sharply-on-profit-concerns-is-it-20240826.jpg,marketbeat.com,"On a day when stocks rallied on expectations of lower interest rates, Intuit Inc. NASDAQ: INTU was the biggest loser on the S&P 500. Shares of the financial services company known for the QuickBooks and TurboTax brands were down 6.8%.",https://www.marketbeat.com/stock-ideas/intu-stock-drops-sharply-on-profit-concerns-is-it-a-buy/
INTU,2024-08-23 15:39:52,"3-Stock Lunch: Uber, Intuit & Cava",https://images.financialmodelingprep.com/news/3stock-lunch-uber-intuit-cava-20240823.jpg,youtube.com,"Anthony Forcione, Rockland Trust, VP and portfolio manager, joins 'Power Lunch' to discuss stock plays for three stocks.",https://www.youtube.com/watch?v=AUouO6XKEvI
INTU,2024-08-23 14:21:41,"Intuit Is Biggest S&P 500 Decliner After Surprise Loss, Soft Profit Outlook",https://images.financialmodelingprep.com/news/intuit-is-biggest-sp-500-decliner-after-surprise-loss-20240823.jpg,investopedia.com,"Intuit (INTU) is the S&P 500's worst performer Friday, a day after the company reported a surprise fourth-quarter loss and a soft profit outlook.",https://www.investopedia.com/intuit-is-biggest-s-and-p-500-decliner-after-surprise-loss-soft-profit-outlook-8700621
INTU,2024-08-23 13:13:41,"Intuit Stock Drops As Investors Parse Guidance, Long-Term Growth Targets",https://images.financialmodelingprep.com/news/intuit-stock-drops-as-investors-parse-guidance-longterm-growth-20240823.jpg,investors.com,"Intuit stock fell as investors focused on the company's current-quarter guidance, which missed views because of an accounting change.",https://www.investors.com/news/technology/intuit-stock-drops-as-investors-parse-guidance/
