symbol,publishedDate,title,image,site,text,url
META,2025-06-10 05:00:01,Gen X has become Meta's biggest gold mine,,businessinsider.com,"Meta targets older users with more ads due to higher purchasing power, Barclays analysts found. Facebook's ad load is higher for users over 45, boosting ad revenue.",https://www.businessinsider.com/meta-ads-gen-x-targets-older-users-purchasing-power-2025-6
META,2025-06-10 04:36:00,2 Social Media Stocks That Are Screaming Buys in June,,fool.com,"After a rough start to the year, tech stocks have come roaring back. As of this writing, the tech-heavy Nasdaq Composite index has surged by more than 25% over the last two months.",https://www.fool.com/investing/2025/06/10/2-social-media-stocks-that-are-screaming-buys-in-j/
META,2025-06-10 03:18:31,Meta Is Creating a New A.I. Lab to Pursue ‘Superintelligence',https://images.financialmodelingprep.com/news/meta-is-creating-a-new-ai-lab-to-pursue-20250610.jpg,nytimes.com,"The new lab, set to include Scale AI founder Alexandr Wang, is part of a reorganization of Meta's artificial intelligence efforts under chief executive Mark Zuckerberg.",https://www.nytimes.com/2025/06/10/technology/meta-new-ai-lab-superintelligence.html
META,2025-06-10 03:01:12,"Meta's Zuckerberg is hiring for new AI team, Bloomberg News reports",https://images.financialmodelingprep.com/news/metas-zuckerberg-is-hiring-for-new-ai-team-bloomberg-20250610.jpg,reuters.com,"Meta Platforms CEO Mark Zuckerberg is setting up a team of experts to achieve artificial general intelligence, Bloomberg News reported Tuesday.",https://www.reuters.com/business/metas-zuckerberg-is-hiring-new-ai-team-bloomberg-news-reports-2025-06-10/
META,2025-06-09 20:56:00,"Want $1 Million in Retirement? Invest $100,000 in These 3 Stocks and Wait a Decade",https://images.financialmodelingprep.com/news/want-1-million-in-retirement-invest-100000-in-these-20250609.jpg,fool.com,"The right stocks can turbocharge your stock portfolio and set you up for a comfortable retirement. However, there are nuances to investing in growing companies.",https://www.fool.com/investing/2025/06/09/want-1-million-in-retirement-invest-100000-in-thes/
META,2025-06-09 20:20:29,Buy These AI Stocks Today,https://images.financialmodelingprep.com/news/buy-these-ai-stocks-today-20250609.jpg,investorplace.com,Do we need to fear fallout from the Trump/Musk feud?,https://investorplace.com/2025/06/buy-these-ai-stocks-today/
META,2025-06-09 19:30:37,What retail investors are buying and selling,https://images.financialmodelingprep.com/news/what-retail-investors-are-buying-and-selling-20250609.jpg,youtube.com,"Charles Schwab's client surveys have been showing a trend: retail investors are turning away from individual names and buying ETFs. In the video above, Charles Schwab head trading and derivatives strategist Joe Mazzola explains why the phenomenon may be occurring.",https://www.youtube.com/watch?v=fUVUIZcG6BQ
META,2025-06-09 16:31:36,Meta in Talks to Invest in Scale AI,https://images.financialmodelingprep.com/news/meta-in-talks-to-invest-in-scale-ai-20250609.jpg,nytimes.com,"Scale AI, an artificial intelligence start-up, has built a business by labeling and culling data to make it easier to use to train A.I. systems.",https://www.nytimes.com/2025/06/09/technology/meta-scale-ai-investment.html
META,2025-06-09 12:45:00,"INVESTOR ALERT: Pomerantz Law Firm Investigates Claims On Behalf of Investors of Meta Platforms, Inc. - META",https://images.financialmodelingprep.com/news/investor-alert-pomerantz-law-firm-investigates-claims-on-behalf-of-investors-of-meta-20250609.jpg,accessnewswire.com,"NEW YORK CITY, NY / ACCESS Newswire / June 9, 2025 / Pomerantz LLP is investigating claims on behalf of investors of Meta Platforms, Inc.(""Meta"" or the ""Company"") (NASDAQ:META). Such investors are advised to contact Danielle Peyton at newaction@pomlaw.com or 646-581-9980, ext.",https://www.accessnewswire.com/newsroom/en/business-and-professional-services/investor-alert-pomerantz-law-firm-investigates-claims-on-behalf-1037093
META,2025-06-09 10:06:15,"Meta Platforms, Inc. (META) is Attracting Investor Attention: Here is What You Should Know",https://images.financialmodelingprep.com/news/meta-platforms-inc-meta-is-attracting-investor-attention-here-20250609.jpg,zacks.com,"Meta Platforms (META) has been one of the stocks most watched by Zacks.com users lately. So, it is worth exploring what lies ahead for the stock.",https://www.zacks.com/stock/news/2490559/meta-platforms-inc-meta-is-attracting-investor-attention-here-is-what-you-should-know?cid=CS-STOCKNEWSAPI-FT-tale_of_the_tape|most_searched_stocks-2490559
META,2025-06-09 09:15:05,Options Corner: META's A.I. Investment,https://images.financialmodelingprep.com/news/options-corner-metas-ai-investment-20250609.jpg,youtube.com,"After reports that Meta Platforms (META) is planning to invest $10B in Scale A.I. for further expansion in the space, Tom White looks at the chart.",https://www.youtube.com/watch?v=dI_NTzq2Br4
META,2025-06-09 09:00:00,Beyond The Screen: How Meta's Glasses Will Reshape Our Lives,https://images.financialmodelingprep.com/news/beyond-the-screen-how-metas-glasses-will-reshape-our-20250609.jpg,seekingalpha.com,"Meta Platforms, Inc. is the most ambitious big tech, leading innovation with smart glasses and AR, aiming to revolutionize daily life beyond smartphones. CEO Mark Zuckerberg's long-term vision and control enabled Meta to invest heavily in Reality Labs, giving it a significant first-mover advantage over rivals. Meta's core business remains highly profitable, with strong cash flows, effective advertising, and a growing user base, making it a solid investment regardless of AR success.",https://seekingalpha.com/article/4793111-beyond-the-screen-how-meta-glasses-will-reshape-our-lives
META,2025-06-09 07:31:00,"Greece Social Commerce Market Databook 2025, with Focus on Tomigo, Greeks.Social, Broombids, Facebook and Instagram",https://images.financialmodelingprep.com/news/greece-social-commerce-market-databook-2025-with-focus-on-tomigo-20250609.jpg,globenewswire.com,"This detailed report explores market dynamics, consumer behavior, and retail strategies, offering insights into domestic and cross-border opportunities across major categories. The report covers Facebook, Instagram, Tomigo, Greeks.Socialand Broombids. This detailed report explores market dynamics, consumer behavior, and retail strategies, offering insights into domestic and cross-border opportunities across major categories. The report covers Facebook, Instagram, Tomigo, Greeks.Socialand Broombids.",https://www.globenewswire.com/news-release/2025/06/09/3095760/28124/en/Greece-Social-Commerce-Market-Databook-2025-with-Focus-on-Tomigo-Greeks-Social-Broombids-Facebook-and-Instagram.html
META,2025-06-09 03:01:43,Meta eyes major investment in AI start-up Scale,https://images.financialmodelingprep.com/news/meta-eyes-major-investment-in-ai-startup-scale-20250609.jpg,proactiveinvestors.co.uk,"Meta Platforms Inc (NASDAQ:META, ETR:FB2A, SWX:FB) is in advanced discussions to invest several billion dollars into artificial intelligence firm Scale AI, in what could become one of the largest private funding deals on record. The final terms of what is reported to be a $10 billion investment round are not yet agreed, and both companies have declined to comment.",https://www.proactiveinvestors.co.uk/companies/news/1072591
META,2025-06-09 01:39:48,Meta in Talks for Scale AI Multi-Billion Investment,https://images.financialmodelingprep.com/news/meta-in-talks-for-scale-ai-multibillion-investment-20250609.jpg,youtube.com,"Meta Platforms Inc. is in talks to make a multibillion-dollar investment into artificial intelligence startup Scale AI, according to people familiar with the matter. Scale AI uses an army of contractors to label the data that tech firms such as Meta and OpenAI use to train and improve their AI models, and helps companies make custom AI applications.",https://www.youtube.com/watch?v=Q0XI6dOoUu8
META,2025-06-08 16:09:30,Meta Reportedly Exploring $10 Billion-Plus Investment in Scale AI,https://images.financialmodelingprep.com/news/meta-reportedly-exploring-10-billionplus-investment-in-scale-ai-20250608.jpg,pymnts.com,"Meta is reportedly weighing a multibillion-dollar investment in artificial intelligence (AI) startup Scale AI.  [contact-form-7] The tech giant is in talks with Scale AI about an investment that could exceed $10 billion, Bloomberg News reported Sunday (June 8), citing sources familiar with the matter.",https://www.pymnts.com/artificial-intelligence-2/2025/meta-reportedly-exploring-10-billion-plus-investment-in-scale-ai/
META,2025-06-08 15:59:08,Meta reportedly in talks to invest billions of dollars in Scale AI,https://images.financialmodelingprep.com/news/meta-reportedly-in-talks-to-invest-billions-of-dollars-20250608.jpg,techcrunch.com,"Meta is discussing a multi-billion dollar investment in Scale AI, according to Bloomberg. In fact, the deal value could reportedly exceed $10 billion, making it the largest external AI investment for the Facebook parent company and one of the largest funding events ever for a private company.",https://techcrunch.com/2025/06/08/meta-reportedly-in-talks-to-invest-billions-of-dollars-in-scale-ai/
META,2025-06-08 15:26:46,"Meta in talks over Scale AI stake that could top $10B, Bloomberg reports",https://images.financialmodelingprep.com/news/metain-talks-over-scale-ai-stake-that-could-top-20250608.jpg,nypost.com,"Meta Platforms is in talks to make an investment that could exceed $10 billion in artificial intelligence startup Scale AI, Bloomberg News reported on Sunday.",https://nypost.com/2025/06/08/business/meta-in-talks-over-scale-ai-stake-that-could-top-10b-bloomberg-reports/
META,2025-06-08 13:10:05,Meta To Dump $10 Billion Into AI,https://images.financialmodelingprep.com/news/meta-to-dump-10-billion-into-ai-20250608.jpg,247wallst.com,Meta Is Making AI Investment ScaleAI Is A Key Industry Player Take this quiz to see if you're on track to retire.,https://247wallst.com/technology-3/2025/06/08/meta-to-dump-10-billion-into-ai/
META,2025-06-08 05:40:00,2 Artificial Intelligence (AI) Stocks to Buy and Hold for the Next 20 Years,https://images.financialmodelingprep.com/news/2-artificial-intelligence-ai-stocks-to-buy-and-hold-20250608.jpg,fool.com,Artificial intelligence (AI) is sweeping across every industry. Researcher IDC forecasts that AI will contribute a total of nearly $20 trillion to the global economy over the next five years.,https://www.fool.com/investing/2025/06/08/2-artificial-intelligence-stocks-buy-hold-20-years/
META,2025-06-08 04:35:00,Value Meets Growth: 3 Artificial Intelligence (AI) Stocks Even Warren Buffett Might Respect,https://images.financialmodelingprep.com/news/value-meets-growth-3-artificial-intelligence-ai-stocks-even-20250608.jpg,fool.com,"Investors often view value stocks and growth stocks as mutually exclusive. This is likely because growth stocks often trade at premium valuations, and value stocks tend to attract conservative investors, or those focused on income more than growth.",https://www.fool.com/investing/2025/06/08/value-meets-growth-3-ai-stocks-buffett-respect/
META,2025-06-08 01:58:17,"Meta in talks for Scale AI investment that could top $10 billion, Bloomberg News reports",https://images.financialmodelingprep.com/news/meta-in-talks-for-scale-ai-investment-that-could-20250608.jpg,reuters.com,"Meta Platforms is in talks to make an investment that could exceed $10 billion in artificial intelligence startup Scale AI, Bloomberg News reported on Sunday.",https://www.reuters.com/business/meta-talks-scale-ai-investment-that-could-top-10-billion-bloomberg-news-reports-2025-06-08/
META,2025-06-07 10:31:09,Meta: Reality Labs Could Take Off Sooner Than Later,https://images.financialmodelingprep.com/news/meta-reality-labs-could-take-off-sooner-than-later-20250607.jpg,seekingalpha.com,"I reaffirm my strong buy rating on Meta and I project the stock testing all-time highs in the next few months. I see high potential in the Reality Labs segment from the new deal with Anduril, the store expansion strategy, and the potential deal with Hollywood for exclusive content. The store expansion is key in the VR strategy. I believe this will give skeptics a chance to try the headsets and experience the full potential of the immersive technology.",https://seekingalpha.com/article/4793193-meta-reality-labs-could-take-off-sooner-than-later
META,2025-06-07 10:00:00,"INVESTOR ALERT: Pomerantz Law Firm Investigates Claims On Behalf of Investors of Meta Platforms, Inc. - META",https://images.financialmodelingprep.com/news/investor-alert-pomerantz-law-firm-investigates-claims-on-behalf-of-investors-of-meta-20250607.jpg,prnewswire.com,"NEW YORK , June 7, 2025 /PRNewswire/ -- Pomerantz LLP is investigating claims on behalf of investors of Meta Platforms, Inc. (""Meta"" or the ""Company"") (NASDAQ: META). Such investors are advised to contact Danielle Peyton at newaction@pomlaw.com or 646-581-9980, ext.",https://www.prnewswire.com/news-releases/investor-alert-pomerantz-law-firm-investigates-claims-on-behalf-of-investors-of-meta-platforms-inc---meta-302474964.html
META,2025-06-07 05:30:00,Prediction: Meta Platforms Will Be a $3 Trillion Company in 5 Years,https://images.financialmodelingprep.com/news/prediction-meta-platforms-will-be-a-3-trillion-company-20250607.jpg,fool.com,"Meta Platforms (META 1.95%) is the parent company of the world's most widely used social media sites, like Facebook and Instagram. Its sprawling business has already allowed it to achieve a $1.67 trillion valuation, but I think there's much more in store.",https://www.fool.com/investing/2025/06/07/prediction-meta-platforms-will-be-a-3-trillion-com/
META,2025-06-07 04:20:00,Up 725% in 10 Years: Why This Could Be Wall Street's Next Big Stock Split,https://images.financialmodelingprep.com/news/up-725-in-10-years-why-this-could-be-20250607.jpg,fool.com,Some might argue a stock split is merely cosmetic. Existing owners still own the same percentage of the company they did before the split and the business continues to operate just as it had before.,https://www.fool.com/investing/2025/06/07/up-10-years-why-wall-street-stock-split-meta/
META,2025-06-06 17:52:20,"2025 will be a ‘pivotal year' for Meta's augmented and virtual reality, says CTO",https://images.financialmodelingprep.com/news/2025-will-be-a-pivotal-year-for-metas-augmented-20250606.jpg,techcrunch.com,"Meta CTO Andrew “Boz” Bosworth, who was one of the company's first 15 engineers, published a memo earlier this year forecasting that 2025 could be the year of greatness for Reality Labs, the company's augmented and virtual reality unit. Or, it would be the year when the metaverse goes down as a “legendary misadventure.",https://techcrunch.com/2025/06/06/2025-will-be-a-pivotal-year-for-metas-augmented-and-virtual-reality-says-cto/
META,2025-06-06 17:08:32,"Stock Market This Week: TSLA v. Trump, AVGO Earnings, META & CEG Deal",https://images.financialmodelingprep.com/news/stock-market-this-week-tsla-v-trump-avgo-earnings-20250606.jpg,youtube.com,"Markets rallied on the week despite tariff shakiness and a steep sell-off in Tesla (TSLA). The latter happened after Tesla CEO Elon Musk openly criticized President Trump and his ""big, beautiful"" tax bill on X.",https://www.youtube.com/watch?v=hjhlHx7Eovs
META,2025-06-06 11:45:00,"INVESTOR ALERT: Pomerantz Law Firm Investigates Claims On Behalf of Investors of Meta Platforms, Inc. - META",https://images.financialmodelingprep.com/news/investor-alert-pomerantz-law-firm-investigates-claimson-behalf-of-investors-of-meta-20250606.jpg,globenewswire.com,"NEW YORK, June 06, 2025 (GLOBE NEWSWIRE) -- Pomerantz LLP is investigating claims on behalf of investors of  Meta Platforms, Inc. (“Meta” or the “Company”) (NASDAQ: META).  Such investors are advised to contact Danielle Peyton at newaction@pomlaw.com or 646-581-9980, ext. 7980.",https://www.globenewswire.com/news-release/2025/06/06/3095287/1087/en/INVESTOR-ALERT-Pomerantz-Law-Firm-Investigates-Claims-On-Behalf-of-Investors-of-Meta-Platforms-Inc-META.html
META,2025-06-06 11:20:16,"Meta Platforms Rises 17% Year to Date: Buy, Sell or Hold META Stock?",https://images.financialmodelingprep.com/news/meta-platforms-rises-17-year-to-date-buy-sell-20250606.jpg,zacks.com,"META rides AI-driven ad gains and rising engagement, but overvaluation and monetization concerns linger for now.",https://www.zacks.com/stock/news/2487500/meta-platforms-rises-17-year-to-date-buy-sell-or-hold-meta-stock?cid=CS-STOCKNEWSAPI-FT-analyst_blog|most_popular_stocks-2487500
META,2025-06-06 10:51:20,Here's Why Meta Platforms (META) is a Strong Growth Stock,https://images.financialmodelingprep.com/news/heres-why-meta-platforms-meta-is-a-strong-growth-20250606.jpg,zacks.com,"Wondering how to pick strong, market-beating stocks for your investment portfolio? Look no further than the Zacks Style Scores.",https://www.zacks.com/stock/news/2487411/here-s-why-meta-platforms-meta-is-a-strong-growth-stock?cid=CS-STOCKNEWSAPI-FT-tale_of_the_tape|zacks_education_growth_score-2487411
META,2025-06-06 10:43:48,AppLovin (NASDAQ: APP) Stock Price Prediction and Forecast 2025-2030 (May 30),https://images.financialmodelingprep.com/news/applovin-nasdaq-app-stock-price-prediction-and-forecast-20252030-20250606.jpg,https://247wallst.com,"After hitting an all-time high of $525.15 in February, AppLovin Corp.&#8217;s (NASDAQ: APP) share price tumbled more than 35%, due to a pending class action lawsuit and to short seller reports. However, the software company&#8217;s better-than-expected first-quarter report gave the stock a boost last month. The share price is now 27.9% higher than at the beginning of the year. Compared to a year ago, the stock is 395.0% higher, far outperforming the S&amp;P 500 and the Nasdaq in that time. Since the company went public in 2021, its stock price is up 613.9%. So, this has clearly been a top growth stock that investors have done well owning in recent years. AppLovin has been among the top tech stocks seeing a lot of love from the market, but is that still true with the recent overhang? 24/7 Wall St. Key Points: AppLovin Corp. (NASDAQ: APP) has seen incredibly strong growth, driven by its core business model that helps online advertisers boost monetization and marketing efforts for their solutions. Key drivers propelling AppLovin going forward include its enhancements in AI-powered advertising and its expansion into e-commerce advertising. Here’s where this stock has come since its inception, and where AppLovin could be headed over the next few years. If you’re looking for some stocks with huge potential, make sure to grab a free copy of our “The Next NVIDIA” report. It features a software stock we’re confident has 10X potential. These days, the company focuses on providing software solutions that enhance the marketing and monetization of online advertisers. With AppLovin, there are certainly catalysts worth considering, and we&#8217;ll get to those shortly. It continues to benefit from the strong secular growth trends investors are seeking increased exposure to. As investors continue to pile into such stocks, retail investors appear eager to gain outsized exposure ahead of a continued boom. It is worth remembering that AppLovin did experience a drawdown of more than 90% from its post-pandemic highs in 2021. So, is this stock headed for a further beatdown, or is its momentum real? Let&#8217;s dive into some catalysts and price predictions around where this stock could go for the rest of 2025 through to the end of this decade. Three Key Drivers for AppLovin As mentioned, AppLovin investors have to contend with plenty of news. For instance, the analysts covering AppLovin have not been as bullish on this company as many may think, having issued warnings on the stock in the past year or so due to concerns around the company&#8217;s fundamentals. Nonetheless, we see these key drivers propelling AppLovin going forward. 1. AI-Powered Advertising Enhancements AppLovin’s Axon AI engine has been a game-changer, optimizing ad targeting and expanding beyond gaming into new categories like e-commerce, fintech, and automotive advertising. During the Q4 2024 earnings call, CEO Adam Foroughi highlighted that for the first time, AppLovin captured a significant share of holiday shopping ad spend—validating that its AI models are effective outside gaming. Scaling AI Beyond Gaming: The company initially focused on direct-to-consumer (DTC) brands, but early pilots have shown AI-driven success across multiple verticals. This means any business in any industry could potentially tap into AppLovin’s advertising platform. Personalized Advertising With Generative AI: The company is developing automated tools and AI-generated ad creatives to improve engagement. AppLovin’s self-service platform (currently in development) will eventually allow businesses to run ads autonomously with AI-optimized targeting—a major step toward scaling its reach. AppLovin&#8217;s AI capabilities are proving to be industry-agnostic, opening the door for millions of global advertisers. 2. Expansion Into E-Commerce Advertising Foroughi described fourth-quarter 2024 as a major milestone, marking AppLovin’s first real penetration into e-commerce advertising. Historically, the company primarily monetized mobile gaming ads, but now retail and consumer brands are joining the platform in large numbers. Surging Demand From E-Commerce Brands: Advertisers saw strong return on investment during the holiday season, prompting continued demand for the platform in 2025. Pilot Program Scaling Up: While AppLovin hasn’t disclosed the number of e-commerce advertisers, industry checks suggest a significant influx of brands wanting access. Self-Service Expansion Is the Next Big Growth Driver: Currently, the company manually onboards advertisers, but in 2025, the launch of automated tools and a self-serve platform will allow thousands of new businesses to join. E-commerce advertising is set to be a major revenue contributor. Once self-serve tools become operational, adoption could scale exponentially. 3. Strategic Divestment of Mobile Gaming Unit AppLovin is officially exiting game development—a move that frees up resources to focus entirely on advertising technology. $900 Million Sale of Apps Business: AppLovin announced that it has signed an exclusive term sheet to sell its mobile gaming division, with $500 million in cash and $400 million in equity in a private company. Why This Matters: The company originally acquired gaming studios to train its AI models, but it was never meant to be a core business. Now that AI is self-sufficient, AppLovin no longer needs to develop its own games. Shifting to a Pure Ad-Tech Model: With gaming divested, the company can fully concentrate on expanding its advertising ecosystem—positioning itself as a direct competitor to Google and Meta in the ad tech space. Divesting from mobile games is a giant pivot for the stock, as it paves the way as a pure advertising technology company. Stock Price Prediction for 2025 There are clearly strong reasons why AppLovin was up as much as it is this year. Simply put, investors have been banking on AppLovin as a potential AI beneficiary, as several AI advancements have fueled customer success and accelerated the company&#8217;s adoption and growth rates across the board. If the company can continue to prioritize generating outsized free cash flow and return capital to shareholders to a greater degree, I certainly think this multiple could be warranted. Here&#8217;s where the stock could be headed, assuming the company&#8217;s multiple stays the same and earnings grow according to analyst estimates. Wall Street&#8217;s consensus one-year price target for AppLovin has risen to $457.67, which would be a 10.5% gain from the current price. On average, 27 analysts covering AppLovin recommend buying shares, four of them with a Strong Buy rating. 24/7 Wall St.&#8217;s forecast projects AppLovin&#8217;s stock price to be just $377.10 by year&#8217;s end, or about 9% lower than today&#8217;s price. Yet, we see the stock continuing its strong growth rate and outperforming analysts&#8217; expectations going forward. AppLovin Price Target for 2030 By the end of the decade, we estimate AppLovin’s stock price to be $662.40 per share with less than 10% year-over-year revenue growth. Our estimated stock price will be nearly 60% higher than the current stock price. Year Price Target Upside Potential 2025 $377.10 −8.9% 2026 $445.78 7.6% 2027 $500.47 20.8% 2028 $572.02 38.1% 2029 $609.44 47.2% 2030 $662.40 59.9% Palantir Stock Price Prediction and Forecast 2025-2030 The post AppLovin (NASDAQ: APP) Stock Price Prediction and Forecast 2025-2030 (May 30) appeared first on 24/7 Wall St..",https://247wallst.com/forecasts/2025/06/06/applovin-price-prediction-and-forecast-2025-2030/
META,2025-06-06 07:18:05,5 Earnings Season Winners With More Upside on the Way,https://images.financialmodelingprep.com/news/5-earnings-season-winners-with-more-upside-on-the-20250606.jpg,marketbeat.com,"Earnings season has come and gone, and many prominent companies surprised analysts with impressive Q1 earnings strength. Despite unpredictable tariffs, a weakening dollar, and ISM survey comments that suggest Armageddon is imminent, the S&P 500 continues to chug along toward its February all-time high.",https://www.marketbeat.com/stock-ideas/5-earnings-season-winners-with-more-upside-on-the-way/
