symbol,publishedDate,title,image,site,text,url
META,2025-04-12 23:59:00,"Meta Platforms: Selloff Overdone, Strong Buy",https://images.financialmodelingprep.com/news/meta-platforms-selloff-overdone-strong-buy-20250412.jpg,seekingalpha.com,"The selloff in Meta Platforms' stock represents a buying opportunity due to their large user base and investments in AI and compute infrastructure. Despite reliance on ad revenue, Meta's flexibility and innovative culture mitigate long-term risks. Founder CEO Mark Zuckerberg's willingness to take risks and innovate positions Meta for future growth, supported by his significant voting control.",https://seekingalpha.com/article/4774742-meta-platforms-selloff-overdone-strong-buy
META,2025-04-12 04:25:00,"5 Cheap, Leading AI Stocks That Are Screaming Buys in April",https://images.financialmodelingprep.com/news/5-cheap-leading-ai-stocks-that-are-screaming-buys-20250412.jpg,fool.com,"With the recent stock market crash, several leading artificial intelligence (AI) stocks have gone on sale. While the market is likely to remain volatile given tariffs, threatened tariffs, and the current trade war, now is still a great time to begin building positions in market-leading businesses.",https://www.fool.com/investing/2025/04/12/cheap-leading-ai-stocks-screaming-buys-april/
META,2025-04-12 00:46:47,Missed Meta In 2023? This Might Be Your Second Chance,https://images.financialmodelingprep.com/news/missed-meta-in-2023-this-might-be-your-second-20250412.jpg,seekingalpha.com,"Meta's core business remains robust, with $52 billion in free cash flow and strong ad pricing power, despite a 30% stock drop. The market undervalues Meta at 20x trailing earnings, ignoring growth in WhatsApp, Threads, and AI, focusing instead on Reality Labs losses. Meta's management is committed to Reality Labs while scaling AI infrastructure, with significant capital returns through buybacks and a new dividend.",https://seekingalpha.com/article/4774644-missed-meta-in-2023-this-might-be-your-second-chance
META,2025-04-11 18:32:14,Meta adds former Trump advisor to its board,https://images.financialmodelingprep.com/news/meta-adds-former-trump-advisor-to-its-board-20250411.jpg,cnbc.com,"Meta's newest Trump-friendly board member is Dina Powell McCormick, who served as an advisor to the president from 2017 until 2018. Last month, she and her husband, the Republican Sen.",https://www.cnbc.com/2025/04/11/meta-adds-former-trump-advisor-to-its-board.html
META,2025-04-11 16:00:39,META Introduces New Teen Safety Tools: How Safe is the Stock for You?,https://images.financialmodelingprep.com/news/meta-introduces-new-teen-safety-tools-how-safe-is-20250411.jpg,zacks.com,"Meta Platforms expands its teen accounts with new protections on Instagram, Facebook, and Messenger to give parents more peace of mind and improve teen safety online.",https://www.zacks.com/stock/news/2447974/meta-introduces-new-teen-safety-tools-how-safe-is-the-stock-for-you?cid=CS-STOCKNEWSAPI-FT-analyst_blog|company_news_tech_sector-2447974
META,2025-04-11 14:10:12,FTC vs. Meta: What you need to know about the trial,https://images.financialmodelingprep.com/news/ftc-vs-meta-what-you-need-to-know-about-20250411.jpg,youtube.com,"The trial will begin on Monday, April 14. Transcript: The Federal Trade Commission and Meta are finally about to square off.",https://www.youtube.com/watch?v=iG6BOeR3dMk
META,2025-04-11 14:06:03,"Final Trades: TJX, Meta, Abbvie and Taiwan Semi",https://images.financialmodelingprep.com/news/final-trades-tjx-meta-abbvie-and-taiwan-semi-20250411.jpg,youtube.com,The Investment Committee give you their top stocks to watch for the second half.,https://www.youtube.com/watch?v=VIw9UJH9tZA
META,2025-04-11 13:49:36,Legal Defense Fund exits Meta civil rights advisory group over DEI changes,https://images.financialmodelingprep.com/news/legal-defense-fund-exits-meta-civil-rights-advisory-group-20250411.jpg,theguardian.com,"Meta ending DEI programs, getting rid of factcheckers and changing content moderation policies led to LDF's decision",https://www.theguardian.com/technology/2025/apr/11/meta-ldf-dei-policy
META,2025-04-11 12:30:19,Example NVDA & META Trades for Short-Term Gains,https://images.financialmodelingprep.com/news/example-nvda-meta-trades-for-shortterm-gains-20250411.jpg,youtube.com,"Kevin Hincks composes two example trades in Mag 7 stocks: Nvidia (NVDA) and Meta Platforms (META). Factoring in the companies' upcoming earnings reports, Kevin looks at a long call diagonal strategy for NVDA and META.",https://www.youtube.com/watch?v=wR_fwFoZ6uk
META,2025-04-11 09:55:36,These 2 Computer and Technology Stocks Could Beat Earnings: Why They Should Be on Your Radar,https://images.financialmodelingprep.com/news/these-2-computer-and-technology-stocks-could-beat-earnings-20250411.jpg,zacks.com,Investors looking for ways to find stocks that are set to beat quarterly earnings estimates should check out the Zacks Earnings ESP.,https://www.zacks.com/stock/news/2447199/these-2-computer-and-technology-stocks-could-beat-earnings-why-they-should-be-on-your-radar?cid=CS-STOCKNEWSAPI-FT-tale_of_the_tape|zacks_education_earnings_esp-2447199
META,2025-04-11 09:52:01,Irish regulator investigates X over use of EU personal data to train Grok AI,https://images.financialmodelingprep.com/news/irish-regulator-investigates-x-over-use-of-eu-personal-20250411.jpg,https://www.marketscreener.com,"DUBLIN (Reuters) - Ireland's data regulator on Friday said it had opened an investigation into social media platform X over the use of personal data collected from European Union users to train its AI system Grok. Ireland's Data Protection Commission (DPC) is the lead EU regulator for X due to the location of its EU operations in the country. It has the power to impose fines of up to 4% of a company's global revenue under the EU's strict General Data Protection Regulation (GDPR). aAdsList.push('Article'); aAdsListSize.push([300, 250]); aAdsListCA.push(null); The inquiry will look at ""the processing of personal data comprised in publicly-accessible posts posted on the X social media platform by EU/EEA users, for the purposes of training generative artificial intelligence models,"" the DPC said in a statement. U.S. President Donald Trump and other members of his administration have criticised EU regulation of U.S. companies and described fines imposed on U.S. tech companies by the EU as a form of taxation. X owner Elon Musk, the world's richest man and a top adviser to Trump, has also railed against EU regulations, mainly those imposed directly by Brussels on online content. The decision follows a court case last year in which the Irish regulator sought an order to restrict X from processing the data of EU users for the purposes of developing its AI systems. X agreed to stop training its AI systems using personal data collected from EU users before they had the option to withdraw their consent. The Irish regulator ended its court proceedings weeks later, saying X had agreed the limits on a permanent basis. The powerful Irish privacy regulator has fined the likes of Microsoft's LinkedIn, TikTok and Meta since it was given sanctioning powers in 2018. Its fines to date of Meta total almost 3 billion euros. X, or Twitter as it was then called, has not faced sanctions since the DPC fined it 450,000 euros ($511,000) in 2020, the first penalty the regulator handed out under the new data privacy system. ($1 = 0.8808 euros) (Writing by Conor Humphries; Editing by Catarina Demony)",https://www.marketscreener.com/quote/cryptocurrency/BITCOIN-BTC-USD-45553945/news/Irish-regulator-investigates-X-over-use-of-EU-personal-data-to-train-Grok-AI-49599801/
META,2025-04-11 08:32:12,"MSFT, META and NFLX Forecast – Major US Stocks Quiet in Premarket",https://images.financialmodelingprep.com/news/msft-meta-and-nflx-forecast-major-us-stocks-quiet-20250411.jpg,fxempire.com,"The three stocks in this analysis all look like they are simply going to sit still for the open, as the markets are probably fairly exhausted at this point in time.",https://www.fxempire.com/forecasts/article/msft-meta-and-nflx-forecast-major-us-stocks-quiet-in-premarket-1511190
META,2025-04-11 07:00:01,Meta vs. the FTC: The blockbuster antitrust trial kicks off,https://images.financialmodelingprep.com/news/meta-vs-the-ftc-the-blockbuster-antitrust-trial-kicks-20250411.jpg,cnbc.com,Meta will face off against the U.S. Federal Trade Commission on Monday in a high-stakes antitrust trial that could result in the company divesting Instagram and WhatsApp. The upcoming trial in Washington is expected to last several weeks and centers around the FTC's allegations that Meta monopolizes the personal social networking market.,https://www.cnbc.com/2025/04/11/ftc-meta-instagram-whatsapp-lawsuit.html
META,2025-04-11 06:00:00,Stock Market Turmoil: Here Are My Top 10 Stocks to Buy Now,https://images.financialmodelingprep.com/news/stock-market-turmoil-here-are-my-top-10-stocks-20250411.jpg,fool.com,"The stock market sold off rapidly over the past few weeks, leading many to label this a stock market crash brought on by President Donald Trump's tariff announcements. Stocks moved down sharply this week as reciprocal tariffs went into effect; they recovered quickly as Trump announced tariff relief on every country except China, but continued to mark additional losses on Thursday.",https://www.fool.com/investing/2025/04/11/stock-market-turmoil-here-are-my-top-10-stocks-to/
META,2025-04-11 04:18:00,Should You Buy Meta Platforms Stock Before April 30?,https://images.financialmodelingprep.com/news/should-you-buy-meta-platforms-stock-before-april-30-20250411.jpg,fool.com,"Meta Platforms (META -6.74%) is the parent company of social networks including Facebook, Instagram, Messenger, and WhatsApp, which serve more than 3.3 billion people every single day. The company is coming off of a spectacular year of earnings growth in 2024, and it's scheduled to report its financial results for the first quarter of 2025 (ended March 31) on April 30.",https://www.fool.com/investing/2025/04/11/should-buy-meta-platforms-stock-before-april-30/
META,2025-04-10 20:00:00,Meta Platforms: Back To $750,https://images.financialmodelingprep.com/news/meta-platforms-back-to-750-20250410.jpg,seekingalpha.com,"Meta Platforms, Inc. is attractively priced at $550, with potential rebound to $750, due to limited direct impact from global trade tariffs. The company's significant AI and capex investments are expected to drive substantial revenue growth, with forecasts reaching nearly $265 billion by 2028. Meta's EPS could be significantly boosted by cutting Reality Labs spending, making the stock undervalued at 16x adjusted EPS targets.",https://seekingalpha.com/article/4774352-meta-platforms-back-to-750
META,2025-04-10 15:41:18,Congress and FTC Focus on Meta,https://images.financialmodelingprep.com/news/congress-and-ftc-focus-on-meta-20250410.jpg,youtube.com,Congress takes aim at Meta CEO Mark Zuckerberg during its whistleblower testimony as the social media giant prepares to fight the Federal Trade Commission over monopoly claims. Bloomberg's Riley Griffin discusses it all with Caroline Hyde and Ed Ludlow on “Bloomberg Technology.,https://www.youtube.com/watch?v=zchMJXyhDxM
META,2025-04-10 12:47:08,Here's why Piper Sandler is recommending Meta and Google amid market volatility,https://images.financialmodelingprep.com/news/heres-why-piper-sandler-is-recommending-meta-and-google-20250410.jpg,youtube.com,"Thomas Champion, senior research analyst at Piper Sandler, joins CNBC's Money Movers to discuss how Trump's tariffs are impacting the digital ad space, the names that look mispriced, and more.",https://www.youtube.com/watch?v=k8fWBbdakws
META,2025-04-10 10:46:41,Why META (Nasdaq: META) and Broadcom (Nasdaq: AVGO) Are Tumbling Today,https://images.financialmodelingprep.com/news/why-meta-nasdaq-meta-and-broadcom-nasdaq-avgo-are-20250410.jpg,247wallst.com,"With tariff uncertainties remaining, some of yesterday's biggest rebounders are some of today's biggest losers.",https://247wallst.com/investing/2025/04/10/why-meta-nasdaq-meta-and-broadcom-nasdaq-avgo-are-tumbling-today/
META,2025-04-10 09:10:49,Meta whistleblower claims the company put profit over the safety of children in Horizon Worlds,https://images.financialmodelingprep.com/news/meta-whistleblower-claims-the-company-put-profit-over-the-20250410.jpg,businessinsider.com,"Nonprofit Fairplay filed an FTC complaint against Meta over its Horizon Worlds platform. In the complaint, a Meta whistleblower alleged execs knew underage children were on the virtual platform.",https://www.businessinsider.com/meta-horizon-worlds-child-safety-whistleblower-ftc-fairplay-2025-4
META,2025-04-10 08:46:53,Meta Seeks Trump's Help in FTC Trial: The Implications Are Huge,https://images.financialmodelingprep.com/news/meta-seeks-trumps-help-in-ftc-trial-the-implications-20250410.jpg,marketbeat.com,"Magnificent Seven stock Meta Platforms NASDAQ: META constantly has headlines swirling around it. Three analysts downgraded the stock in April, and shares are down big-time on tariff worries.",https://www.marketbeat.com/originals/meta-seeks-trumps-help-in-ftc-trial-the-implications-are-huge/
META,2025-04-10 07:30:33,Meta: Time To Buy The Fear [Upgrade],https://images.financialmodelingprep.com/news/meta-time-to-buy-the-fear-upgrade-20250410.jpg,seekingalpha.com,"Meta Platforms is upgraded back to ""Strong Buy"" due to its very attractive valuation at the moment. Meta recently started releasing its updated Llama 4 family of models, which is a very important milestone in building the company's moat in the AI era. The business's fair value estimate under a very conservative scenario is $1.63 trillion, indicating a 27% upside potential.",https://seekingalpha.com/article/4774158-meta-stock-time-to-buy-the-fear-upgrade-strong-buy
META,2025-04-10 05:15:00,4 Artificial Intelligence Stocks You Can Buy and Hold for the Next Decade,https://images.financialmodelingprep.com/news/4-artificial-intelligence-stocks-you-can-buy-and-hold-20250410.jpg,fool.com,"The market's enthusiasm for artificial intelligence (AI) and its growth potential has been thrown into doubt, at least for now, by tariff drama stemming from the Trump administration's recent policy announcements. The market initially plunged, flirting with a technical bear market after touching all-time highs just months ago, then recovered some of the losses after President Donald Trump said most of his tariff plan was on hold for three months.",https://www.fool.com/investing/2025/04/10/4-artificial-intelligence-stocks-you-can-buy-and-h/
META,2025-04-10 05:04:00,Should You Buy Meta Stock Before April 30?,https://images.financialmodelingprep.com/news/should-you-buy-meta-stock-before-april-30-20250410.jpg,fool.com,Meta Platforms (META 14.45%) is not immune to increasing trade barriers worldwide.,https://www.fool.com/investing/2025/04/10/should-you-buy-meta-stock-before-april-30/
META,2025-04-10 04:08:00,Prediction: This Artificial Intelligence (AI) Stock Will Rebound More Than Any Other This Year (Hint: It's Not Nvidia),https://images.financialmodelingprep.com/news/prediction-this-artificial-intelligence-ai-stock-will-rebound-more-20250410.jpg,fool.com,"Artificial intelligence (AI) stocks delivered healthy gains in 2023 and 2024. However, due to the recent broad market sell-off, 2025 has been a tough year so far for companies looking to benefit from the fast-growing adoption of this technology.",https://www.fool.com/investing/2025/04/10/prediction-this-artificial-intelligence-ai-stock-w/
META,2025-04-09 20:26:06,Whistleblower tells Senate committee that Meta undermined US national security to cozy up to China,https://images.financialmodelingprep.com/news/whistleblower-tells-senate-committee-that-meta-undermined-us-national-20250409.jpg,foxbusiness.com,A whistleblower on Wednesday told a Senate committee that Meta repeatedly undermine U.S. national security in an effort to win favor with China.,https://www.foxbusiness.com/politics/whistleblower-tells-senate-committee-meta-undermined-us-national-security-cozy-up-china
META,2025-04-09 19:48:07,Magnificent Seven adds whopping $1.5T in value as Trump pauses sweeping tariffs,https://images.financialmodelingprep.com/news/magnificent-seven-adds-whopping-15t-in-value-as-trump-20250409.jpg,nypost.com,The gains did not erase the $3.4 trillion in value the companies have collectively shed since their peak in late 2024. But the reprieve gave investors a reason to buy back these expensive stocks.,https://nypost.com/2025/04/09/business/magnificent-seven-adds-whopping-1-5t-in-value-as-trump-pauses-sweeping-tariffs/
META,2025-04-09 19:42:15,"Nasdaq Gains 12% Today, Alphabet (Nasdaq: GOOG) and Meta (Nasdaq: META) and Marvell (Nasdaq MRVL) Soar",https://images.financialmodelingprep.com/news/nasdaq-gains-12-today-alphabet-nasdaq-goog-and-meta-20250409.jpg,247wallst.com,"The tech-heavy NASDAQ exploded higher. All after President Trump reversed course on tariffs, with a 90-day delay.",https://247wallst.com/investing/2025/04/09/nasdaq-gains-12-today-alphabet-nasdaq-goog-and-meta-nasdaq-meta-and-marvell-nasdaq-mrvl-soar/
META,2025-04-09 18:10:00,The Stock Market Has Crashed: My Top 5 Dirt Cheap Tech Stocks to Buy Now,https://images.financialmodelingprep.com/news/the-stock-market-has-crashed-my-top-5-dirt-20250409.jpg,fool.com,"President Trump's announcement of tariffs on imports from countries worldwide has rocked the stock market -- and the tech-heavy Nasdaq Composite (^IXIC 12.16%) has led the decline, crashing more than 20% from its most recent high.",https://www.fool.com/investing/2025/04/09/the-stock-market-has-crashed-my-top-5-dirt-cheap-t/
META,2025-04-09 16:41:38,Whistleblower claims Meta helped China develop advanced AI to ‘outcompete American companies': bombshell testimony,https://images.financialmodelingprep.com/news/whistleblower-claims-meta-helped-china-develop-advanced-ai-to-20250409.jpg,nypost.com,"Meta actively helped China in the race to develop artificial intelligence as part of its failed effort to cozy up to Beijing, former executive turned whistleblower Sarah Wynn-Williams said during a bombshell Senate hearing on Wednesday.",https://nypost.com/2025/04/09/business/meta-helped-china-develop-advanced-ai-to-outcompete-american-companies-whistleblower/
META,2025-04-09 16:41:09,Meta Aided China in AI Race According to Whistleblower,https://images.financialmodelingprep.com/news/meta-aided-china-in-ai-race-according-to-whistleblower-20250409.jpg,youtube.com,"A Meta whistleblower is expected to testify before congress that Meta threatened US interests by cozying up to China, which Meta denies. Bloomberg's Riley Griffin discusses the possible impact with Caroline Hyde and Ed Ludlow on “Bloomberg Technology”.",https://www.youtube.com/watch?v=jCstjPomZc4
META,2025-04-09 16:33:30,"Mag 7 Stocks Could Snap Back, Chronert Says",https://images.financialmodelingprep.com/news/mag-7-stocks-could-snap-back-chronert-says-20250409.jpg,youtube.com,"Scott Chronert, Citi US equity strategist and global head of ETF research, talks about the rebound of stocks on Wall Street and where's seeing opportunities. He's on ""Bloomberg The Close.",https://www.youtube.com/watch?v=Rd_9wn0al0Q
META,2025-04-09 13:49:47,"Final Trades: Meta, UnitedHealth and the QQQ",https://images.financialmodelingprep.com/news/final-trades-meta-unitedhealth-and-the-qqq-20250409.jpg,youtube.com,The Investment Committee give you their top stocks to watch for the second half.,https://www.youtube.com/watch?v=BtVAdaGHwfw
META,2025-04-09 13:22:19,Meta: Market Too Busy Selling To Notice Its Tariff Insensitivity Or Llama 4,https://images.financialmodelingprep.com/news/meta-market-too-busy-selling-to-notice-its-tariff-20250409.jpg,seekingalpha.com,"Since my last Meta Platforms, Inc. analysis, new catalysts have materially shifted its return/risk curve and made it a strong buy. The ongoing selloff ignored META's unique model that can help it to be relatively less sensitive to higher tariffs. These differentiating factors include its digital revenue model and global user base.",https://seekingalpha.com/article/4774041-meta-market-too-busy-selling-to-notice-its-tariff-insensitivity-or-llama-4
META,2025-04-09 13:15:59,Will Meta Platforms (META) Beat Estimates Again in Its Next Earnings Report?,https://images.financialmodelingprep.com/news/will-meta-platforms-meta-beat-estimates-again-in-its-20250409.jpg,zacks.com,Meta Platforms (META) has an impressive earnings surprise history and currently possesses the right combination of the two key ingredients for a likely beat in its next quarterly report.,https://www.zacks.com/stock/news/2442805/will-meta-platforms-meta-beat-estimates-again-in-its-next-earnings-report?cid=CS-STOCKNEWSAPI-FT-tale_of_the_tape|yseop_template_7-2442805
META,2025-04-09 12:29:22,Meta Platforms (NASDAQ: META) Price Prediction and Forecast 2025-2030 for April 9,https://images.financialmodelingprep.com/news/meta-platforms-nasdaq-meta-price-prediction-and-forecast-20252030-20250409.jpg,247wallst.com,Shares of Meta Platforms Inc. (NASDAQ: META) were down -0.58% during a.m.,https://247wallst.com/technology-3/2025/04/09/meta-platforms-meta-price-prediction-and-forecast-2025-2030/
META,2025-04-09 11:39:13,"Meta, IBM, Palo Alto Networks: Why Stephanie Link Is Doubling Down On These Tariff-Proof Tech Titans",https://images.financialmodelingprep.com/news/meta-ibm-palo-alto-networks-why-stephanie-link-is-20250409.jpg,benzinga.com,"As tariffs and trade war chatter send shivers down tech's spine, Stephanie Link of Hightower Advisors sees opportunity – especially in software and services names with recurring revenue and minimal exposure to global shocks.",https://www.benzinga.com/analyst-ratings/analyst-color/25/04/44716846/meta-ibm-palo-alto-networks-why-stephanie-link-doubling-down-tariff-proof-tech-titans
META,2025-04-09 09:21:21,"Meta undermined US national security, whistleblower will testify",https://images.financialmodelingprep.com/news/meta-undermined-us-national-security-whistleblower-will-testify-20250409.jpg,foxbusiness.com,Meta whistleblower Sarah Wynn-Williams will testify before senators that Mark Zuckerberg's company undermined national security through its ties to China.,https://www.foxbusiness.com/politics/meta-undermined-us-national-security-whistleblower-testify
META,2025-04-09 05:00:02,Author of explosive Meta memoir to star at US Senate hearing,https://images.financialmodelingprep.com/news/author-of-explosive-meta-memoir-to-star-at-us-20250409.jpg,techxplore.com,The former Facebook employee behind a scathing book about parent company Meta will testify Wednesday before US senators keen to establish whether the social networking giant ever collaborated with the Chinese government.,https://techxplore.com/news/2025-04-author-explosive-meta-memoir-star.html
META,2025-04-09 02:56:10,"Meta exec to testify before Congress; alleges China contact, says newswire",https://images.financialmodelingprep.com/news/meta-exec-to-testify-before-congress-alleges-china-contact-20250409.jpg,proactiveinvestors.co.uk,"Sarah Wynn-Williams, a former Meta Platforms Inc (NASDAQ:META, ETR:FB2A, SWX:FB) executive, is set to testify before the US Senate later on Wednesday, alleging that the company undermined American national security while fostering ties with China. In prepared remarks cited by Bloomberg, Wynn-Williams claims Meta briefed Chinese officials on emerging technologies, including artificial intelligence, as early as 2015, with the aim of helping China surpass US firms.",https://www.proactiveinvestors.co.uk/companies/news/1069353
META,2025-04-08 16:00:43,META vs. Pinterest: Which Social Media Stock is a Better Buy?,https://images.financialmodelingprep.com/news/meta-vs-pinterest-which-social-media-stock-is-a-20250408.jpg,zacks.com,"Meta Platforms META and Pinterest PINS are well-known social commerce providers. Social commerce is a subset of e-commerce, which essentially means using social media platforms to promote and sell products or services.",https://www.zacks.com/stock/news/2442196/meta-vs-pinterest-which-social-media-stock-is-a-better-buy?cid=CS-STOCKNEWSAPI-FT-analyst_blog|most_popular_stocks-2442196
META,2025-04-08 10:45:43,Why Meta Platforms (META) is a Top Growth Stock for the Long-Term,https://images.financialmodelingprep.com/news/why-meta-platforms-meta-is-a-top-growth-stock-20250408.jpg,zacks.com,"Wondering how to pick strong, market-beating stocks for your investment portfolio? Look no further than the Zacks Style Scores.",https://www.zacks.com/stock/news/2441907/why-meta-platforms-meta-is-a-top-growth-stock-for-the-long-term?cid=CS-STOCKNEWSAPI-FT-tale_of_the_tape|zacks_education_growth_score-2441907
META,2025-04-08 10:04:47,Parental controls on Instagram expanded - and brought to Facebook,https://images.financialmodelingprep.com/news/parental-controls-on-instagram-expanded-and-brought-to-facebook-20250408.jpg,news.sky.com,Teenagers using Instagram will be prevented from using some of its features without parental permission as part from an update to the app.,https://news.sky.com/story/parental-controls-on-instagram-expanded-and-brought-to-facebook-13344366
META,2025-04-08 08:47:42,"EXCLUSIVE: Meta's Still The Mag 7 Standout, Says Expert - But Can It Hold On?",https://images.financialmodelingprep.com/news/exclusive-metas-still-the-mag-7-standout-says-expert-20250408.jpg,benzinga.com,"Meta Platforms Inc. META has been an unlikely standout in a turbulent tech year, but the chart suggests the party might be coming to an end.",https://www.benzinga.com/25/04/44683681/exclusive-metas-still-the-mag-7-standout-says-expert-but-can-it-hold-on
