symbol,publishedDate,title,image,site,text,url
META,2025-05-28 11:56:17,"Meta plans to expand its retail footprint, internal communication shows",https://images.financialmodelingprep.com/news/meta-plans-to-expand-its-retail-footprint-internal-communication-20250528.jpg,businessinsider.com,"Meta is planning to open physical stores and hire retail workers, a move that could mirror Apple's retail strategy. Meta has an ongoing project to expand its retail footprint, an internal communication seen by BI shows.",https://www.businessinsider.com/meta-retail-stores-expansion-virtual-reality-2025-5
META,2025-05-28 10:25:00,"Protect Your Investment: Contact Levi & Korsinsky About the Meta Platforms, Inc. (META) Investigation",https://images.financialmodelingprep.com/news/protect-your-investment-contact-levi-korsinsky-about-the-meta-20250528.jpg,accessnewswire.com,"NEW YORK, NY / ACCESS Newswire / May 28, 2025 / Levi & Korsinsky notifies investors that it has commenced an investigation of Meta Platforms, Inc. (""Meta Platforms, Inc."") (NASDAQ:META) concerning possible violations of federal securities laws. The Wall Street Journal published an article on May 15, 2025, entitled ""Meta Is Delaying the Rollout of Its Flagship AI Model.",https://www.accessnewswire.com/newsroom/en/business-and-professional-services/protect-your-investment-contact-levi-and-korsinsky-about-the-met-1032717
META,2025-05-28 10:00:00,"Bronstein, Gewirtz & Grossman, LLC Is Investigating Meta Platforms, Inc. (META) And Encourages Investors to Connect",https://images.financialmodelingprep.com/news/bronstein-gewirtz-grossman-llc-is-investigating-meta-platforms-inc-20250528.jpg,accessnewswire.com,"NEW YORK CITY, NY / ACCESS Newswire / May 28, 2025 / Bronstein, Gewirtz & Grossman, LLC is investigating potential claims on behalf of purchasers of Meta Platforms, Inc. (""Meta"" or ""the Company"") (NASDAQ:META). Investors who purchased Meta securities are encouraged to obtain additional information and assist the investigation by visiting the firm's site: bgandg.com/META.",https://www.accessnewswire.com/newsroom/en/business-and-professional-services/bronstein-gewirtz-and-grossman-llc-is-investigating-meta-platfor-1029656
META,2025-05-28 08:38:09,Meta's Institutional & Insider Data Fuels Bulls Despite Disparity,https://images.financialmodelingprep.com/news/metas-institutional-insider-data-fuels-bulls-despite-disparity-20250528.jpg,marketbeat.com,"Magnificent Seven stock Meta Platforms NASDAQ: META is seeing a huge divergence in trading activity when it comes to two important groups: institutions and insiders. This analysis will dive into what these groups each are indicating about Meta going forward, and provide perspective on what they mean overall.",https://www.marketbeat.com/originals/metas-institutional-and-insider-data-fuels-bulls-despite-disparity/
META,2025-05-28 07:15:27,The Magnificent 7 Earnings Finale,https://images.financialmodelingprep.com/news/the-magnificent-7-earnings-finale-20250528.jpg,seekingalpha.com,Listen on the go! A daily podcast of Wall Street Breakfast will be available by 8:00 a.m.,https://seekingalpha.com/article/4790402-the-magnificent-7-earnings-finale
META,2025-05-28 04:25:00,Is Meta Platforms' Business in Trouble?,https://images.financialmodelingprep.com/news/is-meta-platforms-business-in-trouble-20250528.jpg,fool.com,"Meta Platforms (META 2.32%), the social media giant that owns Facebook, Instagram, and WhatsApp, has been a growth beast in recent years. Its revenue is growing at a fast pace, and the stock is soaring.",https://www.fool.com/investing/2025/05/28/is-meta-platforms-business-in-trouble/
META,2025-05-27 18:12:11,Circle IPO has peculiar Facebook-like characteristic,https://images.financialmodelingprep.com/news/circle-ipo-has-peculiar-facebooklike-characteristic-20250527.jpg,cnbc.com,"In its updated IPO prospectus on Tuesday, Circle indicated that most of the shares being sold in the offering are coming from existing stakeholders rather than the company. Circle co-founders Jeremy Allaire and Sean Neville have said they're selling shares in the stablecoin issuer's offering, alongside other directors and venture investors.",https://www.cnbc.com/2025/05/27/circle-ipo-has-peculiar-facebook-like-characteristic.html
META,2025-05-27 17:05:09,"Gas, Nuclear, Renewables Battle Over Power For Meta's New Data Center",https://images.financialmodelingprep.com/news/gas-nuclear-renewables-battle-over-power-for-metas-new-20250527.jpg,forbes.com,"Meta, the company that owns Facebook, are planning a new AI data center, the company's largest yet, in Richland Parish, Louisiana. The local utility company, Entergy, has plans to build three new gas-fired power plants to supply the additional electricity needed for the data center.",https://www.forbes.com/sites/ianpalmer/2025/05/27/gas-nuclear-renewables-battle-over-power-for-metas-new-data-center/
META,2025-05-27 16:46:34,Zuckerberg's Bet on MAGA Has Yet to Pay Off for Meta,https://images.financialmodelingprep.com/news/zuckerbergs-bet-on-maga-has-yet-to-pay-off-20250527.jpg,youtube.com,"Mark Zuckerberg has gotten close with President Trump and the White House, but those ties have yet to bear fruit for his social media company, Meta. Bloomberg's Riley Griffin discusses her latest Big Take with Caroline Hyde and Ed Ludlow on ""Bloomberg Technology.",https://www.youtube.com/watch?v=TGfHasR_bmA
META,2025-05-27 15:49:12,Meta's Fate Now Rests With a Judge,https://images.financialmodelingprep.com/news/metas-fate-now-rests-with-a-judge-20250527.jpg,nytimes.com,A landmark antitrust trial accusing the social media giant of cementing its dominance through acquiring Instagram and WhatsApp has concluded.,https://www.nytimes.com/2025/05/27/technology/meta-antitrust-trial-concludes.html
META,2025-05-27 15:12:34,Meta reportedly splits its AI team to build products faster,https://images.financialmodelingprep.com/news/meta-reportedly-splits-its-ai-team-to-build-products-20250527.jpg,techcrunch.com,"Meta is dividing its AI department into two new teams, according to a report from Axios. Now, the company's AI personnel will be assigned to an AI products team, or an AGI Foundations unit.",https://techcrunch.com/2025/05/27/meta-reportedly-splits-its-ai-team-to-build-products-faster/
META,2025-05-27 12:30:00,"Lost Money on Meta Platforms, Inc. (META)? Contact Levi & Korsinsky to Protect Your Rights",https://images.financialmodelingprep.com/news/lost-money-on-meta-platforms-inc-meta-contact-levi-20250527.jpg,accessnewswire.com,"NEW YORK, NY / ACCESS Newswire / May 27, 2025 / Levi & Korsinsky notifies investors that it has commenced an investigation of Meta Platforms, Inc. (""Meta Platforms, Inc."") (NASDAQ:META) concerning possible violations of federal securities laws. The Wall Street Journal published an article on May 15, 2025, entitled ""Meta Is Delaying the Rollout of Its Flagship AI Model.",https://www.accessnewswire.com/newsroom/en/business-and-professional-services/lost-money-on-meta-platforms-inc.-meta-contact-levi-and-korsinsk-1032327
META,2025-05-27 12:00:00,"INVESTOR ALERT: Pomerantz Law Firm Investigates Claims On Behalf of Investors of Meta Platforms, Inc. - META",https://images.financialmodelingprep.com/news/investor-alert-pomerantz-law-firm-investigates-claims-on-behalf-of-investors-of-meta-20250527.jpg,accessnewswire.com,"NEW YORK, NY / ACCESS Newswire / May 27, 2025 / Pomerantz LLP is investigating claims on behalf of investors of Meta Platforms, Inc.(""Meta"" or the ""Company"") (NASDAQ:META). Such investors are advised to contact Danielle Peyton at newaction@pomlaw.com or 646-581-9980, ext.",https://www.accessnewswire.com/newsroom/en/business-and-professional-services/investor-alert-pomerantz-law-firm-investigates-claims-on-behalf-1032296
META,2025-05-27 10:15:00,"META Investor Notice: Levi & Korsinsky Investigates Meta Platforms, Inc. for Securities Law Violations",https://images.financialmodelingprep.com/news/meta-investor-notice-levi-korsinsky-investigates-meta-platforms-inc-for-20250527.jpg,accessnewswire.com,"NEW YORK, NY / ACCESS Newswire / May 27, 2025 / Levi & Korsinsky notifies investors that it has commenced an investigation of Meta Platforms, Inc. (""Meta Platforms, Inc."") (NASDAQ:META) concerning possible violations of federal securities laws. The Wall Street Journal published an article on May 15, 2025, entitled ""Meta Is Delaying the Rollout of Its Flagship AI Model.",https://www.accessnewswire.com/newsroom/en/business-and-professional-services/meta-investor-notice-levi-and-korsinsky-investigates-meta-platfo-1032223
META,2025-05-27 10:05:32,"Meta Platforms, Inc. (META) Is a Trending Stock: Facts to Know Before Betting on It",https://images.financialmodelingprep.com/news/meta-platforms-inc-meta-is-a-trending-stock-facts-20250527.jpg,zacks.com,"Meta Platforms (META) has been one of the stocks most watched by Zacks.com users lately. So, it is worth exploring what lies ahead for the stock.",https://www.zacks.com/stock/news/2477567/meta-platforms-inc-meta-is-a-trending-stock-facts-to-know-before-betting-on-it?cid=CS-STOCKNEWSAPI-FT-tale_of_the_tape|most_searched_stocks-2477567
META,2025-05-27 10:00:00,"Bronstein, Gewirtz & Grossman, LLC Encourages Meta Platforms, Inc. (META) Stockholders to Inquire about Securities Investigation",https://images.financialmodelingprep.com/news/bronstein-gewirtz-grossman-llc-encourages-meta-platforms-inc-meta-20250527.jpg,accessnewswire.com,"NEW YORK CITY, NY / ACCESS Newswire / May 27, 2025 / Bronstein, Gewirtz & Grossman, LLC is investigating potential claims on behalf of purchasers of Meta Platforms, Inc. (""Meta"" or ""the Company"") (NASDAQ:META). Investors who purchased Meta securities are encouraged to obtain additional information and assist the investigation by visiting the firm's site: bgandg.com/META.",https://www.accessnewswire.com/newsroom/en/business-and-professional-services/bronstein-gewirtz-and-grossman-llc-encourages-meta-platforms-inc-1029655
META,2025-05-27 02:57:34,"Meta: Attractive And Controversial, Like Always",https://images.financialmodelingprep.com/news/meta-attractive-and-controversial-like-always-20250527.jpg,seekingalpha.com,"Meta is a fairly easy investment to understand through the lens of its financials. It presently trades at about 16x enterprise value to family of apps operating profits, while growing at 20%. Exceptionally attractive. That said, with the rapid emergence of AI and an ongoing antitrust trial, Meta remains as controversial as ever.",https://seekingalpha.com/article/4789988-meta-attractive-and-controversial-like-always
META,2025-05-26 21:11:57,Meta's AI Optionality Advantage: Probability Makes The Stock A No-Brainer,https://images.financialmodelingprep.com/news/metas-ai-optionality-advantage-probability-makes-the-stock-a-20250526.jpg,seekingalpha.com,"Meta is making massive AI-driven bets across five high-upside tech trends to secure its next wave of growth. From autonomous AI advertising to AI-powered messaging and interactive content, each initiative significantly expands Meta's total addressable market. The company's vast user base, behavioral data, and platform integration give it a unique edge in deploying personalized and scalable AI solutions.",https://seekingalpha.com/article/4789935-metas-ai-optionality-advantage-probability-makes-the-stock-a-no-brainer
META,2025-05-26 11:30:00,ATTENTION META Investors: Securities Fraud Investigation Underway - Contact Levi & Korsinsky,https://images.financialmodelingprep.com/news/attention-meta-investors-securities-fraud-investigation-underway-contact-levi-20250526.jpg,accessnewswire.com,"NEW YORK, NY / ACCESS Newswire / May 26, 2025 / Levi & Korsinsky notifies investors that it has commenced an investigation of Meta Platforms, Inc. (""Meta Platforms, Inc."") (NASDAQ:META) concerning possible violations of federal securities laws. The Wall Street Journal published an article on May 15, 2025, entitled ""Meta Is Delaying the Rollout of Its Flagship AI Model.",https://www.accessnewswire.com/newsroom/en/business-and-professional-services/attention-meta-investors-securities-fraud-investigation-underway-1031893
META,2025-05-26 10:00:00,"Bronstein, Gewirtz & Grossman, LLC Announces an Investigation Against Meta Platforms, Inc. (META) and Encourages Investors to Learn More About the Investigation",https://images.financialmodelingprep.com/news/bronstein-gewirtz-grossman-llc-announces-an-investigation-against-meta-20250526.jpg,accessnewswire.com,"NEW YORK CITY, NY / ACCESS Newswire / May 26, 2025 / Bronstein, Gewirtz & Grossman, LLC is investigating potential claims on behalf of purchasers of Meta Platforms, Inc. (""Meta"" or ""the Company"") (NASDAQ:META). Investors who purchased Meta securities are encouraged to obtain additional information and assist the investigation by visiting the firm's site: bgandg.com/META.",https://www.accessnewswire.com/newsroom/en/business-and-professional-services/bronstein-gewirtz-and-grossman-llc-announces-an-investigation-ag-1029654
META,2025-05-26 10:00:00,"INVESTOR ALERT: Pomerantz Law Firm Investigates Claims On Behalf of Investors of Meta Platforms, Inc. - META",https://images.financialmodelingprep.com/news/investor-alert-pomerantz-law-firm-investigates-claims-on-behalf-of-investors-of-meta-20250526.jpg,prnewswire.com,"NEW YORK , May 26, 2025 /PRNewswire/ -- Pomerantz LLP is investigating claims on behalf of investors of  Meta Platforms, Inc. (""Meta"" or the ""Company"") (NASDAQ: META).  Such investors are advised to contact Danielle Peyton at newaction@pomlaw.com or 646-581-9980, ext.",https://www.prnewswire.com/news-releases/investor-alert-pomerantz-law-firm-investigates-claims-on-behalf-of-investors-of-meta-platforms-inc---meta-302463576.html
META,2025-05-26 07:00:00,7 Artificial Intelligence (AI) Stocks to Buy Right Now,https://images.financialmodelingprep.com/news/7-artificial-intelligence-ai-stocks-to-buy-right-now-20250526.jpg,fool.com,"Artificial intelligence (AI) is rapidly evolving from a futuristic concept to the defining technology of our era. With generative AI alone projected to add trillions in economic value by 2030, we're witnessing the early stages of a transformation that will reshape every industry.",https://www.fool.com/investing/2025/05/26/7-artificial-intelligence-ai-stocks-to-buy-right-n/
META,2025-05-26 06:01:19,Meta's panic about ‘groomers' targeting minors on Instagram surfaces at FTC antitrust trial,https://images.financialmodelingprep.com/news/metas-panic-about-groomers-targeting-minors-on-instagram-surfaces-20250526.jpg,nypost.com,"Mark Zuckerberg's Meta knew Instagram was steering underage users toward online creeps and other harmful content – even as it shot down requests by cofounder Kevin Systrom and others to commit more resources for safety, according to bombshell documents that surfaced at the FTC's antitrust trial.",https://nypost.com/2025/05/26/business/metas-panic-about-groomers-targeting-minors-on-instagram-surfaces-at-ftc-antitrust-trial/
META,2025-05-26 05:00:01,Meta's Llama AI team has been bleeding talent. Many top researchers have joined French AI startup Mistral.,https://images.financialmodelingprep.com/news/metas-llama-ai-team-has-been-bleeding-talent-many-20250526.jpg,businessinsider.com,Meta's AI team has faced a talent drain as key Llama model creators have exited. The departures raise concerns about Meta's ability to retain top AI talent.,https://www.businessinsider.com/meta-llama-ai-talent-mistral-2025-5
META,2025-05-26 04:46:00,3 Top Growth Stocks to Buy in the Second Half of 2025,https://images.financialmodelingprep.com/news/3-top-growth-stocks-to-buy-in-the-second-20250526.jpg,fool.com,"Believe it or not, but we're not far away from being halfway through the year. Time flies when you're having fun -- and when you're not having fun, too.",https://www.fool.com/investing/2025/05/26/3-top-growth-stocks-to-buy-in-the-second-half-of-2/
META,2025-05-26 03:00:00,"Largest U.S. Pension Sells Apple Stock, Buys Meta, AMD, and McDonald's",https://images.financialmodelingprep.com/news/largest-us-pension-sells-apple-stock-buys-meta-amd-20250526.jpg,barrons.com,Apple is shifting production of iPhones it will sell in the U.S. away from China.,https://www.barrons.com/articles/apple-stock-meta-amd-mcdonalds-342abfe5
META,2025-05-25 11:00:00,"ATTENTION Meta Platforms, Inc. (META) Investors: Possible Fraud - Contact Levi & Korsinsky Today",https://images.financialmodelingprep.com/news/attention-meta-platforms-inc-meta-investors-possible-fraud-contact-20250525.jpg,accessnewswire.com,"NEW YORK, NY / ACCESS Newswire / May 25, 2025 / Levi & Korsinsky notifies investors that it has commenced an investigation of Meta Platforms, Inc. (""Meta Platforms, Inc."") (NASDAQ:META) concerning possible violations of federal securities laws. The Wall Street Journal published an article on May 15, 2025, entitled ""Meta Is Delaying the Rollout of Its Flagship AI Model.",https://www.accessnewswire.com/newsroom/en/business-and-professional-services/attention-meta-platforms-inc.-meta-investors-possible-fraud-cont-1031752
META,2025-05-25 10:00:00,"Meta Platforms, Inc. (META) Investigation: Bronstein, Gewirtz & Grossman, LLC Encourages Shareholders to Contact the Firm to Learn More About the Investigation",https://images.financialmodelingprep.com/news/meta-platforms-inc-meta-investigation-bronstein-gewirtz-grossman-llc-20250525.jpg,accessnewswire.com,"NEW YORK CITY, NY / ACCESS Newswire / May 25, 2025 / Bronstein, Gewirtz & Grossman, LLC is investigating potential claims on behalf of purchasers of Meta Platforms, Inc. (""Meta"" or ""the Company"") (NASDAQ:META). Investors who purchased Meta securities are encouraged to obtain additional information and assist the investigation by visiting the firm's site: bgandg.com/META.",https://www.accessnewswire.com/newsroom/en/business-and-professional-services/meta-platforms-inc.-meta-investigation-bronstein-gewirtz-and-gro-1029653
META,2025-05-24 18:01:00,"Securities Investigation: Levi & Korsinsky Investigates Meta Platforms, Inc. (META) on Behalf of Investors",https://images.financialmodelingprep.com/news/securities-investigation-levi-korsinsky-investigates-meta-platforms-inc-meta-20250524.jpg,accessnewswire.com,"NEW YORK, NY / ACCESS Newswire / May 24, 2025 / Levi & Korsinsky notifies investors that it has commenced an investigation of Meta Platforms, Inc. (""Meta Platforms, Inc."") (NASDAQ:META) concerning possible violations of federal securities laws. The Wall Street Journal published an article on May 15, 2025, entitled ""Meta Is Delaying the Rollout of Its Flagship AI Model.",https://www.accessnewswire.com/newsroom/en/business-and-professional-services/securities-investigation-levi-and-korsinsky-investigates-meta-pl-1031665
META,2025-05-24 09:00:00,"INVESTOR ALERT: Pomerantz Law Firm Investigates Claims On Behalf of Investors of Meta Platforms, Inc. - META",https://images.financialmodelingprep.com/news/investor-alert-pomerantz-law-firm-investigates-claims-on-behalf-of-investors-of-meta-20250524.jpg,accessnewswire.com,"NEW YORK CITY, NY / ACCESS Newswire / May 24, 2025 / Pomerantz LLP is investigating claims on behalf of investors of Meta Platforms, Inc.(""Meta"" or the ""Company"") (NASDAQ:META). Such investors are advised to contact Danielle Peyton at newaction@pomlaw.com or 646-581-9980, ext.",https://www.accessnewswire.com/newsroom/en/business-and-professional-services/investor-alert-pomerantz-law-firm-investigates-claims-on-behalf-1030523
META,2025-05-24 08:00:30,"Meta, Broadcom Lead Five Stocks Forging New Buy Points In Market Pullback",https://images.financialmodelingprep.com/news/meta-broadcom-lead-five-stocks-forging-new-buy-points-20250524.jpg,investors.com,"Meta Platforms and Broadcom have new, lower buy points as the market pullback allowed the AI giants to forge handles last week.",https://www.investors.com/news/meta-stock-broadcom-stock-handle-buy-point-earnings-bj-on-ai-tariffs/
META,2025-05-24 08:00:00,5 Best CEFs This Month For Yields Up To 14% (May 2025),https://images.financialmodelingprep.com/news/5-best-cefs-this-month-for-yields-up-to-20250524.jpg,seekingalpha.com,"For income investors, closed-end funds, or CEFs, remain an attractive investment class that covers various asset classes and promises high distributions and reasonable total returns. CEFs, are generally characterized by higher volatility and deeper drawdowns than the broader market. For these reasons, they are not suited for everyone. In this monthly series, we highlight five CEFs with solid track records that pay high distributions and offer ""excess"" discounts. We try to separate the wheat from the chaff using our filtering process to select just five CEFs every month from around 500 closed-end funds.",https://seekingalpha.com/article/4788928-5-best-cefs-this-month-for-yields-up-to-14-percent-may-2025
META,2025-05-24 06:45:00,3 Reasons to Buy This Artificial Intelligence (AI) Stock Like There Is No Tomorrow,https://images.financialmodelingprep.com/news/3-reasons-to-buy-this-artificial-intelligence-ai-stock-20250524.jpg,fool.com,"Artificial intelligence (AI) isn't new, but novel applications of the technology have become extremely popular in the past few years. Demand for AI-based services is already high, but according to some experts, we're arguably still in the early innings of this revolution.",https://www.fool.com/investing/2025/05/24/3-reasons-to-buy-this-artificial-intelligence-ai/
META,2025-05-23 16:20:02,German court says Meta can use user data to train AI,https://images.financialmodelingprep.com/news/german-court-says-meta-can-use-user-data-to-20250523.jpg,techxplore.com,A German court on Friday dismissed an injunction request brought by consumer protection groups to prevent US tech giant Meta from using user data from Facebook and Instagram to train artificial intelligence systems.,https://techxplore.com/news/2025-05-german-court-meta-user-ai.html
META,2025-05-23 10:15:00,"Lost Money on Meta Platforms, Inc. (META)? Possible Fraud - Contact Levi & Korsinsky Today",https://images.financialmodelingprep.com/news/lost-money-on-meta-platforms-inc-meta-possible-fraud-contact-20250523.jpg,accessnewswire.com,"NEW YORK, NY / ACCESS Newswire / May 23, 2025 / Levi & Korsinsky notifies investors that it has commenced an investigation of Meta Platforms, Inc. (""Meta Platforms, Inc."") (NASDAQ:META) concerning possible violations of federal securities laws. The Wall Street Journal published an article on May 15, 2025, entitled ""Meta Is Delaying the Rollout of Its Flagship AI Model.",https://www.accessnewswire.com/newsroom/en/business-and-professional-services/lost-money-on-meta-platforms-inc.-meta-possible-fraud-contact-le-1031279
META,2025-05-23 10:00:00,"Bronstein, Gewirtz & Grossman, LLC Initiates an Investigation into Allegations Against Meta Platforms, Inc. (META) And Encourages Stockholders to Reach Out",https://images.financialmodelingprep.com/news/bronstein-gewirtz-grossman-llc-initiates-an-investigation-into-allegations-20250523.jpg,accessnewswire.com,"NEW YORK CITY, NY / ACCESS Newswire / May 23, 2025 / Bronstein, Gewirtz & Grossman, LLC is investigating potential claims on behalf of purchasers of Meta Platforms, Inc. (""Meta"" or ""the Company"") (NASDAQ:META). Investors who purchased Meta securities are encouraged to obtain additional information and assist the investigation by visiting the firm's site: bgandg.com/META.",https://www.accessnewswire.com/newsroom/en/business-and-professional-services/bronstein-gewirtz-and-grossman-llc-initiates-an-investigation-in-1029652
META,2025-05-23 09:09:48,German rights group fails in bid stop Meta's data use for AI,https://images.financialmodelingprep.com/news/german-rights-group-fails-in-bid-stop-metas-data-20250523.jpg,reuters.com,A German consumer rights group on Friday failed to win a court injunction to stop Meta Platforms from training its artificial intelligence models with Facebook and Instagram user posts.,https://www.reuters.com/sustainability/boards-policy-regulation/german-rights-group-fails-bid-stop-metas-data-use-ai-2025-05-23/
META,2025-05-22 18:30:00,"Award-Winning Designer Maryna Karpenko Honored for Shaping Consumer and B2B Experiences at Meta, Mattermost, Hily, and Wavechat",https://images.financialmodelingprep.com/news/awardwinning-designer-maryna-karpenko-honored-for-shaping-consumer-and-20250522.jpg,globenewswire.com,"Award-winning product designer Maryna Karpenko is recognized for her leadership in shaping messaging and live-streaming experiences at Meta, Mattermost, Hily, and Wavechat. She has earned top industry honors for her work connecting millions of users worldwide.",https://www.globenewswire.com/news-release/2025/05/22/3087195/0/en/Award-Winning-Designer-Maryna-Karpenko-Honored-for-Shaping-Consumer-and-B2B-Experiences-at-Meta-Mattermost-Hily-and-Wavechat.html
META,2025-05-22 17:22:24,"Stocks Mixed After House OKs Trump Tax Bill; Amazon, Broadcom, Meta Eye Latest Buy Points",https://images.financialmodelingprep.com/news/stocks-mixed-after-house-oks-trump-tax-bill-amazon-20250522.jpg,investors.com,"The stock market closed mixed Thursday after the House's passage of the Trump tax bill. Amazon, Broadcom and Meta are near buy points.",https://www.investors.com/market-trend/the-big-picture/stock-market-trump-tax-bill-amazon-broadcom-meta-buy-points/
