symbol,publishedDate,title,image,site,text,url
META,2025-05-01 09:20:28,"Nasdaq 100: Bullish Rebound in Tech Stocks Today on Strong Microsoft, Meta Earnings",https://images.financialmodelingprep.com/news/nasdaq-100-bullish-rebound-in-tech-stocks-today-on-20250501.jpg,fxempire.com,"Tech stocks rally as Microsoft and Meta post strong earnings, lifting the Nasdaq 100 and boosting confidence in AI despite weak U.S. economic data.",https://www.fxempire.com/forecasts/article/nasdaq-100-bullish-rebound-in-tech-stocks-today-on-strong-microsoft-meta-earnings-1515650
META,2025-05-01 09:15:00,Meta Earnings Green Light AI Rally,https://images.financialmodelingprep.com/news/meta-earnings-green-light-ai-rally-20250501.jpg,seekingalpha.com,"Meta Platforms stock experienced a significant decline but remains a strong buy due to its monopolistic presence and solid earnings, despite short-term volatility. Meta's recent earnings beat estimates with a 23% EPS increase and strong ad spending, projecting Q2 sales of $42.5–45.5B. Meta's forward P/E ratio of 17–20 is attractive given its growth prospects; future EPS growth could return to 15–20%.",https://seekingalpha.com/article/4780384-meta-earnings-green-light-ai-rally
META,2025-05-01 09:06:35,Meta Surges on Earnings Strength,https://images.financialmodelingprep.com/news/meta-surges-on-earnings-strength-20250501.jpg,fool.com,Here's our initial take on Meta Platforms' (META -1.08%) first-quarter financial report.,https://www.fool.com/investing/2025/05/01/meta-surges-on-earnings-strength/
META,2025-05-01 08:48:30,Meta Is Recession-Proof: Maintaining Buy Post-Earnings,https://images.financialmodelingprep.com/news/meta-is-recessionproof-maintaining-buy-postearnings-20250501.jpg,seekingalpha.com,"Meta reported a homerun kind of quarter on Wednesday, reversing concerns over ad impact from tariff triggered by Snap. Despite market fears, Meta's ad spend resilience, limited Chinese exposure, and market leadership favorably position it against competitors like Snapchat and Pinterest. Meta's AI-driven ad innovations, including the new Generative Ads Recommendation Model, enhance ad conversion rates and efficiency, bolstering its competitive edge.",https://seekingalpha.com/article/4780376-meta-is-recession-proof-maintaining-buy-post-earnings
META,2025-05-01 08:45:39,Meta: A No-Brainer Growth Play,https://images.financialmodelingprep.com/news/meta-a-nobrainer-growth-play-20250501.jpg,seekingalpha.com,"Meta exceeded Q1'25 earnings and revenue estimates, driven by strong digital advertising and user growth, with a 16% Y/Y revenue increase to $42.3B. Meta's average ad prices rose 10% Y/Y, and the social media company generated $10.3B in free cash flow in Q1'25. Meta's guidance for Q2'25 implies double-digit Y/Y top-line growth. The firm also revised its CapEx guidance higher.",https://seekingalpha.com/article/4780375-meta-a-no-brainer-growth-play
META,2025-05-01 08:02:17,Nasdaq to head Wall Street rally after Microsoft and Meta earnings beats,https://images.financialmodelingprep.com/news/nasdaq-to-head-wall-street-rally-after-microsoft-and-20250501.jpg,proactiveinvestors.com,"Technology stocks are anticipated to lead a Wall Street rally to start the month of May on Thursday, following earnings from Microsoft and Meta Platforms overnight and ahead of more from Apple and Amazon after the close.  Futures markets are calling the Nasdaq 100 around 1.7% higher, ahead of the opening bell, with S&P 500 futures up 1.2% and those for the Dow Jones rising 0.8%.",https://www.proactiveinvestors.com/companies/news/1070532
META,2025-05-01 07:10:58,Meta's advertisers didn't flinch after it shook up content moderation,https://images.financialmodelingprep.com/news/metas-advertisers-didnt-flinch-after-it-shook-up-content-20250501.jpg,businessinsider.com,Meta's ad business is firing on all cylinders. That's despite rolling out major content moderation changes that could have spooked advertisers.,https://www.businessinsider.com/meta-earnings-advertisers-fact-checking-content-moderation-2025-5
META,2025-05-01 07:00:38,"Wall Street Breakfast Podcast: Meta, Microsoft Soar On AI, Cloud Strength",https://images.financialmodelingprep.com/news/wall-street-breakfast-podcast-meta-microsoft-soar-on-ai-20250501.jpg,seekingalpha.com,"Microsoft shares surged 7% premarket due to strong FQ3 results, with Azure growth at 33% and a 20% Y/Y rise in Microsoft Cloud. Meta Platforms shares rose 5% after a robust Q1 beat, with revenue up 16% Y/Y, profits up 35%, and daily active users beating expectations.",https://seekingalpha.com/article/4780363-wall-street-breakfast-podcast-meta-microsoft-soar-on-ai-cloud-strength
META,2025-05-01 05:19:00,Nvidia Stock Gains. What Microsoft and Meta Earnings Mean for the Chip Maker.,https://images.financialmodelingprep.com/news/nvidia-stock-gains-what-microsoft-and-meta-earnings-mean-20250501.jpg,barrons.com,Nvidia stock was rising after Microsoft and Meta Platforms signaled they will continue to spend heavily on AI data centers.,https://www.barrons.com/articles/nvidia-stock-price-meta-microsoft-earnings-91d6f11a
META,2025-05-01 03:45:01,"Meta, Microsoft shrug off tariff concerns to post Q1 beats",https://images.financialmodelingprep.com/news/meta-microsoft-shrug-off-tariff-concerns-to-post-q1-20250501.jpg,youtube.com,"Meta and Microsoft both score quarterly profit beats on the top and bottom line, unfazed by the Trump tariff war. Qualcomm, however, sees its stock fall in after-hours trade and concern about the levies begins to weigh on its guidance.",https://www.youtube.com/watch?v=yWgKtmeFOdU
META,2025-05-01 03:31:29,UK investors breathe sigh of relief as Meta delivers bullish update amid tech sector turbulence,https://images.financialmodelingprep.com/news/uk-investors-breathe-sigh-of-relief-as-meta-delivers-20250501.jpg,proactiveinvestors.co.uk,"Tens of thousands of UK savers with exposure to US technology stocks, whether through ISAs, SIPPs, or global equity funds, will be heartened by Meta Platforms Inc's (NASDAQ:META, ETR:FB2A, SWX:FB) stronger-than-expected first-quarter results, released after-hours Wednesday. Shares in the social media giant are on course to open more than 5% higher on Thursday, providing a much-needed boost after a rocky start to the year for the so-called ‘Magnificent Seven'.",https://www.proactiveinvestors.co.uk/companies/news/1070502
META,2025-04-30 21:38:33,Meta forecasted it would make $1.4T in revenue from generative AI by 2035,https://images.financialmodelingprep.com/news/meta-forecasted-it-would-make-14t-in-revenue-from-generative-20250430.jpg,techcrunch.com,"Meta made a prediction last year its generative AI products would rake in $2 billion to $3 billion in revenue in 2025, and between $460 billion and $1.4 trillion by 2035, according to court documents unsealed Wednesday.",https://techcrunch.com/2025/04/30/meta-forecasted-it-would-make-1-4t-in-revenue-from-generative-ai-by-2035/
META,2025-04-30 21:00:00,FEC Sponsors “Dubai Token 2049 Meta Crypto Oasis” Event — A Resounding Success,https://images.financialmodelingprep.com/news/fec-sponsors-dubai-token-2049-meta-crypto-oasis-event-20250430.jpg,globenewswire.com,"Dubai, UAE, April 30, 2025 (GLOBE NEWSWIRE) -- On April 29, 2025, the highly anticipated “Dubai Token 2049 Meta Crypto Oasis” event was successfully held in Dubai. FEC (Fortune Earning Coupon), the event's premier sponsor, played a pivotal role in ensuring the success of this major Web3 gathering.",https://www.globenewswire.com/news-release/2025/05/01/3072030/0/en/FEC-Sponsors-Dubai-Token-2049-Meta-Crypto-Oasis-Event-A-Resounding-Success.html
META,2025-04-30 20:40:17,"Meta Platforms, Inc. (META) Q1 2025 Earnings Call Transcript",https://images.financialmodelingprep.com/news/meta-platforms-inc-meta-q1-2025-earnings-call-transcript-20250430.jpg,seekingalpha.com,"Meta Platforms, Inc. (NASDAQ:META ) Q1 2025 Earnings Conference Call April 30, 2025 5:00 PM ET Company Participants Kenneth Dorell - Director, Investor Relations Mark Zuckerberg - Chief Executive Officer Susan Li - Chief Financial Officer Conference Call Participants Brian Nowak - Morgan Stanley Eric Sheridan - Goldman Sachs Justin Post - Bank of America Doug Anmuth - JPMorgan Mark Shmulik - Bernstein Ross Sandler - Barclays Kenneth Gawrelski - Wells Fargo Youssef Squali - Truist Securities Mark Mahaney - Evercore ISI Operator Good afternoon. My name is Krista, and I will be your conference operator today.",https://seekingalpha.com/article/4780182-meta-platforms-inc-meta-q1-2025-earnings-call-transcript
META,2025-04-30 20:24:23,Meta Leans Into AI and Subscriptions to Future-Proof Its Ecosystem,https://images.financialmodelingprep.com/news/meta-leans-into-ai-and-subscriptions-to-futureproof-its-20250430.jpg,pymnts.com,Meta CEO Mark Zuckerberg said Wednesday (April 30) that the social media giant will increase its spending for artificial intelligence (AI) data centers this year as it embeds the technology more deeply throughout its family of apps.,https://www.pymnts.com/meta/2025/meta-leans-into-ai-and-subscriptions-to-future-proof-its-ecosystem/
META,2025-04-30 19:51:20,Meta says China retailers are reducing digital ad spend,https://images.financialmodelingprep.com/news/meta-says-china-retailers-are-reducing-digital-ad-spend-20250430.jpg,cnbc.com,"Chinese online retailers have cut back their spending on Facebook and Instagram ads in reaction to President Donald Trump's tough trade policy with the country. Meta's finance chief Susan Li said Wednesday that ""Asia-based e-commerce exporters"" have reduced their spending with the social media company.",https://www.cnbc.com/2025/04/30/meta-says-china-retailers-are-reducing-digital-ad-spend.html
META,2025-04-30 19:16:00,Meta's blowout earnings show why investors shouldn't sweat a boost to AI spending,https://images.financialmodelingprep.com/news/metas-blowout-earnings-show-why-investors-shouldnt-sweat-a-boost-20250430.jpg,marketwatch.com,"Facebook's parent company, Meta Platforms Inc., delivered a strong earnings beat on Wednesday, and that's likely easing investor concerns over big spending on artificial intelligence.",https://www.marketwatch.com/story/metas-blowout-earnings-show-why-investors-shouldnt-sweat-a-boost-to-ai-spending-a1b4fa7d
META,2025-04-30 19:01:15,"Steady PCE, Higher Pending Home Sales, Help Bolster Hump Day Trading",https://images.financialmodelingprep.com/news/steady-pce-higher-pending-home-sales-help-bolster-hump-20250430.jpg,zacks.com,"While PCE month over month was flat on both headline and core, Pending Home Sales increased and late earnings reports posted beats.",https://www.zacks.com/stock/news/2459491/steady-pce-higher-pending-home-sales-help-bolster-hump-day-trading?cid=CS-STOCKNEWSAPI-FT-ahead_of_wall_street-2459491
META,2025-04-30 18:55:45,Meta Q1 earnings & revenue beat Wall Street expectations,https://images.financialmodelingprep.com/news/meta-q1-earnings-revenue-beat-wall-street-expectations-20250430.jpg,youtube.com,Meta (META) posted better-than-expected first quarter results on Wednesday. The tech giant also announced it was boosting its spending to advance its AI push.,https://www.youtube.com/watch?v=qMiuqTXoWEs
META,2025-04-30 18:46:06,Meta Boosts Spending Plans to Grow Its AI Capacity,https://images.financialmodelingprep.com/news/meta-boosts-spending-plans-to-grow-its-ai-capacity-20250430.jpg,investopedia.com,America's tech giants aren't showing signs of slowing AI spending plans despite a stretch of economic uncertainty that has meant tough times for technology shares.,https://www.investopedia.com/meta-boosts-spending-plans-to-grow-its-ai-capacity-stock-facebook-zuckerberg-11725409
META,2025-04-30 18:45:00,Meta: An Exceptional Q1 2025 That Spreads Optimism Across The Markets (Upgrade),https://images.financialmodelingprep.com/news/meta-an-exceptional-q1-2025-that-spreads-optimism-across-20250430.jpg,seekingalpha.com,"Meta Platforms, Inc.'s Q1 2025 results are outstanding, with double-digit revenue growth, a 27% increase in operating income, and a 35% rise in net income. Family Daily Active People, or DAP, reached 3.43 billion, showcasing Meta's unparalleled user base and effective AI-driven advertising, boosting ad revenues by 16%. CapEx spending is revised upward to $64-$72 billion for 2025, primarily for AI advancements, indicating strong demand and future cash flow potential.",https://seekingalpha.com/article/4780127-meta-an-exceptional-q1-2025-that-spreads-optimism-across-the-markets-upgrade
META,2025-04-30 18:37:38,"Microsoft, Meta, and Qualcomm, and Robinhood report earnings",https://images.financialmodelingprep.com/news/microsoft-meta-and-qualcomm-and-robinhood-report-earnings-20250430.jpg,youtube.com,"Market Domination anchors Julie Hyman and Josh Lipton break down the latest earnings for Microsoft, Meta, Qualcomm, and Robinhood. They also speak to analysts to break down key takeaways for investors.",https://www.youtube.com/watch?v=syfwgkTQwJk
META,2025-04-30 18:30:00,"Meta Platforms: Huge Beat And Raise, Valuation Remains Attractive",https://images.financialmodelingprep.com/news/meta-platforms-huge-beat-and-raise-valuation-remains-attractive-20250430.jpg,seekingalpha.com,"Meta Platforms, Inc. reported strong earnings with a double beat, showing a 16% revenue increase, driven by user growth and higher ad prices. META's valuation remains attractive at 22x forward earnings, with potential for upward revisions following the Q1 earnings beat. META's Q2 guidance is strong, and cost efficiency improvements are expected, although higher capital expenditures might slightly impact free cash flow and buybacks.",https://seekingalpha.com/article/4780124-meta-platforms-huge-beat-and-raise-valuation-remains-attractive
META,2025-04-30 18:16:27,"Final Trade: SBUX, META, XLV and BABA",https://images.financialmodelingprep.com/news/final-trade-sbux-meta-xlv-and-baba-20250430.jpg,youtube.com,The final trades of the day with CNBC's Melissa Lee and the Fast Money traders.,https://www.youtube.com/watch?v=C_u2G9jGgBI
META,2025-04-30 18:15:29,Meta Platforms (META) Q1 Earnings and Revenues Top Estimates,https://images.financialmodelingprep.com/news/meta-platforms-meta-q1-earnings-and-revenues-top-estimates-20250430.jpg,zacks.com,"Meta Platforms (META) came out with quarterly earnings of $6.43 per share, beating the Zacks Consensus Estimate of $5.22 per share. This compares to earnings of $4.71 per share a year ago.",https://www.zacks.com/stock/news/2459426/meta-platforms-meta-q1-earnings-and-revenues-top-estimates?cid=CS-STOCKNEWSAPI-FT-tale_of_the_tape|yseop_template_4-2459426
META,2025-04-30 18:15:10,"Meta Beats Q1 Earnings And Rallies 5% After Hours--Still, I'm Staying Put",https://images.financialmodelingprep.com/news/meta-beats-q1-earnings-and-rallies-5-after-hoursstill-im-20250430.jpg,seekingalpha.com,"Meta Platforms, Inc. just released its first quarter earnings and vastly beat both revenue and EPS. META stock rallied 5% after hours immediately after the release came out. Still, there were areas of concern in the release; for example, the company's free cash flow declined precipitously on increased CAPEX spend.",https://seekingalpha.com/article/4780121-meta-beats-q1-earnings-and-rallies-5-percent-after-hours-still-im-staying-put
META,2025-04-30 17:55:03,"Meta is showing tangible examples of AI investment, says Deepwater's Gene Munster",https://images.financialmodelingprep.com/news/meta-is-showing-tangible-examples-of-ai-investment-says-20250430.jpg,youtube.com,"Gene Munster, Deepwater Asset Management, joins 'Fast Money' to discuss Meta's earnings, his takeaways and outlook for the stock.",https://www.youtube.com/watch?v=y1bmTlVu_nA
META,2025-04-30 17:36:51,'Fast Money' traders talk how they are playing Meta post-earnings,https://images.financialmodelingprep.com/news/fast-money-traders-talk-how-they-are-playing-meta-20250430.jpg,youtube.com,'Fast Money' traders talk how they are playing Meta post-earnings and their takeaways from the Big Tech sector.,https://www.youtube.com/watch?v=_rAtZYKKa6E
META,2025-04-30 17:26:01,"Meta Stock Rallies as Earnings Top Estimates, Meta AI Hits User Milestone",https://images.financialmodelingprep.com/news/meta-stock-rallies-as-earnings-top-estimates-meta-ai-20250430.jpg,investopedia.com,"Meta (META) reported better-than-expected quarterly earnings, sending shares higher in extended trading Wednesday.",https://www.investopedia.com/meta-earnings-q1-fy2025-11724074
META,2025-04-30 17:24:19,"Meta, Microsoft reports lift AI-related stocks",https://images.financialmodelingprep.com/news/meta-microsoft-reports-lift-airelated-stocks-20250430.jpg,reuters.com,Shares in artificial intelligence and cloud-computing-related companies were rising sharply in late trade on Wednesday after Meta Platforms and Microsoft results beat Wall Street expectations.,https://www.reuters.com/business/retail-consumer/meta-microsoft-reports-lift-ai-related-stocks-2025-04-30/
META,2025-04-30 16:58:57,Meta Says It Anticipates Continued Growth Despite Tariffs,https://images.financialmodelingprep.com/news/meta-says-it-anticipates-continued-growth-despite-tariffs-20250430.jpg,nytimes.com,The Silicon Valley company made the revenue projection as it reported a 35 percent rise in profit in the first quarter.,https://www.nytimes.com/2025/04/30/technology/meta-earnings-report.html
META,2025-04-30 16:55:54,Breaking Down Meta's Better-Than-Expected Earnings,https://images.financialmodelingprep.com/news/breaking-down-metas-betterthanexpected-earnings-20250430.jpg,youtube.com,"Shweta Khajuria, Wolfe Research managing director, global internet, reacts to Meta Platforms' first-quarter earnings on ""Bloomberg The Close."" Meta posted $42.3 billion in sales in the first quarter, beating analysts' estimates of $41.4 billion.",https://www.youtube.com/watch?v=xayPd7k9wTs
META,2025-04-30 16:42:12,Meta shares rise on stronger than expected revenue for the quarter,https://images.financialmodelingprep.com/news/meta-shares-rise-on-stronger-than-expected-revenue-for-20250430.jpg,youtube.com,CNBC's Julia Boorstin joins 'Closing Bell: Overtime' to discuss Meta's earnings report.,https://www.youtube.com/watch?v=gTskTpZuGDw
META,2025-04-30 16:40:26,Meta Platforms' shares rise as revenue beats forecasts on boost from AI tools,https://images.financialmodelingprep.com/news/meta-platforms-shares-rise-as-revenue-beats-forecasts-on-20250430.jpg,nypost.com,"The results come as Meta faces a high-stakes trial in Washington, in which the Federal Trade Commission is seeking to unwind the company's acquisitions of prized assets Instagram and WhatsApp.",https://nypost.com/2025/04/30/business/meta-platforms-shares-rise-as-revenue-beats-forecasts-on-boost-from-ai-tools/
META,2025-04-30 16:33:01,"EARNINGS ALERT: MSFT, META",https://images.financialmodelingprep.com/news/earnings-alert-msft-meta-20250430.jpg,youtube.com,"Microsoft (MSFT) and Meta Platforms (META) shares soar after earnings. For MSFT, 3Q Intelligent Cloud revenue clocked in at $26.8B, above Wall Street estimates.",https://www.youtube.com/watch?v=LgdH4x3ocSg
META,2025-04-30 16:25:05,"Meta Q1 Results Beat Expectations, Easing Concerns About Tariff-Tossed Economy's Threat To Big Tech",https://images.financialmodelingprep.com/news/meta-q1-results-beat-expectations-easing-concerns-about-tarifftossed-20250430.jpg,deadline.com,"Social media giant Meta Platforms posted better-than-expected numbers in the first quarter, with revenue surging 16% from a year ago to reach $42.3 billion, lifting shares in after-hours trading. The results showed advertising dollars continuing to fill Meta's coffers despite significant macroeconomic uncertainty. Shares in Meta climbed 4% after hours.",https://deadline.com/2025/04/meta-q1-2025-earnings-1236381665/
META,2025-04-30 16:22:04,"Meta Q1 revenue and profits top estimates, boosts capex for AI infrastructure investments",https://images.financialmodelingprep.com/news/meta-q1-revenue-and-profits-top-estimates-boosts-capex-20250430.jpg,proactiveinvestors.com,"Meta Platforms Inc (NASDAQ:META, ETR:FB2A, SWX:FB) delivered better-than-expected revenue and profits for the first quarter, sending shares of the Facebook, Instagram and WhatsApp owner higher afterhours on Wednesday. First quarter revenue was up 16% from the same periood last year at $42.31 billion, almost $1 billion higher than the $41.36 Wall Street consensus estimate.",https://www.proactiveinvestors.com/companies/news/1070479
META,2025-04-30 16:22:00,"Meta Posts $42 Billion in Sales, Points to Strong Growth",https://images.financialmodelingprep.com/news/meta-posts-42-billion-in-sales-points-to-strong-20250430.jpg,wsj.com,The tech giant's outlook may allay investor concerns about the digital advertising marke,https://www.wsj.com/tech/meta-earnings-q1-2025-stock-1e853c58
META,2025-04-30 16:10:07,Meta's Reality Labs posts $4.2 billion loss in first quarter,https://images.financialmodelingprep.com/news/metas-reality-labs-posts-42-billion-loss-in-first-20250430.jpg,cnbc.com,"In Meta's first-quarter earnings report on Wednesday, the company said its Reality Labs unit recorded an operating loss of $4.2 billion while bringing in $412 million in sales. Last week, Meta said it laid off an unspecified number of Reality Labs employees, who were part of the Oculus Studios unit.",https://www.cnbc.com/2025/04/30/metas-reality-labs-posts-4point2-billion-loss-in-first-quarter.html
META,2025-04-30 16:10:00,Meta And Microsoft Stocks Soar On Robust Earnings Reports,https://images.financialmodelingprep.com/news/meta-and-microsoft-stocks-soar-on-robust-earnings-reports-20250430.jpg,forbes.com,"Earnings for two of the U.S.' handful of trillion-dollar companies came out Wednesday afternoon as Meta and Microsoft will update investors, kicking off a crucial week for on-edge big technology stocks as tariffs complicated investor appetite for artificial intelligence-driven growth.",https://www.forbes.com/sites/dereksaul/2025/04/30/meta-and-microsoft-stocks-soar-on-robust-earnings-reports/
META,2025-04-30 16:05:00,Meta Reports First Quarter 2025 Results,https://images.financialmodelingprep.com/news/meta-reports-first-quarter-2025-results-20250430.jpg,prnewswire.com,"MENLO PARK, Calif. , April 30, 2025 /PRNewswire/ -- Meta Platforms, Inc. (Nasdaq: META) today reported financial results for the quarter ended March 31, 2025.",https://www.prnewswire.com/news-releases/meta-reports-first-quarter-2025-results-302443250.html
META,2025-04-30 15:31:00,Small Bootstrapped Practice Climbs Product Hunt Rankings Alongside Meta's Tenth Launch,https://images.financialmodelingprep.com/news/small-bootstrapped-practice-climbs-product-hunt-rankings-alongside-metas-20250430.jpg,globenewswire.com,"TEMECULA, Calif., April 30, 2025 (GLOBE NEWSWIRE) -- While tech giant Meta released its tenth product on Product Hunt this week, it was a small, bootstrapped speech therapy practice that quietly earned a spot among the platform's Top 100 product launches.",https://www.globenewswire.com/news-release/2025/04/30/3071774/0/en/Small-Bootstrapped-Practice-Climbs-Product-Hunt-Rankings-Alongside-Meta-s-Tenth-Launch.html
META,2025-04-30 14:46:00,"Meta, Baker Hughes and Other ‘Fallen Angel' Stocks Due for a Rebound",https://images.financialmodelingprep.com/news/meta-baker-hughes-and-other-fallen-angel-stocks-due-20250430.jpg,barrons.com,"The downbeat mood on Wall Street could be a great opportunity to buy the dip in quality stocks, according to a Wednesday report by J.P. Morgan.",https://www.barrons.com/articles/meta-stock-baker-hughes-rebound-496c97e4
META,2025-04-30 14:13:48,"EXCLUSIVE: If Meta Is Forced To Divest Instagram, WhatsApp, Or Facebook, 43% Pick This Standout",https://images.financialmodelingprep.com/news/exclusive-if-meta-is-forced-to-divest-instagram-whatsapp-20250430.jpg,benzinga.com,"An antitrust trial against Meta Platforms META has put the company's segments, such as Instagram and WhatsApp, into the spotlight, as the company could be forced to divest these units.",https://www.benzinga.com/tech/25/04/45112477/exclusive-if-meta-is-forced-to-divest-instagram-whatsapp-or-facebook-43-pick-this-standout
META,2025-04-30 14:00:01,Meta to report quarterly earnings amid tariff uncertainty and AI investment,https://images.financialmodelingprep.com/news/meta-to-report-quarterly-earnings-amid-tariff-uncertainty-and-20250430.jpg,theguardian.com,Wall Street is projecting the company will post $41.36bn in revenue on $5.21 in earnings per share,https://www.theguardian.com/technology/2025/apr/30/meta-first-quarterly-earnings
META,2025-04-30 13:56:14,Jefferies' Thill on Meta: Near-term ad environment will be challenged but bullish long-term,https://images.financialmodelingprep.com/news/jefferies-thill-on-meta-nearterm-ad-environment-will-be-20250430.jpg,youtube.com,"Jefferies' Brent Thill and MNTN's Mark Douglas, joins 'The Exchange' to discuss how to position in markets amidst earnings this week.",https://www.youtube.com/watch?v=4rZZc9pAuvA
META,2025-04-30 13:38:37,"Why Amazon, Meta Platforms, and Alphabet Slumped on Wednesday",https://images.financialmodelingprep.com/news/why-amazon-meta-platforms-and-alphabet-slumped-on-wednesday-20250430.jpg,fool.com,"The U.S. economy has run consistently higher over the past couple of years. However, recent concerns about tariffs, the burgeoning trade war with China, and the impact of the broader uncertainty on the economy have fueled significant stock market volatility.",https://www.fool.com/investing/2025/04/30/why-amazon-meta-platforms-and-alphabet-slumped-on/
