symbol,publishedDate,title,image,site,text,url
ADBE,2025-02-25 09:03:35,"Adobe brings free Photoshop app to phones, courting younger users",https://images.financialmodelingprep.com/news/adobe-brings-free-photoshop-app-to-phones-courting-younger-20250225.jpg,reuters.com,"Adobe said on Tuesday it is bringing its Photoshop app to mobile phones for the first time, offering both a free version and a paid version at the lowest cost yet for the app, at $7.99 per month.",https://www.reuters.com/technology/adobe-brings-free-photoshop-app-phones-courting-younger-users-2025-02-25/
ADBE,2025-02-24 10:30:32,Why Adobe Systems (ADBE) is a Top Stock for the Long-Term,https://images.financialmodelingprep.com/news/why-adobe-systems-adbe-is-a-top-stock-for-20250224.jpg,zacks.com,"Finding strong, market-beating stocks with a positive earnings outlook becomes easier with the Focus List, a top feature of the Zacks Premium portfolio service.",https://www.zacks.com/stock/news/2420348/why-adobe-systems-adbe-is-a-top-stock-for-the-long-term?cid=CS-STOCKNEWSAPI-FT-tale_of_the_tape|zacks_education_focus_list-2420348
ADBE,2025-02-21 11:00:46,Adobe Expands Portfolio for Advertisers: Buy or Hold the Stock?,https://images.financialmodelingprep.com/news/adobe-expands-portfolio-for-advertisers-buy-or-hold-the-20250221.jpg,zacks.com,ADBE shares are benefiting from strong demand for its creative products and expanding clientele amid increasing competition and stretched valuation.,https://www.zacks.com/stock/news/2419591/adobe-expands-portfolio-for-advertisers-buy-or-hold-the-stock?cid=CS-STOCKNEWSAPI-FT-analyst_blog|most_popular_stocks-2419591
ADBE,2025-02-21 10:05:35,Adobe Inc. (ADBE) is Attracting Investor Attention: Here is What You Should Know,https://images.financialmodelingprep.com/news/adobe-inc-adbe-is-attracting-investor-attention-here-is-20250221.jpg,zacks.com,"Adobe (ADBE) has received quite a bit of attention from Zacks.com users lately. Therefore, it is wise to be aware of the facts that can impact the stock's prospects.",https://www.zacks.com/stock/news/2419400/adobe-inc-adbe-is-attracting-investor-attention-here-is-what-you-should-know?cid=CS-STOCKNEWSAPI-FT-tale_of_the_tape|most_searched_stocks-2419400
ADBE,2025-02-20 09:00:00,Adobe Announces General Availability of Real-Time CDP Collaboration for Brands to Jointly Drive Ad Performance in a Privacy-First Landscape,https://images.financialmodelingprep.com/news/adobe-announces-general-availability-of-realtime-cdp-collaboration-for-20250220.jpg,businesswire.com,"SAN JOSE, Calif.--(BUSINESS WIRE)--Today, Adobe (Nasdaq:ADBE) announced the general availability of Adobe Real-Time CDP Collaboration in the U.S., a new offering that enables advertisers and publishers to tackle a changing advertising landscape. Brands have long relied on third-party audience signals to power tailored digital ads. As consumers play a more active role in customizing their privacy preferences, a move away from third-party data means new tools are required for brands to identify r.",https://www.businesswire.com/news/home/20250220778009/en/Adobe-Announces-General-Availability-of-Real-Time-CDP-Collaboration-for-Brands-to-Jointly-Drive-Ad-Performance-in-a-Privacy-First-Landscape/
ADBE,2025-02-20 07:00:00,Prediction: This Stock Will Be Worth More Than Palantir by the End of 2025,https://images.financialmodelingprep.com/news/prediction-this-stock-will-be-worth-more-than-palantir-20250220.jpg,fool.com,"Palantir (PLTR -10.08%) has been one of the hottest stocks on Wall Street, rising nearly 600% since the start of 2024. That's an incredible return in just over a year, and it has made Palantir one of the highest-valued software stocks on the market.",https://www.fool.com/investing/2025/02/20/prediction-this-stock-will-be-worth-more-than-pala/
ADBE,2025-02-19 18:51:41,Adobe Systems (ADBE) Stock Falls Amid Market Uptick: What Investors Need to Know,https://images.financialmodelingprep.com/news/adobe-systems-adbe-stock-falls-amid-market-uptick-what-20250219.jpg,zacks.com,"In the closing of the recent trading day, Adobe Systems (ADBE) stood at $456.99, denoting a -1.53% change from the preceding trading day.",https://www.zacks.com/stock/news/2418109/adobe-systems-adbe-stock-falls-amid-market-uptick-what-investors-need-to-know?cid=CS-STOCKNEWSAPI-FT-tale_of_the_tape|yseop_template_6-2418109
ADBE,2025-02-18 06:17:00,"CORRECTION FROM SOURCE: News Media Group, Inc. and Digital Lifestyle Expert Mario Armstrong worked with Adobe on a National Satellite Media Tour to Help Introduce the New AI-Powered Contract Intelligence Featured in Acrobat AI Assistant",https://images.financialmodelingprep.com/news/correction-from-source-news-media-group-inc-and-digital-lifestyle-20250218.jpg,newsfilecorp.com,"The National Satellite Media Tour highlighted how contract intelligence in Adobe Acrobat AI Assistant can help consumers simplify their contract comprehension New York, New York--(Newsfile Corp. - February 18, 2025) - News Media Group, Inc. helped Adobe with their newly announced launch of contract intelligence in Adobe Acrobat AI Assistant. Digital Lifestyle Expert Mario Armstrong was interviewed by TV news stations and shows around the country about these new features that can help everyone grasp complex terms and spot differences between multiple agreements so they can better understand and verify the information in these important documents-faster and easier.",https://www.newsfilecorp.com/release/241183/CORRECTION-FROM-SOURCE-News-Media-Group-Inc.-and-Digital-Lifestyle-Expert-Mario-Armstrong-worked-with-Adobe-on-a-National-Satellite-Media-Tour-to-Help-Introduce-the-New-AIPowered-Contract-Intelligence-Featured-in-Acrobat-AI-Assistant
ADBE,2025-02-17 10:35:32,Is Adobe (ADBE) a Buy as Wall Street Analysts Look Optimistic?,https://images.financialmodelingprep.com/news/is-adobe-adbe-a-buy-as-wall-street-analysts-20250217.jpg,zacks.com,"Investors often turn to recommendations made by Wall Street analysts before making a Buy, Sell, or Hold decision about a stock. While media reports about rating changes by these brokerage-firm employed (or sell-side) analysts often affect a stock's price, do they really matter?",https://www.zacks.com/stock/news/2416852/is-adobe-adbe-a-buy-as-wall-street-analysts-look-optimistic?cid=CS-STOCKNEWSAPI-FT-fundamental_analysis|average_broker_rating-2416852
ADBE,2025-02-15 09:15:00,2 Stocks Down 27% and 8% to Buy Right Now,https://images.financialmodelingprep.com/news/2-stocks-down-27-and-8-to-buy-right-20250215.jpg,fool.com,"The prospect of several more weeks of winter after Punxsutawney Phil saw his shadow may have your mind fretful about more frosty weather, but that shouldn't distract you from the S&P 500's red-hot performance, which has resulted in the index soaring more than 20%.",https://www.fool.com/investing/2025/02/15/2-stocks-down-27-and-8-to-buy-right-now/
ADBE,2025-02-15 03:56:00,Billionaire Investor David Tepper Dumped Adobe and Acquired This Semiconductor Stock. Should You Follow?,https://images.financialmodelingprep.com/news/billionaire-investor-david-tepper-dumped-adobe-and-acquired-this-20250215.jpg,fool.com,"If you haven't achieved a net worth north of $1 billion by wisely investing in stocks, there's probably a lot that you can learn from the handful of folks who have.",https://www.fool.com/investing/2025/02/15/billionaire-investor-david-tepper-dumped-adobe-and/
ADBE,2025-02-14 23:51:07,Adobe: Undue Fear Makes It A Strong Buy (Rating Upgrade),https://images.financialmodelingprep.com/news/adobe-undue-fear-makes-it-a-strong-buy-rating-20250214.jpg,seekingalpha.com,"Adobe's stock weakness is an opportunity to accumulate shares in a company with a strong moat and exceptional AI integration. AI will enhance, not replace, Adobe's software, driving increased efficiency and demand among digital-first enterprises. Adobe's Firefly AI model and innovative features position it as the defining leader in AI-powered digital creation.",https://seekingalpha.com/article/4758684-adobe-undue-fear-makes-it-a-strong-buy
ADBE,2025-02-14 13:27:26,"Calls of the Day: Baker Hughes, Adobe, Salesforce and Home Depot",https://images.financialmodelingprep.com/news/calls-of-the-day-baker-hughes-adobe-salesforce-and-20250214.jpg,youtube.com,The Investment Committee debate the latest Calls of the Day.,https://www.youtube.com/watch?v=Wr6fZTbFHAo
ADBE,2025-02-13 15:55:00,Trent Thayne From BlastX Consulting Named 2025 Adobe Analytics Rockstar,https://images.financialmodelingprep.com/news/trent-thayne-from-blastx-consulting-named-2025-adobe-analytics-20250213.jpg,businesswire.com,"ROSEVILLE, Calif.--(BUSINESS WIRE)-- #AdobeRockstar--BlastX Consulting is proud to announce that Trent Thayne, Senior Consultant, Digital Analytics & Insights, has been recognized as an Adobe Analytics Rockstar—an elite honor recognizing top analytics experts. Thayne will take the stage at Adobe Summit 2025, sharing cutting-edge strategies that help brands transform data into business impact. Adobe Analytics Rockstars: Next-Level Analytics Insights Selected for his expertise, Thayne joins analytics leaders.",https://www.businesswire.com/news/home/20250212720271/en/Trent-Thayne-From-BlastX-Consulting-Named-2025-Adobe-Analytics-Rockstar/
ADBE,2025-02-13 13:39:26,"Calls of the Day: Live Nation, Eli Lilly, AT&T, Adobe and Astera Labs",https://images.financialmodelingprep.com/news/calls-of-the-day-live-nation-eli-lilly-att-20250213.jpg,youtube.com,The Investment Committee discuss the latest Calls of the Day.,https://www.youtube.com/watch?v=IiKNqHZESlA
ADBE,2025-02-13 11:33:00,"News Media Group, Inc. and Digital Lifestyle Expert Mario Armstrong worked with Adobe on a National Satellite Media Tour to Help Introduce the New AI-Powered Contract Intelligence Featured in Acrobat AI Assistant",https://images.financialmodelingprep.com/news/news-media-group-inc-and-digital-lifestyle-expert-mario-20250213.jpg,newsfilecorp.com,"The National Satellite Media Tour highlighted how contract intelligence in Adobe Acrobat AI Assistant can help consumers simplify their contract comprehension New York, New York--(Newsfile Corp. - February 13, 2025) - News Media Group, Inc. helped Adobe with their newly announced launch of contract intelligence in Adobe Acrobat AI Assistant. Digital Lifestyle Expert Mario Armstrong was interviewed by TV news stations and shows around the country about these new features that can help everyone grasp complex terms and spot differences between multiple agreements so they can better understand and verify the information in these important documents—faster and easier.",https://www.newsfilecorp.com/release/240584/News-Media-Group-Inc.-and-Digital-Lifestyle-Expert-Mario-Armstrong-worked-with-Adobe-on-a-National-Satellite-Media-Tour-to-Help-Introduce-the-New-AIPowered-Contract-Intelligence-Featured-in-Acrobat-AI-Assistant
ADBE,2025-02-13 10:04:00,"Syniverse Enables Reliable, Targeted SMS Messaging Support via Adobe Campaign",https://images.financialmodelingprep.com/news/syniverse-enables-reliable-targeted-sms-messaging-support-via-adobe-campaign-20250213.jpg,businesswire.com,"TAMPA, Fla.--(BUSINESS WIRE)--Syniverse, the world's most connected company®, and Adobe (Nasdaq:ADBE) have come together to provide Syniverse's SMS messaging through the Adobe Campaign omnichannel marketing platform. This collaboration lets businesses optimize the customer experience while ensuring messages are delivered safely and reliably. Syniverse's solution allows organizations to send targeted and personalized SMS messages to their customers worldwide — and engage with them in real time —.",https://www.businesswire.com/news/home/20250213036059/en/Syniverse-Enables-Reliable-Targeted-SMS-Messaging-Support-via-Adobe-Campaign/
ADBE,2025-02-13 08:18:13,Billionaire David Tepper's Appaloosa Jumps Out of Adobe and Into This Iconic Company,https://images.financialmodelingprep.com/news/billionaire-david-teppers-appaloosa-jumps-out-of-adobe-and-into-20250213.jpg,247wallst.com,"David Tepper's hedge fund, Appaloosa LP , filed its Q4 2024 13F holdings report recently.",https://247wallst.com/investing/2025/02/13/billionaire-david-teppers-appaloosa-jumps-out-of-adobe-and-into-this-iconic-company/
ADBE,2025-02-13 08:00:00,Reply Announces the Launch of Comwrap Reply to Expand Adobe Expertise in North America,https://images.financialmodelingprep.com/news/reply-announces-the-launch-of-comwrap-reply-to-expand-20250213.jpg,prnewswire.com,"ATLANTA , Feb. 13, 2025 /PRNewswire/ -- Reply, a global systems integrator and technology firm, is proud to announce the launch of Comwrap Reply in North America. This strategic expansion builds on Comwrap Reply's inception in 2004 and established presence in Germany, Italy, and the UK, enhancing its position as a leading provider of AI-powered, end-to-end digital experience solutions.",https://www.prnewswire.com/news-releases/reply-announces-the-launch-of-comwrap-reply-to-expand-adobe-expertise-in-north-america-302374778.html
ADBE,2025-02-12 11:42:39,Forget Palantir. These 2 Software Stocks Have More AI Upside,https://images.financialmodelingprep.com/news/forget-palantir-these-2-software-stocks-have-more-ai-20250212.jpg,247wallst.com,"Palantir (NASDAQ:PLTR) stock has been going into overdrive this past week, adding to the 22% or so gains enjoyed following what was a remarkable quarterly earnings beat.",https://247wallst.com/investing/2025/02/12/forget-palantir-these-2-software-stocks-have-more-ai-upside/
ADBE,2025-02-12 10:31:19,Earnings Growth & Price Strength Make Adobe Systems (ADBE) a Stock to Watch,https://images.financialmodelingprep.com/news/earnings-growth-price-strength-make-adobe-systems-adbe-a-20250212.jpg,zacks.com,"Finding strong, market-beating stocks with a positive earnings outlook becomes easier with the Focus List, a top feature of the Zacks Premium portfolio service.",https://www.zacks.com/stock/news/2414486/earnings-growth-price-strength-make-adobe-systems-adbe-a-stock-to-watch?cid=CS-STOCKNEWSAPI-FT-tale_of_the_tape|zacks_education_focus_list-2414486
ADBE,2025-02-12 09:04:38,Adobe launches AI video tool to compete with OpenAI,https://images.financialmodelingprep.com/news/adobe-launches-ai-video-tool-to-compete-with-openai-20250212.jpg,reuters.com,"Adobe on Wednesday released the first public version of an artificial intelligence tool that can generate video clips and revealed how much it will charge, but said it will not set pricing for major users such as studios until later this year.",https://www.reuters.com/technology/artificial-intelligence/adobe-launches-ai-video-tool-compete-with-openai-2025-02-12/
ADBE,2025-02-12 09:00:00,Adobe launches subscriptions for Firefly AI,https://images.financialmodelingprep.com/news/adobe-launches-subscriptions-for-firefly-ai-20250212.jpg,techcrunch.com,"Adobe is hoping to capitalize on the early success of its Firefly AI models by launching a new standalone subscription service that gives users access to the company's AI image, vector and video generating models.",https://techcrunch.com/2025/02/12/adobe-launches-firefly-ai-subscriptions/
ADBE,2025-02-12 07:15:48,Adobe's AI Strategy Is Paying Off: Why This Stock Could Surge,https://images.financialmodelingprep.com/news/adobes-ai-strategy-is-paying-off-why-this-stock-could-20250212.jpg,seekingalpha.com,"Adobe is undervalued at $450, with a target price of $600, driven by strong subscription revenue and AI integration. Despite competition fears, Adobe's core audience remains loyal, and AI features are boosting customer retention and engagement. Adobe's financials are robust, with 89% gross margins, growing revenue, and significant free cash flow, making it a stable investment.",https://seekingalpha.com/article/4757318-adobes-ai-strategy-is-paying-off-why-this-stock-could-surge
ADBE,2025-02-11 18:51:26,Adobe Systems (ADBE) Laps the Stock Market: Here's Why,https://images.financialmodelingprep.com/news/adobe-systems-adbe-laps-the-stock-market-heres-why-20250211.jpg,zacks.com,"Adobe Systems (ADBE) concluded the recent trading session at $458.82, signifying a +1.71% move from its prior day's close.",https://www.zacks.com/stock/news/2414065/adobe-systems-adbe-laps-the-stock-market-here-s-why?cid=CS-STOCKNEWSAPI-FT-tale_of_the_tape|yseop_template_6-2414065
ADBE,2025-02-10 12:52:25,Adobe: Buy The Generative AI Fears,https://images.financialmodelingprep.com/news/adobe-buy-the-generative-ai-fears-20250210.jpg,seekingalpha.com,"The market appears concerned that generative AI is disrupting Adobe. ADBE has seen revenue growth decelerate, instead of accelerate as hoped for – validating such fears. The company remains a cash cow with a strong balance sheet and ongoing share repurchases.",https://seekingalpha.com/article/4756682-adobe-buy-the-generative-ai-fears
ADBE,2025-02-08 18:00:03,"Adobe is focused on creativity, CEO says",https://images.financialmodelingprep.com/news/adobe-is-focused-on-creativity-ceo-says-20250208.jpg,youtube.com,Adobe chairman and CEO Shantanu Narayen has the latest on the state of the tech industry on 'The Claman Countdown.',https://www.youtube.com/watch?v=43L8muiAFa8
ADBE,2025-02-08 11:45:00,3 Reasons to Buy Adobe Stock Like There's No Tomorrow,https://images.financialmodelingprep.com/news/3-reasons-to-buy-adobe-stock-like-theres-no-20250208.jpg,fool.com,"Adobe (ADBE -0.54%) shareholders might wish they could use Photoshop, the tech giant's flagship image-editing tool, to magically erase the stock's disappointing performance in 2024. Despite solid growth and record profitability, shares are down about 30% in the past year.",https://www.fool.com/investing/2025/02/08/3-reasons-buy-adobe-stock-like-theres-no-tomorrow/
ADBE,2025-02-07 10:06:20,Adobe Inc. (ADBE) Is a Trending Stock: Facts to Know Before Betting on It,https://images.financialmodelingprep.com/news/adobe-inc-adbe-is-a-trending-stock-facts-to-know-20250207.jpg,zacks.com,"Zacks.com users have recently been watching Adobe (ADBE) quite a bit. Thus, it is worth knowing the facts that could determine the stock's prospects.",https://www.zacks.com/stock/news/2411868/adobe-inc-adbe-is-a-trending-stock-facts-to-know-before-betting-on-it?cid=CS-STOCKNEWSAPI-FT-tale_of_the_tape|most_searched_stocks-2411868
ADBE,2025-02-04 18:51:13,Here's Why Adobe Systems (ADBE) Gained But Lagged the Market Today,https://images.financialmodelingprep.com/news/heres-why-adobe-systems-adbe-gained-but-lagged-the-20250204.jpg,zacks.com,"Adobe Systems (ADBE) concluded the recent trading session at $440.23, signifying a +0.37% move from its prior day's close.",https://www.zacks.com/stock/news/2409559/here-s-why-adobe-systems-adbe-gained-but-lagged-the-market-today?cid=CS-STOCKNEWSAPI-FT-tale_of_the_tape|yseop_template_6-2409559
ADBE,2025-02-04 06:00:00,Adobe Acrobat AI Assistant Introduces New Generative AI Features to Make Understanding Contracts Easier for Everyone,https://images.financialmodelingprep.com/news/adobe-acrobat-ai-assistant-introduces-new-generative-ai-features-20250204.jpg,businesswire.com,"SAN JOSE, Calif.--(BUSINESS WIRE)--Today Adobe (Nasdaq: ADBE) announced new intelligent contract capabilities in Acrobat AI Assistant to simplify working with contracts. The new generative AI features can help customers grasp complex terms and spot differences between multiple agreements so they can better understand and verify the information in these important documents—faster and easier. From credit card and vendor agreements to loyalty programs and purchase orders, contracts are a fact of l.",https://www.businesswire.com/news/home/20250204672701/en/Adobe-Acrobat-AI-Assistant-Introduces-New-Generative-AI-Features-to-Make-Understanding-Contracts-Easier-for-Everyone/
ADBE,2025-02-03 05:45:00,3 No-Brainer Artificial Intelligence (AI) Stocks to Buy With $500 Right Now,https://images.financialmodelingprep.com/news/3-nobrainer-artificial-intelligence-ai-stocks-to-buy-with-20250203.jpg,fool.com,"By far the biggest driving force behind the stock market returns over the last two years has been artificial intelligence (AI). With big tech spending heavily to build out data centers and develop new AI capabilities, the promises of AI are moving closer to a reality.",https://www.fool.com/investing/2025/02/03/3-no-brainer-artificial-intelligence-ai-stocks-to/
ADBE,2025-02-01 13:38:22,Adobe exec Scott Belsky departs for indie movie studio A24,https://images.financialmodelingprep.com/news/adobe-exec-scott-belsky-departs-for-indie-movie-studio-20250201.jpg,techcrunch.com,"Adobe's chief strategy officer Scott Belsky announced this week that he will be joining A24, the independent movie studio behind “Civil War,” “Everything Everywhere All At Once,” and many more titles.",https://techcrunch.com/2025/02/01/adobe-exec-scott-belsky-departs-for-indie-movie-studio-a24/
ADBE,2025-01-31 07:28:00,Dentsu Partners with Adobe to Introduce Adobe GenStudio dentsu+,https://images.financialmodelingprep.com/news/dentsu-partners-with-adobe-to-introduce-adobe-genstudio-dentsu-20250131.jpg,globenewswire.com,"Dentsu, in partnership with Adobe, today announced Adobe GenStudio dentsu+, an innovative, generative AI-powered, integrated marketing ecosystem for brands",https://www.globenewswire.com/news-release/2025/01/31/3018722/0/en/Dentsu-Partners-with-Adobe-to-Introduce-Adobe-GenStudio-dentsu.html
ADBE,2025-01-30 10:31:12,Brokers Suggest Investing in Adobe (ADBE): Read This Before Placing a Bet,https://images.financialmodelingprep.com/news/brokers-suggest-investing-in-adobe-adbe-read-this-before-20250130.jpg,zacks.com,"The recommendations of Wall Street analysts are often relied on by investors when deciding whether to buy, sell, or hold a stock. Media reports about these brokerage-firm-employed (or sell-side) analysts changing their ratings often affect a stock's price.",https://www.zacks.com/stock/news/2406599/brokers-suggest-investing-in-adobe-adbe-read-this-before-placing-a-bet?cid=CS-STOCKNEWSAPI-FT-fundamental_analysis|average_broker_rating-2406599
ADBE,2025-01-28 11:17:08,Top 3 Must-See Tech Opportunities After the Recent Sell-Off,https://images.financialmodelingprep.com/news/top-3-mustsee-tech-opportunities-after-the-recent-selloff-20250128.jpg,marketbeat.com,"While the better part of 2022 through 2024 was dominated by the technology sector, mainly centered around the semiconductor and chip maker names in the market, 2025 is getting off to a rough start for this space. After Chinese company DeepSeek made it the number one downloaded app in the world, claiming it has more computing power with a fraction of the costs claimed by the industry, technology names have taken a beating.",https://www.marketbeat.com/stock-ideas/top-3-must-see-tech-opportunities-after-the-recent-sell-off/
ADBE,2025-01-27 10:06:23,Adobe Inc. (ADBE) is Attracting Investor Attention: Here is What You Should Know,https://images.financialmodelingprep.com/news/adobe-inc-adbe-is-attracting-investor-attention-here-is-20250127.jpg,zacks.com,"Adobe (ADBE) has received quite a bit of attention from Zacks.com users lately. Therefore, it is wise to be aware of the facts that can impact the stock's prospects.",https://www.zacks.com/stock/news/2403675/adobe-inc-adbe-is-attracting-investor-attention-here-is-what-you-should-know?cid=CS-STOCKNEWSAPI-FT-tale_of_the_tape|most_searched_stocks-2403675
ADBE,2025-01-24 12:16:11,"Adobe Declines 30% in a Year: Buy, Sell or Hold the Stock in 2025?",https://images.financialmodelingprep.com/news/adobe-declines-30-in-a-year-buy-sell-or-20250124.jpg,zacks.com,ADBE shares are benefiting from strong demand for its creative products and expanding clientele amid increasing competition and stretched valuation.,https://www.zacks.com/stock/news/2403071/adobe-declines-30-in-a-year-buy-sell-or-hold-the-stock-in-2025?cid=CS-STOCKNEWSAPI-FT-analyst_blog|most_popular_stocks-2403071
ADBE,2025-01-23 18:51:26,Adobe Systems (ADBE) Stock Sinks As Market Gains: Here's Why,https://images.financialmodelingprep.com/news/adobe-systems-adbe-stock-sinks-as-market-gains-heres-20250123.jpg,zacks.com,"Adobe Systems (ADBE) closed the most recent trading day at $437.28, moving -0.01% from the previous trading session.",https://www.zacks.com/stock/news/2402499/adobe-systems-adbe-stock-sinks-as-market-gains-here-s-why?cid=CS-STOCKNEWSAPI-FT-tale_of_the_tape|yseop_template_6-2402499
ADBE,2025-01-23 05:30:00,Is Adobe Stock Too Cheap to Pass Up?,https://images.financialmodelingprep.com/news/is-adobe-stock-too-cheap-to-pass-up-20250123.jpg,fool.com,Adobe (ADBE 0.22%) stock has fallen over 30% in the past year as the company's revenue growth slows and competition from lower cost and artificial intelligence tools heats up. Is the stock a value or is there more to fall?,https://www.fool.com/investing/2025/01/23/is-adobe-stock-too-cheap-to-pass-up/
ADBE,2025-01-22 11:32:41,1 Fantastic Artificial Intelligence (AI) Stock Down 35% to Buy in 2025,https://images.financialmodelingprep.com/news/1-fantastic-artificial-intelligence-ai-stock-down-35-to-20250122.jpg,fool.com,"In this video, I will cover the recent updates regarding Adobe (ADBE 0.18%). Watch the short video to learn more, consider subscribing, and click the special offer link below.",https://www.fool.com/investing/2025/01/22/1-fantastic-artificial-intelligence-ai-stock-down/
ADBE,2025-01-22 06:10:40,"Los Angeles wildfires spark interest in adobe, natural building materials",https://images.financialmodelingprep.com/news/los-angeles-wildfires-spark-interest-in-adobe-natural-building-20250122.jpg,reuters.com,"Marialyce Pedersen stood in a white Tyvek suit on her Altadena, California, lot leveled by this month's wildfires. Her house was reduced to ash that spilled into the pool, turning the water a toxic black.",https://www.reuters.com/world/us/los-angeles-wildfires-spark-interest-adobe-natural-building-materials-2025-01-22/
