symbol,publishedDate,title,image,site,text,url
ADBE,2024-09-12 15:00:36,4 Mega-Cap Tech Stocks to Buy Ahead of Fed's September Rate Cut,https://images.financialmodelingprep.com/news/4-megacap-tech-stocks-to-buy-ahead-of-feds-20240912.jpg,zacks.com,"A rate cut by the Fed will help mega-cap tech stocks like Micron Technology (MU), Arista Networks (ANET), Adobe (ADBE) and AudioEye (AEYE).",https://www.zacks.com/stock/news/2335469/4-mega-cap-tech-stocks-to-buy-ahead-of-fed-s-september-rate-cut?cid=CS-STOCKNEWSAPI-FT-analyst_blog|investment_ideas-2335469
ADBE,2024-09-12 12:55:41,What You Need To Know Ahead of Adobe's Earnings Report,https://images.financialmodelingprep.com/news/what-you-need-to-know-ahead-of-adobes-earnings-20240912.jpg,investopedia.com,"UPDATE—Sept. 12, 2024: This article has been updated to reflect more recent share price information.",https://www.investopedia.com/what-you-need-to-know-ahead-of-adobe-earnings-report-thursday-8707135
ADBE,2024-09-12 12:37:25,Adobe Earnings Are Imminent; These Most Accurate Analysts Revise Forecasts Ahead Of Earnings Call,https://images.financialmodelingprep.com/news/adobe-earnings-are-imminent-these-most-accurate-analysts-revise-20240912.jpg,benzinga.com,"Adobe Inc. ADBE will release earnings results for its third quarter, after the closing bell on Thursday, Sept. 12.",https://www.benzinga.com/news/earnings/24/09/40838711/adobe-earnings-are-imminent-these-most-accurate-analysts-revise-forecasts-ahead-of-earnings-call
ADBE,2024-09-12 12:01:10,Core PPI Increased More Than Expected,https://images.financialmodelingprep.com/news/core-ppi-increased-more-than-expected-20240912.jpg,zacks.com,"More economic data is out this week this morning, among them the sister report to yesterday's CPI number: the Producer Price Index (PPI). Look at this as the wholesale print on inflation, whereas the CPI reports retail inflation.",https://www.zacks.com/stock/news/2335325/core-ppi-increased-more-than-expected?cid=CS-STOCKNEWSAPI-FT-economic_highlights-2335325
ADBE,2024-09-12 07:43:55,Earnings Preview: What To Expect From Adobe,https://images.financialmodelingprep.com/news/earnings-preview-what-to-expect-from-adobe-20240912.jpg,forbes.com,Adobe is scheduled to report earnings after Thursday' close. The stock hit a record high of $699.54/share in 2021 and is currently trading near $580.,https://www.forbes.com/sites/adamsarhan/2024/09/12/earnings-preview-what-to-expect-from-adobe/
ADBE,2024-09-11 16:23:20,Adobe Firefly Will Introduce AI-Generated Videos This Year,https://images.financialmodelingprep.com/news/adobe-firefly-will-introduce-aigenerated-videos-this-year-20240911.jpg,cnet.com,"Adobe said the upgrade will be available in beta later this year, but you can join the waitlist now.",https://www.cnet.com/tech/services-and-software/adobe-firefly-will-introduce-ai-generated-videos-this-year/
ADBE,2024-09-11 13:31:10,Will Adobe's (ADBE) Q3 Earnings Gain From Digital Media?,https://images.financialmodelingprep.com/news/will-adobes-adbe-q3-earnings-gain-from-digital-media-20240911.jpg,zacks.com,Adobe's fiscal third-quarter results are likely to reflect solid momentum across Creative Cloud and Document Cloud.,https://www.zacks.com/stock/news/2334861/will-adobe-s-adbe-q3-earnings-gain-from-digital-media?cid=CS-STOCKNEWSAPI-FT-analyst_blog|earnings_preview-2334861
ADBE,2024-09-11 09:03:06,Adobe to launch generative AI video creation tool later this year,https://images.financialmodelingprep.com/news/adobe-to-launch-generative-ai-video-creation-tool-later-20240911.jpg,reuters.com,"Adobe will unveil a new generative AI-powered video creation and editing tool in a limited release later this year, the software maker said on Wednesday, as it looks to beef up its suite of applications catering to creative professionals.",https://www.reuters.com/technology/artificial-intelligence/adobe-launch-generative-ai-video-creation-tool-later-this-year-2024-09-11/
ADBE,2024-09-11 09:02:00,Adobe Previews Its Upcoming Firefly Video Model,https://images.financialmodelingprep.com/news/adobe-previews-its-upcoming-firefly-video-model-20240911.jpg,businesswire.com,"SAN JOSE, Calif.--(BUSINESS WIRE)--Today, Adobe (Nasdaq: ADBE) previewed advancements to its generative AI video capabilities, powered by the Adobe Firefly Video Model. First previewed earlier this year, Adobe's upcoming video capabilities are designed to empower film editors and video professionals with tools to help inspire their creative vision, fill gaps in their timeline and add new elements to existing footage. The Firefly Video Model will extend Adobe's family of generative AI models, wh.",https://www.businesswire.com/news/home/20240911277120/en/Adobe-Previews-Its-Upcoming-Firefly-Video-Model/
ADBE,2024-09-10 13:15:38,Adobe Set to Post Q3 Earnings: To Buy or Not to Buy the Stock?,https://images.financialmodelingprep.com/news/adobe-set-to-post-q3-earnings-to-buy-or-20240910.jpg,zacks.com,ADBE's fiscal third-quarter results are likely to reflect the impacts of its strength in generative AI and positive contributions from partnerships.,https://www.zacks.com/stock/news/2334195/adobe-set-to-post-q3-earnings-to-buy-or-not-to-buy-the-stock?cid=CS-STOCKNEWSAPI-FT-analyst_blog|most_popular_stocks-2334195
ADBE,2024-09-09 10:16:26,Unveiling Adobe (ADBE) Q3 Outlook: Wall Street Estimates for Key Metrics,https://images.financialmodelingprep.com/news/unveiling-adobe-adbe-q3-outlook-wall-street-estimates-for-20240909.jpg,zacks.com,"Evaluate the expected performance of Adobe (ADBE) for the quarter ended August 2024, looking beyond the conventional Wall Street top-and-bottom-line estimates and examining some of its key metrics for better insight.",https://www.zacks.com/stock/news/2333292/unveiling-adobe-adbe-q3-outlook-wall-street-estimates-for-key-metrics?cid=CS-STOCKNEWSAPI-FT-fundamental_analysis|nfm_preview-2333292
ADBE,2024-09-09 07:00:00,"Adobe: The Market Is Changing, And Growth Is Decelerating (Rating Downgrade)",https://images.financialmodelingprep.com/news/adobe-the-market-is-changing-and-growth-is-decelerating-20240909.jpg,seekingalpha.com,"Adobe faces significant challenges from competitors like Canva and Figma, as evolving content needs are impacting its growth and market positioning. Revenue growth has decelerated, and despite strong margins, Adobe's valuation appears inflated compared to peers like Microsoft. AI initiatives like Firefly have yet to significantly boost revenue, raising concerns about Adobe's future growth prospects.",https://seekingalpha.com/article/4719847-adobe-the-market-is-changing-and-growth-is-decelerating-rating-downgrade
ADBE,2024-09-08 06:26:35,What You Need to Know Ahead of Adobe's Earnings Report,https://images.financialmodelingprep.com/news/what-you-need-to-know-ahead-of-adobes-earnings-20240908.jpg,investopedia.com,"Adobe (ADBE) is scheduled to release its fiscal third-quarter results after the bell Thursday, with investors likely watching to see whether the company can build on its momentum with artificial intelligence (AI).",https://www.investopedia.com/what-you-need-to-know-ahead-of-adobe-s-earnings-report-8707135
ADBE,2024-09-06 14:15:57,"Adobe Is Successfully Monetizing Generative AI, Analyst Says",https://images.financialmodelingprep.com/news/adobe-is-successfully-monetizing-generative-ai-analyst-says-20240906.jpg,investors.com,"Digital media and marketing software firm Adobe is making significant progress in monetizing its AI offerings, an analyst says.",https://www.investors.com/news/technology/adbe-stock-adobe-monetizing-generative-ai/
ADBE,2024-09-03 13:15:55,Market Correction Alert: Buy These 3 Tech Stocks In September,https://images.financialmodelingprep.com/news/market-correction-alert-buy-these-3-tech-stocks-in-20240903.jpg,247wallst.com,"Investors looking to make the best of what's left of summer, and buy a few growth stocks before the next leg of the bull market takes off, I've got a warning for you.",https://247wallst.com/investing/2024/09/03/market-correction-alert-buy-these-3-tech-stocks-in-september/
ADBE,2024-09-03 10:30:46,Why Adobe Systems (ADBE) is a Top Stock for the Long-Term,https://images.financialmodelingprep.com/news/why-adobe-systems-adbe-is-a-top-stock-for-20240903.jpg,zacks.com,"Finding strong, market-beating stocks with a positive earnings outlook becomes easier with the Focus List, a top feature of the Zacks Premium portfolio service.",https://www.zacks.com/stock/news/2330786/why-adobe-systems-adbe-is-a-top-stock-for-the-long-term?cid=CS-STOCKNEWSAPI-FT-tale_of_the_tape|zacks_education_focus_list-2330786
ADBE,2024-09-03 07:49:00,"Load Up on Adobe Stock and These 2 Others This September, J.P. Morgan Says",https://images.financialmodelingprep.com/news/load-up-on-adobe-stock-and-these-2-others-this-20240903.jpg,barrons.com,"Adobe shares are up 31% over the past three months, having rallied after a strong quarterly earnings report that highlighted strong demand for the software developer's AI products.",https://www.barrons.com/articles/stocks-to-buy-jpmorgan-adobe-323f16ee
ADBE,2024-09-02 11:46:47,3 Tech Stocks to Buy Before the Summer Ends,https://images.financialmodelingprep.com/news/3-tech-stocks-to-buy-before-the-summer-ends-20240902.jpg,247wallst.com,Investors looking for the next stage of economic growth are largely focused on the tech sector.,https://247wallst.com/investing/2024/09/02/3-tech-stocks-to-buy-before-the-summer-ends/
ADBE,2024-09-02 10:51:21,Scoop up These 4 GARP Stocks to Receive Handsome Returns,https://images.financialmodelingprep.com/news/scoop-up-these-4-garp-stocks-to-receive-handsome-20240902.jpg,zacks.com,"The GARP strategy helps investors gain exposure to stocks that have impressive prospects and are trading at a discount. HCA, ADBE, WRB and VERX are some stocks that hold promise.",https://www.zacks.com/stock/news/2330403/scoop-up-these-4-garp-stocks-to-receive-handsome-returns?cid=CS-STOCKNEWSAPI-FT-analyst_blog|rw-2330403
ADBE,2024-08-30 10:05:56,Is Trending Stock Adobe Inc. (ADBE) a Buy Now?,https://images.financialmodelingprep.com/news/is-trending-stock-adobe-inc-adbe-a-buy-now-20240830.jpg,zacks.com,"Adobe (ADBE) has been one of the stocks most watched by Zacks.com users lately. So, it is worth exploring what lies ahead for the stock.",https://www.zacks.com/stock/news/2329420/is-trending-stock-adobe-inc-adbe-a-buy-now?cid=CS-STOCKNEWSAPI-FT-tale_of_the_tape|most_searched_stocks-2329420
ADBE,2024-08-30 07:00:00,10 High-Yield A-Rated Blue-Chips For Potentially Scary Times Ahead,https://images.financialmodelingprep.com/news/10-highyield-arated-bluechips-for-potentially-scary-times-ahead-20240830.jpg,seekingalpha.com,"The economy is stable but cooling, with the labor market showing signs of slowing down. GDP growth is likely to keep falling, and individual companies could suffer. Long-term investors should focus on companies with strong risk management and adaptability to changing economic conditions, ensuring consistent returns and dividend growth. These 10 companies average an A-credit rating and S&P risk management in the top 0.4% of global companies.",https://seekingalpha.com/article/4717585-10-high-yield-blue-chips-scary-times-ahead
ADBE,2024-08-29 04:51:00,"These 2 Unstoppable Stocks -- Up 153,000% and 287,000% Since Their IPOs -- Are Logical Candidates to Announce a Stock Split in September",https://images.financialmodelingprep.com/news/these-2-unstoppable-stocks-up-153000-and-287000-since-their-20240829.jpg,fool.com,"Just over a dozen prominent businesses have announced or completed a stock split in 2024. A consumer staples goliath that hasn't split its shares since early 2000, and has a laundry list of competitive advantages in its sails, is a prime candidate to announce a stock split next month.",https://www.fool.com/investing/2024/08/29/2-stocks-up-153000-and-287000-announce-stock-split/
ADBE,2024-08-28 05:10:00,"3 Magnificent Stocks That I'm ""Never"" Selling",https://images.financialmodelingprep.com/news/3-magnificent-stocks-that-im-never-selling-20240828.jpg,fool.com,Mastercard is a reputable payments processor that is growing both its top and bottom lines and generates consistent free cash flow. Alphabet has a dominant market share in the internet search engine space and is riding on the artificial intelligence boom that promises to deliver long-term growth for the business.,https://www.fool.com/investing/2024/08/28/3-magnificent-stocks-that-im-never-selling/
ADBE,2024-08-27 09:14:01,Adobe Systems (ADBE) Ascends While Market Falls: Some Facts to Note,https://images.financialmodelingprep.com/news/adobe-systems-adbe-ascends-while-market-falls-some-facts-20240827.jpg,zacks.com,"Adobe Systems (ADBE) concluded the recent trading session at $559.44, signifying a +0.2% move from its prior day's close.",https://www.zacks.com/stock/news/2327318/adobe-systems-adbe-ascends-while-market-falls-some-facts-to-note?cid=CS-STOCKNEWSAPI-FT-tale_of_the_tape|yseop_template_6-2327318
ADBE,2024-08-27 06:00:00,Adobe Stock Is Cooling Off But There Are Two Big Tech Stocks That Outshine It In Value,https://images.financialmodelingprep.com/news/adobe-stock-is-cooling-off-but-there-are-two-20240827.jpg,forbes.com,"Adobe stock has been trading sideways this year, declining by about 4% year-to-date. This compares to the Nasdaq-100, which has gained about 18% over the same period.",https://www.forbes.com/sites/greatspeculations/2024/08/27/adobe-stock-is-cooling-off-but-there-are-two-big-tech-stocks-that-outshine-it-in-value/
ADBE,2024-08-26 13:15:36,Adobe (ADBE) Stock Plunges 6.4% YTD: Should You Buy the Dip?,https://images.financialmodelingprep.com/news/adobe-adbe-stock-plunges-64-ytd-should-you-buy-20240826.jpg,zacks.com,Adobe (ADBE) holds long-term promises on the back of its generative AI strength amid a challenging macroeconomic environment.,https://www.zacks.com/stock/news/2327276/adobe-adbe-stock-plunges-6-4-ytd-should-you-buy-the-dip?cid=CS-STOCKNEWSAPI-FT-analyst_blog|most_popular_stocks-2327276
ADBE,2024-08-25 05:05:00,"Generative AI Software Sales Could Soar 18,647% by 2032. 1 Unstoppable Artificial Intelligence (AI) Stock to Buy Before They Do",https://images.financialmodelingprep.com/news/generative-ai-software-sales-could-soar-18647-by-2032-20240825.jpg,fool.com,"Generative artificial intelligence (AI) is growing like gangbusters, and while chips were the initial beneficiary, software will dominate the next wave of AI adoption. Estimates suggest the generative AI software market could soar 18,647% by 2032, according to Bloomberg Intelligence.",https://www.fool.com/investing/2024/08/25/generative-ai-software-sales-could-soar-18647-by-2/
ADBE,2024-08-23 10:31:29,Earnings Growth & Price Strength Make Adobe Systems (ADBE) a Stock to Watch,https://images.financialmodelingprep.com/news/earnings-growth-price-strength-make-adobe-systems-adbe-a-20240823.jpg,zacks.com,The Zacks Focus List offers investors a way to easily find top-rated stocks and build a winning investment portfolio. Here's why you should take advantage.,https://www.zacks.com/stock/news/2326239/earnings-growth-price-strength-make-adobe-systems-adbe-a-stock-to-watch?cid=CS-STOCKNEWSAPI-FT-tale_of_the_tape|zacks_education_focus_list-2326239
ADBE,2024-08-22 12:14:18,2 Tech Stocks To Watch In Late August 2024,https://images.financialmodelingprep.com/news/2-tech-stocks-to-watch-in-late-august-2024-20240822.jpg,stockmarket.com,Tech stocks to watch today.,https://stockmarket.com/featured/2-tech-stocks-to-watch-in-late-august-2024-2024-08-22
ADBE,2024-08-22 11:11:07,"Adobe: Eyes On The Q3 Report, Shares Rangebound",https://images.financialmodelingprep.com/news/adobe-eyes-on-the-q3-report-shares-rangebound-20240822.jpg,seekingalpha.com,"Adobe reported a solid Q2 report this past June, including a significant guidance increase amid high demand for AI-related services. Shares rose big the following session, but I see the stock near fair value ahead of its Q3 report in September. Adobe faces risks from AI investment slowdown and global competition, but analysts expect continued growth.",https://seekingalpha.com/article/4716463-adobe-eyes-on-the-q3-report-shares-rangebound
ADBE,2024-08-22 08:30:00,Billionaires Were Busy Buying This AI Software Stock in Q2,https://images.financialmodelingprep.com/news/billionaires-were-busy-buying-this-ai-software-stock-in-20240822.jpg,fool.com,Two well-known billionaire investors piled into Adobe stock in the second quarter. The company has dominant positions in the creative and PDF software spaces.,https://www.fool.com/investing/2024/08/22/billionaires-were-buying-this-ai-software-stock/
ADBE,2024-08-21 08:00:52,Are Tech Stocks Making a Comeback? 3 Top Picks Leading the Way,https://images.financialmodelingprep.com/news/are-tech-stocks-making-a-comeback-3-top-picks-20240821.jpg,marketbeat.com,"After the brief sell-off in the S&P 500 sparked by the so-called “carry trade” between the U.S. dollar and the Japanese yen, most investors thought that the bullish wave taking over the technology sector was over and done with. As it turns out, these were – and are – some of the stocks that recovered swiftly and now trade near their 52-week highs, but there's much more than just price action backing the further upside that could be had in these names.",https://www.marketbeat.com/stock-ideas/are-tech-stocks-making-a-comeback-3-top-picks-leading-the-way/
ADBE,2024-08-19 18:50:52,Adobe Systems (ADBE) Surpasses Market Returns: Some Facts Worth Knowing,https://images.financialmodelingprep.com/news/adobe-systems-adbe-surpasses-market-returns-some-facts-worth-20240819.jpg,zacks.com,"Adobe Systems (ADBE) closed at $563.12 in the latest trading session, marking a +1.75% move from the prior day.",https://www.zacks.com/stock/news/2324037/adobe-systems-adbe-surpasses-market-returns-some-facts-worth-knowing?cid=CS-STOCKNEWSAPI-FT-tale_of_the_tape|yseop_template_6-2324037
ADBE,2024-08-19 10:06:03,Adobe Inc. (ADBE) is Attracting Investor Attention: Here is What You Should Know,https://images.financialmodelingprep.com/news/adobe-inc-adbe-is-attracting-investor-attention-here-is-what-20240819.jpg,zacks.com,"Adobe (ADBE) has been one of the stocks most watched by Zacks.com users lately. So, it is worth exploring what lies ahead for the stock.",https://www.zacks.com/stock/news/2323616/adobe-inc-adbe-is-attracting-investor-attention-here-is-what-you-should-know?cid=CS-STOCKNEWSAPI-FT-tale_of_the_tape|most_searched_stocks-2323616
ADBE,2024-08-18 07:17:00,3 Stocks That Can Help You Get Richer in 2024 and Beyond,https://images.financialmodelingprep.com/news/3-stocks-that-can-help-you-get-richer-in-20240818.jpg,fool.com,Sony has a turnaround plan and has been buying back stock. Shopify has been growing by double-digits and may get a boost from AI.,https://www.fool.com/investing/2024/08/18/3-stocks-that-can-help-you-to-get-richer-in-2024-a/
ADBE,2024-08-17 04:45:00,3 No-Brainer Artificial Intelligence (AI) Stocks to Buy Amid the Stock Market Sell-Off,https://images.financialmodelingprep.com/news/3-nobrainer-artificial-intelligence-ai-stocks-to-buy-amid-20240817.jpg,fool.com,Not every AI stock will emerge as a winner over the long run. These three companies all benefit from sustainable competitive advantages.,https://www.fool.com/investing/2024/08/17/3-no-brainer-artificial-intelligence-ai-stocks-to/
ADBE,2024-08-14 10:31:09,Brokers Suggest Investing in Adobe (ADBE): Read This Before Placing a Bet,https://images.financialmodelingprep.com/news/brokers-suggest-investing-in-adobe-adbe-read-this-before-20240814.jpg,zacks.com,"The recommendations of Wall Street analysts are often relied on by investors when deciding whether to buy, sell, or hold a stock. Media reports about these brokerage-firm-employed (or sell-side) analysts changing their ratings often affect a stock's price.",https://www.zacks.com/stock/news/2321898/brokers-suggest-investing-in-adobe-adbe-read-this-before-placing-a-bet?cid=CS-STOCKNEWSAPI-FT-fundamental_analysis|average_broker_rating-2321898
ADBE,2024-08-14 08:43:00,Will Adobe Be a Trillion-Dollar Stock by 2035?,https://images.financialmodelingprep.com/news/will-adobe-be-a-trilliondollar-stock-by-2035-20240814.jpg,fool.com,Adobe needs a 15.5% CAGR to reach a $1 trillion market cap by 2035. The stock has enjoyed a 22.7% CAGR over the last decade.,https://www.fool.com/investing/2024/08/14/will-adobe-be-a-trillion-dollar-stock-by-2035/
ADBE,2024-08-13 18:45:39,Here's Why Adobe Systems (ADBE) Gained But Lagged the Market Today,https://images.financialmodelingprep.com/news/heres-why-adobe-systems-adbe-gained-but-lagged-the-20240813.jpg,zacks.com,"Adobe Systems (ADBE) closed at $535.22 in the latest trading session, marking a +0.81% move from the prior day.",https://www.zacks.com/stock/news/2321638/here-s-why-adobe-systems-adbe-gained-but-lagged-the-market-today?cid=CS-STOCKNEWSAPI-FT-tale_of_the_tape|yseop_template_6-2321638
ADBE,2024-08-13 12:57:49,7 Generative AI Stocks That Are Worth Picking Up NOW,https://images.financialmodelingprep.com/news/7-generative-ai-stocks-that-are-worth-picking-up-now-20240813.jpg,investorplace.com,"Artificial intelligence may very well take over the world. However, like anything in the market, excessive hype can push valuations ahead of the sector.",https://investorplace.com/2024/08/7-generative-ai-stocks-that-are-worth-picking-up-now/
ADBE,2024-08-10 08:00:00,The 3 Best Augmented Reality Stocks to Buy in August 2024,https://images.financialmodelingprep.com/news/the-3-best-augmented-reality-stocks-to-buy-in-20240810.jpg,investorplace.com,"As we advance further into the digital age, augmented reality (AR) continues to emerge as a pivotal technology reshaping numerous industries. The AR market is ripe for significant growth.",https://investorplace.com/2024/08/the-3-best-augmented-reality-stocks-to-buy-in-august-2024/
ADBE,2024-08-09 07:30:00,ADBE Stock Analysis: Is Adobe Massively Undervalued?,https://images.financialmodelingprep.com/news/adbe-stock-analysis-is-adobe-massively-undervalued-20240809.jpg,investorplace.com,"Despite the AI-dominated tech rally over the past year, Adobe (NASDAQ: ADBE ) has been a laggard in the industry. The stock is down by more than 11% year-to-date and 3.0% over the past twelve months.",https://investorplace.com/2024/08/adbe-stock-analysis-is-adobe-massively-undervalued/
ADBE,2024-08-09 07:00:00,5 Dividend Blue-Chip Bargain Buys For This Market Downturn,https://images.financialmodelingprep.com/news/5-dividend-bluechip-bargain-buys-for-this-market-downturn-20240809.jpg,seekingalpha.com,"The recent market pullback saw the 3rd highest market volatility in recorded history, with some companies falling over 30% in a few days. This creates incredible opportunities for blue-chip bargain-hunting for smart investors who know where to look. This article highlights five blue-chip bargains in five categories: high-yield, deep value, hyper-growth, highest quality, and lowest price/earnings/growth ratio (growth at a reasonable price).",https://seekingalpha.com/article/4711966-dividend-blue-chip-bargain-buys-market-downturn
ADBE,2024-08-07 09:00:00,Adobe Transforms B2B Marketing with Generative AI-Powered Journey Optimizer to Reach Buying Groups,https://images.financialmodelingprep.com/news/adobe-transforms-b2b-marketing-with-generative-aipowered-journey-optimizer-to-20240807.jpg,businesswire.com,"SAN JOSE, Calif.--(BUSINESS WIRE)--Today, Adobe (Nasdaq:ADBE) announced the general availability of Adobe Journey Optimizer (AJO) B2B Edition. For businesses that sell to other businesses, this offering will activate generative AI to help them engage customers with greater precision and drive profitable growth. Characterized by extensive and complex sales cycles, B2B marketing and sales teams have long struggled to identify specific decision makers that collectively sign off on large purchases.",https://www.businesswire.com/news/home/20240807552993/en/Adobe-Transforms-B2B-Marketing-with-Generative-AI-Powered-Journey-Optimizer-to-Reach-Buying-Groups/
ADBE,2024-08-06 15:11:00,Four Stocks That Look Like Long-Term Bargains,https://images.financialmodelingprep.com/news/four-stocks-that-look-like-longterm-bargains-20240806.jpg,barrons.com,"There's flip side of the market's nasty summer decline. We've identified a handful of beaten-up stocks to buy, including Amazon, Nvidia, AMD, and Adobe.",https://www.barrons.com/articles/amazon-stock-nvidia-stock-bargains-d0941d77
ADBE,2024-08-06 10:01:06,Adobe Inc. (ADBE) Is a Trending Stock: Facts to Know Before Betting on It,https://images.financialmodelingprep.com/news/adobe-inc-adbe-is-a-trending-stock-facts-to-know-20240806.jpg,zacks.com,"Adobe (ADBE) has been one of the stocks most watched by Zacks.com users lately. So, it is worth exploring what lies ahead for the stock.",https://www.zacks.com/stock/news/2316809/adobe-inc-adbe-is-a-trending-stock-facts-to-know-before-betting-on-it?cid=CS-STOCKNEWSAPI-FT-tale_of_the_tape|most_searched_stocks-2316809
ADBE,2024-08-05 13:00:46,Today's Biggest Stock Losers: 6 Names That Are Tanking the Most,https://images.financialmodelingprep.com/news/todays-biggest-stock-losers-6-names-that-are-tanking-20240805.jpg,investorplace.com,"Speculative stocks, especially those tied to the technology sector, are leading the stock market down on Aug. 5. Trump Media & Technology (NASDAQ: DJT ) is down over 8% as of this writing.",https://investorplace.com/2024/08/todays-biggest-stock-losers-6-names-that-are-tanking-the-most/
ADBE,2024-08-03 08:53:00,2 Unstoppable Tech Stocks to Buy Without any Hesitation,https://images.financialmodelingprep.com/news/2-unstoppable-tech-stocks-to-buy-without-any-hesitation-20240803.jpg,fool.com,ServiceNow helps companies manage many internal processes. Adobe is the industry standard for creative software.,https://www.fool.com/investing/2024/08/03/2-unstoppable-tech-stocks-buy-without-hesitation/
