symbol,publishedDate,title,image,site,text,url
ADBE,2025-06-10 14:50:11,Will Adobe (ADBE) Stock Rebound as Q2 Earnings Near?,https://images.financialmodelingprep.com/news/will-adobe-adbe-stock-rebound-as-q2-earnings-near-20250610.jpg,zacks.com,"Set to report its Q2 results on Thursday, June 12, Adobe (ADBE) stock is down nearly 30% from its 52-week high of $587 a share.",https://www.zacks.com/stock/news/2493081/will-adobe-adbe-stock-rebound-as-q2-earnings-near?cid=CS-STOCKNEWSAPI-FT-stocks_in_the_news-2493081
ADBE,2025-06-10 13:29:02,Adobe pricing power and innovation keep analysts bullish amid rising competition,https://images.financialmodelingprep.com/news/adobe-pricing-power-and-innovation-keep-analysts-bullish-amid-20250610.jpg,proactiveinvestors.com,"Adobe Inc (NASDAQ:ADBE) remains a ‘Buy'-rated stock according to analysts at Jefferies, who cited the company's strong product relevance, continued innovation, and compelling valuation. Despite recent underperformance, the analysts noted that Adobe's fundamentals and long-term outlook remain intact.",https://www.proactiveinvestors.com/companies/news/1072729
ADBE,2025-06-10 12:16:08,"Should You Buy, Sell, or Hold Adobe Stock Post Q2 Earnings?",https://images.financialmodelingprep.com/news/should-you-buy-sell-or-hold-adobe-stock-post-20250610.jpg,zacks.com,ADBE's second-quarter fiscal 2025 results are likely to reflect strong demand for GenAI solutions amid growing competition and stretched valuation.,https://www.zacks.com/stock/news/2492812/should-you-buy-sell-or-hold-adobe-stock-post-q2-earnings?cid=CS-STOCKNEWSAPI-FT-analyst_blog|most_popular_stocks-2492812
ADBE,2025-06-10 09:36:51,This Underrated AI Stock is Down 40%. It's a Buy According to Wall Street Pro,https://images.financialmodelingprep.com/news/this-underrated-ai-stock-is-down-40-its-a-20250610.jpg,247wallst.com,Price changes could provide a bit of a near-term tailwind to the creative software giant.,https://247wallst.com/investing/2025/06/10/this-underrated-ai-stock-is-down-40-its-a-buy-according-to-wall-street-pro/
ADBE,2025-06-10 09:01:07,Buy This Tech Stock (ADBE) Down 40% for AI-Powered Upside,https://images.financialmodelingprep.com/news/buy-this-tech-stock-adbe-down-40-for-aipowered-20250610.jpg,zacks.com,Buy Adobe stock on the dip for long-term upside as it expands its creative artificial intelligence efforts.,https://www.zacks.com/commentary/2491386/buy-this-tech-stock-adbe-down-40-for-ai-powered-upside?cid=CS-STOCKNEWSAPI-FT-investment_ideas-2491386
ADBE,2025-06-10 08:30:00,Adobe: Undervalued As Growth Is Fueled By AI Innovation,https://images.financialmodelingprep.com/news/adobe-undervalued-as-growth-is-fueled-by-ai-innovation-20250610.jpg,seekingalpha.com,"Adobe is deeply undervalued, with strong margins, robust cash flow, and significant forward EPS growth compared to both tech and consumer peers. AI integration across Creative, Document, and Experience Clouds is driving innovation, record revenue, and recurring subscription growth, positioning Adobe for future upside. Despite risks from AI competition and economic slowdown, ADBE's balance sheet strength, share buybacks, and high profitability make it a compelling investment opportunity.",https://seekingalpha.com/article/4793312-adobe-stock-undervalued-growth-fueled-by-ai-innovation
ADBE,2025-06-09 10:16:10,Unlocking Q2 Potential of Adobe (ADBE): Exploring Wall Street Estimates for Key Metrics,https://images.financialmodelingprep.com/news/unlocking-q2-potential-of-adobe-adbe-exploring-wall-street-20250609.jpg,zacks.com,"Beyond analysts' top -and-bottom-line estimates for Adobe (ADBE), evaluate projections for some of its key metrics to gain a better insight into how the business might have performed for the quarter ended May 2025.",https://www.zacks.com/stock/news/2490614/unlocking-q2-potential-of-adobe-adbe-exploring-wall-street-estimates-for-key-metrics?cid=CS-STOCKNEWSAPI-FT-fundamental_analysis|nfm_preview-2490614
ADBE,2025-06-09 06:02:35,Sell ADBE Stock Ahead Of Its Earnings?,https://images.financialmodelingprep.com/news/sell-adbe-stock-ahead-of-its-earnings-20250609.jpg,forbes.com,"Adobe (NASDAQ:ADBE) will announce its earnings on Thursday, June 12, 2025. Historically, the stock has shown negative reactions the day following earnings announcements.",https://www.forbes.com/sites/greatspeculations/2025/06/09/sell-adbe-stock-ahead-of-its-earnings/
ADBE,2025-06-08 22:37:59,"Adobe: More Earnings Volatility Possible, But Shares Attractively Priced",https://images.financialmodelingprep.com/news/adobe-more-earnings-volatility-possible-but-shares-attractively-priced-20250608.jpg,seekingalpha.com,"I reiterate my buy rating on Adobe, citing compelling valuation and robust free cash flow despite recent stock underperformance and negative earnings reactions. Adobe's AI adoption and recurring revenue growth remain positive, though EPS guidance has softened, and competitive pressures are rising. My updated fair value target is $533, reflecting lower profit expectations but still indicating about 20% upside from current levels.",https://seekingalpha.com/article/4793315-adobe-stock-more-earnings-volatility-possible-but-attractively-priced
ADBE,2025-06-08 10:00:00,One of the first ‘liberation day' losers reports earnings this week,https://images.financialmodelingprep.com/news/one-of-the-first-liberation-day-losers-reports-earnings-20250608.jpg,marketwatch.com,"Earnings Watch: Results are due from RH, Victoria's Secret, GameStop, Oracle and Adobe",https://www.marketwatch.com/story/one-of-the-first-liberation-day-losers-reports-earnings-this-week-db5d1566
ADBE,2025-06-07 14:57:56,Will the Adobe stock price rise or fall after earnings?,https://images.financialmodelingprep.com/news/will-the-adobe-stock-price-rise-or-fall-after-20250607.jpg,invezz.com,"Adobe stock price has moved sideways in the past few days as investors wait for its earnings, which will shed more color on its progress on artificial intelligence. ADBE was trading at $415 on Friday, up by 25% from its lowest point this year.",https://invezz.com/news/2025/06/07/will-the-adobe-stock-price-rise-or-fall-after-earnings/
ADBE,2025-06-06 14:05:04,Adobe Reports After Close 6/12 — Options Expire The Next Day,https://images.financialmodelingprep.com/news/adobe-reports-after-close-612-options-expire-the-next-20250606.jpg,forbes.com,"According to NextEarningsDate.com, the Adobe next earnings date is projected to be 6/12 after the close, with earnings estimates of $4.97/share on $5.80 Billion of revenue. Looking back, the recent Adobe earnings history looks like this:",https://www.forbes.com/sites/dividendchannel/2025/06/06/adobe-reports-after-close-612---options-expire-the-next-day/
ADBE,2025-06-06 10:43:48,DocuSign (DOCU) Earnings Live: Stock Dodges Landmines Amid Repositioning,https://images.financialmodelingprep.com/news/docusign-docu-earnings-live-stock-dodges-landmines-amid-repositioning-20250606.jpg,https://247wallst.com,"Live Updates Live Coverage Has Ended One Positive... 5:00 pm by Joel South As of 5 p.m. ET, DocuSign is now down 16%. As we&#8217;ve noted in prior updates, this likely is due to lower-than-expected billings guidance. The punishment to the stock is harsher than we would have imagined given these results. One positive to take away from the quarter if you&#8217;re a long-term holder of DocuSign: the company raised its share repurchase program by a billion dollars. Digging into Why DocuSign is Down 4:31 pm by Joel South One key reason DocuSign is down after-hours: the company now expects billings to come in between $3.28 and $3.34 bllion. Previously, the company had guided to $3.3 billion to $3.35 billion. That&#8217;s a slight decrease, but for a company where the main concern weighing on shares is future growth expectations, billings moving in the wrong direction paints a picture of more headwinds to come. Earnings are Out and Docusign is Down 15% 4:25 pm by Eric Bleeker DocuSign beat on revenue and EPS last quarter (posting $.90 versus estimates of $.81). In addition, full year guidance was slightly ahead of Wall Street expectations, yet the stock is down 15%. We&#8217;ll keep digging into what&#8217;s going on during this live blog. Strategic Narrative &amp; Positioning 3:33 pm by Joel South DocuSign continues to reposition itself as more than an e-signature vendor — aiming to be the system of agreement for enterprise workflows. The company is embedding AI across its product stack, pitching productivity and risk-reduction to procurement, legal, and sales teams. However, this repositioning is still in transition. AI feature adoption is early, pricing clarity is limited, and competitive encroachment from Adobe and Microsoft remains a structural headwind. With net retention flat and billings growth trailing revenue, DOCU’s path to reacceleration is uncertain. The bull case hinges on enterprise AI monetization and international growth, while the bear case focuses on mid-single-digit topline and eroding operating leverage. Until a clearer inflection emerges, valuation is likely to remain range-bound. Keys to Watch 3:32 pm by Joel South GenAI Uptake &amp; Monetization: DOCU has leaned into AI with summarization, clause prediction, and document prep tools. While these features are promising, the company has yet to disclose attach or monetization metrics. How and when these tools drive upsell or pricing power is critical to the bull case. Billings vs. Revenue Divergence: The miss on Q1 billings and the tepid full-year billings guide stand in contrast to stable revenue growth. This raises questions about deal cycles, pricing pressure, and pipeline visibility. Investors will be watching closely for signs of large-deal delays or ASP compression. Margin Management Amid FX Headwinds: Despite a solid FCF quarter, DOCU is guiding for lower operating margins in FY25. Execution on cost control while investing in AI and international expansion will be key to preserving profitability. Core Results &amp; Financial Highlights 3:31 pm by Joel South Q1 Financials vs. Consensus: Revenue: $710M vs. $707M est. EPS (adj.): $0.82 vs. $0.79 est. Billings: $709M vs. ~$720M est. (soft) Non-GAAP Operating Margin: 22% FCF: $211M (30% FCF margin) Customer Metrics: Total customers: 1.49M (+10% YoY) Enterprise/commercial mix improving International now 26% of total revenue Retention remains stable with net revenue retention at 100%, down slightly but consistent with expectations. Enterprise renewal rates improved modestly, partially offsetting SMB softness. Expenses were well managed. R&amp;D and S&amp;M both came in slightly below plan, helping support EPS upside. However, management noted headwinds from FX and wage inflation as reasons for the lower full-year margin guide. DocuSign (Nasdaq: DOCU) delivered Q1 results that modestly outperformed consensus, but the stock traded lower post-earnings due to cautious forward billings guidance and a mixed margin profile. Revenue grew 7% YoY to $710M (vs. $707M est.), and EPS came in at $0.82 (vs. $0.79 est.), driven by lower-than-expected opex and stable gross margin. However, billings rose just 5% YoY to $709M, and full-year billings guidance of $2.93B–$2.96B implies a further slowdown. Management reaffirmed full-year revenue guidance of $2.76B–$2.78B, consistent with the ~7% topline growth pace, but operating margins are expected to contract to 21–22% from 23% in FY24. AI was a key focus. DocuSign flagged early adoption of new GenAI features like AI-powered document summarization, clause suggestions, and identity verification tools. While uptake metrics were not disclosed, management emphasized positive early feedback and embedded value in enterprise renewals. Despite the operational progress, the stock fell after hours as investors reacted to a reaffirmed full-year guide with no upward revisions and a weaker Q2 billings outlook. Shares remain in a volatile range, with YTD gains now mostly erased. The post DocuSign (DOCU) Earnings Live: Stock Dodges Landmines Amid Repositioning appeared first on 24/7 Wall St..",https://247wallst.com/investing/2025/06/05/docusign-docu-earnings-live-stock-dodges-landmines-amid-repositioning/
ADBE,2025-06-05 04:30:00,Prediction: 2 Artificial Intelligence (AI) Stocks That Will Be Worth More Than Palantir Within 1 Year,https://images.financialmodelingprep.com/news/prediction-2-artificial-intelligence-ai-stocks-that-will-be-worth-20250605.jpg,fool.com,Artificial intelligence (AI) has been the driving force behind the stock market's gains since the release of ChatGPT in November 2022.,https://www.fool.com/investing/2025/06/05/predict-artificial-intelligence-ai-stocks-palantir/
ADBE,2025-06-04 18:51:30,Why Adobe Systems (ADBE) Outpaced the Stock Market Today,https://images.financialmodelingprep.com/news/why-adobe-systems-adbe-outpaced-the-stock-market-today-20250604.jpg,zacks.com,"Adobe Systems (ADBE) reachead $414.07 at the closing of the latest trading day, reflecting a +0.38% change compared to its last close.",https://www.zacks.com/stock/news/2484936/why-adobe-systems-adbe-outpaced-the-stock-market-today?cid=CS-STOCKNEWSAPI-FT-tale_of_the_tape|yseop_template_6-2484936
ADBE,2025-06-03 06:00:00,2 Dirt Cheap AI Stocks to Buy in June,https://images.financialmodelingprep.com/news/2-dirt-cheap-ai-stocks-to-buy-in-june-20250603.jpg,fool.com,"""Dirt cheap"" and artificial intelligence (AI) aren't typically mentioned in the same sentence. There's a preconceived notion that many of the AI stocks in the market are quite expensive, which is, for the most part, a fair assessment.",https://www.fool.com/investing/2025/06/03/2-dirt-cheap-ai-stocks-to-buy-in-june/
ADBE,2025-06-02 13:00:00,Adobe to Announce Q2 FY2025 Earnings Results on June 12,https://images.financialmodelingprep.com/news/adobe-to-announce-q2-fy2025-earnings-results-on-june-20250602.jpg,businesswire.com,"SAN JOSE, Calif.--(BUSINESS WIRE)--Today, Adobe (Nasdaq:ADBE) announced it will release its second quarter fiscal year 2025 results after the market closes on Thursday, June 12, 2025, followed by a conference call with investors from 2-3 p.m. Pacific Time. The conference call will be streamed live on the Adobe Investor Relations Site. Following the call, a recording and related materials will be available on the site. Adobe uses its website as a channel of distribution of material company infor.",https://www.businesswire.com/news/home/20250602561549/en/Adobe-to-Announce-Q2-FY2025-Earnings-Results-on-June-12/
ADBE,2025-06-02 11:05:04,A Smart Bet On Adobe Stock Ahead Of Earnings?,https://images.financialmodelingprep.com/news/a-smart-bet-on-adobe-stock-ahead-of-earnings-20250602.jpg,forbes.com,"What if we told you that Adobe (NASDAQ: ADBE) stock is setting itself up for a huge gain opportunity? Adobe is set to report earnings on June 12, and if you're the kind of investor who likes to play short-term volatility with defined risk, there's an intriguing opportunity brewing.",https://www.forbes.com/sites/greatspeculations/2025/06/02/a-smart-bet-on-adobe-stock-ahead-of-earnings/
ADBE,2025-06-01 05:15:00,5 Brilliant Stocks to Buy in June,https://images.financialmodelingprep.com/news/5-brilliant-stocks-to-buy-in-june-20250601.jpg,fool.com,"As the calendar flips to June and we have nearly reached the halfway point of 2025, stocks are nearly flat for the year despite the turmoil in the market. As of the time of writing, the S&P 500 is basically flat for the year.",https://www.fool.com/investing/2025/06/01/5-brilliant-stocks-to-buy-in-june/
ADBE,2025-05-31 15:42:46,Adobe stock price is cheap: is it a good buy?,https://images.financialmodelingprep.com/news/adobe-stock-price-is-cheap-is-it-a-good-20250531.jpg,invezz.com,"Adobe stock price has underperformed the broader market and other companies in the software-as-a-service (SaaS) industry like Microsoft, ServiceNow, and Salesforce. It has dropped by over 35% from its highest point last year as concerns about competition and impact of artificial intelligence (AI) remain.",https://invezz.com/news/2025/05/31/adobe-stock-price-is-cheap-is-it-a-good-buy/
ADBE,2025-05-30 10:36:21,Should You Invest in Adobe (ADBE) Based on Bullish Wall Street Views?,https://images.financialmodelingprep.com/news/should-you-invest-in-adobe-adbe-based-on-bullish-20250530.jpg,zacks.com,"When deciding whether to buy, sell, or hold a stock, investors often rely on analyst recommendations. Media reports about rating changes by these brokerage-firm-employed (or sell-side) analysts often influence a stock's price, but are they really important?",https://www.zacks.com/stock/news/2479455/should-you-invest-in-adobe-adbe-based-on-bullish-wall-street-views?cid=CS-STOCKNEWSAPI-FT-fundamental_analysis|average_broker_rating-2479455
ADBE,2025-05-30 06:45:00,2 Cheap Tech Stocks to Buy Right Now,https://images.financialmodelingprep.com/news/2-cheap-tech-stocks-to-buy-right-now-20250530.jpg,fool.com,"The list of what I'd consider ""cheap"" tech stocks has shrunk as the market has recovered over the past few weeks, but there are still some out there that could certainly have that label applied. Two that I think deserve the moniker are Alphabet (GOOG -0.21%) (GOOGL -0.27%) and Adobe (ADBE 0.29%).",https://www.fool.com/investing/2025/05/30/2-cheap-tech-stocks-to-buy-right-now/
ADBE,2025-05-30 05:10:00,3 Tech Stocks You Can Buy and Hold for the Next Decade,https://images.financialmodelingprep.com/news/3-tech-stocks-you-can-buy-and-hold-for-20250530.jpg,fool.com,"Technology has become a major part of our lives, and the surge in demand for digitalization and cloud computing has connected more people and organizations across the world. The emergence of artificial intelligence (AI) has made our lives easier by enabling rapid data analysis to gain insights.",https://www.fool.com/investing/2025/05/30/3-tech-stocks-you-can-buy-and-hold-for-the-next-de/
ADBE,2025-05-29 10:25:12,Salesforce vs. Adobe: Which Cloud Software Stock Has an Edge?,https://images.financialmodelingprep.com/news/salesforce-vs-adobe-which-cloud-software-stock-has-an-20250529.jpg,zacks.com,"CRM outpaces ADBE with stronger AI growth, better valuation, and steadier earnings, giving CRM the edge in cloud software stocks.",https://www.zacks.com/stock/news/2478789/salesforce-vs-adobe-which-cloud-software-stock-has-an-edge?cid=CS-STOCKNEWSAPI-FT-analyst_blog|most_popular_stocks-2478789
ADBE,2025-05-28 09:37:51,Is This Dependable Growth Stock a Buy Right Now?,https://images.financialmodelingprep.com/news/is-this-dependable-growth-stock-a-buy-right-now-20250528.jpg,fool.com,"This company has demonstrated solid revenue growth for a long time, and investors appreciate the reliability.",https://www.fool.com/investing/2025/05/28/is-this-dependable-growth-stock-a-buy-right-now/
ADBE,2025-05-27 18:46:04,Here's Why Adobe Systems (ADBE) Gained But Lagged the Market Today,https://images.financialmodelingprep.com/news/heres-why-adobe-systems-adbe-gained-but-lagged-the-20250527.jpg,zacks.com,"Adobe Systems (ADBE) closed at $413.10 in the latest trading session, marking a +1.33% move from the prior day.",https://www.zacks.com/stock/news/2477914/here-s-why-adobe-systems-adbe-gained-but-lagged-the-market-today?cid=CS-STOCKNEWSAPI-FT-tale_of_the_tape|yseop_template_6-2477914
ADBE,2025-05-27 10:05:37,Adobe Inc. (ADBE) Is a Trending Stock: Facts to Know Before Betting on It,https://images.financialmodelingprep.com/news/adobe-inc-adbe-is-a-trending-stock-facts-to-20250527.jpg,zacks.com,"Adobe (ADBE) has been one of the stocks most watched by Zacks.com users lately. So, it is worth exploring what lies ahead for the stock.",https://www.zacks.com/stock/news/2477568/adobe-inc-adbe-is-a-trending-stock-facts-to-know-before-betting-on-it?cid=CS-STOCKNEWSAPI-FT-tale_of_the_tape|most_searched_stocks-2477568
ADBE,2025-05-22 05:05:08,Time To Buy Adobe Stock?,https://images.financialmodelingprep.com/news/time-to-buy-adobe-stock-20250522.jpg,forbes.com,"Adobe (NASDAQ: ADBE), a global frontrunner in creative software and digital experiences, has consistently achieved strong financial outcomes over the years due to innovation-driven growth. However, the stock's performance during the past five years has been lackluster, as it is presently at almost the same level it occupied in May 2020!",https://www.forbes.com/sites/greatspeculations/2025/05/22/time-to-buy-adobe-stock/
ADBE,2025-05-21 13:16:06,Adobe Jumps 19% in a Month: Is There Any Momentum Left in the Stock?,https://images.financialmodelingprep.com/news/adobe-jumps-19-in-a-month-is-there-any-20250521.jpg,zacks.com,ADBE's performance is expected to remain subdued in the near term due to stiff competition and stretched valuation despite an innovative AI-powered portfolio.,https://www.zacks.com/stock/news/2475545/adobe-jumps-19-in-a-month-is-there-any-momentum-left-in-the-stock?cid=CS-STOCKNEWSAPI-FT-analyst_blog|most_popular_stocks-2475545
ADBE,2025-05-20 11:50:25,Top Fund Managers Are Buying These 3 Cheap Stocks,https://images.financialmodelingprep.com/news/top-fund-managers-are-buying-these-3-cheap-stocks-20250520.jpg,youtube.com,Buffett expects to own some stocks indefinitely—and one of those stocks looks cheap today.,https://www.youtube.com/watch?v=oiw_sNlDcII
ADBE,2025-05-19 18:51:02,Adobe Systems (ADBE) Rises Higher Than Market: Key Facts,https://images.financialmodelingprep.com/news/adobe-systems-adbe-rises-higher-than-market-key-facts-20250519.jpg,zacks.com,"Adobe Systems (ADBE) concluded the recent trading session at $420.76, signifying a +0.87% move from its prior day's close.",https://www.zacks.com/stock/news/2474285/adobe-systems-adbe-rises-higher-than-market-key-facts?cid=CS-STOCKNEWSAPI-FT-tale_of_the_tape|yseop_template_6-2474285
ADBE,2025-05-19 16:00:11,GOOGL vs. ADBE: Which AI-Driven Tech Stock is a Better Buy Now?,https://images.financialmodelingprep.com/news/googl-vs-adbe-which-aidriven-tech-stock-is-a-20250519.jpg,zacks.com,"Alphabet GOOGL and Adobe ADBE are infusing artificial intelligence (AI) into their core offerings. While Alphabet is adding AI to its search and cloud services, Adobe is incorporating AI into its creative products.",https://www.zacks.com/stock/news/2474258/googl-vs-adbe-which-ai-driven-tech-stock-is-a-better-buy-now?cid=CS-STOCKNEWSAPI-FT-analyst_blog|most_popular_stocks-2474258
ADBE,2025-05-19 08:55:00,"RLTR's Reel Intelligence (RI) Emerges as the Comprehensive Leader in Image Generation Surpassing Midjourney, Stable Diffusion, and Adobe Firefly",https://images.financialmodelingprep.com/news/rltrs-reel-intelligence-ri-emerges-as-the-comprehensive-leader-20250519.jpg,accessnewswire.com,"Reel Intelligence (RI), has solidified its position as the most advanced and versatile image generation solution available today. BOTHELL, WASHINGTON / ACCESS Newswire / May 19, 2025 / ReelTime Rentals, Inc. (OTCPINK:RLTR) proudly announces that its proprietary platform, Reel Intelligence (RI), has solidified its position as the most advanced and versatile image generation solution available today.",https://www.accessnewswire.com/newsroom/en/business-and-professional-services/rltrs-reel-intelligence-ri-emerges-as-the-comprehensive-leader-i-1029205
ADBE,2025-05-19 07:46:09,Best Value Stocks According to Morningstar in 2025,https://images.financialmodelingprep.com/news/best-value-stocks-according-to-morningstar-in-2025-20250519.jpg,marketbeat.com,"Thinking independently in the stock market is the premise for a successful career. Still, oftentimes ideas come to a dry up, and no opportunities seem to be lying around for the taking, and this is when investors can take advantage of someone else's homework in the financial markets.",https://www.marketbeat.com/stock-ideas/best-value-stocks-according-to-morningstar-in-2025/
ADBE,2025-05-16 10:58:24,"Nasdaq Index: Bullish Forecast as Adobe, Alphabet, AMD Lead Weekly Stock Market Gains",https://images.financialmodelingprep.com/news/nasdaq-index-bullish-forecast-as-adobe-alphabet-amd-lead-20250516.jpg,fxempire.com,"Nasdaq 100 climbs over 6% this week as easing inflation and tariff relief fuel tech stock gains, with traders watching options expiry and sector rotation.",https://www.fxempire.com/forecasts/article/nasdaq-index-bullish-forecast-as-adobe-alphabet-amd-lead-weekly-stock-market-gains-1519596
ADBE,2025-05-16 10:05:22,Adobe Inc. (ADBE) is Attracting Investor Attention: Here is What You Should Know,https://images.financialmodelingprep.com/news/adobe-inc-adbe-is-attracting-investor-attention-here-is-20250516.jpg,zacks.com,"Adobe (ADBE) has been one of the stocks most watched by Zacks.com users lately. So, it is worth exploring what lies ahead for the stock.",https://www.zacks.com/stock/news/2472843/adobe-inc-adbe-is-attracting-investor-attention-here-is-what-you-should-know?cid=CS-STOCKNEWSAPI-FT-tale_of_the_tape|most_searched_stocks-2472843
ADBE,2025-05-15 13:20:21,"Final Trades: Adobe, Microsoft, Kinetik Holdings and Kinsale Capital",https://images.financialmodelingprep.com/news/final-trades-adobe-microsoft-kinetik-holdings-and-kinsale-capital-20250515.jpg,youtube.com,The Investment Committee give you their top stocks to watch for the second half.,https://www.youtube.com/watch?v=N7oVPH1No4o
