symbol,publishedDate,title,image,site,text,url
ADBE,2024-10-16 11:30:00,Adobe Inc. (ADBE) Investors with Losses are Urged to Contact Levi & Korsinsky to Discuss Their Rights,https://images.financialmodelingprep.com/news/adobe-inc-adbe-investors-with-losses-are-urged-to-20241016.jpg,accesswire.com,"NEW YORK, NY / ACCESSWIRE / October 16, 2024 / Levi & Korsinsky notifies investors that it has commenced an investigation of Adobe Inc. (""Adobe Inc."") (NASDAQ:ADBE) concerning possible violations of federal securities laws. Adobe issued a press release on September 12, 2024, reporting financial results for the third quarter of its fiscal year 2024.",https://www.accesswire.com/viewarticle.aspx?id=932399&lang=en
ADBE,2024-10-16 11:00:00,The Schall Law Firm Urges Investor Participation In A Securities Fraud Case Against Adobe Inc.,https://images.financialmodelingprep.com/news/the-schall-law-firm-urges-investor-participation-in-a-20241016.jpg,accesswire.com,"LOS ANGELES, CA / ACCESSWIRE / October 16, 2024 / The Schall Law Firm, a national shareholder rights litigation firm, announces that it is investigating claims on behalf of investors of Adobe Inc. (""Adobe"" or ""the Company"") (NASDAQ:ADBE) for violations of the securities laws. The investigation focuses on whether the Company issued false and/or misleading statements and/or failed to disclose information pertinent to investors.",https://www.accesswire.com/viewarticle.aspx?id=932152&lang=en
ADBE,2024-10-16 09:00:00,Miro Introduces New Integration With Adobe Express to Bring Powerful Design Capabilities into the Innovation Workspace,https://images.financialmodelingprep.com/news/miro-introduces-new-integration-with-adobe-express-to-bring-20241016.jpg,businesswire.com,"SAN FRANCISCO & AMSTERDAM--(BUSINESS WIRE)-- #adobeexpress--Miro®, the workspace for innovation, today announces further expansion of its ecosystem with Adobe Express now available to users within the platform. Adobe Express is a powerful design tool used to create high-quality, professional creative content. The integration of Adobe Express, the create-anything app, into Miro will empower anyone in an organization – regardless of skill level – to make standout content and coordinate creative campaigns directl.",https://www.businesswire.com/news/home/20241016025406/en/Miro-Introduces-New-Integration-With-Adobe-Express-to-Bring-Powerful-Design-Capabilities-into-the-Innovation-Workspace/
ADBE,2024-10-15 17:15:00,Shareholders that lost money on Adobe Inc.(ADBE) should contact Levi & Korsinsky about Securities Fraud Investigation - ADBE,https://images.financialmodelingprep.com/news/shareholders-that-lost-money-on-adobe-incadbe-should-contact-20241015.jpg,accesswire.com,"NEW YORK, NY / ACCESSWIRE / October 15, 2024 / Levi & Korsinsky notifies investors that it has commenced an investigation of Adobe Inc. (""Adobe Inc."") (NASDAQ:ADBE) concerning possible violations of federal securities laws. Adobe issued a press release on September 12, 2024, reporting financial results for the third quarter of its fiscal year 2024.",https://www.accesswire.com/viewarticle.aspx?id=932043&lang=en
ADBE,2024-10-15 16:45:00,SHAREHOLDER ALERT: Pomerantz Law Firm Investigates Claims On Behalf of Investors of Adobe Inc. - ADBE,https://images.financialmodelingprep.com/news/shareholder-alert-pomerantz-law-firm-investigates-claims-on-behalf-of-investors-of-adobe-20241015.jpg,accesswire.com,"NEW YORK, NY / ACCESSWIRE / October 15, 2024 / Pomerantz LLP is investigating claims on behalf of investors of Adobe Inc. (""Adobe"" or the ""Company"") (NASDAQ:ADBE). Such investors are advised to contact Danielle Peyton at newaction@pomlaw.com or 646-581-9980, ext.",https://www.accesswire.com/viewarticle.aspx?id=932023&lang=en
ADBE,2024-10-15 12:14:18,"Adobe Stock To Turn From Laggard To Leader, Analysts Highlight 'AI Monetization Opportunities' From MAX Creativity Conference",https://images.financialmodelingprep.com/news/adobe-stock-to-turn-from-laggard-to-leader-analysts-20241015.jpg,benzinga.com,Analysts see Adobe Inc ADBE benefitting from new product announcements and a focus on GenAI value add-ons unveiled at the company's MAX 2024 Creativity Conference this week.,https://www.benzinga.com/analyst-ratings/analyst-color/24/10/41339153/adobe-stock-to-turn-from-laggard-to-leader-analysts-highlight-ai-monetization-oppor
ADBE,2024-10-15 11:15:00,Levi & Korsinsky Announces an Investigation on Behalf of Adobe Inc. (ADBE) Shareholders Who May Have Been Affected by Fraud,https://images.financialmodelingprep.com/news/levi-korsinsky-announces-an-investigation-on-behalf-of-adobe-20241015.jpg,accesswire.com,"NEW YORK, NY / ACCESSWIRE / October 15, 2024 / Levi & Korsinsky notifies investors that it has commenced an investigation of Adobe Inc. (""Adobe Inc."") (NASDAQ:ADBE) concerning possible violations of federal securities laws. Adobe issued a press release on September 12, 2024, reporting financial results for the third quarter of its fiscal year 2024.",https://www.accesswire.com/viewarticle.aspx?id=931781&lang=en
ADBE,2024-10-15 11:00:00,Adobe Inc Is Being Investigated For Securities Law Violations And Affected Shareholders Are Encouraged To Help The Schall Law Firm,https://images.financialmodelingprep.com/news/adobe-inc-is-being-investigated-for-securities-law-violations-20241015.jpg,accesswire.com,"LOS ANGELES, CA / ACCESSWIRE / October 15, 2024 / The Schall Law Firm, a national shareholder rights litigation firm, announces that it is investigating claims on behalf of investors of Adobe Inc. (""Adobe"" or ""the Company"") (NASDAQ:ADBE) for violations of the securities laws. The investigation focuses on whether the Company issued false and/or misleading statements and/or failed to disclose information pertinent to investors.",https://www.accesswire.com/viewarticle.aspx?id=931538&lang=en
ADBE,2024-10-14 19:15:00,Adobe Shows Off Its AI. Will Investors Notice?,https://images.financialmodelingprep.com/news/adobe-shows-off-its-ai-will-investors-notice-20241014.jpg,barrons.com,The company has yet to tell customers and investors in detail how it will charge for its emerging AI features.,https://www.barrons.com/articles/adobe-ai-stock-3844a533
ADBE,2024-10-14 19:07:03,Adobe Inc. (ADBE) Adobe MAX 2024 Investor Q&A with Company Leadership (Transcript),https://images.financialmodelingprep.com/news/adobe-inc-adbe-adobe-max-2024-investor-qa-with-20241014.jpg,seekingalpha.com,"Adobe Inc. (NASDAQ:ADBE ) Adobe MAX 2024 Investor Q&A with Company Leadership October 14, 2024 5:00 PM ET Company Participants Jonathan Vaas - VP, IR Shantanu Narayen - Chair & CEO David Wadhwani - President, Digital Media Business Anil Chakravarthy - President, Digital Experience Business Daniel Durn - EVP & CFO Scott Belsky - Chief Strategy Officer & EVP, Design & Emerging Products Steve Day - Head of IR Conference Call Participants Jay Vleeschhouwer - Griffin Securities Michael Turrin - Wells Fargo Saket Kalia - Barclays Karl Keirstead - UBS Mark Murphy - JPMorgan Gregg Moskowitz - Mizuho Securities Jackson Ader - KeyBanc Capital Markets Stefan Slowinski - BNP Paribas Jonathan Vaas Welcome, everyone to Adobe MAX 2024 Investor Update. It's great to see so many friendly faces here, from the investment community, some of our Board members in the back.",https://seekingalpha.com/article/4726739-adobe-inc-adbe-adobe-max-2024-investor-q-company-leadership-transcript
ADBE,2024-10-14 13:02:43,Adobe's AI Video Tools Will Be Priced Differently: CEO,https://images.financialmodelingprep.com/news/adobes-ai-video-tools-will-be-priced-differently-ceo-20241014.jpg,youtube.com,"Adobe unveiled AI tools that can create and modify videos, joining Big Tech companies and startups in trying to capitalize on demand for the emerging technology. Adobe CEO Shantanu Narayen joins Caroline Hyde and Ed Ludlow to explain why the company's new video-generating AI product will be priced differently than its other AI tools on ""Bloomberg Technology.",https://www.youtube.com/watch?v=y52pHRp4u-0
ADBE,2024-10-14 11:15:00,ADBE ALERT: Levi & Korsinsky Reminds Investors of an Investigation Involving Possible Securities Fraud Violations by Adobe Inc.,https://images.financialmodelingprep.com/news/adbe-alert-levi-korsinsky-reminds-investors-of-an-investigation-20241014.jpg,accesswire.com,"NEW YORK, NY / ACCESSWIRE / October 14, 2024 / Levi & Korsinsky notifies investors that it has commenced an investigation of Adobe Inc. (""Adobe Inc."") (NASDAQ:ADBE) concerning possible violations of federal securities laws. Adobe issued a press release on September 12, 2024, reporting financial results for the third quarter of its fiscal year 2024.",https://www.accesswire.com/viewarticle.aspx?id=931228&lang=en
ADBE,2024-10-14 11:00:00,The Schall Law Firm Urges Investor Participation In An Inquiry Into Adobe Inc. For Possible Securities Fraud,https://images.financialmodelingprep.com/news/the-schall-law-firm-urges-investor-participation-in-an-inquiry-20241014.jpg,accesswire.com,"LOS ANGELES, CA / ACCESSWIRE / October 14, 2024 / The Schall Law Firm, a national shareholder rights litigation firm, announces that it is investigating claims on behalf of investors of Adobe Inc. (""Adobe"" or ""the Company"") (NASDAQ:ADBE) for violations of the securities laws. The investigation focuses on whether the Company issued false and/or misleading statements and/or failed to disclose information pertinent to investors.",https://www.accesswire.com/viewarticle.aspx?id=931022&lang=en
ADBE,2024-10-14 09:03:13,"Adobe starts roll-out of AI video tools, challenging OpenAI and Meta",https://images.financialmodelingprep.com/news/adobe-starts-rollout-of-ai-video-tools-challenging-openai-20241014.jpg,reuters.com,"Adobe on Monday said it has started publicly distributing an AI model that can generate video from text prompts, joining the growing field of companies trying to upend film and television production using generative artificial intelligence.",https://www.reuters.com/technology/artificial-intelligence/adobe-starts-roll-out-ai-video-tools-challenging-openai-meta-2024-10-14/
ADBE,2024-10-14 09:02:00,"Adobe Puts Greater Power & Possibility in Hands of Creators, Teams & Marketers at Adobe MAX 2024",https://images.financialmodelingprep.com/news/adobe-puts-greater-power-possibility-in-hands-of-creators-20241014.jpg,businesswire.com,"MIAMI BEACH, Fla.--(BUSINESS WIRE)--Today, Adobe (Nasdaq:ADBE) brought together the global creative community for the kickoff of Adobe MAX 2024 – the world's largest creativity conference – where it introduced over one hundred new Creative Cloud features, including groundbreaking capabilities powered by Adobe Firefly that offer creators unprecedented power to create, collaborate and conceptualize ideas while empowering them to work more productively. Major updates to Adobe Express and an all-ne.",https://www.businesswire.com/news/home/20241014283216/en/Adobe-Puts-Greater-Power-Possibility-in-Hands-of-Creators-Teams-Marketers-at-Adobe-MAX-2024/
ADBE,2024-10-14 09:00:00,"Adobe Introduces New Global Initiative Aimed at Helping 30 Million Next-Generation Learners Develop AI Literacy, Content Creation and Digital Marketing Skills by 2030",https://images.financialmodelingprep.com/news/adobe-introduces-new-global-initiative-aimed-at-helping-30-20241014.jpg,businesswire.com,"MIAMI BEACH, Fla.--(BUSINESS WIRE)--Today at Adobe MAX 2024 – the world's largest creativity conference – Adobe (Nasdaq:ADBE) announced a new global initiative that expands the Adobe Digital Academy's focus to equip next-generation learners and teachers with AI literacy, content creation and digital marketing skills to thrive in the modern workforce. Expanding on the Adobe Digital Academy's decade of success in upskilling and creating new career pathways, the program will provide training, cert.",https://www.businesswire.com/news/home/20241014183798/en/Adobe-Introduces-New-Global-Initiative-Aimed-at-Helping-30-Million-Next-Generation-Learners-Develop-AI-Literacy-Content-Creation-and-Digital-Marketing-Skills-by-2030/
ADBE,2024-10-14 09:00:00,Adobe Launches GenStudio for Performance Marketing to Accelerate Campaigns for Marketing and Creative Teams with Generative AI and Deep Insights,https://images.financialmodelingprep.com/news/adobe-launches-genstudio-for-performance-marketing-to-accelerate-campaigns-20241014.jpg,businesswire.com,"MIAMI BEACH, Fla.--(BUSINESS WIRE)--Today, Adobe (Nasdaq:ADBE) announced the general availability of Adobe GenStudio for Performance Marketing, a new generative AI-first application that empowers brands and agencies to accelerate the delivery of global advertising and marketing campaigns. The new offering addresses one of the biggest challenges facing businesses today, where the need for highly personalized, on-brand and performant content—across a myriad of channels and geographies—is outstrip.",https://www.businesswire.com/news/home/20241014153905/en/Adobe-Launches-GenStudio-for-Performance-Marketing-to-Accelerate-Campaigns-for-Marketing-and-Creative-Teams-with-Generative-AI-and-Deep-Insights/
ADBE,2024-10-14 09:00:00,"New Innovations in Photoshop and Illustrator Transform Creative Workflows and Deliver More Speed, Precision and Power Than Ever Before",https://images.financialmodelingprep.com/news/new-innovations-in-photoshop-and-illustrator-transform-creative-workflows-20241014.jpg,businesswire.com,"MIAMI BEACH, Fla.--(BUSINESS WIRE)--Today at Adobe MAX – the world's largest creativity conference – Adobe (Nasdaq:ADBE) announced breakthrough innovations in Adobe Photoshop and Adobe Illustrator that deliver unmatched power and precision across core graphic design, illustration and creative imaging workflows, while bringing unprecedented levels of speed and productivity. The latest Photoshop and Illustrator releases support creative professionals across all steps of their creative process fro.",https://www.businesswire.com/news/home/20241014130993/en/New-Innovations-in-Photoshop-and-Illustrator-Transform-Creative-Workflows-and-Deliver-More-Speed-Precision-and-Power-Than-Ever-Before/
ADBE,2024-10-14 09:00:00,Next Generation of Adobe's Frame.io Transforms Collaboration for Creative Teams,https://images.financialmodelingprep.com/news/next-generation-of-adobes-frameio-transforms-collaboration-for-creative-20241014.jpg,businesswire.com,"MIAMI BEACH, Fla.--(BUSINESS WIRE)--Today, at Adobe MAX – the world's largest creativity conference – Adobe (Nasdaq: ADBE) announced the general availability of the next generation of Frame.io, building on its industry-leading video post-production capabilities to deliver powerful metadata and asset workflows and expanding support to include photo, design and more. Frame.io empowers teams to better organize and navigate their media and assets in one location, build custom workflows, and central.",https://www.businesswire.com/news/home/20241014709489/en/Next-Generation-of-Adobe%E2%80%99s-Frame.io-Transforms-Collaboration-for-Creative-Teams/
ADBE,2024-10-14 09:00:00,Gatorade Launches Generative AI Squeeze Bottle Personalization to Fuel Athlete Self-Expression,https://images.financialmodelingprep.com/news/gatorade-launches-generative-ai-squeeze-bottle-personalization-to-fuel-20241014.jpg,prnewswire.com,"Available exclusively on Gatorade.com, Gatorade iD now offers next level AI design technology through a collaboration with Adobe Firefly so athletes can personalize their own one-of-one signature bottles CHICAGO , Oct. 14, 2024 /PRNewswire/ -- Today, Gatorade announced the launch of a generative AI-powered design experience on its Gatorade iD free membership platform. In partnership with Adobe Firefly, Adobe's family of creative generative AI models that is safe for commercial use, the new customizer tool allows athletes to express their unique styles and interests through nearly endless personalization possibilities on Gatorade Squeeze Bottles.",https://www.prnewswire.com/news-releases/gatorade-launches-generative-ai-squeeze-bottle-personalization-to-fuel-athlete-self-expression-302274530.html
ADBE,2024-10-13 13:07:00,Investors who lost money on Adobe Inc. should contact Levi & Korsinsky about an ongoing investigation - ADBE,https://images.financialmodelingprep.com/news/investors-who-lost-money-on-adobe-inc-should-contact-20241013.jpg,accesswire.com,"NEW YORK, NY / ACCESSWIRE / October 13, 2024 / Levi & Korsinsky notifies investors that it has commenced an investigation of Adobe Inc. (""Adobe Inc."") (NASDAQ:ADBE) concerning possible violations of federal securities laws. Adobe issued a press release on September 12, 2024, reporting financial results for the third quarter of its fiscal year 2024.",https://www.accesswire.com/viewarticle.aspx?id=930940&lang=en
ADBE,2024-10-13 12:00:00,SHAREHOLDER ALERT: Pomerantz Law Firm Investigates Claims On Behalf of Investors of Adobe Inc. - ADBE,https://images.financialmodelingprep.com/news/shareholder-alert-pomerantz-law-firm-investigates-claims-on-behalf-of-investors-of-adobe-20241013.jpg,accesswire.com,"NEW YORK, NY / ACCESSWIRE / October 13, 2024 / Pomerantz LLP is investigating claims on behalf of investors of Adobe Inc. (""Adobe"" or the ""Company"") (NASDAQ:ADBE). Such investors are advised to contact Danielle Peyton at newaction@pomlaw.com or 646-581-9980, ext.",https://www.accesswire.com/viewarticle.aspx?id=930571&lang=en
ADBE,2024-10-12 22:08:00,Adobe Inc. Investigated Regarding Potential Securities Law Violations - Contact Levi & Korsinsky for Details- ADBE,https://images.financialmodelingprep.com/news/adobe-inc-investigated-regarding-potential-securities-law-violations-contact-20241012.jpg,accesswire.com,"NEW YORK, NY / ACCESSWIRE / October 12, 2024 / Levi & Korsinsky notifies investors that it has commenced an investigation of Adobe Inc. (""Adobe Inc."") (NASDAQ:ADBE) concerning possible violations of federal securities laws. Adobe issued a press release on September 12, 2024, reporting financial results for the third quarter of its fiscal year 2024.",https://www.accesswire.com/viewarticle.aspx?id=930794&lang=en
ADBE,2024-10-12 21:00:00,Adobe Inc Is Being Investigated For Securities Law Violations And Affected Shareholders Are Encouraged To Contact The Schall Law Firm,https://images.financialmodelingprep.com/news/adobe-inc-is-being-investigated-for-securities-law-violations-20241012.jpg,accesswire.com,"LOS ANGELES, CA / ACCESSWIRE / October 12, 2024 / The Schall Law Firm, a national shareholder rights litigation firm, announces that it is investigating claims on behalf of investors of Adobe Inc. (""Adobe"" or ""the Company"") (NASDAQ:ADBE) for violations of the securities laws. The investigation focuses on whether the Company issued false and/or misleading statements and/or failed to disclose information pertinent to investors.",https://www.accesswire.com/viewarticle.aspx?id=930748&lang=en
ADBE,2024-10-12 20:31:00,Adobe Inc. Investigated by Shareholder Rights Advocates – Investors Should Contact Levi & Korsinsky Regarding Potential Securities Law Violations - ADBE,https://images.financialmodelingprep.com/news/adobe-inc-investigated-by-shareholder-rights-advocates-investors-should-20241012.jpg,accesswire.com,"NEW YORK, NY / ACCESSWIRE / October 12, 2024 / Levi & Korsinsky notifies investors that it has commenced an investigation of Adobe Inc. (""Adobe Inc."") (NASDAQ:ADBE) concerning possible violations of federal securities laws. Adobe issued a press release on September 12, 2024, reporting financial results for the third quarter of its fiscal year 2024.",https://www.accesswire.com/viewarticle.aspx?id=930775&lang=en
ADBE,2024-10-11 20:15:00,The Schall Law Firm Urges Investor Participation In An Inquiry Into Adobe Inc. For Possible Securities Fraud,https://images.financialmodelingprep.com/news/the-schall-law-firm-urges-investor-participation-in-an-inquiry-20241011.jpg,accesswire.com,"LOS ANGELES, CA / ACCESSWIRE / October 11, 2024 / The Schall Law Firm, a national shareholder rights litigation firm, announces that it is investigating claims on behalf of investors of Adobe Inc. (""Adobe"" or ""the Company"") (NASDAQ:ADBE) for violations of the securities laws. The investigation focuses on whether the Company issued false and/or misleading statements and/or failed to disclose information pertinent to investors.",https://www.accesswire.com/viewarticle.aspx?id=930661&lang=en
ADBE,2024-10-11 16:00:00,ADBE ALERT- Levi & Korsinsky Has Commenced an Investigation on Behalf of Adobe Inc. Shareholders Who Lost Money,https://images.financialmodelingprep.com/news/adbe-alert-levi-korsinsky-has-commenced-an-investigation-on-20241011.jpg,accesswire.com,"NEW YORK, NY / ACCESSWIRE / October 11, 2024 / Levi & Korsinsky notifies investors that it has commenced an investigation of Adobe Inc. (""Adobe Inc."") (NASDAQ:ADBE) concerning possible violations of federal securities laws. Adobe issued a press release on September 12, 2024, reporting financial results for the third quarter of its fiscal year 2024.",https://www.accesswire.com/viewarticle.aspx?id=930593&lang=en
ADBE,2024-10-11 15:45:00,SHAREHOLDER ALERT: Pomerantz Law Firm Investigates Claims On Behalf of Investors of Adobe Inc. - ADBE,https://images.financialmodelingprep.com/news/shareholder-alert-pomerantz-law-firm-investigates-claims-on-behalf-of-investors-of-adobe-20241011.jpg,accesswire.com,"NEW YORK, NY / ACCESSWIRE / October 11, 2024 / Pomerantz LLP is investigating claims on behalf of investors of Adobe Inc. (""Adobe"" or the ""Company"") (NASDAQ:ADBE). Such investors are advised to contact Danielle Peyton at newaction@pomlaw.com or 646-581-9980, ext.",https://www.accesswire.com/viewarticle.aspx?id=930560&lang=en
ADBE,2024-10-10 19:30:00,Lost Money on Adobe Inc.(ADBE)? Contact Levi & Korsinsky Regarding an Ongoing Investigation,https://images.financialmodelingprep.com/news/lost-money-on-adobe-incadbe-contact-levi-korsinsky-regarding-20241010.jpg,accesswire.com,"NEW YORK, NY / ACCESSWIRE / October 10, 2024 / Levi & Korsinsky notifies investors that it has commenced an investigation of Adobe Inc. (""Adobe Inc."") (NASDAQ:ADBE) concerning possible violations of federal securities laws. Adobe issued a press release on September 12, 2024, reporting financial results for the third quarter of its fiscal year 2024.",https://www.accesswire.com/viewarticle.aspx?id=930208&lang=en
ADBE,2024-10-10 19:15:00,Adobe Inc Is Being Investigated For Securities Law Violations And Impacted Shareholders Are Encouraged To Assist The Schall Law Firm,https://images.financialmodelingprep.com/news/adobe-inc-is-being-investigated-for-securities-law-violations-20241010.jpg,accesswire.com,"LOS ANGELES, CA / ACCESSWIRE / October 10, 2024 / The Schall Law Firm, a national shareholder rights litigation firm, announces that it is investigating claims on behalf of investors of Adobe Inc. (""Adobe"" or ""the Company"") (NASDAQ:ADBE) for violations of the securities laws. The investigation focuses on whether the Company issued false and/or misleading statements and/or failed to disclose information pertinent to investors.",https://www.accesswire.com/viewarticle.aspx?id=930203&lang=en
ADBE,2024-10-10 13:40:58,"Calls of the Day: Netflix, PayPal, Honeywell, 3M, PepsiCo, Salesforce, Adobe and Nike",https://images.financialmodelingprep.com/news/calls-of-the-day-netflix-paypal-honeywell-3m-pepsico-20241010.jpg,youtube.com,The Investment Committee debate the latest Calls Of The Day.,https://www.youtube.com/watch?v=nnqLmQiiv-A
ADBE,2024-10-10 13:30:00,ATTENTION Adobe Inc. Investors: You May Have Been Affected by Fraud- Contact Levi & Korsinsky to Discuss Your Rights,https://images.financialmodelingprep.com/news/attention-adobe-inc-investors-you-may-have-been-affected-20241010.jpg,accesswire.com,"NEW YORK, NY / ACCESSWIRE / October 10, 2024 / Levi & Korsinsky notifies investors that it has commenced an investigation of Adobe Inc. (""Adobe Inc."") (NASDAQ:ADBE) concerning possible violations of federal securities laws. Adobe issued a press release on September 12, 2024, reporting financial results for the third quarter of its fiscal year 2024.",https://www.accesswire.com/viewarticle.aspx?id=929927&lang=en
ADBE,2024-10-10 07:00:00,This Artificial Intelligence (AI) Stock Plunged 15% in the Last Month. Here's Why I'm Not Selling.,https://images.financialmodelingprep.com/news/this-artificial-intelligence-ai-stock-plunged-15-in-the-20241010.jpg,fool.com,Adobe's stock slumped after Q3 earnings weren't well received.,https://www.fool.com/investing/2024/10/10/this-artificial-intelligence-ai-stock-plunged-15-i/
ADBE,2024-10-09 19:30:00,The Schall Law Firm Urges Investor Participation In An Inquiry Into Adobe Inc. For Possible Securities Fraud,https://images.financialmodelingprep.com/news/the-schall-law-firm-urges-investor-participation-in-an-inquiry-20241009.jpg,accesswire.com,"LOS ANGELES, CA / ACCESSWIRE / October 9, 2024 / The Schall Law Firm, a national shareholder rights litigation firm, announces that it is investigating claims on behalf of investors of Adobe Inc. (""Adobe"" or ""the Company"") (NASDAQ:ADBE) for violations of the securities laws. The investigation focuses on whether the Company issued false and/or misleading statements and/or failed to disclose information pertinent to investors.",https://www.accesswire.com/viewarticle.aspx?id=929688&lang=en
