symbol,publishedDate,title,image,site,text,url
COST,2025-03-15 07:21:35,"Why Costco Stock Is Poised to Hit $1,000 Again Soon",https://images.financialmodelingprep.com/news/why-costco-stock-is-poised-to-hit-1000-again-20250315.jpg,marketbeat.com,"Costco Wholesale Corp NASDAQ: COST has been on an unstoppable rally since late 2022, consistently hitting new highs and rewarding long-term investors. That momentum carried into February when the stock reached an all-time record.",https://www.marketbeat.com/stock-ideas/why-costco-stock-is-poised-to-hit-1-000-again-soon/
COST,2025-03-14 11:43:26,2 Stocks Billionaire Investors Are Piling Into,https://images.financialmodelingprep.com/news/2-stocks-billionaire-investors-are-piling-into-20250314.jpg,247wallst.com,"Hedge funds are the VIP lounges of investing. They are locked tight to keep the little guy out, while swinging their doors wide open for the elite.",https://247wallst.com/investing/2025/03/14/2-stocks-billionaire-investors-are-piling-into/
COST,2025-03-14 08:46:20,"Market Momentum Shifts, But These 3 Stocks Are Built to Last",https://images.financialmodelingprep.com/news/market-momentum-shifts-but-these-3-stocks-are-built-20250314.jpg,marketbeat.com,Market momentum clearly shifted in late February as the S&P 500 NYSEARCA: SPY began to sell off. The shift is caused by increased uncertainty related to Trump's tariffs and policy changes and a growing risk of a recession.,https://www.marketbeat.com/stock-ideas/market-momentum-shifts-but-these-3-stocks-are-built-to-last/
COST,2025-03-12 18:41:00,"Can Investing $25,000 Into Costco Wholesale Stock Make You a Millionaire in 25 Years?",https://images.financialmodelingprep.com/news/can-investing-25000-into-costco-wholesale-stock-make-you-20250312.jpg,fool.com,"Costco Wholesale (COST -0.37%) is one of the most iconic and recognizable retailers in the world. Its massive warehouses are often packed with customers, and its treasure hunt experience inevitably leaves shoppers spending much more than they planned.",https://www.fool.com/investing/2025/03/12/can-investing-25000-into-costco-wholesale-stock-ma/
COST,2025-03-12 10:46:33,Jim Cramer is “Scrapping” the Magnificent 7 — Here's a Stock That Looks Better Right Now,https://images.financialmodelingprep.com/news/jim-cramer-is-scrapping-the-magnificent-7-heres-a-20250312.jpg,247wallst.com,"You just knew it was just a matter of time before the Magnificent Seven, a term coined by Mad Money host Jim Cramer, was “scrapped.",https://247wallst.com/investing/2025/03/12/jim-cramer-is-scrapping-the-magnificent-7-heres-a-stock-that-looks-better-right-now/
COST,2025-03-12 07:33:00,Costco Stock Suffers Biggest 1-Day Drop in Over 3 Years. Is The Dividend-Paying Growth Stock a Buy Now?,https://images.financialmodelingprep.com/news/costco-stock-suffers-biggest-1day-drop-in-over-3-years-20250312.jpg,fool.com,Costco Wholesale (COST -0.42%) fell 6.1% on Friday in response to its second-quarter fiscal 2025 results and management commentary on the earnings call. Costco's earnings only came in slightly below Wall Street analyst estimates.,https://www.fool.com/investing/2025/03/12/costco-stock-down-big-buy-sell-now/
COST,2025-03-12 06:45:00,"Warren Buffett Admits His 2021 Sale of This Stock Was ""Probably a Mistake."" Is It Too Late to Invest in Costco?",https://images.financialmodelingprep.com/news/warren-buffett-admits-his-2021-sale-of-this-stock-20250312.jpg,fool.com,"Warren Buffett is known for being one of the greatest investors of all time. For its part, Costco Wholesale (COST -0.42%) has been one of the greatest stocks to buy and hold over the very long term, considering it's up by more than 14,000% since 1985.",https://www.fool.com/investing/2025/03/12/warren-buffett-admits-his-2021-sale-of-this-stock/
COST,2025-03-12 04:25:00,Could Costco Help You Become a Millionaire?,https://images.financialmodelingprep.com/news/could-costco-help-you-become-a-millionaire-20250312.jpg,fool.com,"Costco (COST -0.42%) is a very well run company with a long history of success. And, if the fiscal second quarter of 2025 is any indication, the business continues to perform quite well.",https://www.fool.com/investing/2025/03/12/could-costco-help-you-become-a-millionaire/
COST,2025-03-12 03:09:00,Could the Nasdaq Sell-Off Make This Growth Stock a Buy Again?,https://images.financialmodelingprep.com/news/could-the-nasdaq-selloff-make-this-growth-stock-a-20250312.jpg,fool.com,"Wall Street is an emotional place, which is really what makes markets work. However, every so often, investors flow like lemmings in just one direction.",https://www.fool.com/investing/2025/03/12/could-the-nasdaq-sell-off-make-this-growth-stock-a/
COST,2025-03-11 21:03:00,Nasdaq Correction: 2 Stocks Down 13% and 57% to Buy Now and Hold Forever,https://images.financialmodelingprep.com/news/nasdaq-correction-2-stocks-down-13-and-57-to-20250311.jpg,fool.com,"The markets have been volatile over the past few weeks as investors process a slew of economic and policy changes. The tech-heavy Nasdaq Composite is officially in correction territory, down more than 13% from its recent highs as of the close of trading Monday.",https://www.fool.com/investing/2025/03/11/nasdaq-correction-2-stocks-down-13-and-57-to-buy-n/
COST,2025-03-11 12:50:22,Is Costco Stock a Buy or Sell After Its Latest Q2 Earnings Report?,https://images.financialmodelingprep.com/news/is-costco-stock-a-buy-or-sell-after-its-20250311.jpg,zacks.com,"Costco has long been known for its stability and strong customer base, even in the face of broader economic headwinds.",https://www.zacks.com/stock/news/2428462/is-costco-stock-a-buy-or-sell-after-its-latest-q2-earnings-report?cid=CS-STOCKNEWSAPI-FT-analyst_blog|most_popular_stocks-2428462
COST,2025-03-11 10:05:31,Here is What to Know Beyond Why Costco Wholesale Corporation (COST) is a Trending Stock,https://images.financialmodelingprep.com/news/here-is-what-to-know-beyond-why-costco-wholesale-20250311.jpg,zacks.com,"Costco (COST) has been one of the stocks most watched by Zacks.com users lately. So, it is worth exploring what lies ahead for the stock.",https://www.zacks.com/stock/news/2428125/here-is-what-to-know-beyond-why-costco-wholesale-corporation-cost-is-a-trending-stock?cid=CS-STOCKNEWSAPI-FT-tale_of_the_tape|most_searched_stocks-2428125
COST,2025-03-11 07:12:52,Costco Price Plunge Equals Opportunity for Investors,https://images.financialmodelingprep.com/news/costco-price-plunge-equals-opportunity-for-investors-20250311.jpg,marketbeat.com,"Costco Wholesale NASDAQ: COST March 2025 price plunge allows investors to buy into this industry-leading membership club at a discount ahead of an expected special dividend payment. The company is still a few quarters away from being able to issue another special but is on track, increasing its cash by 25% YTD in Q2 and 35% compared to the prior year.",https://www.marketbeat.com/originals/costco-price-plunge-equals-opportunity-for-investors/
COST,2025-03-10 21:00:00,5 Reasons to Buy Costco Stock Like There's No Tomorrow,https://images.financialmodelingprep.com/news/5-reasons-to-buy-costco-stock-like-theres-no-20250310.jpg,fool.com,"Costco's (COST -3.10%) stock dropped 6% on March 7 after the company posted its latest earnings report. In the second quarter of fiscal 2025, which ended on Feb. 16, the warehouse retailer's revenue rose 9% year over year to $63.72 billion and exceeded analysts' estimates by $640 million.",https://www.fool.com/investing/2025/03/10/5-reasons-to-buy-costco-stock-like-theres-no-tomor/
COST,2025-03-10 11:06:05,Costco's February Comparable Sales Show Impressive Growth,https://images.financialmodelingprep.com/news/costcos-february-comparable-sales-show-impressive-growth-20250310.jpg,zacks.com,Costco's distinctive membership business model and pricing power set it apart from traditional players. Comparable sales for February increase 6.5%.,https://www.zacks.com/stock/news/2427773/costco-s-february-comparable-sales-show-impressive-growth?cid=CS-STOCKNEWSAPI-FT-analyst_blog|company_news_corporate_actions-2427773
COST,2025-03-10 04:40:00,2 Top Growth Stocks to Buy Hand Over Fist in the Nasdaq Correction,https://images.financialmodelingprep.com/news/2-top-growth-stocks-to-buy-hand-over-fist-20250310.jpg,fool.com,"The Nasdaq has been a surefire winner over the past two years, soaring in the double digits annually. Investors were optimistic about the potential for a lower interest rate environment ahead and the fact that such a backdrop could benefit high-growth companies.",https://www.fool.com/investing/2025/03/10/2-top-growth-stocks-to-buy-hand-over-fist-in-the-n/
COST,2025-03-08 05:41:05,"COST stock falls on earnings and tariff threats, but Costco is still opening 12 new U.S. stores this year",https://images.financialmodelingprep.com/news/cost-stock-falls-on-earnings-and-tariff-threats-but-20250308.jpg,fastcompany.com,"Shares of Costco (COST) fell more than 7% in midday trading on Friday after the wholesale retailer reported mixed second-quarter earnings results, missing profit estimates but beating on revenue, as the company braces for the impact of tariffs and inflation on consumer spending.",https://www.fastcompany.com/91293212/costco-stock-falls-on-earnings-12-new-stores-opening-list-of-locations
COST,2025-03-07 13:20:26,"Costco Q2 Earnings Lag Estimates, E-Commerce Comp Sales Rise 21%",https://images.financialmodelingprep.com/news/costco-q2-earnings-lag-estimates-ecommerce-comp-sales-rise-20250307.jpg,zacks.com,"COST's second-quarter results report a 9% year-over-year revenue rise, with e-commerce comparable sales up 20.9%. Strong comparable sales gains across key markets.",https://www.zacks.com/stock/news/2427484/costco-q2-earnings-lag-estimates-e-commerce-comp-sales-rise-21?cid=CS-STOCKNEWSAPI-FT-analyst_blog|earnings_article-2427484
COST,2025-03-07 11:29:14,Shares of Costco Fall After Mixed Earnings and Warnings About Tariffs,https://images.financialmodelingprep.com/news/shares-of-costco-fall-after-mixed-earnings-and-warnings-20250307.jpg,fool.com,"Shares of Costco (COST -6.50%) traded 6.4% lower, as of 10:14 a.m. ET, after the large membership retailer reported mixed earnings results.",https://www.fool.com/investing/2025/03/07/shares-of-costco-fall-after-mixed-earnings-and-war/
COST,2025-03-07 11:22:49,"Costco Wholesale Posts Q4 Earnings Miss; Performing Well Above Peers, Analysts Say",https://images.financialmodelingprep.com/news/costco-wholesale-posts-q4-earnings-miss-performing-well-above-20250307.jpg,benzinga.com,"Costco Wholesale Corp COST shares are down on Friday, after the company reported mixed fiscal second-quarter results.",https://www.benzinga.com/news/earnings/earnings-misses/25/03/44195360/costco-wholesale-posts-q4-earnings-miss-performing-well-above-peers-analysts-say
COST,2025-03-07 10:12:23,Costco Stock Brushes Off Bull Notes After Profit Miss,https://images.financialmodelingprep.com/news/costco-stock-brushes-off-bull-notes-after-profit-miss-20250307.jpg,schaeffersresearch.com,"Costco Wholesale Corp   (NASDAQ:COST) stock is down 4.9% to trade at $206.63 at last glance, after the retailer reported worse-than-expected profits for the second quarter due to rising merchandising costs.",https://www.schaeffersresearch.com/content/news/2025/03/07/costco-stock-brushes-off-bull-notes-after-profit-miss
COST,2025-03-07 09:21:38,Costco earnings fall short as consumers remain cautious with tariffs looming,https://images.financialmodelingprep.com/news/costco-earnings-fall-short-as-consumers-remain-cautious-with-20250307.jpg,proactiveinvestors.com,"Costco Wholesale Corporation (NASDAQ:COST, ETR:CTO) shares edged lower pre-market after the warehouse retailer's fiscal second quarter earnings fell short of expectations. The company's net income was $1.79 billion or $4.02 per share, short of expectations of $4.11 per share.",https://www.proactiveinvestors.com/companies/news/1067575
COST,2025-03-07 09:00:00,"Costco: Strong Business, But Its Earnings Multiple Can't Expand Forever",https://images.financialmodelingprep.com/news/costco-strong-business-but-its-earnings-multiple-cant-expand-20250307.jpg,seekingalpha.com,"Costco's Q2-2025 earnings report showed solid revenue growth but a slight EPS miss, leading to a 1.2% stock dip in after-hours trading. Despite robust fundamentals, Costco's high valuation requires a 12.318% FCF/share CAGR for 20 years to justify its current price. The stock's P/E ratio is already high, limiting future multiple expansion and potentially hurting returns if it contracts.",https://seekingalpha.com/article/4765585-costco-stock-q4-strong-business-but-its-earnings-multiple-cant-expand-forever
COST,2025-03-07 08:29:00,Costco customers showed up despite a cold February. That's not the only thing impressing analysts.,https://images.financialmodelingprep.com/news/costco-customers-showed-up-despite-a-cold-february-thats-20250307.jpg,marketwatch.com,"“No other major retailer of this scale has succeeded in every country it entered,” one analyst noted.",https://www.marketwatch.com/story/costco-customers-showed-up-despite-a-cold-february-thats-not-the-only-thing-impressing-analysts-772a5c62
COST,2025-03-06 21:03:15,Costco Wholesale Corporation (COST) Q2 2025 Earnings Call Transcript,https://images.financialmodelingprep.com/news/costco-wholesale-corporation-cost-q2-2025-earnings-call-transcript-20250306.jpg,seekingalpha.com,"Costco Wholesale Corporation (NASDAQ:COST ) Q2 2025 Earnings Conference Call March 6, 2025 5:00 PM ET Company Participants Gary Millerchip - EVP and CFO Ron Vachris - President and CEO Conference Call Participants Simeon Gutman - Morgan Stanley Michael Lasser - UBS Christopher Horvers - JPMorgan Scot Ciccarelli - Truist Securities Zhihan Ma - Bernstein Oliver Chen - TD Cowen John Heinbockel - Guggenheim Securities Rupesh Parikh - Oppenheimer Greg Melich - Evercore ISI Edward Kelly - Wells Fargo Chuck Grom - Gordon Haskett Kelly Bania - BMO Capital Markets Robert Ohmes - Bank of America Joseph Feldman - Telsey Advisory Group Mike Baker - D.A. Davidson Operator Ladies and gentlemen, thank you for standing by.",https://seekingalpha.com/article/4765557-costco-wholesale-corporation-cost-q2-2025-earnings-call-transcript
COST,2025-03-06 20:01:07,Heavy March Headwinds Continue: Stocks Market Indexes Down,https://images.financialmodelingprep.com/news/heavy-march-headwinds-continue-stocks-market-indexes-down-20250306.jpg,zacks.com,"It's been a dire month for market indexes, no doubt. The Dow is -4.8% over that time period, the S&P 500 is -5.6% and the Nasdaq -8.7%.",https://www.zacks.com/stock/news/2426981/heavy-march-headwinds-continue-stocks-market-indexes-down?cid=CS-STOCKNEWSAPI-FT-ahead_of_wall_street-2426981
COST,2025-03-06 19:58:02,Costco Leans Into Memberships Amid Tariff Uncertainty,https://images.financialmodelingprep.com/news/costco-leans-into-memberships-amid-tariff-uncertainty-20250306.jpg,pymnts.com,"As the Trump administration rolls out — and rescinds — tariffs on Canada and Mexico, investors were anxious to learn how the policy would impact Costco. The company's reliance on membership fees for more than 70% of its operating profits gives it an advantage over competitors in an inflationary environment.",https://www.pymnts.com/earnings/2025/costco-leans-into-memberships-amid-tariff-uncertainty/
COST,2025-03-06 19:00:37,Costco (COST) Q2 Earnings: Taking a Look at Key Metrics Versus Estimates,https://images.financialmodelingprep.com/news/costco-cost-q2-earnings-taking-a-look-at-key-20250306.jpg,zacks.com,"The headline numbers for Costco (COST) give insight into how the company performed in the quarter ended February 2025, but it may be worthwhile to compare some of its key metrics to Wall Street estimates and the year-ago actuals.",https://www.zacks.com/stock/news/2426956/costco-cost-q2-earnings-taking-a-look-at-key-metrics-versus-estimates?cid=CS-STOCKNEWSAPI-FT-fundamental_analysis|nfm-2426956
COST,2025-03-06 18:43:18,Costco says it's been buying up extra inventory as tariff uncertainty looms,https://images.financialmodelingprep.com/news/costco-says-its-been-buying-up-extra-inventory-as-20250306.jpg,businessinsider.com,Costco delivered strong quarterly revenue driven by increased store visits but missed profit expectations. CEO Ron Vachris said the company would work to minimize any cost increases from tariffs.,https://www.businessinsider.com/costco-earnings-purchasing-extra-inventory-tariff-uncertainty-2025-3
COST,2025-03-06 18:25:32,Costco (COST) Lags Q2 Earnings Estimates,https://images.financialmodelingprep.com/news/costco-cost-lags-q2-earnings-estimates-20250306.jpg,zacks.com,"Costco (COST) came out with quarterly earnings of $4.02 per share, missing the Zacks Consensus Estimate of $4.09 per share. This compares to earnings of $3.71 per share a year ago.",https://www.zacks.com/stock/news/2426903/costco-cost-lags-q2-earnings-estimates?cid=CS-STOCKNEWSAPI-FT-tale_of_the_tape|yseop_template_4-2426903
COST,2025-03-06 17:46:04,"Costco Sales Top Estimates, But Earnings Miss",https://images.financialmodelingprep.com/news/costco-sales-top-estimates-but-earnings-miss-20250306.jpg,investopedia.com,"Costco (COST) reported fiscal second-quarter sales that topped analysts' estimates, but earnings missed as costs rose.",https://www.investopedia.com/costco-earnings-q2-fy2025-11692082
COST,2025-03-06 17:42:18,Costco Wholesale Sales Surge 9.1%,https://images.financialmodelingprep.com/news/costco-wholesale-sales-surge-91-20250306.jpg,fool.com,"Costco Wholesale (COST -2.02%), the leading membership warehouse retailer, announced its second quarter fiscal 2025 results on March 6, 2025. Highlighting robust sales growth, it reported $62.53 billion in net sales, a 9.1% increase compared to the same quarter last year.",https://www.fool.com/data-news/2025/03/06/costco-wholesale-sales-surge-91/
COST,2025-03-06 16:41:21,Costco reports mixed second-quarter earnings,https://images.financialmodelingprep.com/news/costco-reports-mixed-secondquarter-earnings-20250306.jpg,cnbc.com,Costco's fiscal second-quarter results missed on earnings but beat on revenue. Net sales for the quarter totaled $62.53 billion.,https://www.cnbc.com/2025/03/06/costco-cost-q2-2025-earnings.html
COST,2025-03-06 16:36:00,Costco shares slip after profit and revenue miss,https://images.financialmodelingprep.com/news/costco-shares-slip-after-profit-and-revenue-miss-20250306.jpg,marketwatch.com,"Shares of Costco slipped after hours on Thursday, after the membership warehouse retailer reported a per-share profit and revenue figures that both missed Wall Street's expectations.",https://www.marketwatch.com/story/costco-shares-slip-after-profit-and-revenue-miss-33f5ca3f
COST,2025-03-06 16:21:54,Costco beats quarterly sales estimates on bulk buying surge,https://images.financialmodelingprep.com/news/costco-beats-quarterly-sales-estimates-on-bulk-buying-surge-20250306.jpg,reuters.com,"Costco Wholesale beat Wall Street expectations for second-quarter revenue on Thursday, as its members shopped more goods, including groceries, home furnishings and electronics, in bulk from its retail outlets amid rising living costs.",https://www.reuters.com/business/retail-consumer/costco-beats-quarterly-sales-estimates-bulk-buying-surge-2025-03-06/
COST,2025-03-06 16:15:00,Costco Wholesale Corporation Reports Second Quarter and Year-To-Date Operating Results For Fiscal 2025 and February Sales Results,https://images.financialmodelingprep.com/news/costco-wholesale-corporation-reports-second-quarter-and-yeartodate-operating-results-20250306.jpg,globenewswire.com,"ISSAQUAH, Wash., March 06, 2025 (GLOBE NEWSWIRE) -- Costco Wholesale Corporation (“Costco” or the “Company”) (Nasdaq: COST) today announced its operating results for the second quarter (twelve weeks) and the first 24 weeks of fiscal 2025, ended February 16, 2025.",https://www.globenewswire.com/news-release/2025/03/06/3038641/0/en/Costco-Wholesale-Corporation-Reports-Second-Quarter-and-Year-To-Date-Operating-Results-For-Fiscal-2025-and-February-Sales-Results.html
COST,2025-03-06 11:45:20,Trade Deficit Widened in January,https://images.financialmodelingprep.com/news/trade-deficit-widened-in-january-20250306.jpg,zacks.com,"Pre-market indexes are in a giving mood an hour ahead of today's opening bell. By that I mean they're giving back most of the gains made on Wednesday, which was the first up-day in the past three sessions.",https://www.zacks.com/stock/news/2426704/trade-deficit-widened-in-january?cid=CS-STOCKNEWSAPI-FT-economic_highlights-2426704
COST,2025-03-06 11:25:19,"ECB Cuts, Jobless Claims Mixed, Trade Deficit Hits Record",https://images.financialmodelingprep.com/news/ecb-cuts-jobless-claims-mixed-trade-deficit-hits-record-20250306.jpg,zacks.com,"While the ECB cut rates 25 bps despite a potential trade war, jobless claims stayed within range but the trade deficit fell through the floor.",https://www.zacks.com/stock/news/2426697/ecb-cuts-jobless-claims-mixed-trade-deficit-hits-record?cid=CS-STOCKNEWSAPI-FT-ahead_of_wall_street-2426697
COST,2025-03-06 10:54:08,"Market Update: Economic Clues from Costco, Taiwan Semi, and Brokers",https://images.financialmodelingprep.com/news/market-update-economic-clues-from-costco-taiwan-semi-and-20250306.jpg,seeitmarket.com,Volatility is back in town. Tariff jitters and concerns about growth and inflation have resulted in an S&P 500 dip and the Cboe Volatility Index (VIX) jumping above 20.,https://www.seeitmarket.com/market-update-economic-clues-from-costco-taiwan-semi-and-brokers/
COST,2025-03-06 09:29:14,How To Earn $500 A Month From Costco Stock Ahead Of Q2 Earnings,https://images.financialmodelingprep.com/news/how-to-earn-500-a-month-from-costco-stock-20250306.jpg,benzinga.com,"Costco Wholesale Corporation COST will release its second-quarter financial results, after the closing bell, on Thursday, March 6.",https://www.benzinga.com/news/earnings/25/03/44165710/how-to-earn-500-a-month-from-costco-stock-ahead-of-q2-earnings
COST,2025-03-06 09:15:29,Costco Moves Into EV Business,https://images.financialmodelingprep.com/news/costco-moves-into-ev-business-20250306.jpg,247wallst.com,The electric vehicle (EV) industry is in trouble in the United States. There had been an expectation that half the new cars sold in 2030 would be EVs.,https://247wallst.com/retail/2025/03/06/costco-moves-into-ev-business/
COST,2025-03-06 08:45:00,"Between Costco and Home Depot, What Is the Top Retail Stock to Buy Right Now?",https://images.financialmodelingprep.com/news/between-costco-and-home-depot-what-is-the-top-20250306.jpg,fool.com,"Costco (COST 1.05%) and Home Depot (HD 1.22%) are two leading retailers that investors are surely familiar with. They have strong industry positions within their specific verticals, whether it's general merchandise or home improvement.",https://www.fool.com/investing/2025/03/06/costco-home-depot-top-stock-buy-right-now/
COST,2025-03-05 13:45:26,"Is Costco (COST) a Solid Growth Stock? 3 Reasons to Think ""Yes""",https://images.financialmodelingprep.com/news/is-costco-cost-a-solid-growth-stock-3-reasons-20250305.jpg,zacks.com,"Costco (COST) possesses solid growth attributes, which could help it handily outperform the market.",https://www.zacks.com/stock/news/2426180/is-costco-cost-a-solid-growth-stock-3-reasons-to-think-yes?cid=CS-STOCKNEWSAPI-FT-tale_of_the_tape|yseop_template_11_growth-2426180
COST,2025-03-05 13:20:16,3 Major Grocery Retailers On Earnings Deck After Target's Warning On Trump Tariffs,https://images.financialmodelingprep.com/news/3-major-grocery-retailers-on-earnings-deck-after-targets-20250305.jpg,investors.com,Major grocery retailers are on tap after Target said higher produce prices from Trump tariffs could come in days. Costco earnings are due late Thursday.,https://www.investors.com/news/costco-earnings-bj-wholesale-club-kroger-target-albertons-trump-tariffs/
COST,2025-03-05 10:30:25,Is It Worth Investing in Costco (COST) Based on Wall Street's Bullish Views?,https://images.financialmodelingprep.com/news/is-it-worth-investing-in-costco-cost-based-on-20250305.jpg,zacks.com,"Investors often turn to recommendations made by Wall Street analysts before making a Buy, Sell, or Hold decision about a stock. While media reports about rating changes by these brokerage-firm employed (or sell-side) analysts often affect a stock's price, do they really matter?",https://www.zacks.com/stock/news/2425882/is-it-worth-investing-in-costco-cost-based-on-wall-street-s-bullish-views?cid=CS-STOCKNEWSAPI-FT-fundamental_analysis|average_broker_rating-2425882
COST,2025-03-04 20:00:00,Costco Stock Is Doing Great! But Is It a Buy Now?,https://images.financialmodelingprep.com/news/costco-stock-is-doing-great-but-is-it-a-20250304.jpg,fool.com,"Costco (COST -0.95%) is hitting it out of the park right now despite the difficult retail backdrop. The company's sales and earnings numbers are nothing short of impressive, thanks at least partly to an advantaged business model.",https://www.fool.com/investing/2025/03/04/costco-stock-is-doing-great-but-is-it-a-buy-now/
