symbol,publishedDate,title,image,site,text,url
COST,2024-09-30 10:05:15,Investors Heavily Search Costco Wholesale Corporation (COST): Here is What You Need to Know,https://images.financialmodelingprep.com/news/investors-heavily-search-costco-wholesale-corporation-cost-here-is-20240930.jpg,zacks.com,"Costco (COST) has been one of the stocks most watched by Zacks.com users lately. So, it is worth exploring what lies ahead for the stock.",https://www.zacks.com/stock/news/2343207/investors-heavily-search-costco-wholesale-corporation-cost-here-is-what-you-need-to-know?cid=CS-STOCKNEWSAPI-FT-tale_of_the_tape|most_searched_stocks-2343207
COST,2024-09-30 06:15:00,15 Best Dividend Stocks for Lifelong Passive Income,https://images.financialmodelingprep.com/news/15-best-dividend-stocks-for-lifelong-passive-income-20240930.jpg,fool.com,"Dividend sustainability trumps high yields when selecting stocks for passive income. The featured companies span diverse sectors including healthcare, consumer goods, retail, finance, and real estate.",https://www.fool.com/investing/2024/09/30/15-best-dividend-stocks-for-lifelong-passive-incom/
COST,2024-09-28 03:36:00,Billionaires Are Selling Costco. These 2 Retail Stocks Are Better Buys.,https://images.financialmodelingprep.com/news/billionaires-are-selling-costco-these-2-retail-stocks-are-20240928.jpg,fool.com,"Costco has been a big winner, but the stock is looking pricey. Home Depot looks poised to gain as interest rates fall.",https://www.fool.com/investing/2024/09/28/billionaires-are-selling-costco-these-2-retail-sto/
COST,2024-09-27 19:40:21,Previewing the Q3 Earnings Season,https://images.financialmodelingprep.com/news/previewing-the-q3-earnings-season-20240927.jpg,zacks.com,"Costco COST shares were down following the company's mixed quarterly release where it narrowly missed on the top-line even as it handily beat bottom-line estimates. Other than the modest revenue miss, there is not a whole lot in the report that Costco shareholders can complain about, as the company continues to deliver impressive results in a consumer spending backdrop that many of its peers are finding challenging.",https://www.zacks.com/commentary/2343034/previewing-the-q3-earnings-season?cid=CS-STOCKNEWSAPI-FT-earnings_preview-2343034
COST,2024-09-27 17:34:00,"The Score: Costco, Micron, EchoStar and More Stocks That Defined the Week",https://images.financialmodelingprep.com/news/the-score-costco-micron-echostar-and-more-stocks-that-20240927.jpg,wsj.com,Here are some of the major companies whose stocks moved on the week's news.,https://www.wsj.com/articles/the-score-costco-micron-echostar-and-more-stocks-that-defined-the-week-3bf0c91c
COST,2024-09-27 16:00:18,Costco Q4 Earnings Beat Estimates Even Though Revenues Miss,https://images.financialmodelingprep.com/news/costco-q4-earnings-beat-estimates-even-though-revenues-miss-20240927.jpg,zacks.com,"Costco's Q4 earnings beat the Zacks Consensus Estimate by 2%, while revenues fall short. Comparable sales rise 5.4% but at a decelerated pace.",https://www.zacks.com/stock/news/2342933/costco-q4-earnings-beat-estimates-even-though-revenues-miss?cid=CS-STOCKNEWSAPI-FT-analyst_blog|earnings_article-2342933
COST,2024-09-27 13:33:06,Can Costco Stock Hit New Highs as Interest Rates Drop?,https://images.financialmodelingprep.com/news/can-costco-stock-hit-new-highs-as-interest-rates-20240927.jpg,marketbeat.com,"An apparent tailwind hit yesterday's value stocks, a new development seen in the declining shares of Costco Wholesale Co. NASDAQ: COST after the company released its latest set of quarterly earnings this week. Costco stock is now down over 2% after the report, a bearish sentiment that comes despite the Federal Reserve (the Fed) recently cutting interest rates by the most since the 2008 financial crisis.",https://www.marketbeat.com/originals/can-costco-stock-hit-new-highs-as-interest-rates-drop/
COST,2024-09-27 13:15:00,"Costco stock 'universally loved,' and its price reflects that",https://images.financialmodelingprep.com/news/costco-stock-universally-loved-and-its-price-reflects-that-20240927.jpg,youtube.com,"Shares of Costco (COST) are sliding after the retailer posted a mixed fourth-quarter earnings report. Revenue came in at $79.70 billion, falling slightly below the expected $79.96 billion.",https://www.youtube.com/watch?v=5AeMqSNqUD8
COST,2024-09-27 13:06:05,Costco touts success of card scanner rollout; speeds up checkout process,https://images.financialmodelingprep.com/news/costco-touts-success-of-card-scanner-rollout-speeds-up-20240927.jpg,foxbusiness.com,"Costco CEO Ron Vachris explained the benefits of the company's new membership card scanners in U.S. stores during the retailer's latest earnings call, and said customers see the pluses.",https://www.foxbusiness.com/markets/costco-touts-success-card-scanner-rollout-speeds-up-checkout-process
COST,2024-09-27 12:50:40,4 Key Takeaways From Costco's Earnings Call,https://images.financialmodelingprep.com/news/4-key-takeaways-from-costcos-earnings-call-20240927.jpg,investopedia.com,"After Costco Wholesale (COST) reported better-than-expected profits but missed sales estimates, executives updated investors about the retailer's first membership fee hike in seven years, its international growth plans, and more in the company's earnings call Thursday.",https://www.investopedia.com/4-key-takeaways-from-costco-earnings-call-q4-fy2024-8719397
COST,2024-09-27 12:15:51,Why Costco Stock Was Pulling Back Today,https://images.financialmodelingprep.com/news/why-costco-stock-was-pulling-back-today-20240927.jpg,fool.com,"Costco delivered a solid earnings report after the close Thursday, but its revenue missed the mark. The stock is expensive, trading at a price-to-earnings ratio of 53.",https://www.fool.com/investing/2024/09/27/why-costco-stock-was-pulling-back-today/
COST,2024-09-27 11:52:19,Costco: Too Expensive For My Shopping Cart,https://images.financialmodelingprep.com/news/costco-too-expensive-for-my-shopping-cart-20240927.jpg,seekingalpha.com,"Costco's modest growth does not justify a 50x PE ratio, making it significantly overvalued. Historical averages suggest lower growth and valuation multiples, indicating a potential downside in COST share prices. Costco Wholesale's current high valuations are driven by momentum; a correction is expected as retail investor enthusiasm wanes.",https://seekingalpha.com/article/4723768-costco-too-expensive-for-my-shopping-cart
COST,2024-09-27 10:35:18,Costco's Strong Q4 Performance Sparks Mixed Analyst Reactions As Stock Slides,https://images.financialmodelingprep.com/news/costcos-strong-q4-performance-sparks-mixed-analyst-reactions-as-20240927.jpg,benzinga.com,"Costco Wholesale Corporation COST shares were down in early trading on Friday, even after the company reported upbeat results for its fiscal fourth quarter.",https://www.benzinga.com/analyst-ratings/analyst-color/24/09/41068281/costcos-strong-q4-performance-sparks-mixed-analyst-reactions-as-stock-slides
COST,2024-09-27 10:06:07,"COST Earnings Slip, BMY Schizophrenia Drug Approval, HPQ Downgrade",https://images.financialmodelingprep.com/news/cost-earnings-slip-bmy-schizophrenia-drug-approval-hpq-downgrade-20240927.jpg,youtube.com,"Costco (COST), one of the biggest names in retail, slips after earnings. Despite a beat on the top line and membership fees, revenue and comp.",https://www.youtube.com/watch?v=hmeDGlNwV8U
COST,2024-09-27 09:47:15,"AI Stock Surge: AMZN, ASML and COST Are Artificial Intelligence Beneficiaries to Own Right Now",https://images.financialmodelingprep.com/news/ai-stock-surge-amzn-asml-and-cost-are-artificial-20240927.jpg,247wallst.com,Artificial intelligence technology is certainly among the most disruptive trends in the market for investors to consider.,https://247wallst.com/investing/2024/09/27/ai-stock-surge-amzn-asml-and-cost-are-artificial-intelligence-beneficiaries-to-own-right-now/
COST,2024-09-27 09:41:40,Dow Surges Over 100 Points; Costco Earnings Top Views,https://images.financialmodelingprep.com/news/dow-surges-over-100-points-costco-earnings-top-views-20240927.jpg,benzinga.com,"U.S. stocks traded higher this morning, with the Dow Jones index rising more than 100 points on Friday.",https://www.benzinga.com/markets/equities/24/09/41067282/dow-surges-over-100-points-costco-earnings-top-views
COST,2024-09-27 09:18:37,Inflation Continues To Ease,https://images.financialmodelingprep.com/news/inflation-continues-to-ease-20240927.jpg,forbes.com,"S&P 500 Hits Its 42nd High, Signaling Broad Market Strength With 80% Stocks Above Moving Averages",https://www.forbes.com/sites/jjkinahan/2024/09/27/inflation-continues-to-ease/
COST,2024-09-27 09:07:00,"Costco's sales are strong, but valuation ‘leaves no room for error,' says analyst",https://images.financialmodelingprep.com/news/costcos-sales-are-strong-but-valuation-leaves-no-room-20240927.jpg,marketwatch.com,"Costco's current valuation “has become extremely stretched,” says Truist Securities.",https://www.marketwatch.com/story/costcos-sales-are-strong-but-valuation-leaves-no-room-for-error-says-analyst-85d4c950
COST,2024-09-27 03:55:15,"From Cart To Chart: Costco's Earnings And The $1,000 Question",https://images.financialmodelingprep.com/news/from-cart-to-chart-costcos-earnings-and-the-1000-20240927.jpg,seekingalpha.com,"Costco's unique business model, acting as a buyer for its members and passing on savings, drives its success and profitability. High membership renewal rates and upfront fees provide Costco with 0% interest financing, aiding in its expansion and financial stability. In this article, we review Costco's earnings and tackle the issue of valuation.",https://seekingalpha.com/article/4723638-costco-stock-q4-earnings-from-cart-to-chart-hold-for-now
COST,2024-09-27 03:45:00,"Costco Stock: Buy, Sell, or Hold?",https://images.financialmodelingprep.com/news/costco-stock-buy-sell-or-hold-20240927.jpg,fool.com,The company continues to grow net sales at robust rates. A recent boost to its annual membership fee should bolster the company's net income growth.,https://www.fool.com/investing/2024/09/27/costco-stock-buy-sell-or-hold/
COST,2024-09-27 03:07:19,Like Costco as consumers seek value: Analyst,https://images.financialmodelingprep.com/news/like-costco-as-consumers-seek-value-analyst-20240927.jpg,youtube.com,"Shelby McFaddin, senior analyst at Motley Fool Asset Management, says customers are in a better place now than they have been for a few years, but continue to look for savings in both staples and discretionary items.",https://www.youtube.com/watch?v=Q_aoFsKo8Cw
COST,2024-09-26 23:33:14,Costco Q4: Membership Fee Increase To Take Effect In FY 2025,https://images.financialmodelingprep.com/news/costco-q4-membership-fee-increase-to-take-effect-in-20240926.jpg,seekingalpha.com,"I reiterate a 'Buy' rating for Costco with a fair value of $980 per share, driven by strong same-store sales and membership growth. COST's traffic and shopping frequencies increased significantly, contributing to a 6.9% same-store sales growth, supported by a 9.6% year-over-year membership increase. The membership fee increase starting September 2024 will significantly boost the Company's operating profits, enhancing their financial outlook for FY25.",https://seekingalpha.com/article/4723611-costco-stock-q4-earnings-membership-fee-increase-to-take-effect-fy-2025-reiterate-buy
COST,2024-09-26 21:02:02,Costco Wholesale Corporation (COST) Q4 2024 Earnings Call Transcript,https://images.financialmodelingprep.com/news/costco-wholesale-corporation-cost-q4-2024-earnings-call-transcript-20240926.jpg,seekingalpha.com,"Costco Wholesale Corporation (NASDAQ:COST ) Q4 2024 Earnings Conference Call September 26, 2024 5:00 PM ET Company Participants Gary Millerchip - EVP & CFO Ron Vachris - CEO Conference Call Participants Simeon Gutman - Morgan Stanley Chris Horvers - JPMorgan Chuck Grom - Gordon Haskett Brandon Cheatham - Citigroup John Heinbockel - Guggenheim Securities Scott Ciccarelli - Truist Securities Rupesh Parikh - Oppenheimer Kelly Bania - BMO Capital Markets Michael Baker - D.A. Davidson Karen Short - Melius Research Greg Melich - Evercore ISI Operator Ladies and gentlemen, thank you for standing by.",https://seekingalpha.com/article/4723602-costco-wholesale-corporation-cost-q4-2024-earnings-call-transcript
COST,2024-09-26 20:07:00,Costco Q4: Revenue Miss Overshadows Earnings Beat,https://images.financialmodelingprep.com/news/costco-q4-revenue-miss-overshadows-earnings-beat-20240926.jpg,seekingalpha.com,"Costco's Q4 FY2024 report showed mixed performance, with a tiny top-line miss and a significant bottom-line beat, driving a slight stock price decline. Despite robust membership renewal rates and higher margins, Costco's valuation remains exorbitant, leaving little margin of safety for investors. Costco's growth rates have slowed, and its stock is overvalued, with a 5-year expected CAGR of -4.14%, making it a tactical ""Sell"".",https://seekingalpha.com/article/4723594-costco-stock-q4-revenue-miss-overshadows-earnings-beat-reiterate-sell
COST,2024-09-26 20:05:13,"Costco's gas sales is a 'fair amount' of revenue, says Telsey Advisory's Joe Feldman",https://images.financialmodelingprep.com/news/costcos-gas-sales-is-a-fair-amount-of-revenue-20240926.jpg,youtube.com,"Joe Feldman, Telsey Advisory Group senior analyst, joins 'Closing Bell Overtime' to talk Costco earnings.",https://www.youtube.com/watch?v=BbLJ8zV_hIg
COST,2024-09-26 19:01:10,S&P Sets New Closing High; COST Mixed in Fiscal Q4,https://images.financialmodelingprep.com/news/sp-sets-new-closing-high-cost-mixed-in-fiscal-20240926.jpg,zacks.com,"Ex-fuel and foreign exchange costs, Costco saw +6.9% gains year over year, demonstrating the importance of lower gasoline prices to its top line.",https://www.zacks.com/stock/news/2342291/s-p-sets-new-closing-high-cost-mixed-in-fiscal-q4?cid=CS-STOCKNEWSAPI-FT-ahead_of_wall_street-2342291
COST,2024-09-26 19:01:08,"Compared to Estimates, Costco (COST) Q4 Earnings: A Look at Key Metrics",https://images.financialmodelingprep.com/news/compared-to-estimates-costco-cost-q4-earnings-a-look-20240926.jpg,zacks.com,"The headline numbers for Costco (COST) give insight into how the company performed in the quarter ended August 2024, but it may be worthwhile to compare some of its key metrics to Wall Street estimates and the year-ago actuals.",https://www.zacks.com/stock/news/2342290/compared-to-estimates-costco-cost-q4-earnings-a-look-at-key-metrics?cid=CS-STOCKNEWSAPI-FT-fundamental_analysis|nfm-2342290
COST,2024-09-26 18:50:39,"Costco's Earnings Top Estimates, But Sales Miss as Growth Slows",https://images.financialmodelingprep.com/news/costcos-earnings-top-estimates-but-sales-miss-as-growth-20240926.jpg,investopedia.com,Costco Wholesale (COST) reported fiscal fourth-quarter earnings that topped analysts' expectations but narrowly missed on revenue as growth slowed.,https://www.investopedia.com/costco-s-earnings-top-estimates-but-sales-miss-as-growth-slows-8719222
COST,2024-09-26 18:26:10,Costco (COST) Surpasses Q4 Earnings Estimates,https://images.financialmodelingprep.com/news/costco-cost-surpasses-q4-earnings-estimates-20240926.jpg,zacks.com,"Costco (COST) came out with quarterly earnings of $5.15 per share, beating the Zacks Consensus Estimate of $5.05 per share. This compares to earnings of $4.86 per share a year ago.",https://www.zacks.com/stock/news/2342222/costco-cost-surpasses-q4-earnings-estimates?cid=CS-STOCKNEWSAPI-FT-tale_of_the_tape|yseop_template_4-2342222
COST,2024-09-26 17:16:48,Earnings Alert: Costco (COST),https://images.financialmodelingprep.com/news/earnings-alert-costco-cost-20240926.jpg,youtube.com,"The retail giant beat on EPS for the quarter but missed on revenue, leading to mixed reaction in after hours trading. The wholesale chain did show promise in its comp and e-commerce sales, but as Joe Tigay points out, maintaining constant growth will just get harder over time for Costco (COST).",https://www.youtube.com/watch?v=Vx54OMnlO3w
COST,2024-09-26 16:43:36,"Costco Posts Major Earnings Beat, But Misses On These Metrics",https://images.financialmodelingprep.com/news/costco-posts-major-earnings-beat-but-misses-on-these-20240926.jpg,investors.com,"Costco cleared Q4 earnings estimates late Thursday, but fell short of revenue views. Costco stock eased in late trade, but near record highs.",https://www.investors.com/news/costco-stock-q4-earnings-report-2024/
COST,2024-09-26 16:42:01,Costco's e-commerce sales surge in Q4 as total sales rise,https://images.financialmodelingprep.com/news/costcos-ecommerce-sales-surge-in-q4-as-total-sales-20240926.jpg,proactiveinvestors.com,"Costco Wholesale Corporation (NASDAQ:COST, ETR:CTO) exceeded earnings expectations in Q4, reporting EPS of $5.29, above the estimated $5.08, and reflecting an 8.8% year-over-year (YoY) increase. Revenue, however, came in slightly below forecasts at $79.7 billion, compared to the expected $79.93 billion.",https://www.proactiveinvestors.com/companies/news/1057070
COST,2024-09-26 16:33:00,Costco's stock slips as quarterly sales come up short,https://images.financialmodelingprep.com/news/costcos-stock-slips-as-quarterly-sales-come-up-short-20240926.jpg,marketwatch.com,"Shares of Costco Wholesale Corp. slipped after hours, after the membership warehouse retailer reported sales trends that came up shy of Wall Street's estimates.",https://www.marketwatch.com/story/costcos-stock-slips-as-quarterly-sales-come-up-short-723508b9
COST,2024-09-26 16:20:07,Costco Wholesale misses quarterly revenue estimates,https://images.financialmodelingprep.com/news/costco-wholesale-misses-quarterly-revenue-estimates-20240926.jpg,reuters.com,"Costco Wholesale missed market expectations for fourth-quarter revenue on Thursday on cautious spending by budget-conscious customers at its membership-only stores, as well as an impact from lower gasoline prices.",https://www.reuters.com/business/retail-consumer/costco-wholesale-misses-quarterly-revenue-estimates-2024-09-26/
COST,2024-09-26 16:15:00,Costco Wholesale Corporation Reports Fourth Quarter and Fiscal Year 2024 Operating Results,https://images.financialmodelingprep.com/news/costco-wholesale-corporation-reports-fourth-quarter-and-fiscal-year-20240926.jpg,globenewswire.com,"ISSAQUAH, Wash., Sept. 26, 2024 (GLOBE NEWSWIRE) -- Costco Wholesale Corporation (“Costco” or the “Company”) (Nasdaq: COST) today announced its operating results for the 16-week fourth quarter and the 52-week fiscal year ended September 1, 2024.",https://www.globenewswire.com/news-release/2024/09/26/2954153/0/en/Costco-Wholesale-Corporation-Reports-Fourth-Quarter-and-Fiscal-Year-2024-Operating-Results.html
COST,2024-09-26 14:42:45,"""No Signs of Resistance"" from Costco's (COST) Customers",https://images.financialmodelingprep.com/news/no-signs-of-resistance-from-costcos-cost-customers-20240926.jpg,youtube.com,"Costco (COST) reports earnings after the closing bell, and @LikeFolio's Megan Brantley sees little downside for the retailer. The one red flag she believes can hold the stock back: its valuation.",https://www.youtube.com/watch?v=K3u_OFhY4Do
COST,2024-09-26 12:41:16,BURL or COST: Which Is the Better Value Stock Right Now?,https://images.financialmodelingprep.com/news/burl-or-cost-which-is-the-better-value-stock-20240926.jpg,zacks.com,Investors interested in stocks from the Retail - Discount Stores sector have probably already heard of Burlington Stores (BURL) and Costco (COST). But which of these two stocks offers value investors a better bang for their buck right now?,https://www.zacks.com/stock/news/2342098/burl-or-cost-which-is-the-better-value-stock-right-now?cid=CS-STOCKNEWSAPI-FT-tale_of_the_tape|yseop_template_3-2342098
COST,2024-09-26 12:39:16,Costco (COST) Price Prediction and Forecast,https://images.financialmodelingprep.com/news/costco-cost-price-prediction-and-forecast-20240926.jpg,247wallst.com,"Headquartered in Issaquah, WA, Costco Wholesale Corporation ( NASDAQ: COST ) sells high volumes of foods and general merchandise at discounted prices through membership warehouses.",https://247wallst.com/forecasts/2024/09/26/costco-cost-price-prediction-and-forecast/
COST,2024-09-26 11:31:00,Is Costco Going Back Down to $873? 1 Wall Street Analyst Thinks So,https://images.financialmodelingprep.com/news/is-costco-going-back-down-to-873-1-wall-20240926.jpg,fool.com,"Truist downgraded Costco to hold with a price target of $873, implying a downside of 3%. At a price-to-earnings ratio of 57, the stock looks overbought.",https://www.fool.com/investing/2024/09/26/1-analyst-sees-costco-going-down-to-873/
COST,2024-09-26 08:24:27,How To Earn $500 A Month From Costco Stock Ahead Of Q4 Earnings,https://images.financialmodelingprep.com/news/how-to-earn-500-a-month-from-costco-stock-20240926.jpg,benzinga.com,"When Costco Wholesale Corporation COST releases earnings for the fourth quarter after the closing bell on Thursday, analysts expect the bulk retailer to report quarterly earnings at $5.08 per share.",https://www.benzinga.com/news/earnings/24/09/41045161/how-to-earn-500-a-month-from-costco-stock-ahead-of-q4-earnings
COST,2024-09-26 01:00:00,Costco Is Poised for Another Strong Quarter,https://images.financialmodelingprep.com/news/costco-is-poised-for-another-strong-quarter-20240926.jpg,barrons.com,"Analysts expect the retailer to report solid revenue and earnings growth, driven by strategic investments in non-food products and e-commerce.",https://www.barrons.com/articles/costco-wholesale-earnings-stock-price-4b2d3fd6
COST,2024-09-25 17:55:54,What Wall Street Analysts Think of Costco's Stock Ahead of Earnings,https://images.financialmodelingprep.com/news/what-wall-street-analysts-think-of-costcos-stock-ahead-20240925.jpg,investopedia.com,"Costco Wholesale (COST) will report fiscal fourth-quarter earnings after the closing bell Thursday, with analysts projecting growth on the top and bottom lines—but very little further appreciation for the shares.",https://www.investopedia.com/what-wall-street-analysts-think-of-costco-s-stock-ahead-of-earnings-8718320
COST,2024-09-25 15:31:27,Is Costco's (COST) Stock a Buy as Earnings Approach,https://images.financialmodelingprep.com/news/is-costcos-cost-stock-a-buy-as-earnings-approach-20240925.jpg,zacks.com,"Wall Street will watch Costco's (COST) stock closely this week with the food and general merchandise retailer set to report its fiscal fourth quarter results on Thursday, September 26.",https://www.zacks.com/stock/news/2341536/is-costco-s-cost-stock-a-buy-as-earnings-approach?cid=CS-STOCKNEWSAPI-FT-stocks_in_the_news-2341536
COST,2024-09-25 15:03:47,Retail Stock Could Soon Burn Options Bears,https://images.financialmodelingprep.com/news/retail-stock-could-soon-burn-options-bears-20240925.jpg,forbes.com,"Costco Wholesale Corporation (NASDAQ:COST) steps into the earnings confessional tomorrow, with the discount retailer scheduled to report fiscal fourth-quarter financial results after the close. Ahead of the event, COST sports an intriguing technical setup worth exploring.",https://www.forbes.com/sites/greatspeculations/2024/09/25/retail-stock-could-soon-burn-options-bears/
COST,2024-09-25 14:26:23,Sectornomics: Tracking valuations in consumer staples,https://images.financialmodelingprep.com/news/sectornomics-tracking-valuations-in-consumer-staples-20240925.jpg,youtube.com,"CNBC's Dominic Chu joins 'The Exchange' to report on consumer staples in Wednesday's edition of “Sectornomics.""",https://www.youtube.com/watch?v=SLnFiDLLsQo
COST,2024-09-25 13:06:26,"The Big 3: XOM, COST, CAT",https://images.financialmodelingprep.com/news/the-big-3-xom-cost-cat-20240925.jpg,youtube.com,Today's Big 3 focuses on stocks trading at or near their all-time highs. Do they have potential for a breakout?,https://www.youtube.com/watch?v=KsQTIKhHwVc
COST,2024-09-25 08:29:47,Top 10 Stock Picks For The Holiday Boom: Adobe Forecasts Unprecedented E-Commerce Sales This Season,https://images.financialmodelingprep.com/news/top-10-stock-picks-for-the-holiday-boom-adobe-forecasts-unprecedented-20240925.jpg,benzinga.com,"Consumers remained a pillar of support for the economy despite the high interest-rate environment that has prevailed since early 2022. With the Federal Reserve implementing a substantial 50 basis-point rate cut, the benefits of which are expected to trickle down to them, consumers are forecasted to splurge on purchases this holiday season, according to early forecasts provided by Adobe on Wednesday.",https://www.benzinga.com/news/24/09/41023224/top-10-stock-picks-for-the-holiday-boom-adobe-forecasts-unprecedented-e-commerce-sales-this-season
COST,2024-09-25 06:05:00,3 Blue Chip Market Beaters to Buy If the Market Crashes,https://images.financialmodelingprep.com/news/3-blue-chip-market-beaters-to-buy-if-the-market-20240925.jpg,fool.com,Apple may have a harder time supporting its high valuation at its current size. Home Depot could produce double-digit returns if the price is right.,https://www.fool.com/investing/2024/09/25/3-blue-chip-market-beaters-to-buy-if-market-crash/
COST,2024-09-24 16:01:08,Should You Buy or Hold Costco Stock Ahead of Q4 Earnings Release?,https://images.financialmodelingprep.com/news/should-you-buy-or-hold-costco-stock-ahead-of-q4-20240924.jpg,zacks.com,"Costco is poised to deliver a decent fourth-quarter fiscal 2024 earnings report, supported by its strategic growth initiatives and loyal customer base.",https://www.zacks.com/stock/news/2340807/should-you-buy-or-hold-costco-stock-ahead-of-q4-earnings-release?cid=CS-STOCKNEWSAPI-FT-analyst_blog|most_popular_stocks-2340807
