symbol,publishedDate,title,image,site,text,url
COST,2024-12-17 10:55:50,Costco exec warns Trump's proposed tariffs would raise costs,https://images.financialmodelingprep.com/news/costco-exec-warns-trumps-proposed-tariffs-would-raise-costs-20241217.jpg,foxbusiness.com,"Costco is the latest retailer to warn that President-elect Trump's proposed tariffs would raise costs. However, the warehouse giant said it's hard to predict the impact.",https://www.foxbusiness.com/lifestyle/costco-exec-warns-trumps-proposed-tariffs-would-raise-costs
COST,2024-12-17 07:15:01,Why Costco's Rally May Continue Into 2025,https://images.financialmodelingprep.com/news/why-costcos-rally-may-continue-into-2025-20241217.jpg,marketbeat.com,"Highly valued or not, Costco NASDAQ: COST can continue to rally in 2025. The stock is pricey, trading at 55x its current year earnings estimate.",https://www.marketbeat.com/originals/why-costcos-rally-may-continue-into-2025/
COST,2024-12-16 20:30:00,Costco's E-Commerce Sales Just Jumped by 13%. Here's Why Investors Should Care.,https://images.financialmodelingprep.com/news/costcos-ecommerce-sales-just-jumped-by-13-heres-why-20241216.jpg,fool.com,"When it comes to retail giant Costco Wholesale (COST 0.36%), there are plenty of things filling up the headlines. First and foremost, Costco stock just crossed $1,000 per share for the first time.",https://www.fool.com/investing/2024/12/16/costcos-e-commerce-sales-just-jumped-by-13-heres-w/
COST,2024-12-16 18:00:00,"Up More Than 200% in the Past 5 Years, Can Costco Continue Its Momentum in 2025?",https://images.financialmodelingprep.com/news/up-more-than-200-in-the-past-5-years-20241216.jpg,fool.com,Costco (COST 0.36%) is one of the best-performing large-cap retail stocks over the past five years. It continued to show why it's one of the top retailers when it once again reported strong results for its fiscal first quarter.,https://www.fool.com/investing/2024/12/16/up-more-than-200-in-the-past-5-years-can-costco-co/
COST,2024-12-16 16:20:54,Costco Q1: Sell The Membership Fee Euphoria,https://images.financialmodelingprep.com/news/costco-q1-sell-the-membership-fee-euphoria-20241216.jpg,seekingalpha.com,"I am rating Costco a “sell” with a price target of $832, as its current valuation fully prices in projected FY25 revenue and operating income growth of 10% and 28% YoY, respectively. With the recent 8.3% increase in membership fees, effective as of September, Costco could see a 61% YoY in membership income, assuming minimal churn and a growing mix of Executive members. Costco's expansion plans and e-commerce growth are positive, but uncertain macroeconomic conditions and declining sales per member could hurt profitability.",https://seekingalpha.com/article/4744655-costco-q1-sell-the-membership-fee-euphoria
COST,2024-12-16 14:41:48,"Costco executive warns of price hikes because of Trump tariffs: ‘When it rains, it rains on everybody'",https://images.financialmodelingprep.com/news/costco-executive-warns-of-price-hikes-because-of-trump-20241216.jpg,nypost.com,The president-elect has said he plans to slap a 25% levy on all goods entering the US from Mexico and Canada.,https://nypost.com/2024/12/16/business/costco-executive-warns-of-price-hikes-because-of-trump-tariffs/
COST,2024-12-16 10:05:16,Costco Wholesale Corporation (COST) Is a Trending Stock: Facts to Know Before Betting on It,https://images.financialmodelingprep.com/news/costco-wholesale-corporation-cost-is-a-trending-stock-facts-20241216.jpg,zacks.com,"Costco (COST) has been one of the stocks most watched by Zacks.com users lately. So, it is worth exploring what lies ahead for the stock.",https://www.zacks.com/stock/news/2383829/costco-wholesale-corporation-cost-is-a-trending-stock-facts-to-know-before-betting-on-it?cid=CS-STOCKNEWSAPI-FT-tale_of_the_tape|most_searched_stocks-2383829
COST,2024-12-15 19:19:48,"Costco: I Was Wrong, Upgrading To Buy",https://images.financialmodelingprep.com/news/costco-i-was-wrong-upgrading-to-buy-20241215.jpg,seekingalpha.com,"Costco has significantly outperformed the S&P 500, rising 35% in nine months, prompting a reassessment of its stock rating from Hold to Buy. Despite a high P/E ratio, Costco's strong retail operations and potential in Retail Media Networks justify a small Buy position. Costco's unique customer loyalty and comprehensive purchase data position it well to challenge Amazon in the RMN space, potentially generating substantial future revenue.",https://seekingalpha.com/article/4744411-costco-stock-upgrading-to-buy
COST,2024-12-15 18:15:00,Can Costco Become a Trillion-Dollar Stock by 2030?,https://images.financialmodelingprep.com/news/can-costco-become-a-trilliondollar-stock-by-2030-20241215.jpg,fool.com,"As of this writing, there are nine different companies that have made it into the illustrious trillion-dollar club. The vast majority of these operate within the technology sector.",https://www.fool.com/investing/2024/12/15/can-costco-become-a-trillion-dollar-stock-by-2030/
COST,2024-12-15 05:50:00,Where Will Costco Stock Be in 3 Years?,https://images.financialmodelingprep.com/news/where-will-costco-stock-be-in-3-years-20241215.jpg,fool.com,Costco Wholesale's (COST 0.10%) stock rallied nearly 80% over the past three years as the S&P 500 advanced about 30%. The warehouse retailer outperformed the market as it impressed investors with its consistent growth and resistance to economic headwinds.,https://www.fool.com/investing/2024/12/15/where-will-costco-stock-be-in-3-years/
COST,2024-12-15 04:13:00,3 Lessons Dividend Stock Investors Can Benefit From in 2025,https://images.financialmodelingprep.com/news/3-lessons-dividend-stock-investors-can-benefit-from-in-20241215.jpg,fool.com,The end of the year is a perfect time to reflect on your investment journey. Part of that reflection can involve identifying mistakes worth avoiding or portfolio moves to make before the end of the year.,https://www.fool.com/investing/2024/12/15/3-lessons-dividend-stock-investors-benefit-2025/
COST,2024-12-14 05:05:00,3 Facts About Costco You Must Know Before Buying the Stock,https://images.financialmodelingprep.com/news/3-facts-about-costco-you-must-know-before-buying-20241214.jpg,fool.com,"Costco Wholesale (COST 0.10%) is not only a consumer favorite, but a top choice among the investment community as well. Shares of the warehouse club operator have risen 595% in the past decade.",https://www.fool.com/investing/2024/12/14/must-know-facts-costco-before-buying-stock/
COST,2024-12-13 23:54:16,"Best Way To Invest $100,000: Build An 8-Stock Portfolio For Growth And Value",https://images.financialmodelingprep.com/news/best-way-to-invest-100000-build-an-8stock-portfolio-20241213.jpg,seekingalpha.com,"Concentrate on a select few high-conviction stocks across different sectors to avoid ""diworsification"" and maximize returns, inspired by Charlie Munger and Warren Buffett. Utilize Joel Greenblatt's ""Magic Formula"" and James O'Shaughnessy's methodologies to screen stocks based on earnings yield and return on total capital. Exclude overly regulated sectors like Utilities, Financials, and REITs to focus on sectors with higher growth potential and less regulatory constraints.",https://seekingalpha.com/article/4744245-best-way-to-invest-100000-build-an-8-stock-portfolio-for-growth-and-value
COST,2024-12-13 13:32:54,Costco Unharmed By Subscription Hike As Retailer Beats Street Forecast,https://images.financialmodelingprep.com/news/costco-unharmed-by-subscription-hike-as-retailer-beats-street-20241213.jpg,forbes.com,"Costco Wholesale ruffled some feathers earlier this year when it warned that subscription rates were going up for the first time since 2017, but the bulk discounter beat earnings estimates for its fiscal first quarter yesterday.",https://www.forbes.com/sites/markfaithfull/2024/12/13/costco-unharmed-by-subscription-hike-as-retailer-beats-street-forecast/
COST,2024-12-13 13:10:00,Costco Stock Climbs After Earnings. Why Analysts Don't Mind Its High Price Tag.,https://images.financialmodelingprep.com/news/costco-stock-climbs-after-earnings-why-analysts-dont-mind-20241213.jpg,barrons.com,The warehouse clubs' fledgling e-commerce business is driving sales of discretionary items.,https://www.barrons.com/articles/costco-wholesale-stock-price-earnings-91486950
COST,2024-12-13 12:30:14,Memberships are at 'the core' of Costco's success: Analyst,https://images.financialmodelingprep.com/news/memberships-are-at-the-core-of-costcos-success-analyst-20241213.jpg,youtube.com,"Costco Wholesale (COST) posted a fiscal first-quarter earnings beat, with e-commerce sales rising 13% year over year. Jefferies Senior VP of Equity Research Corey Tarlowe joined the Morning Brief to discuss the company's performance.",https://www.youtube.com/watch?v=Jq_EArLgMtA
COST,2024-12-13 12:28:07,Costco Q4: Strong Membership Fee Growth Likely Ahead,https://images.financialmodelingprep.com/news/costco-q4-strong-membership-fee-growth-likely-ahead-20241213.jpg,seekingalpha.com,"Costco Wholesale Corporation's strong membership fee income growth and 7.1% adjusted comparable sales growth support a “Buy” rating with a fair value of $1,200 per share. The recent membership fee increase will significantly impact future quarters, with membership fee income expected to grow by 14.5% in FY25. E-commerce growth of 13.2% and enhancements to Costco's digital network further bolster the company's robust performance and future outlook.",https://seekingalpha.com/article/4744170-costco-q4-strong-membership-fee-growth-likely-ahead
COST,2024-12-13 12:04:49,Costco's Unique Retail Model And Solid Growth Stand Out In Challenging Market: Analysts,https://images.financialmodelingprep.com/news/costcos-unique-retail-model-and-solid-growth-stand-out-20241213.jpg,benzinga.com,"JP Morgan analyst Christopher Horvers reiterated the Overweight rating on Costco Wholesale Corporation COST with a price forecast of $1,090.",https://www.benzinga.com/24/12/42488201/costcos-unique-retail-model-and-solid-growth-stand-out-in-challenging-market-analysts-note
COST,2024-12-13 11:00:46,Why Is Costco Stock Up 2x S&P 500 This Year?,https://images.financialmodelingprep.com/news/why-is-costco-stock-up-2x-sp-500-this-20241213.jpg,forbes.com,"Note: Costco FY'24 ended on September 1, 2024.",https://www.forbes.com/sites/greatspeculations/2024/12/13/why-is-costco-stock-up-2x-sp-500-this-year/
COST,2024-12-13 10:40:43,Is Costco Stock Still a Buy After Earnings?,https://images.financialmodelingprep.com/news/is-costco-stock-still-a-buy-after-earnings-20241213.jpg,kiplinger.com,Costco stock is slightly higher Friday after the warehouse club beat expectations for its fiscal first quarter. Here's what Wall Street has to say.,https://www.kiplinger.com/investing/stocks/is-costco-stock-still-a-buy-after-earnings
COST,2024-12-13 10:36:29,Costco: Waiting For A Dip? Next Quarter Is Your Hope,https://images.financialmodelingprep.com/news/costco-waiting-for-a-dip-next-quarter-is-your-hope-20241213.jpg,seekingalpha.com,"Costco Wholesale Corporation's consistent performance continued in fiscal Q1 '25, with revenues up 7.5% and EPS growing 12.8%, beating estimates. Costco's business model continues to outperform, frustrating bears awaiting a valuation dip. However, next quarter may be weaker due to inferior e-commerce positioning and tougher comps, possibly leading to a correction.",https://seekingalpha.com/article/4744147-costco-waiting-for-a-dip-next-quarter-is-your-hope
COST,2024-12-13 10:31:00,"Costco, boosted by traffic and digital sales, is well positioned for future gains, says Jefferies",https://images.financialmodelingprep.com/news/costco-boosted-by-traffic-and-digital-sales-is-well-20241213.jpg,marketwatch.com,"Costco Wholesale Corp., which reported first-quarter results after market close Thursday, is well placed for future share gains, according to analyst firm Jefferies.",https://www.marketwatch.com/story/costco-boosted-by-traffic-and-digital-sales-is-well-positioned-for-future-gains-says-jefferies-5c734af2
COST,2024-12-13 10:23:41,"RH Year-High Rally, COST Little Changed, Homebuilder Downgrades",https://images.financialmodelingprep.com/news/rh-yearhigh-rally-cost-little-changed-homebuilder-downgrades-20241213.jpg,youtube.com,"Broadcom (AVGO) may have stolen the show with its earnings, but RH ushers a huge rally of its own with raised guidance despite a miss on earnings. Costco (COST) didn't shake a lot of ground in the market after reporting an earnings beat.",https://www.youtube.com/watch?v=WDVY3Uw8bTU
COST,2024-12-13 09:35:18,"Costco Q1 Earnings Beat Estimates, Comparable Sales Rise 5.2% Y/Y",https://images.financialmodelingprep.com/news/costco-q1-earnings-beat-estimates-comparable-sales-rise-52-20241213.jpg,zacks.com,"Costco's Q1 EPS beats estimates, sales increase 7.5%, and membership jumps to 77.4M with a 90.4% renewal rate, highlighting strong customer loyalty.",https://www.zacks.com/stock/news/2383206/costco-q1-earnings-beat-estimates-comparable-sales-rise-5-2-y-y?cid=CS-STOCKNEWSAPI-FT-analyst_blog|earnings_article-2383206
COST,2024-12-13 09:14:07,"Costco: $1,000 Per Share Has No Basis In Reality",https://images.financialmodelingprep.com/news/costco-1000-per-share-has-no-basis-in-reality-20241213.jpg,seekingalpha.com,"Costco's stock has surged rapidly, but technical indicators suggest a potential pullback, making the current risk/reward ratio unattractive. Despite strong revenue and membership fee growth, Costco's valuation is excessively high, resembling that of a high-growth tech company. The stock trades at unprecedented multiples, with a PEG ratio far above undervalued growth stocks, indicating overvaluation.",https://seekingalpha.com/article/4744126-costco-1000-per-share-no-basis-in-reality
COST,2024-12-13 09:10:13,"COST Falters After Earnings, CRM Upgrade",https://images.financialmodelingprep.com/news/cost-falters-after-earnings-crm-upgrade-20241213.jpg,youtube.com,"Costco (COST) fades from overnight highs following the wholesale retailer's 1Q earnings report. COST reported a top-and-bottom line earnings beat, with comp.",https://www.youtube.com/watch?v=4rkMFhCAz7M
COST,2024-12-13 08:20:46,5 Things to Know Before the Stock Market Opens,https://images.financialmodelingprep.com/news/5-things-to-know-before-the-stock-market-opens-20241213.jpg,investopedia.com,"Stock futures were higher early Friday, with the Nasdaq looking to return to gains while and the Dow in position to break its losing streak; chipmaker Broadcom (AVGO) soared as it reported strong revenue growth on surging artificial intelligence (AI) sales; Costco Wholesale (COST) beat earnings estimates in its first report since raising its membership fee; furniture retailer RH (RH) jumped after posting a quarterly profit and raising demand projections; Apple (AAPL) shares moved higher on analyst optimism over the company's AI products.",https://www.investopedia.com/5-things-to-know-before-the-stock-market-opens-december-13-2024-8760974
COST,2024-12-13 06:55:39,"US Stocks Likely To Open Higher, Investors Eye Fed Policy Meet Next Week: Broadcom, RH, Costco In Focus",https://images.financialmodelingprep.com/news/us-stocks-likely-to-open-higher-investors-eye-fed-20241213.jpg,benzinga.com,U.S. stock futures advanced on Friday in premarket hours after declining in trade on Thursday. The futures of all four major indices were trading higher.,https://www.benzinga.com/24/12/42480972/us-markets-to-open-higher-ahead-of-feds-policy-meet-next-week-broadcom-rh-costco-in-focus
COST,2024-12-13 06:15:00,Meet the Monster Stock That Continues to Crush the Market,https://images.financialmodelingprep.com/news/meet-the-monster-stock-that-continues-to-crush-the-20241213.jpg,fool.com,"Costco (COST -0.63%) has been one of the biggest winners in the market over the past three decades, and investors can learn a lot from the company's success. In this video, Travis Hoium explains the company's business model and how it's so powerful.",https://www.fool.com/investing/2024/12/13/meet-the-monster-stock-that-continues-to-crush-the/
COST,2024-12-13 05:06:00,Prediction: These Will Be Wall Street's 2 Most-Prominent Stock-Split Stocks of 2025,https://images.financialmodelingprep.com/news/prediction-these-will-be-wall-streets-2-mostprominent-stocksplit-20241213.jpg,fool.com,"In case you haven't noticed, the stock market has been practically unstoppable in 2024. The iconic Dow Jones Industrial Average, benchmark S&P 500, and growth-focused Nasdaq Composite have reached multiple record highs and respectively risen by 17%, 27%, and 31% this year, as of the closing bell on Dec. 10.",https://www.fool.com/investing/2024/12/13/prediction-wall-street-2-stock-split-stocks-2025/
COST,2024-12-13 04:21:38,Costco can cope with higher tariffs: Analyst,https://images.financialmodelingprep.com/news/costco-can-cope-with-higher-tariffs-analyst-20241213.jpg,youtube.com,"Scott Mushkin of R5 Capital discusses the potential impact of Trump's proposed tariffs on Costco's supply chain and pricing, and outlook for the bulk discount retailer",https://www.youtube.com/watch?v=wmwLXUY20jg
COST,2024-12-13 03:07:09,Costco says it's seeing a shift in how much people eat at home vs. at restaurants,https://images.financialmodelingprep.com/news/costco-says-its-seeing-a-shift-in-how-much-20241213.jpg,businessinsider.com,"Costco said it's seeing a boost in meat and produce sales. Costco's finance chief said in the Q1 2025 earnings call that there was a shift toward ""food at home.",https://www.businessinsider.com/costco-says-shift-people-eating-at-home-more-not-out-2024-12
COST,2024-12-12 20:50:26,Costco Wholesale Corporation (COST) Q1 2025 Earnings Call Transcript,https://images.financialmodelingprep.com/news/costco-wholesale-corporation-cost-q1-2025-earnings-call-transcript-20241212.jpg,seekingalpha.com,"Costco Wholesale Corporation (NASDAQ:COST ) Q1 2025 Earnings Conference Call December 12, 2024 5:00 PM ET Company Participants Gary Millerchip - EVP and CFO Ron Vachris - President and CEO Conference Call Participants Simeon Gutman - Morgan Stanley Oliver Chen - TD Cowen Christopher Horvers - JPMorgan Zhihan Ma - Bernstein Karen Short - Melius Research Edward Kelly - Wells Fargo John Heinbockel - Guggenheim Rupesh Parikh - Oppenheimer Peter Benedict - Baird Greg Melich - Evercore ISI Scott Mushkin - R5 Capital Robbie Ohmes - Bank of America Michael Lasser - UBS Chuck Grom - Gordon Haskett Kelly Bania - BMO Capital Markets Chuck Cerankosky - Northcoast Research Corey Tarlowe - Jefferies Laura Champine - Loop Capital Operator Good afternoon, and thank you for standing by. My name is Abby, and I will be your conference operator today.",https://seekingalpha.com/article/4744020-costco-wholesale-corporation-cost-q1-2025-earnings-call-transcript
COST,2024-12-12 19:50:34,Costco CEO: Digital Sales Outpacing Overall Growth on ‘Tech Journey',https://images.financialmodelingprep.com/news/costco-ceo-digital-sales-outpacing-overall-growth-on-tech-20241212.jpg,pymnts.com,"Costco is proving that its digital transformation is more than just a buzzword — it's driving growth. As the company continues to enhance its eCommerce offerings and streamline member experiences, its first-quarter results (Q3 by the calendar) for fiscal 2025 illustrate a combination of solid online performance and in-store success.",https://www.pymnts.com/news/retail/2024/costco-ceo-digital-sales-outpacing-overall-growth-on-tech-journey/
COST,2024-12-12 19:00:38,Costco (COST) Q1 Earnings: Taking a Look at Key Metrics Versus Estimates,https://images.financialmodelingprep.com/news/costco-cost-q1-earnings-taking-a-look-at-key-20241212.jpg,zacks.com,"While the top- and bottom-line numbers for Costco (COST) give a sense of how the business performed in the quarter ended November 2024, it could be worth looking at how some of its key metrics compare to Wall Street estimates and year-ago values.",https://www.zacks.com/stock/news/2383078/costco-cost-q1-earnings-taking-a-look-at-key-metrics-versus-estimates?cid=CS-STOCKNEWSAPI-FT-fundamental_analysis|nfm-2383078
COST,2024-12-12 18:55:40,"Markets Take a Breather on Econ Data; COST, AVGO, RH Report Late",https://images.financialmodelingprep.com/news/markets-take-a-breather-on-econ-data-cost-avgo-20241212.jpg,zacks.com,"We're still near all-time highs on the major indexes, so taking a breather with less-than-stellar economic prints seems perfectly reasonable.",https://www.zacks.com/stock/news/2383067/markets-take-a-breather-on-econ-data-cost-avgo-rh-report-late?cid=CS-STOCKNEWSAPI-FT-ahead_of_wall_street-2383067
COST,2024-12-12 18:25:37,Costco (COST) Beats Q1 Earnings and Revenue Estimates,https://images.financialmodelingprep.com/news/costco-cost-beats-q1-earnings-and-revenue-estimates-20241212.jpg,zacks.com,"Costco (COST) came out with quarterly earnings of $3.82 per share, beating the Zacks Consensus Estimate of $3.79 per share. This compares to earnings of $3.48 per share a year ago.",https://www.zacks.com/stock/news/2383042/costco-cost-beats-q1-earnings-and-revenue-estimates?cid=CS-STOCKNEWSAPI-FT-tale_of_the_tape|yseop_template_4-2383042
COST,2024-12-12 17:17:19,Costco's strong quarter shows shoppers can't get enough of the wholesale club,https://images.financialmodelingprep.com/news/costcos-strong-quarter-shows-shoppers-cant-get-enough-of-20241212.jpg,businessinsider.com,"Costco beat expectations for its fiscal first-quarter earnings, with net sales growth of 7.5%. Comparable sales growth was largely driven by increased traffic.",https://www.businessinsider.com/costco-earnings-sales-traffic-growth-membership-fee-2024-12
COST,2024-12-12 17:11:59,Costco's Earnings Top Expectations in First Results Reflecting Membership Fee Hike,https://images.financialmodelingprep.com/news/costcos-earnings-top-expectations-in-first-results-reflecting-membership-fee-20241212.jpg,investopedia.com,"Costco Wholesale (COST) reported fiscal first-quarter earnings that beat analysts' expectations, in its first quarterly results reflecting the impact of its hike in membership fees.",https://www.investopedia.com/costco-q1-fy-2025-earnings-8759082
COST,2024-12-12 16:48:23,"EARNINGS ALERT: AVGO, COST",https://images.financialmodelingprep.com/news/earnings-alert-avgo-cost-20241212.jpg,youtube.com,"Costco (COST) and Broadcom (AVGO) popped after reporting earnings. For COST, the company posted U.S. Comp.",https://www.youtube.com/watch?v=sITe1OzOF3A
COST,2024-12-12 16:41:00,Costco's stock wobbles after retailer reports mixed results,https://images.financialmodelingprep.com/news/costcos-stock-wobbles-after-retailer-reports-mixed-results-20241212.jpg,marketwatch.com,Membership warehouse retailer Costco Wholesale Corp. on Thursday reported quarterly results that were a mixed bag.,https://www.marketwatch.com/story/costcos-stock-wobbles-after-retailer-reports-mixed-results-ea6cf92b
COST,2024-12-12 16:26:06,Costco posts quarterly earnings beat as revenue grows,https://images.financialmodelingprep.com/news/costco-posts-quarterly-earnings-beat-as-revenue-grows-20241212.jpg,proactiveinvestors.com,"Costco Wholesale Corporation (NASDAQ:COST, ETR:CTO) reported better-than-expected earnings for the first quarter of fiscal 2025. The retail giant's results were buoyed by robust revenue growth, strong e-commerce performance, and rising membership fees.",https://www.proactiveinvestors.com/companies/news/1062743
COST,2024-12-12 16:25:44,Costco beats on earnings as membership fee hike boosts revenue,https://images.financialmodelingprep.com/news/costco-beats-on-earnings-as-membership-fee-hike-boosts-20241212.jpg,cnbc.com,Costco topped Wall Street's earnings and revenue estimates. The warehouse club was helped by an increase in its annual membership fee.,https://www.cnbc.com/2024/12/12/costco-cost-earnings-q1-2025-earnings.html
COST,2024-12-12 16:20:50,Costco beats quarterly sales estimates,https://images.financialmodelingprep.com/news/costco-beats-quarterly-sales-estimates-20241212.jpg,reuters.com,"Costco Wholesale slightly beat Wall Street expectations for first-quarter revenue on Thursday, as more Americans turned to the membership-only retail chain to shop for everything from food to home furnishings for the holiday season.",https://www.reuters.com/business/retail-consumer/costco-beats-quarterly-sales-estimates-2024-12-12/
COST,2024-12-12 16:15:00,Costco Wholesale Corporation Reports First Quarter Fiscal Year 2025 Operating Results,https://images.financialmodelingprep.com/news/costco-wholesale-corporation-reports-first-quarter-fiscal-year-2025-20241212.jpg,globenewswire.com,"ISSAQUAH, Wash., Dec. 12, 2024 (GLOBE NEWSWIRE) -- Costco Wholesale Corporation (“Costco” or the “Company”) (Nasdaq: COST) today announced its operating results for the first quarter of fiscal 2025 (twelve weeks), ended November 24, 2024.",https://www.globenewswire.com/news-release/2024/12/12/2996530/0/en/Costco-Wholesale-Corporation-Reports-First-Quarter-Fiscal-Year-2025-Operating-Results.html
COST,2024-12-12 14:14:48,Costco rejects union demands as contract deadline looms,https://images.financialmodelingprep.com/news/costco-rejects-union-demands-as-contract-deadline-looms-20241212.jpg,foxbusiness.com,"Teamsters union said that Costco rejected 98% of the contract provisions it proposed, underscoring how tensions are rising between both sides ahead of the deadline.",https://www.foxbusiness.com/lifestyle/costco-workers-accusing-warehouse-fake-worker-friendly-image
