symbol,publishedDate,title,image,site,text,url
IBM,2025-01-24 13:11:06,Will IBM (IBM) Beat Estimates Again in Its Next Earnings Report?,https://images.financialmodelingprep.com/news/will-ibm-ibm-beat-estimates-again-in-its-next-20250124.jpg,zacks.com,IBM (IBM) has an impressive earnings surprise history and currently possesses the right combination of the two key ingredients for a likely beat in its next quarterly report.,https://www.zacks.com/stock/news/2403153/will-ibm-ibm-beat-estimates-again-in-its-next-earnings-report?cid=CS-STOCKNEWSAPI-FT-tale_of_the_tape|yseop_template_7-2403153
IBM,2025-01-23 15:00:00,Fresche Solutions Acquires OmniData Insights to Accelerate AI-Enabled Data Modernization and Expand Beyond IBM i,https://images.financialmodelingprep.com/news/fresche-solutions-acquires-omnidata-insights-to-accelerate-aienabled-data-20250123.jpg,globenewswire.com,"SAN FRANCISCO, Jan. 23, 2025 (GLOBE NEWSWIRE) -- Fresche Solutions, a global leader in IBM i modernization and transformation, acquires OmniData Insights, a Microsoft Gold-certified leader specializing in AI-enabled Data and Analytics modernization. This strategic move marks a significant step forward in diversifying Fresche's portfolio of solutions and services and reinforces its dedication to address the growing customer demand for advanced AI-enabled Data Analytics.",https://www.globenewswire.com/news-release/2025/01/23/3014559/0/en/Fresche-Solutions-Acquires-OmniData-Insights-to-Accelerate-AI-Enabled-Data-Modernization-and-Expand-Beyond-IBM-i.html
IBM,2025-01-23 12:16:12,IBM Partners With e& to Launch Multi-Model AI Platform: Stock to Gain?,https://images.financialmodelingprep.com/news/ibm-partners-with-e-to-launch-multimodel-ai-platform-20250123.jpg,zacks.com,"IBM collaborates with e& to launch a cutting-edge, end-to-end, multi-model Generative AI governance solution.",https://www.zacks.com/stock/news/2402332/ibm-partners-with-e-to-launch-multi-model-ai-platform-stock-to-gain?cid=CS-STOCKNEWSAPI-FT-analyst_blog|company_news_tech_sector-2402332
IBM,2025-01-23 10:31:28,IBM Stock Before Q4 Earnings: A Smart Buy or Risky Investment?,https://images.financialmodelingprep.com/news/ibm-stock-before-q4-earnings-a-smart-buy-or-20250123.jpg,zacks.com,"With declining earnings estimates, IBM is witnessing a negative investor perception and it might be prudent to avoid the stock at the moment.",https://www.zacks.com/stock/news/2402077/ibm-stock-before-q4-earnings-a-smart-buy-or-risky-investment?cid=CS-STOCKNEWSAPI-FT-analyst_blog|most_popular_stocks-2402077
IBM,2025-01-23 06:18:16,4 Mega-Cap High-Yield Dividend Giants Look Like Huge 2025 Winners,https://images.financialmodelingprep.com/news/4-megacap-highyield-dividend-giants-look-like-huge-2025-winners-20250123.jpg,247wallst.com,"Investors love dividend stocks, especially the high-yield mega-cap variety, because they offer a significant income stream and have massive total return potential.",https://247wallst.com/investing/2025/01/23/4-mega-cap-high-yield-dividend-giants-are-2025-superstars/
IBM,2025-01-23 04:00:00,"SiXworks, an IBM Company, and KX Deliver Secure, Real-Time Data Analytics to Transform Defense Operations",https://images.financialmodelingprep.com/news/sixworks-an-ibm-company-and-kx-deliver-secure-realtime-20250123.jpg,businesswire.com,"LONDON--(BUSINESS WIRE)--SiXworks and KX partner to deliver high-frequency, secure analytics for real-time decision-making in defense operations.",https://www.businesswire.com/news/home/20250123391640/en/SiXworks-an-IBM-Company-and-KX-Deliver-Secure-Real-Time-Data-Analytics-to-Transform-Defense-Operations/
IBM,2025-01-22 16:05:00,"SL Green Signs 93,000-Square-Foot Expansion Lease With IBM at One Madison Avenue",https://images.financialmodelingprep.com/news/sl-green-signs-93000squarefoot-expansion-leasewith-ibm-at-one-20250122.jpg,globenewswire.com,"NEW YORK, Jan. 22, 2025 (GLOBE NEWSWIRE) -- SL Green Realty Corp. (NYSE: SLG), Manhattan's largest office landlord, today announced that it has signed a 92,663-square-foot expansion lease with IBM at One Madison Avenue, increasing IBM's total footprint at the property to 362,092 square feet. The 15-year lease covers the entire 7th floor and brings the building to 72% leased. This lease follows the strong 2024 portfolio-wide leasing momentum during which the Company signed 188 leases covering 3,607,924 square feet. In addition, the Company has a current, active pipeline of prospective leases of more than 875,000 square feet.",https://www.globenewswire.com/news-release/2025/01/22/3013881/0/en/SL-Green-Signs-93-000-Square-Foot-Expansion-Lease-With-IBM-at-One-Madison-Avenue.html
IBM,2025-01-22 07:55:00,e& Collaborates with IBM to Launch Pioneering End-to-End AI Governance Platform,https://images.financialmodelingprep.com/news/e-collaborates-with-ibm-to-launch-pioneering-endtoend-ai-20250122.jpg,prnewswire.com,"DUBAI, UAE, Jan. 22, 2025 /PRNewswire/ -- e&, a global technology group, has collaborated with IBM (NYSE: IBM) to deploy a pioneering, end-to-end, multi-model Artificial Intelligence (AI) and Generative AI governance solution. Announced today at the World Economic Forum 2025 in Davos, this collaboration intends to enhance e&'s AI governance framework to promote compliance, oversight, and ethical practices across its growing AI ecosystem, reinforcing e&'s commitment to establishing robust governance, risk management, and regulatory oversight across its AI usage.",https://www.prnewswire.com/news-releases/e-collaborates-with-ibm-to-launch-pioneering-end-to-end-ai-governance-platform-302357383.html
IBM,2025-01-22 06:30:00,This AI Stock Is Also a Great Dividend Stock,https://images.financialmodelingprep.com/news/this-ai-stock-is-also-a-great-dividend-stock-20250122.jpg,fool.com,"When you think about cutting-edge artificial intelligence (AI) companies, generous dividend payments probably aren't on your radar. AI is a booming and fast-evolving industry, requiring massive investments to keep pace with the competition.",https://www.fool.com/investing/2025/01/22/this-ai-stock-is-also-a-great-dividend-stock/
IBM,2025-01-21 18:51:27,IBM (IBM) Stock Sinks As Market Gains: Here's Why,https://images.financialmodelingprep.com/news/ibm-ibm-stock-sinks-as-market-gains-heres-why-20250121.jpg,zacks.com,"IBM (IBM) closed at $224.26 in the latest trading session, marking a -0.24% move from the prior day.",https://www.zacks.com/stock/news/2400817/ibm-ibm-stock-sinks-as-market-gains-here-s-why?cid=CS-STOCKNEWSAPI-FT-tale_of_the_tape|yseop_template_6-2400817
IBM,2025-01-21 15:19:44,4 Blue Chip AI Technology Giants That Also Pay Dependable Dividends,https://images.financialmodelingprep.com/news/4-blue-chip-ai-technology-giants-that-also-pay-20250121.jpg,247wallst.com,"Investors love dividend stocks because they provide dependable income, passive income streams, and an excellent opportunity for solid total return.",https://247wallst.com/investing/2025/01/21/4-blue-chip-ai-technology-giants-that-also-pay-dependable-dividends/
IBM,2025-01-21 11:56:47,IBM Investor Day Preview: Why Analyst Says This Event Could Be A Catalyst For The Stock,https://images.financialmodelingprep.com/news/ibm-investor-day-preview-why-analyst-says-this-event-20250121.jpg,benzinga.com,IBM IBM is scheduled to host its Investor Day on Feb. 4.,https://www.benzinga.com/analyst-ratings/analyst-color/25/01/43105367/ibm-investor-day-preview-why-analyst-says-this-event-could-be-a-catalyst-for-the-st
IBM,2025-01-21 11:46:13,"IBM, L'Oreal Team Up to Drive Sustainable Innovation With AI Model",https://images.financialmodelingprep.com/news/ibm-loreal-team-up-to-drive-sustainable-innovation-with-20250121.jpg,zacks.com,IBM is set to build custom AI foundation models in collaboration with L'Oreal to advance the creation of sustainable cosmetics.,https://www.zacks.com/stock/news/2400629/ibm-l-oreal-team-up-to-drive-sustainable-innovation-with-ai-model?cid=CS-STOCKNEWSAPI-FT-analyst_blog|company_news_tech_sector-2400629
IBM,2025-01-20 10:05:31,International Business Machines Corporation (IBM) is Attracting Investor Attention: Here is What You Should Know,https://images.financialmodelingprep.com/news/international-business-machines-corporation-ibm-is-attracting-investor-attention-20250120.jpg,zacks.com,"IBM (IBM) has received quite a bit of attention from Zacks.com users lately. Therefore, it is wise to be aware of the facts that can impact the stock's prospects.",https://www.zacks.com/stock/news/2399704/international-business-machines-corporation-ibm-is-attracting-investor-attention-here-is-what-you-should-know?cid=CS-STOCKNEWSAPI-FT-tale_of_the_tape|most_searched_stocks-2399704
IBM,2025-01-18 07:40:00,IBM Just Bolstered This Critical Business,https://images.financialmodelingprep.com/news/ibm-just-bolstered-this-critical-business-20250118.jpg,fool.com,"International Business Machines' (IBM 0.96%) strategy centers around hybrid cloud computing and artificial intelligence (AI). In the cloud computing market, IBM's acquisition of Red Hat forms the foundation of its hybrid cloud platform.",https://www.fool.com/investing/2025/01/18/ibm-just-bolstered-this-critical-business/
IBM,2025-01-17 10:26:11,Can IBM Stock Benefit From Applications Software Technology Buyout?,https://images.financialmodelingprep.com/news/can-ibm-stock-benefit-from-applications-software-technology-buyout-20250117.jpg,zacks.com,IBM is set to expand Oracle consulting expertise with the Applications Software Technology buyout.,https://www.zacks.com/stock/news/2398962/can-ibm-stock-benefit-from-applications-software-technology-buyout?cid=CS-STOCKNEWSAPI-FT-analyst_blog|company_news_tech_sector-2398962
IBM,2025-01-16 09:15:00,"IBM to Acquire Applications Software Technology LLC, Bolstering Oracle Expertise to Help Clients Transform Their Operations",https://images.financialmodelingprep.com/news/ibm-to-acquire-applications-software-technology-llc-bolstering-oracle-expertise-20250116.jpg,prnewswire.com,"Applications Software Technology's deep US and UK public sector skills support clients' Oracle Cloud Application transformations ARMONK, N.Y. , Jan. 16, 2025 /PRNewswire/ -- IBM (NYSE: IBM) today announced its intent to acquire Applications Software Technology LLC1, a global Oracle consultancy.",https://www.prnewswire.com/news-releases/ibm-to-acquire-applications-software-technology-llc-bolstering-oracle-expertise-to-help-clients-transform-their-operations-302353239.html
IBM,2025-01-16 02:01:00,IBM and L'Oréal to Build First AI Model to Advance the Creation of Sustainable Cosmetics,https://images.financialmodelingprep.com/news/ibm-and-loral-to-build-first-ai-model-to-20250116.jpg,prnewswire.com,"PARIS and NEW YORK , Jan. 16, 2025 /PRNewswire/ -- IBM (NYSE: IBM) and L'Oréal, the world's leading beauty company, announced a collaboration to leverage IBM's generative artificial intelligence (GenAI) technology and expertise to uncover new insights in cosmetic formulation data, facilitating L'Oréal's use of sustainable raw materials, for energy and material waste reductions. This unique effort will develop a custom AI foundation model engineered to significantly increase the ability of L'Oréal Research & Innovation teams to reach extra performance and consumer satisfaction in every cosmetic category and every region of the world.",https://www.prnewswire.com/news-releases/ibm-and-loreal-to-build-first-ai-model-to-advance-the-creation-of-sustainable-cosmetics-302352463.html
IBM,2025-01-15 13:16:00,IBM to Announce Fourth-Quarter 2024 Financial Results,https://images.financialmodelingprep.com/news/ibm-to-announce-fourthquarter-2024-financial-results-20250115.jpg,prnewswire.com,"ARMONK, N.Y. , Jan. 15, 2025 /PRNewswire/ -- IBM (NYSE: IBM) will hold its quarterly conference call to discuss its fourth-quarter 2024 financial results on Wednesday, January 29, 2025 at 5:00 p.m.",https://www.prnewswire.com/news-releases/ibm-to-announce-fourth-quarter-2024-financial-results-302352171.html
IBM,2025-01-15 12:20:24,"IBM, Walmart Team Up to Streamline Last-Mile Delivery: Stock to Gain?",https://images.financialmodelingprep.com/news/ibm-walmart-team-up-to-streamline-lastmile-delivery-stock-20250115.jpg,zacks.com,"By leveraging Walmart's robust delivery network and logistics expertise, IBM aims to provide reliable last-mile delivery options to its clients and retailers.",https://www.zacks.com/stock/news/2397612/ibm-walmart-team-up-to-streamline-last-mile-delivery-stock-to-gain?cid=CS-STOCKNEWSAPI-FT-analyst_blog|company_news_tech_sector-2397612
IBM,2025-01-15 11:10:10,IBM price target boosted ahead of Q4 earnings report,https://images.financialmodelingprep.com/news/ibm-price-target-boosted-ahead-of-q4-earnings-report-20250115.jpg,proactiveinvestors.com,International Business Machines Corp (NYSE:IBM) has earned a price target bump to $160 from UBS analysts ahead of its fourth quarter earnings report due on January 29 after US markets close. The analysts raised their price target from $150 but repeated their ‘Sell' rating on the technology firm.,https://www.proactiveinvestors.com/companies/news/1064390
IBM,2025-01-15 10:44:07,Walmart and IBM Team to Bolster Last-Mile Delivery,https://images.financialmodelingprep.com/news/walmart-and-ibm-team-to-bolster-lastmile-delivery-20250115.jpg,pymnts.com,"Walmart has formed a partnership with IBM aimed at improving last-mile delivery for retailers. The collaboration will integrate Walmart's GoLocal delivery service into IBM's Sterling order management platform, the companies said in a Monday (Jan. 13) news release.",https://www.pymnts.com/news/delivery/2025/walmart-and-ibm-team-to-bolster-last-mile-delivery/
IBM,2025-01-15 10:00:00,How I'm Building My Quantum Computing Portfolio,https://images.financialmodelingprep.com/news/how-im-building-my-quantum-computing-portfolio-20250115.jpg,fool.com,"Nvidia CEO Jensen Huang's sobering assessment of quantum computing's timeline sent the space into a tailspin last week. During a question-and-answer session with analysts, Huang suggested that useful quantum computers were likely 15 to 30 years away.",https://www.fool.com/investing/2025/01/15/how-im-building-my-quantum-computing-portfolio/
IBM,2025-01-15 08:00:00,CoreWeave Partners with IBM to Deliver New AI Supercomputer for IBM Granite Models,https://images.financialmodelingprep.com/news/coreweave-partners-with-ibm-to-deliver-new-ai-supercomputer-20250115.jpg,prnewswire.com,"One of the first deployments of NVIDIA GB200 NVL72 at supercomputing scale Supercomputer will leverage IBM Storage Scale System to power AI research and development ROSELAND, N.J. and YORKTOWN HEIGHTS, N.Y.",https://www.prnewswire.com/news-releases/coreweave-partners-with-ibm-to-deliver-new-ai-supercomputer-for-ibm-granite-models-302351465.html
IBM,2025-01-14 12:51:02,"IBM, Globant, EPAM Top IT Bets For 2025, Driven by Demand Trends And Margin Expansion: Analyst",https://images.financialmodelingprep.com/news/ibm-globant-epam-top-it-bets-for-2025-driven-20250114.jpg,benzinga.com,Goldman Sachs analyst James Schneider expects fourth-quarter 2024 reports to reflect gradual demand improvement in 2025 guidance. Based on intra-quarter management commentary and Accenture ACN,https://www.benzinga.com/trading-ideas/25/01/42983710/ibm-globant-epam-top-it-bets-for-2025-driven-by-demand-trends-and-margin-expansion-analyst
IBM,2025-01-13 18:51:28,IBM (IBM) Stock Drops Despite Market Gains: Important Facts to Note,https://images.financialmodelingprep.com/news/ibm-ibm-stock-drops-despite-market-gains-important-facts-20250113.jpg,zacks.com,"In the latest trading session, IBM (IBM) closed at $217.40, marking a -1.07% move from the previous day.",https://www.zacks.com/stock/news/2396166/ibm-ibm-stock-drops-despite-market-gains-important-facts-to-note?cid=CS-STOCKNEWSAPI-FT-tale_of_the_tape|yseop_template_6-2396166
IBM,2025-01-13 09:00:00,IBM: Still Undervalued At All-Time Highs Yielding Around 3%,https://images.financialmodelingprep.com/news/ibm-still-undervalued-at-alltime-highs-yielding-around-3-20250113.jpg,seekingalpha.com,"IBM has transformed into a hybrid tech company focusing on AI, hybrid cloud, automation, and quantum computing, leading to a 36.30% share price increase in 2024. IBM's strong Q3 results, including $6.6 billion in free cash flow and 10% software segment growth, highlight its profitability and growth potential. Despite risks like economic downturns and integration challenges, IBM's valuation remains attractive, trading at 19.5 times 2026 earnings, with significant opportunities in AI and quantum computing.",https://seekingalpha.com/article/4748917-ibm-still-undervalued-at-all-time-highs-yielding-around-3-percent
IBM,2025-01-12 08:21:00,2 No-Brainer Quantum Computing Stocks to Buy Right Now,https://images.financialmodelingprep.com/news/2-nobrainer-quantum-computing-stocks-to-buy-right-now-20250112.jpg,fool.com,"Quantum computing became a hot topic in 2024. After bubbling just below the zeitgeist for several years, a leading technology developer in the field presented a huge leap forward.",https://www.fool.com/investing/2025/01/12/2-no-brainer-quantum-computing-stocks-to-buy-now/
IBM,2025-01-12 03:30:00,3 Cheap Tech Stocks That Are Screaming Buys in January,https://images.financialmodelingprep.com/news/3-cheap-tech-stocks-that-are-screaming-buys-in-20250112.jpg,fool.com,"Many tech stocks surged over the past year as expectations for lower interest rates drove investors back toward higher-growth companies. But with the Nasdaq Composite now hovering near its all-time highs, investors should get picky with the stocks they buy.",https://www.fool.com/investing/2025/01/12/cheap-tech-stocks-screaming-buys-january/
IBM,2025-01-10 11:51:54,IBM: Positives Have Been Priced In (Rating Downgrade),https://images.financialmodelingprep.com/news/ibm-positives-have-been-priced-in-rating-downgrade-20250110.jpg,seekingalpha.com,"Earlier, I argued that the growth potential of IBM's software business is underestimated with the expansion of AI. IBM has indeed made progress on this front with several of its AI-related products since then. However, the stock's P/E ratio has also expanded significantly meanwhile.",https://seekingalpha.com/article/4748747-ibm-positives-have-been-priced-in-rating-downgrade
IBM,2025-01-10 10:35:58,SAP Launches RISE With SAP on IBM Power Virtual Server Offering,https://images.financialmodelingprep.com/news/sap-launches-rise-with-sap-on-ibm-power-virtual-20250110.jpg,zacks.com,"SAP's RISE with SAP on IBM Power Virtual Server will be available in the second quarter of 2025, featuring a customized investment program from IBM.",https://www.zacks.com/stock/news/2395031/sap-launches-rise-with-sap-on-ibm-power-virtual-server-offering?cid=CS-STOCKNEWSAPI-FT-analyst_blog|company_news_tech_sector-2395031
IBM,2025-01-10 10:00:11,2 Stocks Still Worth Buying to Play Quantum Computing for the Long Haul,https://images.financialmodelingprep.com/news/2-stocks-still-worth-buying-to-play-quantum-computing-20250110.jpg,247wallst.com,"Nvidia (NASDAQ:NVDA) CEO Jensen Huang had some thoughts to share about the state of quantum computing, a forward-thinking innovation that may eventually surpass artificial intelligence (AI) in hype.",https://247wallst.com/investing/2025/01/10/2-stocks-still-worth-buying-to-play-quantum-computing-for-the-long-haul/
IBM,2025-01-08 07:17:00,Should You Forget MicroStrategy and Buy 2 Artificial Intelligence (AI) Stocks Instead?,https://images.financialmodelingprep.com/news/should-you-forget-microstrategy-and-buy-2-artificial-intelligence-20250108.jpg,fool.com,"Enterprise software developer MicroStrategy (MSTR -9.94%) has been crushing the broader stock market recently. The stock gained 359% in 2024, rising a total of 2,370% in five years on the morning of Jan. 6.",https://www.fool.com/investing/2025/01/08/should-you-skip-microstrategy-and-buy-2-ai-stocks/
IBM,2025-01-07 10:16:30,International Business Machines Corporation (IBM) Is a Trending Stock: Facts to Know Before Betting on It,https://images.financialmodelingprep.com/news/international-business-machines-corporation-ibm-is-a-trending-stock-20250107.jpg,zacks.com,"IBM (IBM) has been one of the stocks most watched by Zacks.com users lately. So, it is worth exploring what lies ahead for the stock.",https://www.zacks.com/stock/news/2392800/international-business-machines-corporation-ibm-is-a-trending-stock-facts-to-know-before-betting-on-it?cid=CS-STOCKNEWSAPI-FT-tale_of_the_tape|most_searched_stocks-2392800
IBM,2025-01-07 09:33:00,RISE with SAP on IBM Power Virtual Server to Help Accelerate Transformation with SAP S/4HANA Cloud,https://images.financialmodelingprep.com/news/rise-with-sap-on-ibm-power-virtual-server-to-20250107.jpg,prnewswire.com,"New offering designed to move SAP S/4HANA workloads from IBM Power Systems on-premises to cloud within 90 days IBM realized 30% reduction in  infrastructure costs and related operations  over 18 months in RISE with SAP modernization project supporting 150,000 ERP users ARMONK, N.Y. and WALLDORF, Germany , Jan. 7, 2025 /PRNewswire/ -- Today, IBM (NYSE: IBM) and SAP SE (NYSE: SAP) announced the upcoming release of RISE with SAP on IBM Power Virtual Server, designed to make it the fastest and easiest path for IBM Power customers to accelerate their ERP transformation.",https://www.prnewswire.com/news-releases/rise-with-sap-on-ibm-power-virtual-server-to-help-accelerate-transformation-with-sap-s4hana-cloud-302344487.html
IBM,2025-01-07 09:06:28,Buy 5 Giant AI Hardware Manufacturers to Maximize Your Gains,https://images.financialmodelingprep.com/news/buy-5-giant-ai-hardware-manufacturers-to-maximize-your-20250107.jpg,zacks.com,"Five AI chipset manufacturers have strong potential for 2025. These are: TSM, QCOM, IBM, AVGO, MRVL.",https://www.zacks.com/stock/news/2392703/buy-5-giant-ai-hardware-manufacturers-to-maximize-your-gains?cid=CS-STOCKNEWSAPI-FT-analyst_blog|investment_ideas-2392703
IBM,2025-01-07 08:30:00,IBM Study: AI Spending Expected to Surge 52% Beyond IT Budgets as Retail Brands Embrace Enterprise-Wide Innovation,https://images.financialmodelingprep.com/news/ibm-study-ai-spending-expected-to-surge-52-beyond-20250107.jpg,prnewswire.com,"The report found that 81% of surveyed executives and 96% of their teams are already using AI to a moderate or significant extent  Executives indicate they want to expand into more sophisticated AI use cases, such as integrated business planning where they plan to increase usage by 82% in 2025 NEW YORK , Jan. 7, 2025 /PRNewswire/ -- A new global study from the IBM (NYSE: IBM) Institute for Business Value found that surveyed retail and consumer product executives are dramatically shifting their focus toward artificial intelligence (AI), with responses indicating that participants project spending outside of traditional IT operations could surge by 52% in the next year. The report, titled ""Embedding AI in Your Brand's DNA,"" reveals how brands are preparing for the next phase of AI-driven transformation across the enterprise.",https://www.prnewswire.com/news-releases/ibm-study-ai-spending-expected-to-surge-52-beyond-it-budgets-as-retail-brands-embrace-enterprise-wide-innovation-302343509.html
IBM,2025-01-07 06:20:00,1 Top AI Agent Stock to Buy Right Now,https://images.financialmodelingprep.com/news/1-top-ai-agent-stock-to-buy-right-now-20250107.jpg,fool.com,"The first phase of the artificial intelligence (AI) boom was undoubtedly defined by powerful large language models capable of a large variety of tasks. AI models like those that power ChatGPT can do a lot of things reasonably well, although they still output incorrect information and fabricated responses at times.",https://www.fool.com/investing/2025/01/07/1-top-ai-agent-stock-to-buy-right-now/
IBM,2025-01-04 11:49:00,Big Blue Chip Dividends? Try These ‘Dogs' Up To 6.8%,https://images.financialmodelingprep.com/news/big-blue-chip-dividends-try-these-dogs-up-to-20250104.jpg,forbes.com,The Dogs of the Dow 2025 pay big dividends—up to 6.8%! Collectively they yield three-times what the broader market pays.,https://www.forbes.com/sites/brettowens/2025/01/04/big-blue-chip-dividends-try-these-dogs-up-to-68/
IBM,2025-01-04 07:00:00,3 Dividend-Paying Artificial Intelligence Stocks to Buy in 2025,https://images.financialmodelingprep.com/news/3-dividendpaying-artificial-intelligence-stocks-to-buy-in-2025-20250104.jpg,fool.com,"Artificial intelligence has been a hot market throughout 2024. AI fueled the surge in share price for companies such as Nvidia, which saw its stock rise nearly 180% over the past year through Dec. 31.",https://www.fool.com/investing/2025/01/04/3-dividend-paying-artificial-intelligence-stocks/
IBM,2025-01-03 12:00:36,Will IBM Stock Benefit From Lawsuit Settlement With GlobalFoundries?,https://images.financialmodelingprep.com/news/will-ibm-stock-benefit-from-lawsuit-settlement-with-globalfoundries-20250103.jpg,zacks.com,International Business Machines Corporation reaches a positive resolution with GlobalFoundries settling all legal disputes and paving the foundation for future collaboration.,https://www.zacks.com/stock/news/2391723/will-ibm-stock-benefit-from-lawsuit-settlement-with-globalfoundries?cid=CS-STOCKNEWSAPI-FT-analyst_blog|company_news_tech_sector-2391723
IBM,2025-01-02 16:06:28,IBM Faces UK Watchdog Scrutiny for HashiCorp Buyout: Trouble Brewing?,https://images.financialmodelingprep.com/news/ibm-faces-uk-watchdog-scrutiny-for-hashicorp-buyout-trouble-20250102.jpg,zacks.com,IBM appears primed for further price appreciation despite apparent roadblocks and investors are likely to profit if they bet on this high-flying stock now.,https://www.zacks.com/stock/news/2391230/ibm-faces-uk-watchdog-scrutiny-for-hashicorp-buyout-trouble-brewing?cid=CS-STOCKNEWSAPI-FT-analyst_blog|most_popular_stocks-2391230
