symbol,publishedDate,title,image,site,text,url
IBM,2025-06-10 18:51:07,IBM (IBM) Outperforms Broader Market: What You Need to Know,https://images.financialmodelingprep.com/news/ibm-ibm-outperforms-broader-market-what-you-need-to-20250610.jpg,zacks.com,"In the most recent trading session, IBM (IBM) closed at $276.24, indicating a +1.53% shift from the previous trading day.",https://www.zacks.com/stock/news/2493270/ibm-ibm-outperforms-broader-market-what-you-need-to-know?cid=CS-STOCKNEWSAPI-FT-tale_of_the_tape|yseop_template_6-2493270
IBM,2025-06-10 17:21:00,IBM's stock set a new all-time high. This was the latest spark.,https://images.financialmodelingprep.com/news/ibms-stock-set-a-new-alltime-high-this-was-20250610.jpg,marketwatch.com,"The tech company's shares were up 1.5% at the closing bell Tuesday after it unveiled plans for a large-scale, fault-tolerant quantum computer.",https://www.marketwatch.com/story/ibms-stock-set-a-new-all-time-high-this-was-the-latest-spark-0c88f76b
IBM,2025-06-10 12:06:27,IBM unveils quantum computing roadmap,https://images.financialmodelingprep.com/news/ibm-unveils-quantum-computing-roadmap-20250610.jpg,proactiveinvestors.com,"International Business Machines Corp (NYSE:IBM) has unveiled plans to build the world's first large-scale, fault-tolerant quantum computer called Starling, which is expected to be available by 2029. The company outlined a step-by-step plan to build a scalable, fault-tolerant quantum computer by 2029, starting with experimental processors like Loon, Kookaburra, and Cockatoo, and culminating in the IBM Quantum Starling.",https://www.proactiveinvestors.com/companies/news/1072725
IBM,2025-06-10 11:47:36,"IBM announces new quantum processor, plan for Starling supercomputer by 2029",https://images.financialmodelingprep.com/news/ibm-announces-new-quantum-processor-plan-for-starling-supercomputer-20250610.jpg,cnbc.com,"IBM on Tuesday announced a detailed roadmap to develop a large-scale, fault-tolerant quantum computer called Quantum Starling. Part of the company's plan involves the new IBM Quantum Nighthawk processor, which is set to release later this year, according to a blog post announcing the roadmap.",https://www.cnbc.com/2025/06/10/ibm-quantum-processor-starling-supercomputer.html
IBM,2025-06-10 11:25:27,IBM's quantum leap by 2029 faces formidable headwinds,https://images.financialmodelingprep.com/news/ibms-quantum-leap-by-2029-faces-formidable-headwinds-20250610.jpg,invezz.com,"IBM (NYSE: IBM) opened comfortably in the green this morning after announcing a rather ambitious target of introducing a practical, fault-tolerant quantum computer by 2029.",https://invezz.com/news/2025/06/10/ibms-quantum-leap-by-2029-faces-formidable-headwinds/
IBM,2025-06-10 10:11:11,IBM's Software Segment Growth Picks Up: A Sign of More Upside?,https://images.financialmodelingprep.com/news/ibms-software-segment-growth-picks-up-a-sign-of-20250610.jpg,zacks.com,IBM's Software unit hits $6.34B in Q1 revenue as hybrid cloud and AI demand drive strong segment growth.,https://www.zacks.com/stock/news/2492251/ibm-s-software-segment-growth-picks-up-a-sign-of-more-upside?cid=CS-STOCKNEWSAPI-FT-analyst_blog|quick_take-2492251
IBM,2025-06-10 08:00:00,"IBM Study: Businesses View AI Agents as Essential, Not Just Experimental",https://images.financialmodelingprep.com/news/ibm-study-businesses-view-ai-agents-as-essential-not-20250610.jpg,prnewswire.com,"Surveyed executives report anticipated 8x surge in AI-enabled workflows by 2025, with AI agents improving process efficiency, reducing costs, and changing workflows.  Respondents say that 64% of AI budgets are now spent on core business functions.",https://www.prnewswire.com/news-releases/ibm-study-businesses-view-ai-agents-as-essential-not-just-experimental-302476922.html
IBM,2025-06-10 06:02:06,"IBM aims for quantum computer in 2029, lays out road map for larger systems",https://images.financialmodelingprep.com/news/ibm-aims-for-quantum-computer-in-2029-lays-out-20250610.jpg,reuters.com,"International Business Machines on Tuesday said it plans to have a practical quantum computer by 2029, and it laid out the detailed steps the company will take to get there.",https://www.reuters.com/business/retail-consumer/ibm-aims-quantum-computer-2029-lays-out-road-map-larger-systems-2025-06-10/
IBM,2025-06-10 06:01:00,IBM Unveils Plans for First ‘Fault-Tolerant' Quantum Supercomputer,https://images.financialmodelingprep.com/news/ibm-unveils-plans-for-first-faulttolerant-quantum-supercomputer-20250610.jpg,barrons.com,"IBM is building what it calls the world's first ‘large-scale, fault-tolerant supercomputer.'",https://www.barrons.com/articles/ibm-quantum-supercomputer-af375f6e
IBM,2025-06-10 06:00:00,"IBM Sets the Course to Build World's First Large-Scale, Fault-Tolerant Quantum Computer at New IBM Quantum Data Center",https://images.financialmodelingprep.com/news/ibm-sets-the-course-to-build-worlds-first-largescale-20250610.jpg,prnewswire.com,"IBM Quantum roadmap, processors, and infrastructure outline clear path to IBM Quantum Starling, expected to be first large-scale, fault-tolerant quantum computer  Breakthrough research defines key elements for an efficient fault-tolerant architecture — charting the first viable path toward a system projected to run 20,000 times more operations than today's quantum computers Representing the computational state of IBM Starling would require the memory of more than a quindecillion (1048) of the world's most powerful supercomputers YORKTOWN HEIGHTS, N.Y. , June 10, 2025 /PRNewswire/ -- IBM (NYSE: IBM) unveiled its path to build the world's first large-scale, fault-tolerant quantum computer, setting the stage for practical and scalable quantum computing.",https://www.prnewswire.com/news-releases/ibm-sets-the-course-to-build-worlds-first-large-scale-fault-tolerant-quantum-computer-at-new-ibm-quantum-data-center-302476945.html
IBM,2025-06-10 06:00:00,IBM Has a Roadmap to a ‘Fault-Tolerant' Quantum Computer by 2029,https://images.financialmodelingprep.com/news/ibm-has-a-roadmap-to-a-faulttolerant-quantum-computer-20250610.jpg,wsj.com,"The powerhouse computers can be sensitive and error-prone. Now, IBM is offering some details on how it will overcome those problems and build a first-of-its-kind quantum computer.",https://www.wsj.com/articles/ibm-has-a-roadmap-to-a-fault-tolerant-quantum-computer-by-2029-91645d73
IBM,2025-06-10 05:20:00,Want to Invest in Quantum Computing? 3 Stocks That Are Great Buys Right Now.,https://images.financialmodelingprep.com/news/want-to-invest-in-quantum-computing-3-stocks-that-20250610.jpg,fool.com,"The world is on the verge of one of the most significant technological leaps of our lifetime. Over the coming years, computers utilizing quantum mechanics will have exponentially higher capabilities than even the cutting-edge supercomputers of today.",https://www.fool.com/investing/2025/06/10/want-to-invest-in-quantum-computing-3-stocks-that/
IBM,2025-06-09 18:01:08,Why IBM stock is hitting a record,https://images.financialmodelingprep.com/news/why-ibm-stock-is-hitting-a-record-20250609.jpg,youtube.com,"Matthew Swanson, RBC Capital Markets Director, Equity Research discusses IBM and what is driving the stock higher. #youtube #IBM #stocks About Yahoo Finance: Yahoo Finance provides free stock ticker data, up-to-date news, portfolio management resources, comprehensive market data, advanced tools, and more information to help you manage your financial life.",https://www.youtube.com/watch?v=jLARp4uSImo
IBM,2025-06-06 11:31:03,IBM Surges 16% in Six Months: Is it Time to Buy the Stock?,https://images.financialmodelingprep.com/news/ibm-surges-16-in-six-months-is-it-time-20250606.jpg,zacks.com,"IBM surges 16% in six months as hybrid cloud and AI demand power growth, outpacing rivals despite margin pressures.",https://www.zacks.com/stock/news/2487519/ibm-surges-16-in-six-months-is-it-time-to-buy-the-stock?cid=CS-STOCKNEWSAPI-FT-analyst_blog|most_popular_stocks-2487519
IBM,2025-06-05 17:51:25,"Don't look too much into Trump-Musk feud, could be different story in a week: IBM's Gary Cohn",https://images.financialmodelingprep.com/news/dont-look-too-much-into-trumpmusk-feud-could-be-20250605.jpg,youtube.com,"Gary Cohn, IBM vice chair, former NEC director, and former Goldman Sachs president and COO, joins 'Fast Money' to talk political uncertainty and the economy.",https://www.youtube.com/watch?v=e2hqTiO1UEk
IBM,2025-06-05 09:36:04,Will the Launch of watsonx AI Labs Be a Game Changer for IBM?,https://images.financialmodelingprep.com/news/will-the-launch-of-watsonx-ai-labs-be-a-20250605.jpg,zacks.com,"IBM opens watsonx AI Labs in NYC to co-create enterprise AI with startups and scale-ups, boosting its AI innovation push.",https://www.zacks.com/stock/news/2485545/will-the-launch-of-watsonx-ai-labs-be-a-game-changer-for-ibm?cid=CS-STOCKNEWSAPI-FT-analyst_blog|quick_take-2485545
IBM,2025-06-04 18:51:18,IBM (IBM) Laps the Stock Market: Here's Why,https://images.financialmodelingprep.com/news/ibm-ibm-laps-the-stock-market-heres-why-20250604.jpg,zacks.com,"IBM (IBM) concluded the recent trading session at $265.52, signifying a +0.12% move from its prior day's close.",https://www.zacks.com/stock/news/2484929/ibm-ibm-laps-the-stock-market-here-s-why?cid=CS-STOCKNEWSAPI-FT-tale_of_the_tape|yseop_template_6-2484929
IBM,2025-06-04 14:34:40,David Bahnsen names IBM as his dividend playbook stock,https://images.financialmodelingprep.com/news/david-bahnsen-names-ibm-as-his-dividend-playbook-stock-20250604.jpg,youtube.com,"David Bahnsen, The Bahnsen Group CIO, joins 'The Exchange' to discuss investing amid tariff uncertainty and dividend growth stocks to buy.",https://www.youtube.com/watch?v=N9l3ZBhlPYg
IBM,2025-06-03 10:06:13,Investors Heavily Search International Business Machines Corporation (IBM): Here is What You Need to Know,https://images.financialmodelingprep.com/news/investors-heavily-search-international-business-machines-corporation-ibm-here-20250603.jpg,zacks.com,"IBM (IBM) has received quite a bit of attention from Zacks.com users lately. Therefore, it is wise to be aware of the facts that can impact the stock's prospects.",https://www.zacks.com/stock/news/2482690/investors-heavily-search-international-business-machines-corporation-ibm-here-is-what-you-need-to-know?cid=CS-STOCKNEWSAPI-FT-tale_of_the_tape|most_searched_stocks-2482690
IBM,2025-06-02 14:06:21,"IBM acquires data analysis startup Seek AI, opens AI accelerator in NYC",https://images.financialmodelingprep.com/news/ibm-acquires-data-analysis-startup-seek-ai-opens-ai-20250602.jpg,techcrunch.com,"IBM on Monday said that it has acquired Seek AI, an AI platform that allows users to ask questions about enterprise data using natural language, for an undisclosed sum.",https://techcrunch.com/2025/06/02/ibm-acquires-data-analysis-startup-seek-ai-opens-ai-accelerator-in-nyc/
IBM,2025-06-02 12:00:00,"IBM Unveils watsonx AI Labs: The Ultimate Accelerator for AI Builders, Startups and Enterprises in New York City",https://images.financialmodelingprep.com/news/ibm-unveils-watsonx-ai-labs-the-ultimate-accelerator-for-20250602.jpg,prnewswire.com,"New AI initiative will co-create gen AI solutions with IBM clients, nurture NYC talent, advance enterprise AI implementations NEW YORK , June 2, 2025 /PRNewswire/ -- IBM (NYSE: IBM) today announced watsonx AI Labs, a new, developer-first innovation hub in New York City, designed to supercharge AI builders and accelerate AI adoption at scale. watsonx AI Labs connects IBM's enterprise resources and expertise with the next generation of AI developers in order to build breakthrough AI applications for business.",https://www.prnewswire.com/news-releases/ibm-unveils-watsonx-ai-labs-the-ultimate-accelerator-for-ai-builders-startups-and-enterprises-in-new-york-city-302470856.html
IBM,2025-05-29 18:51:30,IBM (IBM) Stock Falls Amid Market Uptick: What Investors Need to Know,https://images.financialmodelingprep.com/news/ibm-ibm-stock-falls-amid-market-uptick-what-investors-20250529.jpg,zacks.com,"In the latest trading session, IBM (IBM) closed at $258.69, marking a -0.6% move from the previous day.",https://www.zacks.com/stock/news/2479227/ibm-ibm-stock-falls-amid-market-uptick-what-investors-need-to-know?cid=CS-STOCKNEWSAPI-FT-tale_of_the_tape|yseop_template_6-2479227
IBM,2025-05-27 13:15:56,Rigetti vs. IBM: Which Quantum Computing Stock Has Better Prospects?,https://images.financialmodelingprep.com/news/rigetti-vs-ibm-which-quantum-computing-stock-has-better-20250527.jpg,zacks.com,"RGTI and IBM are shaping the future of quantum computing, one with agility and innovation, the other with scale and infrastructure. Which has the upper hand?",https://www.zacks.com/stock/news/2477853/rigetti-vs-ibm-which-quantum-computing-stock-has-better-prospects?cid=CS-STOCKNEWSAPI-FT-analyst_blog|most_popular_stocks-2477853
IBM,2025-05-27 12:30:06,"The Big 3: NVDA, GOOGL, IBM",https://images.financialmodelingprep.com/news/the-big-3-nvda-googl-ibm-20250527.jpg,youtube.com,"Jessica Inskip talks all about Big Tech on today's Big 3. On Alphabet (GOOGL), she makes the case that a new transformative tech offers a new avenue for its outlook.",https://www.youtube.com/watch?v=EPr2Yp96iiY
IBM,2025-05-27 10:01:00,"Real World Evidence (RWE) Oncology Market to Reach $3.51 Billion by 2035, Growing at a CAGR of 14.7% from 2025--Exclusive Report by Meticulous Research®",https://images.financialmodelingprep.com/news/real-world-evidence-rwe-oncology-market-to-reach-351-20250527.jpg,https://www.prnewswire.com,"Market Growth Driven by Increasing Demand for Real-World Evidence in Drug Development, Rising Focus on Value-Based Healthcare, Growing Cancer Incidence Globally, and Advancements in Data Analytics and AI Technologies REDDING, Calif., May 27, 2025 /PRNewswire/ -- According to a new market research report titled 'RWE Oncology Solutions Market by Component (Datasets, Consulting Services), Application (Drug Development & Approvals, Market Access & Reimbursement/Coverage Decisions, Medical Device Development & Approvals, Post-market Surveillance), End User, and Geography - Global Forecast to 2035', the RWE oncology solutions market is projected to reach $3.51 billion by 2035, up from an estimated $893 million in 2025, growing at a CAGR of 14.7% during the forecast period. The growth of this market is mainly driven by increasing demand for real-world evidence in drug development, rising focus on value-based healthcare, growing cancer incidence and prevalence globally, regulatory support for RWE in healthcare decision-making, and advancements in data analytics and AI technologies. For more comprehensive insights, download the FREE report sample: https://www.meticulousresearch.com/download-sample-report/cp_id=5276 Key Market Drivers and Trends The RWE oncology solutions market is witnessing strong growth, primarily driven by the shift towards patient-centric healthcare models and the adoption of cloud-based RWE platforms that are reshaping traditional evidence generation approaches. Integration of genomic and molecular data with real-time data collection and analysis is gaining momentum. Market expansion is further supported by the growing integration with precision medicine initiatives and the development of AI-powered analytics solutions, especially in developed markets with advanced healthcare infrastructure across pharmaceutical, regulatory, and healthcare provider domains. Latest trends in the RWE oncology solutions market include the development of comprehensive cancer datasets across the healthcare ecosystem and the industry's increasing focus on evidence-driven cancer care solutions. The market is increasingly focusing on robust, integrated platforms that merge comprehensive oncology datasets with advanced analytics capabilities to meet the demands of the rapidly evolving healthcare landscape. Growth Opportunities The market presents substantial growth opportunities in expansion in emerging markets, which offers substantial opportunities for market players looking to reach new customer bases. Another major opportunity lies in the integration with precision medicine initiatives, which enhances the accessibility of personalized cancer care. Additionally, the development of AI-powered analytics solutions and partnerships between healthcare stakeholders are generating new revenue streams for solution providers as organizations increasingly seek evidence-based alternatives to traditional healthcare decision-making methods. Get Insightful Data on Regions, Market Segments, Customer Landscape, and Top Companies (Charts, Tables, Figures and More) – https://www.meticulousresearch.com/product/rwe-oncology-market-5276 Market Challenges Despite significant growth potential, the overall RWE oncology solutions market faces challenges including data privacy and security concerns straining implementation budgets, particularly in cost-sensitive healthcare sectors. Limited interoperability between healthcare systems is creating integration barriers. Additionally, recent global disruptions have exposed vulnerabilities in data standardization processes, affecting data quality and completeness. Rapidly evolving regulatory compliance requirements across different regions are creating implementation concerns, and high implementation and maintenance costs, especially for comprehensive RWE platforms, are delaying adoption, limiting scalability in key healthcare markets. Segment Insights The global RWE oncology solutions market is segmented by component (Datasets [Disparate Datasets, Integrated Datasets], Consulting Services), application (Drug Development & Approvals, Market Access & Reimbursement/Coverage Decisions, Medical Device Development & Approvals, Post-market Surveillance, Other Applications), end user (Pharmaceutical, Biotechnology, and Medical Device Companies, Healthcare Payers, Healthcare Providers, Other End Users), and geography (North America, Europe, Asia-Pacific, Latin America, and the Middle East & Africa). Market by Component The Datasets segment is expected to account for the largest share of the overall RWE oncology solutions market in 2025, primarily driven by increasing demand for comprehensive cancer data across the healthcare ecosystem, including disparate datasets (EMR/EHR/clinical data, claims & billing data, pharmacy data, cancer registries) and integrated datasets. Their comprehensive coverage, data reliability, and broad adoption across diverse healthcare applications make them indispensable in pharmaceutical research, regulatory submissions, and healthcare decision-making. However, the Consulting Services segment is expected to grow at the fastest rate through 2035, fueled by the growing need for expertise in RWE study design, regulatory guidance, and data interpretation services. Request a customized research analysis tailored to your specific requirements: https://www.meticulousresearch.com/request-customization/cp_id=5276 Market by End User The Pharmaceutical, Biotechnology, and Medical Device Companies segment is expected to account for the largest share of the global RWE oncology solutions market in 2025, primarily due to their substantial investment in oncology R&D, regulatory requirements for post-market surveillance, and the essential requirement for real-world evidence capable of supporting drug development and regulatory submissions. However, the Healthcare Payers segment is expected to witness the highest growth rate during the forecast period, driven by increasing adoption of value-based care models, the need for cost-effectiveness evidence in coverage decisions, and increasing reliance on RWE for value-based healthcare decisions. Geographic Market Insights In 2025, North America is expected to hold the largest share of the global RWE oncology solutions market, followed by Europe, due to its advanced healthcare infrastructure, strong regulatory support for RWE, well-established pharmaceutical industry, favorable reimbursement policies, and the strong presence of prominent RWE solution providers. Additionally, high cancer incidence rates and mature data analytics capabilities contribute significantly to market dominance. However, the Asia-Pacific region, particularly China, India, and South Korea, is projected to experience the fastest growth during the forecast period. This acceleration is mainly driven by rising cancer burden, expanding healthcare infrastructure, growing pharmaceutical investments, increasing awareness about precision medicine approaches, and the region's pivotal role as a global pharmaceutical manufacturing center. Immediate Delivery Available | Buy this Research Report (Insights, Charts, Tables, Figures and More)- https://www.meticulousresearch.com/view-pricing/590 Competitive Landscape The global RWE oncology solutions market is characterized by a competitive and dynamic landscape, comprising established healthcare data analytics companies, pharmaceutical service providers, technology giants, and specialized oncology data solution providers, each adopting unique approaches to advancing RWE capabilities. Market evolution is increasingly shaped by trends such as data standardization, integration of disparate data sources, and the development of AI-powered analytics solutions designed to address regulatory compliance across different regions. Leading companies are leveraging advanced data analytics capabilities to achieve comprehensive evidence generation without compromising data quality and are incorporating enhanced security measures to meet the demands of sensitive healthcare data systems. Key players in the global RWE oncology solutions market include IQVIA Holdings Inc., Veracyte Inc., Flatiron Health Inc., IBM Corporation, Oracle Corporation, SAS Institute Inc., ICON plc, Parexel International Corporation, Syneos Health Inc., Cognizant Technology Solutions Corporation, UnitedHealth Group Incorporated, Anthem Inc., Clinigen Group plc, PerkinElmer Inc., and Tempus Labs Inc., among others. Related Reports: Real-world Evidence Solutions Market Size, Share, Forecast, & Trends Analysis by Component (Datasets [Clinical, Claims, Pharmacy], Services) Application (Market Access, Drug Development & Approvals, PMS), and End User - Global Forecast to 2031https://www.meticulousresearch.com/product/real-world-evidence-solutions-market-4954 Real-world Data (RWD) Market by Source (EMR, Claims, Pharmacy, Disease Registries), Application [Market Access, Drug Development & Approvals (Oncology, Neurology), Post Market Surveillance], End User (Pharma, Payers, Providers) - Global Forecast to 2029https://www.meticulousresearch.com/product/real-world-data-market-5297 Real-world Evidence Analytics Market by Application [Market Access & Reimbursement, Drug Development & Approval (Oncology, Neurology, Cardiovascular), Post Market Surveillance, Medical Device Development], End User (Pharma, Payer, Provider) - Global Forecast to 2029https://www.meticulousresearch.com/product/real-world-evidence-analytics-market-5306 About Meticulous Research® We are a trusted research partner for leading businesses worldwide, empowering Fortune 500 organizations and emerging enterprises with market intelligence designed to drive revenue transformation and strategic growth. Our insights reveal future growth opportunities, equipping clients with a competitive edge through a versatile suite of research solutions—including syndicated reports, custom research, and direct analyst engagement. Each year, we conduct over 300 syndicated studies and manage 60+ consulting engagements across eight major sectors and 20+ geographic markets, all to deliver targeted business insights that help our clients lead in a rapidly evolving global market. With a strong focus on problem-solving for complex business challenges, our research enables organizations to navigate change with assertion, aligning it with strategic pathways for sustainable growth. By identifying innovative and effective solutions, we empower leaders to make impactful decisions that drive operational excellence and fuel innovation. We are committed to crafting insights that enhance business performance and help our clients unlock new revenue opportunities, positioning them for long-term success in the competitive global marketplace. To find out more, visit www.meticulousresearch.com or follow us on LinkedIn. Contact:Mr. Khushal BombeMeticulous Market Research Pvt. Ltd.1267 Willis St, Ste 200 Redding,California, 96001, U.S.USA: +1-646-781-8004Europe: +44-203-868-8738APAC: +91 744-7780008Email- [email protected]Visit Our Website: https://www.meticulousresearch.com/Connect with us on LinkedIn- https://www.linkedin.com/company/meticulous-researchContent Source: https://www.meticulousresearch.com/product/rwe-oncology-market-5276 Logo: https://mma.prnewswire.com/media/1757980/5251440/Meticulous_Research_Logo_1.jpg",https://www.prnewswire.com/news-releases/real-world-evidence-rwe-oncology-market-to-reach-3-51-billion-by-2035--growing-at-a-cagr-of-14-7-from-2025exclusive-report-by-meticulous-research-302465809.html
