symbol,publishedDate,title,image,site,text,url
INFY,2025-05-02 10:05:00,"Blockchain As A Service Market is expected to generate a revenue of USD 347.25 Billion by 2031, Globally, at 71.20% CAGR: Verified Market Research®",https://images.financialmodelingprep.com/news/blockchain-as-a-service-market-is-expected-to-generate-20250502.jpg,https://www.prnewswire.com,"Strategically, the Blockchain As A Service (BaaS) market presents strong growth potential, especially in regions like North America with mature digital infrastructure and regulatory support. Market entry should prioritize sectors like finance, supply chain, and healthcare, where blockchain adoption is accelerating. However, high implementation costs and regulatory uncertainty require careful risk assessment and strategic partnerships. Firms should offer scalable, compliant, and cost-efficient BaaS solutions, while investing in customer education and technical support to overcome integration challenges and capitalize on long-term enterprise adoption trends. LEWES, Del., May 2, 2025 /PRNewswire/ -- The Global Blockchain As A Service Market Size is projected to grow at a CAGR of 71.20% from 2024 to 2031, according to a new report published by Verified Market Research®. The report reveals that the market was valued at USD 47.93 Billion in 2024 and is expected to reach USD 347.25 Billion by the end of the forecast period. The Blockchain As A Service Market is evolving rapidly, fueled by adoption in BFSI, healthcare, and supply chain sectors. Enterprises are leveraging BaaS for improved traceability, security, and data integrity. The market shows strong potential amid growing digitization trends. Key Highlights of the Report: Why This Report Matters: This report delivers actionable insights into a rapidly evolving market where blockchain is transforming business models. It empowers decision-makers with data-driven forecasts, competitive intelligence, and technology trends to stay ahead of industry shifts. Who You Should Read This Report: For more information or to purchase the report, please contact us at: https://www.verifiedmarketresearch.com/download-sample?rid=10565 Browse in-depth TOC on ""Global Blockchain As A Service Market Size"" 202 – Pages126 – Tables37 – Figures Report Scope Global Blockchain As A Service Market Overview Market Driver Surge in Enterprise Demand for Secure Digital Transactions: As cyber risks advance, organizations are transitioning to decentralized architectures to safeguard sensitive data and preserve transaction integrity. Blockchain as a Service (BaaS) provides strong cryptographic security and audit capabilities, minimizing fraud and illegal access. Entities within the BFSI, legal, and healthcare sectors are implementing BaaS to enhance verification procedures, mitigate operational risks, and bolster trust among stakeholders. Increasing Adoption in Supply Chain and Logistics: Blockchain facilitates real-time asset monitoring, provenance verification, and immutable recording—essential requirements for contemporary supply chains. Logistics firms, manufacturers, and retailers are integrating BaaS platforms to assure compliance, mitigate counterfeit concerns, and improve supplier transparency. Due to increasing ESG and traceability demands, companies are investing in BaaS to digitally transform their comprehensive supply networks. Growth of Smart Contracts and Decentralized Applications (dApps): Smart contracts are transforming enterprise automation by eliminating the necessity for third-party validation in contractual processes. Blockchain-as-a-Service (BaaS) solutions empower enterprises to construct, implement, and oversee smart contracts on scalable blockchain networks without necessitating internal blockchain infrastructure. Industries such as insurance, finance, and energy are adopting BaaS to mitigate delays, enforce contractual commitments, and diminish disputes through self-executing protocols. To Purchase a Comprehensive Report Analysis: https://www.verifiedmarketresearch.com/select-licence?rid=10565 Market Restraint Regulatory Uncertainty and Compliance Challenges: The international blockchain regulatory framework is disjointed and continues to develop. Businesses encounter uncertainty around the alignment of blockchain transactions, smart contracts, and digital identities with local compliance regulations, including GDPR, HIPAA, and financial reporting standards. The intricate regulatory landscape, especially for cross-border operations, obstructs comprehensive BaaS implementations and introduces legal and reputational risks. High Implementation and Integration Costs: While BaaS diminishes the price associated with constructing blockchain infrastructure from the ground up, overall implementation costs might be considerable. Organizations must allocate resources for customisation, user training, legacy system integration, and post-deployment maintenance. For SMEs, the initial and recurring expenses remain high, deterring adoption despite the technology's promise for long-term ROI. Limited Availability of Blockchain Expertise: Blockchain continues to be a specialized competency inside the global labor market. Many firms lack the internal technical expertise necessary to efficiently implement, scale, and secure BaaS infrastructures. The learning curve related to distributed ledger technologies, consensus processes, and smart contract programming hinders implementation deadlines. This skills deficit increases dependence on external consultants and impedes innovation cycles. Geographical Dominance North America possesses the predominant stake in the Blockchain As A Service (BaaS) industry, propelled by early adoption in financial services, healthcare, and logistics. The existence of influential major actors, along with robust regulatory support for digital transformation, drives regional growth. U.S. companies are utilizing BaaS to improve data security, optimize operations, and maintain competitiveness, establishing the area as a global center for blockchain innovation. Key Players The ""Global Blockchain As A Service Market"" study report will provide a valuable insight with an emphasis on the global market. The major players in the market are IBM Corporation, Microsoft Corporation, SAP SE, Amazon Web Services, Oracle Corporation, Accenture PLC, Deloitte Touche Tohmatsu Limited, Cognizant, Infosys Limited, Capgemini SE, NTT Data Corporation, Huawei Technologies Co. Ltd, HPE, Baidu, Inc., Tata Consultancy Services Limited, KPMG, Wipro Limited. Blockchain As A Service Market Segment Analysis Based on the research, Verified Market Research has segmented the global market into Component, Business Application, Vertical and Geography. Browse Related Reports: Global Web 3.0 Market Size By Type (Decentralized Applications (dApps), Decentralized Finance (DeFi)), By Technology (Blockchain Technology, Artificial Intelligence (AI)), By Application (Gaming, Social Media), By Geography, And Forecast Global Blockchain Security Market Size By Component (Platform, and Services), By Provider (Application Providers, Middleware Providers), By Type (Private, Public), By Organization Size (Large Enterprises, SMEs), By Application (Transportation and Logistics, Agriculture and Food), By Geography, And Forecast Global Fintech as a Service (FaaS) Market Size By Type (Banking, Payment), By Technology (Artificial Intelligence (AI), Blockchain), By Application (Fraud Monitoring, KYC Verification), By End-User (Banks, Financial Institutions), By Geography, And Forecast Global Blockchain Interoperability Market Size By Solution (Cross-chain Bridging, Cross-chain APIs, Federated or Consortium Interoperability), By Application (d Apps, Digital Assets/NFTs, Cross-chain Trading & Exchange), By Geography, And Forecast 5 Leading Blockchain-As-A-Service Providers' technological tour de force Visualize Blockchain As A Service Market using Verified Market Intelligence -: Verified Market Intelligence is our BI Enabled Platform for narrative storytelling in this market. VMI offers in-depth forecasted trends and accurate Insights on over 20,000+ emerging & niche markets, helping you make critical revenue-impacting decisions for a brilliant future. VMI provides a holistic overview and global competitive landscape with respect to Region, Country, Segment, and Key players of your market. Present your Market Report & findings with an inbuilt presentation feature saving over 70% of your time and resources for Investor, Sales & Marketing, R&D, and Product Development pitches. VMI enables data delivery In Excel and Interactive PDF formats with over 15+ Key Market Indicators for your market. About Us Verified Market Research® stands at the forefront as a global leader in Research and Consulting, offering unparalleled analytical research solutions that empower organizations with the insights needed for critical business decisions. Celebrating 10+ years of service, VMR has been instrumental in providing founders and companies with precise, up-to-date research data. With a team of 500+ Analysts and subject matter experts, VMR leverages internationally recognized research methodologies for data collection and analyses, covering over 15,000 high impact and niche markets. This robust team ensures data integrity and offers insights that are both informative and actionable, tailored to the strategic needs of businesses across various industries. VMR's domain expertise is recognized across 14 key industries, including Semiconductor & Electronics, Healthcare & Pharmaceuticals, Energy, Technology, Automobiles, Defense, Mining, Manufacturing, Retail, and Agriculture & Food. In-depth market analysis cover over 52 countries, with advanced data collection methods and sophisticated research techniques being utilized. This approach allows for actionable insights to be furnished by seasoned analysts, equipping clients with the essential knowledge necessary for critical revenue decisions across these varied and vital industries. Verified Market Research® is also a member of ESOMAR, an organization renowned for setting the benchmark in ethical and professional standards in market research. This affiliation highlights VMR's dedication to conducting research with integrity and reliability, ensuring that the insights offered are not only valuable but also ethically sourced and respected worldwide. Contact UsMr. Edwyne FernandesVerified Market Research®US: +1 (650)-781-4080US Toll Free: +1 (800)-782-1768Email: [email protected]Web: https://www.verifiedmarketresearch.com/",https://www.prnewswire.com/news-releases/blockchain-as-a-service-market-is-expected-to-generate-a-revenue-of-usd-347-25-billion-by-2031--globally-at-71-20-cagr-verified-market-research-302444998.html
INFY,2025-04-30 06:21:00,Infosys Collaborates with Yorkshire Building Society to Accelerate Digital Transformation,https://images.financialmodelingprep.com/news/infosys-collaborates-with-yorkshire-building-society-to-accelerate-digital-20250430.jpg,prnewswire.com,"To provide Yorkshire Building Society's mortgage, commercial, and savings customers with a seamless mobile-first banking experience, simplifying financial interactions LONDON and BENGALURU, India , April 30, 2025 /PRNewswire/ -- Infosys (NSE: INFY) (BSE: INFY) (NYSE: INFY), a global leader in next-generation digital services and consulting, today announced a strategic collaboration with Yorkshire Building Society, one of the largest member-owned financial institutions in the UK, to accelerate its digital transformation. As part of the engagement, Infosys will help Yorkshire Building Society deliver a mobile-first, data enabled, and efficient banking experience for their mortgage, commercial, and savings members.",https://www.prnewswire.com/news-releases/infosys-collaborates-with-yorkshire-building-society-to-accelerate-digital-transformation-302442531.html
INFY,2025-04-29 16:32:49,Nifty 50 Sees Foreign Inflows While Investors Eye Earnings,https://images.financialmodelingprep.com/news/nifty-50-sees-foreign-inflows-while-investors-eye-earnings-20250429.jpg,https://247wallst.com,"Indian benchmark indices Sensex and Nifty 50 opened in green but did not maintain the momentum. Both the indices slipped into negative territory today. Today was a cautious day in terms of trade. Sensex closed at 80,288.38, up only 0.09% while Nifty 50 closed at 24,335, up 0.03%. Investors are focused on the quarterly results of some of the biggest companies including Bajaj Finserv, Bajaj Finance, Ambuja Cements and BPCL. The movement in Nifty 50 and Sensex was driven by the anticipation of the results while the stocks remained under pressure. Investors are also maintaining caution due to the global market uncertainty. Key Points Nifty 50 saw slight upside driven by tech and defense stocks. Investors have become cautious due to the geopolitical tensions in the country. Dividends are flat out one of the best ways to build wealth over the long haul, and these two dividend legends can’t stop cutting investors checks. Click here to reveal the names. Major tech stocks made gains today. Infosys (1.07%), HCL Tech (1.34%) and TCS (0.86%) saw some gains. Additionally, shares of the top defense companies also surged. Hindustan Aeronautics (4.15%), Cochin Shipyard (9.88%), and Data Patterns (14.93%) have seen a significant surge. The share price jump was seen due to the rising geopolitical tensions between India and Pakistan. The resilience behind the market is also driven by the strong buying streak from Foreign Portfolio Investors (FPIs) which pumped about Rs.35,000 crore into equities for the ninth straight session. This has helped the Nifty 50 see a surge lately. Reliance Industries, which announced strong Q4 results yesterday saw a 3% jump in share price reporting the second consecutive day of gains. The company&#8217;s shares jumped 8% in the two sessions. Ambuja Cements Ambuja Cements, a leading cement manufacturer announced Q4 results today, beating estimates. Its quarterly profit stood at Rs.956 crore, a 9% drop while the operating margin expanded to 18.2%. The company saw an 11.6% jump in revenue to Rs.9,902 crores and the management announced a dividend of Rs.2 per share. The company crossed the 100 MTPA capacity this year, making a historic milestone since its inception. It is on an expansion spree and aims to achieve 118 MTPA capacity by the end of FY 2026. Ambuja Cements share closed at $535 today, down 1.80%. Overall, the stock is down 6.93% in six months and 15% in 12 months. It has seen a drop over the last few days and is moving in a downward direction. The stock’s 52-week low is Rs. 453. The impact of the earnings will be seen on the shares tomorrow. BPCL Bharat Petroleum Corporation Ltd (BPCL) saw a 24% drop in net profit to Rs.3,214 crore for the fourth quarter. The revenue from operations also dropped 4% year-over-year. The Indian government holds a 52.98% stake in the company. The management has announced a final dividend of Rs.5 per share. Once approved, the company will distribute Rs 2,169 crore in dividends. Despite the dip in profits, the company managed to beat estimates. BPCL shares are trading for Rs. 311 and saw a minor 0.32% upside today. Overall, the shares are up 5.32% year-to-date. Trent Westside and Zudio owner Trent saw a 46% year-over-year drop in the net profit to Rs.350 crore. The fourth quarter of 2024 saw a net profit of Rs.543 crore. Despite the dip, it beat expectations and announced a dividend of Rs. 5 per equity share. For the full year, the company saw a 39% revenue jump year-over-year. It opened 13 new Westside stores in the quarter and 132 Zudio outlets. The Tata Group enterprise is registered on the NSE and saw a 5.7% jump in share price after the earnings announcement. Trading for Rs. 5,510, the share saw a sharp rise and recovered the losses of the month. Year-to-date, it is down 22%. The post Nifty 50 Sees Foreign Inflows While Investors Eye Earnings appeared first on 24/7 Wall St..",https://247wallst.com/investing/2025/04/29/nifty-50-sees-foreign-inflows-while-investors-eye-earnings/
INFY,2025-04-29 06:20:00,Announcing Infosys Topaz for SAP S/4HANA Cloud: An AI-first Offering that helps Enterprises Harness AI and Gen AI Technologies to Accelerate SAP S/4HANA Cloud Transformation,https://images.financialmodelingprep.com/news/announcing-infosys-topaz-for-sap-s4hana-cloud-an-aifirst-20250429.jpg,prnewswire.com,"Infosys to drive innovation and create sustainable value as a RISE with SAP Validated Partner  BENGALURU, India , April 29, 2025 /PRNewswire/ -- Infosys (NSE: INFY) (BSE: INFY) (NYSE: INFY), a global leader in next-generation digital services and consulting, today announced the launch of Infosys Topaz for SAP S/4HANA Cloud, an AI-first suite designed to help enterprises harness the power of AI and Gen AI in their SAP S/4HANA Cloud transformation journey. The comprehensive AI suite is powered by Infosys Cobalt cloud offerings and Infosys Topaz, an AI-first set of services, solutions, and platforms using generative AI.",https://www.prnewswire.com/news-releases/announcing-infosys-topaz-for-sap-s4hana-cloud-an-ai-first-offering-that-helps-enterprises-harness-ai-and-gen-ai-technologies-to-accelerate-sap-s4hana-cloud-transformation-302441098.html
INFY,2025-04-17 12:45:18,India's Infosys sees slowing revenue growth over global uncertainty,https://images.financialmodelingprep.com/news/indias-infosys-sees-slowing-revenue-growth-over-global-uncertainty-20250417.jpg,techxplore.com,Indian tech giant Infosys forecast muted annual revenue growth on Thursday in an outlook that suggests clients might curtail tech spending because of growing global uncertainty.,https://techxplore.com/news/2025-04-india-infosys-revenue-growth-global.html
INFY,2025-04-17 11:43:54,Infosys Limited (INFY) Q4 2025 Earnings Call Transcript,https://images.financialmodelingprep.com/news/infosys-limited-infy-q4-2025-earnings-call-transcript-20250417.jpg,seekingalpha.com,"Infosys Limited (NYSE:INFY ) Q4 2025 Earnings Conference Call April 17, 2025 8:00 AM ET Company Participants Sandeep Mahindroo - Head of IR Salil Parekh - CEO and Managing Director Jayesh Sanghrajka - CFO Conference Call Participants Ankur Rudra - JPMorgan Kumar Rakesh - BNP Paribas Abhishek Pathak - Motilal Oswal Gaurav Rateria - Morgan Stanley Jonathan Lee - Guggenheim Partners Keith Bachman - BMO Capital Surendra Goyal - Citi Abhishek Kumar - JM Financial Sandeep Shah - Equirus Securities Vibhor Singhal - Nuvama Institutional Equities Nitin Padmanabhan - Investec India Manik Taneja - Axis Capital Ashwin Mehta - Ambit Capital Girish Pai - BOB Capital Markets Operator Ladies and gentlemen, good day, and welcome to Infosys Limited Q4 FY '25 Earnings Conference Call. As a reminder all participant lines will be in the listen-only mode, and there will be an opportunity for you to ask questions after the presentation concludes.",https://seekingalpha.com/article/4775944-infosys-limited-infy-q4-2025-earnings-call-transcript
INFY,2025-04-17 11:25:42,"Infosys Q4 Earnings Surpass Estimates, Revenues Fall Short",https://images.financialmodelingprep.com/news/infosys-q4-earnings-surpass-estimates-revenues-fall-short-20250417.jpg,zacks.com,INFY's Q4 results reflect growth across manufacturing and financial services segments on the back of its key strategic initiatives and unique offerings.,https://www.zacks.com/stock/news/2450821/infosys-q4-earnings-surpass-estimates-revenues-fall-short?cid=CS-STOCKNEWSAPI-FT-analyst_blog|earnings_article-2450821
INFY,2025-04-17 10:35:58,Infosys (INFY) Reports Q4 Earnings: What Key Metrics Have to Say,https://images.financialmodelingprep.com/news/infosys-infy-reports-q4-earnings-what-key-metrics-have-20250417.jpg,zacks.com,"While the top- and bottom-line numbers for Infosys (INFY) give a sense of how the business performed in the quarter ended March 2025, it could be worth looking at how some of its key metrics compare to Wall Street estimates and year-ago values.",https://www.zacks.com/stock/news/2450612/infosys-infy-reports-q4-earnings-what-key-metrics-have-to-say?cid=CS-STOCKNEWSAPI-FT-fundamental_analysis|nfm-2450612
INFY,2025-04-17 09:59:00,Infosys to Acquire Leading Cybersecurity Services Provider The Missing Link,https://images.financialmodelingprep.com/news/infosys-to-acquire-leading-cybersecurity-services-provider-the-missing-20250417.jpg,prnewswire.com,"Acquisition strengthens Infosys' cybersecurity and cloud capabilities across Australia and Asia BENGALURU, India and SYDNEY , April 17, 2025 /PRNewswire/ -- Infosys (NSE: INFY) (BSE: INFY) (NYSE: INFY) , a global leader in next-generation digital services and consulting, today announced a definitive agreement to acquire The Missing Link, an award winning Australian cybersecurity services specialist firm with capabilities across the full stack of cyber solutions. This strategic investment further strengthens Infosys' cybersecurity capabilities, while bolstering its presence in the fast-growing Australian market, and reaffirms its continued commitment to global clients to navigate their digital transformation journey.",https://www.prnewswire.com/news-releases/infosys-to-acquire-leading-cybersecurity-services-provider-the-missing-link-302431570.html
INFY,2025-04-17 09:51:00,"Infosys: Growth of 4.2% in CC, operating margin expansion of 0.5% in FY25",https://images.financialmodelingprep.com/news/infosys-growth-of-42-in-cc-operating-margin-expansion-20250417.jpg,prnewswire.com,"- Highest ever Free Cash Flow at $4.1 billion for FY25- FY26 revenue guidance at 0%-3% and operating margin at 20%-22% BENGALURU, India , April 17, 2025 /PRNewswire/ -- Infosys (NSE: INFY), (BSE: INFY), (NYSE: INFY), a global leader in next-generation digital services and consulting, delivered $19,277 million in FY25 revenues, growth of 4.2% in constant currency. Operating margin was at 21.1%, expansion of 0.5% year on year.",https://www.prnewswire.com/news-releases/infosys-growth-of-4-2-in-cc-operating-margin-expansion-of-0-5-in-fy25--302431561.html
INFY,2025-04-17 09:34:00,"Infosys to Acquire Leading Energy Consulting Company, MRE Consulting",https://images.financialmodelingprep.com/news/infosys-to-acquire-leading-energy-consulting-company-mre-consulting-20250417.jpg,prnewswire.com,"Acquisition to strengthen energy and commodity trading and risk management (E/CTRM) capabilities for Infosys BENGALURU, India and HOUSTON , April 17, 2025 /PRNewswire/ -- Infosys (NSE, BSE, NYSE: INFY) a global leader in next-generation digital services and consulting, today announced a definitive agreement to acquire MRE Consulting Ltd. ('MRE Consulting'), a technology and business consulting service provider.",https://www.prnewswire.com/news-releases/infosys-to-acquire-leading-energy-consulting-company-mre-consulting-302431549.html
INFY,2025-04-17 09:32:00,"Mitsubishi Heavy Industries joins Infosys-led JV in Japan, HIPUS",https://images.financialmodelingprep.com/news/mitsubishi-heavy-industries-joins-infosysled-jv-in-japan-hipus-20250417.jpg,prnewswire.com,"JV to accelerate business process transformation for enterprises leveraging digital procurement platforms BENGALURU, India and TOKYO , April 17, 2025 /PRNewswire/ -- Infosys (NSE, BSE, NYSE: INFY), a global leader in next-generation digital services and consulting, today announced Mitsubishi Heavy Industries (MHI) has invested in the Infosys-led Joint Venture HIPUS, enhancing Infosys' presence in Japan. MHI is one of the world's leading industrial groups, spanning energy, smart infrastructure, industrial machinery, aerospace and defense, and has established corporations like Hitachi Ltd.",https://www.prnewswire.com/news-releases/mitsubishi-heavy-industries-joins-infosys-led-jv-in-japan-hipus-302431546.html
INFY,2025-04-17 07:04:09,India's Infosys misses fourth-quarter revenue estimates,https://images.financialmodelingprep.com/news/indias-infosys-misses-fourthquarter-revenue-estimates-20250417.jpg,reuters.com,Infosys on Thursday projected weak revenue growth for the fiscal year as ongoing softness in North America underscored tighter client budgets.,https://www.reuters.com/world/india/indias-infosys-misses-fourth-quarter-revenue-estimates-2025-04-17/
INFY,2025-04-14 10:21:03,Unveiling Infosys (INFY) Q4 Outlook: Wall Street Estimates for Key Metrics,https://images.financialmodelingprep.com/news/unveiling-infosys-infy-q4-outlook-wall-street-estimates-for-20250414.jpg,zacks.com,Get a deeper insight into the potential performance of Infosys (INFY) for the quarter ended March 2025 by going beyond Wall Street's top -and-bottom-line estimates and examining the estimates for some of its key metrics.,https://www.zacks.com/stock/news/2448333/unveiling-infosys-infy-q4-outlook-wall-street-estimates-for-key-metrics?cid=CS-STOCKNEWSAPI-FT-fundamental_analysis|nfm_preview-2448333
INFY,2025-04-10 14:44:55,Options Bears Blast Infosys Stock Before Earnings,https://images.financialmodelingprep.com/news/options-bears-blast-infosys-stock-before-earnings-20250410.jpg,schaeffersresearch.com,"Options bears are blasting Infosys Ltd (NYSE:INFY) stock, with 23,000 puts traded so far today -- 14 times the intraday average volume -- compared to just 142 calls.",https://www.schaeffersresearch.com/content/options/2025/04/10/options-bears-blast-infosys-stock-before-earnings
