symbol,publishedDate,title,image,site,text,url
INFY,2025-04-09 06:12:00,Infosys and AIB Extend Strategic Collaboration for Digital Transformation,https://images.financialmodelingprep.com/news/infosys-and-aib-extend-strategic-collaboration-for-digital-transformation-20250409.jpg,prnewswire.com,"To deliver application development, testing, and support services BENGALURU, India and DUBLIN , April 9, 2025 /PRNewswire/ -- Infosys (NSE: INFY) (BSE: INFY) (NYSE: INFY), a global leader in next-generation digital services and consulting, today announced it is extending its strategic collaboration with AIB, a financial services group operating predominantly in the Republic of Ireland and the UK. Building further on its 10-year relationship, Infosys will take on a renewed and expanded role to support AIB as it further accelerates its transformation initiatives and delivers support and value to its customers and stakeholders.",https://www.prnewswire.com/news-releases/infosys-and-aib-extend-strategic-collaboration-for-digital-transformation-302424410.html
INFY,2025-04-02 04:28:00,Infosys and Formula E Launch AI-Powered Stats Center to Boost Fan Engagement,https://images.financialmodelingprep.com/news/infosys-and-formula-e-launch-aipowered-stats-center-to-20250402.jpg,prnewswire.com,"Leveraging Infosys Topaz, the Stats Center offers interactive and immersive stories based on driver and team stats across seasons BENGALURU, India , April 2, 2025 /PRNewswire/ -- Infosys (NSE: INFY) (BSE: INFY) (NYSE: INFY), a global leader in next-generation digital services and consulting, today announced the launch of the Formula E Stats Center, developed in partnership with the ABB FIA Formula E World Championship, the world's first all-electric FIA World Championship. The Stats Center is powered by Infosys Topaz, an AI-first offering using generative AI technologies, and is set to redefine fan engagement by delivering advanced, data-driven insights and immersive experiences.",https://www.prnewswire.com/news-releases/infosys-and-formula-e-launch-ai-powered-stats-center-to-boost-fan-engagement-302418249.html
INFY,2025-03-31 15:23:37,Infosys: Well-Positioned To Support The Next Wave Of Digital Transformation,https://images.financialmodelingprep.com/news/infosys-wellpositioned-to-support-the-next-wave-of-digital-20250331.jpg,seekingalpha.com,"Infosys is a global leader in digital services, well-positioned for long-term value creation despite near-term macroeconomic uncertainties and subdued client spending. INFY's strong client relationships, robust service portfolio, and operational excellence support resilient margins, with significant new large deal wins and a solid free cash flow generation. Growth strategies include leveraging the Topaz AI platform and Cobalt cloud solutions, strategic acquisitions, and enhancing operational efficiency through Project Maximus.",https://seekingalpha.com/article/4772009-infosys-well-positioned-support-next-wave-digital-transformation
INFY,2025-03-31 11:12:00,Infosys and Linux Foundation Networking Collaborate to Strengthen Responsible AI for Global Networks,https://images.financialmodelingprep.com/news/infosys-and-linux-foundation-networking-collaborate-to-strengthen-responsible-20250331.jpg,prnewswire.com,"Infosys has contributed its Responsible AI Toolkit and AI application development framework to two new open source networking projects aimed at accelerating ethical enterprise AI adoption LONDON and BENGALURU, India , March 31, 2025 /PRNewswire/ -- Infosys (NSE: INFY) (BSE: INFY) (NYSE: INFY), a global leader in next-generation digital services and consulting, today announced its collaboration with Linux Foundation Networking (LFN), the facilitator of collaboration and operational excellence across open source networking projects, to advance Responsible AI principles and spur the adoption of domain-specific AI across global networks. This collaboration underscores a shared commitment to fostering responsible, effective, and sustainable AI technologies on a global scale.",https://www.prnewswire.com/news-releases/infosys-and-linux-foundation-networking-collaborate-to-strengthen-responsible-ai-for-global-networks-302415786.html
INFY,2025-03-31 10:36:14,"Infosys (INFY) Loses -9.6% in 4 Weeks, Here's Why a Trend Reversal May be Around the Corner",https://images.financialmodelingprep.com/news/infosys-infy-loses-96-in-4-weeks-heres-why-a-20250331.jpg,zacks.com,"The heavy selling pressure might have exhausted for Infosys (INFY) as it is technically in oversold territory now. In addition to this technical measure, strong agreement among Wall Street analysts in revising earnings estimates higher indicates that the stock is ripe for a trend reversal.",https://www.zacks.com/stock/news/2437371/infosys-infy-loses-9-6-in-4-weeks-here-s-why-a-trend-reversal-may-be-around-the-corner?cid=CS-STOCKNEWSAPI-FT-tale_of_the_tape|rsi-2437371
INFY,2025-03-27 06:19:00,Infosys Powers LKQ Europe's HR Transformation with a Unified Digital Platform,https://images.financialmodelingprep.com/news/infosys-powers-lkq-europes-hr-transformation-with-a-unified-20250327.jpg,prnewswire.com,"Leveraging Infosys Cobalt, the digital platform will help streamline HR processes across LKQ Europe's 18 countries BENGALURU, India , March 27, 2025 /PRNewswire/ -- Infosys (NSE: INFY) (BSE: INFY) (NYSE: INFY), a global leader in next-generation digital services and consulting, today announced a successful collaboration with LKQ Europe, one of the leading distributors of automotive aftermarket parts for cars, commercial vans, and industrial vehicles in the region. Leveraging Infosys Cobalt, a set of services, solutions, and platforms designed to help enterprises accelerate their cloud journeys, Infosys has helped LKQ Europe adopt a unified, cloud-based digital platform to streamline its HR processes across 18 countries.",https://www.prnewswire.com/news-releases/infosys-powers-lkq-europes-hr-transformation-with-a-unified-digital-platform-302413065.html
INFY,2025-03-25 10:23:00,Capitalizing on Growth: Why Financial Services Firms Need a Unified AI Strategy,https://images.financialmodelingprep.com/news/capitalizing-on-growth-why-financial-services-firms-need-a-20250325.jpg,prnewswire.com,"New Infosys and HFS Research Report underscores how AI is the new transformation lever for BFS enterprises BENGALURU, India , March 25, 2025 /PRNewswire/ -- The advent of gen AI has driven two-thirds (66 percent) of banking and financial services (BFS) enterprises to update their AI strategy – yet the majority (88 percent) of BFS firms lack a comprehensive, enterprise-wide AI strategy, according to a new study from Infosys (NYSE: INFY), a global leader in next-generation digital services and consulting. The new report titled ""Why, What, and How Financial Services firms can be AI-First,"" conducted in collaboration with HFS Research, underscored the critical gap at many BFS firms between AI initiatives and overarching business objectives.",https://www.prnewswire.com/news-releases/capitalizing-on-growth-why-financial-services-firms-need-a-unified-ai-strategy-302410777.html
INFY,2025-03-14 11:43:03,Infosys settles lawsuits against US unit over cyber incident for $17.5 million,https://images.financialmodelingprep.com/news/infosys-settles-lawsuits-against-us-unit-over-cyber-incident-20250314.jpg,reuters.com,Indian IT services provider Infosys on Friday said it had reached an agreement with the plaintiffs of lawsuits pending against its U.S. unit over the 2023 cyber incident.,https://www.reuters.com/technology/infosys-settles-lawsuits-against-us-unit-over-cyber-incident-175-million-2025-03-14/
INFY,2025-03-12 09:46:00,Infosys Announces Expansion of Strategic Collaboration with Citizens to Propel AI-led Transformation,https://images.financialmodelingprep.com/news/infosys-announces-expansion-of-strategic-collaboration-with-citizens-to-20250312.jpg,prnewswire.com,"To help accelerate innovation, drive market leadership and better serve customers BENGALURU, India , March 12, 2025 /PRNewswire/ -- Infosys (NSE: INFY) (BSE: INFY) (NYSE: INFY), a global leader in next-generation digital services and consulting today announced the expansion of its long-standing strategic collaboration with Citizens, one of the oldest and largest financial institutions in the US. Citizens will leverage Infosys' deep domain expertise in financial services and its innovative technologies, including AI, cloud, and automation to develop cloud native domain platforms and achieve data center exit.",https://www.prnewswire.com/news-releases/infosys-announces-expansion-of-strategic-collaboration-with-citizens-to-propel-ai-led-transformation-302399928.html
INFY,2025-03-12 06:46:00,Enterprise AI Takes Center Stage as Over 50% of AI Use Cases Now Deliver Impact: Infosys Research,https://images.financialmodelingprep.com/news/enterprise-ai-takes-center-stage-as-over-50-of-20250312.jpg,prnewswire.com,"Agentic AI emerges as a priority for operating model transformation Effective employee engagement and change management improve AI success by up to 18 percentage points BENGALURU, India , March 12, 2025 /PRNewswire/ -- Infosys Knowledge Institute (IKI), a research arm of Infosys (NSE: INFY) (BSE: INFY) (NYSE: INFY), a global leader in next-generation digital services and consulting, today unveiled its largest survey of AI effectiveness to date. Titled Infosys AI Business Value Radar, the report surveyed 3,240 companies worldwide across 132 different AI business use cases and highlights a significant shift in AI deployment.",https://www.prnewswire.com/news-releases/enterprise-ai-takes-center-stage-as-over-50-of-ai-use-cases-now-deliver-impact-infosys-research-302399713.html
INFY,2025-03-11 07:08:00,Ethisphere recognizes Infosys among 2025 World's Most Ethical Companies® for the Fifth Consecutive Year,https://images.financialmodelingprep.com/news/ethisphere-recognizes-infosys-among-2025-worlds-most-ethical-companies-20250311.jpg,prnewswire.com,"Recognized for demonstrating strong culture of ethics, integrity, ethical governance, and responsible business practices BENGALURU, India , March 11, 2025 /PRNewswire/ -- Infosys (NSE: INFY) (BSE: INFY) (NYSE: INFY), a global leader in next-generation digital services and consulting, today announced that it has received The 2025 World's Most Ethical Companies® recognition by Ethisphere , a global leader in defining and advancing the standards of ethical business practices. Infosys received the honor, for the fifth consecutive year, for demonstrating strong culture of ethics, integrity, ethical governance, and responsible business practices.",https://www.prnewswire.com/news-releases/ethisphere-recognizes-infosys-among-2025-worlds-most-ethical-companies-for-the-fifth-consecutive-year-302398254.html
INFY,2025-02-26 04:50:00,Infosys Launches Open-Source Responsible AI Toolkit to Enhance Trust and Transparency in AI,https://images.financialmodelingprep.com/news/infosys-launches-opensource-responsible-ai-toolkit-to-enhance-trust-20250226.jpg,prnewswire.com,"The initiative furthers Infosys' commitment to creating an inclusive AI ecosystem, ensuring safety, security, privacy, and fairness BENGALURU, India , Feb. 26, 2025 /PRNewswire/ -- Infosys (NSE: INFY), (BSE: INFY), (NYSE: INFY), a global leader in next-generation digital services and consulting, today announced the launch of its open-source Responsible AI Toolkit, a key component of the Infosys Topaz Responsible AI Suite, designed to help enterprises innovate responsibly while addressing the challenges and risks associated with ethical AI adoption. The Infosys Responsible AI Toolkit builds on the Infosys AI3S framework (Scan, Shield, and Steer), equipping enterprises with advanced defensive technical guardrails, including specialized AI models and shielding algorithms, to detect and mitigate issues such as privacy breaches, security attacks, sensitive information leakages, biased output, harmful content, copyright infringement, hallucinations, malicious use, deepfakes and more.",https://www.prnewswire.com/news-releases/infosys-launches-open-source-responsible-ai-toolkit-to-enhance-trust-and-transparency-in-ai-302385918.html
INFY,2025-02-18 05:14:00,"Infosys, Lufthansa Group, and Lufthansa Systems Collaborate to Accelerate Digital Innovation in the Aviation Industry",https://images.financialmodelingprep.com/news/infosys-lufthansa-group-and-lufthansa-systems-collaborate-to-accelerate-20250218.jpg,prnewswire.com,"Establishes a new Global Capability Center in India to drive growth and deliver future-ready capabilities and services powered by Infosys Topaz BENGALURU, India , Feb. 18, 2025 /PRNewswire/ -- Infosys (NSE: INFY) (BSE: INFY) (NYSE: INFY), a global leader in next-generation digital services and consulting, today announced a strategic, long-term collaboration with Lufthansa Group  (LHG), a global aviation group, and Lufthansa Systems GmbH  (LSY), leading airline IT provider, to accelerate digital transformation and drive innovation in the aviation industry. As part of the engagement, LSY and Infosys will establish a dedicated Global Capability Center (GCC) in Bengaluru, India.",https://www.prnewswire.com/news-releases/infosys-lufthansa-group-and-lufthansa-systems-collaborate-to-accelerate-digital-innovation-in-the-aviation-industry-302378775.html
INFY,2025-01-29 05:19:00,Infosys and Siemens AG to Accelerate Digital Learning with Generative AI,https://images.financialmodelingprep.com/news/infosys-and-siemens-ag-to-accelerate-digital-learning-with-20250129.jpg,prnewswire.com,"Collaboration provides lifelong learners at Siemens with new and personalized learning experiences BENGALURU, India , Jan. 29, 2025 /PRNewswire/ -- Infosys (NSE: INFY) (BSE: INFY) (NYSE: INFY), a global leader in next-generation digital services and consulting, today announced the expansion of its collaboration with Siemens AG, a leading technology company, to accelerate its digital learning initiatives with generative AI. The collaboration aims to provide over 250,000 Siemens' people globally with upskilling opportunities, and a personalized learning and growth experience.",https://www.prnewswire.com/news-releases/infosys-and-siemens-ag-to-accelerate-digital-learning-with-generative-ai-302363122.html
INFY,2025-01-28 05:22:00,Infosys and Saïd Business School Launch Course for Entrepreneurs on Infosys Springboard,https://images.financialmodelingprep.com/news/infosys-and-sad-business-school-launch-course-for-entrepreneurs-20250128.jpg,prnewswire.com,"Collaboration aims to empower entrepreneurs and SMEs with the skills needed to thrive in today's dynamic business landscape OXFORD, England and BENGALURU, India , Jan. 28, 2025 /PRNewswire/ -- Infosys (NSE: INFY) (BSE: INFY) (NYSE: INFY), a global leader in next-generation digital services and consulting, and Saïd Business School, University of Oxford, one of Europe's leading  entrepreneurial business schools, today announced the launch of the 'Springboard StartSmart: Foundations for Entrepreneurs' course. Leveraging Infosys Springboard, the free digital learning and reskilling platform, the course is aimed at new entrepreneurs and small and medium enterprises (SMEs).",https://www.prnewswire.com/news-releases/infosys-and-said-business-school-launch-course-for-entrepreneurs-on-infosys-springboard-302361799.html
INFY,2025-01-27 08:36:04,"Infosys CEO on Growth in US, AI, Trump Policies",https://images.financialmodelingprep.com/news/infosys-ceo-on-growth-in-us-ai-trump-policies-20250127.jpg,youtube.com,"Salil Parekh, Infosys CEO and managing director speaks to Bloomberg's Haslinda Amin on the sidelines of the 2025 World Economic Forum in Davos. They talk about the impact of President Donald Trump on business, earnings, immigration and artificial intelligence.",https://www.youtube.com/watch?v=t9C3FtBAxxM
INFY,2025-01-27 05:21:00,Infosys and Street Child Unite to Enable Access to Quality Education in Ukraine with Digital Innovation,https://images.financialmodelingprep.com/news/infosys-and-street-child-unite-to-enable-access-to-20250127.jpg,prnewswire.com,"Establish seven Digital Learning Centers and create high-quality content for teachers and children, available through Infosys Springboard BENGALURU, India , Jan. 27, 2025 /PRNewswire/ -- Infosys (NSE: INFY) (BSE: INFY) (NYSE: INFY), a global leader in next-generation digital services and consulting, today announced a critical milestone in its three-year collaboration with Street Child, an international children's charity, with the establishment of seven Digital Learning Centers (DLCs) to address the educational challenges faced by children in crisis-affected areas of Ukraine. This collaboration addresses the profound disruption to Ukraine's education system caused by the ongoing conflict, which has affected over 3,700 educational institutions and destroying 365 schools, as reported by Save the Children.",https://www.prnewswire.com/news-releases/infosys-and-street-child-unite-to-enable-access-to-quality-education-in-ukraine-with-digital-innovation-302360660.html
INFY,2025-01-23 07:00:25,"Infosys has de-risked firm's reliance on H-1B visas, CEO says",https://images.financialmodelingprep.com/news/infosys-has-derisked-firms-reliance-on-h1b-visas-ceo-20250123.jpg,youtube.com,"Salil Parekh, chief executive of Infosys, said the Indian technology outsourcing firm has lowered the risk it faces from any potential curbs to U.S. work permits.",https://www.youtube.com/watch?v=M7KJfgBvvZk
INFY,2025-01-21 07:52:57,"Indian IT sector's talent management to evolve, Infosys CTO says at Davos",https://images.financialmodelingprep.com/news/indian-it-sectors-talent-management-to-evolve-infosys-cto-20250121.jpg,reuters.com,"Infosys expects the way the tech industry manages talent to shift and has already begun experimenting with how this transformation will occur, its chief technology officer said in an interview Davos, Switzerland.",https://www.reuters.com/technology/indian-it-sectors-talent-management-evolve-infosys-cto-says-davos-2025-01-21/
INFY,2025-01-21 04:57:00,Infosys leads the industry with the fastest growing CAGR in brand value of 18% over 5 years. Maintains leadership as a global Top 3 IT services brand,https://images.financialmodelingprep.com/news/infosys-leads-the-industry-with-the-fastest-growing-cagr-20250121.jpg,prnewswire.com,"Infosys CEO Salil Parekh is the No.1 IT services CEO, for the second year in a row, in the Brand Guardianship Index 2025 DAVOS, Switzerland , Jan. 21, 2025 /PRNewswire/ -- Infosys  (NSE: INFY) (BSE: INFY) (NYSE: INFY), a global leader in next-generation digital services and consulting, today announced that Brand Finance, the world's leading brand valuation firm, has recognized the company as a Top 3 IT services brand and the fastest growing IT services brand globally, with a CAGR of 18% over 5 years in its Brand Finance Global 500 2025 report. Infosys' brand value has grown to over US$16 billion in 2025, and Infosys is ranked as #132 most valuable brand in the world.",https://www.prnewswire.com/news-releases/infosys-leads-the-industry-with-the-fastest-growing-cagr-in-brand-value-of-18-over-5-years-maintains-leadership-as-a-global-top-3-it-services-brand-302356020.html
INFY,2025-01-19 09:30:00,Infosys: IT Services Giant Hit By Negative Sentiment And Weak Q4 Outlook,https://images.financialmodelingprep.com/news/infosys-it-services-giant-hit-by-negative-sentiment-and-20250119.jpg,seekingalpha.com,"Infosys, a major IT services player, has seen a 29.24% return since October 2023 but recently dropped 10% due to a bleak Q4 2025 outlook. Despite strong financials and a solid balance sheet, Infosys faces slower top-line growth, fewer large deals, and rising costs, impacting its attractiveness. Compared to peers, Infosys appears overvalued with a high FWD P/E ratio of 28.92 and a TTM price-to-book ratio of 8.55.",https://seekingalpha.com/article/4750459-infosys-it-services-giant-hit-by-negative-sentiment-and-weak-q4-outlook
INFY,2025-01-18 06:37:08,Infosys Ltd.: Share Price Drop Represents An Attractive Entry Point,https://images.financialmodelingprep.com/news/infosys-ltd-share-price-drop-represents-an-attractive-entry-20250118.jpg,seekingalpha.com,"I reiterate a buy rating for Infosys Ltd. (INFY) due to improving demand, attractive entry point, and long-term growth potential. INFY's latest earnings show revenue growth of 1.7% q/q and 6.1% y/y, with a net profit increase of ~11.5% y/y. INFY's AI-driven large deal momentum and industry recovery signal strong growth potential, despite conservative 4Q25 guidance.",https://seekingalpha.com/article/4750378-infosys-ltd-share-price-drop-represents-an-attractive-entry-point
INFY,2025-01-17 09:35:24,INFY Q3 Earnings Meet Estimates: Will Upbeat FY25 View Lift the Stock?,https://images.financialmodelingprep.com/news/infy-q3-earnings-meet-estimates-will-upbeat-fy25-view-20250117.jpg,zacks.com,"Infosys' Q3 results reflect growth across segments and regions on the back of its key strategic initiatives, strong position and unique offerings.",https://www.zacks.com/stock/news/2398836/infy-q3-earnings-meet-estimates-will-upbeat-fy25-view-lift-the-stock?cid=CS-STOCKNEWSAPI-FT-analyst_blog|earnings_article-2398836
INFY,2025-01-16 23:51:04,India's Infosys shares fall on worries about quality of earnings,https://images.financialmodelingprep.com/news/indias-infosys-shares-fall-on-worries-about-quality-of-earnings-20250116.jpg,reuters.com,"Shares of India's No. 2 software services exporter Infosys fell nearly 6% on Friday and were set for their biggest one-day decline since July 2023, as analysts raised concerns about the quality of earnings following its third-quarter report.",https://www.reuters.com/technology/indias-infosys-shares-fall-worries-about-quality-earnings-2025-01-17/
INFY,2025-01-16 21:01:15,Here's What Key Metrics Tell Us About Infosys (INFY) Q3 Earnings,https://images.financialmodelingprep.com/news/heres-what-key-metrics-tell-us-about-infosys-infy-20250116.jpg,zacks.com,"The headline numbers for Infosys (INFY) give insight into how the company performed in the quarter ended December 2024, but it may be worthwhile to compare some of its key metrics to Wall Street estimates and the year-ago actuals.",https://www.zacks.com/stock/news/2398633/here-s-what-key-metrics-tell-us-about-infosys-infy-q3-earnings?cid=CS-STOCKNEWSAPI-FT-fundamental_analysis|nfm-2398633
INFY,2025-01-16 11:49:04,Infosys Limited (INFY) Q3 2025 Earnings Call Transcript,https://images.financialmodelingprep.com/news/infosys-limited-infy-q3-2025-earnings-call-transcript-20250116.jpg,seekingalpha.com,"Infosys Limited (NYSE:INFY ) Q3 2025 Earnings Conference Call January 16, 2025 8:00 AM ET Company Participants Sandeep Mahindroo - Head of IR Salil Parekh - CEO and Managing Director Jayesh Sanghrajka - CFO Conference Call Participants Ankur Rudra - JPMorgan Yogesh Agarwal - HSBC Securities Bryan Bergin - TD Cowen Rishi Jhunjhunwala - India Infoline Jonathan Lee - Guggenheim Partners Surendra Goyal - Citigroup Vibhor Singhal - Nuvama Institutional Equities Ashwin Mehta - Ambit Capital Jamie Friedman - Susquehanna International Group Sandeep Shah - Equirus Securities Sumeet Jain - CLSA India Keith Bachman - BMO Capital Abhinav Ganeshan - SBI Pension Funds Operator Ladies and gentlemen, good day, and welcome to Infosys Limited Q3 FY '25 Earnings Conference Call. [Operator Instructions] Please note that this conference is being recorded.",https://seekingalpha.com/article/4749976-infosys-limited-infy-q3-2025-earnings-call-transcript
INFY,2025-01-16 10:36:43,IT giant Infosys reports slower revenue growth,https://images.financialmodelingprep.com/news/it-giant-infosys-reports-slower-revenue-growth-20250116.jpg,proactiveinvestors.com,"Shares in Infosys (NASDAQ:INFY) fell 5.8% in New York on Thursday after the IT consultancy multinational turned in fiscal third-quarter results that showed slower sales growth but a slight improvement in margins.  The India-headquartered giant, among the top 150 companies on the NYSE, revealed US$4.9 billion of revenue for the the three months to December, up 1.7% on the preceding quarter and 6.1% compared to a year earlier.",https://www.proactiveinvestors.com/companies/news/1064474
INFY,2025-01-16 07:27:00,"Infosys: Strong growth of 6.1% YoY in CC, 80 bps YoY operating margin expansion",https://images.financialmodelingprep.com/news/infosys-strong-growth-of-61-yoy-in-cc-80-20250116.jpg,prnewswire.com,"Large deal TCV of $2.5 billion including 63% net new; Headcount increased by 5,591  FY25 revenue guidance revised to 4.5%-5.0%  BENGALURU, India , Jan. 16, 2025 /PRNewswire/ -- Infosys (NSE: INFY) (BSE: INFY) (NYSE: INFY), a global leader in next-generation digital services and consulting, delivered strong and broad-based performance with $4,939 million in Q3 revenues, growth of 1.7% sequentially and 6.1% year on year in constant currency. Operating margin for Q3 was at 21.3%, increase of 0.2% sequentially.",https://www.prnewswire.com/news-releases/infosys-strong-growth-of-6-1-yoy-in-cc-80-bps-yoy-operating-margin-expansion-302353179.html
INFY,2025-01-16 07:20:00,Outsourcing giant Infosys raised sales guidance for a third time. AI is helping.,https://images.financialmodelingprep.com/news/outsourcing-giant-infosys-raised-sales-guidance-for-a-third-20250116.jpg,marketwatch.com,Indian outsourcing giant Infosys on Thursday raised its sales outlook for the third time this year as the company said clients were increasingly adopting its artificial-intelligence services.,https://www.marketwatch.com/story/outsourcing-giant-infosys-raised-sales-guidance-for-a-third-time-ai-is-helping-ce7105bc
