symbol,publishedDate,title,image,site,text,url
ORCL,2024-12-12 11:11:06,Oracle Slips on Q2 Earnings & Sales Miss: Time to Sell the Stock?,https://images.financialmodelingprep.com/news/oracle-slips-on-q2-earnings-sales-miss-time-to-20241212.jpg,zacks.com,"ORCL's Q2 shows weak margins, heavy AI spending and negative cash flow. Despite cloud growth claims, rising costs and tepid guidance signal it's time to exit.",https://www.zacks.com/stock/news/2382858/oracle-slips-on-q2-earnings-sales-miss-time-to-sell-the-stock?cid=CS-STOCKNEWSAPI-FT-analyst_blog|most_popular_stocks-2382858
ORCL,2024-12-12 10:46:06,Here's Why Oracle (ORCL) is a Strong Growth Stock,https://images.financialmodelingprep.com/news/heres-why-oracle-orcl-is-a-strong-growth-stock-20241212.jpg,zacks.com,"Whether you're a value, growth, or momentum investor, finding strong stocks becomes easier with the Zacks Style Scores, a top feature of the Zacks Premium research service.",https://www.zacks.com/stock/news/2382787/here-s-why-oracle-orcl-is-a-strong-growth-stock?cid=CS-STOCKNEWSAPI-FT-tale_of_the_tape|zacks_education_growth_score-2382787
ORCL,2024-12-12 09:00:00,Siemens and Oracle Red Bull Racing celebrate 20 years of innovation,https://images.financialmodelingprep.com/news/siemens-and-oracle-red-bull-racing-celebrate-20-years-20241212.jpg,prnewswire.com,"PLANO, Texas , Dec. 12, 2024 /PRNewswire/ -- Siemens Digital Industries Software is celebrating the 20th anniversary of its collaboration with Oracle Red Bull Racing, representing one of the longest standing technical partnerships in Formula 1™ today.   ""With Siemens, we've got the digital backbone that lets us turn ideas into reality faster than ever.",https://www.prnewswire.com/news-releases/siemens-and-oracle-red-bull-racing-celebrate-20-years-of-innovation-302329075.html
ORCL,2024-12-12 08:00:00,Nashville Metro Government Selects Oracle Fusion Cloud Applications to Support Growing Population and Fiscal Responsibility,https://images.financialmodelingprep.com/news/nashville-metro-government-selects-oracle-fusion-cloud-applications-to-20241212.jpg,prnewswire.com,"City of Nashville, Davidson County, and Nashville Public Schools are turning to Oracle to increase efficiency, improve decision-making, and enhance service delivery AUSTIN, Texas , Dec. 12, 2024 /PRNewswire/ -- The Nashville Metro Government is implementing Oracle Fusion Cloud Applications for finance and HR to support its mission of delivering exceptional services to its growing population. With Oracle Fusion Applications, Nashville Metro Government will transform operational efficiency to better meet the current and future needs of its workforce and constituents.",https://www.prnewswire.com/news-releases/nashville-metro-government-selects-oracle-fusion-cloud-applications-to-support-growing-population-and-fiscal-responsibility-302328700.html
ORCL,2024-12-12 05:55:00,"Oracle: Q2 Earnings, Still Essential For AGI",https://images.financialmodelingprep.com/news/oracle-q2-earnings-still-essential-for-agi-20241212.jpg,seekingalpha.com,"Oracle's recent Q2 miss on EPS and revenue sparked a sell-off, but the declines were minimal, with EPS missing by just $0.01 and revenue missing by $63.95 million. Oracle remains pivotal to AI development, with cloud infrastructure revenue up 52% and GPU consumption surging 336%, driven by record AI demand and AGI database needs. Oracle's forward revenue and EPS growth outpace the sector median, yet shares trade at only a slight premium, offering strong growth at a reasonable valuation.",https://seekingalpha.com/article/4743800-oracle-orcl-stock-q2-earnings-still-essential-for-agi
ORCL,2024-12-11 16:44:00,Missed Nvidia? Buy Oracle and 2 Other Beaten-Down AI Stocks Now.,https://images.financialmodelingprep.com/news/missed-nvidia-buy-oracle-and-2-other-beatendown-ai-20241211.jpg,barrons.com,"Missed out on the Magnificent Seven surge, or just looking for me? Oracle, Teradyne, and AMD offer meaningful upside.",https://www.barrons.com/articles/nvidia-ai-stocks-oracle-teradyne-amd-c2208fdf
ORCL,2024-12-11 11:30:45,Oracle: The Market Has Given Us An Early Christmas Present (Rating Upgrade),https://images.financialmodelingprep.com/news/oracle-the-market-has-given-us-an-early-christmas-20241211.jpg,seekingalpha.com,"Oracle Cloud Infrastructure's robust growth and market share gains have propelled the stock's recent outperformance. However, a near-term double miss disappointed investors at Oracle's recent FQ2 earnings release. Investors shouldn't be unduly concerned about the pullback, as Oracle is well-poised to gain market share over time.",https://seekingalpha.com/article/4743512-oracle-stock-post-earnings-decline-buying-opportunity
ORCL,2024-12-11 07:45:00,ARCO Streamlines Construction Payments with Oracle Textura,https://images.financialmodelingprep.com/news/arco-streamlines-construction-payments-with-oracle-textura-20241211.jpg,prnewswire.com,"Leading design-build company deploys Oracle Textura to improve collaboration with subcontractors and better manage lien waivers AUSTIN, Texas , Dec. 11, 2024 /PRNewswire/ -- ARCO, a leading national design-build construction firm, has implemented Oracle Textura Payment Management to streamline and automate its construction payment processes. With Textura, ARCO has transformed the speed and efficiency of its invoicing, improved the secure management of lien waivers and compliance, and enhanced its collaboration with subcontractors.",https://www.prnewswire.com/news-releases/arco-streamlines-construction-payments-with-oracle-textura-302328215.html
ORCL,2024-12-11 03:58:48,Advanced Micro Devices Inc. (AMD) Price Prediction and Forecast 2025-2030,https://images.financialmodelingprep.com/news/advanced-micro-devices-inc-amd-price-prediction-and-forecast-20252030-20241211.jpg,https://247wallst.com,"According to PC Gamer, “The AMD Ryzen 7 7800X3D is simply the best gaming CPU around right now. It’s certainly the best gaming chip that AMD has ever made, but it’s also capable of outperforming Intel’s top CPU when it comes to gaming frame rates and is doing so for a lot less cash. It’s also a lot less power-thirsty, too.” Rave reviews such as this would have been considered unthinkable over a decade ago. After 50 years of playing second best to rival Intel (NASDAQ: INTC), Advanced Micro Devices (NASDAQ: AMD) surpassed it, thanks to CEO Dr. Linda Su, who took the reins in 2014 and AMD was able to unveil the Ryzen in 2017, which became a game changer. Based on a principle of multiple microscopic CPUs working in tandem, AMD’s Ryzen CPU outperformed Intel’s CPUs in speed and efficiency, and most importantly – cost only half as much. Ryzen and its later updates subsequently added tents of billions to AMD’s revenues, and in 2022, AMD surpassed Intel in market cap, although not in chip market share. Headwinds and Challenges Under Dr. Lisa Su, AMD’s Ryzen and Epyc CPUs have propelled the company to profitability and market cap superiority over longtime rival Intel. Despite AMD’s phenomenal turnaround over the past decade, not everything has been smooth sailing and concern-free. Unlike Intel, AMD does not own manufacturing facilities in the US. Dr. Su’s reputation and ties to Taiwan have created a strong relationship with manufacturing facilities owned by Taiwan Semiconductor Manufacturing Co, (NYSE: TSM). While the relationship between AMD and TSMC remains robust, geopolitical tensions between Taiwan and China, whose CCP leadership continues to advocate for “reunification” with Taiwan, even if by military invasion, continues to be a supply chain risk factor. While AMD’s MI300 GPU is a viable competitor to Nvidia’s H100, industry publication Tom’s Hardware estimates that AMD’s new chips sell for just 25% of the price of Nvidia’s H100, despite their similar performance. This means less room for growth and lower margins. Additionally, Nvidia (NASDAQ: NVDA) isn’t standing still. In Q1, the company announced its new Blackwell platform, designed to train generative AI models at a fraction of the cost of its predecessor. Nvidia’s faster development cycle means that AMD may be stuck playing a game of catchup — putting further pressure on its pricing power, growth, and margins. US technology export restrictions require AMD, Nvidia, and other US chip makers to design lower-performance versions of their top products for export to China and the Middle East. Prior iterations from Q1 2024 were rejected by the Commerce Dept. as still being too powerful, and export licenses were withheld. The counterintuitive need to create a better device to market while simultaneously designing lower capabilities is proving to be a more delicate and difficult task than anticipated. Regardless, investors are much more concerned with future stock performance over the next 1, 5, to 10 years. While most Wall Street analysts will calculate 12-month forward projections, it’s clear that nobody has a consistent crystal ball, and plenty of unforeseen circumstances can render even near-term projections irrelevant. 24/7 Wall Street aims to present some further-looking insights based on AMD’s own numbers, along with business and market development information that may be of help to our readers’ own research. Key Points In This Article Lisa Su’s acquisitions of ZT Systems and various AI software companies are part of a comprehensive AI-focused strategy. The acquisition of ZT Systems, a cloud architecture solution provider, is a key building block of Lisa Su’s AI development strategy objective, which is to provide AI in end-to-end computing. AMD’s MI300 GPU and future models will continue to compete with Nvidia for the AI graphics market. AMD’s chip architecture for Ryzen and other products will expand for installation applications beyond gaming, such as automobiles, IoT, and others. The threat of a PRC military invasion of Taiwan is still a major semiconductor supply chain threat, as AMD, Nvidia, Apple, and other tech companies all rely on Taiwan Semiconductor for its manufacturing needs. If you’re looking for a megatrend with massive potential, make sure to grab a complimentary copy of our “The Next NVIDIA” report. This report breaks down AI stocks with 10x potential and will give you a huge leg up on profiting from this massive sea change. Advanced Micro Devices News and Updates 12/9/2024 Vivek Arya, an analyst with Bank of America, downgraded Advanced Micro Devices stock from “Buy” to “Neutral” and lowered its price target from $180 to $155. This downgrade follows Amazon’s executives reports of weak demand for AMD’s AI accelerators and led to a decline in AMD’s stock today. 12/6/2024 AMD’s stock price has gone down today. This decrease followed an Amazon executive’s report that the company hasn’t observed enough demand for AMD’s AI accelerators to warrant their sale through Amazon Web Services. 12/5/2024 Mizuho has lowered its price target for Advanced Micro Devices from $185 to $180, but still maintains a “Buy” rating on the stock. This revised target price suggests a potential upside of 26.64% from AMD’s current market price. 12/3/2024 Advanced Micro Devices stock declined 0.3% today, trading between $141.23 and $141.61. 11/27/2024 Advanced Micro Devices has solidified its commitment to Indian by inaugurating a new research and development center. This move aligns with the company’s previously announced $400 million investment in the country. 11/26/2024 Advanced Micro Devices is planning to acquire ZT Systems for $4.9 billion in a strategic move to bolster its position in the AI market and challenge Nvidia’s dominance. ZT Systems will bring expertise to AMD and encourage accelerated deployment of AI infrastructure at scale. 11/25/2024 Advanced Micro Devices is investing $400 million in India, highlighting the importance of its Bengaluru R&amp;D center to its global operations and India as a key market and vital hub for technological innovation and growth. 11/22/2024 Analysts at Zacks Research have increased their earnings estimates for Advanced Micro Devices from $2.37 to $2.47. Zacks Research also provided estimates for AMD’s earnings in the upcoming quarters and fiscal years. These estimates range from $0.81 per share in Q4 2024 to $4.63 per share in FY 2026. 11/21/2024 Advanced Micro Devices’ shares decreased 1.4% today, trading as low as $134.93. 11/20/2024 Advanced Micro Devices’ stock declined slightly by 1.1% today, trading as low as $137.06. 5-10 Year Review A huge part of AMD’s success has been the Damocles sword decision to have all foundry work performed by Taiwan Semiconductor. After stints at IBM and Texas Instruments, Dr. Lisa Su became COO of AMD, assuming the CEO position in 2014. Soon afterwards, she started her overhaul of the company by splitting it into 2 divisions: Computing and Graphics, which includes desktop and notebook processors and chipsets, discrete GPUs, and professional graphics; Enterprise, Embedded, and Semi-Custom, which includes server and embedded processors, dense servers, semi-custom SoC products (including solutions for gaming consoles), engineering services, and royalties. Dr. Su oversaw the release of the Radeon 300 and Fury series, the last of the Bulldozer derivatives, and then the RX 400 series of GPUs in 2016. Based on AMD’s Zen architecture, both Epyc for servers and workstations Ryzen for laptops and desktops debuted in 2017. They innovatively took multiple micro CPUs to work as a team for superior computing power and speed. Ryzen, in particular, took the computing world and Intel by surprise, as it catapulted AMD to previously uncharted levels. 2020 saw AMD announce the acquisition of Xilinx for its field programmable gate arrays (FPGA). AMD would discontinue Xilinx production of its complex programmable logic devices (CPLD) in early 2024. Pensando Systems was added to AMD’s portfolio in 2022, with Mipsology to follow in 2023. On the AI front, 2023 saw AMD acquire Nod.ai, followed by Silo.AI, Europe’s largest private AI Lab, in 2024. Fiscal Year (Dec) Price Revenues Net Income 2015 $2.87 $3.991 B -($660 M) 2016 $11.34 $4.319 B -($498 M) 2017 $10.28 $5.253 B -($33 M) 2018 $18.46 $6.475 B $337 M 2019 $45.86 $6.731 B $341 M 2020 $91.71 $9.763 B $2.490 B 2021 $143.90 $16.434 B $3.162 B 2022 $64.77 $23.601 B $1.320 B 2023 $147.41 $22.680 B $864 M 2024 LTM (Jun 2024) $$162.21 $23.276 B $$1.354 B Key Drivers for AMD’s Stock in the Future Lisa Su’s release of AMD’s MI300 GPU has thrown down the gauntlet for AI to her cousin, CEO Jensen Huang of Nvidia, which controls close to 70% of the AI GPU market at present. AMD’s MI300 GPU (Graphics Processing Units) and similar products are addressing AI workloads for cloud computing, which is stirring up interest. Microsoft (NASDAQ: MSFT) and Oracle (NASDAQ: ORCL) are already using the MI300. As a result, AMD is now on the radar alongside other AI related stocks. The ZT Systems acquisition for $4.9 billion is a key building block of Lisa Su’s AI development strategy. By integrating ZT’s expertise in data center infrastructure, AMD will be able to offer complete AI solutions, encompassing hardware, software, and system-level integration. Therefore, AMD will soon provide a one-stop, comprehensive and integrated offering to clients seeking robust AI solutions. Data Center growth (already $2.3 billion sector revenues for AMD in Q1, +80% y-o-y), should continue to expand that area for the near and extended future. AMD 3D V-Cache chips will be an integral contributor to AMD-powered data center equipment. Stock Price Prediction for 2025 The consensus rating from over 40 Wall Street analysts is “buy/outperform” (31 buy, 7 outperform, 10 hold). Their average price target in 12 months is $186.91, which is 42.53% from the price today. 24/7 Wall Street’s 12-month projection for AMD’s price is $205.20, which would be a 48.31% increase. We believe Dr. Su’s goal of end-to-end AI utility is already underway, with AMD competing with Nvidia in a similar fashion and strategy to how it challenged Intel: with comparable or superior speed and performance for lower prices. AMD’s Next 5 Years’ Outlook The past 10-year median P/E ratio for AMD is 34.27. 24/7 Wall Street is using a more conservative P/E ratio of 30 for the following price predictions. These prices also preclude an invasion of Taiwan from China, which would understandably devastate chip manufacturing worldwide. For 2026, we predict a price of $237.12, which would be a 15.56% gain year-over-year. AMD’s acquisition of ZT Systems will be a significant contributor to Dr. Su’s AI development agenda. She anticipates that the AI accelerator and GPU chip market will reach $400 billion by 2027. AMD’s Instinct and Epyc accelerators for machine learning will see a major boost in this surge. To follow up on the AI agenda, 2027 should benefit from ZT Systems’ software boost capabilities. During 2023-24, AMD invested more than $1 billion to improve its AI software capabilities and R&amp;D activities. AMD has already made three small software AI-related acquisitions (Silo AI, Nod.ai, and Mipsology) to bolster its mid- and high-level software abstractions and help customers customize LLMs. Dr. Su and Nvidia’s Jensen Huang are blood-relative cousins, and their respective competitive drives and tech savvy make the AMD and Nvidia rivalry in AI all the more compelling when the different components are compared head-to-head. The 24/7 Wall Street price target for 2027 is $294.40. This would be a 24.16% gain year-over-year. 2028 should see AMD get an upswing from its ancillary markets. For example, AMD’s Ryzen is already a big part of the digital cockpits in the automotive market. Its partnerships with Daimler-Benz and Tesla will likely expand to other auto manufacturers as AI becomes more ubiquitous and demand escalates. Our price target is $306, a modest year-over-year gain of 3.94%. Edge computing would be another ancillary market for AMD that would benefit from AI. 2029 should see a boost in IoT applications using AMD-powered devices and digital architecture. AMD’s Multi-Chip Modules (MCM) will continue to expand, with its Epyc Milan X, the first MCM GPU, leading the way for a range of other configurations. The resulting bump would be a target price of $336, a 9.80% gain from the previous year’s price target. AMD Stock in 2030 AMD’s development of end-to-end AI computing is Dr. Lisa Su’s primary goal over the next decade. At present, no smartphone utilizes any AMD CPUs. Nevertheless, AMD has already announced the availability of Ryzen chips for mobile devices. By 2030, the growth of AI-powered mobile gaming should reach the point where the demand for Ryzen performance in smartphones by game-oriented users should see Ryzen-powered smartphones. This would be a huge boon for AMD, as the smartphone market is a major one that has long eluded it. The 24/7 Wall Street 2030 price target is $396.20. Year EPS P/E multiple Price 2025 $6.84 30 $205.20 2026 $7.90 30 $237.12 2027 $9.81 30 $294.40 2028 $10.20 30 $306.00 2029 $11.20 30 $336.00 2030 $13.21 30 $396.20 Get Ready To Retire (Sponsored) Start by taking a quick retirement quiz from SmartAsset that will match you with up to 3 financial advisors that serve your area and beyond in 5 minutes, or less. Each advisor has been vetted by SmartAsset and is held to a fiduciary standard to act in your best interests. Here’s how it works: 1. Answer SmartAsset advisor match quiz 2. Review your pre-screened matches at your leisure. Check out the advisors’ profiles. 3. Speak with advisors at no cost to you. Have an introductory call on the phone or introduction in person and choose whom to work with in the future Get started right here. The post Advanced Micro Devices Inc. (AMD) Price Prediction and Forecast 2025-2030 appeared first on 24/7 Wall St..",https://247wallst.com/forecasts/2024/12/10/advanced-micro-devices-inc-amd-price-prediction-and-forecast/
ORCL,2024-12-11 03:27:41,"Dow and S&P 500 flat as markets await US inflation data; Alaska Air Group shares jump, while NVIDIA and Oracle slip",https://images.financialmodelingprep.com/news/dow-and-sp-500-flat-as-markets-await-us-20241211.jpg,invezz.com,"US equity averages were little changed on Tuesday as investors waited for the release of inflation data and further economic cues later this week.  At the time of writing, the Dow Jones Industrial Average was steady at 44,427.70 points, while the S&P 500 was at 6,053.44 points.",https://invezz.com/news/2024/12/11/dow-and-s-alaska-air-group-shares-jump-while-nvidia-and-oracle-slip/
ORCL,2024-12-11 03:16:22,"The Zacks Analyst Blog Alphabet, Oracle, Merck & Co, Canterbury Park and CompX International",https://images.financialmodelingprep.com/news/the-zacks-analyst-blog-alphabet-oracle-merck-co-canterbury-20241211.jpg,zacks.com,"Alphabet, Oracle, Merck & Co, Canterbury Park and CompX International are included in this Analyst Blog.",https://www.zacks.com/stock/news/2381841/the-zacks-analyst-blog-alphabet-oracle-merck-co-canterbury-park-and-compx-international?cid=CS-STOCKNEWSAPI-FT-press_releases-2381841
ORCL,2024-12-10 20:23:23,"Oracle and C3.ai both came into their earnings reports hot, says Jim Cramer",https://images.financialmodelingprep.com/news/oracle-and-c3ai-both-came-into-their-earnings-reports-20241210.jpg,youtube.com,'Mad Money' host Jim Cramer talks the tale of two AI companies with C3.ai and Oracle.,https://www.youtube.com/watch?v=rwO3Iwoynts
ORCL,2024-12-10 18:33:07,"Oracle Q2: Doubling CAPEX In FY 2025, Stock Remains A 'Sell'",https://images.financialmodelingprep.com/news/oracle-q2-doubling-capex-in-fy-2025-stock-remains-20241210.jpg,seekingalpha.com,"I reiterate a “Sell” rating for Oracle Corporation stock, citing overvaluation with a fair value of $155 per share despite strong cloud growth. Oracle's cloud services, particularly Oracle Cloud Infrastructure, saw robust growth, but high CAPEX spending will challenge free cash flow generation. Oracle forecasts 9%-11% revenue growth and 7%-9% EPS growth for Q3, with significant CAPEX increases anticipated for FY25.",https://seekingalpha.com/article/4743440-oracle-q2-doubling-capex-in-fy25-stock-remains-a-sell
ORCL,2024-12-10 17:01:58,Oracle's Earnings Fallout Offers Hidden Contrarian Opportunity,https://images.financialmodelingprep.com/news/oracles-earnings-fallout-offers-hidden-contrarian-opportunity-20241210.jpg,benzinga.com,Enterprise-software stalwart Oracle Corp ORCL suffered significant volatility during Monday's after-hours session following the release of disappointing financial results.,https://www.benzinga.com/news/earnings/earnings-misses/24/12/42425771/oracle-earnings-fallout-contrarian-opportunity
ORCL,2024-12-10 15:16:10,Oracle's growth story still intact despite 2Q misses: analysts,https://images.financialmodelingprep.com/news/oracles-growth-story-still-intact-despite-2q-misses-analysts-20241210.jpg,proactiveinvestors.com,"Oracle Corp (NYSE:ORCL, ETR:ORC) shares are down around 7.8% following the release of its fiscal second quarter 2025 earnings, as investors reacted to results that fell short of expectations and a cautious outlook for the coming quarter. The company reported earnings per share of $1.47, slightly below the anticipated $1.48, and revenue of $14.06 billion, missing the $14.12 billion forecast by analysts.",https://www.proactiveinvestors.com/companies/news/1062542
ORCL,2024-12-10 13:20:21,Oracle cloud business growing while other units shrink,https://images.financialmodelingprep.com/news/oracle-cloud-business-growing-while-other-units-shrink-20241210.jpg,youtube.com,Oracle (ORCL) shares continued to slide Tuesday morning after reporting a slight miss on its fiscal second quarter revenue — $14.06 billion vs. expectations of $14.12 billion — and adjusted earnings estimates — $1.47 per share vs.,https://www.youtube.com/watch?v=2VFaA22VM2w
ORCL,2024-12-10 12:50:13,"ORCL ""Still is Back"" After Earnings Plunge",https://images.financialmodelingprep.com/news/orcl-still-is-back-after-earnings-plunge-20241210.jpg,youtube.com,"Oracle (ORCL) was ""teed up to have a perfect quarter,"" according to Derrick Wood. He argues potential headwinds in its guidance sparked the sell-off.",https://www.youtube.com/watch?v=HzH5lNI1iwo
ORCL,2024-12-10 12:44:29,"Oracle Shares Down After Mixed Q2 Results Spark Analyst Caution, 'Guidance Fell Below Consensus'",https://images.financialmodelingprep.com/news/oracle-shares-down-after-mixed-q2-results-spark-analyst-20241210.jpg,benzinga.com,Oracle Corp ORCL shares tanked in early trading on Tuesday after the company reported downbeat fiscal second-quarter results.,https://www.benzinga.com/analyst-ratings/analyst-color/24/12/42420091/oracle-shares-down-after-mixed-q2-results-spark-analyst-caution-guidance-fell-below
ORCL,2024-12-10 12:31:11,Oracle shares head for worst day of 2024 after earnings miss,https://images.financialmodelingprep.com/news/oracle-shares-head-for-worst-day-of-2024-after-20241210.jpg,cnbc.com,Oracle shares had their steepest drop in a year on Tuesday following the company's disappointing earnings report. Oracle also issued a weaker-than-expected forecast.,https://www.cnbc.com/2024/12/10/oracle-shares-head-for-worst-day-of-2024-after-q2-earnings-miss.html
ORCL,2024-12-10 12:26:35,Dollar's rise causes 3% hit to Oracle's Q3 outlook,https://images.financialmodelingprep.com/news/dollars-rise-causes-3-hit-to-oracles-q3-outlook-20241210.jpg,youtube.com,CNBC's Seema Mody reports on the dollar's impact on earnings.,https://www.youtube.com/watch?v=bQVXhMzgzuM
