symbol,publishedDate,title,image,site,text,url
ORCL,2025-03-14 11:05:23,Oracle Launches AI Centre in Southeast Asia to Steer Competition,https://images.financialmodelingprep.com/news/oracle-launches-ai-centre-in-southeast-asia-to-steer-20250314.jpg,zacks.com,"ORCL's AI Centre can't hide missed earnings, falling license revenues, and fierce regional competition from AWS, Microsoft and Google.",https://www.zacks.com/stock/news/2430266/oracle-launches-ai-centre-in-southeast-asia-to-steer-competition?cid=CS-STOCKNEWSAPI-FT-analyst_blog|company_news_tech_sector-2430266
ORCL,2025-03-14 10:01:04,Oracle Corporation (ORCL) Is a Trending Stock: Facts to Know Before Betting on It,https://images.financialmodelingprep.com/news/oracle-corporation-orcl-is-a-trending-stock-facts-to-20250314.jpg,zacks.com,"Zacks.com users have recently been watching Oracle (ORCL) quite a bit. Thus, it is worth knowing the facts that could determine the stock's prospects.",https://www.zacks.com/stock/news/2430101/oracle-corporation-orcl-is-a-trending-stock-facts-to-know-before-betting-on-it?cid=CS-STOCKNEWSAPI-FT-tale_of_the_tape|most_searched_stocks-2430101
ORCL,2025-03-14 09:32:43,"Why Is Oracle Stock Falling, and Is It a Buying Opportunity?",https://images.financialmodelingprep.com/news/why-is-oracle-stock-falling-and-is-it-a-20250314.jpg,fool.com,"Oracle (ORCL -2.14%) reported quarterly results to stock market investors, who were dissatisfied with the performance.",https://www.fool.com/investing/2025/03/14/why-is-oracle-stock-falling-and-is-it-a-buying-opp/
ORCL,2025-03-14 08:46:20,"Market Momentum Shifts, But These 3 Stocks Are Built to Last",https://images.financialmodelingprep.com/news/market-momentum-shifts-but-these-3-stocks-are-built-20250314.jpg,marketbeat.com,Market momentum clearly shifted in late February as the S&P 500 NYSEARCA: SPY began to sell off. The shift is caused by increased uncertainty related to Trump's tariffs and policy changes and a growing risk of a recession.,https://www.marketbeat.com/stock-ideas/market-momentum-shifts-but-these-3-stocks-are-built-to-last/
ORCL,2025-03-14 00:42:23,"Oracle said to weigh data center in Indonesia's Batam Island, Bloomberg News reports",https://images.financialmodelingprep.com/news/oracle-said-to-weigh-data-center-in-indonesias-batam-20250314.jpg,reuters.com,"Oracle Corp is in discussions with Indonesia's government to establish a cloud services center in the country's Batam Island, Bloomberg News reported on Friday, citing people familiar with the matter.",https://www.reuters.com/technology/oracle-said-weigh-data-center-indonesias-batam-island-bloomberg-news-reports-2025-03-14/
ORCL,2025-03-13 15:55:07,Oracle is reportedly a top choice for helping run TikTok,https://images.financialmodelingprep.com/news/oracle-is-reportedly-a-top-choice-for-helping-run-20250313.jpg,techcrunch.com,"TikTok has until April to finalize a sale to a U.S.-based buyer, yet uncertainties about the future of the short-form video app remain.",https://techcrunch.com/2025/03/13/oracle-is-reportedly-a-top-choice-for-storing-u-s-tiktok-user-data/
ORCL,2025-03-13 14:20:02,Larry Ellison's Oracle is ‘leading contender to help run TikTok' in possible sale: report,https://images.financialmodelingprep.com/news/larry-ellisons-oracle-is-leading-contender-to-help-run-20250313.jpg,nypost.com,Tech billionaire Larry Ellison's Oracle is reportedly a “leading contender to help run TikTok” as the Trump administration works to secure a sale that would avoid a complete ban of the China-owned app.,https://nypost.com/2025/03/13/business/larry-ellisons-oracle-is-leading-contender-to-help-run-tiktok-in-potential-sale-report/
ORCL,2025-03-13 10:16:09,International Markets and Oracle (ORCL): A Deep Dive for Investors,https://images.financialmodelingprep.com/news/international-markets-and-oracle-orcl-a-deep-dive-for-investors-20250313.jpg,zacks.com,Explore Oracle's (ORCL) international revenue trends and how these numbers impact Wall Street's forecasts and what's ahead for the stock.,https://www.zacks.com/stock/news/2429554/international-markets-and-oracle-orcl-a-deep-dive-for-investors?cid=CS-STOCKNEWSAPI-FT-fundamental_analysis|nfm_international_revenues-2429554
ORCL,2025-03-13 09:48:03,"Super Micro Computer Has High Hopes But Analysts Aren't Convinced, Buy The Skepticism",https://images.financialmodelingprep.com/news/super-micro-computer-has-high-hopes-but-analysts-arent-20250313.jpg,seekingalpha.com,"SMCI is poised for growth with new data center capacity and AI initiatives. Oracle's recent q3'25 earnings confirmed strong demand for cloud services with its backlog growing to $130b. Though consensus estimates suggest skepticism across the analyst community, Oracle's guidance may support management's $40b revenue guidance for eFY26. Customers may ramp up the transition to Blackwell GPUs in q3'25 following, pushing SMCI to ramp-up production to meet customer demand following a significant decline in inventory levels.",https://seekingalpha.com/article/4767206-super-micro-computer-has-high-hopes-but-analysts-arent-convinced-buy-the-skepticism
ORCL,2025-03-13 09:44:15,"TSLA, PLTR and ORCL Forecast – Major NASDAQ Stocks Mixed Early Thursday",https://images.financialmodelingprep.com/news/tsla-pltr-and-orcl-forecast-major-nasdaq-stocks-mixed-20250313.jpg,fxempire.com,"There are three major NASDAQ stocks that I am watching in the early hours of Thursday, as we are trying to claw back some of the losses that have been in found in some of the world's most favorite stocks.",https://www.fxempire.com/forecasts/article/tsla-pltr-and-orcl-forecast-major-nasdaq-stocks-mixed-early-thursday-1504107
ORCL,2025-03-13 08:53:56,Oracle: Durable Growth Can Deliver Good Returns,https://images.financialmodelingprep.com/news/oracle-durable-growth-can-deliver-good-returns-20250313.jpg,seekingalpha.com,"Oracle's Q3 FY2025 results show strong revenue growth, with cloud services up 10% y/y and total revenue up 6% y/y to $14.1 bn. Despite negative FCF, Oracle increased its dividend and executed $150 million in share buybacks, indicating confidence in future cash flow improvements. Oracle's RPO surged to $130 bn, a 63% y/y increase, driven by demand and excluding contributions from Project Stargate.",https://seekingalpha.com/article/4767180-oracle-durable-growth-can-deliver-good-returns
ORCL,2025-03-13 08:30:00,Oracle Red Bull Racing Doubles Down on Oracle Cloud and AI to Drive Performance for 2025 Season and Beyond,https://images.financialmodelingprep.com/news/oracle-red-bull-racing-doubles-down-on-oracle-cloud-20250313.jpg,prnewswire.com,"Brings Oracle AI to the pit wall to increase efficiency of sporting regulation reviews Standardizes on Oracle Virtualization from the factory to the track to increase flexibility, streamline IT infrastructure, and simplify training  AUSTIN, Texas and MILTON KEYNES, England , March 13, 2025 /PRNewswire/ -- Oracle Red Bull Racing, the multiple championship winning Formula One team, is expanding its use of Oracle Cloud and AI technologies on and off the track as the team kicks off the 2025 Formula One (F1) season. ""Since the start of our partnership, Oracle has given us a technical advantage that has helped us win races, championships, and fans,"" said Christian Horner, CEO and Team Principal, Oracle Red Bull Racing.",https://www.prnewswire.com/news-releases/oracle-red-bull-racing-doubles-down-on-oracle-cloud-and-ai-to-drive-performance-for-2025-season-and-beyond-302400546.html
ORCL,2025-03-13 07:44:54,Oracle: Continues To Achieve Remarkable Growth Even Without Pulling The Stargate Lever,https://images.financialmodelingprep.com/news/oracle-continues-to-achieve-remarkable-growth-even-without-pulling-20250313.jpg,seekingalpha.com,"Oracle's Q3 results missed both revenue and EPS estimates, but strong RPO growth and OCI demand indicate robust long-term potential, even without Stargate contracts. Management's FY26 and FY27 revenue growth targets are 15% and 20%, respectively, supported by easing capacity constraints and efficient Capex management. Oracle's partnerships with hyperscalers and cybersecurity firms remain strong, and the company's disciplined expense management enhances its growth outlook.",https://seekingalpha.com/article/4767161-oracle-continues-to-achieve-remarkable-growth-even-without-pulling-the-stargate-lever
ORCL,2025-03-12 21:00:00,Oracle Brings AI Agents to the Fight Against Financial Crime,https://images.financialmodelingprep.com/news/oracle-brings-ai-agents-to-the-fight-against-financial-20250312.jpg,prnewswire.com,"New agentic AI capabilities in Oracle Investigation Hub can reduce manual work to help uncover and thwart financial schemes faster AUSTIN, Texas , March 12, 2025 /PRNewswire/ -- Oracle Financial Services is supercharging its Investigation Hub Cloud Service with the addition of a broad class of AI agents and agentic workflows that enable financial firms to automate investigative processes needed to uncover complex patterns and fight financial crime. The agents help improve the overall quality and speed of reviewing suspicious activity by using generative AI-driven narratives to supplement investigators' own analysis.",https://www.prnewswire.com/news-releases/oracle-brings-ai-agents-to-the-fight-against-financial-crime-302399584.html
ORCL,2025-03-12 13:48:40,Waiting For Stargate Liftoff: Oracle Eyes Megaproject To Restart Stock Rally,https://images.financialmodelingprep.com/news/waiting-for-stargate-liftoff-oracle-eyes-megaproject-to-restart-20250312.jpg,investors.com,The massive Stargate project is capturing attention and dividing investors. The post Waiting For Stargate Liftoff: Oracle Eyes Megaproject To Restart Stock Rally appeared first on Investor's Business Daily.,https://www.investors.com/news/technology/oracle-stock-ai-stargate-cloud-openai/
ORCL,2025-03-12 11:15:43,Oracle Earnings Review: Strong Guidance With AGI,https://images.financialmodelingprep.com/news/oracle-earnings-review-strong-guidance-with-agi-20250312.jpg,seekingalpha.com,"Oracle's AI Cloud demand is surging, presenting huge potential for long-term growth, despite a recent 16% drop in share price. Oracle's Q3 earnings showed minor EPS and revenue misses, but strong cloud revenue growth and promising future guidance reinforce my bullish stance. Valuation metrics suggest Oracle is undervalued; I believe shares should trade at a 20% premium to the sector median forward P/E ratio.",https://seekingalpha.com/article/4766855-oracle-earnings-review-strong-guidance-with-agi
ORCL,2025-03-12 09:10:26,"Oracle Trips on Q3 Earnings & Sales Miss: Buy, Sell or Hold the Stock?",https://images.financialmodelingprep.com/news/oracle-trips-on-q3-earnings-sales-miss-buy-sell-20250312.jpg,zacks.com,ORCL's missed Q3 targets expose an overvalued tech giant with slowing growth. Sell the stock now before the premium multiple collapses.,https://www.zacks.com/stock/news/2428867/oracle-trips-on-q3-earnings-sales-miss-buy-sell-or-hold-the-stock?cid=CS-STOCKNEWSAPI-FT-analyst_blog|most_popular_stocks-2428867
ORCL,2025-03-12 08:00:00,Oracle Just Shared Some Amazing News for the Entire Artificial Intelligence (AI) Industry,https://images.financialmodelingprep.com/news/oracle-just-shared-some-amazing-news-for-the-entire-20250312.jpg,fool.com,"In this video, I will cover Oracle's (ORCL -3.10%) earnings report and management's comments during the earnings call. Watch the short video to learn more, consider subscribing, and click the special offer link below.",https://www.fool.com/investing/2025/03/12/oracle-just-shared-some-amazing-news-for-the-entir/
ORCL,2025-03-12 07:58:45,Oracle Earnings: Fast-Approaching Buy Territory (But Not Yet),https://images.financialmodelingprep.com/news/oracle-earnings-fastapproaching-buy-territory-but-not-yet-20250312.jpg,seekingalpha.com,"The share price reaction to Oracle's recent quarterly results is quite telling about investors' overly optimistic expectations. There were some very important takeaways from the earnings announcement, and the stock is fast approaching buy territory. In light of the ongoing risk-off trade, I prefer to take a more cautious approach, and I retain my Hold rating (for now).",https://seekingalpha.com/article/4766794-oracle-earnings-fast-approaching-buy-territory-but-not-yet
ORCL,2025-03-11 15:44:30,Why Oracle Stock Is Sinking Today,https://images.financialmodelingprep.com/news/why-oracle-stock-is-sinking-today-20250311.jpg,fool.com,Shares of Oracle (ORCL -3.02%) are sliding on Tuesday. The stock lost 3.2% as of 2:45 p.m.,https://www.fool.com/investing/2025/03/11/why-oracle-stock-is-sinking-today/
ORCL,2025-03-11 14:33:32,Oracle: AI Growth Has Yet To Begin,https://images.financialmodelingprep.com/news/oracle-ai-growth-has-yet-to-begin-20250311.jpg,seekingalpha.com,"Oracle Corporation's RPO grew to $130B, signaling strong revenue growth through conversion in the coming years as data center capacity is built out. Oracle's cloud infrastructure and AI capabilities, including partnerships with Microsoft, Google, and AWS, are key growth drivers, with significant revenue potential from cloud database migrations. ORCL shares' valuation decline offers investors a buying opportunity. Recommend averaging into a position, with share prices potentially bottoming at $130/share.",https://seekingalpha.com/article/4766597-oracle-ai-growth-has-yet-to-begin
ORCL,2025-03-11 13:05:58,"Oracle earnings miss on profit, revenue, cloud sales",https://images.financialmodelingprep.com/news/oracle-earnings-miss-on-profit-revenue-cloud-sales-20250311.jpg,youtube.com,"Oracle (ORCL) reported third quarter earnings that missed on the top and bottom lines. Adjusted earnings per share (EPS) was $1.47 for the quarter, lower than estimates of $1.49, while adjusted revenue was $14.13 billion, below the $14.39 billion Wall Street expected.",https://www.youtube.com/watch?v=Q8S1fiGjxM8
ORCL,2025-03-11 13:05:49,Analyst updates Oracle (ORCL) stock price targets after earnings,https://images.financialmodelingprep.com/news/analyst-updates-oracle-orcl-stock-price-targets-after-earnings-20250311.jpg,finbold.com,"Oracle Corporation (NYSE: ORCL) saw its stock decline over 3% on March 11, trading at $143.21 at press time, after the company's third-quarter earnings for Fiscal Year 2025 fell short of analyst expectations.",https://finbold.com/analyst-updates-oracle-orcl-stock-price-targets-after-earnings/
ORCL,2025-03-11 12:50:48,"Oracle's Q3 Falls Short, But AI Demand Keep Long-Term Outlook Strong Say Analysts",https://images.financialmodelingprep.com/news/oracles-q3-falls-short-but-ai-demand-keep-longterm-20250311.jpg,benzinga.com,"Oracle Corp ORCL shares are down on Tuesday, after the company reported downbeat fiscal third-quarter results.",https://www.benzinga.com/news/earnings/earnings-misses/25/03/44255998/oracles-q3-falls-short-but-ai-demand-keep-long-term-outlook-strong-say-analysts
ORCL,2025-03-11 12:35:00,Oracle won some big cloud contracts. Here's why its stock is falling.,https://images.financialmodelingprep.com/news/oracle-won-some-big-cloud-contracts-heres-why-its-stock-20250311.jpg,marketwatch.com,"Oracle Corp. regaled Wall Street on Monday with talk about the future, enormous demand and some very large cloud-services contracts, but its stock continued a downward trend over concerns about growing costs associated with building out more data centers.",https://www.marketwatch.com/story/oracle-won-some-big-cloud-contracts-heres-why-its-stock-is-falling-ec29af53
ORCL,2025-03-11 11:28:01,Oracle Stock: 5 Reasons This AI Powerhouse Is a Long-Term Buy,https://images.financialmodelingprep.com/news/oracle-stock-5-reasons-this-ai-powerhouse-is-a-20250311.jpg,marketbeat.com,Oracle's NYSE: ORCL CQ1 2025 price correction is an opportunity for investors because the market is resetting its outlook and not reversing. The market reset is due to the timing of AI's tremendous impact on Oracle.,https://www.marketbeat.com/originals/oracle-stock-5-reasons-this-ai-powerhouse-is-a-long-term-buy/
ORCL,2025-03-11 10:30:22,"ORCL Sells After Earnings, KSS 52-Week Low, LEN Downgrade",https://images.financialmodelingprep.com/news/orcl-sells-after-earnings-kss-52week-low-len-downgrade-20250311.jpg,youtube.com,Oracle (ORCL) opened lower today despite an initial jump following Monday's after-hour earnings. Diane King Hall dives into the report and shows the numbers that may be troubling investors.,https://www.youtube.com/watch?v=glOxatzJLbQ
ORCL,2025-03-11 09:19:08,Oracle and OpenAI Drop Surprising News to Nvidia Stock Investors,https://images.financialmodelingprep.com/news/oracle-and-openai-drop-surprising-news-to-nvidia-stock-20250311.jpg,fool.com,"In today's video, I discuss recent updates affecting Nvidia (NVDA -5.07%). To learn more, check out the short video, consider subscribing, and click the special offer link below.",https://www.fool.com/investing/2025/03/11/oracle-and-openai-drop-surprising-news-to-nvidia-s/
ORCL,2025-03-11 09:00:00,Oracle: Don't Be Paralyzed By Fear As The Opportunity Knocks,https://images.financialmodelingprep.com/news/oracle-dont-be-paralyzed-by-fear-as-the-opportunity-20250311.jpg,seekingalpha.com,"Oracle investors have endured intense downside recently, as investors reacted to fears of an economic recession. Yet, Oracle's earnings outlook suggests continued growth cadence through FY2027, downplaying the skepticism. Trump's policy whiplash could intensify the downside, but don't simply count out the opportunities for downstream AI adoption.",https://seekingalpha.com/article/4766447-oracle-dont-be-paralyzed-by-fear-as-the-opportunity-knocks
ORCL,2025-03-11 06:47:29,"Dow Jones sinks 800+ points, Oracle Q3 earnings and revenue miss expectations",https://images.financialmodelingprep.com/news/dow-jones-sinks-800-points-oracle-q3-earnings-and-20250311.jpg,youtube.com,"Yahoo Finance's Julie Hyman and Jared Blikre analyze the close of the major averages amid recession fears, tariff uncertainty, and volatility. Next, Wealth Alliance CEO Rob Conzo discusses investor concerns, tariffs, government layoffs, market volatility and opportunities for investors.",https://www.youtube.com/watch?v=7ai_fYENxQM
ORCL,2025-03-11 05:34:00,Is Oracle Stock a Buy?,https://images.financialmodelingprep.com/news/is-oracle-stock-a-buy-20250311.jpg,fool.com,"Oracle (ORCL -4.11%) is often considered a slow-growth tech giant, but its stock has still rallied more than 260% over the past 10 years. The database software leader impressed investors by expanding its cloud-based services, making smart acquisitions, and repatriating a lot of its overseas cash to repurchase more than a third of its shares.",https://www.fool.com/investing/2025/03/11/is-oracle-stock-a-buy/
ORCL,2025-03-10 19:47:34,Oracle Corporation (ORCL) Q3 2025 Earnings Call Transcript,https://images.financialmodelingprep.com/news/oracle-corporation-orcl-q3-2025-earnings-call-transcript-20250310.jpg,seekingalpha.com,"Oracle Corporation (NYSE:ORCL ) Q3 2025 Earnings Conference Call March 10, 2025 5:00 PM ET Company Participants Ken Bond - Head, IR Safra Catz - CEO Lawrence Ellison - Chairman and CTO Conference Call Participants Brad Zelnick - Deutsche Bank Derrick Wood - TD Cowen Alex Zukin - Wolfe Research John DiFucci - Guggenheim Securities Kirk Materne - Evercore ISI Mark Moerdler - Bernstein Research Operator Ladies and gentlemen, thank you for standing by. My name is Abby I will be your conference operator today.",https://seekingalpha.com/article/4766310-oracle-corporation-orcl-q3-2025-earnings-call-transcript
ORCL,2025-03-10 18:16:06,Oracle (ORCL) Q3 Earnings and Revenues Miss Estimates,https://images.financialmodelingprep.com/news/oracle-orcl-q3-earnings-and-revenues-miss-estimates-20250310.jpg,zacks.com,"Oracle (ORCL) came out with quarterly earnings of $1.47 per share, missing the Zacks Consensus Estimate of $1.48 per share. This compares to earnings of $1.41 per share a year ago.",https://www.zacks.com/stock/news/2427970/oracle-orcl-q3-earnings-and-revenues-miss-estimates?cid=CS-STOCKNEWSAPI-FT-tale_of_the_tape|yseop_template_4-2427970
ORCL,2025-03-10 17:30:54,Oracle's Sales Miss Estimates. Its CEO Expects AI-Driven Growth.,https://images.financialmodelingprep.com/news/oracles-sales-miss-estimates-its-ceo-expects-aidriven-growth-20250310.jpg,investopedia.com,"Oracle (ORCL) reported fiscal third-quarter sales that missed analysts' expectations, but executives said they expect AI-driven growth in the coming fiscal year.",https://www.investopedia.com/oracle-earnings-q3-fy2025-11694091
ORCL,2025-03-10 17:19:57,"Oracle Stock Rises Despite Earnings Miss As Tech Giant Touts AI Demand, Stargate Opportunity",https://images.financialmodelingprep.com/news/oracle-stock-rises-despite-earnings-miss-as-tech-giant-20250310.jpg,investors.com,"Oracle stock gained despite an earning miss as the tech giant touted AI demand and gave a strong sales outlook. The post Oracle Stock Rises Despite Earnings Miss As Tech Giant Touts AI Demand, Stargate Opportunity appeared first on Investor's Business Daily.",https://www.investors.com/news/technology/oracle-stock-earnings-february-2025-orcl-news/
ORCL,2025-03-10 17:10:07,Oracle Q3 Cloud Revenue Surges 23%,https://images.financialmodelingprep.com/news/oracle-q3-cloud-revenue-surges-23-20250310.jpg,fool.com,"Database software and cloud services specialist Oracle (ORCL -4.11%) reported fiscal 2025 third-quarter financial results on Monday, March 10, that fell short of analysts' consensus expectations. With an adjusted EPS of $1.47 and revenue of $14.13 billion, both figures were slightly below estimates of $1.49 and $14.38 billion, respectively.",https://www.fool.com/data-news/2025/03/10/oracle-cloud-revenue-surges-23/
ORCL,2025-03-10 17:08:00,"Oracle Revenue Rises, Sees Further Growth Ahead",https://images.financialmodelingprep.com/news/oracle-revenue-rises-sees-further-growth-ahead-20250310.jpg,wsj.com,"The cloud-software provider's results missed Wall Street's expectations, but shares rose in after-hours trading as the company expects further growth ahead.",https://www.wsj.com/tech/oracle-quarterly-revenue-rises-sees-further-growth-ahead-09dfa7e8
ORCL,2025-03-10 17:04:58,"GOOGL Antitrust Woes, AAPL A.I. Delay, ORCL Earnings",https://images.financialmodelingprep.com/news/googl-antitrust-woes-aapl-ai-delay-orcl-earnings-20250310.jpg,youtube.com,"Last week's sea of red poured into markets to start this trading week. The Mag 7 leaders are responsible for a lot of the weakness due to Alphabet's (GOOGL) antitrust woes, while Apple (AAPL) pushed back A.I.",https://www.youtube.com/watch?v=vpxU17WjHwE
ORCL,2025-03-10 16:50:00,"Oracle shares gain as investors focus on cloud deals, overlooking quarterly revenue miss",https://images.financialmodelingprep.com/news/oracle-shares-gain-as-investors-focus-on-cloud-deals-20250310.jpg,marketwatch.com,"Oracle Corp. shares were up in after-hours trading Monday, as investors appeared to initially overlook the software giant's disappointing quarterly revenue, much of it from a cloud-services miss, and instead focused on the large number of big cloud-computing contracts in the future.",https://www.marketwatch.com/story/oracle-shares-gain-as-investors-focus-on-cloud-deals-overlooking-quarterly-revenue-miss-0d88e168
ORCL,2025-03-10 16:46:26,"Oracle misses on quarterly results, raises dividend by 25%",https://images.financialmodelingprep.com/news/oracle-misses-on-quarterly-results-raises-dividend-by-25-20250310.jpg,youtube.com,CNBCs Seema Mody joins 'Closing Bell Overtime' to talk Oracle results.,https://www.youtube.com/watch?v=DQy3mFXbC2E
ORCL,2025-03-10 16:42:24,Oracle misses on earnings but touts data center growth from AI,https://images.financialmodelingprep.com/news/oracle-misses-on-earnings-but-touts-data-center-growth-20250310.jpg,cnbc.com,Oracle's fiscal third-quarter results missed analysts' expectations. The company's cloud infrastructure segment has been booming due to demand for computing power that can support artificial intelligence projects.,https://www.cnbc.com/2025/03/10/oracle-orcl-q3-earnings-report-2025.html
ORCL,2025-03-10 16:33:49,Oracle quarterly earnings fall short of estimates,https://images.financialmodelingprep.com/news/oracle-quarterly-earnings-fall-short-of-estimates-20250310.jpg,proactiveinvestors.com,"Oracle Corp (NYSE:ORCL, ETR:ORC) shares rallied afterhours despite the multinational software firm's quarterly earnings falling short of Wall Street expectations.   Shares of Oracle added 3.3% at about $154, after finishing Monday's session down 4.1% amid a broader selloff.",https://www.proactiveinvestors.com/companies/news/1067673
ORCL,2025-03-10 16:31:53,EARNINGS ALERT: ORCL,https://images.financialmodelingprep.com/news/earnings-alert-orcl-20250310.jpg,youtube.com,Kevin Green and Caroline Woods react to Monday's market selling before turning their attention to Oracle (ORCL) earnings. The company reported mixed earnings but increased its dividend from $0.40 to $0.50 per share.,https://www.youtube.com/watch?v=UxtHlyyPRag
ORCL,2025-03-10 16:09:30,Oracle misses third quarter revenue estimates,https://images.financialmodelingprep.com/news/oracle-misses-third-quarter-revenue-estimates-20250310.jpg,reuters.com,"Oracle missed Wall Street expectations for third-quarter revenue on Monday, weighed down by softer enterprise spending on its cloud infrastructure services, and strong competition from larger players.",https://www.reuters.com/technology/oracle-misses-third-quarter-revenue-estimates-2025-03-10/
